doi,is_relevant,journal,explanation,topic_words,authors,title,abstract
10.1016/j.atmosenv.2024.120813,True,Atmospheric Environment,该研究主要关注大气颗粒物数量大小分布（PNSD）的建模和应用。研究人员使用多对数正态分布模型来模拟PNSD，并将其与来自不同环境（农村、城市、山区和极地）的观测数据进行比较。研究结果表明，该模型能够有效地捕捉到成核模式和艾特肯模式颗粒的关键特征，但存在高估颗粒物总浓度的趋势。研究还探讨了该模型在不同时间尺度和特定粒径范围内的局限性，并强调了改进气候模型中PNSD模拟的必要性。,"['air quality', 'particle size distribution', 'atmospheric particles', 'multi-lognormal distribution', 'monitoring', 'satellite observations', 'climate models', 'aerosol behavior']",Ke Zhu;Lina Wang,A comprehensive study on the validation and application of multi-lognormal distribution models for atmospheric particles,"•The multi-lognormal distribution model overestimates particle concentrations compared to actual values, by around 1.09 times. •The multi-lognormal distribution model effectively fits various particle modes and determines the particle size range. •In bimodal distributions, particle number concentrations tend to be higher, particularly for smaller particles. •The multi-lognormal distribution model exhibits high accuracy in analyzing large time scales and cyclic variations. •When dealing with finer time scales and specific particle sizes such as NPF, careful interpretation of the model's results is warranted. 
 The particle number size distribution (PNSD) is crucial for evaluating air quality and mitigating environmental pollution, as particles of different sizes have diverse effects on human health and climate. However, obtaining a comprehensive understanding of PNSD is challenging due to its inherent complexities and variability. Multi-lognormal distribution models are employed to fit PNSD, as seen in climate models, but discrepancies between model fits and observed PNSD persist. This study adopts hourly data from 2017 to 2020 across eight monitoring sites in diverse environments—rural, urban, mountainous, and polar, and compares the observed PNDS with those simulated by multi-lognormal distribution models. The results demonstrated that the model generally achieved a high correlation with observed PNSD data (r2 > 0.75), effectively capturing key characteristics of nucleation and Aitken mode particles. However, the model had a tendency to overestimate the total number concentration by approximately 1.09 times, particularly noticeable under conditions of high concentrations of smaller particles. The model successfully represented prevalent bimodal size distribution patterns in urban areas with high ultrafine particle concentrations, though its performance was slightly less accurate in scenarios involving trimodal distributions. Despite these strong correlations and the model's ability to reflect diurnal and seasonal variations, which suggests its broad applicability and utility, there were notable limitations on smaller time scales and in specific particle size ranges. These limitations were particularly evident in capturing detailed phenomena relevant to new particle formation events, indicating areas where model refinement is necessary. The results highlighted the importance of investigating discrepancies between model predictions and actual observations, which is crucial for refining climate models that utilize PNDS. The uniform comparison facilitated a detailed exploration of particle properties from model results, offering deeper insights into aerosol behavior and its environmental impacts."
None,False,Atmospheric Environment,由于没有提供论文标题和摘要，无法判断其是否与大气环境遥感技术相关。请提供论文标题和摘要以便进行分析。,[],,Editorial Board,
10.1016/j.atmosres.2024.107697,False,Atmospheric Research,该研究探讨了飓风迈克尔对飓风莱斯利轨迹可预测性的影响，使用了ECMWF和NCEP集合系统。研究利用聚类方法识别莱斯利轨迹的潜在路径，并分析了上层位势涡度和无旋风对飓风轨迹的影响。研究发现，迈克尔对莱斯利轨迹的影响主要体现在对急流配置的改变，进而影响了莱斯利的运动方向。该研究主要关注的是飓风之间的相互作用，以及对飓风轨迹预测的影响，与大气环境遥感技术关系不大。,"['tropical cyclone', 'hurricane', 'track prediction', 'ensemble prediction system', 'ECMWF', 'NCEP', 'potential vorticity', 'irrotational wind', 'jet stream', 'ridge', 'trough', 'Azores anticyclone', 'synoptic Rossby wave flow']",M. López-Reyes;J.J. Gónzalez-Alemán;C. Calvo-Sancho;P. Bolgiani;M. Sastre;M.L. Martín,Remote Interactions between tropical cyclones: The case of Hurricane Michael and Leslie's high predictability uncertainty,"•Ensemble prediction systems to gauge uncertainty in highly impactful meteorological events. •Impact of Hurricane Michael's upstream conditions on the forecast uncertainty of Hurricane Leslie's track. •Application of clustering techniques to discern factors contributing to varied behaviors in meteorological events. 
 The study explores Hurricane Michael's impact on Hurricane Leslie's trajectory predictability using ECMWF and NCEP ensemble systems. A clustering method focused on tropical cyclones is used to identify potential paths for Leslie: Cluster 1 accurately predicted Leslie's direction towards the Iberian Peninsula, whereas Clusters 2 and 3 indicated a southern recurve near the Canary Islands. Analysis of potential vorticity and irrotational wind at upper levels showed a significant interaction between Michael, ridge, and trough across the jet stream from +12 h after initialization. Cluster 1 showed a stronger Michael promoting upper-level wind divergence greatest, modifying the jet stream configuration around the ridge and downstream. Alterations in the jet stream's configuration, functioning as a waveguide, propagated downstream, guiding Leslie towards the Iberian Peninsula. Clusters 2 and 3 indicated the trough's failure to incorporate Leslie, resulting in a recurve of the trajectory around the Azores anticyclone. This research enhances comprehension of the interaction between two tropical cyclones via synoptic Rossby wave flow. Moreover, the conceptual framework can aid operational meteorologists in identifying the sources of uncertainty, particularly in track forecasts under synoptic conditions analogous to those examined in this study."
10.1016/j.atmosres.2024.107659,False,Atmospheric Research,这篇研究论文主要关注的是 WRF/Noah-MP 地区气候模型中雪深和地表气温的敏感性分析。研究通过对模型参数进行调整，以减少模型对雪深和气温的模拟偏差。研究中使用了 ERA5 再分析数据和地面观测数据来评估模型性能。该研究与大气环境遥感技术关系不大，主要侧重于数值模拟和气候模型的改进。,"['snow depth', 'surface air temperature', 'WRF/Noah-MP model', 'regional climate model', 'ERA5 reanalysis']",Ákos János Varga;Hajnalka Breuer,Sensitivity analysis of snow depth and surface air temperature to various WRF/Noah-MP model configurations in Central Europe,"•Certain physics schemes greatly reduce snow depth overestimation in the WRF/Noah-MP regional climate model. •Temperature underestimation in the cold season decreases but is not completely alleviated. •WRF/Noah-MP parameterization options that enhance snow-related model performance in low-elevation regions are identified. 
 This study addresses snow depth overestimation and temperature underestimation in the WRF/Noah-MP regional climate model by producing eight sensitivity simulations at a 10 km grid spacing for the 2001–2006 period, driven by the ERA5 reanalysis. The experiments differ either in the parameterization of snow-related processes within the Noah-MP land surface model, the physical parameterization schemes of the atmospheric model (planetary boundary layer, surface layer, microphysics), or the WRF model version (v4.2 or v4.3, with the latter incorporating snow-related code enhancements). The best-performing configuration is further tested by conducting a hindcast simulation spanning an extended climatological period (1985–2010). The study area includes parts of Western, Central, and Eastern Europe, focusing on the Carpathian Basin. Snow depth is evaluated using in situ observations from low-elevation stations and ERA5 reanalysis data. Temperature and precipitation biases are assessed using the CARPATCLIM dataset, consisting of gridded surface meteorological observations. With the appropriate choice of physical parameterizations in the WRF/Noah-MP model, the median snow depth bias is reduced from 3.4 cm/day to 0.7 cm/day across all stations during the 2001–2006 period (November to March), with a corresponding decrease in RMSE from 8.4 to 3.9 cm/day and an increase in the correlation coefficient from 0.68 to 0.82. Concurrently, the underestimation of average daily minimum temperatures decreases from 2.5 °C to 1.6 °C over a plain subregion within the Carpathian Basin. Further efforts are required to eliminate the cold bias above snow cover in the WRF/Noah-MP model. The results suggest that exploring sensitivities to physical processes within the land surface scheme is equally important as testing different physical parameterizations in the atmospheric model itself."
10.1016/j.atmosres.2024.107695,False,Atmospheric Research,这篇论文主要研究了北京-天津-河北城市群夏季极端降水事件的加剧趋势，分析了城市化、东亚夏季风和西太平洋副热带高压的变化对极端降水的影响。论文没有涉及大气环境遥感技术，例如空气质量监测、卫星观测或大气成分分析。,"['precipitation', 'extreme precipitation', 'urbanization', 'monsoon', 'subtropical high', 'climate change']",Yujie Wang;Haoyu Wang;Lianchun Song,"Amplified precipitation extremes since 21st century in the Beijing-Tianjin-Hebei urban agglomeration, China","•Precipitation extremes in summer over the Beijing-Tianjin-Hebei urban agglomeration significantly amplified since 21st century. •Urbanization contribution to the increased extreme precipitation indices on average is estimated by 21 %. •The strengthened East Asian Summer Monsoon, intensified and northward extended West Pacific Subtropical High may increase precipitation extremes. 
 The Beijing-Tianjin-Hebei urban agglomeration(BTH) has successively witnessed the extraordinary precipitation extremes (PEs) with huge economic losses and death-toll in the recent decade. To timely and comprehensively understand the PEs in the urban agglomeration, we investigate the characteristic and mechanism of PEs variation based on six extreme precipitation indices (EPIs) including maximum daily precipitation(Rx1day), maximum consecutive 5-day precipitation(Rx5day), total precipitation with daily precipitation more than the 95th percentile (R95P), average daily precipitation on wet days (SDII), heavy precipitation days(R25) and very heavy precipitation days(R50). Our results suggest that the PEs of summertime over the BTH has significantly amplified since 21st century. During 2001–2023, the Rx1day, Rx5day, R95p, SDII, R25 and R50 significantly increased at a rate of 13.5 mm/10a, 26.3 mm/10a, 49.4 mm/10a, 2.2 mm/10a, 0.78d/10a and 0.46d/10a, respectively. The average contribution of urbanization to the increased EPIs is estimated by 21 %. The strengthened East Asian Summer Monsoon, intensified and northward extended West Pacific Subtropical High may increase occurrence and severity of PEs in the era of rapid global warming. Three case studies of PEs in 2012, 2016 and 2023 verify our finding. We hope this study can help policy makers to shape strategies to mitigate or reduce societal impact of PEs under global warming crisis and rapid urbanization."
10.1016/j.atmosres.2024.107693,True,Atmospheric Research,该研究利用CloudSat卫星数据，分析了西太平洋台风不同发展阶段（发展期、成熟期、衰减期）的降水类型（对流性、层状、浅层）及其相关的云垂直微物理和辐射加热特征。研究发现，对流性降水强度最高，在台风发展期达到峰值；层状降水强度次之，在台风成熟期达到峰值；浅层降水强度最弱。研究还发现，对流性降水云中上层冰水含量和冰粒子尺寸更大，导致其短波辐射加热强度更高或与层状降水相当，而长波辐射冷却率在两种降水类型中表现出非常相似的特征。研究结果表明，云冰粒子数浓度不仅影响降水强度，还决定了短波辐射加热中心的垂直位置。,"['cloud microphysics', 'radiative heating', 'typhoon', 'precipitation', 'satellite observations', 'CloudSat']",Yafei Yan;Jianguo Tan;Ming Ying;Yimin Liu;Yao Tang,Vertical structures of typhoon cloud microphysical and radiative features associated with the precipitation type over the western North Pacific,"•Convective and stratiform precipitation peak at develop and mature stage, separately. Shallow precipitation is the weakest. •Convective precipitation contains more ice particles in upper layers than stratiform precipitation. •Cloud ice particle number concentration is crucial in defining the vertical location of shortwave radiative heating center. •Shortwave heating radiation is higher in convective profile, but longwave cooling radiation is similar to stratiform profile. 
 Intensity of different precipitation types (convective, stratiform and shallow) and associated cloud vertical microphysical and radiative heating features are analyzed considering typhoon development, maturity, and decaying stages over the western North Pacific using the CloudSat Tropical Cyclone and China Meteorological Administration tropical cyclone best-track datasets from 2 June 2006 to 31 December 2015. At all three stages, the convective precipitation intensity, approximately twice that of stratiform precipitation, is the highest and peaks at development stage. The strongest stratiform precipitation occurs at typhoon maturity stage. Shallow precipitation is the weakest throughout the typhoon lifespan. Although the cloud microphysical parameters (radar reflectivity, cloud ice particle number concentration and effective radius) of both convective and stratiform precipitation tend to increase with precipitation intensity, convective precipitation contains more ice water of larger sizes in upper layers than stratiform precipitation. Unlike convective and stratiform precipitation, dominated by cold clouds, shallow precipitation is dominated by warm clouds with weak vertical contrast in the radiative distribution but strong radiation nearby 5 km. Our results show that cloud ice particle number concentration is important not only in precipitation intensity enhancement but also in determining the shortwave radiative heating center vertical location. More and larger ice particles in convective precipitation profiles result in stronger or comparable shortwave radiative heating than those in stratiform precipitation profiles, while the longwave radiative cooling rates in convective and stratiform precipitation profiles exhibit very similar features, likely attributable to similar infrared radiation levels due to comparable temperatures in these profiles."
None,False,Atmospheric Research,由于没有提供论文标题和摘要，无法判断其是否与大气环境遥感技术相关。请提供论文标题和摘要以便进行分析。,[],,Editorial Board,
10.1126/science.adt2251,False,Science,这篇论文的标题和摘要没有提供任何与大气环境遥感技术相关的线索。它提到了一个美国机构撤销了关于不当行为规则的争议性修改，这与大气环境遥感技术无关。,[],Jeffrey Mervis,U.S. agency drops controversial changes to misconduct rules,
10.1126/sciadv.ado8107,False,Science Advances,这篇论文主要研究的是大肠杆菌中的一种名为PotD-PotABC的转运蛋白复合物，该复合物负责将多胺类物质（如亚精胺）转运到细菌细胞内。论文通过结构分析揭示了该转运蛋白复合物在不同状态下的构象变化，并阐明了其识别底物结合蛋白PotD以及转运亚精胺的分子机制。该研究与大气环境遥感技术没有直接关系。,[],Zhu Qiao;Phong Hoa Do;Joshua Yi Yeo;Rya Ero;Zhuowen Li;Liying Zhan;Sandip Basak;Yong-Gui Gao,Structural insights into polyamine spermidine uptake by the ABC transporter PotD-PotABC,"Polyamines, characterized by their polycationic nature, are ubiquitously present in all organisms and play numerous cellular functions. Among polyamines, spermidine stands out as the predominant type in both prokaryotic and eukaryotic cells. The PotD-PotABC protein complex inEscherichia coli, belonging to the adenosine triphosphate–binding cassette transporter family, is a spermidine-preferential uptake system. Here, we report structural details of the polyamine uptake system PotD-PotABC in various states. Our analyses reveal distinct “inward-facing” and “outward-facing” conformations of the PotD-PotABC transporter, as well as conformational changes in the “gating” residues (F222, Y223, D226, and K241 in PotB; Y219 and K223 in PotC) controlling spermidine uptake. Therefore, our structural analysis provides insights into how the PotD-PotABC importer recognizes the substrate-binding protein PotD and elucidates molecular insights into the spermidine uptake mechanism of bacteria."
10.1126/sciadv.adn2301,False,Science Advances,这篇论文主要研究月球土壤中的磁铁矿，探讨了磁铁矿的形成机制以及它在月球磁异常和深层月球矿物成分中的作用。研究使用嫦娥五号返回的月球玻璃样本，通过分析玻璃表面嵌入的亚微米级磁铁矿颗粒，推断出磁铁矿的形成与月球撞击事件有关。该研究与大气环境遥感技术没有直接关联。,[],Zhi Cao;Zhuang Guo;Chen Li;Sizhe Zhao;Yang Li;Qi He;Yuanyun Wen;Zhiyong Xiao;Xiongyao Li;Long Xiao;Lifang Li;Junhu Wang;Jianzhong Liu,Submicroscopic magnetite may be ubiquitous in the lunar regolith of the high-Ti region,"Magnetite is rare on the Moon. The ubiquitous presence of magnetite in lunar soil has been hypothesized in previous Apollo Mössbauer spectroscopy and electron spin resonance studies, but there is currently no mineralogical evidence to prove it. Here, we report a large number of submicroscopic magnetite particles embedded within iron-sulfide on the surface of Chang’e-5 glass, with a close positive correlation between magnetite content and the TiO2content of the surrounding glass. The morphology and mineralogy of the iron-sulfide grains suggest that these magnetite particles formed via an impact process between iron-sulfide droplets and silicate glass melt, and ilmenite is necessary for magnetite formation. Magnetite in lunar glass is a potential candidate for the “magnetite-like” phase detected in the Apollo era and suggests that impact-induced submicroscopic magnetite may be ubiquitous in high-Ti regions of the Moon. Moreover, these impact-induced magnetite particles may be crucial for understanding the lunar magnetic anomalies and mineral components of the deep Moon."
10.1126/sciadv.ado9543,False,Science Advances,这篇论文研究了南美洲夏季风在过去千年的变化趋势，并分析了其与大西洋和太平洋气候系统之间的关系。研究方法主要基于古气候数据同化，结合了气候模型和氧同位素数据，重建了南美洲热带地区夏季水文气候变化。论文重点关注了中世纪暖期到小冰期过渡期间的南美洲夏季风增强现象，并将其与大西洋赤道辐合带的南移和太平洋沃克环流的增强联系起来。研究结果表明，准确模拟太平洋沃克环流对于预测未来南美洲夏季风变化至关重要。论文与大气环境遥感技术关系不大，主要关注古气候重建和气候模型模拟。,"['monsoon', 'climate model', 'oxygen isotope', 'paleoclimate data assimilation', 'hydroclimate reconstruction', 'Atlantic Intertropical Convergence Zone', 'Pacific Walker circulation']",Zhiqiang Lyu;Mathias Vuille;Hugues Goosse;Rebecca Orrison;Valdir F. Novello;Francisco W. Cruz;Nicolás M. Stríkis;Julio Cauhy,South American monsoon intensification during the last millennium driven by joint Pacific and Atlantic forcing,"The South American summer monsoon (SASM) profoundly influences tropical South America’s climate, yet understanding its low-frequency variability has been challenging. Climate models and oxygen isotope data have been used to examine the SASM variability over the last millennium (LM) but have, at times, provided conflicting findings, especially regarding its mean-state change from the Medieval Climate Anomaly to the Little Ice Age. Here, we use a paleoclimate data assimilation (DA) method, combining model results and δ18O observations, to produce a δ18O-enabled, dynamically coherent, and spatiotemporally complete austral summer hydroclimate reconstruction over the LM for tropical South America at 5-year resolution. This reconstruction aligns with independent hydroclimate and δ18O records withheld from the DA, revealing a centennial-scale SASM intensification during the MCA-LIA transition period, associated with the southward shift of the Atlantic Intertropical Convergence Zone and the strengthening Pacific Walker circulation (PWC). This highlights the necessity of accurately representing the PWC in climate models to predict future SASM changes."
10.1126/sciadv.ado4274,False,Science Advances,该研究主要关注的是SF3B1-K700E突变对免疫反应的影响，特别是它如何通过影响Treg细胞的功能来促进自身免疫疾病和癌症的发展。研究发现，SF3B1-K700E突变导致Anapc13基因的异常剪接，从而影响Treg细胞的正常分化和功能。该研究与大气环境遥感技术无关。,[],Yun Shi;Wencan Zhang;Qiong Jia;Xiancai Zhong;Prajish Iyer;Hongmin Wu;Yate-Ching Yuan;Yuqi Zhao;Lianjun Zhang;Lili Wang;Zhenyu Jia;Ya-Huei Kuo;Zuoming Sun,Cancer-associated SF3B1-K700E mutation controls immune responses by regulating Treg function via aberrant Anapc13 splicing,"Recurrent somatic mutations in spliceosome factor 3b subunit 1 (SF3B1) are identified in hematopoietic malignancies, with SF3B1-K700E being the most common one. Here, we show that regulatory T cell (Treg)–specific expression of SF3B1-K700E (Sf3b1K700Efl/+/Foxp3YFP-Cre) results in spontaneous autoimmune phenotypes. CD4+T cells fromSf3b1K700Efl/+/Foxp3YFP-Cremice display defective Tregdifferentiation and inhibitory function, which is demonstrated by failed prevention of adoptive transfer colitis bySf3b1K700Efl/+/Foxp3YFP-CreTregs. Mechanically, SF3B1-K700E induces an aberrant splicing event that results in reduced expression of a cell proliferation regulatorAnapc13due to the insertion of a 231–base pair DNA fragment to the 5′ untranslated region. Forced expression of theAnapc13gene restores the differentiation and ability ofSf3b1K700Efl/+/Foxp3YFP-CreTregsto prevent adoptive transfer colitis. In addition, acute myeloid leukemia grows faster in aged, but not young,Sf3b1K700Efl/+/Foxp3YFP-Cremice compared toFoxp3YFP-Cremice. Our results highlight the impact of cancer-associatedSF3B1mutation on immune responses, which affect cancer development."
10.1126/sciadv.ado9461,False,Science Advances,这篇论文研究的是线虫基因组中转座子对基因结构和表达的影响，以及宿主对转座子活动的抑制机制。研究发现，转座子插入导致基因结构发生重排，进而影响基因表达。这与大气环境遥感技术无关。,[],Gaotian Zhang;Marie-Anne Félix;Erik C. Andersen,Transposon-mediated genic rearrangements underlie variation in small RNA pathways,"Transposable elements (TEs) can alter host gene structure and expression, whereas host organisms develop mechanisms to repress TE activities. In the nematodeCaenorhabditis elegans, a small interfering RNA pathway dependent on the helicase ERI-6/7 primarily silences retrotransposons and recent genes of likely viral origin. By studying gene expression variation among wildC. elegansstrains, we found that structural variants and transposon remnants likely underlie expression variation ineri-6/7and the pathway targets. We further found that multiple insertions of the DNA transposons,Polintons,reshuffled theeri-6/7locus and induced inversion oferi-6in some wild strains. In the inverted configuration, gene function was previously shown to be repaired by unusual trans-splicing mediated by direct repeats. We identified that these direct repeats originated from terminal inverted repeats ofPolintons. Our findings highlight the role of host-transposon interactions in driving rapid host genome diversification among natural populations and shed light on evolutionary novelty in genes and splicing mechanisms."
