doi,is_relevant,journal,explanation,topic_words,authors,title,abstract
10.1038/s43247-024-01840-7,True,Communications Earth & Environment,这篇研究论文利用双重差分法，评估了巴西亚马逊地区森林保护政策对当地居民健康的影响。研究发现，减少森林砍伐能够降低森林火灾发生率，进而改善空气质量（减少细颗粒物浓度），最终降低当地居民因呼吸系统疾病导致的住院和死亡率。该研究与大气环境遥感技术密切相关，因为它利用了卫星观测数据（例如，用于监测森林砍伐和火灾）以及空气质量监测数据来量化森林保护政策对空气质量和健康的影响。,"['Particulate matter', 'Air quality', 'Satellite imagery', 'Remote sensing', 'Deforestation', 'Respiratory health', 'Impact evaluation', 'Amazon']",Yannic Damm;Jan Börner;Nicolas Gerber;Britaldo Soares-Filho,Health benefits of reduced deforestation in the Brazilian Amazon,"Forest conservation policies driving reduced deforestation of the Brazilian Amazon improves local air quality and decreases hospitalization and mortality rates due to respiratory diseases of the population, as quantified with impact evaluation methods 
 The conversion of tropical forests in the Amazon region for agriculture and other land uses is associated with health risks linked, for example, to air and water pollution from forest fires and agrochemical use. Several conservation policies introduced in the 2000s aimed at reducing deforestation in the Brazilian Amazon. Here we exploit variations in the regional targeting of these policies to measure human health externalities of conservation policy enforcement using a double-difference approach at close distance to the Amazon biome border. We find that the change in deforestation pressure reduces forest fire incidence. As a consequence, fine particulate matter concentrations in the air—a main vector for adverse health effects of fire smoke—also decrease. This leads to a reduction in the hospitalization and death prevalence rate due to respiratory health problems and other health benefits for the local population. Forest conservation policies driving reduced deforestation of the Brazilian Amazon improves local air quality and decreases hospitalization and mortality rates due to respiratory diseases of the population, as quantified with impact evaluation methods"
10.1038/s43247-024-01827-4,True,Communications Earth & Environment,这篇论文研究了北半球森林碳汇的估算问题，特别关注森林扰动（例如火灾、土地利用变化）和森林再生对碳汇的影响。研究发现，动态全球植被模型（DGVM）低估了碳汇，这可能是因为它们对森林扰动的模拟存在缺陷，例如高估了火灾排放，低估了森林再生速率。为了解决这个问题，研究人员利用卫星数据估算了森林再生碳通量，并结合其他数据源（如火灾排放、土地利用变化排放），对碳汇进行了重新估算。结果表明，考虑森林扰动和再生的‘自下而上’估算方法与大气反演结果一致，这提高了对北半球森林碳汇估算的可靠性。研究中使用了卫星遥感技术获取森林年龄、生物量等数据，这体现了大气环境遥感技术在碳循环研究中的重要作用。,"['carbon sink', 'forest regrowth', 'satellite observation', 'carbon dioxide', 'atmospheric inversion', 'fire emissions', 'vegetation', 'biomass', 'remote sensing']",Michael O’Sullivan;Stephen Sitch;Pierre Friedlingstein;Ingrid T. Luijkx;Wouter Peters;Thais M. Rosan;Almut Arneth;Vivek K. Arora;Naveen Chandra;Frédéric Chevallier;Philippe Ciais;Stefanie Falk;Liang Feng;Thomas Gasser;Richard A. Houghton;Atul K. Jain;Etsushi Kato;Daniel Kennedy;Jürgen Knauer;Matthew J. McGrath;Yosuke Niwa;Paul I. Palmer;Prabir K. Patra;Julia Pongratz;Benjamin Poulter;Christian Rödenbeck;Clemens Schwingshackl;Qing Sun;Hanqin Tian;Anthony P. Walker;Dongxu Yang;Wenping Yuan;Xu Yue;Sönke Zaehle,The key role of forest disturbance in reconciling estimates of the northern carbon sink,"A satellite-based estimate of forest regrowth carbon flux across the Northern Hemisphere suggests forest disturbance and regrowth are transient but important aspects of the carbon sink that may explain underestimates from dynamic global vegetation models 
 Northern forests are an important carbon sink, but our understanding of the driving factors is limited due to discrepancies between dynamic global vegetation models (DGVMs) and atmospheric inversions. We show that DGVMs simulate a 50% lower sink (1.1 ± 0.5 PgC yr−1 over 2001–2021) across North America, Europe, Russia, and China compared to atmospheric inversions (2.2 ± 0.6 PgC yr−1). We explain why DGVMs underestimate the carbon sink by considering how they represent disturbance processes, specifically the overestimation of fire emissions, and the lack of robust forest demography resulting in lower forest regrowth rates than observed. We reconcile net sink estimates by using alternative disturbance-related fluxes. We estimate carbon uptake through forest regrowth by combining satellite-derived forest age and biomass maps. We calculate a regrowth flux of 1.1 ± 0.1 PgC yr−1, and combine this with satellite-derived estimates of fire emissions (0.4 ± 0.1 PgC yr−1), land-use change emissions from bookkeeping models (0.9 ± 0.2 PgC yr−1), and the DGVM-estimated sink from CO2 fertilisation, nitrogen deposition, and climate change (2.2 ± 0.9 PgC yr−1). The resulting ‘bottom-up’ net flux of 2.1 ± 0.9 PgC yr−1 agrees with atmospheric inversions. The reconciliation holds at regional scales, increasing confidence in our results. A satellite-based estimate of forest regrowth carbon flux across the Northern Hemisphere suggests forest disturbance and regrowth are transient but important aspects of the carbon sink that may explain underestimates from dynamic global vegetation models"
10.1038/s43247-024-01889-4,True,Communications Earth & Environment,这篇论文研究了2021年1月一次突然平流层增温事件对南亚气溶胶输送至青藏高原的影响。利用包含化学成分的天气预报模型，分析表明，此次事件导致对流层环流发生变化，从而抑制了气溶胶的输送，减少了30%–40%。研究发现，平流层突然增温激发的向东传播波列，导致从波斯湾到中国北部出现反气旋异常，其南侧的东风异常阻碍了气溶胶从南亚向青藏高原的输送。由于南亚气溶胶会加剧青藏高原冰川融化，这项研究结果对于预测青藏高原地区空气质量具有重要意义。该研究与大气环境遥感技术密切相关，因为它涉及气溶胶（大气成分）的监测、数值模拟（可用于解释卫星观测数据）以及对空气质量和冰川融化的影响评估。,"['Aerosol', 'Air quality', 'Satellite observation', 'Atmospheric composition', 'Tibetan Plateau', 'South Asia', 'Stratospheric warming', 'Glacier melt', 'Numerical simulation', 'Weather forecasting model']",Yuling Hu;Haipeng Yu;Shichang Kang;Mian Xu;Siyu Chen;Junhua Yang;Xintong Chen;Jixiang Li,Reduced aerosol transport from South Asia to the Tibetan Plateau following the January 2021 sudden stratospheric warming event,"Following a sudden stratospheric warming event in 2021, transport of aerosols from South Asia to the Tibetan Plateau was suppressed as a result of changes in the tropospheric circulation, according to analyses with a weather forecasting model with a chemistry component. 
 Aerosols from South Asia directly enhance glacier melt over the Tibetan Plateau. While the transboundary transport of aerosols from South Asia towards the Tibetan Plateau has been extensively investigated from a tropospheric perspective, less focus has been given to the stratospheric dimension. Here we examined the impact of the sudden stratospheric warming in January 2021 on aerosol transport from South Asia towards the Tibetan Plateau via numerical simulation. The results revealed that the aerosol transport from South Asia to the Tibetan Plateau reduced by 30%–40% following the January 2021 sudden stratospheric warming event. The eastward-propagating wave train stimulated by the stratospheric sudden warming induced an anticyclonic anomaly from the Persian Gulf to northern China, south of which easterly anomalies hindered the aerosol transport from South Asia to the Plateau. This study provides valuable insights for predicting air quality over the Tibetan Plateau. 
                
                  
                
               Following a sudden stratospheric warming event in 2021, transport of aerosols from South Asia to the Tibetan Plateau was suppressed as a result of changes in the tropospheric circulation, according to analyses with a weather forecasting model with a chemistry component."
10.1016/j.rse.2024.114498,False,Remote Sensing of Environment,这篇论文关注的是利用高分辨率遥感影像进行社区开放空间（COS）制图。它提出了一种新的分层遮挡感知模型（LOPM）来解决高分辨率影像中COS由于三维结构导致的分层遮挡问题，从而更准确地绘制COS地图。研究使用了覆盖中国31个主要城市的COS-1m数据集，该数据集包含各种要素及其耦合空间，分辨率为1米。该模型的整体精度达到86.39%，平均F1分数为77.47%。研究结果表明，平均每个城市有60.51平方公里的COS区域被遮挡，占COS总面积的10.18%。该研究的重点在于改进城市社区开放空间的制图技术，为城市可持续发展目标（SDGs）的评估提供更精细的数据产品，这与大气环境遥感技术（例如空气质量监测、卫星观测和大气成分分析）并没有直接关系。,[],Yichen Lei;Xiuyuan Zhang;Shuping Xiong;Ge Tan;Shihong Du,Developing Layered Occlusion Perception Model: Mapping community open spaces in 31 China cities,"•Hierarchical model for layer-occluded Community-level Open Spaces (COS) mapping. •Above-ground element knowledge guides the feature selection of ground elements. •Identify 10.18% of open spaces in China exhibit complex layer-coupled structures. •COS-1 m dataset produced covering 31 major cities in China with 1 m resolution. 
 Community Open Spaces (COS) refer to the fine-grained and micro-open areas within communities that offer residents convenient opportunities for social interaction and health benefits. The mapping of COS using Very High Resolution (VHR) imagery can provide critical community-scale data for monitoring urban sustainable development goals (SDGs). However, the three-dimensional structure of COS often results in layered occlusion in two-dimensional satellite imagery, leading to the invisibility and fragmentation of ground COS features in VHR images. This study presents a novel Layered Occlusion Perception Model (LOPM) to address these challenges by accurately modeling and reconstructing the intricate layered structure of COS. Our approach involves the automatic generation of a comprehensive COS database and the joint training of a deep learning network to decompose occlusion relationships. The developed dual-layer map product, COS-1m, includes various elements and their coupled spaces, with a resolution of 1 m, covering 31 major cities in China. The results demonstrate that the proposed method achieved an overall accuracy of 86.39% and an average F1-score of 77.47% across these cities. COS-1m reveals that, on average, 60.51 km2 of COS area per city is occluded, constituting 10.18% of the total COS area. This research advances the technology for layered monitoring of COS, fills a critical gap in community-scale SDG assessments by providing fine-grained COS data products, and offers valuable insights for urban planners and policymakers to promote more effective and sustainable urban development."
None,True,Remote Sensing of Environment,这篇论文是对之前发表在《Remote Sensing of Environment》期刊上的一篇文章的更正说明。原文研究的是如何利用遥感技术反演高分辨率的融雪季地表反照率，并探讨了其对喀喇昆仑异常的意义。更正说明可能涉及数据处理、方法修正或结果调整等方面，但核心仍然围绕着利用遥感技术观测地表反照率及其环境意义。因此，它与大气环境遥感技术密切相关，特别是卫星观测和地表参数反演方面。,"['Albedo', 'Satellite observation', 'Remote sensing', 'Karakoram Anomaly', 'Melting-season albedo', 'High-resolution']",Fuming Xie;Shiyin Liu;Yu Zhu;Xinyi Qing;Shucheng Tan;Yongpeng Gao;Miaomiao Qi;Ying Yi;Hui Ye;Muhammad Mannan Afzal;Xianhe Zhang;Jun Zhou,Corrigendum to “Retrieval of high-resolution melting-season albedo and its implications for the Karakoram Anomaly” [Remote Sensing of Environment Volume 315 (2024) 114438],
None,False,Remote Sensing of Environment,由于没有提供标题和摘要，无法判断其与大气环境遥感技术的关系。请提供标题和摘要以便进行分析。,[],,Editorial Board,
None,False,International Journal of Applied Earth Observation and Geoinformation,这篇论文主要关注的是利用合成孔径雷达（SAR）技术进行热带森林扰动制图。它探讨了纹理特征如何提高SAR图像的分析精度，属于遥感技术应用领域，但与大气环境遥感（例如空气质量监测、卫星观测和大气成分分析）关系不大。论文的核心在于改进森林扰动监测方法，而非大气成分的探测或分析。,[],Johannes Balling;Martin Herold;Johannes Reiche,Corrigendum to “How textural features can improve SAR-based tropical forest disturbance mapping” [Int. J. Appl. Earth Obs. Geoinform. 124 (2023) 103492],
None,False,International Journal of Applied Earth Observation and Geoinformation,这篇论文的标题和摘要表明它关注的是地理问题回答系统GeoQA2及其评估基准。这与大气环境遥感技术，例如空气质量监测、卫星观测和大气成分分析，并没有直接关系。GeoQA2更可能是一个自然语言处理或地理信息系统方面的研究，而不是大气科学。因此，它与大气环境遥感技术的相关性较弱。,[],Sergios-Anestis Kefalidis;Dharmen Punjani;Eleni Tsalapati;Konstantinos Plas;Maria-Aggeliki Pollali;Pierre Maret;Manolis Koubarakis,The question answering system GeoQA2 and a new benchmark for its evaluation,
None,False,International Journal of Applied Earth Observation and Geoinformation,这篇论文的标题和摘要表明，其研究重点是全球主要河流三角洲的沿海湿地动态变化，时间跨度为1990年至2019年。研究内容集中在湿地变化本身，例如湿地面积变化、类型变化等，并没有直接涉及大气环境遥感技术，例如空气质量监测、卫星观测和大气成分分析等。因此，该研究与大气环境遥感技术关系不大。,[],Yongchao Liu;Jialin Li;Xinxin Wang;Chao Sun;Peng Tian;Gaili He,Divergent dynamics of coastal wetlands in the world’s major river deltas during 1990–2019,
None,False,International Journal of Applied Earth Observation and Geoinformation,这篇论文主要关注的是利用一种名为TDFC-RNNs的框架结合时间卷积注意力机制来预测地表形变，并以北京平原为例进行了案例研究。文章的重点在于改进InSAR技术用于地表形变预测的精度和效率，并没有直接涉及大气环境遥感技术，例如空气质量监测、卫星观测和大气成分分析等。因此，它与大气环境遥感技术的相关性较弱。,[],Sheng Yao;Changfeng Jing;Xu He;Yi He;Lifeng Zhang,A TDFC-RNNs framework integrated temporal convolutional attention mechanism for InSAR surface deformation prediction: A case study in Beijing Plain,
None,False,International Journal of Applied Earth Observation and Geoinformation,这篇论文的标题和摘要表明，其研究重点是利用多时相Sentinel-2卫星影像对中国区域的裸土进行二维分类。这属于遥感技术应用的范畴，但与大气环境遥感技术（例如空气质量监测、卫星观测和大气成分分析）并没有直接关系。研究中使用了遥感卫星数据，但目标是地表特征（裸土）而非大气成分。因此，该研究与大气环境遥感技术关联性较弱。,[],Jie Xue;Xianglin Zhang;Yuyang Huang;Songchao Chen;Lingju Dai;Xueyao Chen;Qiangyi Yu;Su Ye;Zhou Shi,A two-dimensional bare soil separation framework using multi-temporal Sentinel-2 images across China,
10.1016/j.atmosenv.2024.120922,True,Atmospheric Environment,这篇论文研究了中国中部典型工业城市黄石市2021年至2022年PM2.5的浓度、化学成分、来源及其对能见度的影响。文章通过分析PM2.5的季节性变化趋势，以及有机碳（OC）、元素碳（EC）和水溶性无机离子（WSII）等组分的浓度，揭示了黄石市PM2.5污染的特征。研究发现，冬季PM2.5浓度最高，夏季最低；NO3−/SO42−比值表明污染源正从燃煤转向机动车排放；二次无机盐对能见度影响显著，并且具有明显的季节变化。此外，研究还利用气团聚类分析和潜在源区分析方法，确定了PM2.5及其组分的来源，主要来自本地及周边地区。这些发现强调了加强地方污染控制措施、改变污染源以及有针对性地控制排放以改善空气质量和能见度的必要性。虽然文章本身没有直接使用卫星遥感数据，但其研究结果与大气环境遥感技术密切相关，例如，可以为利用卫星遥感技术监测PM2.5浓度和空间分布提供重要的地面观测数据和科学依据，也可以用于验证和改进大气成分分析模型。,"['PM2.5', 'Aerosol', 'Air quality', 'Light extinction', 'Satellite observation', 'Air quality monitoring', 'Atmospheric composition', 'Source apportionment']",Changlin Zhan;Chong Wei;Ziguo Liu;Hongxia Liu;Xuefen Yang;Jingru Zheng;Shan Liu;Jihong Quan;Yong Zhang;Qiyuan Wang;Nan Li;Junji Cao,Seasonal trends and light extinction effects of PM<sub>2.5</sub> chemical composition from 2021 to 2022 in a typical industrial city of central China,"•PM2.5levels in Huangshi exceed China's annual standard, peaking in winter. •OC, EC, and WSIIs dominate the chemical composition of PM2.5. •NO3−/SO42−ratio indicates a shift from coal combustion to vehicle emissions. •Secondary inorganic salts significantly impact visibility, with seasonal variation inbext. •PM2.5and its components were major originated from local and nearby regions. 
 This study investigates the concentrations, chemical compositions, and sources of PM2.5 in Huangshi, China. Daily average PM2.5 levels ranged from 8.43 to 193.08 μg m−3, with an annual mean of 54.13 μg m−3, exceeding China's annual secondary standard of 35 μg m−3. Seasonal mean concentrations peaked in winter and were lowest in summer. Organic carbon (OC) and elemental carbon (EC) had annual means of 4.89 μg m−3 and 0.94 μg m−3, respectively. Water-soluble inorganic ions (WSIIs) accounted for 52.17% of PM2.5, with NO3−, SO42−, and NH4+ being the major components. The NO3−/SO42− ratio averaged 1.65, indicating a transition from coal combustion to vehicle emissions as the primary pollution source. Chemical mass reconstruction revealed that NH4NO3, (NH4)2SO4, and organic matter (OM) accounted for 65.3% of PM2.5 mass. Seasonal variations in light extinction (bext) highlighted the impact of secondary inorganic salts on visibility, with an annual average bext of 346.30 ± 246.98 Mm−1. Airmass clusters and potential source region analysis suggested PM2.5 and its components were primarily originated from local and nearby regions. These findings underscore the effectiveness of local pollution control measures, changing pollution sources, and the necessity for targeted emission controls to improve air quality and visibility in urban areas."
None,False,Atmospheric Environment,这篇论文的标题和摘要表明，其研究重点是地中海高海拔地区自然环境中空气中花粉的来源。这属于植物学、生态学和气象学的研究范畴。虽然花粉是空气成分的一部分，但该研究似乎并没有直接使用大气环境遥感技术，例如空气质量监测、卫星观测或大气成分分析来进行研究。研究可能涉及花粉的采集、鉴定和来源追踪等野外调查和实验室分析方法。,[],Paloma Cariñanos;Soledad Ruiz-Peñuela;Andrea Casans;Alberto Cazorla;Fernando Rejano;Alejandro Ontiveros;Pablo Ortiz-Amezcua;Juan Luis Guerrero-Rascado;Francisco José Olmo;Lucas Alados-Arboledas;Gloria Titos,Assessment of potential sources of airborne pollen in a high-mountain mediterranean natural environment,
None,True,Atmospheric Environment,这篇论文评估和比较了不同WRF-Chem模式配置对预测2022年4月伊朗西部沙尘暴事件中风场的影响。WRF-Chem模式是一种常用的数值天气预报模型，可以模拟大气化学过程，包括沙尘传输。该研究关注的是沙尘气溶胶对空气质量的影响，以及风场在沙尘暴中的作用。这与大气环境遥感技术密切相关，因为遥感技术，例如卫星观测，可以用来监测沙尘气溶胶的时空分布，而数值模式结果可以与遥感数据进行对比验证，从而提高沙尘预报的准确性。因此，本研究属于大气环境遥感技术的应用范畴，可以帮助我们更好地理解和预测沙尘暴等大气环境事件。,"['Aerosol', 'Dust', 'Air quality', 'Wind field', 'WRF-Chem model', 'Atmospheric composition', 'Numerical weather prediction']",Elham Mobarak Hassan;Mahnaz Karimkhani;Jeff Sepehri,Evaluating and comparison of WRF-chem model configurations for wind field impact on the April 2022 dust episode in western Iran,
