doi,is_relevant,journal,explanation,topic_words,authors,title,abstract
10.1021/acs.est.4c07262,False,Environmental Science & Technology,这篇论文主要研究的是生物炭在冻融循环下的溶解黑碳释放行为及其在土壤中的截留能力。研究发现，冻融循环显著促进了生物炭中溶解黑碳的释放，释放量远高于无冻融循环的情况。不同热解温度的生物炭，其溶解黑碳的释放动力学也不同。此外，冻融循环产生的溶解黑碳在土壤中的截留能力也降低了。这主要是因为冻融循环产生的溶解黑碳中含有大量的亲水性低分子量化合物，这些化合物更容易溶于水相，而不是被土壤截留，从而可能加剧溶解有机碳的流失。该研究结果阐明了冻融循环过程中溶解黑碳的释放行为，揭示了其对寒冷地区碳库衰减的贡献。总的来说，该研究主要关注的是土壤碳循环和生物炭的稳定性，与大气环境遥感技术关系不大。,[],Lang Zhu;Na Chen;Xianglei Zhang;Luyao Ren;Rui Zou;Jia Xie;Zhiqiang Wang;Huiqiang Yang;Zelin Hao;Jianjun Qin;Hanzhong Jia,Freeze–Thaw Cycle Events Enable the Deep Disintegration of Biochar: Release of Dissolved Black Carbon and Its Structural-Dependent Carbon Sequestration Capacity,"Biochar is widely regarded as a recalcitrant carbon pool. However, the impact of freeze–thaw cycle events on its storage capacity, particularly on the release of dissolved black carbon (DBC), has remained poorly investigated. This study investigated the release behavior of DBC from biochar pyrolyzed at 300–700 °C during freeze–thaw cycles and their retention capacity in soil. Freeze–thaw cycles dramatically promoted DBC release (33.08–230.74 mg C L–1), exhibiting an order of magnitude higher than those without freeze–thaw process. The release kinetics of freeze–thaw-induced DBC varied depending on the pyrolysis temperature of biochar due to the different disintegration mechanisms. Interestingly, the retention capacity of freeze–thaw-induced DBC in soil showed a reduction ranging from 7.7 to 29.5% compared to DBC without the freeze–thaw process. This reduction can be attributed to numerous hydrophilic low-molecular-weight compounds (16.97–75.31%) in freeze–thaw-induced DBC, as evidenced by the results of size exclusion chromatography, fluorescence excitation/emission matrix, Fourier transform infrared spectroscopy, and nuclear magnetic resonance. These compounds tend to concentrate in the aqueous phase rather than being retained in the soil, potentially exacerbating the outflow of dissolved organic carbon. These findings clarify the release behavior of DBC during freeze–thaw cycles and reveal their contribution to the attenuation of carbon pools in cold regions."
10.1021/acs.est.4c07264,False,Environmental Science & Technology,这篇论文主要研究的是土壤中微生物碳利用效率和微生物残体稳定性受岩石类型、土壤团聚体和矿物的影响。研究发现，碳酸盐岩土壤（喀斯特土壤）中，较高的钙含量和铁（氢）氧化物含量会降低微生物碳利用效率，但同时提高微生物残体的稳定性。而通过比较喀斯特土壤和非喀斯特土壤，研究揭示了岩石类型对土壤微生物过程的调控作用。该研究属于土壤科学和生态学领域，与大气环境遥感技术，例如空气质量监测、卫星观测和大气成分分析等，没有直接关系。,[],Peilei Hu;Wei Zhang;Andrew T. Nottingham;Dan Xiao;Yakov Kuzyakov;Lin Xu;Hongsong Chen;Jun Xiao;Pengpeng Duan;Tiangang Tang;Jie Zhao;Kelin Wang,Lithological Controls on Soil Aggregates and Minerals Regulate Microbial Carbon Use Efficiency and Necromass Stability,"Microbial carbon (C) use efficiency (CUE) drives soil C formation, while physical-chemical protection stabilizes subsequent microbial necromass, both shaped by soil aggregates and minerals. Soils inherit many properties from the parent material, yet the influence of lithology and associated soil geochemistry on microbial CUE and necromass stabilization remains unknow. Here, we quantified microbial CUE in well-aggregated bulk soils and crushed aggregates, as well as microbial necromass in bulk soils and the mineral-associated organic matter fraction, originating from carbonate-containing (karst) and carbonate-free (clastic rock, nonkarst) parent materials along a broad climatic gradient. We found that aggregate crushing significantly increased microbial CUE in both karst and nonkarst soils. Additionally, compared to nonkarst soils, calcium-rich karst soils increased macroaggregate stability and decreased the ratio of oligotrophic to copiotrophic microbial taxa, leading to a reduction in microbial CUE. Moreover, microbial CUE was negatively associated with iron (hydr)oxides in karst soils, attributed to the greater abundance of iron (hydr)oxides and higher soil pH. Despite the negative effects of soil aggregation and minerals on microbial CUE, particularly in karst soils, these soils concurrently showed greater microbial necromass stability through organo–mineral associations compared to nonkarst soils. Consequently, (i) bedrock lithology mediates the effects of aggregates and minerals on microbial CUE and necromass stability; and (ii) balancing minerals’ dual roles in diminishing microbial CUE and enhancing microbial necromass stability is vital for optimizing soil C preservation."
10.1021/envhealth.4c00160,False,Environment & Health,这篇论文研究的是利用酵母细胞的蛋白质生物标志物进行基因毒性筛选的方法。研究人员构建了一个包含酵母细胞DNA损伤反应网络的图谱，并通过荧光蛋白融合酵母菌株，鉴定出15个蛋白质生物标志物，可以用来评估各种物质的基因毒性。文中提到的方法与大气环境遥感技术，例如空气质量监测、卫星观测和大气成分分析等，没有任何关系。,[],Yushi Jin;Boyuan Xue;Xiaohong Zhou,Protein Biomarkers of DNA Damage in Yeast Cells for Genotoxicity Screening,"Providing an unbiased and comprehensive view of the DNA damage response in cells is critical in genotoxicity screening to identify substances that cause diverse types of DNA damage. Considering that S. cerevisiae is one of the most well-characterized model organisms in molecular and cellular biology, we created a map of the DNA damage response network containing the reported signaling pathways in yeast cells programmed to constitutively respond to DNA damage. A collection of GFP-fused S. cerevisiae yeast strains treated with typical genotoxic agents illuminated the cellular response to DNA damage, thereby identifying 15 protein biomarkers encompassing all eight documented DNA damage response pathways. Three statistical and one deep learning models were proposed to interpret the quantitative molecular toxicity end point, i.e. protein effect level index (PELI), by introducing weights of 15 biomarkers in genotoxicity assessment. The method based on standard deviation exhibited the best performance, with an R2 of 0.916 compared to the SOS/umu test and an R2 of 0.989 compared to the comet assay. The GFP-fused yeast-based proteomic assay has minute-level resolution of pathway activation data. It provides a concise alternative for fast, efficient, and mechanistic genotoxicity screening for various environmental and health applications."
10.1029/2024GL112609,False,Geophysical Research Letters,这篇论文研究的是地球磁尾中氧离子对磁重联过程的影响。它使用三维混合模拟的方法，研究了源自电离层顶部的氧离子外流对磁尾结构和动力学的影响，特别是关注氧离子在黄昏侧磁尾中诱导磁通绳的现象。该研究与大气环境遥感技术关系不大，因为它关注的是地球空间环境中的等离子体过程，而非大气成分的监测或分析。研究中使用的模拟方法也是基于物理模型的数值模拟，而非遥感观测技术。,"['ionosphere', 'magnetotail', 'plasma', 'magnetic reconnection', 'space weather', 'hybrid simulation', 'oxygen ions']",Y. A. Omelchenko;C. Mouikis;J. Ng;V. Roytershtyen,Flux Ropes Induced by O+ ${\mathrm{O}}^{+}$ Outflow in the Near‐Earth Magnetotail: Three‐Dimensional Hybrid Simulations,"Spacecrafts observe signatures of duskside magnetic reconnection in the Earth's magnetotail associated with the presence of oxygen O+ $\left({\mathrm{O}}^{+}\right)$ ions of ionospheric origin. The exact role of O+ ${\mathrm{O}}^{+}$ ions in mediating reconnection remains largely unknown due to the local nature of observational techniques. We analyze results from global three‐dimensional hybrid (kinetic ions, fluid electrons) simulations of O+ ${\mathrm{O}}^{+}$ outflows and demonstrate that oxygen ions, escaping from the top of the ionosphere into the lobes, may cause disruptions on the duskside of the proton‐formed magnetotail, adding up to its turbulent, unsteady nature. These O+ ${\mathrm{O}}^{+}$ ions are shown to be capable of inducing magnetic flux ropes in the current sheet that thins out toward the dusk flank of the magnetotail due to Hall and ion kinetic effects. Unlike magnetohydrodynamics (MHD) simulations, where dawn‐dusk magnetotail asymmetries may develop due to nonuniform ionospheric conductivity, the hybrid simulations demonstrate duskside tail disruptions on much faster ion gyroscales."
10.1029/2024GL109352,True,Geophysical Research Letters,这篇研究论文密切相关于大气环境遥感技术。标题和摘要都清晰地表明了研究使用了卫星数据（例如TROPOMI数据）和化学传输模型（例如CarbonTracker和GEOS-Chem模型）来分析2018年、2019年和2020年加州野火对大气中痕量气体（CO2、CO、CH4等）的影响。研究关注野火燃烧导致大气成分变化，特别是温室气体浓度升高，这与空气质量监测和卫星观测密切相关。论文利用卫星遥感数据和模型模拟结果对比，评估了模型模拟的准确性，并指出模型在模拟某些气体浓度变化方面存在不足，这为改进大气环境遥感技术和模型提供了方向。,"['CO2', 'CO', 'CH4', 'trace gases', 'atmospheric composition', 'satellite data', 'remote sensing', 'air quality monitoring', 'wildfires', 'biomass burning', 'TROPOMI', 'CarbonTracker', 'GEOS-Chem', 'California']",Thishan Dharshana Karandana Gamalathge;Nolan Tai;Xun Jiang;Xinyue Wang;Liming Li;Yuk L. Yung,Impacts of California Wildfires on CO2 and Other Trace Gases,"Wildfires have broad impacts on the atmosphere, ecology, and society. This study leverages satellite data and chemistry‐transport models to analyze the impact of wildfires on trace gases in California during the August‐October periods of 2018, 2019, and 2020. During these months, Southern California experiences minimal precipitation, leading to a high Vapor Pressure Deficit, which results in decreased photosynthetic activities. This reduction, combined with increased biomass burning, causes a rise in CO2 concentrations. Increased CO and CH4 levels are also seen in TROPOMI retrievals tied to the increase in biomass burning. The CarbonTracker model captures these elevated CO2 concentrations, though with a reduced amplitude of increased CO2. Similarly, the GEOS‐Chem model successfully simulates high CO levels but underestimates the observed enhancements. These findings will improve the understanding of fire's influence on trace gases and refine future numerical models on surface emissions and transport."
10.1029/2024GL112211,True,Geophysical Research Letters,这篇论文使用GITM-SAMI3耦合模型模拟了2017年9月7日地磁暴期间电离层-热层系统的响应。研究结果表明，模拟中形成了一个超级赤道等离子体泡（SEPB），并上升到大约40°磁纬度。这归因于穿透电场（PEF）增强了广义瑞利-泰勒不稳定性（GRTI）的增长率，而大气/电离层扰动则起到了种子机制的作用。虽然研究的重点是电离层等离子体泡的形成和演变，但这与大气环境遥感技术密切相关，因为电离层的状态会受到地磁活动和大气成分变化的影响，而卫星观测是研究电离层的重要手段。因此，该研究有助于改进空间天气预报模型，并提高我们对电离层动态过程的理解，这对于依赖于电离层稳定性的各种技术（如卫星通信和导航）至关重要。,"['ionosphere', 'thermosphere', 'plasma bubbles', 'geomagnetic storm', 'satellite observations', 'ionospheric irregularities', 'GITM', 'SAMI3']",Zihan Wang;Shasha Zou;J. D. Huba;Aaron Ridley,Development of Super Plasma Bubbles During the 7 September 2017 Geomagnetic Storm Revealed by Coupled GITM‐SAMI3 Simulations,"In this study, we used the coupled GITM (Global Ionosphere Thermosphere Model)‐SAMI3 (Sami3 is Also a Model of the Ionosphere) model to simulate the response of the ionosphere‐thermosphere system during the 7 September 2017 geomagnetic storm. In the simulation results, a super equatorial plasma bubble (SEPB) formed and rose to around 40° $40{}^{\circ}$ magnetic latitude (MLAT). This is attributed to a penetration electric field (PEF) that enhances the growth rate of generalized Rayleigh‐Taylor instability (GRTI), while traveling atmospheric/ionospheric disturbances act as a seeding mechanism."
10.1029/2024GL111398,False,Geophysical Research Letters,这篇论文研究的是澳大利亚陆地碳循环对气候变化的响应及其不确定性。它使用了CMIP6多模式集合和动态全球植被模型LPJ-GUESS来预测未来澳大利亚植被碳储量。研究发现，预测结果存在很大的不确定性，这主要与气象强迫数据的偏差有关。通过对气象强迫数据进行偏差校正，可以减少一部分不确定性，但仍然存在由模型对大气CO2浓度、温度和降水变化的敏感性差异导致的不确定性。因此，论文强调需要改进陆地生物圈模型和全球气候模型对区域降水的模拟，以提高预测精度。总的来说，该研究关注的是陆地生态系统碳循环，与大气环境遥感技术关系不大。,"['terrestrial carbon cycle', 'vegetation carbon storage', 'climate change', 'CMIP6', 'LPJ-GUESS', 'Global Climate Models', 'meteorological forcing', 'precipitation variability']",Lina Teckentrup;Martin G. De Kauwe;Andy J. Pitman;David Wårlind;Anna M. Ukkola;Benjamin Smith,Resolving Uncertainty in the Response of Australia's Terrestrial Carbon Cycle to Projected Climate Change,"
Semi‐arid ecosystems, common across the Australian continent, strongly influence the inter‐annual variability and trend in the global terrestrial net carbon sink. Here we explore the future Australian terrestrial carbon cycle using the CMIP6 ensemble, and the dynamic global vegetation model LPJ‐GUESS. Uncertainty in Australia's carbon storage in vegetation ranged between 6 and 49 PgC at the end of the century and was strongly linked to biases in the meteorological forcing. Using LPJ‐GUESS with bias‐corrected meteorological forcing reduced uncertainty in the vegetation carbon storage to between 14 and 20 PgC, with the remaining range linked to model sensitivities to rising atmospheric CO2 concentration, temperature, and precipitation variability. Reducing this uncertainty will require improved terrestrial biosphere models, but also major improvements in the simulation of regional precipitation by Global Climate Models."
10.1029/2024GL111835,False,Geophysical Research Letters,这篇论文研究的是胡安德富卡-戈尔达板块系统中的地震方位各向异性。研究者利用瑞利波数据反演，建立了一个两层模型来描述80公里深度内的各向异性。结果显示，岩石圈的各向异性主要反映了板块形成的运动学，而软流圈的快速传播方向与根据NUVEL1A板块运动模型推断的对流剪切一致。这表明，即使是像胡安德富卡-戈尔达这样年轻的板块系统，其区域各向异性也记录了与太平洋板块等较老板块类似的对流信息。这项研究使用了地震学方法，与大气环境遥感技术（例如空气质量监测、卫星观测和大气成分分析）并没有直接关系。,[],Chuanming Liu;Thorsten Becker;Mengyu Wu;Shuoshuo Han;Michael H. Ritzwoller,Seismic Azimuthal Anisotropy Within the Juan de Fuca ‐ Gorda Plate System,"We estimate seismic azimuthal anisotropy for the Juan de Fuca ‐ Gorda plates from inversion of a new 10–80 s period Rayleigh wave dataset, resulting in a two‐layer model to 80 km depth. In the lithosphere, most anisotropy patterns reflect the kinematics of plate formation, as approximated from seafloor‐age‐based paleo‐spreading, except for regions close to propagator wakes and near plate boundaries. In the asthenosphere, the fast propagation orientations align with convective shear as inferred from the NUVEL1A plate motion model, which is indicative of a ∼3 Myr average, rather than with the more recent, ∼0.8 Myr, motions inferred from MORVEL. Regional anisotropy of this young plate system thus records convection like older plates such as the Pacific. On smaller scales, anisotropy imaging provides insights into dynamics of plate generation and can further elucidate plate reorganizations and changes in boundary loading."
10.1029/2024GL111623,True,Geophysical Research Letters,这篇论文研究了天王星大气层温度的变化，以及太阳风对天王星热层温度影响的显著性。研究发现，1992年至2018年间，天王星热层温度持续下降，这与同期太阳风能量下降50%相吻合。这表明，与其他行星相比，天王星热层受太阳风的影响更为显著。该研究利用地面望远镜的近红外观测数据，结合对太阳风活动趋势的分析，揭示了太阳风与天王星热层温度之间的耦合关系。虽然研究本身并非直接针对地球大气环境遥感技术，例如空气质量监测或特定大气成分分析，但其研究方法（卫星观测数据分析，近红外光谱观测）和对行星大气物理过程的理解，与大气环境遥感技术具有共通之处，例如对大气温度和成分的遥感监测。因此，该研究可以为行星大气遥感技术的改进和发展提供参考。,"['Thermosphere temperature', 'Solar wind', 'Upper atmosphere', 'Planetary magnetosphere', 'Satellite observations', 'Near-infrared observation']",A. Masters;J. R. Szalay;S. Zomerdijk‐Russell;M. M. Kao,Solar Wind Power Likely Governs Uranus' Thermosphere Temperature,"Observations of Uranus in the near‐infrared by ground‐based telescopes from 1992 to 2018 have shown that the planet's upper atmosphere (thermosphere) steadily cooled from ∼700 to ∼450 K. We explain this cooling as due to the concurrent decline in the power of the solar wind incident on Uranus' magnetic field, which has dropped by ∼50% over the same period due to solar activity trends longer than the 11‐year solar cycle. Uranus' thermosphere appears to be more strongly governed by the solar wind than any other planet where we have assessed this coupling so far. Uranus' total auroral power may also have declined, in contrast with the power of the radio aurora that we expect has been predominantly modulated by the solar cycle. In the absence of strong local driving, planets with sufficiently large magnetospheres may also have thermospheres predominantly governed by the stellar wind, rather than stellar radiation."
10.1029/2024GL111080,False,Geophysical Research Letters,这篇论文研究的是盐结晶对多孔介质中盐水蒸发动力学的影响。实验通过监测不同浓度NaCl溶液供给的沙柱在受控环境条件下的水质量损失率，并同步进行光学和热成像观测盐晶体的形成和演化来进行。研究发现，即使盐浓度相似，结晶动力学的差异也会影响蒸发质量损失率，盐壳的形成会增强蒸发速率。热成像还量化了盐壳可见的间歇性温度波动，这与表面同时发生的结晶、溶解和蒸发动力学过程有关。总的来说，这项研究关注的是微观尺度上的蒸发过程及其受盐结晶的影响，与大气环境遥感技术，例如空气质量监测、卫星观测和大气成分分析等，并没有直接关系。,[],Sahar Jannesarahmadi;Milad Aminzadeh;Rainer Helmig;Dani Or;Nima Shokri,Quantifying Salt Crystallization Impact on Evaporation Dynamics From Porous Surfaces,"We investigated the effects of salt crystallization on the dynamics of saline water evaporation in porous media. Water mass loss rates from sand columns supplied with NaCl solutions at three concentrations were monitored under controlled ambient conditions. The formation and evolution of salt crystals over sand surfaces were synchronously imaged optically and thermally. Despite identical experimental and ambient conditions, we observed distinct crystallization dynamics that affected evaporative mass loss rates for similar salt concentrations, highlighting high variability of crystallization and its impact on evaporation. We observed the enhancement of maximum evaporation rates by factors of 3 to 14 under our experimental conditions and attributed this enhancement to the formation and evolution of porous crystalized salts at the surface. Additionally, visible intermittent temperature fluctuations of the salt crust were quantified using thermal imagery attributed to the dynamic processes of crystallization, dissolution and evaporation occurring simultaneously at the surface."
10.1029/2024GL110871,False,Geophysical Research Letters,这篇论文利用波兰Żabińskie湖泊的生物化学纹层，重建了过去10800年春季和夏季温度变化。研究基于Ca/Ti比率与240年仪器观测的春季和夏季温度之间的显著相关性。结果显示了全新世期间主要的气候事件，例如全新世大暖期、8.2 ka事件、中世纪气候异常和小冰期。研究发现，全新世暖季温度存在一个8000年的低频下降趋势，这与夏季太阳辐射的下降有关。早全新世时期温度变化最大，这可能与当时温暖干燥的气候条件有关。最后，研究指出，过去90年的变暖速度非常异常，在全新世时期可能是前所未有的。总的来说，这项研究是利用湖泊沉积物记录重建过去气候变化的古气候学研究，与大气环境遥感技术，例如空气质量监测、卫星观测和大气成分分析等，并没有直接关系。,[],Paul D. Zander;Maurycy Żarczyński;Wojciech Tylmann;Hendrik Vogel;Martin Grosjean,Subdecadal Holocene Warm‐Season Temperature Variability in Central Europe Recorded by Biochemical Varves,"Paleoclimate data provide important information about the character of natural climate variability. However, records with sufficient length and resolution to resolve high‐frequency (decadal‐scale) variability across the Holocene are scarce. We present a 10,800‐year reconstruction of spring and summer temperature at three‐year resolution based on biochemical varves from Lake Żabińskie, Poland. The reconstruction is based on Ca/Ti ratio, which are significantly correlated with instrumental spring and summer temperature spanning 240 years. Major climate events of the Holocene period are represented in the reconstruction, including the Holocene Thermal Maximum, 8.2 ka Event, Medieval Climate Anomaly, and Little Ice Age. A low‐frequency 8,000‐year decreasing trend in warm‐season temperatures is driven by declining summer insolation. Temperature variability is highest during the early Holocene, likely related to warmer and drier conditions. The rate of warming during the past 90 years is extremely unusual, if not unprecedented for the Holocene, based on our reconstruction."
