doi,is_relevant,journal,explanation,topic_words,authors,title,abstract
10.1038/s41467-024-53833-x,False,Nature Communications,这篇论文研究的是利用钛化物电催化剂将硝酸盐电还原为氨，这是一种可持续的氨合成方法，旨在替代传统的Haber-Bosch工艺。文章的重点在于钛化物电催化剂的晶格氢转移机制，该机制通过晶格氢和活性氢之间的可逆平衡反应来增强电催化活性，从而提高氨的产率和法拉第效率。该研究属于电化学催化和材料科学领域，与大气环境遥感技术（例如空气质量监测、卫星观测和大气成分分析）并没有直接关系。,"['Ammonia', 'Nitrate', 'Electrocatalysis', 'Haber-Bosch process', 'Titanium hydride']",Jiawei Li;Wanqiang Yu;Haifeng Yuan;Yujie Wang;Yuke Chen;Di Jiang;Tong Wu;Kepeng Song;Xuchuan Jiang;Hong Liu;Riming Hu;Man Huang;Weijia Zhou,Lattice hydrogen transfer in titanium hydride enhances electrocatalytic nitrate to ammonia conversion,"The electrocatalytic reduction of nitrate to ammonia offers a sustainable alternative to the Haber-Bosch process. Here, the authors report a lattice hydrogen transfer mechanism that enhances electrocatalytic activity by enabling reversible equilibrium reactions between lattice and active hydrogen. 
 The electrocatalytic reduction of nitrate toward ammonia under mild conditions addresses many challenges of the Haber-Bosch reaction, providing a sustainable method for ammonia synthesis, yet it is limited by sluggish reduction kinetics and multiple competing reactions. Here, the titanium hydride electrocatalyst is synthesized by electrochemical hydrogenation reconstruction of titanium fiber paper, which achieves a large ammonia yield rate of 83.64 mg h−1 cm−2 and a high Faradaic efficiency of 99.11% with an ampere-level current density of 1.05 A cm−2 at −0.7 V versus the reversible hydrogen electrode. Electrochemical evaluation and kinetic studies indicate that the lattice hydrogen transfer from titanium hydride promotes the electrocatalytic performance of nitrate reduction reaction and the reversible equilibrium reaction between lattice hydrogen and activate hydrogen not only improves the electrocatalytic activity of nitrate reduction reaction but also demonstrates notable catalytic stability. These finding offers a universal design principle for metal hydrides as catalysts for effectively electrochemical ammonia production, highlighting their potential for sustainable ammonia synthesis. The electrocatalytic reduction of nitrate to ammonia offers a sustainable alternative to the Haber-Bosch process. Here, the authors report a lattice hydrogen transfer mechanism that enhances electrocatalytic activity by enabling reversible equilibrium reactions between lattice and active hydrogen."
10.1038/s41467-024-53758-5,False,Nature Communications,这篇研究论文主要关注雄激素受体（AR）介导的基因转录调控机制，特别是AR激活如何影响染色质环的动态变化以及基因表达。研究使用了多组学技术，包括mRNA、染色质可及性、转录因子结合、组蛋白修饰和染色质环等数据，构建了一个整合的调控网络，以阐明AR结合位点如何影响基因表达。研究发现，AR的结合会引起CREs（顺式调控元件）上表观遗传特征的顺序变化，但不会显著重构染色质环，而是增加预先存在的环与靶基因启动子的接触频率。基因表达与接触频率的变化密切相关。该研究提出了一个非平衡多增强子模型，解释了AR结合增强子对基因表达的影响具有异质性，并与它们与靶基因启动子的接触频率成正比。总而言之，这项研究揭示了AR介导的基因表达的分子机制，特别是急性雄激素刺激后AR的作用机制，为研究核受体介导的扰动提供了一个机制框架。它与大气环境遥感技术，如空气质量监测、卫星观测和大气成分分析等，没有任何关系。,[],Umut Berkay Altıntaş;Ji-Heui Seo;Claudia Giambartolomei;Dogancan Ozturan;Brad J. Fortunato;Geoffrey M. Nelson;Seth R. Goldman;Karen Adelman;Faraz Hach;Matthew L. Freedman;Nathan A. Lack,Decoding the epigenetics and chromatin loop dynamics of androgen receptor-mediated transcription,"Androgen receptor (AR) is the critical driver of nearly all prostate cancer. The authors show that AR activation causes specific pre-existing chromatin loops to increase contact frequency with target promoters and drive transcription. 
 Androgen receptor (AR)-mediated transcription plays a critical role in development and prostate cancer growth. AR drives gene expression by binding to thousands of cis-regulatory elements (CRE) that loop to hundreds of target promoters. With multiple CREs interacting with a single promoter, it remains unclear how individual AR bound CREs contribute to gene expression. To characterize the involvement of these CREs, we investigate the AR-driven epigenetic and chromosomal chromatin looping changes by generating a kinetic multi-omic dataset comprised of steady-state mRNA, chromatin accessibility, transcription factor binding, histone modifications, chromatin looping, and nascent RNA. Using an integrated regulatory network, we find that AR binding induces sequential changes in the epigenetic features at CREs, independent of gene expression. Further, we show that binding of AR does not result in a substantial rewiring of chromatin loops, but instead increases the contact frequency of pre-existing loops to target promoters. Our results show that gene expression strongly correlates to the changes in contact frequency. We then propose and experimentally validate an unbalanced multi-enhancer model where the impact on gene expression of AR-bound enhancers is heterogeneous, and is proportional to their contact frequency with target gene promoters. Overall, these findings provide insights into AR-mediated gene expression upon acute androgen simulation and develop a mechanistic framework to investigate nuclear receptor mediated perturbations. Androgen receptor (AR) is the critical driver of nearly all prostate cancer. The authors show that AR activation causes specific pre-existing chromatin loops to increase contact frequency with target promoters and drive transcription."
10.1038/s43247-024-01835-4,False,Communications Earth & Environment,这篇论文主要研究的是大气中二氧化碳浓度变化对北大西洋海平面变化的影响，特别是关注大西洋经向翻转环流(AMOC) 的作用。研究使用了理想化的二氧化碳浓度上升和下降实验，来模拟海平面的波动。结果表明，在二氧化碳浓度下降的情况下，北大西洋亚极地地区的海平面下降速度很快，这主要是由于AMOC的快速恢复以及由此引起的经向盐度输送增强。因此，该研究与大气环境遥感技术关系不大，它更侧重于气候变化和海洋动力学方面的研究。,"['atmospheric carbon dioxide', 'sea level', 'climate mitigation', 'Atlantic Meridional Overturning Circulation', 'ocean modeling']",Sunhee Wang;Yechul Shin;Ji-Hoon Oh;Jong-Seong Kug,Fast recovery of North Atlantic sea level in response to atmospheric carbon dioxide removal,"The Atlantic Meridional Overturning Circulation’s response to carbon dioxide forcing is crucial for rapid sea level fluctuations in the Subpolar North Atlantic, indicating potential for fast changes under climate mitigation scenarios, according to results from carbon dioxide ramp-up and -down experiments to investigate sea level variation. 
 Sea level rise due to anthropogenic warming threatens coastal environments and human societies, but its regional reversibility under successful climate mitigation efforts remains unclear. Here, we investigate sea level fluctuations in the Subpolar North Atlantic using idealized atmospheric carbon dioxide ramp-up and -down experiments. During the ramp-up period, the Subpolar North Atlantic experiences a faster sea level rise than the global mean, followed by a more rapid sea level decline over several dacades with decreasing carbon dioxide. These rapid sea level fluctuations are mainly driven by the response of the Atlantic Meridional Overturning Circulation to carbon dioxide forcing. The enhanced meridional salinity transport triggered by the rapid recovery of the Atlantic Meridional Overturning Circulation plays a crucial role in the regional sea level decline. Our study highlights the potential for pronounced sea level changes in the Subpolar North Atlantic and surrounding coastal areas under climate mitigation scenarios. The Atlantic Meridional Overturning Circulation’s response to carbon dioxide forcing is crucial for rapid sea level fluctuations in the Subpolar North Atlantic, indicating potential for fast changes under climate mitigation scenarios, according to results from carbon dioxide ramp-up and -down experiments to investigate sea level variation."
10.1038/s43247-024-01819-4,True,Communications Earth & Environment,这篇论文研究了气候变化对高空急流波动性的影响。研究发现，气候变化导致高空急流的南北向波动性增加，极端南移和北移的幅度增加速度快于平均速度。这种现象可以用一个“加速-加速”机制来解释，该机制将波动性与密度对比变化联系起来。研究还发现，北极海冰的减少并不能解释这种现象，反而会导致波动性减慢。研究结果表明，“加速-加速”机制可以解释高空急流波动性的变化，并揭示了气候变化下高空和中层波动性之间的相互作用。该研究使用了再分析数据，这与卫星遥感技术密切相关，因为再分析数据通常整合了来自各种卫星和地面观测站的数据。因此，这项研究与大气环境遥感技术密切相关。,"['Jet Stream', 'Atmospheric Dynamics', 'Climate Change', 'Satellite Meteorology', 'Reanalysis Data', 'Temperature', 'Density', 'Waviness']",Tiffany A. Shaw;Osamu Miyawaki;Hsing-Hung Chou;Russell Blackport,Fast-get-faster explains wavier upper-level jet stream under climate change,"Climate change causes upper-level jet stream waviness to increase in both hemispheres, with extreme southward and northward excursions increasing faster than the mean, according to results from a fast-get-faster mechanism connecting waviness to density contrast changes. 
 Earth’s upper-level jet streams primarily flow in the eastward direction. They often exhibit a north-south component or waviness connected to extreme weather at the surface. Recently the upper-level eastward jet stream was found to exhibit a fast-get-faster response under climate change explained by the impact of the nonlinear Clausius-Clapeyron relation on the latitudinal density contrast. Here we show the fast-get-faster mechanism also applies to the upper-level north-south jet stream wind and the longitudinal density contrast, implying increased waviness under climate change. Arctic Sea ice loss, which has been proposed as a driver of increased waviness, cannot explain the response. It leads to a fast-get-slower waviness response at all vertical levels. We demonstrate the fast-get-faster waviness signal has emerged in reanalysis data in the Southern Hemisphere but not yet in the Northern Hemisphere. The results show the fast-get-faster mechanism explains upper-level waviness changes and highlights a tug of war between upper- and mid-level waviness under climate change. Climate change causes upper-level jet stream waviness to increase in both hemispheres, with extreme southward and northward excursions increasing faster than the mean, according to results from a fast-get-faster mechanism connecting waviness to density contrast changes."
10.1038/s43247-024-01843-4,False,Communications Earth & Environment,这篇论文主要研究的是北极斯瓦尔巴特群岛以北的欧亚盆地西南部的晚新生代板内火山活动及其与热液喷口的联系。研究者利用地震反射剖面解释等地球物理数据，识别了大约1000万年前和260万年前形成的火山和热液喷口系统。文章认为这些岩浆特征是斯瓦尔巴特群岛北部地幔下方地震和热异常引起的板内火山活动的结果，与该区域其他火山活动和热液系统具有年龄和成因上的相关性。  研究与大气环境遥感技术，例如空气质量监测、卫星观测和大气成分分析等，没有直接关系。,[],Juan Camilo Meza-Cala;Alexander Minakov;Jan Inge Faleide;Mansour M. Abdelmalak;Grace E. Shephard;Rune Mattingsdal;Wolfram H. Geissler;Carmen Gaina,Late Cenozoic intraplate volcanism as a trigger for hydrothermal venting in the Arctic southwestern Eurasia Basin,"Interpretation of seismic reflection profiles in the southwestern Eurasia Basin and north of Svalbard support a regional mantle thermal anomaly as the source of intraplate Cenozoic magmatism and associated hydrothermal features in the Arctic 
 Intraplate volcanism has occurred for the last 35 million years within Northeast Atlantic and Arctic margins, including the western Barents Sea, Svalbard, and northern Greenland. Earlier studies have suggested that some of this volcanism might be sourced from nearby mid-ocean ridges. However, legacy data does not reveal correlations between the sporadic volcanism, despite comparable setting, ages, and compositions of basalts across the area. Here, we utilize a compilation of geophysical data to document late Cenozoic intraplate volcanism affecting the northeastern Yermak Plateau and southwestern Eurasia Basin located north of Svalbard. The identified seabed and subsurface features include volcanic (Mound-A) and hydrothermal vent systems (Tayrona Vent) formed approximately 10 and 2.6 million years ago, respectively. These intraplate volcanic products are coincident in age and origin with observed hydrothermal systems on Svalbard and Northeast Atlantic. We propose that these magmatic features are the result of intraplate volcanism associated with seismic and thermal anomalies in the mantle beneath northern Svalbard. Interpretation of seismic reflection profiles in the southwestern Eurasia Basin and north of Svalbard support a regional mantle thermal anomaly as the source of intraplate Cenozoic magmatism and associated hydrothermal features in the Arctic"
None,False,International Journal of Applied Earth Observation and Geoinformation,这篇论文的标题和摘要表明，其研究重点是全球主要河流三角洲的沿海湿地动态变化，时间跨度为1990年至2019年。研究内容与大气环境遥感技术，例如空气质量监测、卫星观测和大气成分分析等，并没有直接关系。论文可能使用了遥感技术来获取湿地变化的数据，但这只是辅助手段，而非研究的核心。核心研究在于分析湿地变化的时空格局、驱动因素以及生态环境效应等。,[],Yongchao Liu;Jialin Li;Xinxin Wang;Chao Sun;Peng Tian;Gaili He,Divergent dynamics of coastal wetlands in the world’s major river deltas during 1990–2019,
None,False,International Journal of Applied Earth Observation and Geoinformation,这篇论文的标题和摘要表明它关注的是地理问题问答系统GeoQA2及其评估基准。这与大气环境遥感技术（例如空气质量监测、卫星观测和大气成分分析）没有直接关系。GeoQA2更可能是一个基于地理信息和知识图谱的问答系统，用于处理与地理相关的查询，而不是处理大气数据。因此，论文主题与大气环境遥感技术无关。,[],Sergios-Anestis Kefalidis;Dharmen Punjani;Eleni Tsalapati;Konstantinos Plas;Maria-Aggeliki Pollali;Pierre Maret;Manolis Koubarakis,The question answering system GeoQA2 and a new benchmark for its evaluation,
None,False,International Journal of Applied Earth Observation and Geoinformation,这篇论文主要关注的是利用一种名为TDFC-RNNs的框架结合时间卷积注意力机制来预测北京平原的地表形变。它使用了InSAR技术（干涉合成孔径雷达）获取地表形变数据，然后利用深度学习模型进行预测。文章的重点在于地表形变的预测模型和方法，并没有直接涉及大气环境遥感技术，例如空气质量监测、卫星观测和大气成分分析等。因此，它与大气环境遥感技术关系不大。,[],Sheng Yao;Changfeng Jing;Xu He;Yi He;Lifeng Zhang,A TDFC-RNNs framework integrated temporal convolutional attention mechanism for InSAR surface deformation prediction: A case study in Beijing Plain,
None,False,International Journal of Applied Earth Observation and Geoinformation,这篇论文的标题和摘要表明，其研究重点是利用Sentinel-2卫星的多时相影像对中国地区的裸土进行二维分类。这属于遥感技术应用的范畴，但与大气环境遥感技术（例如空气质量监测、卫星观测和大气成分分析）并没有直接关系。研究中使用了遥感卫星数据，但目标是地表覆盖类型（裸土）的分类，而不是大气成分的分析。因此，该研究与大气环境遥感技术关联性较弱。,[],Jie Xue;Xianglin Zhang;Yuyang Huang;Songchao Chen;Lingju Dai;Xueyao Chen;Qiangyi Yu;Su Ye;Zhou Shi,A two-dimensional bare soil separation framework using multi-temporal Sentinel-2 images across China,
None,False,International Journal of Applied Earth Observation and Geoinformation,这篇论文的标题和摘要表明，其研究重点是中亚干旱地区陆地水储量的未来挑战。文章关注的是水资源，而不是大气环境。因此，它与大气环境遥感技术（例如空气质量监测、卫星观测和大气成分分析）的相关性较弱。论文可能涉及到一些遥感技术用于水资源监测，但这并非其核心研究内容。,[],Yuzhuo Peng;Hao Zhang;Zhuo Zhang;Bin Tang;Dongdong Shen;Gang Yin;Yaoming Li;Xi Chen;Zengyun Hu;Sulaimon Habib Nazrollozoda,Corrigendum to “Future challenges of terrestrial water storage over the arid regions of Central Asia” [Int. J. Appl. Earth Observ. Geoinf. 132 (2024) 104026],
None,False,International Journal of Applied Earth Observation and Geoinformation,这篇论文的标题和摘要表明，它关注的是基于传感器融合和置信度更新的自适应多目标跟踪。这是一种信号处理和计算机视觉领域的技术，用于追踪多个移动目标。它与大气环境遥感技术，例如空气质量监测、卫星观测和大气成分分析，并没有直接关系。论文中提到的传感器融合可能包含各种传感器，但并不局限于大气遥感相关的传感器。因此，该研究与大气环境遥感技术关联性较弱。,[],Junting Liu;Deer Liu;Weizhen Ji;Chengfeng Cai;Zhen Liu,Corrigendum to “Adaptive multi-object tracking based on sensors fusion with confidence updating” [Inter. J. Appl. Earth Obs. Geoinform. 125 (2023) 103577],
None,True,International Journal of Applied Earth Observation and Geoinformation,这篇论文的标题和摘要表明其与大气环境遥感技术密切相关。文章修正了先前一篇关于利用泥炭火灾指数识别泥炭火灾区域（区别于其他野火）的研究论文。这直接关系到利用遥感技术（例如卫星观测）监测大气成分，特别是识别和监测泥炭火灾导致的大气污染。泥炭火灾会释放大量的烟雾和有害气体，影响空气质量，因此，利用遥感技术进行泥炭火灾的快速准确的检测，对于空气质量监测和环境保护至关重要。该研究修正了先前方法中的不足，提高了识别泥炭火灾的精度，这对于改善大气环境遥感技术的应用具有积极意义。,"['air quality', 'satellite observation', 'fire detection', 'peat fire', 'atmospheric composition', 'remote sensing']",Maria Medvedeva;Victor Itkin;Andrey Sirin,Corrigendum to “Identification of peat-fire-burnt areas among other wildfires using the peat fire index” [Int. J. Appl. Earth Observ. Geoinf. 132 (2024) 103973],
10.1016/j.atmosenv.2024.120914,True,Atmospheric Environment,这篇研究论文密切关注中国东北部城市哈尔滨在2018年至2022年期间，燃放烟花爆竹对空气质量的影响。文章利用地面实测数据，分析了烟花爆竹燃放期间空气中PM2.5及相关成分（例如：水溶性钾离子、氯离子、硫酸盐、硝酸盐和有机物）的浓度变化。研究发现，尽管烟花爆竹受到禁令限制，但其对空气质量的影响依然显著，并且逐年变化。具体而言，钾离子和氯离子的富集比逐年增加，而硫酸盐的富集比有所下降，硝酸盐和有机物的贡献则在2022年变得微不足道。这与环保型烟花的推广应用相符。研究结果表明，通过改进烟花制造技术，可以大幅减少烟花燃放造成的空气污染，为重新评估烟花禁令政策提供了依据。该研究属于大气环境地面监测范畴，主要关注的是空气质量和特定气溶胶成分的变化，而非卫星遥感技术。,"['Air quality monitoring', 'PM2.5', 'Aerosols', 'Potassium (K+)', 'Chloride (Cl−)', 'Sulfate', 'Nitrate', 'Organic matter', 'Water-soluble ions', 'Fireworks', 'Ground-based measurements', 'Air pollution', 'Chinese New Year']",Yuan Cheng;Ying-jie Zhong;Jiu-meng Liu;Xu-bing Cao;Ke-bin He,Significant annual variations of firework-impacted aerosols in Northeast China: Implications for rethinking the firework bans,"•Firework-emitted aerosols changed dramatically during recent years in Harbin. •Firework-induced enrichments in K+and Cl−increased across years. •Firework contributions to organic matter and nitrate became negligible in 2022. •The relative importance of fireworks compared to other PM2.5sources decreased. •Green fireworks provide solution to balance air quality concerns and public demand. 
 Fireworks are banned in many Chinese cities but never eliminated, reflecting strong public demand on this traditional activity for festival celebrations. On the other hand, the assessment of firework contributions to air pollution remains vague, raising concerns on the necessity of the mandatory bans. Here we investigated the characteristics of firework episodes in a megacity in Northeast China, based on field campaigns conducted in four successive winters during 2018–2022. Although prohibited, the firework influences remained evident during the Chinese New Year periods, as suggested by the enhancements of water-soluble potassium (K+). In addition, significant annual variations were identified for the firework episodes, with the following features observed. First, the firework-induced enrichment ratios of K+ and chloride exhibited increasing trends across years, climbing from 4.4 to 8.6 and from 1.7 to 2.9, respectively. Second, the enrichment ratio of sulfate dropped from 2.8 to 1.6, indicating that the firework contributions to sulfate decreased but remained considerable. Third, fireworks turned into an unimportant source for organic carbon and nitrate in the most recent winter of 2021–2022, with enrichment ratios of ∼1 for both species. Fourth, the firework-driven increases in fine particle concentration were as high as ∼100% for the two winters during 2019–2021, whereas the increase dropped sharply to ∼30% for 2021–2022. These variations were in line with the promotion of environmentally friendly fireworks. Our results indicated that the air pollution caused by fireworks could be reduced substantially by advanced manufacturing technologies and thus it is time to rethink the firework bans."
