doi,is_relevant,journal,explanation,topic_words,authors,title,abstract
10.1038/s41467-024-52291-9,False,Nature Communications,该研究主要关注的是利用光催化剂将二氧化碳转化为乙酸，这是一种化学合成方法，与大气环境遥感技术关系不大。研究中提到的金纳米颗粒和单原子修饰的二硫化钼材料是催化剂，用于促进二氧化碳的光催化还原反应，最终生成乙酸。该研究的重点在于材料设计和催化性能的优化，而不是大气环境监测或遥感技术。,"['CO2 photoreduction', 'CH3COOH', 'photocatalyst', 'Au nanoparticles', 'single atoms', 'MoS2']",Cai Chen;Chunyin Ye;Xinglei Zhao;Yizhen Zhang;Ruilong Li;Qun Zhang;Hui Zhang;Yuen Wu,Supported Au single atoms and nanoparticles on MoS<sub>2</sub> for highly selective CO<sub>2</sub>-to-CH<sub>3</sub>COOH photoreduction,"Reducing CO2 to CH3COOH using visible and near-infrared light is challenging. Here, Wu and Zhang et al. incorporate Au nanoparticles and single atoms into Mo-edge-rich MoS2 to provide a pathway to overcome limitations and boost productivity. 
 Effectively controlling the selective conversion of CO2 photoreduction to C2 products presents a significant challenge. Here, we develop a heterojunction photocatalyst by controllably implanting Au nanoparticles and single atoms into unsaturated Mo atoms of edge-rich MoS2, denoted as Aun/Au1-CMS. Photoreduction of CO2 results in the production of CH3COOH with a selectivity of 86.4%, which represents a 6.4-fold increase compared to samples lacking single atoms, and the overall selectivity for C2 products is 95.1%. Furthermore, the yield of CH3COOH is 22.4 times higher compared to samples containing single atoms and without nanoparticles. Optical experiments demonstrate that the single atoms domains can effectively capture photoexcited electrons by the Au nanoparticles, or the local electric field generated by the nanoparticles promotes the transfer of photogenerated electrons in MoS2 to Au single atoms, prolonging the relaxation time of photogenerated electrons. Mechanistic investigations reveal that the orbital coupling of Au5d and Mo4d strengthens the oxygen affinity of Mo and carbon affinity of Au. The hybridized orbitals reduce energy splitting levels of CO molecular orbitals, aiding C–C coupling. Moreover, the Mo−Au dual-site stabilize the crucial oxygen-associated intermediate *CH2CO, thereby enhancing the selectivity towards CH3COOH. The cross-scale heterojunctions provide an effective strategy to simultaneously address the kinetical and thermodynamical limitations of CO2-to-CH3COOH conversion. Reducing CO2 to CH3COOH using visible and near-infrared light is challenging. Here, Wu and Zhang et al. incorporate Au nanoparticles and single atoms into Mo-edge-rich MoS2 to provide a pathway to overcome limitations and boost productivity."
10.1038/s41467-024-52131-w,False,Nature Communications,这篇论文主要研究的是电化学反应中金属表面离子特异性水结构的影响，重点关注了碱金属阳离子对金表面二维水网络的改变，以及这种改变对氢气析出反应动力学和效率的影响。论文使用了扫描隧道显微镜和非接触式原子力显微镜等技术，观察了不同碱金属阳离子在带电金表面的水层结构，并发现Li+ 阳离子与金表面之间形成了冰状水层，而K+ 和Cs+ 阳离子则直接接触金表面。这些发现对理解电化学过程中的离子特异性水结构以及观察者离子在电化学过程中的关键作用提供了新的见解。论文与大气环境遥感技术关系不大，因为其研究对象是电化学反应中的水结构，而非大气中的气体成分或气溶胶。,[],Ye Tian;Botao Huang;Yizhi Song;Yirui Zhang;Dong Guan;Jiani Hong;Duanyun Cao;Enge Wang;Limei Xu;Yang Shao-Horn;Ying Jiang,Effect of ion-specific water structures at metal surfaces on hydrogen production,"Water structures at the electrolyte and electrode interfaces are crucial for electrochemical reactions. Here, the authors report that alkali metal cations can modify two-dimensional water networks at charged surfaces, impacting both reaction kinetics and efficiency. 
 Water structures at electrolyte/electrode interfaces play a crucial role in determining the selectivity and kinetics of electrochemical reactions. Despite extensive experimental and theoretical efforts, atomic-level details of ion-specific water structures on metal surfaces remain unclear. Here we show, using scanning tunneling microscopy and noncontact atomic force microscopy, that we can visualize water layers containing alkali metal cations on a charged Au(111) surface with atomic resolution. Our results reveal that Li+ cations are elevated from the surface, facilitating the formation of an ice-like water layer between the Li+ cations and the surface. In contrast, K+ and Cs+ cations are in direct contact with the surface. We observe that the water network structure transitions from a hexagonal arrangement with Li+ to a distorted hydrogen-bonding configuration with Cs+. These observations are consistent with surface-enhanced infrared absorption spectroscopy data and suggest that alkali metal cations significantly impact hydrogen evolution reaction kinetics and efficiency. Our findings provide insights into ion-specific water structures on metal surfaces and underscore the critical role of spectator ions in electrochemical processes. Water structures at the electrolyte and electrode interfaces are crucial for electrochemical reactions. Here, the authors report that alkali metal cations can modify two-dimensional water networks at charged surfaces, impacting both reaction kinetics and efficiency."
10.1038/s41467-024-52162-3,False,Nature Communications,该研究主要关注的是利用碳氮化物作为金属自由光催化剂，通过光催化反应生成过氧化氢（H2O2）。研究重点在于揭示碳氮化物中双键共轭羰基结构作为活性位点，促进氧气光还原生成过氧化氢的机制。该研究与大气环境遥感技术关系不大，因为它主要集中在材料合成和光催化反应方面，而非大气成分分析或卫星观测。,"['photocatalysis', 'H2O2 production', 'carbon nitrides', 'conjugated carbonyl sites']",Tiwei He;Hongchao Tang;Jie Wu;Jiaxuan Wang;Mengling Zhang;Cheng Lu;Hui Huang;Jun Zhong;Tao Cheng;Yang Liu;Zhenhui Kang,A metal-free cascaded process for efficient H<sub>2</sub>O<sub>2</sub> photoproduction using conjugated carbonyl sites,"Elucidating active sites and reaction pathways is an important goal for understanding catalytic reaction mechanisms. Here, the authors report the key role of conjugated carbonyl sites in carbon nitrides for photocatalytic H2O2 production. 
 Carbon-based metal-free catalysts are promising green catalysts for photocatalysis and electrocatalysis due to their low cost and environmental friendliness. A key challenge in utilizing these catalysts is identifying their active sites, given their poor crystallinity and complex structures. Here we demonstrate the key structure of the double-bonded conjugated carbon group as a metal-free active site, enabling efficient O2 photoreduction to H2O2 through a cascaded water oxidation − O2 reduction process. Using ethylenediaminetetraacetic acid as a precursor, we synthesized various carbon-based photocatalysts and analyzed their structural evolution. Under the polymerization conditions of 260 °C to 400 °C, an N-ethyl-2-piperazinone-like structure was formed on the surface of the catalyst, resulting in high photocatalytic H2O2 photoproduction (2884.7 μmol g−1h−1) under visible light. A series of control experiments and theoretical calculations further confirm that the double-bond conjugated carbonyl structure is the key and universal feature of the active site of metal-free photocatalysts. Elucidating active sites and reaction pathways is an important goal for understanding catalytic reaction mechanisms. Here, the authors report the key role of conjugated carbonyl sites in carbon nitrides for photocatalytic H2O2 production."
10.1038/s41612-024-00754-7,False,npj Climate and Atmospheric Science,这篇论文主要研究的是夏季日本海海面温度的可预测性和预测技巧。它利用观测数据和GFDL的SPEAR季节预测系统，分析了日本海海面温度与前一个冬季的空气-海洋耦合之间的关系，并发现日本海海面温度在夏季到秋季可以提前8-9个月预测。论文还探讨了冬季大气环流对日本海海面温度的影响，以及海洋平流在夏季异常海面温度形成中的作用。总体而言，这篇论文关注的是海洋环境变化，特别是日本海海面温度的季节性变化，与大气环境遥感技术关系不大。,"['Sea Surface Temperature', 'SST', 'Ocean Heatwaves', 'Seasonal Forecast', 'Atmospheric Circulation', 'Ekman Transport', 'Barents Sea', 'East China Sea', 'East Asian Rainy Season']",Youngji Joh;SeonJu Lee;Young-Gyu Park;Thomas L. Delworth;Gyundo Pak;Liwei Jia;William F. Cooke;Colleen McHugh;Young-Ho Kim;Hyung-Gyu Lim,Predictability and prediction skill of summertime East/Japan Sea surface temperature events,"Predictability and prediction skill of summertime East/Japan Sea surface temperature events 
 The East/Japan Sea (EJS), a marginal sea of the Northwestern Pacific, is one of the ocean regions showing the most rapid warming and greatest increases in ocean heatwaves over the last several decades. Predictability and skillful prediction of the summer season EJS variability are crucial, given the increasing severity of ocean temperature events impacting fisheries and reinforcing climate conditions like the East Asian rainy season, which in turn affects adjacent high-population density areas over East Asia. We use observations and the Geophysical Fluid Dynamics Laboratory (GFDL) Seamless System for Prediction and Earth System Research (SPEAR) seasonal forecast system to investigate the summertime EJS Sea Surface Temperature (SST) predictability and prediction skill. The observations and seasonal prediction system show that the summer season EJS SST can be closely linked to the previous winter air-sea coupling and predictable 8–9 months in advance. The SPEAR seasonal prediction system demonstrates skillful forecast of EJS SST events from summer to late fall, with added skill for long-lead forecasts initialized in winter. We find that winter large-scale atmospheric circulations linked to Barents Sea variability can induce persistent surface wind anomalies and corresponding northward Ekman heat transport over the East China Sea. The ocean advection anomalies that enter the EJS in prior seasons appear to play a role in developing anomalous SST during summer, along with instantaneous atmospheric forcing, as the source of long-lead predictability. Our findings provide potential applications of large-scale ocean-atmosphere interactions in understanding and predicting seasonal variability of East Asian marginal seas."
10.1038/s41612-024-00741-y,False,npj Climate and Atmospheric Science,这篇论文主要研究的是利用Transformer模型结合热量收支动力学来预测厄尔尼诺-南方涛动（ENSO）现象。论文中提到了利用模型预测赤道太平洋海表温度（SST）以及Nino 3.4指数，并分析了模型对2015年厄尔尼诺和2021年拉尼娜事件的预测结果。论文重点在于模型的解释性和物理一致性，而不是大气环境遥感技术。,"['sea surface temperature', 'ENSO', 'Niño 3.4 index', 'equatorial Pacific', 'thermocline feedback', 'zonal advection feedback', 'easterlies']",Bin Mu;Yuehan Cui;Shijin Yuan;Bo Qin,Incorporating heat budget dynamics in a Transformer-based deep learning model for skillful ENSO prediction,"Incorporating heat budget dynamics in a Transformer-based deep learning model for skillful ENSO prediction 
 While deep learning models have shown promising capabilities in ENSO prediction, their inherent black-box nature often leads to a lack of physical consistency and interpretability. Here, we introduce ENSO-PhyNet, a Transformer-based model for ENSO prediction, which incorporates heat budget dynamical processes through self-attention computations. The model predicts sea surface temperature (SST) in the equatorial Pacific and achieves skillful predictions of the Niño 3.4 index with a lead time of up to 22 months. The self-attention maps reveal how the model makes predictions by focusing on specific processes in certain regions. Case analyses of recent El Niño and La Niña events underscore the impact of thermocline feedback and zonal advection feedback on the warming of the 2015 event, as well as the crucial role of anomalous easterlies in the emergence of the second-year La Niña in 2021. These findings demonstrate the model’s interpretability and its ability to identify signals that are physically consistent with the development of ENSO events."
10.1038/s41612-024-00747-6,True,npj Climate and Atmospheric Science,该研究论文探讨了夜间化学反应对季节性二次有机气溶胶形成的重要性。研究发现，生物质燃烧排放物的夜间氧化作用在秋季和冬季可占总二次有机气溶胶生成量的近一半。研究利用地面观测数据区分了不同季节的夜间和白天二次有机气溶胶的特征，并发现现有化学传输模型在模拟生物质燃烧排放物及其夜间氧化方面存在不足。该研究强调了近地面夜间二次有机气溶胶生成的重要性，并提出了利用地面观测数据区分夜间二次有机气溶胶的方法，为模型优化提供了建议。该研究对于理解和预测夜间二次有机气溶胶的形成具有重要意义。,"['air quality monitoring', 'satellite observations', 'atmospheric composition analysis', 'secondary organic aerosol', 'NO3 oxidation', 'biomass burning', 'aerosol measurements', 'chemistry transport model']",Lu Liu;Thorsten Hohaus;Philipp Franke;Anne C. Lange;Ralf Tillmann;Hendrik Fuchs;Zhaofeng Tan;Franz Rohrer;Vlassis Karydis;Quanfu He;Vaishali Vardhan;Stefanie Andres;Birger Bohn;Frank Holland;Benjamin Winter;Sergej Wedel;Anna Novelli;Andreas Hofzumahaus;Andreas Wahner;Astrid Kiendler-Scharr,Observational evidence reveals the significance of nocturnal chemistry in seasonal secondary organic aerosol formation,"Observational evidence reveals the significance of nocturnal chemistry in seasonal secondary organic aerosol formation 
 Oxidized Organic Aerosol (OOA), a major component of fine atmospheric particles, impacts climate and human health. Previous experiments and atmospheric models emphasize the importance of nocturnal OOA formation from NO3· oxidation of biogenic VOCs. This seasonal study extends the understanding by showing that nocturnal oxidation of biomass-burning emissions can account for up to half of total OOA production in fall and winter. It is the first to distinguish nocturnal OOA characteristics from daytime OOA across all seasons using bulk aerosol measurements. Summer observations of nocturnal OOA align well with regional chemistry transport model predictions, but discrepancies in other seasons reveal a common model deficiency in representing biomass-burning emissions and their nocturnal oxidation. This study underscores the significance of near-ground nocturnal OOA production, proposes a method to differentiate it using bulk aerosol measurements, and suggests model optimization strategies. These findings enhance the understanding and prediction of nighttime OOA formation."
10.1016/j.rse.2024.114393,True,Remote Sensing of Environment,该研究提出了一种名为WRFM的框架，通过整合天气预报模型（WRF）和MODIS卫星数据，利用形态学技术来估计1公里空间分辨率和每小时时间分辨率的地表温度（LST）。研究表明，WRFM框架能够有效地减少WRF模拟中LST的偏差，并能更准确地捕捉到地表热岛效应的时空变化。,"['Land surface temperature (LST)', 'satellite observations', 'MODIS', 'weather modeling', 'WRF', 'urban heat island (UHI)']",Wei Chen;Yuyu Zhou;Ulrike Passe;Tao Zhang;Chenghao Wang;Ghassem R. Asrar;Qi Li;Huidong Li,Improving estimation of diurnal land surface temperatures by integrating weather modeling with satellite observations,"•A WRFM framework was developed for generating hourly LST at 1 km resolution. •The bias in magnitude of LST was reduced by the WRFM from 4.23 K to 2.8 K. •The hourly pattern of surface UHI can be captured by LST estimated from the WRFM. •The improved LST can reveal more accurate information of thermal environments. 
 Land surface temperature (LST) derived from satellite observations and weather modeling has been widely used for investigating Earth surface-atmosphere energy exchange and radiation budget. However, satellite-derived LST has a trade-off between spatial and temporal resolutions and missing observations caused by clouds, while there are limitations such as potential bias and expensive computation in model calibration and simulation for weather modeling. To mitigate those limitations, we proposed a WRFM framework to estimate LST at a spatial resolution of 1 km and temporal resolution of an hour by integrating the Weather Research and Forecasting (WRF) model and MODIS satellite data using the morphing technique. We tested the framework in eight counties, Iowa, USA, including urban and rural areas, to generate hourly LSTs from June 1st to August 31st, 2019, at a 1 km resolution. Upon evaluation with in-situ LST measurements, our WRFM framework has demonstrated its ability to capture hourly LSTs under both clear and cloudy conditions, with a root mean square error (RMSE) of 2.63 K and 3.75 K, respectively. Additionally, the assessment with satellite LST observations has shown that the WRFM framework can effectively reduce the bias magnitude in LST from the WRF simulation, resulting in a reduction of the average RMSE over the study area from 4.34 K (daytime) and 4.12 K (nighttime) to 2.89 K (daytime) and 2.75 K (nighttime), respectively, while still capturing the hourly patterns of LST. Overall, the WRFM is effective in integrating the complementary advantages of satellite observations and weather modeling and can generate LSTs with high spatiotemporal resolutions in areas with complex landscapes (e.g., urban)."
10.1016/j.jag.2024.104105,False,International Journal of Applied Earth Observation and Geoinformation,这篇论文主要关注的是三维点云语义分割，利用图神经网络（Graph Transformer）来提升对结构化物体（例如建筑物）的识别精度。论文中提到的技术和应用场景主要集中在计算机视觉领域，例如三维场景重建、自动驾驶等，与大气环境遥感技术关系不大。,[],Ting Han;Yiping Chen;Jin Ma;Xiaoxue Liu;Wuming Zhang;Xinchang Zhang;Huajuan Wang,Point cloud semantic segmentation with adaptive spatial structure graph transformer,"•Graph Transformer optimizes the structure relationships of the point cloud. •Graph attention improves inter-class discriminability. •The virtual nodes promote fine-grained understanding. 
 With the rapid development of LiDAR and artificial intelligence technologies, 3D point cloud semantic segmentation has become a highlight research topic. This technology is able to significantly enhance the capabilities of building information modeling, navigation and environmental perception. However, current deep learning-based methods primarily rely on voxelization or multi-layer convolution for feature extraction. These methods often face challenges in effectively differentiating between homogeneous objects or structurally adherent targets in complex real-world scenes. To this end, we propose a Graph Transformer point cloud semantic segmentation network (ASGFormer) tailored for structurally adherent objects. Firstly, ASGFormer combines Graph and Transformer to promote global correlation understanding in the graph. Secondly, spatial index and position embedding are constructed based on distance relationships and feature differences. Through a learnable mechanism, the structural weights between points are dynamically adjusted, achieving adaptive spatial structure within the graph. Finally, dummy nodes are introduced to facilitate global information storage and transmission between layers, effectively addressing the issue of information loss at the terminal nodes of the graph. Comprehensive experiments are conducted on the various real-world 3D point cloud datasets, analyzing the effectiveness of proposed ASGFormer through qualitative and quantitative evaluations. ASGFormer outperforms existing approaches with of 91.3% for OA, 78.0% for mAcc, and 72.3% for mIoU on S3DIS dataset. Moreover, ASGFormer achieves 72.8%, 45.5%, 81.6%, 70.1% mIoU on ScanNet, City-Facade, Toronto 3D and Semantic KITTI dataset, respectively. Notably, the proposed method demonstrates effective differentiation of homogeneous structurally adherent objects, further contributing to the intelligent perception and modeling of complex scenes."
10.1016/j.jag.2024.104131,False,International Journal of Applied Earth Observation and Geoinformation,这篇论文主要研究的是利用预训练的扩散模型来防御遥感图像中的对抗样本攻击，它关注的是遥感图像的场景分类和语义分割任务，并没有直接涉及大气环境遥感技术，比如空气质量监测、卫星观测和大气成分分析等。,"['remote sensing', 'scene classification', 'semantic segmentation']",Weikang Yu;Yonghao Xu;Pedram Ghamisi,Universal adversarial defense in remote sensing based on pre-trained denoising diffusion models,"•Introduces UAD-RS for universal adversarial defense on RS adversarial examples. •Mitigates adversarial perturbations with unified pre-trained diffusion models. •Implements an ANLS mechanism optimizing noise levels with FID ranking. •Demonstrates effectiveness for scene classification and semantic segmentation. •Outperforms SOTA approaches defending against seven adversarial perturbations. 
 Deep neural networks (DNNs) have risen to prominence as key solutions in numerous AI applications for earth observation (AI4EO). However, their susceptibility to adversarial examples poses a critical challenge, compromising the reliability of AI4EO algorithms. This paper presents a novel Universal Adversarial Defense approach in Remote Sensing Imagery (UAD-RS), leveraging pre-trained diffusion models to protect DNNs against various adversarial examples exhibiting heterogeneous adversarial patterns. Specifically, a universal adversarial purification framework is developed utilizing pre-trained diffusion models to mitigate adversarial perturbations through the introduction of Gaussian noise and subsequent purification of the perturbations from adversarial examples. Additionally, an Adaptive Noise Level Selection (ANLS) mechanism is introduced to determine the optimal noise level for the purification framework with a task-guided Fréchet Inception Distance (FID) ranking strategy, thereby enhancing purification performance. Consequently, only a single pre-trained diffusion model is required for purifying various adversarial examples with heterogeneous adversarial patterns across each dataset, significantly reducing training efforts for multiple attack settings while maintaining high performance without prior knowledge of adversarial perturbations. Experimental results on four heterogeneous RS datasets, focusing on scene classification and semantic segmentation, demonstrate that UAD-RS outperforms state-of-the-art adversarial purification approaches, providing universal defense against seven commonly encountered adversarial perturbations. Codes and the pre-trained models are available online (https://github.com/EricYu97/UAD-RS)."
None,False,International Journal of Applied Earth Observation and Geoinformation,该论文主要研究的是利用无人机结构光三维重建技术来估计废弃橙树的生物量，与大气环境遥感技术关系不大。,"['UAV', 'SFM', '3D points', 'biomass', 'orange trees']",J. Estornell;J. Martí;E. Hadas;I. López-Cortés;B. Velázquez-Martí;A. Fernández-Sarría,Corrigendum to “Biomass estimation of abandoned orange trees using UAV-SFM 3D points” [Int. J. Appl. Earth Obs. Geoinf. 130 (2024) 103931],
