doi,is_relevant,journal,explanation,topic_words,authors,title,abstract
10.1038/s41586-024-07990-0,False,Nature,这篇论文主要研究植物中一种名为FREE1的ESCRT蛋白，它可以形成液态凝聚物并与膜结合，从而驱动内腔囊泡的形成。研究发现，凝聚物与膜的相互作用可以产生表面张力，并导致膜颈部的断裂，形成新的囊泡。这项研究揭示了凝聚物介导的膜断裂机制，这是一种新的膜断裂机制，它依赖于凝聚物的物理化学性质，并可能参与多种细胞运输过程。,[],Yanning Wang;Shulin Li;Marcel Mokbel;Alexander I. May;Zizhen Liang;Yonglun Zeng;Weiqi Wang;Honghong Zhang;Feifei Yu;Katharina Sporbeck;Liwen Jiang;Sebastian Aland;Jaime Agudo-Canalejo;Roland L. Knorr;Xiaofeng Fang,Biomolecular condensates mediate bending and scission of endosome membranes,"Plant ESCRT component FREE1 forms liquid-like condensates that associate with membranes to drive intraluminal vesicle formation. 
 Multivesicular bodies are key endosomal compartments implicated in cellular quality control through their degradation of membrane-bound cargo proteins1–3. The ATP-consuming ESCRT protein machinery mediates the capture and engulfment of membrane-bound cargo proteins through invagination and scission of multivesicular-body membranes to form intraluminal vesicles4,5. Here we report that the plant ESCRT component FREE16 forms liquid-like condensates that associate with membranes to drive intraluminal vesicle formation. We use a minimal physical model, reconstitution experiments and in silico simulations to identify the dynamics of this process and describe intermediate morphologies of nascent intraluminal vesicles. Furthermore, we find that condensate-wetting-induced line tension forces and membrane asymmetries are sufficient to mediate scission of the membrane neck without the ESCRT protein machinery or ATP consumption. Genetic manipulation of the ESCRT pathway in several eukaryotes provides additional evidence for condensate-mediated membrane scission in vivo. We find that the interplay between condensate and machinery-mediated scission mechanisms is indispensable for osmotic stress tolerance in plants. We propose that condensate-mediated scission represents a previously undescribed scission mechanism that depends on the physicomolecular properties of the condensate and is involved in a range of trafficking processes. More generally, FREE1 condensate-mediated membrane scission in multivesicular-body biogenesis highlights the fundamental role of wetting in intracellular dynamics and organization. Plant ESCRT component FREE1 forms liquid-like condensates that associate with membranes to drive intraluminal vesicle formation."
10.1038/s41586-024-08021-8,False,Nature,这篇论文研究的是海马体 CA1 神经元中行为时间尺度可塑性（BTSP）的分子机制，重点关注了 CaMKII 在 BTSP 诱导过程中的作用。研究发现，BTSP 诱导会导致树突状、延迟和随机的 CaMKII 活化，这种活化依赖于突触前和突触后活动，并与 Ca2+ 流入和平台电位有关。研究还发现，IP3 依赖的细胞内 Ca2+ 释放促进了 DDSC 和 BTSP。这些发现表明，非突触特异性 CaMKII 活化在 BTSP 过程中提供了一个具有数十秒时间窗口的指示性信号。,[],Anant Jain;Yoshihisa Nakahata;Tristano Pancani;Tetsuya Watabe;Polina Rusina;Kelly South;Kengo Adachi;Long Yan;Noriko Simorowski;Hiro Furukawa;Ryohei Yasuda,"Dendritic, delayed, stochastic CaMKII activation in behavioural time scale plasticity","Induction of behavioural time scale plasticity leads to dendritic, delayed and stochastic Ca2+/calmodulin-dependent kinase II activation, findings that clarify the mechanisms that underlie place cell formation. 
 Behavioural time scale plasticity (BTSP) is non-Hebbian plasticity induced by integrating presynaptic and postsynaptic components separated by a behaviourally relevant time scale (seconds)1. BTSP in hippocampal CA1 neurons underlies place cell formation. However, the molecular mechanisms that enable synapse-specific plasticity on a behavioural time scale are unknown. Here we show that BTSP can be induced in a single dendritic spine using two-photon glutamate uncaging paired with postsynaptic current injection temporally separated by a behavioural time scale. Using an improved Ca2+/calmodulin-dependent kinase II (CaMKII) sensor, we did not detect CaMKII activation during this BTSP induction. Instead, we observed dendritic, delayed and stochastic CaMKII activation (DDSC) associated with Ca2+ influx and plateau potentials 10–100 s after BTSP induction. DDSC required both presynaptic and postsynaptic activity, which suggests that CaMKII can integrate these two signals. Also, optogenetically blocking CaMKII 15–30 s after the BTSP protocol inhibited synaptic potentiation, which indicated that DDSC is an essential mechanism of BTSP. IP3-dependent intracellular Ca2+ release facilitated both DDSC and BTSP. Thus, our study suggests that non-synapse-specific CaMKII activation provides an instructive signal with an extensive time window over tens of seconds during BTSP. Induction of behavioural time scale plasticity leads to dendritic, delayed and stochastic Ca2+/calmodulin-dependent kinase II activation, findings that clarify the mechanisms that underlie place cell formation."
10.1038/s41586-024-07955-3,False,Nature,这篇研究主要关注膀胱癌的演化机制，研究人员通过对患者肿瘤样本进行全基因组测序，发现APOBEC3和化疗是两个关键的诱变因素，并观察到染色体外DNA (ecDNA) 形成的结构变异在驱动膀胱癌耐药性方面发挥了重要作用。研究还发现，大多数膀胱癌中的CCND1扩增发生在环状ecDNA形成的结构变异中，ecDNA的形成和复杂化促进了耐药性的发展。这项研究揭示了膀胱癌演化的基本机制，对治疗具有重要意义。,[],Duy D. Nguyen;William F. Hooper;Weisi Liu;Timothy R. Chu;Heather Geiger;Jennifer M. Shelton;Minita Shah;Zoe R. Goldstein;Lara Winterkorn;Adrienne Helland;Michael Sigouros;Jyothi Manohar;Jenna Moyer;Majd Al Assaad;Alissa Semaan;Sandra Cohen;Florencia Madorsky Rowdo;David Wilkes;Mohamed Osman;Rahul R. Singh;Andrea Sboner;Henkel L. Valentine;Phillip Abbosh;Scott T. Tagawa;David M. Nanus;Jones T. Nauseef;Cora N. Sternberg;Ana M. Molina;Douglas Scherr;Giorgio Inghirami;Juan Miguel Mosquera;Olivier Elemento;Nicolas Robine;Bishoy M. Faltas,The interplay of mutagenesis and ecDNA shapes urothelial cancer evolution,"Whole-genome sequencing of matched serial tumours from patients identifies two key mutagenic factors (APOBEC3 and chemotherapy) and extrachromosomal DNA-forming structural variants that drive treatment resistance in urothelial cancer. 
 Advanced urothelial cancer is a frequently lethal disease characterized by marked genetic heterogeneity1. In this study, we investigated the evolution of genomic signatures caused by endogenous and external mutagenic processes and their interplay with complex structural variants (SVs). We superimposed mutational signatures and phylogenetic analyses of matched serial tumours from patients with urothelial cancer to define the evolutionary dynamics of these processes. We show that APOBEC3-induced mutations are clonal and early, whereas chemotherapy induces mutational bursts of hundreds of late subclonal mutations. Using a genome graph computational tool2, we observed frequent high copy-number circular amplicons characteristic of extrachromosomal DNA (ecDNA)-forming SVs. We characterized the distinct temporal patterns of APOBEC3-induced and chemotherapy-induced mutations within ecDNA-forming SVs, gaining new insights into the timing of these mutagenic processes relative to ecDNA biogenesis. We discovered that most CCND1 amplifications in urothelial cancer arise within circular ecDNA-forming SVs. ecDNA-forming SVs persisted and increased in complexity, incorporating additional DNA segments and contributing to the evolution of treatment resistance. Oxford Nanopore Technologies long-read whole-genome sequencing followed by de novo assembly mapped out CCND1 ecDNA structure. Experimental modelling of CCND1 ecDNA confirmed its role as a driver of treatment resistance. Our findings define fundamental mechanisms that drive urothelial cancer evolution and have important therapeutic implications. Whole-genome sequencing of matched serial tumours from patients identifies two key mutagenic factors (APOBEC3 and chemotherapy) and extrachromosomal DNA-forming structural variants that drive treatment resistance in urothelial cancer."
10.1038/s41586-024-07943-7,False,Nature,这篇论文主要研究的是非小细胞肺癌（NSCLC）的免疫治疗，探讨了CTLA4阻断剂联合PD-(L)1抑制剂治疗对STK11和/或KEAP1基因突变的NSCLC患者的疗效。论文中提到了肿瘤微环境、免疫细胞类型等，但与大气环境遥感技术（如空气质量监测、卫星观测、大气成分分析）没有直接关联。,[],Ferdinandos Skoulidis;Haniel A. Araujo;Minh Truong Do;Yu Qian;Xin Sun;Ana Galan Cobo;John T. Le;Meagan Montesion;Rachael Palmer;Nadine Jahchan;Joseph M. Juan;Chengyin Min;Yi Yu;Xuewen Pan;Kathryn C. Arbour;Natalie Vokes;Stephanie T. Schmidt;David Molkentine;Dwight H. Owen;Regan Memmott;Pradnya D. Patil;Melina E. Marmarelis;Mark M. Awad;Joseph C. Murray;Jessica A. Hellyer;Justin F. Gainor;Anastasios Dimou;Christine M. Bestvina;Catherine A. Shu;Jonathan W. Riess;Collin M. Blakely;Chad V. Pecot;Laura Mezquita;Fabrizio Tabbó;Matthias Scheffler;Subba Digumarthy;Meghan J. Mooradian;Adrian G. Sacher;Sally C. M. Lau;Andreas N. Saltos;Julia Rotow;Rocio Perez Johnson;Corinne Liu;Tyler Stewart;Sarah B. Goldberg;Jonathan Killam;Zenta Walther;Kurt Schalper;Kurtis D. Davies;Mark G. Woodcock;Valsamo Anagnostou;Kristen A. Marrone;Patrick M. Forde;Biagio Ricciuti;Deepti Venkatraman;Eliezer M. Van Allen;Amy L. Cummings;Jonathan W. Goldman;Hiram Shaish;Melanie Kier;Sharyn Katz;Charu Aggarwal;Ying Ni;Joseph T. Azok;Jeremy Segal;Lauren Ritterhouse;Joel W. Neal;Ludovic Lacroix;Yasir Y. Elamin;Marcelo V. Negrao;Xiuning Le;Vincent K. Lam;Whitney E. Lewis;Haley N. Kemp;Brett Carter;Jack A. Roth;Stephen Swisher;Richard Lee;Teng Zhou;Alissa Poteete;Yifan Kong;Tomohiro Takehara;Alvaro Guimaraes Paula;Edwin R. Parra Cuentas;Carmen Behrens;Ignacio I. Wistuba;Jianjun Zhang;George R. Blumenschein;Carl Gay;Lauren A. Byers;Don L. Gibbons;Anne Tsao;J. Jack Lee;Trever G. Bivona;D. Ross Camidge;Jhannelle E. Gray;Natasha Lieghl;Benjamin Levy;Julie R. Brahmer;Marina C. Garassino;David R. Gandara;Edward B. Garon;Naiyer A. Rizvi;Giorgio Vittorio Scagliotti;Jürgen Wolf;David Planchard;Benjamin Besse;Roy S. Herbst;Heather A. Wakelee;Nathan A. Pennell;Alice T. Shaw;Pasi A. Jänne;David P. Carbone;Matthew D. Hellmann;Charles M. Rudin;Lee Albacker;Helen Mann;Zhou Zhu;Zhongwu Lai;Ross Stewart;Solange Peters;Melissa L. Johnson;Kwok K. Wong;Alan Huang;Monte M. Winslow;Michael J. Rosen;Ian P. Winters;Vassiliki A. Papadimitrakopoulou;Tina Cascone;Philip Jewsbury;John V. Heymach,CTLA4 blockade abrogates <i>KEAP1</i>/<i>STK11</i>-related resistance to PD-(L)1 inhibitors,"Alterations in the tumour suppressor genes STK11 and/or KEAP1 can identify patients with advanced non-small-cell lung cancer who are likely to benefit from combinations of PD-(L)1 and CTLA4 immune checkpoint inhibitors added to chemotherapy. 
 For patients with advanced non-small-cell lung cancer (NSCLC), dual immune checkpoint blockade (ICB) with CTLA4 inhibitors and PD-1 or PD-L1 inhibitors (hereafter, PD-(L)1 inhibitors) is associated with higher rates of anti-tumour activity and immune-related toxicities, when compared with treatment with PD-(L)1 inhibitors alone. However, there are currently no validated biomarkers to identify which patients will benefit from dual ICB1,2. Here we show that patients with NSCLC who have mutations in the STK11 and/or KEAP1 tumour suppressor genes derived clinical benefit from dual ICB with the PD-L1 inhibitor durvalumab and the CTLA4 inhibitor tremelimumab, but not from durvalumab alone, when added to chemotherapy in the randomized phase III POSEIDON trial3. Unbiased genetic screens identified loss of both of these tumour suppressor genes as independent drivers of resistance to PD-(L)1 inhibition, and showed that loss of Keap1 was the strongest genomic predictor of dual ICB efficacy—a finding that was confirmed in several mouse models of Kras-driven NSCLC. In both mouse models and patients, KEAP1 and STK11 alterations were associated with an adverse tumour microenvironment, which was characterized by a preponderance of suppressive myeloid cells and the depletion of CD8+ cytotoxic T cells, but relative sparing of CD4+ effector subsets. Dual ICB potently engaged CD4+ effector cells and reprogrammed the tumour myeloid cell compartment towards inducible nitric oxide synthase (iNOS)-expressing tumoricidal phenotypes that—together with CD4+ and CD8+ T cells—contributed to anti-tumour efficacy. These data support the use of chemo-immunotherapy with dual ICB to mitigate resistance to PD-(L)1 inhibition in patients with NSCLC who have STK11 and/or KEAP1 alterations. Alterations in the tumour suppressor genes STK11 and/or KEAP1 can identify patients with advanced non-small-cell lung cancer who are likely to benefit from combinations of PD-(L)1 and CTLA4 immune checkpoint inhibitors added to chemotherapy."
10.1038/s41586-024-08005-8,False,Nature,这篇论文主要研究的是利用光镊技术实现中性原子光钟的量子操作，并利用量子纠缠提高时间测量精度。论文中提到了量子门、量子纠缠态、量子逻辑光谱等概念，与大气环境遥感技术关系不大。,[],Ran Finkelstein;Richard Bing-Shiun Tsai;Xiangkai Sun;Pascal Scholl;Su Direkci;Tuvia Gefen;Joonhee Choi;Adam L. Shaw;Manuel Endres,Universal quantum operations and ancilla-based read-out for tweezer clocks,"We demonstrate high-fidelity entangling gates, universal quantum operations, and ancilla-based read-out for ultranarrow optical transitions of neutral atoms in a tweezer clock platform. 
 Enhancing the precision of measurements by harnessing entanglement is a long-sought goal in quantum metrology1,2. Yet attaining the best sensitivity allowed by quantum theory in the presence of noise is an outstanding challenge, requiring optimal probe-state generation and read-out strategies3–7. Neutral-atom optical clocks8, which are the leading systems for measuring time, have shown recent progress in terms of entanglement generation9–11 but at present lack the control capabilities for realizing such schemes. Here we show universal quantum operations and ancilla-based read-out for ultranarrow optical transitions of neutral atoms. Our demonstration in a tweezer clock platform9,12–16 enables a circuit-based approach to quantum metrology with neutral-atom optical clocks. To this end, we demonstrate two-qubit entangling gates with 99.62(3)% fidelity—averaged over symmetric input states—through Rydberg interactions15,17,18 and dynamical connectivity19 for optical clock qubits, which we combine with local addressing16 to implement universally programmable quantum circuits. Using this approach, we generate a near-optimal entangled probe state1,4, a cascade of Greenberger–Horne–Zeilinger states of different sizes, and perform a dual-quadrature5 Greenberger–Horne–Zeilinger read-out. We also show repeated fast phase detection with non-destructive conditional reset of clock qubits and minimal dead time between repetitions by implementing ancilla-based quantum logic spectroscopy20 for neutral atoms. Finally, we extend this to multi-qubit parity checks and measurement-based, heralded, Bell-state preparation21–24. Our work lays the foundation for hybrid processor–clock devices with neutral atoms and more generally points to a future of practical applications for quantum processors linked with quantum sensors25. We demonstrate high-fidelity entangling gates, universal quantum operations, and ancilla-based read-out for ultranarrow optical transitions of neutral atoms in a tweezer clock platform."
10.1038/s41586-024-08031-6,False,Nature,这篇论文主要研究了AKT和EZH2抑制剂在治疗三阴性乳腺癌（TNBC）中的协同作用。研究表明，AKT抑制剂与EZH2抑制剂联合使用，能够通过诱导一种类似于退化过程的机制，在多个TNBC模型中实现显著的肿瘤消退。该研究重点关注了TNBC的分子机制和治疗策略，与大气环境遥感技术无关。,[],Amy E. Schade;Naiara Perurena;Yoona Yang;Carrie L. Rodriguez;Anjana Krishnan;Alycia Gardner;Patrick Loi;Yilin Xu;Van T. M. Nguyen;G. M. Mastellone;Natalie F. Pilla;Marina Watanabe;Keiichi Ota;Rachel A. Davis;Kaia Mattioli;Dongxi Xiang;Jason J. Zoeller;Jia-Ren Lin;Stefania Morganti;Ana C. Garrido-Castro;Sara M. Tolaney;Zhe Li;David A. Barbie;Peter K. Sorger;Kristian Helin;Sandro Santagata;Simon R. V. Knott;Karen Cichowski,AKT and EZH2 inhibitors kill TNBCs by hijacking mechanisms of involution,"AKT inhibitors synergize with agents that suppress the histone methyltransferase EZH2 and promote robust tumour regression in multiple triple-negative breast cancer models in vivo by triggering an involution-like process. 
 Triple-negative breast cancer (TNBC) is the most aggressive breast cancer subtype and has the highest rate of recurrence1. The predominant standard of care for advanced TNBC is systemic chemotherapy with or without immunotherapy; however, responses are typically short lived1,2. Thus, there is an urgent need to develop more effective treatments. Components of the PI3K pathway represent plausible therapeutic targets; more than 70% of TNBCs have alterations in PIK3CA, AKT1 or PTEN3–6. However, in contrast to hormone-receptor-positive tumours, it is still unclear whether or how triple-negative disease will respond to PI3K pathway inhibitors7. Here we describe a promising AKT-inhibitor-based therapeutic combination for TNBC. Specifically, we show that AKT inhibitors synergize with agents that suppress the histone methyltransferase EZH2 and promote robust tumour regression in multiple TNBC models in vivo. AKT and EZH2 inhibitors exert these effects by first cooperatively driving basal-like TNBC cells into a more differentiated, luminal-like state, which cannot be effectively induced by either agent alone. Once TNBCs are differentiated, these agents kill them by hijacking signals that normally drive mammary gland involution. Using a machine learning approach, we developed a classifier that can be used to predict sensitivity. Together, these findings identify a promising therapeutic strategy for this highly aggressive tumour type and illustrate how deregulated epigenetic enzymes can insulate tumours from oncogenic vulnerabilities. These studies also reveal how developmental tissue-specific cell death pathways may be co-opted for therapeutic benefit. AKT inhibitors synergize with agents that suppress the histone methyltransferase EZH2 and promote robust tumour regression in multiple triple-negative breast cancer models in vivo by triggering an involution-like process."
10.1038/s41586-024-08003-w,False,Nature,这篇论文主要研究的是利用石墨烯化学传感器和机器学习技术进行化学分析，特别是针对食品欺诈、腐败和安全问题。论文中提到了ISFET传感器，但没有涉及到大气环境遥感技术，例如空气质量监测、卫星观测或大气成分分析。因此，这篇论文与大气环境遥感技术关系不大。,"['chemical analysis', 'graphene chemosensors', 'machine learning', 'ISFET sensors', 'food fraud', 'food spoilage', 'food safety']",Andrew Pannone;Aditya Raj;Harikrishnan Ravichandran;Sarbashis Das;Ziheng Chen;Collin A. Price;Mahmooda Sultana;Saptarshi Das,Robust chemical analysis with graphene chemosensors and machine learning,"Machine learning models trained with extensive datasets generated by ion-sensitive field-effect transistor sensors can classify complex liquids and quantify changes in chemical composition. 
 Ion-sensitive field-effect transistors (ISFETs) have emerged as indispensable tools in chemosensing applications1–4. ISFETs operate by converting changes in the composition of chemical solutions into electrical signals, making them ideal for environmental monitoring5,6, healthcare diagnostics7 and industrial process control8. Recent advancements in ISFET technology, including functionalized multiplexed arrays and advanced data analytics, have improved their performance9,10. Here we illustrate the advantages of incorporating machine learning algorithms to construct predictive models using the extensive datasets generated by ISFET sensors for both classification and quantification tasks. This integration also sheds new light on the working of ISFETs beyond what can be derived solely from human expertise. Furthermore, it mitigates practical challenges associated with cycle-to-cycle, sensor-to-sensor and chip-to-chip variations, paving the way for the broader adoption of ISFETs in commercial applications. Specifically, we use data generated by non-functionalized graphene-based ISFET arrays to train artificial neural networks that possess a remarkable ability to discern instances of food fraud, food spoilage and food safety concerns. We anticipate that the fusion of compact, energy-efficient and reusable graphene-based ISFET technology with robust machine learning algorithms holds the potential to revolutionize the detection of subtle chemical and environmental changes, offering swift, data-driven insights applicable across a wide spectrum of applications. Machine learning models trained with extensive datasets generated by ion-sensitive field-effect transistor sensors can classify complex liquids and quantify changes in chemical composition."
