doi,is_relevant,journal,explanation,topic_words,authors,title,abstract
10.1038/s41467-024-54213-1,False,Nature Communications,这篇研究论文主要关注的是哺乳动物细胞内双(单酰甘油)磷酸酯(BMP)的合成途径。研究发现，细胞内和细胞外的多种酶促反应都参与了BMP的合成，其中包括溶酶体酶CLN5以及胞质和分泌型转酰基酶。这些酶通过对磷脂酰甘油(PG)进行酰化和水解，最终生成BMP。研究结果表明，这些途径在功能上存在重叠，共同促进BMP的合成。该研究与大气环境遥感技术，例如空气质量监测、卫星观测和大气成分分析等，没有任何关系。,[],Dominik Bulfon;Johannes Breithofer;Gernot F. Grabner;Nermeen Fawzy;Anita Pirchheim;Heimo Wolinski;Dagmar Kolb;Lennart Hartig;Martin Tischitz;Clara Zitta;Greta Bramerdorfer;Achim Lass;Ulrike Taschler;Dagmar Kratky;Peter Greimel;Robert Zimmermann,Functionally overlapping intra- and extralysosomal&#xa0;pathways promote bis(monoacylglycero)phosphate synthesis in mammalian cells,"Bis(monoacylglycero)phosphate (BMP) is an important component of late endosomal and lysosomal membranes. In this study, the authors show that both intra- and extralysosomal pathways can contribute to BMP synthesis. 
 Bis(monoacylglycero)phosphate (BMP) is a major phospholipid constituent of intralumenal membranes in late endosomes/lysosomes, where it regulates the degradation and sorting of lipid cargo. Recent observations suggest that the Batten disease-associated protein CLN5 functions as lysosomal BMP synthase. Here, we show that transacylation reactions catalyzed by cytosolic and secreted enzymes enhance BMP synthesis independently of CLN5. The transacylases identified in this study are capable of acylating the precursor lipid phosphatidylglycerol (PG), generating acyl-PG, which is subsequently hydrolyzed to BMP. Extracellularly, acyl-PG and BMP are generated by endothelial lipase in cooperation with other serum enzymes of the pancreatic lipase family. The intracellular acylation of PG is catalyzed by several members of the cytosolic phospholipase A2 group IV (PLA2G4) family. Overexpression of secreted or cytosolic transacylases was sufficient to correct BMP deficiency in HEK293 cells lacking CLN5. Collectively, our observations suggest that functionally overlapping pathways promote BMP synthesis in mammalian cells. Bis(monoacylglycero)phosphate (BMP) is an important component of late endosomal and lysosomal membranes. In this study, the authors show that both intra- and extralysosomal pathways can contribute to BMP synthesis."
10.1038/s41467-024-54219-9,False,Nature Communications,这篇论文研究的是细菌细胞壁片段的转运蛋白AmpG。研究者利用冷冻电镜技术解析了AmpG的结构，并通过生化和细胞实验阐明了其在细菌适应性和广谱β-内酰胺类抗生素抗性中的作用。该研究与大气环境遥感技术，例如空气质量监测、卫星观测和大气成分分析等，没有任何关系。研究对象是细菌细胞层面的分子机制，与大气环境遥感技术的研究尺度和对象完全不同。,[],Helena E. Sverak;Luke N. Yaeger;Liam J. Worrall;Condurache M. Vacariu;Amy J. Glenwright;Marija Vuckovic;Zayni-Dean Al Azawi;Ryan P. Lamers;Victoria A. Marko;Clarissa Skorupski;Arvind S. Soni;Martin E. Tanner;Lori L. Burrows;Natalie CJ Strynadka,Cryo-EM characterization of the anydromuropeptide permease AmpG central to bacterial fitness and β-lactam antibiotic resistance,"AmpG is an MFS importer of bacterial cell wall fragments. Here, authors present a cryoEM structure and supporting mutagenesis to illuminate AmpG’s essential role in bacterial fitness and derepression of broad-spectrum β-lactam antibiotic resistance. 
 Bacteria invest significant resources into the continuous creation and tailoring of their essential protective peptidoglycan (PG) cell wall. Several soluble PG biosynthesis products in the periplasm are transported to the cytosol for recycling, leading to enhanced bacterial fitness. GlcNAc-1,6-anhydroMurNAc and peptide variants are transported by the essential major facilitator superfamily importer AmpG in Gram-negative pathogens including Escherichia coli, Klebsiella pneumoniae, Acinetobacter baumannii, and Pseudomonas aeruginosa. Accumulation of GlcNAc-1,6-anhydroMurNAc-pentapeptides also results from β-lactam antibiotic induced cell wall damage. In some species, these products upregulate the β-lactamase AmpC, which hydrolyzes β-lactams to allow for bacterial survival and drug-resistant infections. Here, we have used cryo-electron microscopy and chemical synthesis of substrates in an integrated structural, biochemical, and cellular analysis of AmpG. We show how AmpG accommodates the large GlcNAc-1,6-anhydroMurNAc peptides, including a unique hydrophobic vestibule to the substrate binding cavity, and characterize residues involved in binding that inform the mechanism of proton-mediated transport. AmpG is an MFS importer of bacterial cell wall fragments. Here, authors present a cryoEM structure and supporting mutagenesis to illuminate AmpG’s essential role in bacterial fitness and derepression of broad-spectrum β-lactam antibiotic resistance."
10.1038/s41467-024-52987-y,False,Nature Communications,这篇论文的标题和摘要表明，其研究重点在于水系锌离子电池电解液的开发。这属于材料科学和电化学储能领域，与大气环境遥感技术（例如空气质量监测、卫星观测和大气成分分析）并没有直接关系。论文研究了一种新型的弱溶剂化电解液，旨在提高可充电水系锌离子电池的性能。这与大气环境遥感技术所关注的大气成分、污染物传输和气候变化等问题毫无关联。,[],Xin Shi;Jinhao Xie;Jin Wang;Shilei Xie;Zujin Yang;Xihong Lu,Author Correction: A weakly solvating electrolyte towards practical rechargeable aqueous zinc-ion batteries,"Author Correction: A weakly solvating electrolyte towards practical rechargeable aqueous zinc-ion batteries 
 "
10.1038/s41467-024-54389-6,False,Nature Communications,这篇论文研究的是拓扑外尔半金属t-PtBi2中的表面超导性，以及其在5K温度下展现出的超导特性。研究使用了扫描隧道显微镜和谱学技术，发现超导能隙在空间上是不均匀的，大小范围为0到20 meV。该研究与大气环境遥感技术，例如空气质量监测、卫星观测和大气成分分析等，没有任何直接关系。论文关注的是材料科学和凝聚态物理领域，目标是探索高温拓扑超导材料用于容错量子比特的可能性。,[],Sebastian Schimmel;Yanina Fasano;Sven Hoffmann;Julia Besproswanny;Laura Teresa Corredor Bohorquez;Joaquín Puig;Bat-Chen Elshalem;Beena Kalisky;Grigory Shipunov;Danny Baumann;Saicharan Aswartham;Bernd Büchner;Christian Hess,Surface superconductivity in the topological Weyl semimetal t-PtBi<sub>2</sub>,"Topological superconductivity is a promising concept for generating fault-tolerant qubits. Here, the authors report surface superconductivity at 5 K in a topological semimetal—trigonal PtBi2. 
 Topological superconductivity is a promising concept for generating fault-tolerant qubits. Early experimental studies looked at hybrid systems and doped intrinsic topological or superconducting materials at very low temperatures. However, higher critical temperatures are indispensable for technological exploitation. Recent angle-resolved photoemission spectroscopy results have revealed that superconductivity in the type-I Weyl semimetal—trigonal PtBi2 (t-PtBi2)—is located at the Fermi-arc surface states, which renders the material a potential candidate for intrinsic topological superconductivity. Here we show, using scanning tunnelling microscopy and spectroscopy, that t-PtBi2 presents surface superconductivity at elevated temperatures (5 K). The gap magnitude is elusive: it is spatially inhomogeneous and spans from 0 to 20 meV. In particular, the large gap value and the shape of the quasiparticle excitation spectrum resemble the phenomenology of high-Tc superconductors. To our knowledge, this is the largest superconducting gap so far measured in a topological material. Moreover, we show that the superconducting state at 5 K persists in magnetic fields up to 12 T. Topological superconductivity is a promising concept for generating fault-tolerant qubits. Here, the authors report surface superconductivity at 5 K in a topological semimetal—trigonal PtBi2."
10.1038/s41467-024-54144-x,False,Nature Communications,这篇研究论文主要关注的是疟疾的传播机制以及新型抗疟药物的研发。研究人员比较了80种化合物对疟原虫无性繁殖阶段和配子体阶段的活性，发现大多数有效抑制无性繁殖阶段的化合物对配子体的活性显著降低。他们确定了影响药物双重活性的理化特性，特别是脂质摄取是双重活性的主要障碍。该研究为研制具有双重活性的抗疟药物提供了指导，有助于开发有效的阻断疟疾传播的药物。总而言之，该研究属于医学领域，与大气环境遥感技术，例如空气质量监测、卫星观测和大气成分分析等，没有任何关系。,[],Mariska Naude;Ashleigh van Heerden;Janette Reader;Mariëtte van der Watt;Jandeli Niemand;Dorè Joubert;Giulia Siciliano;Pietro Alano;Mathew Njoroge;Kelly Chibale;Esperanza Herreros;Didier Leroy;Lyn-Marié Birkholtz,Eliminating malaria transmission requires targeting immature and mature gametocytes through lipoidal uptake of antimalarials,"Most compounds active against asexual blood stage malaria parasites show reduced activity against gametocytes. Here the authors directly compare asexual and gametocytocidal activity of 80 compounds and identify physicochemical properties that influence dual activity. 
 Novel antimalarial compounds targeting both the pathogenic and transmissible stages of the human malaria parasite, Plasmodium falciparum, would greatly benefit malaria elimination strategies. However, most compounds affecting asexual blood stage parasites show severely reduced activity against gametocytes. The impact of this activity loss on a compound’s transmission-blocking activity is unclear. Here, we report the systematic evaluation of the activity loss against gametocytes and investigate the confounding factors contributing to this. A threshold for acceptable activity loss between asexual blood stage parasites and gametocytes was defined, with near-equipotent compounds required to prevent continued gametocyte maturation and onward transmission. Target abundance is not predictive of gametocytocidal activity, but instead, lipoidal uptake is the main barrier of dual activity and is influenced by distinct physicochemical properties. This study provides guidelines for the required profiles of potential dual-active antimalarial agents and facilitates the development of effective transmission-blocking compounds. Most compounds active against asexual blood stage malaria parasites show reduced activity against gametocytes. Here the authors directly compare asexual and gametocytocidal activity of 80 compounds and identify physicochemical properties that influence dual activity."
10.1038/s41467-024-54307-w,False,Nature Communications,这篇论文研究的是生物量竞争如何影响生物个体和群落尺度的生产力和生物量之间的关系。研究发现，竞争作用改变了生物体代谢与体型大小的比例关系，导致生态系统生产力的幂律缩放与个体生物的代谢缩放具有相似的形式。这与基于体型异速生长关系的预期结果相反。研究使用海洋浮游植物作为模型，揭示了生物量竞争如何通过影响代谢率，进而影响不同尺度上的生产力模式。该研究属于生态学领域，与大气环境遥感技术，例如空气质量监测、卫星观测和大气成分分析等，没有直接关系。,[],Lorenzo Fant;Giulia Ghedini,Biomass competition connects individual and community scaling patterns,"Communities that differ in species size composition show similar relationships between production and biomass, contrary to expectations based on body size allometries. The authors show that these patterns emerge because competition alters the scaling of organismal metabolism with size. 
 Both metabolism and growth scale sublinearly with body mass across species. Ecosystems show the same sublinear scaling between production and total biomass, but ecological theory cannot reconcile the existence of these nearly identical scalings at different levels of biological organization. We attempt to solve this paradox using marine phytoplankton, connecting individual and ecosystem scalings across three orders of magnitude in body size and biomass. We find that competitive interactions determined by biomass slow metabolism in a consistent fashion across species of different sizes. These effects dominate over species-specific peculiarities, explaining why community composition does not affect respiration and production patterns. The sublinear scaling of ecosystem production thus emerges from this metabolic density-dependence that operates across species, independently of the equilibrium state or resource regime. Our findings demonstrate the connection between individual and ecosystem scalings, unifying aspects of physiology and ecology to explain why growth patterns are so strikingly similar across scales. Communities that differ in species size composition show similar relationships between production and biomass, contrary to expectations based on body size allometries. The authors show that these patterns emerge because competition alters the scaling of organismal metabolism with size."
10.1038/s41558-024-02192-y,False,Nature Climate Change,这篇论文的标题和摘要关注的是气候变化对疫苗有效性和健康公平的影响。它主要讨论气候变化如何改变环境条件，从而影响疫苗的效力，并加剧健康不平等。  文章并没有直接涉及大气环境遥感技术，例如空气质量监测、卫星观测或大气成分分析等。因此，它与大气环境遥感技术的关系不大。,[],Kai Zhang;Yifang Dang;Yiming Li;Cui Tao;Junguk Hur;Yongqun He,Impact of climate change on vaccine responses and inequity,"Climate change poses a substantial threat to global health by altering environmental conditions and impacting vaccine effectiveness. We explore how climate change impacts vaccines and worsens inequities, highlighting the need for further research and targeted interventions. 
 Climate change poses a substantial threat to global health by altering environmental conditions and impacting vaccine effectiveness. We explore how climate change impacts vaccines and worsens inequities, highlighting the need for further research and targeted interventions."
10.1038/s41893-024-01450-3,False,Nature Sustainability,这篇论文主要研究的是全球森林干扰的景观格局及其驱动因素，关注的是不同类型森林干扰（自然和人为）的空间分布特征、强度、复杂性和环境背景。研究使用了全球尺度的干扰数据，量化了干扰斑块结构，并根据强度、复杂性和环境背景将干扰模式分为四大类。结果表明，人类活动引入了自然界中不常见的干扰结构，尤其是在热带地区。研究认为，如果目前的干扰动态持续下去，可能会导致全球森林结构的均质化，对森林生态和功能产生潜在的影响。总的来说，这是一篇关于森林生态学和可持续森林管理的论文，与大气环境遥感技术关系不大。,[],Nezha Acil;Jonathan P. Sadler;Cornelius Senf;Susanne Suvanto;Thomas A. M. Pugh,Landscape patterns in stand-replacing disturbances across the world’s forests,"Forests are subject to natural and human-induced disturbances, which can be important in shaping their form and function. In this study, the authors examine the landscape patterns of global forest disturbance and their drivers to better inform sustainable forest management and policy. 
 The spatial imprint of forest disturbances, which can result from a variety of anthropogenic and natural causes, is important in shaping the form and function of the world’s forests. However, we lack a systematic assessment of how the forms of forest disturbances differ globally, which could help in sustainable forest policy and management initiatives to protect forest biomes. Here we produce a global-scale quantification of disturbance patch structures. Using indicators of magnitude, complexity and context, we found that the forms of stand-replacing disturbances can be classified into four broad patterns, whose spatial dominance varies across regions. Human activities were shown to introduce disturbance structures that are not naturally common, especially in the tropics. The consistency of these patterns across biomes outside intact forests suggests that a continuation of current dynamics may lead to a structural homogenization of the world’s forests, with potential consequences for forest ecology and functions. These results provide a greater understanding of the mechanisms governing forest dynamics and elucidating the causal agents of disturbances. This will be a key step towards building more reliable projections of future forest conditions, informing policymaking and ensuring the sustainability of forest management. Forests are subject to natural and human-induced disturbances, which can be important in shaping their form and function. In this study, the authors examine the landscape patterns of global forest disturbance and their drivers to better inform sustainable forest management and policy."
10.1038/s43247-024-01880-z,False,Communications Earth & Environment,这篇论文主要研究人为气候变化对美国本土1221种陆生脊椎动物的干旱暴露的影响。研究使用了三种全球气候模型和两种代表性浓度路径，预测了2050-2080年期间与1950-2005年相比，年干旱和长期干旱暴露的增加程度。结果表明，平均而言，年干旱暴露将增加377％，长期干旱暴露将增加579％。美国西南部地区的物种面临的干旱暴露增加最为显著。该研究与大气环境遥感技术关系不大，因为它关注的是气候变化对物种分布和生存的影响，而不是大气成分的监测或分析。,"['drought', 'climate change', 'terrestrial vertebrates', 'species distribution modeling', 'conservation']",M. van den Bosch;J. K. Costanza;R. A. Peek;J. M. Mola;Z. L. Steel,Climate change scenarios forecast increased drought exposure for terrestrial vertebrates in the contiguous United States,"Anthropogenic climate change is expected to significantly increase drought exposure for 1221 terrestrial vertebrates in the United States, with an average increase of 377% for annual drought and 579% for prolonged drought by 2050–2080, according to analysis of different climate scenarios to assess drought exposure across species and ecoregions. 
 Anthropogenic climate change is altering patterns of extreme weather events across the planet, with far-ranging consequences for biodiversity. Increases in the frequency, duration, and severity of droughts are anticipated to substantially impact natural ecosystems. Here, we predicted the extent to which 1221 terrestrial vertebrates in the contiguous United States will be increasingly exposed to annual (12-month) and prolonged (36-month) drought, under three global climate models and two representative concentration pathways. On average, a 377% increase in annual drought exposure and a 579% increase in prolonged drought exposure are anticipated for the study area by 2050–2080, compared to 1950–2005. Species in the southwestern USA could see the largest increases in drought exposure, while this area also has the highest vertebrate diversity and an abundance of drought-threatened species. Our results aid in identifying vertebrates and ecoregions anticipated to see large increases in drought exposure, which can inform conservation strategies aimed at mitigating vertebrate extinction risks. Anthropogenic climate change is expected to significantly increase drought exposure for 1221 terrestrial vertebrates in the United States, with an average increase of 377% for annual drought and 579% for prolonged drought by 2050–2080, according to analysis of different climate scenarios to assess drought exposure across species and ecoregions."
10.1038/s43247-024-01857-y,True,Communications Earth & Environment,这篇论文研究了2022年春季南亚地区前所未有的热浪对该区域积雪的影响。研究利用卫星观测和ERA5再分析数据，发现这次热浪导致区域积雪覆盖面积减少了42%，积雪深度减少了57%。热浪是由持续高压系统和罗斯比波共同作用造成的，导致了大范围的快速融雪，甚至一些低海拔地区的积雪完全消失。此外，降雪量也远低于长期平均水平。研究结果表明，这次热浪造成了严重的区域性春季积雪干旱，突显了气候变化对南亚地区水资源安全的影响。研究中使用了卫星遥感技术来监测积雪覆盖和深度，这与大气环境遥感技术密切相关。,"['Snow cover', 'Snow depth', 'Satellite observations', 'ERA5 reanalysis data', 'Snowmelt', 'Atmospheric temperature', 'Heatwave', 'High-pressure system', 'Rossby wave', 'Climate change', 'South Asia', 'Himalayas']",Waqar ul Hassan;Munir Ahmad Nayak;Md Saquib Saharwardi;Junaid Ahmad Dar;Hari Prasad Dasari;Ibrahim Hoteit;Yasser Abualnaja,Unveiling the devastating effect of the spring 2022 mega-heatwave on the South Asian snowpack,"An unprecedented heatwave in South Asia driven by a persistent high-pressure system coupled with a Rossby wave packet during spring 2022 led to an average loss of 42% in snow cover and 57% in snow depth of the regional snowpack, according to analysis of satellite observations and ERA5 reanalysis data. 
 Global warming has led to a notable increase in heatwaves globally and regionally. In spring 2022, South Asia witnessed an unprecedented heatwave with temperatures breaking historical records and exceeding 5° C from climatological mean at several locations in the northern Indian subcontinent. Here, using 3D tracking, this heatwave ranked the most severe in the past 64 years, characterized by its protracted duration and wide spatial extent. The excess atmospheric heat, represented by temperature anomalies, during the mega-heatwave triggered rapid snowmelt across the snow-covered areas in the region, leading to an average loss of 42% in snow cover and 57% in snow depth of the regional snowpack. This rapid melting resulted in the complete disappearance of low-level snowpack in the western Himalayas, Pir Panjal, and Afghanistan highlands, leading to the lowest snowpack observed in the last six decades. Moreover, during the heatwave, the amount of snowfall received was only 29% of the long-term average. This combination of excessive melting and reduced snowfall culminated in a severe regional snow drought in spring 2022. The heatwave genesis lay a persistent high-pressure system over Northwest South Asia, reinforced by a quasi-stationary Rossby wave packet over Europe during the initial spell. Continuous heat from high-pressure ridges associated with circumglobal Rossby waves combined with the physical barrier of the Himalayas, lent staying power to this system during the second phase. An unprecedented heatwave in South Asia driven by a persistent high-pressure system coupled with a Rossby wave packet during spring 2022 led to an average loss of 42% in snow cover and 57% in snow depth of the regional snowpack, according to analysis of satellite observations and ERA5 reanalysis data."
