doi,is_relevant,journal,explanation,topic_words,authors,title,abstract
10.1038/d41586-024-03028-7,False,Nature,这篇论文主要探讨了高压情况下神经元活动下降、乌克兰科学组织的现状以及一个反驳阴谋论的聊天机器人。它与大气环境遥感技术，例如空气质量监测、卫星观测和大气成分分析，没有直接关系。,[],Flora Graham,Daily briefing: Why we choke under pressure,"How our neuron activity drops in high-stakes situations, meet the organizations fighting for Ukrainian science and discover a chatbot that can pop the conspiracy-thinking bubble. 
 How our neuron activity drops in high-stakes situations, meet the organizations fighting for Ukrainian science and discover a chatbot that can pop the conspiracy-thinking bubble.  How our neuron activity drops in high-stakes situations, meet the organizations fighting for Ukrainian science and discover a chatbot that can pop the conspiracy-thinking bubble."
10.1038/s41467-024-51021-5,False,Nature Communications,这篇论文研究的是马尔堡病毒感染者体内抗体的纵向变化，通过分析抗体库来寻找潜在的疫苗靶点。它与大气环境遥感技术，例如空气质量监测、卫星观测和大气成分分析，没有直接关系。,[],Surender Khurana;Gabrielle Grubbs;Supriya Ravichandran;Emily Cluff;JungHyun Kim;Ana I. Kuehne;Samantha Zak;John M. Dye;Julius J. Lutwama;Andrew S. Herbert,Longitudinal proteome-wide antibody profiling in Marburg virus survivors identifies wing domain immunogen for vaccine design,"Longitudinal Marburg virus human antibody repertoire 
 "
10.1038/s41467-024-52457-5,False,Nature Communications,该论文主要关注的是利用动态键合来控制材料的响应性，并将其应用于增材制造金属聚电解质。论文的重点在于材料科学和工程领域，与大气环境遥感技术关系不大。,[],Seola Lee;Pierre J. Walker;Seneca J. Velling;Amylynn Chen;Zane W. Taylor;Cyrus J.B.M Fiori;Vatsa Gandhi;Zhen-Gang Wang;Julia R. Greer,Author Correction: Molecular control via dynamic bonding enables material responsiveness in additively manufactured metallo-polyelectrolytes,"Author Correction: Molecular control via dynamic bonding enables material responsiveness in additively manufactured metallo-polyelectrolytes 
 "
10.1038/s41467-023-44107-z,False,Nature Communications,该研究论文的标题和摘要表明它关注的是与热相关的死亡风险的快速增加，而不是大气环境遥感技术。论文可能涉及气候变化、公共卫生或人口统计学等领域，但与空气质量监测、卫星观测或大气成分分析无关。,"['heat-related mortality', 'risk', 'increase']",Samuel Lüthi;Christopher Fairless;Erich M. Fischer;Noah Scovronick;Ben Armstrong;Micheline De Sousa Zanotti Stagliorio Coelho;Yue Leon Guo;Yuming Guo;Yasushi Honda;Veronika Huber;Jan Kyselý;Eric Lavigne;Dominic Royé;Niilo Ryti;Susana Silva;Aleš Urban;Antonio Gasparrini;Rosana Abrutzky;Yuming Guo;Shilu Tong;Micheline de Sousa Zanotti Stagliorio Coelho;Paulo Hilario Nascimento Saldiva;Eric Lavigne;Patricia Matus Correa;Nicolás Valdés Ortega;Haidong Kan;Samuel Osorio;Dominic Roye;Souzana Achilleos;Jan Kyselý;Ale Urban;Hans Orru;Ene Indermitte;Marek Maasikmets;Jouni J. K. Jaakkola;Mathilde Pascal;Alexandra Schneider;Veronika Huber;Susanne Breitner;Klea Katsouyanni;Antonis Analitis;Evangelia Samoli;Hanne Krage Carlsen;Fatemeh Mayvaneh;Hematollah Roradeh;Patrick Goodman;Ariana Zeka;Raanan Raz;Paola Michelozzi;Francesca de’Donato;Matteo Scortichini;Massimo Stafoggia;Masahiro Hashizume;Yoonhee Kim;Chris Fook Sheng Ng;Yasushi Honda;Barrak Alahmad;John Paul Cauchy;Magali Hurtado Diaz;César De la Cruz Valencia;Ala Overcenco;Danny Houthuijs;Caroline Ameling;Shilpa Rao;Gabriel Carrasco;Xerxes Seposo;Paul Lester Carlos Chua;Susana das Neves Pereira da Silva;Joana Madueira;Iulian Horia Holobaca;Simona Fratianni;Ivana Cvijanovic;Malcolm Mistry;Noah Scovronick;Fiorella Acquaotta;Rebecca M. Garland;Ho Kim;Whanhee Lee;Aurelio Tobias;Carmen Íñiguez;Bertil Forsberg;Ana Maria Vicedo-Cabrera;Martina S. Ragettli;Yue Leon Guo;Shih-Chun Pan;Shanshan Li;Francesco Sera;Pierre Masselot;Valentina Colistro;Michelle Bell;Antonella Zanobetti;Joel Schwartz;Tran Ngoc Dang;Do Van Dung;Antonio Gasparrini;David N. Bresch;Ana M. Vicedo-Cabrera,Author Correction: Rapid increase in the risk of heat-related mortality,"Author Correction: Rapid increase in the risk of heat-related mortality 
 "
10.1038/s41467-024-52180-1,False,Nature Communications,这篇论文研究的是哺乳动物内耳的进化适应性，探讨了非洲兽类和非非洲兽类在内耳形态上的趋同进化现象。研究发现，哺乳动物内耳具有很高的可进化性，这与内耳的复杂遗传和发育机制有关。论文的主题与大气环境遥感技术无关。,[],Nicole D. S. Grunstra;Fabian Hollinetz;Guillermo Bravo Morante;Frank E. Zachos;Cathrin Pfaff;Viola Winkler;Philipp Mitteroecker;Anne Le Maître,Convergent evolution in Afrotheria and non-afrotherians demonstrates high evolvability of the mammalian inner ear,"The inner ear is responsible for hearing and balance control. Here, the authors examine evolutionary convergence in the inner ear morphology of Afrotheria species and similar, non-Afrotheria analogue species, finding unexpectedly high evolvability. 
 Evolutionary convergence in distantly related species is among the most convincing evidence of adaptive evolution. The mammalian ear, responsible for balance and hearing, is not only characterised by its spectacular evolutionary incorporation of several bones of the jaw, it also varies considerably in shape across modern mammals. Using a multivariate approach, we show that in Afrotheria, a monophyletic clade with morphologically and ecologically highly disparate species, inner ear shape has evolved similar adaptations as in non-afrotherian mammals. We identify four eco-morphological trait combinations that underlie this convergence. The high evolvability of the mammalian ear is surprising: Nowhere else in the skeleton are different functional units so close together; it includes the smallest bones of the skeleton, encapsulated within the densest bone. We suggest that this evolvability is a direct consequence of the increased genetic and developmental complexity of the mammalian ear compared to other vertebrates. The inner ear is responsible for hearing and balance control. Here, the authors examine evolutionary convergence in the inner ear morphology of Afrotheria species and similar, non-Afrotheria analogue species, finding unexpectedly high evolvability."
10.1038/s41467-024-52345-y,False,Nature Communications,该研究主要关注的是利用磁性斯格明子进行手势识别的物理储层计算。研究人员使用了一种基于时间复用的斯格明子储层计算方法，能够实时检测毫秒级的手势，并与软件神经网络的性能相媲美。该研究的重点是利用磁性斯格明子的动态特性进行信息处理，并没有涉及大气环境遥感技术，例如空气质量监测、卫星观测或大气成分分析。,"['gesture recognition', 'magnetic skyrmions', 'reservoir computing', 'hand gestures', 'Range-Doppler radar']",Grischa Beneke;Thomas Brian Winkler;Klaus Raab;Maarten A. Brems;Fabian Kammerbauer;Pascal Gerhards;Klaus Knobloch;Sachin Krishnia;Johan H. Mentink;Mathias Kläui,Gesture recognition with Brownian reservoir computing using geometrically confined skyrmion dynamics,"Physical reservoir computing allows real-time low power information processing. Here, the authors report reservoir computing with magnetic skyrmions able to detect millisecond time-scale hand gestures, matching software neural networks’ performance. 
 Physical reservoir computing leverages the dynamical properties of complex physical systems to process information efficiently, significantly reducing training efforts and energy consumption. Magnetic skyrmions, topological spin textures, are promising candidates for reservoir computing systems due to their enhanced stability, non-linear interactions and low-power manipulation. Traditional spin-based reservoir computing has been limited to quasi-static detection or real-world data must be rescaled to the intrinsic timescale of the reservoir. We address this challenge by time-multiplexed skyrmion reservoir computing, that allows for aligning the reservoir’s intrinsic timescales to real-world temporal patterns. Using millisecond-scale hand gestures recorded with Range-Doppler radar, we feed voltage excitations directly into our device and detect the skyrmion trajectory evolution. This method scales down to the nanometer level and demonstrates competitive or superior performance compared to energy-intensive software-based neural networks. Our hardware approach’s key advantage is its ability to integrate sensor data in real-time without temporal rescaling, enabling numerous applications. Physical reservoir computing allows real-time low power information processing. Here, the authors report reservoir computing with magnetic skyrmions able to detect millisecond time-scale hand gestures, matching software neural networks’ performance."
10.1038/s41467-024-51621-1,False,Nature Communications,"这篇论文主要研究的是一种导电聚合物PEDOT:DS的合成和性质，并利用铁（III）十二烷基硫酸盐（Fe(DS)3）多层囊泡（MLVs）作为模板，通过气相聚合3,4-乙撑二氧噻吩来制备具有大晶畴的PEDOT:DS薄膜。该薄膜具有金属导电性、高透明度、机械耐久性和柔韧性，适合用于下一代柔性电子器件。论文中没有涉及大气环境遥感技术，例如空气质量监测、卫星观测和大气成分分析。",[],Feng Ma;Sang-il Choi;Dooyong Lee;Sung Bae Jeon;Sungkyun Park;Sung-Pyo Cho;Jin-Hyo Boo;Sungsoo Kim,"Directed crystallization of a poly(3,4-ethylenedioxythiophene) film by an iron(III) dodecyl sulfate lamellar superstructure","PEDOT:PSS is a conductive polymer with potential as electrodes in flexible electronics, but conductivity is not always satisfactory. Here, the authors report the use of dodecyl sulfate in place of polystyrene sulfonate to prepare a durable and conductive film with large crystal domains. 
 Poly(3,4-ethylenedioxythiophene):polystyrene sulfonate (PEDOT:PSS), a successfully commercialized polymeric semiconductor material, has potential as a transparent electrode in flexible electronic devices, yet has insufficient conductivity. We present the synthesis, properties, and directed crystallization of the PEDOT:dodecyl sulfate (PEDOT:DS) film. Iron(III) dodecyl sulfate (Fe(DS)3) multi-lamellar vesicles (MLVs), a new growth template, are used to synthesize and direct the growth of the PEDOT:DS film via vapor-phase polymerization of 3,4-ethylenedioxythiophene to form huge PEDOT:DS co-crystal domains within the MLV superstructure. The polycrystalline film has metallic conductivity (avg. ~1.0 × 104 S cm−1), is highly transparent and mechanically durable yet flexible, and suitable for next-generation flexible electronics. These noteworthy properties are conferred by the MLV lamellar superstructure of Fe(DS)3, a selective oxidant and an efficient in situ dopant that enhances the film hydrophobicity and durability. Sophisticated MLV-type oxidants are foreseen to enable the synthesis of more conductive, transparent, robust, flexible, and water-stable polymer electrode materials in future. PEDOT:PSS is a conductive polymer with potential as electrodes in flexible electronics, but conductivity is not always satisfactory. Here, the authors report the use of dodecyl sulfate in place of polystyrene sulfonate to prepare a durable and conductive film with large crystal domains."
10.1038/s41467-024-51960-z,False,Nature Communications,这篇论文研究的是人类囊泡单胺转运蛋白2（VMAT2）的结构和功能，它是一种在神经元中起着重要作用的蛋白质，负责将神经递质运输到突触囊泡中。论文通过冷冻电镜技术解析了VMAT2的结构，并结合实验研究揭示了VMAT2在神经递质转运和抑制方面的机制。该研究与大气环境遥感技术无关。,[],Dohyun Im;Mika Jormakka;Narinobu Juge;Jun-ichi Kishikawa;Takayuki Kato;Yukihiko Sugita;Takeshi Noda;Tomoko Uemura;Yuki Shiimura;Takaaki Miyaji;Hidetsugu Asada;So Iwata,Neurotransmitter recognition by human vesicular monoamine transporter 2,"VMAT2 regulates neurotransmitter uptake into synaptic vesicles. Here, the authors determined the cryo-EM structures of VMAT2, providing a structural basis for understanding VMAT2- mediated vesicular transport of neurotransmitters. 
 Human vesicular monoamine transporter 2 (VMAT2), a member of the SLC18 family, plays a crucial role in regulating neurotransmitters in the brain by facilitating their uptake and storage within vesicles, preparing them for exocytotic release. Because of its central role in neurotransmitter signalling and neuroprotection, VMAT2 is a target for neurodegenerative diseases and movement disorders, with its inhibitor being used as therapeutics. Despite the importance of VMAT2 in pharmacophysiology, the molecular basis of VMAT2-mediated neurotransmitter transport and its inhibition remains unclear. Here we show the cryo-electron microscopy structure of VMAT2 in the substrate-free state, in complex with the neurotransmitter dopamine, and in complex with the inhibitor tetrabenazine. In addition to these structural determinations, monoamine uptake assays, mutational studies, and pKa value predictions were performed to characterize the dynamic changes in VMAT2 structure. These results provide a structural basis for understanding VMAT2-mediated vesicular transport of neurotransmitters and a platform for modulation of current inhibitor design. VMAT2 regulates neurotransmitter uptake into synaptic vesicles. Here, the authors determined the cryo-EM structures of VMAT2, providing a structural basis for understanding VMAT2- mediated vesicular transport of neurotransmitters."
10.1038/s41467-024-52468-2,False,Nature Communications,这篇研究论文主要关注的是利用空间激光雷达（GEDI）数据来分析全球森林的结构复杂性，并探讨了不同生物群落中结构复杂性的差异。研究重点在于利用空间激光雷达技术来测量森林冠层的三维结构，并将其与森林生态功能联系起来，例如光照环境、养分循环和生物多样性。因此，该研究并非直接与大气环境遥感技术相关，例如空气质量监测、卫星观测和大气成分分析。,"['spaceborne lidar', 'canopy complexity', 'forest structure', 'GEDI']",Tiago de Conto;John Armston;Ralph Dubayah,Characterizing the structural complexity of the Earth’s forests with spaceborne lidar,"Forest structural complexity plays a crucial role in ecosystem functioning, influencing factors like light, nutrient cycling, and biodiversity. Here, a global map of 3D canopy complexity modeled from spaceborne lidar reveals that highly complex forests are concentrated in the tropics, with significant variations observed across biomes. 
 Forest structural complexity is a key element of ecosystem functioning, impacting light environments, nutrient cycling, biodiversity, and habitat quality. Addressing the need for a comprehensive global assessment of actual forest structural complexity, we derive a near-global map of 3D canopy complexity using data from the GEDI spaceborne lidar mission. These data show that tropical forests harbor most of the high complexity observations, while less than 20% of temperate forests reached median levels of tropical complexity. Structural complexity in tropical forests is more strongly related to canopy attributes from lower and middle waveform layers, whereas in temperate forests upper and middle layers are more influential. Globally, forests exhibit robust scaling relationships between complexity and canopy height, but these vary geographically and by biome. Our results offer insights into the spatial distribution of forest structural complexity and emphasize the importance of considering biome-specific and fine-scale variations for ecological research and management applications. The GEDI Waveform Structural Complexity Index data product, derived from our analyses, provides researchers and conservationists with a single, easily interpretable metric by combining various aspects of canopy structure. Forest structural complexity plays a crucial role in ecosystem functioning, influencing factors like light, nutrient cycling, and biodiversity. Here, a global map of 3D canopy complexity modeled from spaceborne lidar reveals that highly complex forests are concentrated in the tropics, with significant variations observed across biomes."
10.1038/s43247-024-01659-2,False,Communications Earth & Environment,该研究主要关注的是利用地震噪声数据来探测火山内部结构，特别是岩浆系统。它使用了一种称为矩阵成像的技术，通过分析地震噪声的反射矩阵来重建火山内部的结构。该研究与大气环境遥感技术没有直接关系，它更偏向于地球物理学和火山学领域。,[],Elsa Giraudat;Arnaud Burtin;Arthur Le Ber;Mathias Fink;Jean-Christophe Komorowski;Alexandre Aubry,Matrix imaging as a tool for high-resolution monitoring of deep volcanic plumbing systems with seismic noise,"A matrix approach for seismic imaging reveals the plumbing system of La Soufrière volcano, Guadeloupe. Seismic noise correlations yield a reflection matrix whose physics-based post-processing allows an optimized focusing through volcano heterogeneities. 
 Volcanic eruptions necessitate precise monitoring of magma pressure and inflation for improved forecasting. Understanding deep magma storage is crucial for hazard assessment, yet imaging these systems is challenging due to complex heterogeneities that disrupt standard seismic migration techniques. Here we map the magmatic and hydrothermal system of the La Soufrière volcano in Guadeloupe by analyzing seismic noise data from a sparse geophone array under a matrix formalism. Seismic noise interferometry provides a reflection matrix containing the signature of echoes from deep heterogeneities. Using wave correlations resistant to disorder, matrix imaging successfully unscrambles wave distortions, revealing La Soufrière’s internal structure down to 10 km with 100 m resolution. This method surpasses the diffraction limit imposed by geophone array aperture, providing crucial data for modeling and high-resolution monitoring. We see matrix imaging as a revolutionary tool for understanding volcanic systems and enhancing observatories’ abilities to monitor dynamics and forecast eruptions. 
                
                  
                
               A matrix approach for seismic imaging reveals the plumbing system of La Soufrière volcano, Guadeloupe. Seismic noise correlations yield a reflection matrix whose physics-based post-processing allows an optimized focusing through volcano heterogeneities."
None,False,Remote Sensing of Environment,由于没有提供论文标题和摘要，无法判断其与大气环境遥感技术的关系。,[],,Editorial Board,
