doi,is_relevant,journal,explanation,topic_words,authors,title,abstract
10.1029/2024JD041645,True,Journal of Geophysical Research: Atmospheres,这篇论文研究了中国东北地区春季高温事件(SHTE)的年际变化及其与大气环流的联系。研究发现，自1992/93年以来，SHTE的年际变化增强，这与北大西洋四极型海表温度异常(NAQSSTA)和春季西伯利亚积雪深度(SSSD)密切相关。NAQSSTA可以通过增加低层大气斜压性激发罗斯比波，进而影响中国东北地区的大气环流，导致高温事件的发生。西伯利亚积雪深度增加也起到了促进作用。该研究使用了相关分析和模型模拟等方法，揭示了SHTE年际变化增强的机制。虽然文中没有直接提到具体的空气质量监测或大气成分分析技术，但其研究内容与利用卫星观测数据分析大气温度、云量、辐射通量等要素密切相关，这些数据是许多大气环境遥感技术的基础。因此，该研究与大气环境遥感技术具有很强的关联性。,"['temperature', 'radiation flux', 'cloud cover', 'snow depth', 'sea surface temperature', 'geopotential height', 'satellite observations', 'atmospheric circulation', 'Rossby waves']",Qixin Wen;Huopo Chen,Enhanced Interannual Variability of the Spring High‐Temperature Events Over Northeast China and the Associated Mechanisms,"The spring‐high temperature events (SHTE) over northeast China (NEC) and the related local atmospheric factors including cloud cover, radiation flux, and soil moisture exhibited an increased interannual variability after 1992/93. Correlation analyses reveal that both the North Atlantic quadrupole sea surface temperature anomalies (NAQSSTA) and the spring Siberian snow depth (SSSD) had a stronger linkage with SHTE since the early 1990s. Additionally, the interannual variability of SSSD also showed an interdecadal increase, which is a key factor in the changes of interannual variability of SHTE. Further analyses showed that the NAQSSTA could excite Rossby wave via increasing low‐level atmospheric baroclinicity during 1993–2017. One branch of the wave trains propagated eastward and the other branch propagated northeastward through the Siberian high latitudes, which eventually reached NEC together and resulted in local anomalous anticyclonic circulation and sinking motion. The latter branch could contribute to the low geopotential height and cyclonic anomalies over the Siberian high latitudes, which further favored the increase of snow depth there. Subsequently, the positive snow anomalies facilitate the more occurrences of SHTE by exacerbating the meridional thickness gradient between the polar region and mid‐latitudes and then limiting the Arctic cold air to invade into the south. Meanwhile, the positive polar‐Eurasian pattern (POL) associated with higher SSSD could guide the Rossby wave train originating from the North Atlantic to propagate northeastward, which is consistent with the SHTE‐related wave train path after 1992/93. Model results further reproduce the physical processes that linking the NAQSSTA with SHTE."
10.1029/2024JD041021,False,Journal of Geophysical Research: Atmospheres,这篇论文主要研究的是智利阿塔卡马沙漠夏季降雨的成因，特别是“潮湿北风”（MNs）的作用。研究发现，来自热带太平洋的水汽输送与安第斯山脉西坡的 diurnal circulation 相结合，是导致阿塔卡马沙漠降雨的重要机制。论文利用地表观测、再分析数据和高分辨率模拟结果，揭示了 MNs 的天气学特征及其与大气环流（如玻利维亚高压）的关系，并分析了其与ENSO和MJO等气候模态的关系。虽然论文提到了卫星遥感数据在获取信息上的局限性，但其核心内容并非关注大气环境遥感技术本身，而是利用观测数据来解释一个特定区域的降水机制。因此，它与大气环境遥感技术的关联度不高。,"['water vapor', 'precipitation', 'moisture transport', 'cloud formation', 'summer rainfall', 'climate variability', 'Madden-Julian Oscillation', 'La Niña']",José Vicencio Veloso;Christoph Böhm;Jan H. Schween;Ulrich Löhnert;Susanne Crewell,The Overlooked Role of Moist Northerlies as a Source of Summer Rainfall in the Hyperarid Atacama Desert,"In the Atacama Desert, one of the driest places on Earth, the persistent absence of water preserves the record of environmental change, making it an invaluable proxy for studying the evolution of life on Earth. Due to the scarcity of in situ measurements and difficulties in satellite remote sensing, information on precipitation characteristics is limited even for the present climate. Guided by a case study of extreme precipitation in late January 2019, we derive a conceptual framework to explain how moisture transport combined with the diurnal circulation produces rainfall. We found a synoptic‐scale weather pattern that we named “moist northerlies” (MNs) based on surface observations, reanalysis, and high‐resolution simulation. During an MN event, moisture transport from the tropical Pacific is observed in the lower free‐troposphere in the forefront of an 850 hPa low‐pressure offshore Atacama. The diurnal circulation along the western Andean slope transports the moist free tropospheric air above the marine boundary layer inland, triggering clouds and storms. A trough over the southeast Pacific and a southward displaced Bolivian High seem to drive the MNs dynamically. Long‐term observations (1960–2020) show that most of the rainy days in the hyperarid core (75%) are triggered by MNs, occurring more frequently during neutral/La Niña conditions and phases 7‐8‐1 of the Madden‐Julian oscillation (MJO). A trend analysis (1991–2020) reveals that summer water vapor along the west coast of South America has increased rapidly due to the MNs, enhancing summer rainfall in Atacama. The implications of climate change and other climate variability modes are discussed."
10.1029/2024EF005070,False,Earth's Future,这篇论文主要关注中国干旱地区，特别是天山北坡地区，由于灌溉需求增加导致的持续水资源短缺问题。研究使用了一个集成的农业水文模型来模拟历史和未来的水文过程以及作物需水量，预测了在不同气候情景下（2030-2050年）该地区的水资源状况。结果表明，虽然降水量略有增加，但气温升高和灌溉需求增加导致水资源短缺问题加剧，部分地区地下水枯竭风险高，许多流域将面临持续的水资源短缺。因此，论文的重点在于水资源管理和可持续发展，与大气环境遥感技术，例如空气质量监测、卫星观测和大气成分分析等，并没有直接关系。,[],Xingcai Liu;Qiuhong Tang;Ying Zhao;Puyu Wang,Persistent Water Scarcity Due To High Irrigation Demand in Arid China: A Case Study in the North Slope of the Tianshan Mountains,"Water scarcity is a critical threat in arid regions in China due to dry climate and rising human water demand. The sustainability of a recent wetter trend and its impact on future water security remain uncertain. This case study focuses on a hotspot region, the North Slope of the Tianshan Mountains (NSTM), to assess water scarcity in the coming decades (2030–2050) under two climate scenarios. To this end, we developed an integrated agro‐hydrological model to simulate historical and future hydrological processes and crop water dynamics in arid regions. Our results indicate nonsignificant increases in precipitation (around 3%) and evident rising temperatures (0.9–1.5°C) in the NSTM compared to the present‐day (2011–2020) climate. This translates to a projected increase in water availability (5.6%–11.2%) during 2030–2050, with slightly larger increases (6.3%–14%) in glacier runoff. However, the spatial mismatch between precipitation increases and water demand makes this potential gain largely offset by rising irrigation water demand (over 7%) if cropland remains constant from 2020 onwards. As a result, the current annual water deficit (3.3 km3) is likely to increase by 5%–11%, with 32% of NSTM basins facing persistent water scarcity. Most croplands are at high risk of groundwater depletion and 17%–34% of basins will experience intensified water scarcity. These findings highlight the urgent need for comprehensive water management strategies, including improved irrigation efficiency and exploration of alternative water sources, to ensure water security and sustainable development in arid China facing a changing climate."
10.1038/s41467-024-53274-6,False,Nature Communications,这篇论文主要关注的是电力系统中的长期储能技术，以及在不同发电组合、输电扩张决策、储能成本和储能指令下，长期储能技术在零排放电网中的价值。它使用Switch容量扩展模型模拟了一个零排放的西部互联电网，研究了不同情景下长期储能技术的价值。研究结果表明，长期储能技术在以风能为主的地区和水力发电减少的地区特别有价值；如果储能资本成本低于5美元/千瓦时，季节性储能运行将具有成本效益；强制安装足够的长期储能以实现全年储能循环，可以将高需求时段的电价降低70%以上。该研究与大气环境遥感技术，例如空气质量监测、卫星观测和大气成分分析等，没有直接关系。,[],Martin Staadecker;Julia Szinai;Pedro A. Sánchez-Pérez;Sarah Kurtz;Patricia Hidalgo-Gonzalez,The value of long-duration energy storage under various grid conditions in a zero-emissions future,"This study models a zero-emissions Western North American grid to provide guidelines and understand the value of long-duration storage as a function of different generation mixes, transmission expansion decisions, storage costs, and storage mandates. 
 Long-duration energy storage (LDES) is a key resource in enabling zero-emissions electricity grids but its role within different types of grids is not well understood. Using the Switch capacity expansion model, we model a zero-emissions Western Interconnect with high geographical resolution to understand the value of LDES under 39 scenarios with different generation mixes, transmission expansion, storage costs, and storage mandates. We find that a) LDES is particularly valuable in majority wind-powered regions and regions with diminishing hydropower generation, b) seasonal operation of storage becomes cost-effective if storage capital costs fall below US$5 kWh−1, and c) mandating the installation of enough LDES to enable year-long storage cycles would reduce electricity prices during times of high demand by over 70%. Given the asset and resource diversity of the Western Interconnect, our results can provide grid planners in many regions with guidance on how LDES impacts and is impacted by energy storage mandates, investments in LDES research and development, and generation mix and transmission expansion decisions. This study models a zero-emissions Western North American grid to provide guidelines and understand the value of long-duration storage as a function of different generation mixes, transmission expansion decisions, storage costs, and storage mandates."
10.1038/s41467-024-53859-1,False,Nature Communications,这篇论文研究的是细胞黏着斑中talin和vinculin蛋白对肌动蛋白组装的调控作用。它结合了生物化学和细胞生物学的方法，研究了talin和vinculin蛋白复合物如何通过控制肌动蛋白聚合来增强肌动蛋白与黏着斑的连接，从而使细胞能够抵抗外力。研究发现，模拟机械拉伸的talin突变体和激活的vinculin突变体的结合，会触发一个肌动蛋白丝成核、封端和释放的级联机制，从而促进肌动蛋白丝的延伸。这与在细胞中表达相同组成型突变体的实验结果一致，都表明应力纤维的生长速度加快。总的来说，这项研究揭示了一种细胞黏着斑中肌动蛋白组装的调控机制，与大气环境遥感技术，例如空气质量监测、卫星观测和大气成分分析等，没有任何关系。,[],Hong Wang;Rayan Said;Clémence Nguyen-Vigouroux;Véronique Henriot;Peter Gebhardt;Julien Pernier;Robert Grosse;Christophe Le Clainche,Talin and vinculin combine their activities to trigger actin assembly,"In cells, focal adhesions (FAs) strengthen their connection with the actin cytoskeleton to resist force. By combining biochemistry and cell biology, the authors show that the proteins talin and vinculin control actin assembly, thus reinforcing the anchoring of actin to FAs. 
 Focal adhesions (FAs) strengthen their link with the actin cytoskeleton to resist force. Talin-vinculin association could reinforce actin anchoring to FAs by controlling actin polymerization. However, the actin polymerization activity of the talin-vinculin complex is not known because it requires the reconstitution of the mechanical and biochemical activation steps that control the association of talin and vinculin. By combining kinetic and binding assays with single actin filament observations in TIRF microscopy, we show that the association of talin and vinculin mutants, mimicking mechanically stretched talin and activated vinculin, triggers a sequential mechanism in which filaments are nucleated, capped and released to elongate. In agreement with these observations, FRAP experiments in cells co-expressing the same constitutive mutants of talin and vinculin revealed accelerated growth of stress fibers. Our findings suggest a versatile mechanism for the regulation of actin assembly in FAs subjected to various combinations of biochemical and mechanical cues. In cells, focal adhesions (FAs) strengthen their connection with the actin cytoskeleton to resist force. By combining biochemistry and cell biology, the authors show that the proteins talin and vinculin control actin assembly, thus reinforcing the anchoring of actin to FAs."
10.1038/s41467-024-53866-2,False,Nature Communications,这篇论文研究的是小鼠海马体中与社会奖励相关的环境记忆的神经机制。研究使用了体内电生理记录、体内单光子钙成像和光遗传学技术，发现腹侧海马体神经元能够区分具有中性或获得性社会奖励价值的环境，并且这种区分过程依赖于蓝斑的输入。该研究主要关注的是神经科学领域，与大气环境遥感技术，例如空气质量监测、卫星观测和大气成分分析等，没有任何关系。,[],Joana Mendes Duarte;Robin Nguyen;Marios Kyprou;Kaizhen Li;Anastasija Milentijevic;Carlo Cerquetella;Thomas Forro;Stéphane Ciocchi,Hippocampal contextualization of social rewards in mice,"The neuronal mechanisms serving contextual memories of socially rewarding stimuli are unclear. Here the authors demonstrate that neurons in the ventral hippocampus of male mice discriminate between neutral and socially rewarding contexts, a process dependent on input from the locus coeruleus. 
 Acquiring and exploiting memories of rewarding experiences is critical for survival. The spatial environment in which a rewarding stimulus is encountered regulates memory retrieval. The ventral hippocampus (vH) has been implicated in contextual memories involving rewarding stimuli such as food, social cues or drugs. Yet, the neuronal representations and circuits underlying contextual memories of socially rewarding stimuli are poorly understood. Here, using in vivo electrophysiological recordings, in vivo one-photon calcium imaging, and optogenetics during a social reward contextual conditioning paradigm in male mice, we show that vH neurons discriminate between contexts with neutral or acquired social reward value. The formation of context-discriminating vH neurons following learning was contingent upon the presence of unconditioned stimuli. Moreover, vH neurons showed distinct contextual representations during the retrieval of social reward compared to fear contextual memories. Finally, optogenetic inhibition of locus coeruleus (LC) projections in the vH selectively disrupted social reward contextual memory by impairing vH contextual representations. Collectively, our findings reveal that the vH integrates contextual and social reward information, with memory encoding of these representations supported by input from the LC. The neuronal mechanisms serving contextual memories of socially rewarding stimuli are unclear. Here the authors demonstrate that neurons in the ventral hippocampus of male mice discriminate between neutral and socially rewarding contexts, a process dependent on input from the locus coeruleus."
10.1038/s41467-024-53899-7,False,Nature Communications,这篇论文研究的是秀丽隐杆线虫神经系统中两种神经肽的相互作用及其对运动速度的影响。研究发现，NLP-10神经肽加速运动，而FLP-1神经肽则通过抑制NLP-10的分泌来减缓运动。这两种神经肽在同一个神经元对中表达，并通过自分泌反馈机制相互作用，从而微调线虫对不同刺激的反应。该研究主要关注神经生物学领域，与大气环境遥感技术，例如空气质量监测、卫星观测和大气成分分析等，没有任何关系。,[],Ichiro Aoki;Luca Golinelli;Eva Dunkel;Shripriya Bhat;Erschad Bassam;Isabel Beets;Alexander Gottschalk,Hierarchical regulation of functionally antagonistic neuropeptides expressed in a single neuron pair,"Whether and how different neuropeptides in the same neuron might be differentially regulated are not fully understood. This study in C. elegans demonstrates that the signaling of two neuropeptides, expressed in the same neuron, interacts through autocrine feedback. Their antagonistic functions fine-tune behavior in response to different stimuli. 
 Neuronal communication involves small-molecule transmitters, gap junctions, and neuropeptides. While neurons often express multiple neuropeptides, our understanding of the coordination of their actions and their mutual interactions remains limited. Here, we demonstrate that two neuropeptides, NLP-10 and FLP-1, released from the same interneuron pair, AVKL/R, exert antagonistic effects on locomotion speed in Caenorhabditis elegans. NLP-10 accelerates locomotion by activating the G protein-coupled receptor NPR-35 on premotor interneurons that promote forward movement. Notably, we establish that NLP-10 is crucial for the aversive response to mechanical and noxious light stimuli. Conversely, AVK-derived FLP-1 slows down locomotion by suppressing the secretion of NLP-10 from AVK, through autocrine feedback via activation of its receptor DMSR-7 in AVK neurons. Our findings suggest that peptidergic autocrine motifs, exemplified by the interaction between NLP-10 and FLP-1, might represent a widespread mechanism in nervous systems across species. These mutual functional interactions among peptidergic co-transmitters could fine-tune brain activity. Whether and how different neuropeptides in the same neuron might be differentially regulated are not fully understood. This study in C. elegans demonstrates that the signaling of two neuropeptides, expressed in the same neuron, interacts through autocrine feedback. Their antagonistic functions fine-tune behavior in response to different stimuli."
10.1038/s41467-024-53821-1,False,Nature Communications,这篇论文研究的是胃肠道间质瘤（GIST）的基因组和转录组学特征。研究人员分析了117个GIST样本，发现了四种分子亚型，并在高危/转移性GIST中发现了反复出现的YLPM1基因失活突变。该研究与大气环境遥感技术，例如空气质量监测、卫星观测和大气成分分析，没有任何关系。研究关注的是人类疾病的分子机制，而非大气环境。,[],Feifei Xie;Shuzhen Luo;Dongbing Liu;Xiaojing Lu;Ming Wang;Xiaoxiao Liu;Fujian Jia;Yuzhi Pang;Yanying Shen;Chunling Zeng;Xinli Ma;Daoqiang Tang;Lin Tu;Linxi Yang;Yumei Cheng;Yuxiang Luo;Fanfan Xie;Hao Hou;Tao Huang;Bo Ni;Chun Zhuang;Wenyi Zhao;Ke Li;Xufen Zheng;Wenbo Bi;Xiaona Jia;Yi He;Simin Wang;Hui Cao;Kui Wu;Yuexiang Wang,Genomic and transcriptomic landscape of human gastrointestinal stromal tumors,"Gastrointestinal stromal tumours (GISTs) are clinically heterogeneous, with varying degrees of aggressiveness. Here, the authors describe the genomic and transcriptomic landscape of 117 GISTs from 105 patients; they find four molecular subtypes as well as recurrent inactivating YLPM1 mutations in high-risk/metastatic GIST. 
 Gastrointestinal stromal tumor (GISTs) are clinically heterogenous exhibiting varying degrees of disease aggressiveness in individual patients. We comprehensively describe the genomic and transcriptomic landscape of a cohort of 117 GISTs including 31 low-risk, 18 intermediate-risk, 29 high-risk, 34 metastatic and 5 neoadjuvant GISTs from 105 patients. GISTs have notably low tumor mutation burden but widespread copy number variations. Aggressive GISTs harbor remarkably more genomic aberrations than low-/intermediate-risk GISTs. Complex genomic alterations, chromothripsis and kataegis, occur selectively in aggressive GISTs. Despite the paucity of mutations, recurrent inactivating YLPM1 mutations are identified (10.3%, 7 of 68 patients), enriched in high-risk/metastatic GIST and functional study further demonstrates YLPM1 inactivation promotes GIST proliferation, growth and oxidative phosphorylation. Spatially and temporally separated GISTs from individual patients demonstrate complex tumor heterogeneity in metastatic GISTs. Finally, four prominent subtypes are proposed with different genomic features, expression profiles, immune characteristics, clinical characteristics and subtype-specific treatment strategies. This large-scale analysis depicts the landscape and provides further insights into GIST pathogenesis and precise treatment. Gastrointestinal stromal tumours (GISTs) are clinically heterogeneous, with varying degrees of aggressiveness. Here, the authors describe the genomic and transcriptomic landscape of 117 GISTs from 105 patients; they find four molecular subtypes as well as recurrent inactivating YLPM1 mutations in high-risk/metastatic GIST."
10.1038/s41467-024-53416-w,False,Nature Communications,这篇论文研究的是人类如何在新的环境或身体状况下（例如，穿新鞋走路）适应并改进他们的行走方式。研究人员提出了一种模型，该模型将运动适应描述为一个快速反应的稳定控制器和一个通过局部探索和记忆逐渐改进控制器性能的强化学习器之间的相互作用。该模型能够预测多种情况下（例如，使用不对称腿部重量或外骨骼行走）随时间变化的适应性，并能解释先前实验中观察到的学习和泛化现象。研究关注的是运动控制和学习机制，而非大气环境遥感技术。因此，它与大气环境遥感技术，例如空气质量监测、卫星观测和大气成分分析等，没有直接关系。,[],Nidhi Seethapathi;Barrett C. Clark;Manoj Srinivasan,Exploration-based learning of a stabilizing controller predicts locomotor adaptation,"People learn to walk better over time in novel situations, such as walking with new shoes. Here, the authors show that such adaptive behavior relies on a stabilizer that reacts quickly to keep the walker from falling, explaining how this stabilizer is gradually modified to improve performance. 
 Humans adapt their locomotion seamlessly in response to changes in the body or the environment. It is unclear how such adaptation improves performance measures like energy consumption or symmetry while avoiding falling. Here, we model locomotor adaptation as interactions between a stabilizing controller that reacts quickly to perturbations and a reinforcement learner that gradually improves the controller’s performance through local exploration and memory. This model predicts time-varying adaptation in many settings: walking on a split-belt treadmill (i.e. with both feet at different speeds), with asymmetric leg weights, or using exoskeletons — capturing learning and generalization phenomena in ten prior experiments and two model-guided experiments conducted here. The performance measure of energy minimization with a minor cost for asymmetry captures a broad range of phenomena and can act alongside other mechanisms such as reducing sensory prediction error. Such a model-based understanding of adaptation can guide rehabilitation and wearable robot control. People learn to walk better over time in novel situations, such as walking with new shoes. Here, the authors show that such adaptive behavior relies on a stabilizer that reacts quickly to keep the walker from falling, explaining how this stabilizer is gradually modified to improve performance."
