doi,is_relevant,journal,explanation,topic_words,authors,title,abstract
10.1038/s43247-024-01684-1,False,Communications Earth & Environment,这篇论文主要关注的是印度尼西亚的法律领域，探讨了气候变化相关诉讼的趋势和案例。论文分析了2010年至2020年间印度尼西亚刑事和民事法院审理的案件，发现超过100起案件涉及气候变化相关内容。论文重点关注了这些案件的类型、驱动因素和影响，以及它们对印度尼西亚气候变化诉讼发展的影响。论文没有涉及大气环境遥感技术，例如空气质量监测、卫星观测或大气成分分析。,[],Linda Yanti Sulistiawati,Climate change related litigation in Indonesia,"Over the past decade, more than a hundred cases that have mentioned climate change in the main claim, argument, or evidence have been brought to criminal and civil courts in Indonesia, and they are essential for the development of climate change litigation, according to a review of court decisions between 2010 and 2020. 
 Indonesia contributes to greenhouse gas emissions but is also vulnerable to climate change. However, the country does not have a single, overarching law explicitly addressing climate change. Climate litigation is now used in Indonesia to hold governments and corporations accountable. Here, I review the courts’ decisions for criminal and civil climate change-related cases between 2010 and 2020 and highlight trends and examples of case studies, driving factors, and impacts of climate litigation cases in Indonesia. I show that 112 climate change-related cases were brought to Indonesian courts, most of which were criminal cases concerning forestry or forest fires. In addition, there were a number of civil court cases. The cases use phrases concerning climate change in their main claim, argument, evidence, expert witness arguments, and judgments. They are regarded as incidental climate change litigation cases. However, these cases are essential in developing climate change litigation in Indonesia because they open up a discussion of climate change issues in the Indonesian courts and public media. Over the past decade, more than a hundred cases that have mentioned climate change in the main claim, argument, or evidence have been brought to criminal and civil courts in Indonesia, and they are essential for the development of climate change litigation, according to a review of court decisions between 2010 and 2020."
10.1038/s43247-024-01660-9,True,Communications Earth & Environment,这篇论文研究了东亚地区千年尺度的降水变化，发现东南亚和华北地区的降水变化同步，而中西南地区的降水变化与之不同步。论文认为，西太平洋副热带高压的强度变化是造成这种降水异质性的主要原因，并指出太阳活动增强会导致西太平洋副热带高压增强并向北向西扩展，从而导致东亚季风区出现三极降水异质性模式。该研究利用了亚洲降水记录，并结合了卫星观测和大气环流模式分析，对理解东亚地区降水变化及其驱动机制具有重要意义。,"['rainfall', 'precipitation', 'satellite observations', 'atmospheric circulation', 'western Pacific subtropical high', 'solar activity']",Hai Xu;Yunping Song;Jian Cao;Jianghu Lan;Jin Zhang;Kang’en Zhou;Jing Wang;Peng Cheng;Bing Hong;Jun Cheng;Liangcheng Tan,Heterogeneity of the East Asian rainfall influenced by solar-forced western Pacific subtropical high,"Over the past millennium, subtropical east Asia has experienced rainfall heterogeneity, with synchronous variations in southeast Asia and north China but heterogeneous rainfall patterns in central to southwest China due to the influence of the western Pacific subtropical high, according to analysis of Asian precipitation records. 
 The existence and causes of the recently observed rainfall heterogeneity over monsoonal east Asia in historical periods remain unclear. Here we show that such rainfall heterogeneity has been present at least in the last millennium, with decadal to centennial precipitation variations over southeast Asia and north China being broadly synchronous, while central to southwest China’s variations are generally out-of-phase with those in southeast Asia and north China. We propose that the western Pacific subtropical high, which reduces decadal to centennial precipitation over central to southwest China due to its anticyclonic feature, could be responsible for the observed rainfall heterogeneity over subtropical East Asia. Further analyses suggest that intensified decadal to centennial solar activity can lead to enhanced and northward and westward extension of the western Pacific subtropical high, resulting in tripolar rainfall heterogenous patterns over monsoonal East Asia. Over the past millennium, subtropical east Asia has experienced rainfall heterogeneity, with synchronous variations in southeast Asia and north China but heterogeneous rainfall patterns in central to southwest China due to the influence of the western Pacific subtropical high, according to analysis of Asian precipitation records."
10.1016/j.rse.2024.114407,True,Remote Sensing of Environment,这篇论文主要研究了利用地球静止轨道环境卫星-R系列（GOES-R）上的先进基线成像仪（ABI）传感器进行陆地表面物候研究。论文提出了一种基于恒定散射角（CSA）标准的太阳几何定义方法，用于校正ABI反射率，从而减少太阳几何变化对反射率和植被指数的影响。研究结果表明，CSA校正后的ABI EVI2时间序列与VIIRS NBAR EVI2时间序列以及PhenoCam观测结果一致。这说明该方法可以有效地用于陆地表面物候研究，并为利用GOES-R ABI数据进行全球植被监测提供了新的思路。,"['satellite observations', 'GOES-R', 'ABI', 'vegetation monitoring', 'land surface phenology', 'reflectance', 'EVI2', 'BRDF']",Shuai Gao;Xiaoyang Zhang;Hankui K. Zhang;Yu Shen;David P. Roy;Weile Wang;Crystal Schaaf,A new constant scattering angle solar geometry definition for normalization of GOES-R ABI reflectance times series to support land surface phenology studies,"•Constant Scattering Angle (CSA) criterion is proposed to normalize ABI reflectance. •CSA criterion minimizes the impact of solar geometry on ABI reflectance and EVI2. •CSA-adjusted ABI EVI2 is comparable with VIIRS NBAR EVI2 time series. •CSA-adjusted ABI EVI2 detects phenometrics similar to PhenoCam observations. 
 The Advanced Baseline Imager (ABI) sensors on the Geostationary Operational Environment Satellite-R series (GOES-R) broaden the application of global vegetation monitoring due to their higher temporal (5–15 min) and appropriate spatial (0.5–1 km) resolution compared to previous geostationary and current polar-orbiting sensing systems. Notably, ABI Land Surface Phenology (LSP) quantification may be improved due to the greater availability of cloud-free observations as compared to those from legacy GOES satellite generations and from polar-orbiting sensors such as the Moderate Resolution Imaging Spectroradiometer (MODIS) and Visible Infrared Imaging Radiometer Suite (VIIRS). Geostationary satellites sense a location with a fixed view geometry but changing solar geometry and consequently capture pronounced temporal reflectance variations over anisotropic surfaces. These reflectance variations can be reduced by application of a Bidirectional Reflectance Distribution Function (BRDF) model to adjust or predict the reflectance for a new solar geometry and a fixed view geometry. Empirical and semi-empirical BRDF models perform less effectively when used to predict reflectance acquired at angles not found in the observations used to parameterize the model, or acquired under hot-spot sensing conditions when the solar and viewing directions coincide. Consequently, using a fixed solar geometry or even the geometry at local solar noon may introduce errors due to diurnal and seasonal variations in the position of the sun and the incidence of hot-spot sensing conditions. In this paper, a new solar geometry definition based on a Constant Scattering Angle (CSA) criterion is presented that, as we demonstrate, reduces the impacts of solar geometry changes on reflectance and derived vegetation indices used for LSP quantification. The CSA criterion is used with the Ross-Thick-Li-Sparse (RTLS) BRDF model applied to North America ABI surface reflectance data acquired by GOES-16 (1 January 2018 to 31 December 2020) and GOES-17 (1 January 2019 to 31 December 2020) to normalize solar geometry BRDF effects and generate 3-day two-band Enhanced Vegetation Index (EVI2) time series. Compared to the local solar noon geometry, the CSA criterion is shown to reduce solar geometry reflectance and EVI2 time series artifacts. Further, comparison with contemporaneous VIIRS NBAR (Nadir BRDF-Adjusted Reflectance) EVI2 time series is also presented to illustrate the efficacy of the CSA criterion. Finally, the CSA-adjusted EVI2 time series are shown to produce LSP results that agree well with PhenoCam-based observations, with no obvious systematic bias in onsets of vegetation maturity, senescence, and dormancy dates compared to about 10-day bias found with local solar noon adjusted EVI2 time series."
None,False,Remote Sensing of Environment,由于没有提供标题和摘要，无法判断该研究论文是否与大气环境遥感技术相关。,[],,Editorial Board,
10.1016/j.jag.2024.104175,True,International Journal of Applied Earth Observation and Geoinformation,这篇论文研究了利用欧洲航天局 (ESA) 气候变化倡议 (CCI) 开发的全球每日土壤湿度 (SM) 数据集来评估印度南部高原和丘陵 (SPH) 的农业干旱。论文比较了基于参数分布的标准化土壤湿度指数 (SSMI) 和基于非参数分布的经验标准化土壤湿度指数 (ESSMI) 的性能，并将其与标准化降水指数 (SPI) 和标准化降水蒸散指数 (SPEI) 进行比较。研究发现，基于 SM 的指数有效地捕捉了不同季节的干湿变化，并且 SSMI 比 ESSMI 更能捕捉到极端干旱区域。此外，论文还引入了动态阈值运行理论 (DTRT) 来识别和表征干旱事件，包括其持续时间、频率、强度和峰值。总体而言，该研究突出了 ESACCI SM 产品在表征农业干旱方面的有效性。,"['soil moisture', 'satellite observations', 'agricultural drought monitoring', 'remote sensing']",Hussain Palagiri;Manali Pal,"Parametric and non-parametric indices for agricultural drought assessment using ESACCI soil moisture data over the Southern Plateau and Hills, India","•Satellite soil moisture has a great potential for agricultural drought monitoring. •Parametric distribution-based index better captured the extreme droughts. •Dynamic Threshold Run Theory is proposed to identify drought events. •Areas facing frequent droughts in SPH also endure longer periods. 
 The European Space Agency (ESA) under the Climate Change Initiative (CCI) has developed a multi-satellite global, daily Soil Moisture (SM) dataset that has paved the ways for agricultural drought studies. To evaluate the performance of this ESACCI SM, two SM-based indices i.e. parametric distribution-based Standardized Soil Moisture Index (SSMI) and non-parametric distribution-based Empirical Standardized Soil Moisture Index (ESSMI) are computed to characterize agricultural drought in the Southern Plateau and Hills (SPH) in India from 1991 to 2020. SSMI and ESSMI are then compared with the Standardized Precipitation Index (SPI) and Standardized Precipitation Evapotranspiration Index (SPEI). The yearly temporal analysis revealed a consistent pattern among all the four indices with 2003 and 2020 marked as the driest and wettest years, respectively. On the other hand, monthly temporal analysis indicated SSMI and ESSMI lagged behind SPI and ESSMI suggesting a delayed response of SM to precipitation. Spatial distributions of indices showed that the SM-based indices effectively capture temporal variations of dryness or wetness across seasons. The near normal and mild to moderate droughts predominated (both spatially and temporally) the SPH and SSMI better captured the extreme drought areas compared to ESSMI. Further, Dynamic Threshold Run Theory (DTRT) is introduced to identify and characterize drought events based on their duration, frequency, intensity and peak. The findings revealed a resemblance in spatial distribution between the duration and frequency. The drought peak and intensity revealed a moderate nature of drought conditions. Overall, this study highlights the effectiveness of ESACCI SM product to characterize the agricultural droughts."
10.1016/j.jag.2024.104159,False,International Journal of Applied Earth Observation and Geoinformation,这篇论文主要关注的是利用卫星遥感技术进行欧洲地区的作物类型识别，研究重点在于冬季作物类型识别和跨国作物分类。论文使用了ESA的Sentinel-2卫星数据，并结合欧盟的农业申报数据和分层作物农业分类体系（HCAT）进行分析。研究结果表明，深度学习模型能够有效识别欧洲大陆的主要冬季作物类型，HCAT在跨国作物分类方面也表现出良好的效果。整体而言，论文的重点在于利用遥感技术进行作物类型识别，而非大气环境遥感技术，例如空气质量监测、卫星观测和大气成分分析。,"['satellite', 'Sentinel-2', 'crop type mapping', 'land use']",David Gackstetter;Marco Körner;Kang Yu,Approaching holistic crop type mapping in Europe through winter vegetation classification and the Hierarchical Crop and Agriculture Taxonomy,"•Feasibility to detect diverse range of winter vegetation types in continental Europe. •Low influence of winter months and snow even when considering only off-season. •Hierarchical Crop and Agriculture Taxonomy overcomes transnational barriers. •Revealing characteristics of winter crop type mapping and optimization potentials. •Advances towards spatially and temporally holistic crop type mapping in Europe. 
 The process of crop type mapping generates land use maps, which serve as critical tools for efficient evaluation of production factors and impacts of agricultural practice. Yet, despite the necessity for comprehensive solutions in space and time, the state of research still exhibits significant limitations in these two dimensions: (1) From a temporal perspective, the primary focus of past research in crop type mapping has been on the economically most meaningful, main-season crops, thereby largely neglecting the explicit study of off-season vegetation despite its pivotal roles in year-round management cycles. (2) Viewed spatially, study areas in crop type mapping show distinct limitations from a multi- and transnational standpoint, despite intense cross-regional and international interrelations of agricultural production and an increasing number of countries publishing crop reference data. With a focus on Europe, this research aims to tackle the two described shortcomings (a) by investigating to what extent a selection of major off-season, winter vegetation types in continental Europe can be classified and (b) by analyzing the transnational applicability of the Hierarchical Crop and Agriculture Taxonomy (HCAT) for remote sensing-based crop type mapping across the European Union (EU). This study uses ESA’s Sentinel-2 satellite data, EU’s administrative farming declarations, and HCAT labels to analyze off-season farming measures, based on a study period from late summer to spring, in Austria, France, Germany, and Slovenia. We demonstrate that deep learning models effectively identify major productive and agroecogically significant winter vegetation in continental Europe. HCAT proves thereby valuable for transnational crop classification, excelling in mixed-country experiments and showing potential for transfer learning. This study’s findings provide a solid foundation for advancing transnational as well as winter and all-year crop type mapping, thereby serving as contribution towards temporally and spatially holistic research on agricultural practices’ sociocultural, economic, and environmental impacts."
None,False,International Journal of Applied Earth Observation and Geoinformation,该论文主要关注中亚干旱地区的地表水储量变化，利用遥感技术分析了水储量的未来挑战。论文并未涉及大气环境遥感技术，例如空气质量监测、卫星观测和大气成分分析。,"['terrestrial water storage', 'arid regions', 'Central Asia', 'remote sensing', 'satellite observations']",Yuzhuo Peng;Hao Zhang;Zhuo Zhang;Bin Tang;Dongdong Shen;Gang Yin;Yaoming Li;Xi Chen;Zengyun Hu;Sulaimon Habib Nazrollozoda,Corrigendum to “Future challenges of terrestrial water storage over the arid regions of Central Asia” [Int. J. Appl. Earth Observ. Geoinf. 132 (2024) 104026],
None,False,International Journal of Applied Earth Observation and Geoinformation,该论文主要研究的是基于传感器融合和置信度更新的自适应多目标跟踪技术，与大气环境遥感技术关系不大。论文主要关注的是如何利用多个传感器信息进行目标跟踪，并通过置信度更新来提高跟踪精度。,"['multi-object tracking', 'sensors fusion', 'confidence updating']",Junting Liu;Deer Liu;Weizhen Ji;Chengfeng Cai;Zhen Liu,Corrigendum to “Adaptive multi-object tracking based on sensors fusion with confidence updating” [Inter. J. Appl. Earth Obs. Geoinform. 125 (2023) 103577],
None,True,International Journal of Applied Earth Observation and Geoinformation,该论文主要关注利用遥感技术识别泥炭火灾区域。泥炭火灾是一种特殊类型的火灾，会释放大量烟雾和有害气体，对空气质量和气候变化产生重大影响。论文利用泥炭火灾指数（Peat Fire Index）来区分泥炭火灾和其他野火，并使用遥感数据进行分析。这表明该论文与大气环境遥感技术密切相关，特别是利用卫星观测数据进行火灾监测和大气成分分析。,"['peat fire', 'fire detection', 'remote sensing', 'satellite observation', 'Earth observation', 'geospatial analysis']",Maria Medvedeva;Victor Itkin;Andrey Sirin,Corrigendum to “Identification of peat-fire-burnt areas among other wildfires using the peat fire index” [Int. J. Appl. Earth Observ. Geoinf. 132 (2024) 103973],
None,False,International Journal of Applied Earth Observation and Geoinformation,由于没有提供论文标题和摘要，无法判断其与大气环境遥感技术的关系。,[],,Editorial Board,
None,False,Science Bulletin,该研究的标题和摘要表明它关注的是盐碱地改良对土壤碳储量的影响，而不是大气环境遥感技术。研究重点是土壤碳库的变化，而不是大气成分的分析。,[],Lin Chen;Guixiang Zhou;Biao Feng;Chao Wang;Yu Luo;Fang Li;Congcong Shen;Donghao Ma;Congzhi Zhang;Jiabao Zhang,Saline-alkali land reclamation boosts topsoil carbon storage by preferentially accumulating plant-derived carbon,
None,True,Science Bulletin,该研究论文关注中国在气候变暖背景下，如何应对同时发生的热浪和臭氧极端事件。这与大气环境遥感技术密切相关，因为臭氧是重要的空气污染物，卫星观测可以用来监测臭氧浓度和热浪事件，并分析大气成分变化。,"['ozone', 'heatwaves', 'air quality', 'satellite observations', 'atmospheric composition analysis']",Mengmeng Li;Xin Huang;Dan Yan;Shiyi Lai;Zihan Zhang;Lei Zhu;Yuting Lu;Xinyi Jiang;Nan Wang;Tijian Wang;Yu Song;Aijun Ding,Coping with the concurrent heatwaves and ozone extremes in China under a warming climate,
None,True,Science Bulletin,这篇论文研究了全新世期间陆地表面暖季温度的千年尺度变化和降温趋势。这与大气环境遥感技术密切相关，因为研究人员可能使用卫星观测数据来分析陆地表面温度的变化。,"['land surface temperature', 'satellite observations', 'remote sensing']",Yukun Zheng;Hongyan Liu;Hongya Wang;Shucheng Xie;Huan Yang;Siwen Feng;Zeyu Zhang;Wenjie Zhao;Boyi Liang,Millennial changes and cooling trends in land surface warm-season temperatures during the Holocene,
None,False,Science Bulletin,该研究论文的标题和摘要表明它与自身免疫性关节炎的治疗有关，重点是使用一种含瓜氨酸的抗原疫苗。 这与大气环境遥感技术，如空气质量监测、卫星观测和大气成分分析无关。,[],Xu Jin;Tianya Dong;Qian Wang;Yang Xie;Xiangyu Fang;Chaonan Wei;Shuyan Liu;Xi Zheng;Ping Wang;Danxue Zhu;Lulu Cao;Suwei Dong;Kechi Fang;Chao Zhong;Jing Wang;Fanlei Hu;Zhanguo Li,A citrullinated antigenic vaccine in treatment of autoimmune arthritis,
None,False,Science Bulletin,这篇论文的标题和摘要表明它与医学图像分割有关，而不是与大气环境遥感技术有关。论文研究的是如何从多个评审者的标注中学习自校准的医学图像分割模型。,[],Junde Wu;Huihui Fang;Jiayuan Zhu;Yu Zhang;Xiang Li;Yuanpei Liu;Huiying Liu;Yueming Jin;Weimin Huang;Qi Liu;Cen Chen;Yanfei Liu;Lixin Duan;Yanwu Xu;Li Xiao;Weihua Yang;Yue Liu,Multi-rater Prism: Learning self-calibrated medical image segmentation from multiple raters,
None,False,Science Bulletin,该研究的标题和摘要表明它关注的是TRPM2通道的激活机制，这是一种与细胞信号传导相关的离子通道。研究重点在于腺苷二磷酸核糖和钙对该通道的影响，与大气环境遥感技术无关。,[],Cheng Ma;Yanping Luo;Congyi Zhang;Cheng Cheng;Ning Hua;Xiaocao Liu;Jianan Wu;Luying Qin;Peilin Yu;Jianhong Luo;Fan Yang;Lin-Hua Jiang;Guojie Zhang;Wei Yang,Evolutionary trajectory of TRPM2 channel activation by adenosine diphosphate ribose and calcium,
None,False,Science Bulletin,该研究主要关注的是电化学二氧化碳还原反应中铜催化剂的压缩应变对生成C2+产物的影响，属于电化学催化领域，与大气环境遥感技术关系不大。,[],Qikui Fan;Pengxu Yan;Fuzhu Liu;Zhongshuang Xu;Pengfei Liang;Xi Cao;Chenliang Ye;Moxuan Liu;Lingyi Zhao;Shan Ren;Huanran Miao;Xiai Zhang;Zhimao Yang;Xiangdong Ding;Jian Yang;Chuncai Kong;Yuen Wu,Compressive strain in Cu catalysts: Enhancing generation of C<sub>2+</sub> products in electrochemical CO<sub>2</sub> reduction,
None,False,Science Bulletin,该研究主要关注的是5-羟甲基糠醛（HMF）的电化学氧化，这是一种与生物质转化和能源化学相关的化学反应。研究中提到了单原子催化剂，但与大气环境遥感技术没有直接联系。,[],Xiaoxia Xia;Jingyi Xu;Xinru Yu;Jing Yang;An-Zhen Li;Kaiyue Ji;Lei Li;Min Ma;Qian Shao;Ruixiang Ge;Haohong Duan,Electro-oxidation of 5-hydroxymethylfurfural in a low-concentrated alkaline electrolyte by enhancing hydroxyl adsorption over a single-atom supported catalyst,
None,False,Science Bulletin,该论文主要关注的是基于层层堆叠结构的全聚合物太阳能电池，通过使用同配铱(III)卡宾配合物作为固体添加剂，实现了超过18.2%的效率。论文研究的是材料科学和光伏领域，与大气环境遥感技术没有直接关系。,[],Hang Zhou;Yingjie Sun;Miao Zhang;Yuheng Ni;Fenghua Zhang;Sang Young Jeong;Tianhuan Huang;Xiong Li;Han Young Woo;Jian Zhang;Wai-Yeung Wong;Xiaoling Ma;Fujun Zhang,Over 18.2% efficiency of layer–by–layer all–polymer solar cells enabled by homoleptic iridium(III) carbene complex as solid additive,
None,False,Science Bulletin,这篇论文主要关注的是纳米级相位管理在二维/三维异质结构中的应用，以提高钙钛矿太阳能电池的效率。它与大气环境遥感技术，如空气质量监测、卫星观测和大气成分分析，没有直接关系。,[],Hao Gu;Annan Zhu;Junmin Xia;Wang Li;Jiahao Zheng;Tao Yang;Shengwen Li;Nan Zhang;Shiliang Mei;Yongqing Cai;Shi Chen;Chao Liang;Guichuan Xing,Nanoscale phase management of the 2D/3D heterostructure toward efficient perovskite solar cells,
None,False,Science Bulletin,该研究主要关注锂电池负极材料的开发，研究了一种新型的锂金属负极材料LiB/Li3BN2复合材料。该材料通过两种相的相互渗透，提高了锂金属负极的稳定性。研究内容与大气环境遥感技术无关。,[],Piao Qing;Shaozhen Huang;Tuoya Naren;Quan Li;Haifeng Huang;Kecheng Long;Zhijian Liu;Lin Mei;Fu Sun;Weifeng Wei;Yu Zhang;Jianmin Ma;Zhibin Wu;Libao Chen,Interpenetrating LiB/Li<sub>3</sub>BN<sub>2</sub> phases enabling stable composite lithium metal anode,
None,False,Science Bulletin,这篇论文主要研究的是W51星云中粒子加速到PeV能量级别的现象，属于天体物理学领域，与大气环境遥感技术关系不大。,"['particle acceleration', 'PeV energies', 'W51 complex']",Zhen Cao;F. Aharonian;Axikegu;Y.X. Bai;Y.W. Bao;D. Bastieri;X.J. Bi;Y.J. Bi;W. Bian;A.V. Bukevich;Q. Cao;W.Y. Cao;Zhe Cao;J. Chang;J.F. Chang;A.M. Chen;E.S. Chen;H.X. Chen;Liang Chen;Lin Chen,Evidence for particle acceleration approaching PeV energies in the W51 complex,
None,False,Science Bulletin,这篇论文研究了约3750年前青藏高原上牛和野牛的杂交现象，主要关注的是古代动物的遗传演化，与大气环境遥感技术关系不大。,[],Shungang Chen;Lele Ren;Yu Gao;Guanghui Dong;Guilian Sheng;Jianlin Han;Xinyi Liu;Ningbo Chen;Fahu Chen,Evidence of hybridization of cattle and aurochs on the Tibetan Plateau ∼3750 years ago,
