doi,is_relevant,journal,explanation,topic_words,authors,title,abstract
10.1029/2024GL111193,False,Geophysical Research Letters,该研究主要关注的是陆地地下卤水与海水交汇的形态特征以及卤水排放窗口的分布情况，主要利用地球物理探测技术进行研究，与大气环境遥感技术关系不大。,[],Yufeng Zhang;Zengbing Sun;Bingxiao Lei;Mingbo Li;Xiujun Guo;Tianyuan Zheng;Jian Luo,Morphology of Brine‐Seawater Interface and Spatial Distribution of Submarine Groundwater Discharge Windows in the Muddy Coast,"The brine‐seawater interface (BSI) is a unique type of groundwater‐seawater interface (GSI) characterized by the higher density of underground brine compared to seawater. This study focuses on characterizing the bay‐scale BSI morphology and identifying submarine‐groundwater discharge windows using a comprehensive in‐situ geophysical detection on the south bank of Laizhou Bay. Our findings reveal that the BSI forms an extensive mixing zone (15–20 km) without distinct contours between waters of varying salinities. The discharge windows for underground brine are located in nearshore areas with fine sand distribution and offshore pockmark areas. Hydraulic and salinity gradients drive the underground brine discharge through these windows. The aquitard window is the primary area for shallow and deep brine exchange, likely evolved from paleochannels, ancient tidal creeks, or ancient underwater barriers. These findings provide crucial modeling support for analyzing environmental evolution mechanisms and theoretical basis for planning the underground brine mining in similar coastal regions."
10.1029/2024GL109766,False,Geophysical Research Letters,这篇论文主要研究了2023年10月日本伊豆小笠原群岛发生的独特地震和海啸事件。研究发现，地震的P波和S波几乎不可见，只有T波明显，而海啸波及了伊豆小笠原群岛和日本西南太平洋沿岸的广阔区域。研究人员推测T波的源头位于Sofu海山，该海山此前未被认为是活跃的火山。在事件发生后一个月进行的海山测深调查发现，海山具有火山口和中心锥的特征，与1987年的测深结果相比，火山口的地形发生了显著变化，例如中心锥上形成了一个陨石坑。这表明该海山可能是一座活火山。研究人员认为，火山口发生的规模性地形变化可能是10月海啸的来源。,[],Toshiya Fujiwara;Kentaro Imai;Masayuki Obayashi;Kenta Yoshida;Noriko Tada;Koichiro Obana;Gou Fujie;Shigeaki Ono;Shuichi Kodaira,The Sofu Seamount Submarine Volcano Present in the Source Area of the October 2023 Earthquakes and Tsunamis in Japan,"On 8 October 2023 (UTC), unique earthquakes occurred in the Izu‐Ogasawara Arc, Japan, in which the P‐ and S‐phases were barely visible and only the T‐phases were evident, followed by tsunamis that reached islands in the Izu‐Ogasawara Arc and a wide area of the Pacific coast of southwest Japan. Our estimated T‐phase source area coincides with the Sofu Seamount, which was previously unrecognized as an active submarine volcano. A bathymetric survey of the seamount conducted 1 month after the event revealed characteristics of the seamount with a caldera and a central cone. Compared to the bathymetry in 1987, the topography in the caldera had changed significantly such as a crater forming in the central cone. This seamount is likely to be an active volcano. The topographic changes on the caldera‐sized scale that occurred at the caldera can be explained as a source of the October tsunami."
10.1029/2024GL110225,False,Geophysical Research Letters,这篇论文主要研究了海洋中硅酸盐浓度对硅藻生长和有机碳输送的影响。研究者利用全球沉积物捕获数据库，发现硅藻在硅酸盐含量较高的地区，硅藻壳更厚，导致每单位硅藻携带的有机碳量更少。这表明硅酸盐浓度对海洋生物泵的效率有重要影响。论文没有涉及大气环境遥感技术，如空气质量监测、卫星观测或大气成分分析。,"['ocean', 'sediment', 'opal', 'diatoms', 'silicate', 'biological pump', 'organic carbon', 'flux']",B. B. Cael;C. Mark Moore;Joe Guest;Tereza Jarníková;Colleen B. Mouw;Chris Bowler;Edward Mawji;Stephanie A. Henson;Corinne Le Quéré,A Global Ocean Opal Ballasting–Silicate Relationship,"Opal and calcium carbonate are thought to regulate the biological pump's transfer of organic carbon to the deep ocean. A global sediment trap database exhibits large regional variations in the organic carbon flux associated with opal flux. These variations are well‐explained by upper ocean silicate concentrations, with high opal ‘ballasting’ in the silicate‐deplete tropical Atlantic Ocean, and low ballasting in the silicate‐rich Southern Ocean. A plausible, testable hypothesis is that opal ballasting varies because diatoms grow thicker frustules where silicate concentrations are higher, carrying less organic carbon per unit opal. The observed pattern does not fully emerge in an advanced ocean biogeochemical model when diatom silicification is represented using a single global parameterization as a function of silicate and iron. Our results suggest a need for improving understanding of currently modeled processes and/or considering additional parameterizations to capture the links between elemental cycles and future biological pump changes."
10.1029/2024GL110813,True,Geophysical Research Letters,该研究利用STET和SPEAH-RIT模型模拟了电离层电导率在电子沉降事件中的变化。研究发现，电离层电导率的形成和衰减需要一定时间，这被称为电导率惯性。这种惯性是由高能电子耗散和有效复合过程引起的，会影响电离层和磁层电场的变化，进而影响全球范围内的磁层-电离层动力学。该研究与大气环境遥感技术密切相关，因为它涉及到利用卫星观测数据研究电离层电导率的变化，并分析其对磁层-电离层耦合的影响。,"['ionospheric conductance', 'electron precipitation', 'magnetosphere-ionosphere coupling', 'satellite observations', 'auroral activity']",George V. Khazanov;Suk‐Bin Kang;Alex Glocer,Inertia of Ionospheric Conductance During Electron Precipitation Events,"Using the SuperThermal Electron Transport (STET) model coupled with the Super‐thermal Proton Electron Atomic Hydrogen—tRansport in the Ionosphere and Thermosphere (SPEAH‐RIT) codes, we demonstrate that temporal variability of ionospheric conductance is defined by several time scales: the temporal variations of the magnetospheric source, the start time of electron precipitation, and the termination of the corresponding source. In these cases, the time scales are defined by dissipation of energetic electrons and effective recombination processes. The results presented in this paper were applied in the regions of pulsating aurora and polar arcs, demonstrating the fact that ionospheric conductance requires some time to form and decay. These time delays constitute an effective “inertia” in the conductance calculation which is not accounted for in many global models which assume an instantaneous connection between precipitation and conductance. Ionospheric conductance inertia influences the temporal variation in ionospheric and magnetospheric electric fields, and as a result, impacts magnetosphere‐ionosphere (MI) dynamics on a global scale."
10.1029/2024GL109986,False,Geophysical Research Letters,这篇研究论文主要关注的是北极楚科奇海海水的快速酸化问题，研究了2002年至2018年期间该海域海水pH值和文石饱和度（Ωarag）的长期变化趋势。研究发现，海水的pH值和Ωarag在水柱中显著下降，下降速度比大气CO2增加导致的酸化速度快4-6倍。研究认为，这种快速酸化是由于冰川融化导致大气CO2入侵增加和地下再矿化加剧共同作用的结果。地下再矿化加剧是由于富含营养物质的太平洋水流入增加，导致表层生物生产力增强。因此，该研究主要关注的是海洋酸化问题，与大气环境遥感技术关系不大。,"['ocean acidification', 'pH', 'aragonite saturation state', 'Chukchi Sea', 'sea ice melt', 'biological production', 'nutrient', 'Pacific water']",Di Qi;Yingxu Wu;Liqi Chen;Wei‐Jun Cai;Shujie Yu;Zhangxian Ouyang;Yixing Zhang;Leif G. Anderson;Richard A. Feely;Yanpei Zhuang;Hongmei Lin;Ruibo Lei;Haibo Bi,Rapid Acidification of the Arctic Chukchi Sea Waters Driven by Anthropogenic Forcing and Biological Carbon Recycling,"The acidification of coastal waters is distinguished from the open ocean because of much stronger synergistic effects between anthropogenic forcing and local biogeochemical processes. However, ocean acidification research is still rather limited in polar coastal oceans. Here, we present a 16 year (2002–2018) observational dataset in the Chukchi Sea during the rapid sea‐ice melting season to determine the long‐term changes in pH and aragonite saturation state (Ωarag). We found that pH and Ωarag significantly declined in the water column with average rates of −0.0095 ± 0.0027 years−1 and −0.0333 ± 0.0098 years−1, respectively, and are 4–6 times faster than those solely due to increasing atmospheric CO2. We attributed the rapid acidification to the increased dissolved inorganic carbon owing to a combination of ice melt‐induced increased atmospheric CO2 invasion and subsurface remineralization induced by a stronger surface biological production as a result of the increased inflow of the nutrient‐rich Pacific water."
10.1029/2023GL107991,True,Geophysical Research Letters,这篇论文研究了地球磁层中高能电子与合唱波相互作用导致的电子寿命变化。它通过两种不同的方法建立了新的电子寿命模型，并将其参数化，以便在不同的环电流和辐射带模型中使用。这些模型在不同磁局部时间（MLT）区域和地磁活动水平下都适用，并且与卫星观测结果更加吻合。这对于理解磁层中电子的动力学过程具有重要意义。,"['electron dynamics', 'magnetosphere', 'satellite observations', 'radiation belt', 'ring current']",Dedong Wang;Yuri Y. Shprits;Bernhard Haas;Alexander Y. Drozdov,Improved Lifetime Model of Energetic Electrons Due to Their Interactions With Chorus Waves,"Chorus waves induce both electron acceleration and loss. In this letter, we provide significantly improved models of electron lifetime due to interactions with chorus waves. The new models fill the gap that previous models have on some magnetic local time (MLT) sectors of the Earth's magnetosphere. This improvement is critical for modeling studies. The lifetime models developed using two different methods are valid for electrons with an energy range from 1 keV to 2 MeV. To facilitate the integration of these new models into different ring current and radiation belt codes, we parameterize the electron lifetime as a function of L $L$‐shell and electron kinetic energy at each MLT and geomagnetic activity (Kp). The parameterized electron lifetimes exhibit strong dependencies on L $L$‐shell, MLT, and energy. Simulations using these new models demonstrate improved agreement with satellite observations compared to simulations using previous models, advancing our understanding of electron dynamics in the magnetosphere."
10.1029/2024GL109027,False,Geophysical Research Letters,这篇论文主要研究了火星探测器“毅力号”上的RIMFAX地面穿透雷达（GPR）在耶泽罗陨石坑探测到的地下结构，并与轨道上的SHARAD雷达数据进行比较。研究发现，RIMFAX探测到了较浅的反射层，而SHARAD则没有，这可能是由于SHARAD的探测范围更大，导致地下反射信号无法形成连贯的反射。该研究主要关注火星地质结构，与大气环境遥感技术关系不大。,"['ground penetrating radar', 'GPR', 'Mars', 'Jezero crater', 'subsurface', 'stratigraphy', 'reflectors', 'permittivity', 'mafic rocks', 'SHARAD', 'volcanic lithologies']",M. C. Raguso;D. C. Nunes;E. S. Shoemaker;P. Russell;D. A. Paige;S.‐E. Hamran,"Analysis of Orbital Sounding in Context With In‐Situ Ground Penetrating Radar at Jezero Crater, Mars","The RIMFAX ground‐penetrating radar (GPR) on Mars2020 Perseverance Rover is the first GPR operated on the Martian surface since February 2021, searching for stratigraphy beneath the Jezero crater. During its operations, GPR detected several strong reflectors extending from the exposed section of the Séitah formation down to depths of 15 m, with derived relative permittivity of ∼9.0 consistent with low‐porosity mafic rocks. We reprocessed all the SHAllow RADar (SHARAD) observations at a higher resolution and combined repeat‐passes coherently and/or incoherently for clutter mitigation. We then examined the bright returns searching for subsurface structures. The reprocessed data did not show any shallow reflectors like those detected by RIMFAX. We investigated possible factors influencing the lack of shallow reflectors in SHARAD radargrams, including the properties of the older volcanic lithologies and the significant variability of subsurface reflectors within the SHARAD km‐wide spatial footprint, which prevents the formation of coherent reflections."
10.1029/2024GL111603,False,Geophysical Research Letters,该研究主要关注的是波罗的海地区Jasmund冰川构造复合体的形成和演化，通过对陆地和海底地质特征的分析，重建了冰川运动的轨迹和压力方向。研究使用了高分辨率多道地震剖面数据，但与大气环境遥感技术关系不大。,[],B. Haimerl;E. Seidel;A. Gehrmann;J. Preine;M. C. Schmidt;C. Hübscher,Land‐To‐Sea Mapping of the Glacial Erosion Unconformity Reveals Evolution of the Jasmund Glacitectonic Complex East of Rügen Island (SW Baltic Sea),"Glacial movements shaped vast northern parts, offering critical insights into glacial dynamics in a changing climate. Located on the island of Rügen in NE Germany, the Jasmund Glacitectonic Complex (JGC) is a key area to study the dynamics of past glaciations. Previous reconstructions focused primarily on the onshore realm, resulting in some areas remaining unexplored. Here we use more than 140 high‐resolution marine multi‐channel seismic profiles to map the erosional unconformity surrounding the JGC for the first time. Submarine glacial features match features observed onshore, allowing a consistent land‐to‐sea reconstruction of the evolution of the JGC. Our results indicate a single SW‐directed Weichselian glacier advance, suggesting that the JGC formed through three distinct glacier lobes exerting pressure from multiple directions. The ice advance encircled the Jasmund peninsula and overthrusted Cretaceous sediments on the JGC perpendicularly and laterally."
10.1029/2024JD041395,True,Journal of Geophysical Research: Atmospheres,这篇论文研究了利用风力系统气球观测到的温度、湿度和风速数据对极地涡旋合并事件的预测影响。研究人员使用2022年THINICE野外观测活动期间的风力系统气球观测数据，模拟了极地涡旋合并事件，并评估了这些观测数据对预测极地涡旋轨迹和强度的影响。结果表明，风力系统气球观测数据的同化可以改善极地涡旋的预测，并对下游北极气旋的演变产生积极影响。,"['atmospheric composition', 'windborne observations', 'tropopause polar vortex', 'Arctic cyclone', 'forecast']",Aaron Johnson;Xuguang Wang;Todd Hutchinson;Joan Creus‐Costa,Impact of WindBorne Observation Assimilation on Prediction of a TPV Merger Case From THINICE,"The impact of assimilating in situ temperature, moisture and wind observations from a WindBorne Systems balloon, with long duration and adjustable ballast, is evaluated using a case study from the 2022 THINICE field campaign. A case is selected wherein the WindBorne balloon directly sampled a jet streak associated with a tropopause polar vortex (TPV). The observed TPV merged with another TPV at the same time as a downstream Arctic cyclone (AC) redeveloped eastward. The case is used to better understand the role of the observed TPV in the evolution of the downstream AC. The assimilation of the WindBorne observations improves the forecast track and amplitude of the TPV during the ∼1 day forecast period that the TPV can be tracked as a distinct feature. The root mean square error of temperature at 350 hPa is improved by the WindBorne assimilation throughout the 2.5 day forecast period. The surface cyclone track forecast is improved by the WindBorne assimilation during the period of eastward redevelopment of the surface cyclone, and the sea level pressure RMSE in the surrounding region is reduced during the first ∼1.5 days of forecast lead time. Results demonstrate the capability of the long‐duration controllable WindBorne balloons to improve the analysis of the TPV associated with the jet streak, leading to improved forecast of both tropopause‐level and surface pressure features. Additionally, the importance of observing the upstream TPV amplitude for improving forecasts of the process of TPV merging and its impact on the evolution and longevity of the mature AC is confirmed."
10.1029/2024EF004575,True,Earth's Future,这篇论文研究了平流层气溶胶注入（SAI）作为太阳辐射管理（SRM）的一种手段，对风能资源的影响。研究使用地球系统模型模拟了不同排放情景下，包括SAI情景，的风能潜力变化。结果表明，SAI可能会通过改变大气环流模式，例如南半球极地急流的显著向极移动，影响地表风资源。虽然全球总的风能潜力变化很小，但区域差异很大，一些地区的风能潜力增加了12%，另一些地区则减少了12%。这项研究强调了SRM对气候要素（如风模式）的潜在影响，并为减缓气候变化的努力提供了新的视角。,"['aerosol', 'stratospheric aerosol injections', 'climate modeling', 'wind energy', 'remote sensing', 'satellite observations']",Susanne Baur;Benjamin M. Sanderson;Roland Séférian;Laurent Terray,Change in Wind Renewable Energy Potential Under Stratospheric Aerosol Injections,"Wind renewable energy (WRE) is an essential component of the global sustainable energy portfolio. Recently, there has been increasing discussion on the potential supplementation of this conventional mitigation portfolio with Solar Radiation Modification (SRM). However, the impact of SRM on conventional mitigation measures has received limited attention to date. In this study, we explore one part of this impact, the potential effect of one type of SRM, Stratospheric Aerosol Injections (SAI), on WRE. Using hourly output from the Earth System Model CNRM‐ESM2‐1, we compare WRE potential under a medium emission scenario (SSP245) and a high emission scenario (SSP585) with an SRM scenario that has SSP585 baseline conditions and uses SAI to offset warming to approximately SSP245 global warming levels. Our results suggest that SAI may affect surface wind resources by modifying large‐scale circulation patterns, such as a significant poleward jet‐shift in the Southern Hemisphere. The modeled total global WRE potential is negligibly reduced under SAI compared to the SSP‐scenarios. However, regional trends are highly variable, with large increases and decreases in WRE potential frequently reaching 12% across the globe with SAI. This study highlights potential downstream effects of SRM on climatic elements, such as wind patterns, and offers perspectives on its implications for our mitigation efforts."
10.1029/2024EF004990,False,Earth's Future,该研究主要关注红树林-盐沼生态交错带的生态演变，重点分析了物种相互作用和食草动物对湿地优势物种的影响，以及由此导致的形态演变和景观格局变化。研究使用了生态-形态动力学模型，模拟了水动力学、泥沙输运、床面变化和植被动态，并特别关注了红树林和盐沼之间的生物相互作用。研究结果表明，共存植被物种的垂直生长速率是决定湿地优势物种的关键因素，食草动物的偏好也会影响湿地优势物种。此外，研究还发现盐沼主导的湿地比红树林主导的湿地更容易形成水道网络，并且这种模式在物种入侵过程中也存在。总体而言，该研究重点关注了红树林-盐沼生态交错带的生态演变，与大气环境遥感技术关系不大。,[],Yizhang Wei;Barend van Maanen;Danghan Xie;Qin Jiang;Zeng Zhou;Christian Schwarz,Mangrove‐Saltmarsh Ecotones: Are Species Shifts Determining Eco‐Morphodynamic Landform Configurations?,"Mangrove‐saltmarsh ecotones are experiencing rapid alterations due to climate change and human activities, however, the ecological and morphological implications of these shifts remain largely unknown. This study systematically explores how interspecific interactions and herbivory influence the dominant wetland species, as well as the resultant morphological evolution and landscape configuration. To achieve this, we develop a new eco‐morphodynamic model that integrates hydrodynamics, sediment transport, bed‐level change, and vegetation dynamics. The novelty of the current model lies in newly incorporated modules to simulate biotic interactions between mangroves and saltmarshes, enabling exploration of eco‐morphodynamic feedback in mangrove‐saltmarsh ecotones in response to tidal flows and species interactions. Our results show that vertical growth rates of coexisting vegetation species are dominant factors in determining wetland dominance. When mangroves and saltmarshes exhibit comparable growth rates, mangroves typically become the dominant wetland species. Conversely, if mangroves grow more slowly than saltmarshes, they are unable to outcompete saltmarshes. Additionally, herbivory can fundamentally alter wetland dominance depending on herbivore food preferences. Our simulations further underline that saltmarsh‐dominated wetlands develop channel networks more extensively and rapidly than mangrove‐dominated systems. This pattern is also observed during species invasions, with invading saltmarshes extending channel networks, while invading mangroves inhibit ongoing network expansion. This study highlights the pivotal roles of relative growth properties and herbivory in driving ecotone development in respect to wetland dominance and channel network development at the intertidal scale."
10.1029/2024EF004844,False,Earth's Future,这篇论文探讨了气候模型权重对气候预测的影响。研究者使用全球平均气温作为权重指标，评估了该方法对全球平均降水量、区域平均气温变化和区域平均降水量变化的预测效果。结果表明，基于温度的权重方法可以改善全球平均降水量的预测，但在区域尺度上，降水预测的误差减少情况并不一致。这说明在使用加权气候模型进行气候预测时，仅根据温度进行权重可能会导致不准确的预测结果。论文并未涉及大气环境遥感技术，如空气质量监测、卫星观测或大气成分分析。,"['climate models', 'global temperature change', 'precipitation', 'regional climate', 'model weighting']",Abigail McDonnell;Adam Michael Bauer;Cristian Proistosescu,To What Extent Does Discounting ‘Hot’ Climate Models Improve the Predictive Skill of Climate Model Ensembles?,"
It depends. The Intergovernmental Panel on Climate Change's (IPCC) Assessment Report Six (AR6) took a step toward ending so‐called ‘model democracy’ by discounting climate models that are too warm over the historical period (i.e., models that ‘run hot’) when making projections of global temperature change. However, the IPCC did not address whether this procedure is reliable for other quantities. Here, we explore the implications of weighting climate models according to their skill in reproducing historical global‐mean surface temperature using three other climate variables of interest: global average precipitation change, regional average temperature change, and regional average precipitation change. We find that the temperature‐based weighting scheme leads to an improved prediction of global average precipitation, though we show that this prediction could be overconfident. On regional scales, we find a heterogeneous pattern of error reduction in future regional precipitation. This stands in sharp contrast with the broad regional pattern of error reduction in future temperature projections, though we do find regions where error is not significantly reduced. Our results demonstrate that practitioners using weighted climate model ensembles for climate projections must take care when weighting by temperature alone, lest they produce unreliable climate projections that result from an inappropriate weighting procedure."
