doi,is_relevant,journal,explanation,topic_words,authors,title,abstract
10.1038/s43247-024-01692-1,True,Communications Earth & Environment,这篇论文研究了南极海冰表面温度在常用的大气再分析资料中的偏差问题。研究发现，这些再分析资料中存在着明显的暖偏差，主要原因是海冰浓度和云量模拟的偏差。论文利用卫星观测数据对六种常用的再分析资料进行了评估，并分析了偏差产生的原因。结果表明，云量模拟的偏差会导致超过4K的暖偏差，而海冰模拟的偏差也会导致2.3K的暖偏差。论文还指出，海冰浓度模拟的偏差会影响海冰和云之间的耦合关系，以及地表热传导，从而导致空间分布上的偏差。研究结果表明，南极海冰表面温度的偏差问题需要引起重视，并需要改进大气再分析资料中的海冰和云模拟方法。,"['satellite observations', 'sea ice', 'cloud fraction', 'surface temperature', 'atmospheric reanalysis', 'climate change']",Zhaohui Wang;Alexander D. Fraser;Phillip Reid;Siobhan O’Farrell;Richard Coleman,Antarctic sea ice surface temperature bias in atmospheric reanalyses induced by the combined effects of sea ice and clouds,"Robust warm biases exist in Antarctic sea-ice surface temperatures across recent commonly used reanalyses, due both to differences in sea-ice concentrations and poorly represented cloud fraction for this region. 
 Sea-ice surface temperature from atmospheric reanalysis has been used as an indicator of ice melt and climate change. However, its performance in atmospheric reanalyses is not fully understood in Antarctica. Here, we quantified biases in six widely-used reanalyses using satellite observations, and found strong and persistent warm biases in most reanalyses examined. Further analysis of the biases revealed two main culprits: incorrect cloud properties, and inappropriate sea-ice representation in the reanalysis products. We found that overestimated cloud simulation can contribute more than 4 K warm bias, with ERA5 exhibiting the largest warm bias. Even in reanalysis with smaller biases, this accuracy is achieved through a compensatory relationship between relatively lower cloud fraction bias and overestimated sea ice insulation effect. A dynamic downscaling simulation shows that differences in sea-ice representation can contribute a 2.3 K warm bias. The representation of ice concentration is the primary driver of the spatial distribution of biases by modulating the coupling between sea ice and clouds, as well as surface heat conduction. The lack of a snow layer in all reanalyses examined also has an impact on biases. Robust warm biases exist in Antarctic sea-ice surface temperatures across recent commonly used reanalyses, due both to differences in sea-ice concentrations and poorly represented cloud fraction for this region."
10.1038/s43247-024-01640-z,True,Communications Earth & Environment,这篇论文研究了人为气候变化对美国西部干旱恢复时间的影响。研究人员利用观测数据和气候模型输出，分析了自 1901 年至 1980 年和 2000 年至 2021 年两个时期的帕尔默干旱严重指数（PDSI），发现近年来干旱恢复的概率显著降低。研究表明，人为气候变化导致蒸发量增加，延长了干旱恢复时间，这将对水资源管理和干旱规划产生重大影响。论文中使用了卫星观测数据和气候模型输出，因此与大气环境遥感技术相关。,"['drought', 'climate change', 'Palmer Drought Severity Index', 'satellite observations', 'climate model output']",Emily L. Williams;John T. Abatzoglou;Katherine C. Hegewisch;A. Park Williams,Anthropogenic climate change has reduced drought recovery probabilities across the western US,"Increased evaporative demand due to anthropogenic climate change has led to extended recovery times from contemporary droughts in the Western US, compared to 1901-1980, according to an analysis of observations and climate model output. 
 During drought, resource managers want to know when the drought will end to make informed management decisions. However, as anthropogenic climate change has intensified drought conditions, we hypothesize it has affected drought recovery. Here, we leverage monthly self-calibrating Palmer Drought Severity Index data across the western US derived from observations and climate models, and quantify the probability of drought recovery following severe drought. We find that the probability of drought recovery is ~25–50% lower in recent decades (2000–2021) than in the historical record (1901–1980), with at least one-third of the reduced recovery probability attributable to anthropogenic climate change. Climate model ensembles show reduced recovery probabilities in the contemporary era (2000–2040), primarily due to increased evaporative demand in non-winter months, resulting in an additional 1–4 months for droughts to recover compared with the historical record. These findings suggest climate change is slowing drought recovery, with ramifications for water management decisions and drought planning. Increased evaporative demand due to anthropogenic climate change has led to extended recovery times from contemporary droughts in the Western US, compared to 1901-1980, according to an analysis of observations and climate model output."
10.1038/s43247-024-01688-x,False,Communications Earth & Environment,这篇论文主要研究了巴伦支海大陆架早更新世冰川作用的演变过程，通过分析三维地震数据，研究了冰川融水和沉积物输入对深海的影响，并发现早更新世冰川作用的特征从高融水期向低融水期转变。论文重点关注地质学和海洋学领域，与大气环境遥感技术关系不大。,[],Benjamin Bellwald;Dwarika Maharjan;Sverre Planke;Monica Winsborrow;Tom Arne Rydningen;Nikolitsa Alexandropoulou;Reidun Myklebust,Major tunnel valleys and sedimentation changes document extensive Early Pleistocene glaciations of the Barents Sea,"3D seismic data from the continental shelf of the Barents Sea indicate a switch in the character of glaciation from a high meltwater regime generating extensive tunnel valleys to a regime of reduced meltwater contribution from the mid-Pleistocene 
 Sedimentary records of Early Pleistocene (~2.6–0.8 Ma) glaciations are sparse on shelves, yet trough mouth fans on adjacent continental slopes provide a continuous record of ice-sheet and climate development throughout the Quaternary. Here, we interpret high-quality 3D seismic reflection data combined with borehole and chronostratigraphic information from a shelf-slope setting in the southwestern Barents Sea to study meltwater and sediment inputs to the deep ocean, focusing on the onset of Pleistocene glaciations. Sandy deposits were brought to the slopes of the high-latitude Bear Island Fan by a preglacial contourite-turbidite system from ⁓2.6–2.4 Ma. Muddy glacigenic debris flows document the first shelf-edge glaciation at ⁓2.4 Ma. From 1.78–0.78 Ma, muddy turbidity-current- and debris-flow-derived sediments were delivered from shelf to slope via six tunnel valleys measuring up to 12 km in width and 200 m in depth. These tunnel valleys and associated downslope deposits formed during the 41-kyr climate cycles of the Early Pleistocene, and evidence abundant channelized, meltwater discharges from these glaciations. Following the mid-Pleistocene transition to 100-kyr cycles, a change in the style of glaciation is suggested by a change in landform and facies associations consistent with a reduced meltwater contribution. This study shows that the Norwegian-Barents shelf was extensively glaciated in the Early Pleistocene, with a first shelf-edge glaciation from ~2.4 Ma. 3D seismic data from the continental shelf of the Barents Sea indicate a switch in the character of glaciation from a high meltwater regime generating extensive tunnel valleys to a regime of reduced meltwater contribution from the mid-Pleistocene"
10.1038/s43247-024-01712-0,False,Communications Earth & Environment,这篇论文主要研究的是植物叶片角度随时间变化对植被指数的影响，并利用辐射传输模型模拟了这种影响。研究表明，叶片角度的动态变化会系统性地影响常用的植被指数，并且这种影响与环境条件密切相关。论文的重点在于分析叶片角度变化对遥感监测植被动态的影响，而非大气环境遥感技术。,"['vegetation indices', 'leaf angles', 'remote sensing', 'Earth observation', 'vegetation dynamics']",Teja Kattenborn;Sebastian Wieneke;David Montero;Miguel D. Mahecha;Ronny Richter;Claudia Guimarães-Steinicke;Christian Wirth;Olga Ferlian;Hannes Feilhauer;Lena Sachsenmaier;Nico Eisenhauer;Benjamin Dechant,Temporal dynamics in vertical leaf angles can confound vegetation indices widely used in Earth observations,"Temporal variation of vertical leaf angles can strongly alter widely used vegetation indices, with the effect dependent on both environment and species, according to an analysis of time series leaf photos and radiative transfer model simulations. 
 Earth observation data is key for monitoring vegetation dynamics across temporal and spatial scales. The most widely used method to estimate vegetation properties from Earth observation data is vegetation indices. However, temporal dynamics in vertical leaf angles can strongly alter reflectance signals and, hence, vegetation indices. Here, we derive leaf angles from plant photographs to simulate the effect on vegetation indices with radiative transfer models. We show that leaf angle dynamics systematically confound widely applied vegetation indices. Moreover, we demonstrate that these effects are not random but tightly linked to abiotic environmental conditions. These systematic effects of vertical leaf angles have implications for monitoring plant properties, biodiversity, and ecosystem functional properties. We discuss the related challenges and opportunities to assess spatio-temporal vegetation dynamics with remote sensing and vegetation indices. 
                
                  
                
               Temporal variation of vertical leaf angles can strongly alter widely used vegetation indices, with the effect dependent on both environment and species, according to an analysis of time series leaf photos and radiative transfer model simulations."
10.1016/j.rse.2024.114444,True,Remote Sensing of Environment,这篇论文介绍了利用中国“大气与碳探测激光雷达”（ACDL）搭载在“风云一号”卫星（DQ-1）上进行全球海洋颗粒物反向散射系数 (bbp) 的遥感观测。论文重点介绍了一种新的算法，该算法利用空间高光谱分辨率激光雷达 (HSRL) 的颗粒物和分子散射测量数据来反演 bbp。研究结果表明，ACDL 观测到的 bbp 数据与 MODIS 数据以及 Argo 浮标的原位观测数据吻合良好。该研究表明，ACDL/DQ-1 能够为全球海洋观测提供重要的数据，并弥补了传统被动海洋颜色观测的不足。,"['Atmospheric Composition', 'Aerosol', 'Satellite Observation', 'Lidar', 'Air Quality Monitoring', 'Ocean']",Yichen Yang;Yudi Zhou;Iwona S. Stachlewska;Yongxiang Hu;Xiaomei Lu;Weibiao Chen;Jiqiao Liu;Wenbo Sun;Suhui Yang;Yuting Tao;Lei Lin;Weige Lv;Lingying Jiang;Lan Wu;Chong Liu;Dong Liu,Spaceborne high-spectral-resolution lidar ACDL/DQ-1 measurements of the particulate backscatter coefficient in the global ocean,"•A novel algorithm is developed for the spaceborne lidar ocean retrievals. •Particulate backscatter is depicted by spaceborne high-spectral-resolution lidar. •Characteristics of particulate backscatter in different regions are shown. •The retrieved data are in good agreement with ocean colour andin situdata. 
 Spaceborne lidars have demonstrated outstanding global ocean observation in terms of sampling at day- and night-time and penetrating thin cloud and aerosol layers. A spaceborne high-spectral-resolution lidar (HSRL) has the potential to provide accurate optical properties by decreasing the number of assumptions in the retrieval algorithm in comparison with classical elastic spaceborne lidar. In this paper, we report the first ocean application from both particulate and molecular scattering measurements of spaceborne HSRL, namely Aerosol and Carbon Detection Lidar (ACDL) onboard China DQ-1 satellite. We use the ACDL/DQ-1 HSRL to quantify particulate backscatter coefficient bbp in the global ocean, with a novel algorithm exploiting the column-integrated particulate and molecular signals. The ACDL-derived bbp data agree well with MODIS-derived data through along-track and global comparisons. It also presents high correlations with the Argo floats in-situ data under various spatial and temporal matching windows. The ACDL/DQ-1 is anticipated to become an important part of the global ocean satellite observations addressing some limitations of traditional passive ocean colour observation."
10.1016/j.rse.2024.114440,True,Remote Sensing of Environment,这篇论文研究了陆地表面温度气候数据记录（CDR）中云检测方法的稳定性。研究人员分析了来自多个卫星传感器（ATSR-2、AATSR、MODIS 和 SLSTR）的 25 年数据，评估了三种云检测方法的稳定性，并发现云检测稳定性对陆地表面温度趋势的准确性至关重要。该研究与大气环境遥感技术密切相关，因为它涉及使用卫星观测数据来分析云层对陆地表面温度的影响，这对于气候变化研究和环境监测具有重要意义。,"['cloud detection', 'satellite observations', 'land surface temperature', 'climate data records', 'remote sensing']",Claire E. Bulgin;Ross I. Maidment;Darren Ghent;Christopher J. Merchant,Stability of cloud detection methods for Land Surface Temperature (LST) Climate Data Records (CDRs),"•Cloud detection stability is assessed for land surface temperature climate records. •Missed-clear sky observations are more stable than cloud contamination over time. •Land surface temperature stability is related to cloud masking stability. •Characteristics of missed-clear sky and falsely-flagged cloud evaluated. 
 The stability of a climate data record (CDR) is essential for evaluating long-term trends in surface temperature using remote sensing products. In the case of a satellite-derived CDR of land surface temperature (LST), this includes the stability of processing steps prior to the estimation of the target climate variable. Instability in the masking of cloud-affected observations can result in non-geophysical trends in a LST CDR. This paper provides an assessment of cloud detection performance stability over a 25-year LST CDR generated using data from the second Along-Track Scanning Radiometer (ATSR-2), the Advanced Along-Track Scanning Radiometer (AATSR), the Moderate Resolution Imaging Spectroradiometer (MODIS) and the Sea and Land Surface Temperature Radiometer (SLSTR). We evaluate three cloud detection methodologies, one fully Bayesian, one naïve probabilistic and the operational threshold-based cloud mask provided with each sensor, at four in-situ ceilometer sites. Of the 12 algorithm-site combinations assessed, only two (17 %) were stable across the full timeseries with respect to both cloud contamination and missed clear-sky observations. Five (42 %) were stable with respect to missed clear-sky observations only. The associated impacts on LST trends in the CDR could be as large as (+/−)0.73 K per decade (0.43 K per decade above the target stability), which means that attention needs to be paid to this aspect of stability in order to understand uncertainty in long-term observed trends. Given that cloud detection stability has not to our knowledge been previously assessed for any target climate variable, this conclusion may apply more broadly to other satellite-derived CDRs."
10.1016/j.rse.2024.114433,True,Remote Sensing of Environment,该论文主要研究的是针对近岸水体遥感中的邻近效应校正问题。论文提出了一种基于物理模型的邻近效应校正方法，该方法可以用于校正水体遥感数据中的邻近效应，从而提高水体反射率的准确性。论文还使用 Sentinel-2 MSI 和 Landsat 8 OLI 数据对该方法进行了验证，结果表明该方法可以有效地提高水体反射率的准确性。,"['remote sensing', 'coastal and inland waters', 'atmospheric correction', 'adjacency effect', 'Sentinel-2 MSI', 'Landsat 8 OLI', 'water-leaving reflectance', 'atmospheric conditions']",Yulun Wu;Anders Knudby;Nima Pahlevan;David Lapen;Chuiqing Zeng,Sensor-generic adjacency-effect correction for remote sensing of coastal and inland waters,"•We present an adjacency-effect correction tool for aquatic applications. •The code is open-source and physics-based. •The output is adjacency-free TOA reflectance, input to any AC processor. •We show substantially improved reflectance retrieved by three AC processors. 
 The adjacency effect distorts the top-of-atmosphere (TOA) spectral signals of coastal and inland waters and is a major challenge for optical remote sensing of nearshore aquatic environments. We introduce a closed-form expression that corrects for the adjacency effect prior to atmospheric correction. The method is included in an open-source Python tool, which ingests level-1 imagery and calculates the point-spread function of the atmosphere to convolve the input imagery. For each band, the difference between the observed and convolved reflectances is used to quantify and correct for the adjacency effect, i.e., pixels are corrected to the TOA reflectance they would have if surrounded by pixels of identical reflectance. Validation was conducted for Sentinel-2 MSI and Landsat 8 OLI imagery against a global dataset of coincident in situ radiometric measurements. Results showed improved accuracy of water-leaving reflectance derived by atmospheric correction processors, including ACOLITE, POLYMER, and l2gen, when these were applied following adjacency-effect correction. For matchups within 200 m of shorelines (n = 212), adjacency-effect correction resulted in an average 16.7 % reduction in root mean square error, a 32.4 % reduction in symmetric signed percentage bias, and a 36.8 % reduction in median symmetric accuracy for the three processors. The improvements were more significant in the near-infrared (NIR) range for ACOLITE, visible wavelengths for l2gen, and evenly distributed across the visible-NIR spectrum for POLYMER. We anticipate that this physics-based approach to adjacency-effect correction will lead to improved satellite-derived aquatic products for coastal and inland waters under diverse atmospheric and aquatic conditions."
None,False,Remote Sensing of Environment,由于没有提供文章标题和摘要，无法判断文章是否与大气环境遥感技术相关。请提供文章标题和摘要以便进行分析。,[],,Editorial Board,
10.1016/j.jag.2024.104183,True,International Journal of Applied Earth Observation and Geoinformation,这篇论文研究了利用多源卫星数据和随机森林方法来估算瑞典南部地区春季大麦产量的可行性。研究使用了植被指数（VIs）、太阳诱导叶绿素荧光（SIF）和气候变量等数据，并通过随机森林模型进行分析。结果表明，VIs 在大麦产量估算中表现优于 SIF，而将 VIs 和 SIF 结合起来可以获得最佳的模型性能。这项研究证明了利用免费获取的卫星数据和机器学习方法来估算泛欧洲区域水平的作物产量是可行的。,"['satellite observations', 'vegetation indices', 'solar-induced chlorophyll fluorescence', 'crop yield estimation']",Xueying Li;Hongxiao Jin;Lars Eklundh;El Houssaine Bouras;Per-Ola Olsson;Zhanzhang Cai;Jonas Ardö;Zheng Duan,Estimation of district-level spring barley yield in southern Sweden using multi-source satellite data and random forest approach,"•Developing a district-level crop yield estimation approach with Random Forest. •Combining VIs and SIF reaches the best performance (R2= 0.77, RMSE=488 kg/ha) •Using VIs at fine spatial resolution (10 m) has better yield estimates than SIF. •Climate variables have little added contributions to the model performance. •Spring barley yield prediction can be achieved two months before harvest. 
 Remote sensing observations and artificial intelligence algorithms have emerged as key components for crop yield estimation at various scales during the past decades. However, the utilization of multi-source satellite data and machine learning for estimating aggregated crop yield at the regional level in Europe has been only scarcely explored. Our study aims to bridge this research gap by focusing on the district-level spring barley yield estimation in southern Sweden from 2017 to 2022. We developed an estimation method with the random forest (RF) approach using four satellite-derived products along with two climate variables. These variables were used individually and in combinations as inputs for the RF approach. The results showed that vegetation indices (VIs) outperformed solar-induced chlorophyll fluorescence (SIF) in barley yield estimation, while combining VIs and SIF variables achieved the highest model performance (R2 = 0.77, RMSE = 488 kg/ha). The inclusion of climate variables generally had little added contributions to the model performance. Importantly, barley yield prediction could be achieved two months prior to harvest, using monthly VIs and SIF data from April and May. Our study demonstrated the feasibility of using freely accessible satellite data and the machine learning approach for estimating crop yield at the pan-European regional level. We expect that our proposed methodology can be extended to different crop types and regional-scale crop yield estimation in Europe, benefiting national and local authorities in making agricultural productivity decisions."
None,False,International Journal of Applied Earth Observation and Geoinformation,该研究主要关注使用多时相Sentinel-2卫星影像在中国进行裸地分类的二维框架。它与大气环境遥感技术关系不大，主要侧重于土地覆盖分类，而非大气成分分析或空气质量监测。,"['bare soil', 'Sentinel-2', 'multi-temporal', 'two-dimensional', 'separation framework', 'China']",Jie Xue;Xianglin Zhang;Yuyang Huang;Songchao Chen;Lingju Dai;Xueyao Chen;Qiangyi Yu;Su Ye;Zhou Shi,A two-dimensional bare soil separation framework using multi-temporal Sentinel-2 images across China,
None,False,International Journal of Applied Earth Observation and Geoinformation,该论文主要关注中亚干旱地区的陆地水储量变化，探讨了未来挑战。它与大气环境遥感技术关系不大，主要涉及水文和地球物理领域。,"['terrestrial water storage', 'arid regions', 'Central Asia']",Yuzhuo Peng;Hao Zhang;Zhuo Zhang;Bin Tang;Dongdong Shen;Gang Yin;Yaoming Li;Xi Chen;Zengyun Hu;Sulaimon Habib Nazrollozoda,Corrigendum to “Future challenges of terrestrial water storage over the arid regions of Central Asia” [Int. J. Appl. Earth Observ. Geoinf. 132 (2024) 104026],
None,False,International Journal of Applied Earth Observation and Geoinformation,该论文主要关注的是基于传感器融合的多目标跟踪技术，通过置信度更新来提高跟踪精度。它与大气环境遥感技术关系不大，没有涉及到空气质量监测、卫星观测或大气成分分析等方面。,"['multi-object tracking', 'sensors fusion', 'confidence updating']",Junting Liu;Deer Liu;Weizhen Ji;Chengfeng Cai;Zhen Liu,Corrigendum to “Adaptive multi-object tracking based on sensors fusion with confidence updating” [Inter. J. Appl. Earth Obs. Geoinform. 125 (2023) 103577],
None,True,International Journal of Applied Earth Observation and Geoinformation,这篇论文主要关注使用遥感技术识别泥炭火灾区域。泥炭火灾会释放大量烟雾和污染物，影响空气质量和大气成分。论文中提到的“peat fire index”可能是一种基于卫星观测数据的指标，用于区分泥炭火灾和其他类型的野火。因此，该论文与大气环境遥感技术密切相关，特别是与空气质量监测、卫星观测和大气成分分析有关。,"['peat fire', 'fire detection', 'remote sensing', 'satellite observation', 'air quality', 'atmospheric composition']",Maria Medvedeva;Victor Itkin;Andrey Sirin,Corrigendum to “Identification of peat-fire-burnt areas among other wildfires using the peat fire index” [Int. J. Appl. Earth Observ. Geoinf. 132 (2024) 103973],
None,False,International Journal of Applied Earth Observation and Geoinformation,由于缺少标题和摘要，无法判断论文是否与大气环境遥感技术相关。,[],,Editorial Board,
