doi,is_relevant,journal,explanation,topic_words,authors,title,abstract
10.5194/amt-17-5455-2024,True,Atmospheric Measurement Techniques,这篇研究论文重点关注通过整合来自地球静止轨道和太阳同步轨道卫星的观测数据来提高气溶胶光学厚度（AOD）的空间和时间覆盖率。研究人员使用统一的算法将来自六颗卫星的AOD数据进行融合，生成全球范围、高空间分辨率（约25公里）和高时间频率（30分钟间隔）的AOD数据集。该数据集经过验证，并与地面实测数据进行比较，证明了其可靠性。研究表明，该融合数据集显著提高了全球AOD数据的覆盖率，并能够更准确地捕捉到AOD的日变化规律。该数据集对于大气环境遥感技术，特别是空气质量监测、气候研究、污染物日变化分析、长距离烟尘传输以及区域和全球模型评估等方面具有重要意义。,"['aerosol optical depth', 'satellite', 'geostationary', 'sun-synchronous', 'air quality monitoring', 'climate research', 'pollution diurnal variability', 'long-range smoke and dust transport', 'model evaluation']",Pawan Gupta;Robert C. Levy;Shana Mattoo;Lorraine A. Remer;Zhaohui Zhang;Virginia Sawyer;Jennifer Wei;Sally Zhao;Min Oo;V. Praju Kiliyanpilakkil;Xiaohua Pan,Increasing aerosol optical depth spatial and temporal  availability by merging datasets from geostationary  and sun-synchronous satellites,"In this study, for the first time, we combined aerosol data from six satellites using a unified algorithm. The global datasets are generated at a high spatial resolution of about 25 km with an interval of 30 min. The new datasets are compared against ground truth and verified. They will be useful for various applications such as air quality monitoring, climate research, pollution diurnal variability, long-range smoke and dust transport, and evaluation of regional and global models. 
 This comprehensive study analyzed aerosol products from six low-Earth orbit (LEO) and geostationary Earth orbit (GEO) sensors. LEO sensors like the MODerate resolution Imaging Spectroradiometer (MODIS) and VIsible InfraRed Suite (VIIRS) provide one to two daily global measurements, while GEO sensors (Advanced Himawari Imager: AHI, Advanced Baseline Imager: ABI) offer high-frequency data (∼ 10 min) over specific regions. The combination of LEO and GEO capabilities offers expanded coverage of the global aerosol system if aerosol retrievals are applied consistently across all sensors and packaged in an easy-to-use product. The Dark Target aerosol retrieval algorithm was applied to the six sensors, and the resulting Level 2 aerosol optical depth (AOD) products were gridded and merged into a Level 3 quarter-degree latitude–longitude grid with a 30 min temporal resolution, providing the necessary consistency and packaging. Validation of this packaged Level 3 AOD product against Aerosol Robotics NETwork (AERONET) measurements across global locations showcased the merged product's robustness with a correlation coefficient of 0.83, revealing a global mean bias of approximately ±0.05, with 65.5 % of retrievals falling within an expected uncertainty range, underlining the reliability of the dataset. The new gridded Level 3 dataset significantly improved daily global coverage to nearly 45 %, overcoming the limitations of individual sensors, which typically range from 12 % to 25 %. Furthermore, this merged dataset approximates the diurnal cycle of AOD observed by AERONET, thus offering insights into diurnal signatures retrieved elsewhere. The resulting dataset's high spatiotemporal resolution and improved global coverage, especially in regions covered by GEO sensors (Americas and Asia), make it a valuable tool for diverse applications. Tracking aerosol transport from phenomena like wildfires and dust storms is gaining precision, enabling enhanced air quality forecasting and hindcasting. Additionally, the study positions the merged dataset as a significant asset for evaluating and intercomparing regional or global model simulations, which was previously unattainable in such a gridded format. The dataset and fusion framework layout in this study have the potential to include data from recently (future) launched other GEO (FCI, AMI) and LEO (PACE, VIIRS-JPSS) sensors."
10.5194/amt-17-5477-2024,False,Atmospheric Measurement Techniques,这篇论文主要研究了涡动协方差通量的时间平均对玉米水分利用效率动态的影响。研究发现，不同时间平均的涡动协方差通量对能量平衡比的影响不同，并进一步影响了水分利用效率的动态变化。研究还发现，最佳的时间平均周期需要根据作物的生长阶段进行调整。该研究主要关注的是农业领域，利用涡动协方差技术来测量作物的水分利用效率，与大气环境遥感技术关系不大。,"['eddy covariance', 'water use efficiency', 'maize', 'energy balance ratio', 'carbon fluxes', 'water fluxes', 'crop growth stage']",Arun Rao Karimindla;Shweta Kumari;Saipriya S R;Syam Chintala;BVN P. Kambhammettu​​​​​​​,The role of time averaging of eddy covariance fluxes on water use efficiency dynamics of maize,"This study investigates the role of the averaging period of eddy covariance fluxes on the energy balance ratio and further propagation into water use efficiency dynamics. Application was demonstrated on a maize field considering EC flux data. We found that the time averages of EC fluxes that yield the most effective EBR are at 45 and 60 min. The 30 min averaging period was insufficient to capture low-frequency fluxes. Time averaging of EC fluxes needs to be performed based on crop growth stage. 
 Direct measurement of carbon and water fluxes at high frequencies make eddy covariance (EC) the technique most preferred to characterize water use efficiency (WUE). However, reliability of EC fluxes largely hinges on the energy balance ratio (EBR) and inclusion of low-frequency fluxes. This study is aimed at investigating the role of the averaging period in representing EC fluxes and its propagation into WUE dynamics. Carbon and water fluxes were monitored in a drip-irrigated maize field at 10 Hz frequency and were averaged over 1, 5, 10, 15, 30, 45, 60, and 120 min, considering daytime unstable conditions. The optimal averaging period to simulate WUE fluxes for each growth stage is obtained by considering cumulative frequency (Ogive) curves. A clear departure of EBR from unity was observed during the dough and maturity stages of the crop due to ignorance of canopy heat storage, low-frequency flux losses, and an inadequate averaging period. Deviations in representing water (carbon) fluxes relative to the conventional 30 min average are within ±3 % (±10 %) for 10–120 min averaging and beyond ±3 % (±10 %) for other time averages. Ogive plots show that the optimal averaging period to represent carbon, water, and WUE fluxes is 15–30 min for the sixth leaf and silking stages and is 45–60 min for the dough and maturity stages. Dynamics of WUE considering optimal averaging periods are in the range of μ ± σ: 1.49 ± 0.95, 1.37 ± 0.74, 1.39 ± 0.79, and 3.06 ± 0.69 µmol mmol−1 for the sixth leaf, silking, dough, and maturity stages, respectively. The error in representing WUE by conventional 30 min averaging is marginal (< 1.5 %) throughout the crop period except for the dough stage (12.12 %). We conclude that the conventional 30 min averaging of EC fluxes is not appropriate for representing WUE throughout the crop period. Our findings can help to develop efficient water management strategies by accurately characterizing WUE fluxes from the EC measurements."
10.5194/essd-16-4209-2024,False,Earth System Science Data,这篇论文主要关注北冰洋波弗特海海冰边缘的盐度和分层，研究了海洋盐度和近地表分层对上层海洋热含量以及海冰冻结和融化的影响。研究使用了船舶和无人驾驶平台收集了海洋上层性质和气象数据的详细观测，这些数据可以帮助理解盐度在耦合的北极大气-海洋-冰过程中的作用。该研究与大气环境遥感技术关系不大，主要集中在海洋学领域。,"['sea ice', 'salinity', 'stratification', 'oceanography', 'Beaufort Sea', 'NASA', 'SASSIE', 'air-sea fluxes']",Kyla Drushka;Elizabeth Westbrook;Frederick M. Bingham;Peter Gaube;Suzanne Dickinson;Severine Fournier;Viviane Menezes;Sidharth Misra;Jaynice Pérez Valentín;Edwin J. Rainville;Julian J. Schanze;Carlyn Schmidgall;Andrey Shcherbina;Michael Steele;Jim Thomson;Seth Zippel,Salinity and Stratification at the Sea Ice Edge (SASSIE): an oceanographic field campaign in the Beaufort Sea,"The NASA SASSIE mission aims to understand the role of salinity in modifying sea ice formation in early autumn. The 2022 SASSIE campaign collected measurements of upper-ocean properties, including stratification (layering of the ocean) and air–sea fluxes in the Beaufort Sea. These data are presented here and made publicly available on the NASA Physical Oceanography Distributed Active Archive Center (PO.DAAC), along with code to manipulate the data and generate the figures presented herein. 
 As our planet warms, Arctic sea ice coverage continues to decline, resulting in complex feedbacks with the climate system. The core objective of NASA's Salinity and Stratification at the Sea Ice Edge (SASSIE) mission is to understand how ocean salinity and near-surface stratification affect upper-ocean heat content and thus sea ice freeze and melt. SASSIE specifically focuses on the formation of Arctic Sea ice in autumn. The SASSIE field campaign in 2022 collected detailed observations of upper-ocean properties and meteorology near the sea ice edge in the Beaufort Sea using ship-based and piloted and drifting assets. The observations collected during SASSIE include vertical profiles of stratification up to the sea surface, air–sea fluxes, and ancillary measurements that are being used to better understand the role of salinity in coupled Arctic air–sea–ice processes. This publication provides a detailed overview of the activities during the 2022 SASSIE campaign and presents the publicly available datasets generated by this mission (available at https://podaac.jpl.nasa.gov/SASSIE, last access: 29 May 2024; DOIs for individual datasets in the “Data availability” section), introducing an accompanying repository that highlights the numerical routines used to generate the figures shown in this work."
10.5194/essd-16-4243-2024,True,Earth System Science Data,这篇论文介绍了一个名为 GERB Obs4MIPs 的数据集，该数据集包含地球系统模型评估所需的地球大气层顶端反射太阳辐射和发射热能的逐时数据。该数据集利用地球静止轨道辐射平衡 (GERB) 仪器观测到的数据，涵盖了 2007 年至 2012 年期间，每月每小时的平均外向长波辐射 (OLR) 和反射短波 (RSW) 辐射通量，空间分辨率为 1°。论文还展示了该数据集如何用于评估气候模型参数化更新，并通过与 Hadley Centre 全球环境模型的比较，突出了该数据集在评估大气层顶端辐射通量日变化方面的价值。,"['top-of-atmosphere radiative fluxes', 'satellite observations', 'climate model evaluation', 'Geostationary Earth Radiation Budget (GERB) instrument', 'diurnal cycle']",Jacqueline E. Russell;Richard J. Bantges;Helen E. Brindley;Alejandro Bodas-Salcedo,GERB Obs4MIPs: a dataset for evaluating diurnal and monthly variations in top-of-atmosphere  radiative fluxes in climate models,"We present a dataset of top-of-atmosphere diurnally resolved reflected solar and emitted thermal energy for Earth system model evaluation. The multi-year, monthly hourly dataset, derived from observations made by the Geostationary Earth Radiation Budget instrument, covers the range 60° N–60° S, 60° E–60° W at 1° resolution. Comparison with two versions of the Hadley Centre Global Environmental Model highlight how the data can be used to assess updates to key model parameterizations. 
 A newly available radiative flux dataset specifically designed to enable the evaluation of the diurnal cycle in top-of-atmosphere (TOA) fluxes as captured by climate and Earth system models is presented. Observations over the period 2007–2012 made by the Geostationary Earth Radiation Budget (GERB) instrument are used to derive monthly hourly mean outgoing longwave radiation (OLR) and reflected shortwave (RSW) fluxes on a regular 1° latitude–longitude grid covering approximately 60° N–60° S and 60° E–60° W. The impact of missing data is evaluated in detail, and a data-filling solution is implemented using estimates of broadband fluxes from the Spinning Enhanced Visible and Infrared Imager flying on the same Meteosat platform, scaled to the GERB observations. This relatively simple approach is shown to deliver an approximate improvement by a factor of 10 in both the bias caused by missing data and the associated variability in the error. To demonstrate the utility of this V1.1 filled GERB Observations for Climate Model Intercomparison Projects (Obs4MIPs) dataset, comparisons are made to radiative fluxes from two climate configurations of the Hadley Centre's Global Environmental Model: HadGEM3-GC3.1 and HadGEM3-GC5.0. Focusing on marine stratocumulus and deep convective cloud regimes, diurnally resolved comparisons between the models and observations highlight discrepancies between the model configurations in terms of their ability to capture the diurnal amplitude and the phase in TOA fluxes, details that cannot be diagnosed by comparisons at lower temporal resolutions. For these cloud regimes the GC5.0 configuration shows improved fidelity to the observations relative to GC3.1, although notable differences remain. The V1.1 filled GERB Obs4MIPs monthly hourly TOA fluxes are available from the Centre for Environmental Data Analysis, with the OLR fluxes accessible at https://doi.org/10.5285/90148d9b1f1c40f1ac40152957e25467 (Bantges et al., 2023a) and the RSW fluxes accessible at https://doi.org/10.5285/57821b58804945deaf4cdde278563ec2 (Bantges et al., 2023b)."
10.5194/gmd-17-6903-2024,True,Geoscientific Model Development,这篇论文研究了EC-Earth3-AerChem模型中气溶胶和云的相互作用，并评估了模型的最新改进。研究重点关注了Twomey效应在更大时空尺度上的表现。论文利用卫星模拟器评估了模型对云物理属性和辐射效应的模拟结果，并通过最大协方差分析研究了气溶胶光学厚度和云滴有效半径之间的关系。研究发现，模型改进后，南大洋的暖偏差显著减小，并且在更大尺度上观察到了Twomey效应的迹象。此外，论文还分析了气溶胶和云对大气辐射的影响。,"['aerosol', 'cloud', 'satellite', 'remote sensing', 'air quality', 'radiative effect', 'climate model', 'EC-Earth3-AerChem', 'Twomey effect']",Manu Anna Thomas;Klaus Wyser;Shiyu Wang;Marios Chatziparaschos;Paraskevi Georgakaki;Montserrat Costa-Surós;Maria Gonçalves Ageitos;Maria Kanakidou;Carlos Pérez García-Pando;Athanasios Nenes;Twan van Noije;Philippe Le Sager;Abhay Devasthale,Recent improvements and maximum covariance analysis of aerosol and cloud properties in the EC-Earth3-AerChem model,"Aerosol–cloud interactions occur at a range of spatio-temporal scales. While evaluating recent developments in EC-Earth3-AerChem, this study aims to understand the extent to which the Twomey effect manifests itself at larger scales. We find a reduction in the warm bias over the Southern Ocean due to model improvements. While we see footprints of the Twomey effect at larger scales, the negative relationship between cloud droplet number and liquid water drives the shortwave radiative effect. 
 Given the importance of aerosols and clouds and their interactions in the climate system, it is imperative that the global Earth system models accurately represent processes associated with them. This is an important prerequisite if we are to narrow the uncertainties in future climate projections. In practice, this means that continuous model evaluations and improvements grounded in observations are necessary. Numerous studies in the past few decades have shown both the usability and the limitations of utilizing satellite-based observations in understanding and evaluating aerosol–cloud interactions, particularly under varying meteorological and satellite sensor sensitivity paradigms. Furthermore, the vast range of spatio-temporal scales at which aerosol and cloud processes occur adds another dimension to the challenges faced when evaluating climate models.In this context, the aim of this study is two-fold. (1) We evaluate the most recent, significant changes in the representation of aerosol and cloud processes implemented in the EC-Earth3-AerChem model in the framework of the EU project FORCeS compared with its previous CMIP6 version (Coupled Model Intercomparison Project Phase 6; https://pcmdi.llnl.gov/CMIP6/, last access: 13 February 2019). We focus particularly on evaluating cloud physical properties and radiative effects, wherever possible, using a satellite simulator. We report on the overall improvements in the EC-Earth3-AerChem model. In particular, the strong warm bias chronically seen over the Southern Ocean is reduced significantly. (2) A statistical, maximum covariance analysis is carried out between aerosol optical depth (AOD) and cloud droplet (CD) effective radius based on the recent EC-Earth3-AerChem/FORCeS simulation to understand to what extent the Twomey effect can manifest itself in the larger spatio-temporal scales. We focus on the three oceanic low-level cloud regimes that are important due to their strong net cooling effect and where pollution outflow from the nearby continent is simultaneously pervasive. We report that the statistical covariability between AOD and CD effective radius is indeed dominantly visible even at the climate scale when the aerosol amount and composition are favourably preconditioned to allow for aerosol–cloud interactions. Despite this strong covariability, our analysis shows a strong cooling/warming in shortwave cloud radiative effects at the top of the atmosphere in our study regions associated with an increase/decrease in CD effective radius. This cooling/warming can be attributed to the increase/decrease in low cloud fraction, in line with previous observational studies."
10.1021/acs.est.4c05291,False,Environmental Science & Technology,该研究主要关注植物根系微生物群落对砷和锑污染的适应性，通过分析不同根系微环境中微生物群落的组成和功能，揭示了植物在世代生长过程中选择性招募砷和锑还原微生物以减轻砷锑共污染的机制。研究方法包括16S rRNA基因扩增测序、arsC和aioA基因扩增测序以及宏基因组测序等。研究结果表明，香根草在砷锑共污染土壤中招募了具有砷和锑还原能力的微生物，这些微生物可以将砷和锑还原为低毒形式，并分解根系分泌物，从而减轻土壤中砷锑的污染程度。该研究为植物修复砷锑污染提供了新的理论依据和技术支撑。,[],Huang Yu;Shengwei Liu;Wanlin Weng;Yijun Peng;Xinqi Cai;Yu Zhu;Pubo Chen;Dandan Zhang;Huanping Liu;Jiaxiong Zeng;Songfeng Liu;Zhili He;Qingyun Yan,Generational Specific Recruitment of Arsenic- and Antimony-Reducing Microorganisms in Plant Root-Associated Niches for Adapting to Metalloid-Metal Pollution,"The recruitment of microorganisms by plants can enhance their adaptability to environmental stressors, but how root-associated niches recruit specific microorganisms for adapting to metalloid-metal contamination is not well-understood. This study investigated the generational recruitment of microorganisms in different root niches of Vetiveria zizanioides (V. zizanioides) under arsenic (As) and antimony (Sb) stress. The V. zizanioides was cultivated in As- and Sb-cocontaminated mine soils (MS) and artificial pollution soils (PS) over two generations in controlled conditions. The root-associated microbial communities were analyzed through 16S rRNA, arsC, and aioA gene amplicon and metagenomics sequencing. V. zizanioides accumulated higher As(III) and Sb(III) in its endosphere in MS in the second generation, while its physiological indices in MS were better than those observed in PS. SourceTracker analysis revealed that V. zizanioides in MS recruited As(V)- and Sb(V)-reducing microorganisms (e.g., Sphingomonales and Rhodospirillaceae) into the rhizoplane and endosphere. Metagenomics analysis further confirmed that these recruited microorganisms carrying genes encoding arsenate reductases with diverse carbohydrate degradation abilities were enriched in the rhizoplane and endosphere, suggesting their potential to reduce As(V) and Sb(V) and to decompose root exudates (e.g., xylan and starch). These findings reveal that V. zizanioides selectively recruits As- and Sb-reducing microorganisms to mitigate As–Sb cocontamination during the generational growth, providing insights into novel strategies for enhancing phytoremediation of metalloid-metal contaminants."
10.1021/acs.est.4c06870,False,Environmental Science & Technology,该研究主要关注的是土壤和沉积物中汞污染的原位修复，通过添加硫插层层状双氢氧化物（S-LDH）来减少微生物甲基化汞的生成。研究发现，S-LDH 可以将汞固定在层间，形成纳米级β-HgS，从而降低汞的生物可利用性，减少甲基汞的产生。该研究与大气环境遥感技术关系不大，主要集中在土壤和沉积物中重金属污染的控制和修复方面。,[],Xin Tong;Zhanhua Zhang;Xiaoyin Dong;Wenyu Guan;Zhenhai Liu;Jiubin Chen;Pedro J. J. Alvarez;Wei Chen;Tong Zhang,Sulfur-Intercalated Layered Double Hydroxides Minimize Microbial Mercury Methylation: Implications for In Situ Remediation of Mercury-Contaminated Sites,"Conventional approaches for in situ remediation of mercury (Hg)-contaminated soils and sediments rely mostly on precipitation or adsorption. However, this can generate Hg-rich surfaces that facilitate microbial production of methylmercury (MeHg), a potent, bioaccumulative neurotoxin. Herein, we prove the concept that the risk of mercury methylation can be effectively minimized by adding sulfur-intercalated layered double hydroxide (S-LDH) to Hg-contaminated soils. Hg bound to S-LDH has minimal methylation potential when incubated with model methylating bacteria Pseudodesulfovibrio mercurii ND132 and Geobacter sulfurreducens PCA. With a combination of spectroscopic and microscopic evidence, as well as theoretical calculations, we confirm that dissolved Hg(II) tends to enter the interlayers of S-LDH to bind to the sulfur groups intercalated within, leading to the formation of nanoscale metacinnabar (β-HgS). This not only physically blocks the contact of methylating microorganisms but also inhibits secondary release of bound mercury in the presence of strong binding ligands in porewater. This study highlights the promising concept of in situ risk reduction of heavy metal contamination by inducing precipitation within (nano)confined domains, achieving a sustainable outcome of enhanced removal and reduced bioaccessibility for pollutants that may otherwise be bioavailable in the form of nanoprecipitates."
10.1021/acs.est.4c05109,False,Environmental Science & Technology,这篇论文主要研究的是山区洪泛区土壤中微生物对有机物的降解和氧化过程，以及季节性洪水对这些过程的影响。研究方法包括代谢组学和蛋白质组学，并结合了对土壤中不同深度和不同时期有机物组成的分析。论文的重点在于探讨洪水对土壤中不同深度有机物降解的影响，以及不同降解机制对气候变化的敏感性。论文与大气环境遥感技术关系不大，没有涉及到空气质量监测、卫星观测或大气成分分析等方面的内容。,[],Cam G. Anderson;Malak M. Tfaily;Rosalie K. Chu;Nikola Tolić;Patricia M. Fox;Peter S. Nico;Scott Fendorf;Marco Keiluweit,Seasonal Controls on Microbial Depolymerization and Oxidation of Organic Matter in Floodplain Soils,"Floodplain soils are vast reservoirs of organic carbon often attributed to anaerobic conditions that impose metabolic constraints on organic matter degradation. What remains elusive is how such metabolic constraints respond to dynamic flooding and drainage cycles characteristic of floodplain soils. Here we show that microbial depolymerization and respiration of organic compounds, two rate-limiting steps in decomposition, vary spatially and temporally with seasonal flooding of mountainous floodplain soils (Gothic, Colorado, USA). Combining metabolomics and -proteomics, we found a lower abundance of oxidative enzymes during flooding coincided with the accumulation of aromatic, high-molecular weight compounds, particularly in surface soils. In subsurface soils, we found that a lower oxidation state of carbon coincided with a greater abundance of chemically reduced, energetically less favorable low-molecular weight metabolites, irrespective of flooding condition. Our results suggest that seasonal flooding temporarily constrains oxidative depolymerization of larger, potentially plant-derived compounds in surface soils; in contrast, energetic constraints on microbial respiration persist in more reducing subsurface soils regardless of flooding. Our work underscores that the potential vulnerability of these distinct anaerobic carbon storage mechanisms to changing flooding dynamics should be considered, particularly as climate change  shifts both the frequency and extent of flooding in floodplains globally."
