doi,is_relevant,journal,explanation,topic_words,authors,title,abstract
10.1021/acs.est.4c00659,False,Environmental Science & Technology,该研究主要关注大气沉降的镉在土壤和水稻中的累积，利用稳定同位素和扩散梯度薄膜技术（DGT）进行研究。研究发现，大气沉降的镉在水稻生长季通过根系和叶片吸收，对水稻籽粒的镉含量贡献率约为37-79%。该研究没有涉及到大气环境遥感技术，例如空气质量监测、卫星观测或大气成分分析。,"['atmospheric deposition', 'cadmium', 'rice', 'soil', 'isotope']",Jun Zhou;Ruizhi Xia;Joshua D. Landis;Yufang Sun;Zhen Zeng;Jing Zhou,Isotope Evidence for Rice Accumulation of Newly Deposited and Soil Legacy Cadmium: A Three-Year Field Study,"Biogeochemical processes of atmospherically deposited cadmium (Cd) in soils and accumulation in rice were investigated through a three-year fully factorial atmospheric exposure experiment using Cd stable isotopes and diffusive gradients in thin films (DGT). Our results showed that approximately 37–79% of Cd in rice grains was contributed by atmospheric deposition through root and foliar uptake during the rice growing season, while the deposited Cd accounted for a small proportion of the soil pools. The highly bioavailable metals in atmospheric deposition significantly increased the soil DGT-measured bioavailable fraction; yet, this fraction rapidly aged following a first-order exponential decay model, leading to similar percentages of the bioavailable fraction in soils exposed for 1–3 years. The enrichment of light Cd isotopes in the atmospheric deposition resulted in a significant shift toward lighter Cd isotopes in rice plants. Using a modified isotopic mass balance model, foliar and root uptake of deposited Cd accounted for 47–51% and 28–36% in leaves, 41–45% and 22–30% in stems, and 45–49% and 26–30% in grains, respectively. The implications of this study are that new atmospheric deposition disproportionately contributes to the uptake of Cd in rice, and managing emissions thus becomes very important versus remediation of impacted soils."
10.1021/acs.est.4c03593,False,Environmental Science & Technology,该研究主要关注的是催化剂在高湿度环境下氨选择性催化还原（NH3-SCR）反应中的活性演变，并探讨了磷修饰对催化剂结构和性能的影响。研究发现磷的引入可以促进水分子与铜物种的相互作用，形成活性[Cu(OH)]+基团和磷酸盐，从而提高催化剂在高湿度环境下的活性。该研究主要集中在催化剂材料的微观结构和活性方面，与大气环境遥感技术关系不大。,"['air pollution', 'catalyst', 'NH3-SCR', 'water', 'humidity', 'copper', 'zeolite']",Penghao An;Chuan Gao;Xiao Zhu;Bin Wang;Yue Xuan;Yanjie Liang;Sunwen Xia;Wenzhe Si;Dong Wang;Yue Peng;Junhua Li,Phosphorus–Water Interaction Drives Active Center Evolution into the Water-Adaptive Structure in the High-Humidity NH3–SCR Reaction,"The impact of water on catalyst activity remains inconclusive due to its dependence on the specific reaction environment. To maximize the exploitation of water’s promoting effect, we employed ammonia selective catalytic reduction (NH3–SCR) as a probe reaction and proposed a phosphorus modification strategy for Cu-ZSM-5 catalysts. The objective of this approach was to construct water-adaptive microstructures through directional arrangement. To investigate the effect of phosphorus on the transformation of framework copper sites in humid environments, we conducted comprehensive characterizations and density functional theory calculation. Results reveal that water molecules cleave the oxygen bridges between phosphorus oxide and copper, leading to the formation of active isolated [Cu(OH)]+ groups and phosphate. The phosphate species weaken the interaction between exchanged Cu2+ groups and the zeolite framework, leading to the generation of highly migratory hydrated Cu2+ species. This work will potentially guide the rational design of water-adaptive catalysts for gas pollution abatement in a humid environment."
10.1021/acs.est.4c02421,False,Environmental Science & Technology,该研究主要关注化学物质的生物累积性预测，利用迁移学习和多任务学习策略构建图神经网络模型。研究使用正辛醇/水分配系数作为源域，训练模型预测三种生物累积参数。研究重点在于解决化学物质生物累积参数预测中数据量不足的问题，并通过模型预测识别潜在的生物累积性化学物质。该研究与大气环境遥感技术关系不大，主要关注化学物质的性质和环境行为，而非大气成分的遥感监测。,"['bioaccumulation', 'chemicals', 'partition coefficients', 'graph neural network', 'transfer learning', 'multitask learning']",Zijun Xiao;Minghua Zhu;Jingwen Chen;Zecang You,Integrated Transfer Learning and Multitask Learning Strategies to Construct Graph Neural Network Models for Predicting Bioaccumulation Parameters of Chemicals,"Accurate prediction of parameters related to the environmental exposure of chemicals is crucial for the sound management of chemicals. However, the lack of large data sets for training models may result in poor prediction accuracy and robustness. Herein, integrated transfer learning (TL) and multitask learning (MTL) was proposed for constructing a graph neural network (GNN) model (abbreviated as TL-MTL-GNN model) using n-octanol/water partition coefficients as a source domain. The TL-MTL-GNN model was trained to predict three bioaccumulation parameters based on enlarged data sets that cover 2496 compounds with at least one bioaccumulation parameter. Results show that the TL-MTL-GNN model outperformed single-task GNN models with and without the TL, as well as conventional machine learning models trained with molecular descriptors or fingerprints. Applicability domains were characterized by a state-of-the-art structure–activity landscape-based (abbreviated as ADSAL) methodology. The TL-MTL-GNN model coupled with the optimal ADSAL was employed to predict bioaccumulation parameters for around 60,000 chemicals, with more than 13,000 compounds identified as bioaccumulative chemicals. The high predictive accuracy and robustness of the TL-MTL-GNN model demonstrate the feasibility of integrating the TL and MTL strategy in modeling small-sized data sets. The strategy holds significant potential for addressing small data challenges in modeling environmental chemicals."
10.1021/acs.est.4c03460,False,Environmental Science & Technology,这篇论文主要研究的是造纸废水处理工艺的多目标优化问题，重点关注经济、能源和环境目标的平衡。研究使用多智能体深度强化学习框架来优化造纸废水处理过程中的成本、能耗和温室气体排放，并通过模拟模型和真实数据验证了该方法的有效性。论文没有涉及大气环境遥感技术，例如空气质量监测、卫星观测或大气成分分析。,[],Zhenglei He;Zaohao Lu;Xu Wang;Qingang Xiong;Kim Phuc Tran;Sébastien Thomassey;Xianyi Zeng;Mengna Hong;Yi Man,"Multiobjective Optimization of Papermaking Wastewater Treatment Processes under Economic, Energy, and Environmental Goals","Due to the heterogeneity of recycled paper materials and the production conditions, pollutants in papermaking wastewater fluctuate sharply over time. Quality control of the papermaking wastewater treatment process (PWTP) is challenging and costly. As regulations are also growing about the environmental effects of the PWTP on greenhouse gas (GHG) emission, energy consumption, etc., the PWTP formulates a complex multiobjective optimization problem. This research established a multiagent deep reinforcement learning framework to simultaneously optimize process cost, energy consumption, and GHG emission in the PWTP, subjected to the effluent quality, to realize economic, energy, and environmental (3E) goals. The biological treatment process of wastewater in paper mills was simulated using benchmark simulation model no. 1 (BSM1). The data generated based on the BSM manual was utilized for model training, and real data acquired from a local papermaking factory was used to estimate the model performance. The results show that the proposed method outperforms conventional techniques in identifying the best control strategies for multiple targets."
10.1021/acs.est.4c00494,False,Environmental Science & Technology,这篇论文主要研究了利用光伏技术驱动的零排放海水淡化技术，探讨了其在美国的应用潜力。论文重点关注了淡化过程中产生的盐水的处理，以及如何通过光伏技术降低海水淡化的能耗和碳排放。论文没有涉及大气环境遥感技术，例如空气质量监测、卫星观测或大气成分分析。,[],Rodrigo A. Caceres Gonzalez and Marta C. Hatzell,Electrified Solar Zero Liquid Discharge: Exploring the Potential of PV-ZLD in the US,"Current brine management strategies are based on the disposal of brine in nearby aquifers, representing a loss in potential water and mineral resources. Zero liquid discharge (ZLD) is a possible strategy to reduce brine rejection while increasing the resource recovery from desalination plants. However, ZLD substantially increases the energy consumption and carbon footprint of a desalination plant. The predominant strategy to reduce the energy consumption and carbon footprint of ZLD is through the use of a hybrid desalination technology that integrates  renewable energy. Here, we built a computational thermodynamic model of the most mature electrified hybrid technology for ZLD powered by photovoltaic (PV). We examine the potential size and cost of ZLD plants in the US. This work explores the variables (geospatial and design) that most influence the levelized cost of water and the second law efficiency. There is a negative correlation between minimizing the LCOW and maximizing the second-law. And maximizing the second-law, the states that more brine produces, Texas is the location where the studied system achieves the lowest LCOW and high second-law efficiency, while California is the state where the studied system is less favorable. A multiobjective optimization study assesses the impact of considering a carbon tax in the cost of produced water and determines the best potential size for the studied plant."
10.1021/acs.est.3c10814,False,Environmental Science & Technology,这篇研究主要关注的是沉积物中混合物的毒性分析，利用深度学习技术将生物活性、结构和GC-HRMS数据联系起来，识别出混合物中的非靶标毒物。研究中使用了高通量筛选生物测定法，并建立了两个深度学习模型来预测生物活性物质的指纹图谱和将这些候选物质转化为MS可读信息。研究结果表明，该方法可以有效地识别出沉积物中多种化学物质，并为混合物的解构和非靶标分析提供指导。该研究与大气环境遥感技术没有直接关系。,[],Fei Cheng;Beate I. Escher;Huizhen Li;Maria König;Yujun Tong;Jiehui Huang;Liwei He;Xinyan Wu;Xiaohan Lou;Dali Wang;Fan Wu;Yuanyuan Pei;Zhiqiang Yu;Bryan W. Brooks;Eddy Y. Zeng;Jing You,"Deep Learning Bridged Bioactivity, Structure, and GC-HRMS-Readable Evidence to Decipher Nontarget Toxicants in Sediments","Identifying causative toxicants in mixtures is critical, but this task is challenging when mixtures contain multiple chemical classes. Effect-based methods are used to complement chemical analyses to identify toxicants, yet conventional bioassays typically rely on an apical and/or single endpoint, providing limited diagnostic potential to guide chemical prioritization. We proposed an event-driven taxonomy framework for mixture risk assessment that relied on high-throughput screening bioassays and toxicant identification integrated by deep learning. In this work, the framework was evaluated using chemical mixtures in sediments eliciting aryl-hydrocarbon receptor activation and oxidative stress response. Mixture prediction using target analysis explained <10% of observed sediment bioactivity. To identify additional contaminants, two deep learning models were developed to predict fingerprints of a pool of bioactive substances (event driver fingerprint, EDFP) and convert these candidates to MS-readable information (event driver ion, EDION) for nontarget analysis. Two libraries with 121 and 118 fingerprints were established, and 247 bioactive compounds were identified at confidence level 2 or 3 in sediment extract using GC-qToF-MS. Among them, 12 toxicants were analytically confirmed using reference standards. Collectively, we present a “bioactivity-signature-toxicant” strategy to deconvolute mixtures and to connect patchy data sets and guide nontarget analysis for diverse chemicals that elicit the same bioactivity."
10.1021/acs.est.4c00172,False,Environmental Science & Technology,这篇论文主要关注的是利用机器学习方法预测人类非癌症和发育/生殖效应的出发点，与大气环境遥感技术，如空气质量监测，卫星观测和大气成分分析，没有直接关系。,[],Jacob Kvasnicka;Nicolò Aurisano;Kerstin von Borries;En-Hsuan Lu;Peter Fantke;Olivier Jolliet;Fred A. Wright;Weihsueh A. Chiu,Two-Stage Machine Learning-Based Approach to Predict Points of Departure for Human Noncancer and Developmental/Reproductive Effects,
10.1021/acs.est.3c10482,False,Environmental Science & Technology,该研究主要集中在利用计算方法和实验验证来提高细胞色素P450 105D7酶的热稳定性和催化活性，以增强其降解药物活性化合物（如双氯芬酸）的能力。研究重点是酶的结构和功能，而非大气环境遥感技术。,[],Ledong Zhu;Guochao Xu;Qingzhu Zhang;Guoqiang Wang;Wenxing Wang;Qiao Wang,Semirational Design Strategy To Enhance the Thermostability and Catalytic Activity of Cytochrome P450 105D7 for the Degradation of the Pharmaceutically Active Compounds: Diclofenac,"Pharmaceutically active compounds are an important category of emerging pollutants, and their biological transformation processes in the environment are crucial for understanding and evaluating the migration, transformation, and environmental fate of emerging pollutants. The cytochrome P450 105 enzyme family has been proven to play an important role in the degradation of exogenous environmental pollutants. However, its thermostability and catalytic activity still need to be improved to better adapt to complex environmental conditions. This work elucidates the key mechanisms and important residues of the degradation reaction through multiple computational strategies, establishes a mutation library, and obtains 21 single-point mutation designs. Experimental verification showed that 16 single mutants had enhanced thermostability, with the R89F and L197Y mutants showing the highest increases in thermostability at 135 and 119% relative to the wild-type enzyme, respectively. Additionally, as a result of the higher specific activity of D390Q, it was selected for combination mutagenesis, ultimately resulting in three combination mutants (R89F/L197Y, R89F/D390Q, and R89F/L197Y/D390Q) with enhanced thermostability and catalytic activity. This study provides a modification approach for constructing efficient enzyme variants through semirational design and can contribute to the development of control technologies for emerging pollutants."
10.1021/acs.est.3c03906,False,Environmental Science & Technology,这篇论文主要研究了利用大数据和深度学习技术开发一种智能的蓝藻水华预警系统。研究人员利用垂直水体监测系统 (VAMS) 收集数据，并使用“DeepDPM-Spectral Clustering”方法对水体垂直层进行分析和分层。他们开发了 Bloomformer-2 模型，用于对 Chl-a 进行单步和多步预测，并结合世界卫生组织发布的“预警级别框架”来实现蓝藻水华的预警。研究结果表明，该系统能够有效地识别水体中的不同水华类型，并提供准确的预测，为蓝藻水华的早期预警提供了新的方法。,"['Harmful Algal Blooms (HABs)', 'Chlorophyll-a (Chl-a)', 'Water Quality Monitoring', 'Deep Learning', 'Early Warning System']",Jing Qian;Li Qian;Nan Pu;Yonghong Bi;Andre Wilhelms;Stefan Norra,An Intelligent Early Warning System for Harmful Algal Blooms: Harnessing the Power of Big Data and Deep Learning,"Harmful algal blooms (HABs) pose a significant ecological threat and economic detriment to freshwater environments. In order to develop an intelligent early warning system for HABs, big data and deep learning models were harnessed in this study. Data collection was achieved utilizing the vertical aquatic monitoring system (VAMS). Subsequently, the analysis and stratification of the vertical aquatic layer were conducted employing the “DeepDPM-Spectral Clustering” method. This approach drastically reduced the number of predictive models and enhanced the adaptability of the system. The Bloomformer-2 model was developed to conduct both single-step and multistep predictions of Chl-a, integrating the ” Alert Level Framework” issued by the World Health Organization to accomplish early warning for HABs. The case study conducted in Taihu Lake revealed that during the winter of 2018, the water column could be partitioned into four clusters (Groups W1–W4), while in the summer of 2019, the water column could be partitioned into five clusters (Groups S1–S5). Moreover, in a subsequent predictive task, Bloomformer-2 exhibited superiority in performance across all clusters for both the winter of 2018 and the summer of 2019 (MAE: 0.175–0.394, MSE: 0.042–0.305, and MAPE: 0.228–2.279 for single-step prediction; MAE: 0.184–0.505, MSE: 0.101–0.378, and MAPE: 0.243–4.011 for multistep prediction). The prediction for the 3 days indicated that Group W1 was in a Level I alert state at all times. Conversely, Group S1 was mainly under an Level I alert, with seven specific time points escalating to a Level II alert. Furthermore, the end-to-end architecture of this system, coupled with the automation of its various processes, minimized human intervention, endowing it with intelligent characteristics. This research highlights the transformative potential of integrating big data and artificial intelligence in environmental management and emphasizes the importance of model interpretability in machine learning applications."
10.1021/acs.est.3c09753,False,Environmental Science & Technology,该研究主要关注的是利用铜催化的过氧乙酸（PAA）体系去除水体中的有机污染物。研究发现，过氧化氢（H2O2）在铜催化PAA体系中起着重要的作用，它可以加速铜离子（Cu(II)）的还原，从而促进PAA的活化，进而提高有机污染物的降解效率。该研究没有涉及到大气环境遥感技术，例如空气质量监测、卫星观测或大气成分分析。,[],Jianying Wu;Jing Zou;Jinbin Lin;Sheng Li;Linfeng He;Zhijie Wu;Qingsong Li;Chunming Gong;Jun Ma,Overlooked Role of Coexistent Hydrogen Peroxide in Activated Peracetic Acid by Cu(II) for Enhanced Oxidation of Organic Contaminants,"Cu(II)-catalyzed peracetic acid (PAA) processes have shown significant potential to remove contaminants in water treatment. Nevertheless, the role of coexistent H2O2 in the transformation from Cu(II) to Cu(I) remained contentious. Herein, with the Cu(II)/PAA process as an example, the respective roles of PAA and H2O2 on the Cu(II)/Cu(I) cycling were comprehensively investigated over the pH range of 7.0–10.5. Contrary to previous studies, it was surprisingly found that the coexistent deprotonated H2O2 (HO2–), instead of PAA, was crucial for accelerating the transformation from Cu(II) to Cu(I) (kHO2–/Cu(II) = (0.17–1) × 106 M–1 s–1, kPAA/Cu(II) < 2.33 ± 0.3 M–1 s–1). Subsequently, the formed Cu(I) preferentially reacted with PAA (kPAA/Cu(I) = (5.84 ± 0.17) × 102 M–1 s–1), rather than H2O2 (kH2O2/Cu(I) = (5.00 ± 0.2) × 101 M–1 s–1), generating reactive species to oxidize organic contaminants. With naproxen as the target pollutant, the proposed synergistic role of H2O2 and PAA was found to be highly dependent on the solution pH with weakly alkaline conditions being more conducive to naproxen degradation. Overall, this study systematically investigated the overlooked but crucial role of coexistent H2O2 in the Cu(II)/PAA process, which might provide valuable insights for better understanding the underlying mechanism in Cu-catalyzed PAA processes."
10.1021/acs.est.3c06447,False,Environmental Science & Technology,该研究主要关注使用表面增强拉曼光谱 (SERS) 技术结合机器学习来预测痕量有机污染物的浓度。研究人员利用傅里叶变换和沃尔什-哈达玛变换等频域变换方法处理 SERS 光谱数据，并训练机器学习模型来预测三种分析物（罗丹明 6G、毒死蜱和三氯生）的浓度。该研究没有直接涉及大气环境遥感技术，例如空气质量监测、卫星观测或大气成分分析。,"['surface-enhanced Raman spectroscopy (SERS)', 'trace organic contaminant', 'machine learning', 'concentration prediction']",Vishnu Jayaprakash;Jae Bem You;Chiranjeevi Kanike;Jinfeng Liu;Christopher McCallum;Xuehua Zhang,Determination of Trace Organic Contaminant Concentration via Machine Classification of Surface-Enhanced Raman Spectra,"Surface-enhanced Raman spectroscopy (SERS) has been well explored as a highly effective characterization technique that is capable of chemical pollutant detection and identification at very low concentrations. Machine learning has been previously used to identify compounds based on SERS spectral data. However, utilization of SERS to quantify concentrations, with or without machine learning, has been difficult due to the spectral intensity being sensitive to confounding factors such as the substrate parameters, orientation of the analyte, and sample preparation technique. Here, we demonstrate an approach for predicting the concentration of sample pollutants from SERS spectra using machine learning. Frequency domain transform methods, including the Fourier and Walsh–Hadamard transforms, are applied to spectral data sets of three analytes (rhodamine 6G, chlorpyrifos, and triclosan), which are then used to train machine learning algorithms. Using standard machine learning models, the concentration of the sample pollutants is predicted with >80% cross-validation accuracy from raw SERS data. A cross-validation accuracy of 85% was achieved using deep learning for a moderately sized data set (∼100 spectra), and 70–80% was achieved for small data sets (∼50 spectra). Performance can be maintained within this range even when combining various sample preparation techniques and environmental media interference. Additionally, as a spectral pretreatment, the Fourier and Hadamard transforms are shown to consistently improve prediction accuracy across multiple data sets. Finally, standard models were shown to accurately identify characteristic peaks of compounds via analysis of their importance scores, further verifying their predictive value."
10.1021/acs.estlett.4c00593,False,Environmental Science & Technology Letters,这篇论文主要关注的是邻苯二甲酸二(2-乙基己基)酯(DEHP)对肠道代谢的影响，研究方法包括肠道类器官模型、肠道激素分泌和代谢组学分析。它与大气环境遥感技术，例如空气质量监测、卫星观测和大气成分分析，没有直接关系。,[],Siqing Yue;Wangchen Zheng;Chuanbing Fan;Chunrui Wang;Yannan Zhao;Qixian Yuan;Guotao Liu;Meirong Zhao,Mechanistic Insights into Di-2-ethylhexyl Phthalate (DEHP)-Induced Metabolic Disruption: Integrating Gut Hormone Secretion and Metabolomics in Colonic Organoids,
