doi,is_relevant,journal,explanation,topic_words,authors,title,abstract
10.1029/2025GL116420,False,Geophysical Research Letters,该研究主要关注陆地生态系统中通过光合作用固定的二氧化碳速率（GPP），并探讨了如何利用荧光效率（ΦF）导出的最优温度（Topt）来改进植被光合作用模型（VPM），从而更准确地估算光合作用。研究重点在于生物地球化学循环，特别是全球碳循环，以及这些循环对未来气候变暖的响应。虽然研究涉及二氧化碳，但其核心在于植物生理生态学和碳循环建模，而非大气环境遥感技术，如空气质量监测、卫星观测或大气成分分析。,"['photosynthesis', 'gross primary production (GPP)', 'light use efficiency (LUE)', 'optimal temperature (Topt)', 'fluorescence efficiency (ΦF)', 'carbon cycle']",Zhaoying Zhang;Yongguang Zhang,Fluorescence Efficiency‐Derived Physiological Optimal Temperature Improving the Estimation of Photosynthesis,"Terrestrial gross primary production (GPP) quantifies the rate of CO2 fixation in ecosystems through photosynthesis. The optimal temperature (Topt) is one of fundamental determinants in the vegetation photosynthesis model (VPM) model that constrains the temperature response of light use efficiency (LUE) under changing environmental conditions. However, the VPM model uses the biome‐specific Topt without considering the spatial variation in Topt. Therefore, this study estimated the global optimal temperature (Topt) from the fluorescence efficiency (ΦF, a proxy of LUE) and adjusted the VPM model by using the spatially resolved Topt. Our results reported that ΦF‐derived Topt is well consistent with LUE‐derived Topt. In addition, the improvement in R2 reached up to 0.05 for sites with a difference between the biome‐specific Topt and ΦF‐derived Topt larger than 5°C. Our results highlight the potential of the adjusted VPM model for studying the global carbon cycle and their responses to the future warming."
10.1029/2025GL115236,False,Geophysical Research Letters,该研究论文主要关注地球磁层中的氧离子(O+)加速机制，特别是通过双重拾起过程实现的加速。论文通过观测和模拟，研究了来自电离层的低能量O+离子如何在高纬磁层顶被地球方向的等离子体射流和尾向磁鞘流加速至高能量。虽然论文涉及大气中的氧离子，但其重点在于磁层物理过程，而非大气环境遥感技术，如空气质量监测、卫星观测或大气成分分析。,[],H. Koike;M. Yamauchi;S. Taguchi;H. Nilsson;I. Dandouras,Energization of Outflowing O+ by Double‐Pickup in Earthward Plasma Jets From Lobe Reconnection and in Magnetosheath Flow,"This study reports a case of energetic oxygen ions (O+) with energies around 20 keV, observed at the high‐latitude magnetopause during lobe reconnection. In the adjacent lobe/mantle region, another O+ beam, outflowing directly from the ionosphere, was observed with energies of approximately 1 keV. The energies and velocity distribution functions of O+ indicate that the observed 20 keV O+ are accelerated through double pickup processes. A test particle simulation shows that the outflowing O+ ions are first picked up by an earthward plasma jet from lobe reconnection and energized up to ∼3 keV. Subsequently, they are picked up by the tailward magnetosheath flow and further energized up to ∼15 keV. A strong gradient in the convection electric field at the magnetopause current layer, which tends to form during lobe reconnection, is likely to play an important role in the generation of energetic O+."
10.1029/2025GL115926,False,Geophysical Research Letters,该研究论文主要关注台风预测，融合了机器学习模型和物理模型，并通过卫星观测数据的同化来提高预测精度。虽然提到了卫星观测，但其重点在于台风的路径、强度和降水预测，而非大气环境遥感技术，如空气质量监测或大气成分分析。因此，该论文与大气环境遥感技术的关联性不强。,"['typhoon forecasting', 'machine learning', 'physics-based model', 'satellite observations', 'data assimilation']",Zeyi Niu;Dongliang Wang;Mu Mu;Wei Huang;Xuliang Fan;Mengqi Yang;Bo Qin,Machine‐Learning (ML)‐Physics Fusion Model Accelerates the Paradigm Shift in Typhoon Forecasting With a CNOP‐Based Assimilation Framework,"In this study, we develop an advanced hybrid forecasting system for short‐term (0–120 hr) typhoon predictions, seamlessly integrating the FuXi machine‐learning model with the physics‐based Shanghai Typhoon Model (SHTM). By employing spectral nudging, the hybrid FuXi‐SHTM model leverages FuXi's robust large‐scale forecasting capabilities alongside SHTM's mesoscale strengths, significantly enhancing track, intensity, and precipitation predictions for super typhoons Yagi (2024) and Krathon (2024). To further improve the forecasting capability for extreme typhoons, the Conditional Nonlinear Optimal Perturbation method is employed for the first time to identify sensitive regions for the hybrid model. Despite being constrained by FuXi's large‐scale forecast fields, the dense assimilation of satellite observations within these sensitive regions can further enhance typhoon forecasts. This study emphasizes the synergy between data‐driven strategies and established physical modeling, which can inspire further depth in understanding of extreme typhoon events."
10.1029/2025GL115668,False,Geophysical Research Letters,该研究论文主要关注平流层突然变暖（SSW）对天气模式的影响，特别是北大西洋涛动（NAO）的负位相。它使用平流层数值模拟实验来研究2018年和2019年的两次SSW事件，并分析了平流层与对流层之间的耦合关系如何影响天气预报。虽然该研究涉及大气过程，但其重点在于天气预报和气候模式，而不是大气环境遥感技术，例如空气质量监测、卫星观测或大气成分分析。因此，它与大气环境遥感技术的直接关联性较弱。,"['Stratospheric Polar Vortex', 'Sudden Stratospheric Warming (SSW)', 'North Atlantic Oscillation (NAO)', 'Weather Regimes', 'Stratosphere-Troposphere Coupling', 'Subseasonal Forecasts']",Robert W. Lee;Andrew J. Charlton‐Perez;Simon H. Lee,Stratospheric Impacts on Weather Regimes Following the 2018 and 2019 Sudden Stratospheric Warmings,"Major disruptions of the stratospheric polar vortex can improve subseasonal forecast skill for surface climate, as negative North Atlantic Oscillation‐like (NAO−) states can follow sudden stratospheric warmings (SSWs). Yet most insights come from observational studies or large operational forecast archives. Here we use Stratospheric Nudging And Predictable Surface Impacts (SNAPSI) project experiments, which applies stratospheric nudging to forecasts of two SSWs (2018 and 2019) followed by differing tropospheric evolutions. We show that SSWs systematically shift the atmosphere toward negative NAO‐like regimes (stronger Greenland anticyclone) in both the North Atlantic‐European and North American regions. Comparisons among nudged, free, and control runs quantify the benefits of improving and removing SSW representation in diagnosing tropospheric regime shifts. In 2018, accurate stratospheric representation improved weather regime forecasts. However, in 2019, despite persistent observed ridged regimes, nudged SSWs still induced negative NAO‐like patterns, implying that subseasonal models sometimes underrepresent other teleconnections and overrepresent stratosphere‐troposphere coupling."
10.1029/2025GL116277,False,Geophysical Research Letters,该论文主要研究木星磁层盘的结构和动力学，重点是磁场弯曲变化和等离子体波动。虽然提到了卫星观测（Juno），但研究对象是木星的磁层，而非地球大气环境。因此，与大气环境遥感技术（如空气质量监测、卫星观测地球大气成分等）没有直接关联。,[],Z. H. Yao;Y. Xu;Z. L. Zeng;B. Zhang;D. Grodent;B. Bonfond;Y. N. Chen;W. R. Dunn;J. W. Sun;R. W. Ebert;J. E. P. Connerney;F. Allegrini,Rotating Finger‐Like Structures of Jovian Magnetodisc,"At Jupiter, the plasma is concentrated near the centrifugal equator, forming a magnetodisc. The planet's dipole tilt induces periodic disc flapping, generating magnetic oscillations observed by spacecraft. While centrifugal forces are theorized to drive interchange instability in this system, direct detection of such structures remains challenging due to flapping‐induced variabilities. However, in situ and remote sensing data reveal ∼tens‐of‐minute periodicities proposed to link to interchange dynamics. Using unique Juno observations, we analyze two events to: (a) resolve highly variable magnetic curvature changes during successive plasma sheet crossings and (b) identify periodic ∼30‐min fluctuations in plasma measurements in the magnetodisc while Juno occupied a magnetically favorable location. These findings provide the first direct examination of interchange‐related magnetic curvature evolution and plasma signatures, to advance our understanding of the magnetodisc's 3D structure and instability‐driven dynamics."
10.1029/2025GL115256,False,Geophysical Research Letters,该研究论文主要关注南极海冰范围的急剧下降，并使用海冰-海洋模型来研究其原因。研究发现，海冰边缘附近海面温度的升高是导致海冰减少的主要因素。虽然该研究与气候变化有关，但它主要侧重于海洋和海冰的相互作用，而不是大气环境遥感技术，如空气质量监测、卫星观测或大气成分分析。,"['Antarctic sea ice', 'Sea surface temperature', 'Climate modeling']",K. Kusahara;H. Tatebe,Causes of the Abrupt and Sustained 2016–2023 Antarctic Sea‐Ice Decline: A Sea Ice–Ocean Model Perspective,"Antarctic sea ice, which undergoes large seasonal changes and plays a crucial role in the global climate system, showed a gradual increasing trend in its extent from the late 1970s to 2015 but experienced a sharp decline in 2016, followed by record lows in subsequent years. This study investigates the causes of the recent regime shift in Antarctic sea‐ice extent (SIE) using a global sea ice–ocean model with 0.25° resolution forced by atmospheric reanalysis‐based surface boundary conditions. Numerical experiments reveal that thermodynamic boundary conditions, particularly the increased subpolar sea surface temperatures (SSTs) north of the sea‐ice edge, are the dominant drivers of Antarctic sea‐ice decline. Additionally, wind stress partly contributes to the variability in summer SIE. These findings highlight that SST warming near the sea‐ice edge, resulting from atmosphere–ocean interactions under ongoing atmospheric warming, plays a key role in the recent decline in Antarctic SIE."
10.1029/2025GL117293,False,Geophysical Research Letters,该论文主要研究极光现象，特别是前午和后午极光的不对称性。研究重点是前午极光卵极向偏移（PAOPS）现象，并探讨了其与行星际磁场（IMF）极性、太阳周期和季节的关系。研究还利用能量分散离子来推断PAOPS的起源是由于IMF和地磁场在瓣区发生磁重联。虽然该研究涉及大气中的现象，但其重点在于磁场和极光活动，与大气环境遥感技术（如空气质量监测、卫星观测和大气成分分析）没有直接关系。,"['aurora', 'interplanetary magnetic field', 'IMF', 'magnetic reconnection', 'polar cap', 'hemisphere', 'solar cycle']",Yu Wang;Desheng Han,PAOPS (Prenoon Auroral Oval Poleward Shift): A Novel Prenoon‐Postnoon Auroral Asymmetry Phenomenon Revealed by Simultaneous Interhemispheric Observations,"Previous studies indicate that specific polar cap auroral forms frequently occur in the postnoon in summer due to the influence of the interplanetary magnetic field (IMF) By component. However, regardless of the season and IMF conditions, similar auroral forms rarely occur in the prenoon. The reason for this asymmetry remains a mystery. By comparing concurrent auroral observations in both hemispheres, we found that when the polarity of the IMF By (positive), which favors the formation of the specific postnoon auroral forms, is reversed (negative), a phenomenon called Prenoon Auroral Oval Poleward Shift (PAOPS) can be often observed in the summer hemisphere. This highlights a new finding about prenoon‐postnoon auroral asymmetry. PAOPS occurrence exhibits solar cycle dependence, seasonal preference, and IMF control. Energy‐dispersed ions suggest PAOPS originates from magnetic reconnection between IMF and geomagnetic fields in the lobe region."
10.1029/2025GL115365,False,Geophysical Research Letters,该论文主要关注气候模型（CMIP6）在模拟与热带气旋、温带气旋和大气河流相关的极端降水事件时的偏差。研究重点在于评估模型预测的极端降水强度与实际观测（ERA5）之间的差异，并分析这些偏差的成因，包括动力过程和湿度条件的影响。虽然该研究涉及大气过程和降水，但它与大气环境遥感技术（如空气质量监测、卫星观测和大气成分分析）没有直接关系。论文侧重于气候模型的性能评估和偏差分析，而非利用遥感技术进行大气环境监测或成分分析。,[],Xiaorui Li;Bo Liu;Bin Wang;Guoyu Ren;Cristian Martinez‐Villalobos;Meiyu Chang;Zhongshi Zhang,Understanding the Intricacies of Model Biases in Storm‐Related Extreme Precipitation Using CMIP6,"This paper evaluates the biases, defined as deviations from ERA5, in extreme precipitation linked to tropical cyclones (TCs), extratropical cyclones (ETCs), and atmospheric rivers (ARs) in Coupled Model Intercomparison Project Phase 6 (CMIP6) models during 1985–2014. Overall, the multi‐model ensemble significantly overestimates the intensity of storm‐associated extreme precipitation, with global average biases of 19.1% for TCs, 11.4% for ETCs, and 12.2% for ARs. This corresponds to at least a 57% higher risk of storm‐associated extreme precipitation above the 99.9th percentile in the models. The skill score of the CMIP6 multi‐model ensemble mean ranks in the mid‐range among the models, while high‐resolution models typically achieve higher scores. Composite rainfall structure analysis indicates that, although CMIP6 models roughly reproduce the overall structure of extreme precipitation associated with the three storm types, they display significant wet biases with pronounced regional features. These regional differences are primarily influenced by flawed dynamical processes, while moisture conditions play a secondary role."
10.1029/gh2.538,False,GeoHealth,根据提供的信息，文章没有摘要，标题仅为“Issue Information”，无法判断其与大气环境遥感技术的相关性。因此，无法确定其主题词，也无法给出关于文章内容的中文解释。,[],,Issue Information,No abstract is available for this article.
10.1038/d41586-025-02477-y,False,Nature,该论文的标题和摘要表明其主要关注点是培育能够抵抗疾病和气候变化的巨型虾。这与大气环境遥感技术（如空气质量监测、卫星观测和大气成分分析）没有直接关系。因此，该论文与大气环境遥感技术领域不相关。,[],Fengbo Li;Qiang Gao,Breed giant prawns to withstand disease and climate change,"Breed giant prawns to withstand disease and climate change 
 Letter to the Editor"
10.1038/d41586-025-02475-0,False,Nature,该论文的标题和摘要主要关注海洋洄游物种的保护以及陆地和海洋之间的生态联系。它与大气环境遥感技术（如空气质量监测、卫星观测和大气成分分析）没有直接关系。因此，该论文与大气环境遥感技术的相关性较低。,[],Géraldine Lassalle;Patrick Lambert;Audrey M. Darnaude;Pedro Raposo de Almeida,Conserve marine migratory species to protect ecological links between land and sea,"Conserve marine migratory species to protect ecological links between land and sea 
 Letter to the Editor"
10.1038/d41586-025-02482-1,False,Nature,这篇论文的标题和摘要主要关注人工智能生成的虚假引用问题。它探讨了人工智能可能导致的学术不端行为，以及如何应对和解决这些问题。该论文与大气环境遥感技术，如空气质量监测、卫星观测和大气成分分析等，没有直接关系。它的重点在于学术诚信和人工智能的应用风险。,"['Artificial Intelligence', 'Fake Citations', 'Academic Integrity', 'Research Misconduct']",Ayyoob Sharifi,Tackle fake citations generated by AI,"Tackle fake citations generated by AI 
 Letter to the Editor"
10.1038/d41586-025-02442-9,False,Nature,该研究的标题和摘要表明，它主要关注海洋生物学，特别是海星大量死亡的原因。研究确定了一种细菌是导致北美西海岸海星消耗性疾病的原因。因此，该研究与大气环境遥感技术（如空气质量监测、卫星观测和大气成分分析）没有直接关系。,[],,Mystery of billions of sea-star deaths solved at last,"Experiments identify a bacterium as the cause of sea-star wasting disease, which has devastated populations along the western coast of North America. 
 Experiments identify a bacterium as the cause of sea-star wasting disease, which has devastated populations along the western coast of North America.  Experiments identify a bacterium as the cause of sea-star wasting disease, which has devastated populations along the western coast of North America."
10.1038/d41586-025-02478-x,False,Nature,该标题和摘要主要讨论的是科学领域中的“Plan-B”职业（备选职业），探讨这种职业选择对科学发展的积极作用。它与大气环境遥感技术，如空气质量监测、卫星观测和大气成分分析等，没有直接关联。文章关注的是职业发展和科学领域的人才流动，而非特定的环境科学技术应用。,[],Kathleen A. Marrs,Plan-B careers can be a force for good in science,"Plan-B careers can be a force for good in science 
 Letter to the Editor"
10.1038/d41586-025-02480-3,False,Nature,该论文的标题和摘要表明，它主要关注医疗人工智能的伦理问题，特别是未经患者知情同意的情况下使用患者数据进行AI训练的问题。 这与大气环境遥感技术（如空气质量监测、卫星观测和大气成分分析）无关。,[],Toral Banerjee;Rongyu Lin;Mengyuan Shi,Don’t train medical AI on patients’ data without their knowledge,"Don’t train medical AI on patients’ data without their knowledge 
 Letter to the Editor"
10.1038/d41586-025-02440-x,False,Nature,该论文描述了一种纳米机器，它能将分子链转化为互锁的环。这与大气环境遥感技术（如空气质量监测、卫星观测和大气成分分析）没有直接关系。该研究属于纳米技术和分子工程领域，而非大气科学。,[],,Tiny motor uses heat to perform molecular magic,"A nanoscopic machine transforms a molecular chain into interlocking loops. 
 A nanoscopic machine transforms a molecular chain into interlocking loops.  A nanoscopic machine transforms a molecular chain into interlocking loops."
10.1038/d41586-025-02476-z,False,Nature,该论文的标题和摘要主要关注在战争期间保护巴勒斯坦考古遗址，与大气环境遥感技术（如空气质量监测、卫星观测和大气成分分析）没有直接关系。因此，该论文不属于大气环境遥感技术的范畴。,[],Loay Abu Alsaud,Protect Palestinian archaeological sites during war,"Protect Palestinian archaeological sites during war 
 Letter to the Editor"
10.1038/d41586-025-02257-8,False,Nature,该论文的标题和摘要描述的是关于狒狒使用石头进行自卫的行为，以及野外工作者躲避猴子投掷的石块的轶事。与大气环境遥感技术（如空气质量监测、卫星观测和大气成分分析）没有直接关系。因此，该论文与大气环境遥感技术无关。,[],,Baboons defend themselves by throwing stones,"Fieldworkers dodge monkeys’ rocky missiles, and abandoned plans to make cork mattresses, in our weekly dip into Nature’s archive. 
 Fieldworkers dodge monkeys’ rocky missiles, and abandoned plans to make cork mattresses, in our weekly dip into Nature’s archive.  Snippets from Nature’s past."
10.1038/d41586-025-02479-w,False,Nature,根据提供的标题和摘要，这篇论文主要关注通过巧妙的政治手段克服可再生能源发展所面临的威胁。它侧重于能源政策和政治策略，而非大气环境遥感技术。因此，它与空气质量监测、卫星观测或大气成分分析等大气环境遥感技术没有直接关系。,"['renewable energy', 'statecraft', 'policy', 'energy policy']",Sangeetha Chandrashekeran;Adam Fish;Elizabeth Thurbon;Benjamin K. Sovacool,Overcome threats to renewable energy through skilful statecraft,"Overcome threats to renewable energy through skilful statecraft 
 Letter to the Editor"
10.1038/d41586-025-02481-2,False,Nature,该标题和摘要主要关注工作场所的生物危害防护，与大气环境遥感技术（如空气质量监测、卫星观测和大气成分分析）没有直接关系。 这封信更像是写给编辑的，讨论了生物危害防护措施的最新进展。,[],Gunter Kathagen,Protection from biological hazards at work arrives at last,"Protection from biological hazards at work arrives at last 
 Letter to the Editor"
10.1038/d41586-025-02453-6,False,Nature,该论文的标题和摘要主要关注核冲突的影响以及联合国相关研究的滞后性。虽然核战争可能对大气环境产生影响（例如，通过核冬天改变大气成分），但论文本身并未直接涉及大气环境遥感技术，如空气质量监测、卫星观测或大气成分分析。因此，该论文与大气环境遥感技术的关联性较弱。,"['nuclear conflict', 'United Nations study', 'effects of nuclear war']",,Scientists can help stop a slide to nuclear war — don’t shut them out again,"It has taken the United Nations nearly 40 years to commission another study on the effects of nuclear conflict. Better late than never. 
 It has taken the United Nations nearly 40 years to commission another study on the effects of nuclear conflict. Better late than never.  It has taken the United Nations nearly 40 years to commission another study on the effects of nuclear conflict. Better late than never."
10.1038/d41586-025-01814-5,False,Nature,该论文的标题和摘要主要关注生成式人工智能（如ChatGPT）在教育领域的影响，特别是学生论文写作方面。它探讨了如何通过分析写作过程的各个步骤来应对人工智能代写的问题，并讨论了这种方法带来的其他好处。论文内容与大气环境遥感技术，如空气质量监测、卫星观测和大气成分分析等，没有直接关联。,[],Nikita Bezrukov,Version control: how I combat the rise of generative AI in the classroom,"I was worried that ChatGPT was composing my students’ essays. Looking at the writing process step by step can combat this and has other benefits, too. 
 I was worried that ChatGPT was composing my students’ essays. Looking at the writing process step by step can combat this and has other benefits, too.  I was worried that ChatGPT was composing my students’ essays. Looking at the writing process step by step can combat this and has other benefits, too."
10.1038/d41586-025-02460-7,False,Nature,该研究论文的标题和摘要主要关注的是广岛原子弹爆炸事件幸存者的回忆。它强调了保存这些目击者叙述的重要性。论文内容与大气环境遥感技术（如空气质量监测、卫星观测或大气成分分析）无关。,[],Mordecai Sheftall,‘The Sun had fallen to Earth’ — a survivor’s recollection of the Hiroshima bombing,"Eighty years after the atomic bomb was dropped on Japan, it is crucial that witness accounts are saved. Here is what one man told me. 
 Eighty years after the atomic bomb was dropped on Japan, it is crucial that witness accounts are saved. Here is what one man told me.  Eighty years after the atomic bomb was dropped on Japan, it is crucial that witness accounts are saved. Here is what one man told me."
10.1038/d41586-025-02463-4,False,Nature,该标题和摘要描述了坦桑尼亚一家名为TRí的可持续交通公司，该公司主要业务是组装和维修电动三轮车。文章关注的是电动交通工具在可持续交通中的应用，与大气环境遥感技术（如空气质量监测、卫星观测和大气成分分析）没有直接关系。,"['electric vehicles', 'sustainable transportation', 'three-wheelers', 'Tanzania']",Nikki Forrester,How I’m electrifying transportation in Tanzania,"Technician Erasto Job assembles and fixes electric three-wheelers for TRí, a sustainable transportation company in Dar es Salaam. 
 Technician Erasto Job assembles and fixes electric three-wheelers for TRí, a sustainable transportation company in Dar es Salaam.   Technician Erasto Job assembles and fixes electric three-wheelers for TRí, a sustainable transportation company in Dar es Salaam. "
