doi,is_relevant,journal,explanation,topic_words,authors,title,abstract
10.1038/s41586-024-08316-w,False,Nature,这篇论文研究的是地幔碳酸盐熔体迁移对克拉通边缘硫化物富集和金属矿床形成的影响。它关注的是地球深部过程，特别是克拉通岩石圈地幔中硫和铜的分布，以及碳酸盐熔体在金属成矿中的作用。研究方法包括对全球克拉通橄榄岩中硫和铜含量的编译分析以及高压实验。其研究结果揭示了碳酸盐熔体的迁移导致克拉通边缘形成富硫的陆根，并解释了碳酸岩与岩浆金属矿床共生的现象。该研究与大气环境遥感技术，例如空气质量监测、卫星观测和大气成分分析等，没有任何直接关系。,[],Chunfei Chen;Michael W. Förster;Svyatoslav S. Shcheka;Isra S. Ezad;Joshua J. Shea;Yongsheng Liu;Dorrit E. Jacob;Stephen F. Foley,Sulfide-rich continental roots at cratonic margins formed by carbonated melts,"Examination of the sulfur and copper contents of global cratonic peridotites combined with new high-pressure experiments shows that the migration of carbonated melts towards cratonic margins explains the co-location of magmatic metal deposits with carbonatites. 
 The cratonic crust contains abundant mineral deposits of metals such as gold, copper and rare earths1–5 and is underlain by a thick mantle lithosphere rich in the volatiles carbon, sulfur and water6–8. Although volatiles are known to be key components in metallogenesis9, how and where they are distributed in the cratonic lithosphere mantle and their role in the initial enrichment of metals have not been sufficiently explored. Here we compile sulfur and copper contents of global cratonic peridotites, identifying sulfide-rich and copper-rich continental roots at depths of 160–190 km at cratonic margins. Our new high-pressure experiments show that carbonated silicate melts originating from the asthenosphere lose silicate components during reaction with lithospheric peridotite, evolving to carbonatite melts that become concentrated at cratonic margins. Sulfur solubility in melts substantially decreases as the SiO2 content of melts decreases during this process, forcing sulfide precipitation and the formation of sulfide-rich continental roots at the base of the mantle lithosphere. The migration of carbonated melts towards cratonic margins replenishes the continental roots there with sulfur, explaining the co-location of magmatic metal deposits with carbonatites close to cratonic margins. These findings highlight the notable role of carbonated melts in metallogenesis and provide a potential platform for metal ore exploration. Examination of the sulfur and copper contents of global cratonic peridotites combined with new high-pressure experiments shows that the migration of carbonated melts towards cratonic margins explains the co-location of magmatic metal deposits with carbonatites."
10.1038/s41586-024-08351-7,False,Nature,这篇研究论文主要关注人类大脑新皮质的发育过程，特别是神经元、少突胶质细胞前体细胞和星形胶质细胞的产生和分化。研究使用了单细胞核染色质可及性和转录组数据，结合空间转录组分析和谱系追踪实验，揭示了三能中间祖细胞 (Tri-IPCs) 的作用以及其与胶质母细胞瘤的关系。此外，研究还整合了基因组关联研究数据，探讨了发育过程中新皮质细胞与自闭症谱系障碍的关联。总而言之，这是一项神经生物学研究，与大气环境遥感技术，例如空气质量监测、卫星观测和大气成分分析等，没有任何关系。,[],Li Wang;Cheng Wang;Juan A. Moriano;Songcang Chen;Guolong Zuo;Arantxa Cebrián-Silla;Shaobo Zhang;Tanzila Mukhtar;Shaohui Wang;Mengyi Song;Lilian Gomes de Oliveira;Qiuli Bi;Jonathan J. Augustin;Xinxin Ge;Mercedes F. Paredes;Eric J. Huang;Arturo Alvarez-Buylla;Xin Duan;Jingjing Li;Arnold R. Kriegstein,Molecular and cellular dynamics of the developing human neocortex,"Tripotential intermediate progenitor cells are responsible for the local production of GABAergic neurons, oligodendrocyte precursor cells and astrocytes in the human neocortex. 
 The development of the human neocortex is highly dynamic, involving complex cellular trajectories controlled by gene regulation1. Here we collected paired single-nucleus chromatin accessibility and transcriptome data from 38 human neocortical samples encompassing both the prefrontal cortex and the primary visual cortex. These samples span five main developmental stages, ranging from the first trimester to adolescence. In parallel, we performed spatial transcriptomic analysis on a subset of the samples to illustrate spatial organization and intercellular communication. This atlas enables us to catalogue cell-type-specific, age-specific and area-specific gene regulatory networks underlying neural differentiation. Moreover, combining single-cell profiling, progenitor purification and lineage-tracing experiments, we have untangled the complex lineage relationships among progenitor subtypes during the neurogenesis-to-gliogenesis transition. We identified a tripotential intermediate progenitor subtype—tripotential intermediate progenitor cells (Tri-IPCs)—that is responsible for the local production of GABAergic neurons, oligodendrocyte precursor cells and astrocytes. Notably, most glioblastoma cells resemble Tri-IPCs at the transcriptomic level, suggesting that cancer cells hijack developmental processes to enhance growth and heterogeneity. Furthermore, by integrating our atlas data with large-scale genome-wide association study data, we created a disease-risk map highlighting enriched risk associated with autism spectrum disorder in second-trimester intratelencephalic neurons. Our study sheds light on the molecular and cellular dynamics of the developing human neocortex. Tripotential intermediate progenitor cells are responsible for the local production of GABAergic neurons, oligodendrocyte precursor cells and astrocytes in the human neocortex."
10.1038/s41586-024-08370-4,False,Nature,这篇研究论文主要关注的是人类蛋白质结构域的错义突变及其对蛋白质稳定性的影响。研究者构建了一个包含超过50万个错义突变变体的文库，并通过实验分析了这些突变对500多个蛋白质结构域丰度的影响。结果表明，60%的致病性错义突变会降低蛋白质的稳定性。这项研究与大气环境遥感技术，例如空气质量监测、卫星观测和大气成分分析等，没有任何直接关系。研究中涉及的是人类基因组、蛋白质结构和功能等方面，与大气科学领域完全不同。,[],Antoni Beltran;Xiang’er Jiang;Yue Shen;Ben Lehner,Site-saturation mutagenesis of 500 human protein domains,"Large-scale experimental analysis of Human Domainome 1, a library containing more than 500,000 missense mutation variants across more than 500 human protein domains, reveals that 60% of pathogenic missense variants reduce stability of protein domains. 
 Missense variants that change the amino acid sequences of proteins cause one-third of human genetic diseases1. Tens of millions of missense variants exist in the current human population, and the vast majority of these have unknown functional consequences. Here we present a large-scale experimental analysis of human missense variants across many different proteins. Using DNA synthesis and cellular selection experiments we quantify the effect of more than 500,000 variants on the abundance of more than 500 human protein domains. This dataset reveals that 60% of pathogenic missense variants reduce protein stability. The contribution of stability to protein fitness varies across proteins and diseases and is particularly important in recessive disorders. We combine stability measurements with protein language models to annotate functional sites across proteins. Mutational effects on stability are largely conserved in homologous domains, enabling accurate stability prediction across entire protein families using energy models. Our data demonstrate the feasibility of assaying human protein variants at scale and provides a large consistent reference dataset for clinical variant interpretation and training and benchmarking of computational methods. Large-scale experimental analysis of Human Domainome 1, a library containing more than 500,000 missense mutation variants across more than 500 human protein domains, reveals that 60% of pathogenic missense variants reduce stability of protein domains."
10.1038/s41586-024-08328-6,False,Nature,这篇论文介绍了一种名为TabPFN的表格型基础模型，该模型在小数据集上表现出优异的预测精度。它利用先验数据拟合网络，在最多10000个样本的数据集上显著超越了现有方法。TabPFN是一个生成式Transformer模型，支持微调、数据生成、密度估计和学习可复用嵌入。该模型本身也是通过学习数百万个合成数据集训练得到的。虽然该模型具有广泛的应用潜力，可以加速科学发现和改进决策，但它与大气环境遥感技术（例如空气质量监测、卫星观测和大气成分分析）并没有直接关系。论文关注的是一种通用的机器学习模型，其应用范围广泛，不局限于大气科学领域。,[],Noah Hollmann;Samuel Müller;Lennart Purucker;Arjun Krishnakumar;Max Körfer;Shi Bin Hoo;Robin Tibor Schirrmeister;Frank Hutter,Accurate predictions on small data with a tabular foundation model,"Tabular Prior-data Fitted Network, a tabular foundation model, provides accurate predictions on small data and outperforms all previous methods on datasets with up to 10,000 samples by a wide margin. 
 Tabular data, spreadsheets organized in rows and columns, are ubiquitous across scientific fields, from biomedicine to particle physics to economics and climate science1,2. The fundamental prediction task of filling in missing values of a label column based on the rest of the columns is essential for various applications as diverse as biomedical risk models, drug discovery and materials science. Although deep learning has revolutionized learning from raw data and led to numerous high-profile success stories3–5, gradient-boosted decision trees6–9 have dominated tabular data for the past 20 years. Here we present the Tabular Prior-data Fitted Network (TabPFN), a tabular foundation model that outperforms all previous methods on datasets with up to 10,000 samples by a wide margin, using substantially less training time. In 2.8 s, TabPFN outperforms an ensemble of the strongest baselines tuned for 4 h in a classification setting. As a generative transformer-based foundation model, this model also allows fine-tuning, data generation, density estimation and learning reusable embeddings. TabPFN is a learning algorithm that is itself learned across millions of synthetic datasets, demonstrating the power of this approach for algorithm development. By improving modelling abilities across diverse fields, TabPFN has the potential to accelerate scientific discovery and enhance important decision-making in various domains. Tabular Prior-data Fitted Network, a tabular foundation model, provides accurate predictions on small data and outperforms all previous methods on datasets with up to 10,000 samples by a wide margin."
10.1038/s41586-024-08347-3,False,Nature,这篇论文研究的是在超冷费米气体系统中二维非厄米拓扑能带的非厄米趋肤效应。它利用自旋轨道耦合的光学晶格和可调耗散来创建二维非厄米拓扑能带，并通过实验观测到复能量平面中的非零谱绕数、实空间中的质心运动以及动量空间中由开放式体费米弧连接的一对异常点。该研究属于凝聚态物理和量子物理的范畴，与大气环境遥感技术（如空气质量监测、卫星观测和大气成分分析）没有直接关系。,[],Entong Zhao;Zhiyuan Wang;Chengdong He;Ting Fung Jeffrey Poon;Ka Kwan Pak;Yu-Jun Liu;Peng Ren;Xiong-Jun Liu;Gyu-Boong Jo,Two-dimensional non-Hermitian skin effect in an ultracold Fermi gas,"A two-dimensional non-Hermitian topological band is created in an ultracold system of fermions, which exhibits the non-Hermitian skin effect. 
 The concept of non-Hermiticity has expanded the understanding of band topology, leading to the emergence of counter-intuitive phenomena. An example is the non-Hermitian skin effect (NHSE)1–7, which involves the concentration of eigenstates at the boundary. However, despite the potential insights that can be gained from high-dimensional non-Hermitian quantum systems in areas such as curved space8–10, high-order topological phases11,12 and black holes13,14, the realization of this effect in high dimensions remains unexplored. Here we create a two-dimensional (2D) non-Hermitian topological band for ultracold fermions in spin–orbit-coupled optical lattices with tunable dissipation, which exhibits the NHSE. We first experimentally demonstrate pronounced nonzero spectral winding numbers in the complex energy plane with nonzero dissipation, which establishes the existence of 2D skin effect. Furthermore, we observe the real-space dynamical signature of NHSE in real space by monitoring the centre of mass motion of atoms. Finally, we also demonstrate that a pair of exceptional points are created in the momentum space, connected by an open-ended bulk Fermi arc, in contrast to closed loops found in Hermitian systems. The associated exceptional points emerge and shift with increasing dissipation, leading to the formation of the Fermi arc. Our work sets the stage for further investigation into simulating non-Hermitian physics in high dimensions and paves the way for understanding the interplay of quantum statistics with NHSE. A two-dimensional non-Hermitian topological band is created in an ultracold system of fermions, which exhibits the non-Hermitian skin effect."
10.1038/s41586-024-08375-z,False,Nature,这篇研究论文关注的是淡水生物的灭绝风险评估。研究人员对23496种十足类甲壳动物、鱼类和蜻蜓进行了评估，发现其中四分之一面临灭绝的威胁。导致淡水生物面临灭绝的主要威胁包括污染、水坝和取水、农业和入侵物种，以及过度捕捞。研究还考察了受威胁的陆地四足动物和淡水非生物因素（水压力和氮）作为受威胁淡水物种替代指标的程度。结果表明，受威胁的陆地四足动物在优先保护区域以最大限度地提高稀有性加权丰富度方面是良好的替代指标，但在优先保护范围最受限制的物种方面则表现较差。然而，它们比非生物因素要好得多，非生物因素的表现甚至比随机选择还要差。因此，尽管为陆地四足动物保护确定的全球优先区域大体上反映了淡水动物群的优先区域，但鉴于关键威胁和栖息地的差异，满足陆地四足动物的需求并不能保证在地方尺度上也能保护淡水物种。总的来说，该研究与大气环境遥感技术，例如空气质量监测、卫星观测和大气成分分析，没有任何关系。,[],Catherine A. Sayer;Eresha Fernando;Randall R. Jimenez;Nicholas B. W. Macfarlane;Giovanni Rapacciuolo;Monika Böhm;Thomas M. Brooks;Topiltzin Contreras-MacBeath;Neil A. Cox;Ian Harrison;Michael Hoffmann;Richard Jenkins;Kevin G. Smith;Jean-Christophe Vié;John C. Abbott;David J. Allen;Gerald R. Allen;Violeta Barrios;Jean-Pierre Boudot;Savrina F. Carrizo;Patricia Charvet;Viola Clausnitzer;Leonardo Congiu;Keith A. Crandall;Neil Cumberlidge;Annabelle Cuttelod;James Dalton;Adam G. Daniels;Sammy De Grave;Geert De Knijf;Klaas-Douwe B. Dijkstra;Rory A. Dow;Jörg Freyhof;Nieves García;Joern Gessner;Abebe Getahun;Claudine Gibson;Matthew J. Gollock;Michael I. Grant;Alice E. R. Groom;Michael P. Hammer;Geoffrey A. Hammerson;Craig Hilton-Taylor;Laurel Hodgkinson;Robert A. Holland;Rima W. Jabado;Diego Juffe Bignoli;Vincent J. Kalkman;Bakhtiyor K. Karimov;Jens Kipping;Maurice Kottelat;Philippe A. Lalèyè;Helen K. Larson;Mark Lintermans;Federico Lozano;Arne Ludwig;Timothy J. Lyons;Laura Máiz-Tomé;Sanjay Molur;Heok Hee Ng;Catherine Numa;Amy F. Palmer-Newton;Charlotte Pike;Helen E. Pippard;Carla N. M. Polaz;Caroline M. Pollock;Rajeev Raghavan;Peter S. Rand;Tsilavina Ravelomanana;Roberto E. Reis;Cassandra L. Rigby;Janet A. Scott;Paul H. Skelton;Matthew R. Sloat;Jos Snoeks;Melanie L. J. Stiassny;Heok Hui Tan;Yoshinori Taniguchi;Eva B. Thorstad;Marcelo F. Tognelli;Armi G. Torres;Yan Torres;Denis Tweddle;Katsutoshi Watanabe;James R. S. Westrip;Emma G. E. Wright;E Zhang;William R. T. Darwall,One-quarter of freshwater fauna threatened with extinction,"A global multi-taxon extinction risk assessment of freshwater fauna for The IUCN Red List of Threatened Species finds one-quarter of species to be at high risk of extinction. 
 Freshwater ecosystems are highly biodiverse1 and important for livelihoods and economic development2, but are under substantial stress3. To date, comprehensive global assessments of extinction risk have not included any speciose groups primarily living in freshwaters. Consequently, data from predominantly terrestrial tetrapods4,5 are used to guide environmental policy6 and conservation prioritization7, whereas recent proposals for target setting in freshwaters use abiotic factors8–13. However, there is evidence14–17 that such data are insufficient to represent the needs of freshwater species and achieve biodiversity goals18,19. Here we present the results of a multi-taxon global freshwater fauna assessment for The IUCN Red List of Threatened Species covering 23,496 decapod crustaceans, fishes and odonates, finding that one-quarter are threatened with extinction. Prevalent threats include pollution, dams and water extraction, agriculture and invasive species, with overharvesting also driving extinctions. We also examined the degree of surrogacy of both threatened tetrapods and freshwater abiotic factors (water stress and nitrogen) for threatened freshwater species. Threatened tetrapods are good surrogates when prioritizing sites to maximize rarity-weighted richness, but poorer when prioritizing based on the most range-restricted species. However, they are much better surrogates than abiotic factors, which perform worse than random. Thus, although global priority regions identified for tetrapod conservation are broadly reflective of those for freshwater faunas, given differences in key threats and habitats, meeting the needs of tetrapods cannot be assumed sufficient to conserve freshwater species at local scales. A global multi-taxon extinction risk assessment of freshwater fauna for The IUCN Red List of Threatened Species finds one-quarter of species to be at high risk of extinction."
10.1038/s41586-024-08295-y,False,Nature,这篇论文研究的是纤锌矿异质结构中的近邻铁电性。它关注的是在不引入化学或结构无序的情况下，通过界面效应实现非铁电材料的极化反转。研究中使用了多种表征方法，包括极化滞后回线、各向异性化学刻蚀、二次谐波产生、压电响应力显微镜、机电测试和扫描透射电子显微镜原子分辨率极化取向成像等。此外，还进行了密度泛函理论计算以支持所提出的物理模型。总的来说，这项工作属于材料科学和凝聚态物理学领域，与大气环境遥感技术，例如空气质量监测、卫星观测和大气成分分析等，并没有直接关系。,[],Chloe H. Skidmore;R. Jackson Spurling;John Hayden;Steven M. Baksa;Drew Behrendt;Devin Goodling;Joshua L. Nordlander;Albert Suceava;Joseph Casamento;Betul Akkopru-Akgun;Sebastian Calderon;Ismaila Dabo;Venkatraman Gopalan;Kyle P. Kelley;Andrew M. Rappe;Susan Trolier-McKinstry;Elizabeth C. Dickey;Jon-Paul Maria,Proximity ferroelectricity in wurtzite heterostructures,"Proximity ferroelectricity is reported in wurtzite heterostructures, which enables polarization reversal in wurtzites without the chemical or structural disorder that accompanies elemental substitution. 
 Proximity ferroelectricity is an interface-associated phenomenon in electric-field-driven polarization reversal in a non-ferroelectric polar material induced by one or more adjacent ferroelectric materials. Here we report proximity ferroelectricity in wurtzite ferroelectric heterostructures. In the present case, the non-ferroelectric layers are AlN and ZnO, whereas the ferroelectric layers are Al1−xBxN, Al1−xScxN and Zn1−xMgxO. The layered structures include nitride–nitride, oxide–oxide and nitride–oxide stacks that feature two-layer (asymmetric) and three-layer (symmetric) configurations1–3. Ferroelectric switching in both layers is validated by multimodal characterization methods, including polarization hysteresis, anisotropic chemical etching, second harmonic generation, piezo response force microscopy, electromechanical testing and atomic resolution polarization orientation imaging in real space by scanning transmission electron microscopy. We present a physical switching model in which antipolar nuclei originate in the ferroelectric layer and propagate towards the internal non-ferroelectric interface. The domain wall leading edge produces elastic and electric fields that extend beyond the interface at close proximity, reducing the switching barrier in the non-ferroelectric layer, and allowing complete domain propagation without breakdown. Density functional theory calculations of polymorph energies, reversal barriers and domain wall energies support this model. Proximity ferroelectricity enables polarization reversal in wurtzites without the chemical or structural disorder that accompanies elemental substitution, opening new questions and opportunities regarding interface-based ferroelectricity. Proximity ferroelectricity is reported in wurtzite heterostructures, which enables polarization reversal in wurtzites without the chemical or structural disorder that accompanies elemental substitution."
10.1038/s41586-024-08373-1,False,Nature,这篇论文主要介绍了一种利用光能驱动，基于标准纳米加工技术制造的无线微电子器件。该器件可以将传统的96孔或384孔板转化为电化学反应器，从而实现高通量电合成。其应用领域集中在化学合成、药物研发等方面，与大气环境遥感技术（如空气质量监测、卫星观测和大气成分分析）并没有直接关系。论文中并没有提及任何与大气成分、卫星传感器或大气遥感应用相关的概念或技术。,[],Bartosz Górski;Jonas Rein;Samantha Norris;Yanxin Ji;Paul L. McEuen;Song Lin,Light-harvesting microelectronic devices for wireless electrosynthesis,"A method to produce wireless microelectronic devices powered by light using standard nanofabrication techniques is described to convert any traditional 96-well or 384-well plate into an electrochemical reactor that can drive reactions in high throughput. 
 High-throughput experimentation (HTE) has accelerated academic and industrial chemical research in reaction development and drug discovery and has been broadly applied in many domains of organic chemistry1,2. However, application of HTE in electrosynthesis—an enabling tool for chemical synthesis—has been limited by a dearth of suitable standardized reactors3–7. Here we report the development of microelectronic devices, which are produced using standard nanofabrication techniques, to enable wireless electrosynthesis on the microlitre scale. These robust and inexpensive devices are powered by visible light and convert any traditional 96-well or 384-well plate into an electrochemical reactor. We validate the devices in oxidative, reductive and paired electrolysis and further apply them to achieve the library synthesis of biologically active compounds and accelerate the development of two electrosynthetic methodologies. We anticipate that, by simplifying the way electrochemical reactions are set up, this user-friendly solution will not only enhance the experience and efficiency of current practitioners but also substantially reduce the barrier for nonspecialists to enter the field of electrosynthesis, thus allowing the broader community of synthetic chemists to explore and benefit from new reactivities and synthetic strategies enabled by electrochemistry8–12. A method to produce wireless microelectronic devices powered by light using standard nanofabrication techniques is described to convert any traditional 96-well or 384-well plate into an electrochemical reactor that can drive reactions in high throughput."
