doi,is_relevant,journal,explanation,topic_words,authors,title,abstract
10.1021/acs.est.5c00875,False,Environmental Science & Technology,该研究论文主要关注微塑料对土壤团聚体中溶解有机质转化的影响，以及微生物群在其中的作用。论文探讨了微塑料如何改变土壤团聚体的稳定性，以及对农业土壤管理和可持续发展的影响。论文内容与大气环境遥感技术，如空气质量监测、卫星观测和大气成分分析没有直接关系。,[],Xinran Qiu;Sirui Ma;Zhenyuan Liu;Jianrui Pan;Ling Ding;Bin Zhang;Xujun Liang;Peilei Wang;Tao Chen;Xuetao Guo,Microplastics Influence Dissolved Organic Matter Transformation Mediated by Microbiomes in Soil Aggregates,"Soil aggregate stability is vital for soil structure, erosion control, fertility, and crop productivity. Dissolved organic matter (DOM) turnover plays an important role in controlling the stability of soil aggregates, affecting aggregate formation and microbial activity. Microplastics (MPs) are known to impact soil DOM composition and structure, but their effects on DOM transformation in different soil aggregates remain unclear. Herein, we conducted 450 day incubation assays to study the effects of nondegradable and biodegradable MPs with varying aging levels on DOM transformations in agricultural soil aggregates. MPs were found to increase DOM transformation in soil aggregates, leading to changes in soil aggregate stability, including a reduction in geometric mean diameter and mass-weighted diameter. The addition of MPs resulted in a decrease in the stability of DOM in large-sized aggregates but an increase in the aromaticity and unsaturation of DOM in small-sized aggregates, which were more pronounced in the PLAMPs-treated group. This phenomenon is primarily attributed to the transformation of unsaturated aliphatic compounds and highly unsaturated and phenolic compounds, which play a major role in the intra- and intergroup transformation of DOM. In this process, microbial communities play a significant role. They tend to consume DOM in larger aggregates and produce DOM in smaller aggregates, leading to an accumulation of DOM in smaller aggregates, thereby promoting the formation of smaller aggregates and reducing the aggregate stability. This study uncovers the mechanisms of DOM transformation in response to MPs in soil aggregates, providing a scientific basis for soil management and sustainable agricultural development."
10.1021/acs.est.5c01034,False,Environmental Science & Technology,该研究主要关注水处理过程中溶解有机物（DOM）中含氮物质的特性，以及这些物质在氧化过程中形成含氮消毒副产物（N-DBPs）的潜力。研究重点在于使用氯化、臭氧化和稳定同位素分析等方法来识别和量化DOM中的各种活性胺类物质，如脂肪族伯胺、仲胺、芳基伯胺、氨基酸和肽氨基。虽然该研究涉及氮化合物，但其主要应用领域是水处理和饮用水安全，与大气环境遥感技术（如空气质量监测、卫星观测和大气成分分析）没有直接关联。,[],Jiwoon Ra;Kun Huang;Joachim Mohn;Thomas B. Hofstetter;Elisabeth Muck;Urs von Gunten,"Characterization of Organic Nitrogen by Chlorination, Ozonation, and Stable Isotope Analysis of Nitrate","During oxidation, nitrogenous species in dissolved organic matter (DOM) are critical in the formation of nitrogenous, potentially toxic disinfection byproducts, but their chemical identity remains poorly understood. Here, we developed three complementary approaches to identify and quantify reactive amines in model compounds and DOM, including aliphatic primary and secondary amines, aryl-type primary amines, amino acids, and terminal peptidic amino groups. With the chloramine formation assay, the total reactive amines were quantified for the main subgroups. An assay with continuous ozonation quantified three types of reactive amines based on nitrate formation rate constants (kNO3-): kNO3- < 0.1 M–1 s–1 for secondary and aliphatic primary amines; kNO3- = 0.9–1.9 M–1 s–1 for aryl-type primary amines; kNO3- = 15–110 M–1 s–1 for amino acids and peptidic amino groups. The analysis of 15N/14N ratios of nitrate helped to distinguish reactive amines based on 15N enrichment factors (εN): aliphatic (or aryl-type) primary amines (εN:-9 to -3‰), and amino acids and peptidic amino groups (εN:-28 to -19‰). Overall, 23–27% of the organic nitrogen in DOM isolates comprises oxidant-reactive amines, with 5–6% secondary amines, 10–14% aliphatic primary amines, 4% aryl-type primary amines, 1–4% amino acids, and 0–2% peptidic amino groups. Based on the quantitative characterization of amine moieties in DOM, which are possible precursors of N-DBPs, the formation potential of N-DBPs upon oxidative water treatment was estimated."
10.1021/acs.est.5c01120,True,Environmental Science & Technology,该研究论文主要关注利用地球静止卫星（Himawari-8/9）遥感反演亚洲-大洋洲地区碳质气溶胶（包括黑碳和有机碳）的时空分布特征。研究利用一种新的临界反射率算法，分析了该区域碳质气溶胶的变化，并探讨了极端事件（如COVID-19封锁和生物质燃烧）对气溶胶的影响。研究结果有助于理解碳质气溶胶对气候的影响，并为制定空气污染和碳减排政策提供支持。因此，该论文与大气环境遥感技术，特别是空气质量监测、卫星观测和大气成分分析密切相关。,"['carbonaceous aerosols', 'black carbon (BC)', 'organic carbon (OC)', 'geostationary satellite', 'Himawari-8/9', 'remote sensing', 'air quality monitoring', 'biomass burning', 'wildfires', 'climate forcing']",Fangwen Bao;Ying Li;Jinhui Gao,Advancing Carbonaceous Aerosol Remote Sensing across Asia-Oceania: Insights from Geostationary Satellite Retrievals,"Carbonaceous aerosols, comprising mainly black carbon (BC) and organic carbon (OC), have a substantial impact on radiation balance, the climate, and human health. Despite extensive scientific attention, the challenges associated with current approaches for measuring carbonaceous aerosols, especially low spatial and temporal resolutions, limit the understanding of their sources and dynamics. This study presents a comprehensive analysis of carbonaceous aerosols over the Asia–Oceania region using a novel critical reflectance algorithm for geostationary satellite (Himawari-8/9) retrievals. The findings reveal reasonable spatial and temporal variations in BC and OC, with notable differences between the Northern and Southern Hemispheres. Moreover, we highlight the potential for satellite retrievals to distinguish primary OC sources and secondary OC formation. The impacts of extreme events were evident, such as the COVID-19 lockdown and extreme biomass burning or wildfires, demonstrating the capability of monitoring air quality changes in response to emission variations. The findings of the study contribute to our understanding of short-term climate forcing of carbonaceous aerosols and can support the development of effective policies to reduce air pollution and carbon emissions, thereby achieving carbon neutrality goals."
10.1021/acs.est.5c02027,False,Environmental Science & Technology,该研究论文主要关注人畜共患病原体对婴幼儿肠道感染的影响，通过纵向采样测量儿童粪便、动物粪便和家庭环境中的多种肠道病原体，旨在调查肯尼亚北部农村地区动物和儿童之间的病原体传播途径。研究结果表明，家养动物和儿童手部卫生与婴幼儿肠道病原体暴露密切相关。该研究与大气环境遥感技术，如空气质量监测、卫星观测和大气成分分析，没有直接关联。,[],Abigail P. Paulos;John Mboya;Jeremy Lowe;Daehyun Daniel Kim;Hannah C. Wharton;Faith Thuita;Valerie L. Flax;Sammy M. Njenga;Angela R. Harris;Amy J. Pickering,Zoonotic and Environmental Sources of Infant Enteric Pathogen Infections Identified with Longitudinal Sampling,"Many enteric pathogens that infect young children can be zoonotic, yet the exposure risk of domestic animals living in close proximity to young children is poorly understood. Here, we longitudinally measured 33 enteric pathogens in child stool, animal feces, and the household environment (n = 28,743 pathogen-sample observations) to investigate pathogen transmission between animals and children under two in pastoralist communities in rural Northern Kenya. Children were typically infected with 1 enteric pathogen by 3 months of age, and pathogen burden increased with age; 85% of enteric pathogens detected in child stool were also detected in animal feces. New infections in children were associated with preceding household detection of the same pathogen in soil (Odds ratio: 8.8, 95% confidence interval: 3.3–23) and on child hands (odds ratio: 5.0, 95% confidence interval 1.1–17). Regression modeling revealed transmission of pathogens from poultry, dog, and ruminant feces to household soil, and between child hands and child stool. Our results provide new evidence that domestic animals in the household environment contribute to early life enteric pathogen exposure, and that child hand hygiene could substantially prevent animal-child transmission."
10.1021/acs.est.5c02470,True,Environmental Science & Technology,该研究论文介绍了一种名为SoC-POM的新型卫星载人工智能算法，用于实时监测大气中的颗粒物（PM2.5、PM10）和臭氧（O3）浓度。该系统旨在突破现有卫星数据处理的延迟限制，实现对空气污染的快速预警。通过对Himawari-8和Himawari-9卫星数据的测试，结果表明该系统能够以较高的精度和较低的延迟（平均5.5分钟）检测到异常的颗粒物和臭氧浓度，从而为公共卫生和环境监测提供更及时有效的信息。,"['air quality monitoring', 'satellite observations', 'atmospheric composition analysis', 'particulate matter (PM2.5, PM10)', 'ozone (O3)', 'real-time monitoring', 'on-orbit processing', 'Himawari-8', 'Himawari-9', 'air pollution alerts', 'health exposure analysis']",Jiayi Chen;Hang Lv;Qiao Wang;Guoqiang Wang;Kun Jia;Chuanfeng Zhao;Wenzhong Shi;Xing Yan,Revolutionizing Satellite Real-Time Air Pollution Alerts through New On-Orbit System-on-Chip Technology,"Exposure to abnormally high concentrations of particulate matter and ozone can cause severe harm to human health, highlighting the need for real-time satellite monitoring to enable rapid responses and timely warnings. However, the existing methods for on-orbit diagnostics under resource constraints are limited. This study presents SoC-POM (System-on-Chip for Particulate Matter and Ozone Monitoring), a real-time, on-orbit artificial intelligence algorithm embedded in satellites and designed to detect anomalous concentrations of PM2.5, PM10, and O3. Based on tests with the Himawari-8 and Himawari-9 satellites, we demonstrate that SoC-POM achieves an average latency of 5.5 min, breaking through the hourly processing barrier while maintaining high accuracy, with correlation coefficients of 0.78, 0.76, and 0.81 for PM2.5, PM10, and O3, respectively. This novel approach enables real-time monitoring of abnormal particulate matter and ozone levels and demonstrates the potential for the timely analysis of health exposure and its dynamic changes, marking a sustainable advancement in air pollution alerts and public health."
10.1021/acs.est.5c05770,False,Environmental Science & Technology,该研究论文主要关注一种新的水硬度检测方法，通过分析含碳酸氢钠和氯化钠的硬水干燥后的沉积物图案照片来量化水硬度。该方法利用高分辨率成像、自动样品制备和图像分析技术，包括机器学习，以检测沉积物图案中的细微形态变化。虽然该研究具有创新性，并可能在水质监测领域有应用，但它与大气环境遥感技术，如空气质量监测、卫星观测或大气成分分析，没有直接关联。,[],Amrutha S V;Bruno C. Batista;Beni B. Dangi;Oliver Steinbock,Water Hardness from Photos of Dried Drop Stains: Reporter Salts Enable Low-Concentration Detection,"Water hardness is critical in domestic and industrial systems, typically measured by titration, atomic absorption spectroscopy, or inductively coupled plasma mass spectrometry. Here, we present a novel, photo-based method for quantifying water hardness using deposit patterns formed during the evaporation of hard water mixed with highly concentrated solutions of the reporter salts NaHCO3 and NaCl. This indirect approach enables the detection of hardness levels as low as 25 ppm, an improvement by a factor of 1,400 over earlier stain-based studies. Our method leverages high-resolution imaging, automated sample preparation, and advanced image analysis, including machine learning, to detect subtle morphological changes in the deposit patterns. A robotic drop imager (RODI) generated over 16,000 images, from which 47 geometric and textural metrics were extracted to train high-dimensional linear regression models and multilayer perceptron (MLP) networks. Using synthetic water samples with hardness levels of up to 250 ppm, we achieved prediction accuracies exceeding 91% for sodium bicarbonate-based patterns. Extending this methodology, we validated the methodology on real-world tap water, demonstrating its potential as a cost-effective alternative to traditional techniques and a versatile tool for water quality monitoring."
10.1021/acs.estlett.5c00372,False,Environmental Science & Technology Letters,该论文主要关注Criegee中间体（CIs）在大气化学中的反应动力学。虽然CIs与气溶胶形成和大气氧化能力有关，但这项研究侧重于开发一种测量CIs反应速率的技术，而不是直接使用遥感技术监测空气质量或分析大气成分。因此，它与大气环境遥感技术的关联性较弱，更偏向于实验室研究。,"['Criegee intermediates', 'atmospheric chemistry', 'aerosol formation', 'oxidation', 'kinetics']",Pengcheng Wang;Yue Wang;Jinhe Wang;Abdelwahid Mellouki;Véronique Daële;Yangang Ren;Max R. McGillen,Development of a Relative Rate Technique to Measure Criegee Intermediate Reactivity,"Criegee intermediates (CIs) play a major role in atmospheric chemistry, contributing to aerosol formation and oxidizing capacity. To assess this contribution, the kinetics of bimolecular reactions of CIs must first be established. However, few techniques are available for this purpose, limiting our understanding of CIs in the atmosphere. Accordingly, we develop a precise, economical, and highly accessible strategy for acquiring kinetic data using a relative rate approach. This method exploits highly symmetrical alkenes that produce a single type of CI through ozonolysis. By suppressing other reactive species (e.g., OH radical) formed in these systems, we probe the reactivity of CIs toward a selection of acids and alcohols, where decays of reactants were tracked using proton-transfer reaction mass spectrometry. In this proof-of-principle paper, we find that this approach can be applied to a broad variety of compounds, allowing us to access reactions with lower volatility species, extending and augmenting the CI kinetic database toward a class of reaction that may be significant for aerosol formation."
10.1021/acs.estlett.5c00307,True,Environmental Science & Technology Letters,该研究论文主要关注燃煤电厂排放的PM2.5中硫酸盐的形成机制和影响因素，并建立了贝叶斯线性回归模型进行预测。虽然该研究没有直接涉及遥感技术，但它关注大气污染物（硫酸盐）的来源、控制和预测，这些信息对于利用遥感技术进行空气质量监测和大气成分分析至关重要。例如，卫星观测可以用来验证模型预测的硫酸盐浓度，或者评估不同控制措施的效果。因此，该研究与大气环境遥感技术间接相关。,"['PM2.5', 'sulfate', 'air pollution control devices', 'emission control', 'air quality monitoring']",Xuehan Wang;Ruiqing Huo;Wenli Sun;Xiaohui Bi;Jianhui Wu;Yufen Zhang;Yinchang Feng,Dominant Factor Identification and Predictive Modeling of PM2.5-Bound Sulfate from Chinese Coal-Fired Power Plants,"PM2.5-bound sulfate (p-SO42–) from coal-fired power plants (CFPPs) is a crucial component of atmospheric particulate matter, and its formation is comprehensively influenced by coal composition characteristics and air pollution control devices (APCDs). Based on a data set containing 109 measured mass fractions of p-SO42– (p-SO42– fraction) from CFPPs in China, this study develops a Bayesian linear regression model to identify the dominant factors of p-SO42– formation and to quantify the effects. The results indicate that coal’s sulfur content and usage of certain APCDs promote the formation of p-SO42–, including selective catalytic reduction (SCR), wet flue gas desulfurization (WFGD), and semidry desulfurization (SDD), whereas the wet electrostatic precipitator (WESP) and desulfurization efficiency inhibit it. Benchmarking against machine learning approaches demonstrates the performance of the Bayesian model (R2 = 0.72, and RLOO2 = 0.45), which outperformed random forest and XGBoost algorithms in generalization ability, showing its advantages in addressing small data sets. The model predicts an average p-SO42– fraction of 0.144 ± 0.037 g/g across 69 CFPPs in the Beijing–Tianjin–Hebei (BTH) region. This study systematically evaluated the roles of multiple influencing factors on p-SO42– formation and predicted the p-SO42– fractions derived from CFPPs in the BTH region, providing a quantitative decision-making basis for precise sulfate emission control in CFPPs and regional environmental planning."
10.1021/acs.estlett.5c00501,True,Environmental Science & Technology Letters,该研究论文主要探讨了利用中国风云三号E星(FY-3E)搭载的第二代高光谱红外大气探测仪(HIRAS-II)对大气中微量活性气体进行探测的技术。论文重点介绍了如何使用先进的光谱特征量化和识别方法，从FY-3E/HIRAS-II的观测数据中成功检测到14种微量气体。研究绘制了9种常见活性气体的全球分布图，并发现这些气体主要来源于人口密集区、植被区和生物质燃烧区等特殊区域。此外，论文还初步验证了FY-3E/HIRAS-II在反演火灾区域氨气柱浓度方面的能力，表明该卫星能够通过补充早晚时段的观测数据，增进我们对痕量气体日变化的理解。总而言之，这项研究证实了FY-3E/HIRAS-II在微量气体探测方面的潜力，并为后续的浓度反演研究奠定了基础。,"['reactive trace gases', 'FY-3E/HIRAS-II', 'thermal infrared spectral feature quantification', 'global distribution mapping', 'air quality monitoring', 'satellite observations', 'atmospheric composition analysis', 'diurnal variation']",Zhenxing Liang;Dasa Gu;Rui Li;Jian Liu;Chengxing Zhai;Hui Su;Alexis K. H. Lau,Advancing Atmospheric Detection of Weakly Absorbing Reactive Trace Gases Using the FY-3E/HIRAS-II TIR Sounder on a Dawn–Dusk Orbit,"Weakly absorbing reactive trace gases play important roles in the atmospheric environment and usually have short lifetimes ranging from seconds to days. HIRAS-II, the second hyperspectral infrared atmospheric sounder aboard the world’s first civilian meteorological satellite in dawn–dusk orbit, FengYun-3E (FY-3E), can theoretically detect more than a dozen weakly absorbing reactive trace gases and make important contributions to global trace gas mapping by filling the gap for diurnal variation. This study uses state-of-the-art weak absorber thermal infrared spectral feature quantification and identification methods to detect weak absorbers from FY-3E/HIRAS-II and successfully capture 14 species from 35.4 million FY-3E/HIRAS-II clear-sky measurements in July 2023. We map the reliable global distribution of spectral features from nine routine reactive gases and find that these gases originate from scenes that are usually of special concern, including densely populated areas, vegetation, and biomass burning. This study confirms the capability of FY-3E/HIRAS-II in detecting weak absorbers and serves as a stepping stone for subsequent research in concentration retrieval. The case of the ammonia column over wildfires retrieved using neural network technology initially demonstrates that FY-3E/HIRAS-II can improve our understanding of the diurnal variation of trace gases by complementing measurements at dawn and dusk."
10.1021/acsestair.5c00021,True,ACS ES&T Air,该论文提出了一种基于YOLO深度学习算法的新方法，用于自动检测大气中新粒子形成（NPF）事件。虽然该研究没有直接使用卫星观测或遥感技术，但它使用地面观测的粒子数量尺寸分布数据，并开发了一种可以有效识别NPF事件的工具。NPF事件与空气质量、气候和人类健康密切相关，因此该研究对大气环境监测具有重要意义。该方法可以提高NPF事件识别的效率和准确性，从而更好地理解和预测大气气溶胶的变化，最终服务于空气质量的改善。,"['air quality monitoring', 'particle number size distribution', 'atmospheric composition (aerosols)', 'ground-based remote sensing (particle counters)']",Rajat Bhandari;Chandan Sarangi;Mathew Sebastian;Rakesh K. Hooda;Antti-Pekka Hyvärinen;Eija Asmi;Ville Vakkari;Govindan Pandithurai;Sachchidanand Singh;Vijay K. Soni;Tuomo Nieminen;Pieter G. van Zyl;Kerneels Jaars;Lauri K. Laakso;David C. S. Beddows;Roy M. Harrison;Johan Paul Beukes;Nikos Kalivitis;Nikolaos Mihalopoulos;Imre Salma;Máté Vörösmarty;Li-Hao Young;Zachary Watson;Shan-Hu Lee;Michael Pikridas;Jean Sciare;Tuija Jokinen;Vijay P. Kanawade,Identification of New Particle Formation Events Using a You Only Look Once (YOLO) Deep Learning Algorithm,"Atmospheric new particle formation (NPF) events, which involve the formation and growth of molecular clusters, affect air quality, weather, climate, and human health. Traditional NPF event classification schemes in the literature, primarily through visual inspection of particle number size distributions, are subjective, time-consuming, and laborious. Here, we introduced a fast object detection deep learning algorithm, You Only Look Once (YOLO), for the first time to detect NPF events. We used more than one year of asynchronous particle number size distribution data from 20 diverse geographical locations globally. The YOLO algorithm was first trained and validated using a small subset of manually annotated 252 NPF events and 195 non-events (approximately 25 images from each measurement site). The trained YOLO algorithm was then evaluated to detect NPF events against the remaining 6462 observation days across all measurement sites. The performance metrics of the trained YOLO algorithm revealed high precision and accuracy in detecting NPF events. The model accuracy for each measurement site was calculated by taking the ratio of the total number of NPF events detected by the trained YOLO algorithm at a confidence score (CoS) > 0.1 to the total number of visually identified NPF events. Considering all measurement sites, the trained YOLO algorithm’s accuracy (in fraction) for detecting NPF events ranged from 0.74 to 0.97 at a CoS > 0.1, although the accuracy decreased with increasing threshold CoS. This work underscores the efficacy and robustness of the YOLO algorithm and demonstrates its applicability in accurately detecting NPF events in diverse environmental conditions worldwide."
