doi,is_relevant,journal,explanation,topic_words,authors,title,abstract
10.5194/amt-2024-196,True,Atmospheric Measurement Techniques Discussions,这篇论文介绍了GOME型臭氧剖面气候要素基本变量（GOP-ECV）数据集，该数据集涵盖了1995年7月至2021年10月26年的全球臭氧剖面数据。数据来自GOME/ERS-2、SCIAMACHY/ENVISAT、OMI/Aura、GOME-2/MetOp-A和GOME-2/MetOp-B五种卫星传感器。文章详细描述了数据处理过程，包括传感器间偏差的消除、数据融合以及利用GOME型总臭氧气候要素基本变量（GTO-ECV）数据进行长期稳定性改进。最终生成的GOP-ECV数据集具有5°x5°的空间分辨率，包含从地表到80公里高度19个大气层的部分柱状臭氧数据。该研究与大气环境遥感技术密切相关，因为它利用卫星观测数据分析大气成分（臭氧）的时空分布，为大气环境监测和气候变化研究提供重要数据支持。,"['ozone profile', 'atmospheric composition', 'satellite remote sensing', 'air quality monitoring', 'GOME', 'SCIAMACHY', 'OMI', 'GOME-2', 'ERS-2', 'ENVISAT', 'Aura', 'MetOp-A', 'MetOp-B', 'Essential Climate Variable (ECV)', 'data record', 'climate change']",Melanie Coldewey-Egbers;Diego G. Loyola;Barry Latter;Richard Siddans;Brian Kerridge;Daan Hubert;Michel van Roozendael;Michael Eisinger,The novel GOME-type Ozone Profile Essential Climate Variable (GOP-ECV) data record covering the past 26 years,"The GOME-type Ozone Profile Essential Climate Variable (GOP-ECV) data record provides monthly mean ozone profiles with global coverage from 1995 to 2021 at a spatial resolution of 5°x5°. Measurements from five nadir-viewing satellite sensors are first harmonized and then merged into a coherent record. The long-term stability of the data record is further improved through scaling of the profiles using as a reference the GOME-type Total Ozone Essential Climate Variable (GTO-ECV) data record. 
 We present the GOME-type Ozone Profile Essential Climate Variable (GOP-ECV) data record covering the 26-year period from July 1995 until October 2021. It is derived from a series of five nadir-viewing ultraviolet-visible(-near-infrared) satellite instruments of the GOME-type, including GOME/ERS-2, SCIAMACHY/ENVISAT, OMI/Aura, GOME-2/MetOp-A, and GOME-2/MetOp-B, which are merged into a single coherent long-term time series. It provides monthly mean ozone profiles at a spatial resolution of 5° x 5° latitude by longitude. The profiles are given as partial columns for 19 atmospheric layers ranging from the surface up to 80 km. The underlying profile retrieval algorithm is the Rutherford Appleton Laboratory scheme, which has sensitivity to both tropospheric and stratospheric amounts of ozone. The merged profile record has been developed by the German Aerospace Center (DLR) in the framework of the European Space Agency's Climate Change Initiative+ (ESA-CCI+) ozone project (Ozone_CCI+). Profiles from the individual instruments are first harmonized through careful inspection and elimination of inter-sensor deviations and drifts and then merged into a combined record. In a further step, the merged time series is harmonized with the GOME-type Total Ozone Essential Climate Variable (GTO-ECV) data record, which is based on nearly the same satellite sensors. GTO-ECV possesses an excellent long-term stability and with the homogenization an improvement of the robustness and stability of the merged profiles can be achieved. For this purpose, an altitude-dependent scaling is applied that utilizes ozone profile Jacobians obtained from a Machine Learning approach. We found that climatological ozone distributions derived from the final GOP-ECV data record agree with spatial and temporal patterns obtained from other long-term data records."
10.5194/amt-18-619-2025,False,Atmospheric Measurement Techniques,这篇论文主要关注的是极化相控阵雷达在天气测量中的定量误差分析。它比较了平面和圆柱型两种极化相控阵雷达在测量对流性降雨时的性能，并与传统的WSR-88D雷达数据进行了对比，重点分析了不同雷达配置下极化参数的偏差和标准差。研究结果表明，平面相控阵雷达在较大扫描角度下测量精度下降，而圆柱型相控阵雷达具有更好的数据质量。该研究属于气象雷达技术范畴，与大气环境遥感技术如空气质量监测、卫星观测和大气成分分析关系不大。,"['weather radar', 'polarimetric radar', 'precipitation measurement', 'convective rain']",Junho Ho;Zhe Li;Guifu Zhang,Quantitative error analysis of polarimetric phased-array radar weather measurements to reveal radar performance and configuration potential,"This study quantitatively analyzes and compares weather measurements from planar (PPPAR) and cylindrical polarimetric phased-array radars (CPPARs). It examines data quality and potential problems and clarifies misunderstandings between configurations. The findings highlight 2D PPPARs' challenges in making accurate weather measurements when the beam steers off broadside. The CPPAR shows promise in obtaining high-quality polarimetric data due to its azimuthal scan-invariant beam characteristics. 
 The initial weather measurements from two polarimetric phased-array radars (PPARs) with cylindrical and planar configurations, both developed by the Advanced Radar Research Center (ARRC) at the University of Oklahoma (OU), were compared with those from the dish antenna systems, the operational KTLX Weather Surveillance Radar 1988 Doppler (WSR-88D) located in Oklahoma City, Oklahoma (∼ 23 km northeast of OU). Both the cylindrical PPAR (CPPAR) and the planar PPAR (PPPAR) Horus are S-band two-dimensional (2D) electronic scan PPARs. This comparison investigates the error statistics of the polarimetric measurements in one-dimensional (1D) electronic scans from each radar during two convective rain events. The first event occurred on 30 August 2019, when the CPPAR performed a 3.3° elevation plan-position indicator (PPI) scan at 25 azimuth angles. The second event took place on 4 October 2023, when Horus conducted range–height indicator (RHI) scans at 64 elevations. For both events, KTLX provided volumetric polarimetric radar data and served as the reference. To ensure temporal and spatial alignment between the radars, reconstructed RHI scans and PPI sectors from KTLX were matched to the corresponding Horus rays and CPPAR domain, respectively. The standard deviations and mean biases of the PPAR weather measurements were calculated and analyzed. The standard deviations of the two PPARs were similar and met the Radar Functional Requirements (RFR) set by the National Oceanic and Atmospheric Administration National Weather Service. However, as noted in previous studies, the standard deviation and biases of polarimetric variables from Horus exhibited varying error characteristics depending on the electronic steering angle from broadside. The present results suggest that PPPARs may have difficulties in producing high-quality polarimetric data at large steering angles, and further investigation on CPPARs is required to find the optimal design for future weather applications."
10.5194/essd-17-393-2025,False,Earth System Science Data,这篇论文关注的是海洋中固氮微生物的全球生物地理分布。研究人员开发了一种生物信息学工作流程，用于标准化处理nifH扩增子数据集，并构建了一个包含来自全球海洋的9383个ASVs的nifH ASV数据库。该数据库结合了Simons Collaborative Marine Atlas Project (CMAP)的物理和化学元数据，有助于揭示主要固氮菌群的全球生物地理模式及其与海表温度的关系。研究与大气环境遥感技术，例如空气质量监测、卫星观测和大气成分分析等，没有直接关系。,[],Michael Morando;Jonathan D. Magasin;Shunyan Cheung;Matthew M. Mills;Jonathan P. Zehr;Kendra A. Turk-Kubo,Global biogeography of N2-fixing microbes: nifH amplicon database and analytics workflow,"Nitrogen is crucial in ocean food webs, but only some microbes can fix N2 gas into a bioavailable form. Most are known only by their nifH gene sequence. We created a software workflow for nifH data and ran it on 944 ocean samples, producing a database (DB) that captures the global diversity of N2-fixing marine microbes and the environmental factors that influence them. The workflow and DB can standardize analyses of past and future nifH datasets to enable insights into marine communities. 
 Marine dinitrogen (N2) fixation is a globally significant biogeochemical process carried out by a specialized group of prokaryotes (diazotrophs), yet our understanding of their ecology is constantly evolving. Although marine N2 fixation is often ascribed to cyanobacterial diazotrophs, indirect evidence suggests that non-cyanobacterial diazotrophs (NCDs) might also be important. One widely used approach for understanding diazotroph diversity and biogeography is polymerase chain reaction (PCR) amplification of a portion of the nifH gene, which encodes a structural component of the N2-fixing enzyme complex, nitrogenase. An array of bioinformatic tools exists to process nifH amplicon data; however, the lack of standardized practices has hindered cross-study comparisons. This has led to a missed opportunity to more thoroughly assess diazotroph diversity and biogeography, as well as their potential contributions to the marine N cycle. To address these knowledge gaps, a bioinformatic workflow was designed that standardizes the processing of nifH amplicon datasets originating from high-throughput sequencing (HTS). Multiple datasets are efficiently and consistently processed with a specialized DADA2 pipeline to identify amplicon sequence variants (ASVs). A series of customizable post-pipeline stages then detect and discard spurious nifH sequences and annotate the subsequent quality-filtered nifH ASVs using multiple reference databases and classification approaches. This newly developed workflow was used to reprocess nearly all publicly available nifH amplicon HTS datasets from marine studies and to generate a comprehensive nifH ASV database containing 9383 ASVs aggregated from 21 studies that represent the diazotrophic populations in the global ocean. For each sample, the database includes physical and chemical metadata obtained from the Simons Collaborative Marine Atlas Project (CMAP). Here we demonstrate the utility of this database for revealing global biogeographical patterns of prominent diazotroph groups and highlight the influence of sea surface temperature. The workflow and nifH ASV database provide a robust framework for studying marine N2 fixation and diazotrophic diversity captured by nifH amplicon HTS. Future datasets that target understudied ocean regions can be added easily, and users can tune parameters and studies included for their specific focus. The workflow and database are available, respectively, on GitHub (https://github.com/jdmagasin/nifH-ASV-workflow, last access: 21 January 2025; Morando et al., 2024c) and Figshare (https://doi.org/10.6084/m9.figshare.23795943.v2; Morando et al., 2024b)."
10.5194/essd-2024-543,True,Earth System Science Data Discussions,这篇论文研究了芬兰亚北极地区大气中荧光气溶胶颗粒物的浓度和粒径分布。研究使用了广谱集成生物气溶胶传感器（WIBS）进行近实时监测，该传感器可以测量0.5到30微米粒径范围内的颗粒物，并区分不同荧光特性的颗粒物。研究发现，大多数荧光气溶胶颗粒物（FAPs）的浓度呈现明显的季节性变化，并在周围地面被雪覆盖后急剧下降。研究结果可以帮助我们更好地理解生物圈-云相互作用以及生物气溶胶在大气中的动态变化，对改进大气过敏原预报和了解生物气溶胶对云形成的影响具有重要意义。虽然研究使用了地面传感器进行原位测量，但其研究结果与大气环境遥感技术密切相关，因为对生物气溶胶的监测有助于改进大气成分分析和空气质量监测。,"['Atmospheric composition', 'Bioaerosols', 'Aerosol particles', 'Fluorescence', 'Air quality monitoring', 'In-situ measurement', 'WIBS sensor']",Jürgen Gratzl;David Brus;Konstantinos Doulgeris;Alexander Böhmländer;Ottmar Möhler;Hinrich Grothe,Fluorescent aerosol particles in the Finnish sub-Arctic during the Pallas Cloud Experiment 2022 campaign,"Near-real time monitoring of airborne biological particles like fungal spores or pollen grains is of great interest for two main reasons: To improve atmospheric allergen forecasts and deepen the understanding of how bioaerosols influence cloud formation. Here, we measured fluorescent bioaerosols in the Finnish sub-Arctic with high time resolution. A data set that might improve our understanding of biosphere-cloud interactions and the dynamics of bioaerosols in the atmosphere. 
 Fluorescent aerosol particles (FAPs) as a fraction of total aerosol particles (TAPs) were measured online with a Wideband Integrated Bioaerosol Sensor 5/NEO (WIBS, Droplet Measurement Technologies) from mid-September to mid-December during the Pallas Cloud Experiment 2022 (PaCE22) at the Sammaltunturi station, located in the sub-Arctic region of Finnish Lapland. The WIBS measures particle size distributions from 0.5 to 30 µm and fluorescence in three channels of single aerosol particles, as well as particle concentrations. Since most biological aerosol particles exhibit intrinsic fluorescence, FAP concentration can be used as a proxy for primary biological aerosol particles (PBAPs) like bacteria, fungal spores and pollen. The concentrations and size distributions of different fluorescent particles, together with meteorological data and air mass trajectories allow valuable insights to the emission of PBAPs from northern boreal forests and their dynamic in the atmosphere. We found a clear seasonal trend for most FAP types and a strong, sudden decrease in concentration after the surrounding ground is covered in snow. Caution should be taken in interpreting the data, as interference may be introduced by non-biological fluorescent particles like secondary organic aerosols or soot, as well as biological secondary organic aerosol. The data is available at the open data repository Zenodo under the doi 10.5281/zenodo.13885888 (Gratzl and Grothe, 2024)."
10.5194/essd-2024-588,False,Earth System Science Data Discussions,这篇论文研究的是中国1985年至2020年土壤有机碳密度（SOCD）的数据集构建。它利用Landsat卫星影像、地形数据、气象数据以及实测SOCD数据，结合气候分区，采用随机森林算法，构建了高精度、高空间分辨率的SOCD产品。该研究并非直接针对大气环境遥感技术，例如空气质量监测、卫星观测和大气成分分析，而是关注地表土壤有机碳的变化，这与大气环境间接相关，因为土壤碳储量是全球碳循环的重要组成部分，影响着气候变化。因此，虽然使用了遥感数据，但研究的核心并非大气成分分析，而是土壤属性的时空变化。,"['soil organic carbon density', 'remote sensing', 'carbon cycle', 'climate change', 'land surface']",Yi Dong;Xinting Wang;Wei Su,A 1 km soil organic carbon density dataset with depth of 20cm and 100cm from 1985 to 2020 in China,"In this study, we developed the first long-term soil organic carbon density (SOCD) product for China, spanning from 1985 to 2020. The generated product exhibits good consistency with existing datasets and provides finer spatial detail compared to global SOC products. This SOCD dataset offers valuable insights into the long-term status of soil health in China and enhances our understanding of the response of soil organic carbon to global warming and human activities. 
 Soil organic carbon (SOC) is an important component of the worldwide carbon cycle as a vital indicator of soil quality and ecosystem health, with significant implications for agricultural production and climate change adaptation and mitigation strategies. Although there are some studies on mapping the spatial distribution of soil organic carbon density (SOCD), the long-time series SOCD products in China are still lacking. Therefore, this study proposed a new algorithm with climatic zoning, aiming to improve the accuracy of predicting SOC densities with depths of 0–20 cm and 0–100 cm from 1985 to 2020. The data sources used in this study include Landsat archives, topographic data, meteorological data, and measured SOCD data. The innovation lies in the zoning models by climate regions using a random forest ensemble learning approach for SOCD estimation in China. The predicted results show that our zoning model outperformed the global model without climate zoning in predicting SOCD with R2=0.55 and RMSE=2.19 for 0–20 cm SOCD estimation and R2=0.52 and RMSE=6.50 for 0–100 cm. Comparably, the SOCD estimation using the global model is with R2=0.46 and RMSE=2.36 for 0–20 cm SOCD estimation and R2=0.44 and RMSE=8.09 for 0–100 cm. Moreover, our 0–20 cm SOCD predictions align well with independent samples (R²=0.69, RMSE=2.01) and are further validated with Xu's dataset (R²=0.63, RMSE=1.82). Furthermore, the comparisons with the published SOC content products including HWSD, SoilGrids250m, and GSOCmap have also shown good consistency, too. Comparably, our predicted SOCD is the best fit with SoilGrids250m products with R2=0.72 and RMSE=1.35. Comparisons of model predictions to independent datasets from the 1980s, 2000s, and 2010s in China reveal substantial connections and a trend of increasing forecast accuracy over time. The predicted SOCD is available via the Figshare (https://doi.org/10.6084/m9.figshare.27290310.v1) (Dong et al., 2024)."
10.5194/gmd-18-605-2025,False,Geoscientific Model Development,这篇论文主要关注的是利用深度学习模型HIDRA3进行海平面和风暴潮预报。它利用多个验潮站的数据，即使在传感器出现故障或历史数据有限的情况下也能提高预测精度。该模型在预测准确性和数据利用效率方面均优于现有模型，对沿海洪水预报具有重要意义。研究中并没有涉及大气环境遥感技术，例如空气质量监测、卫星观测和大气成分分析等。因此，它与大气环境遥感技术关系不大。,[],Marko Rus;Hrvoje Mihanović;Matjaž Ličer;Matej Kristan,HIDRA3: a deep-learning model for multipoint ensemble sea level forecasting in the presence of tide gauge sensor failures,"HIDRA3 is a deep-learning model for predicting sea levels and storm surges, offering significant improvements over previous models and numerical simulations. It utilizes data from multiple tide gauges, enhancing predictions even with limited historical data and during sensor outages. With its advanced architecture, HIDRA3 outperforms current state-of-the-art models by achieving a mean absolute error of up to 15 % lower, proving effective for coastal flood forecasting under diverse conditions. 
 Accurate modeling of sea level and storm surge dynamics with several days of temporal horizons is essential for effective coastal flood responses and the protection of coastal communities and economies. The classical approach to this challenge involves computationally intensive ocean models that typically calculate sea levels relative to the geoid, which must then be correlated with local tide gauge observations of sea surface height (SSH). A recently proposed deep-learning model, HIDRA2 (HIgh-performance Deep tidal Residual estimation method using Atmospheric data, version 2), avoids numerical simulations while delivering competitive forecasts. Its forecast accuracy depends on the availability of a sufficiently long history of recorded SSH observations used in training. This makes HIDRA2 less reliable for locations with less abundant SSH training data. Furthermore, since the inference requires immediate past SSH measurements as input, forecasts cannot be made during temporary tide gauge failures. We address the aforementioned issues using a new architecture, HIDRA3, that considers observations from multiple locations, shares the geophysical encoder across the locations, and constructs a joint latent state that is decoded into forecasts at individual locations. The new architecture brings several benefits: (i) it improves training at locations with scarce historical SSH data, (ii) it enables predictions even at locations with sensor failures, and (iii) it reliably estimates prediction uncertainties. HIDRA3 is evaluated by jointly training on 11 tide gauge locations along the Adriatic. Results show that HIDRA3 outperforms HIDRA2 and the Mediterranean basin Nucleus for European Modelling of the Ocean (NEMO) setup of the Copernicus Marine Environment Monitoring Service (CMEMS) by ∼ 15 % and ∼ 13 % mean absolute error (MAE) reductions at high SSH values, creating a solid new state of the art. The forecasting skill does not deteriorate even in the case of simultaneous failure of multiple sensors in the basin or when predicting solely from the tide gauges far outside the Rossby radius of a failed sensor. Furthermore, HIDRA3 shows remarkable performance with substantially smaller amounts of training data compared with HIDRA2, making it appropriate for sea level forecasting in basins with high regional variability in the available tide gauge data."
10.1021/acs.est.4c07127,False,Environmental Science & Technology,这篇研究论文主要关注的是利用硫化磁铁矿来去除土壤和地下水中的三氯乙烯（TCE）污染。它探讨了不同硫化方法对磁铁矿的理化性质和反应活性的影响，并将其与硫化纳米零价铁（S-nZVI）进行了比较。研究发现，用硫化物进行硫化处理的磁铁矿（S–Fe3O4_S）在去除TCE方面具有较高的效率，其反应速率甚至超过了S-nZVI。然而，其可重复使用性受到限制。总的来说，这项研究属于土壤和地下水修复领域，与大气环境遥感技术，例如空气质量监测、卫星观测和大气成分分析等，没有直接关系。,[],Ariel Nunez Garcia;Matt Lee;Lei Ding;Xiguang Liang;Chengqi Wang;Feng He;Denis M. O’Carroll,Sulfidation of Magnetite for Superior Dechlorination of Trichloroethene,"The reported contributions of magnetite to the abiotic natural attenuation of chlorinated ethenes have generated interest in its potential for soil and groundwater remediation. In this study, we investigated the impact of the two-step sulfidation method on the physicochemical properties and reactivity of magnetite with trichloroethene (TCE). We systematically evaluated the effect of different sulfur precursors (dithionite, thiosulfate, and sulfide) and sulfur-to-iron ([S/Fe]dosed) molar ratios on the reactivity. Results were compared to those of sulfidated nZVI (S-nZVI) as a benchmark for assessing the efficacy of sulfidated magnetite (S–Fe3O4). The findings indicated limited reactivity of magnetite when sulfidated with dithionite and thiosulfate. However, sulfidation with sulfide yielded reaction rates comparable to those of S-nZVI, particularly at lower [S/Fe]dosed ratios. At higher [S/Fe]dosed ratios (>0.1), sulfide-sulfidated magnetite (S–Fe3O4_S) exhibited reaction rates surpassing those of S-nZVI, with the major dechlorination product being acetylene. Nonetheless, reusability experiments demonstrated that the performance of S–Fe3O4 diminished with aging. These results show that S–Fe3O4_S achieved complete transformation of TCE to acetylene, with reaction rates comparable to S-nZVI. Given its lower cost of production, engineered S–Fe3O4_S remediation systems could serve as a more affordable alternative for in situ chemical reduction of TCE with further research and development."
