doi,is_relevant,journal,explanation,topic_words,authors,title,abstract
10.1038/s41467-025-57535-w,False,Nature Communications,该研究论文的标题和摘要主要关注的是一种名为samuraciclib的CDK7抑制剂在治疗晚期乳腺癌患者的I期临床试验中的剂量递增和扩展队列研究。 这与大气环境遥感技术（如空气质量监测、卫星观测和大气成分分析）没有直接关系。该研究属于医学和肿瘤学领域，而非大气科学或遥感领域。,[],R. C. Coombes;Sacha Howell;Simon R. Lord;Laura Kenny;Janine Mansi;Zahi Mitri;Carlo Palmieri;Linnea I. Chap;Paul Richards;William Gradishar;Sagar Sardesai;Jason Melear;Joyce O’Shaughnessy;Patrick Ward;Pavani Chalasani;Tobias Arkenau;Richard D. Baird;Rinath Jeselsohn;Simak Ali;Glen Clack;Ashwani Bahl;Stuart McIntosh;Matthew G. Krebs,Author Correction: Dose escalation and expansion cohorts in patients with advanced breast cancer in a Phase I study of the CDK7-inhibitor samuraciclib,"Author Correction: Dose escalation and expansion cohorts in patients with advanced breast cancer in a Phase I study of the CDK7-inhibitor samuraciclib 
 "
10.1038/s41467-025-57621-z,False,Nature Communications,该论文主要研究HIV-1病毒中编码T细胞抗原的开放阅读框，利用核糖体谱分析技术进行研究。与大气环境遥感技术，如空气质量监测、卫星观测和大气成分分析等，没有直接关系。因此，该论文与大气环境遥感技术关联性不强。,[],Lisa Bertrand;Annika Nelde;Bertha Cecilia Ramirez;Isabelle Hatin;Hugo Arbes;Pauline François;Stéphane Demais;Emmanuel Labaronne;Didier Decimo;Laura Guiguettaz;Sylvie Grégoire;Anne Bet;Guillaume Beauclair;Antoine Gross;Maja C. Ziegler;Mathias Pereira;Raphaël Jeger-Madiot;Yann Verdier;Joelle Vinh;Sylvain Cardinaud;Stéphanie Graff-Dubois;Audrey Esclatine;Cécile Gouttefangeas;Marcus Altfeld;Laurent Hocqueloux;Assia Samri;Brigitte Autran;Olivier Lambotte;Hans-Georg Rammensee;Emiliano P. Ricci;Juliane Walz;Olivier Namy;Arnaud Moris,Author Correction: Unveiling conserved HIV-1 open reading frames encoding T cell antigens using ribosome profiling,"Author Correction: Unveiling conserved HIV-1 open reading frames encoding T cell antigens using ribosome profiling 
 "
10.1038/s41467-025-57425-1,False,Nature Communications,该论文主要关注的是使用能量过滤技术提高MicroED数据的质量，从而实现蛋白质结构的高分辨率成像。研究重点在于蛋白质晶体的结构分析，与大气环境遥感技术（如空气质量监测、卫星观测和大气成分分析）没有直接关系。论文讨论的是一种改进蛋白质结构解析的方法，而不是大气环境相关的技术或应用。,[],Max T. B. Clabbers;Johan Hattne;Michael W. Martynowycz;Tamir Gonen,Energy filtering enables macromolecular MicroED data at sub-atomic resolution,"High-resolution data are crucial for accurate structural modeling. Here, authors enhance MicroED data quality using energy filtering, achieving sub-atomic resolution protein data and uncovering diffuse scattering, offering detailed insights into protein structure and function. 
 High-resolution information is important for accurate structure modeling but is challenging to attain in macromolecular crystallography due to the rapid fading of diffracted intensities at increasing resolution. While direct electron detection essentially eliminates the read-out noise during MicroED data collection, other sources of noise remain and limit the measurement of faint high-resolution reflections. Inelastic scattering significantly contributes to noise, raising background levels and broadening diffraction peaks. We demonstrate a substantial improvement in signal-to-noise ratio by using energy filtering to remove inelastically scattered electrons. This strategy results in sub-atomic resolution MicroED data from proteinase K crystals, enabling the visualization of detailed structural features. Interestingly, reducing the noise further reveals diffuse scattering that may hold additional structural information. Our findings suggest that combining energy filtering and direct detection provides more accurate measurements at higher resolution, facilitating precise model refinement and improved insights into protein structure and function. High-resolution data are crucial for accurate structural modeling. Here, authors enhance MicroED data quality using energy filtering, achieving sub-atomic resolution protein data and uncovering diffuse scattering, offering detailed insights into protein structure and function."
10.1038/s41467-025-57430-4,False,Nature Communications,该论文主要关注癌症功能蛋白质组学，开发了一个基于人工智能的生物信息学平台DrBioRight 2.0，用于分析和可视化癌症蛋白质组学数据。它利用大规模的蛋白质组学数据来识别生物标志物和治疗靶点，与大气环境遥感技术（如空气质量监测、卫星观测和大气成分分析）没有直接关系。,[],Wei Liu;Jun Li;Yitao Tang;Yining Zhao;Chaozhong Liu;Meiyi Song;Zhenlin Ju;Shwetha V. Kumar;Yiling Lu;Rehan Akbani;Gordon B. Mills;Han Liang,DrBioRight&#xa0;2.0: an LLM-powered bioinformatics chatbot for large-scale cancer functional proteomics analysis,"Functional proteomics enhances cancer research by identifying biomarkers and therapeutic targets. Here, the authors develop a cancer functional proteomics resource and introduce a resource using reverse phase protein arrays and antibodies targeting key pathways. To improve accessibility, they introduce DrBioRight, an AI-powered platform for intuitive data analysis and visualization. 
 Functional proteomics provides critical insights into cancer mechanisms, facilitating the discovery of novel biomarkers and therapeutic targets. We have developed a comprehensive cancer functional proteomics resource using reverse phase protein arrays, incorporating data from nearly 8000 patient samples from The Cancer Genome Atlas and approximately 900 samples from the Cancer Cell Line Encyclopedia. Our dataset includes a curated panel of  nearly 500 high-quality antibodies, covering all major cancer hallmark pathways. To enhance the accessibility and analytic power of this resource, we introduce DrBioRight 2.0 (
                https://drbioright.org
                
              ), an intuitive bioinformatic platform powered by state-of-the-art large language models. DrBioRight enables researchers to explore protein-centric cancer omics data, perform advanced analyses, visualize results, and engage in interactive discussions using natural language. By streamlining complex proteogenomic analyses, this tool accelerates the translation of large-scale functional proteomics data into meaningful biomedical insights. Functional proteomics enhances cancer research by identifying biomarkers and therapeutic targets. Here, the authors develop a cancer functional proteomics resource and introduce a resource using reverse phase protein arrays and antibodies targeting key pathways. To improve accessibility, they introduce DrBioRight, an AI-powered platform for intuitive data analysis and visualization."
10.1038/s41467-025-57558-3,False,Nature Communications,该研究论文主要关注的是在西澳大利亚皮尔巴拉地盾发现的太古宙陨石撞击坑。论文通过在南极洲溪组（ACM）中发现的震裂锥，提供了地球上已知最古老撞击坑的明确证据，撞击时间约为34.7亿年前。研究探讨了陨石撞击对地球早期地壳形成和演化的影响。因此，该论文与大气环境遥感技术（如空气质量监测、卫星观测和大气成分分析）没有直接关系。,[],Christopher L. Kirkland;Tim E. Johnson;Jonas Kaempf;Bruno V. Ribeiro;Andreas Zametzer;R. Hugh Smithies;Brad McDonald,"A Paleoarchaean impact crater in the Pilbara Craton, Western Australia","Shatter cones in rocks in the Pilbara craton provide unequivocal evidence for oldest known impact crater on Earth, which struck 3.5 billion years ago. 
 The role of meteorite impacts in the origin, modification, and destruction of crust during the first two billion years of Earth history (4.5–2.5 billion years ago; Ga) is disputed. Whereas some argue for a relatively minor contribution overall, others have proposed that individual giant impactors (>10–50 km diameter) can initiate subduction zones and deep mantle plumes, arguably triggering a chain of events that formed cratons, the ancient nuclei of the continents. The uncertainty is compounded by the seeming absence of impact structures older than 2.23 Ga, such that the evidence for the terrestrial impact flux in the Hadean and Archaean eons is circumstantial. Here, we report the discovery of shatter cones in a complex, dominantly metasedimentary layer, the Antarctic Creek Member (ACM), in the centre of the East Pilbara Terrane, Western Australia, which provide unequivocal evidence for a hypervelocity meteorite impact. The shocked rocks of the crater floor are overlain by (unshocked) carbonate breccias and pillow lavas, stratigraphically constraining the age of the impact to 3.47 Ga and confirming discovery of the only Archaean crater known thus far. Shatter cones in rocks in the Pilbara craton provide unequivocal evidence for oldest known impact crater on Earth, which struck 3.5 billion years ago."
10.1038/s41467-025-57516-z,False,Nature Communications,这篇论文主要关注的是超表面（metasurface）在多物理场耦合下的频率转移和逆向设计问题，提出了一种多物理场深度学习框架，用于在缺乏多物理场响应知识的情况下，对超表面进行逆向设计。该框架结合了多精度DeepONet、欧拉潜在动态网络和数据分析反演网络，通过动态利用欧拉潜在空间和单物理场信息，成功地将模型推广到未见过的频段，并引入了一种反演方法，将混合先验知识纳入超表面的逆向设计中。该研究在电磁-热耦合下进行了数值和实验验证。总的来说，该论文的核心在于材料科学和机器学习的交叉应用，与大气环境遥感技术（如空气质量监测、卫星观测、大气成分分析等）没有直接关联。,[],Enze Zhu;Zheng Zong;Erji Li;Yang Lu;Jingwei Zhang;Hao Xie;Ying Li;Wen-Yan Yin;Zhun Wei,Frequency transfer and inverse design for metasurface under multi-physics coupling by Euler latent dynamic and data-analytical regularizations,"Frequency transfer, which allows researchers to go beyond in-range analyses of spectrum properties towards out-of-the range predictions, is a key challenge in machine learning. Here, the authors propose a multi-physics deep learning framework without the knowledge of the multi-physics response to inverse design metasurface. 
 Frequency transfer is a key challenge in machine learning as it allows researchers to go beyond in-range analyses of spectrum properties towards out-of-the-range predictions. Traditionally, to predict properties at a specific frequency, targeted spectrum is included in training data for a deep neural network (DNN). However, due to limitations of measurement or computation source, training data at some frequencies are hardly accessible, especially for multi-physics problems. In this work, we propose a multi-physics deep learning framework (MDLF) consisting of a multi-fidelity DeepONet, a Euler latent dynamic network, and a data-analytical inversion network. Without the knowledge about multi-physics response, MDLF is successfully generalized to unseen frequency bands for both parametric and free-form metasurface by dynamically utilizing a Euler latent space and single-physics information. Moreover, an inversion method is introduced to incorporate hybrid a priori in inverse design of metasurface. Under EM-thermal coupling, we verify the proposed MDLF numerically and experimentally. Frequency transfer, which allows researchers to go beyond in-range analyses of spectrum properties towards out-of-the range predictions, is a key challenge in machine learning. Here, the authors propose a multi-physics deep learning framework without the knowledge of the multi-physics response to inverse design metasurface."
10.1038/s41558-025-02255-8,False,Nature Climate Change,该论文研究了非国家行为者在联合国气候变化相关讨论中的作用，特别是不同类型的非政府组织如何影响关于化石燃料和可再生能源的讨论。论文关注的是组织机构如何参与和塑造气候变化议题的讨论，而非直接涉及大气环境遥感技术，如空气质量监测、卫星观测或大气成分分析。因此，该论文与大气环境遥感技术的关联性较低。,"['climate change', 'non-state actors', 'UN', 'fossil fuels', 'renewable energy', 'environmental non-governmental organizations']",,The role of non-state actors in shaping UN climate change side event discussions,"How discussions around key climate change topics evolve over time and which organizations drive such change are important questions. We found that business non-governmental organizations affiliated with fossil fuels focus on hosting renewable energy events but remain absent from anti-fossil-fuel discussions, led instead by a tightly connected network of environmental non-governmental organizations. 
 How discussions around key climate change topics evolve over time and which organizations drive such change are important questions. We found that business non-governmental organizations affiliated with fossil fuels focus on hosting renewable energy events but remain absent from anti-fossil-fuel discussions, led instead by a tightly connected network of environmental non-governmental organizations."
10.1038/s43247-025-02105-7,False,Communications Earth & Environment,该研究论文主要关注塑料污染对食品系统的影响，包括塑料聚合物和化学品、土地利用、贸易和废弃物以及环境与人类健康等方面。虽然环境健康是其中一个考量因素，但论文的核心在于食品系统中的塑料问题，而非大气环境遥感技术。因此，它与空气质量监测、卫星观测或大气成分分析等大气环境遥感技术没有直接关联。,[],Joe Yates;Megan Deeney;Jane Muncke;Bethanie Carney Almroth;Marie-France Dignac;Arturo Castillo Castillo;Winnie Courtene-Jones;Suneetha Kadiyala;Eva Kumar;Peter Stoett;Mengjiao Wang;Trisia Farrelly,Plastics matter in the food system,"Pollution across the entire plastic lifecycle is a system-wide risk to food. Aspirational indicators related to plastic polymers and chemicals, land use, trade, and waste, environmental and human health can help future monitoring of food system plastics. 
 Agriculture and food systems are major sources of plastic pollution but they are also vulnerable to their diverse lifecycle impacts. However, this problem is not well-recognized in global policy and scientific discourse, agendas, and monitoring of food systems. The United Nations-led Global Plastics Treaty, which has been under negotiation since 2022, is a critical opportunity to address pollution across the entire plastics lifecycle for more sustainable and resilient food systems. Here, we offer aspirational indicators for future monitoring of food systems’ plastics related to (1) plastic polymers and chemicals, (2) land use, (3) trade and waste, and (4) environmental and human health. We call for interdisciplinary research collaborations to continue improving and harmonising the evidence base necessary to track and trace plastics and plastic chemicals in food systems. We also highlight the need for collaboration across disciplines and sectors to tackle this urgent challenge for biodiversity, climate change, food security and nutrition, health and human rights at a whole systems level. Pollution across the entire plastic lifecycle is a system-wide risk to food. Aspirational indicators related to plastic polymers and chemicals, land use, trade, and waste, environmental and human health can help future monitoring of food system plastics."
10.1038/s43247-025-02114-6,False,Communications Earth & Environment,该论文主要关注月球南极地区的地表温度测量，以及地形对局部温度的影响。它探讨了利用实地测量数据评估月球水冰资源的可能性，并为未来的月球探测和居住提供参考。论文重点在于月球表面的热物理性质和水冰探测，与大气环境遥感技术（如空气质量监测、卫星观测和大气成分分析）没有直接关系。,[],Durga Prasad K;Chandan Kumar;Ambily G;Kalyana Reddy P;Sanjeev K. Mishra;Janmejay Kumar;Dinakar Prasad Vajja;Aasik V;Tinkal Ladiya;Arpit Patel;Murty S.V.S.;Anil Bhardwaj;Amitabh,Higher surface temperatures near south polar region of the Moon measured by ChaSTE experiment on-board Chandrayaan-3,"In-situ surface temperature as high as 335 K are recorded by Chandra’s surface thermophysical experiment (ChaSTE) on a sunward-facing slope and demonstrate the influence of topography on local metre-scale temperatures at high lunar latitudes. 
 Water-ice prospecting is a crucial step in unlocking the Moon’s potential for supporting human habitat and furthering exploration. Lunar Temperatures not only dictate water-ice, but also drive other aspects of science and exploration. Global temperatures were mapped through remote sensing, but in-situ measurements are only from Apollo 15 and 17. Here, we provide the in-situ temperatures of top 10 cm of a high-latitude lunar regolith measured by Chandra’s Surface Thermophysical Experiment(ChaSTE), a thermal probe on-board Chandrayaan-3 lander. The surface peak temperature of 355 K from ChaSTE is higher than expected(330 K) owing to its deployment on a sunward illuminated local slope region of 6°. This demonstrates that local topography at metre scales can alter temperature at high latitudes, unlike equatorial regions. Numerical model calculations using ChaSTE measurements, suggest that larger poleward facing slopes(>14°) at high latitudes can harbour water-ice, making them promising and technically less challenging sites for future lunar exploration and habitation. In-situ surface temperature as high as 335 K are recorded by Chandra’s surface thermophysical experiment (ChaSTE) on a sunward-facing slope and demonstrate the influence of topography on local metre-scale temperatures at high lunar latitudes."
10.1016/j.rse.2025.114690,False,Remote Sensing of Environment,该研究论文主要评估了全球降水测量（GPM）任务中的综合多卫星检索（IMERG）V07B版本在次日时间尺度上的降水表现。虽然使用了卫星数据，但其重点在于降水量的监测和评估，以及在水文和气候科学中的应用。它与大气环境遥感技术（如空气质量监测、卫星观测大气成分分析）的关联性不强，主要集中在降水这一特定的气象要素上。,"['precipitation', 'satellite-based precipitation products', 'GPM IMERG', 'hydrology', 'climate science']",Jinghua Xiong;Guoqiang Tang;Yuting Yang,Continental evaluation of GPM IMERG V07B precipitation on a sub-daily scale,"•A continental and sub-daily evaluation for GPM IMERG V07B Final Run. •IMERG captures total amount, with over−/under- estimated frequency/intensity. •IMERG shows divergent performance across seasons, climates, and geo-topography. •IMERG underestimates precipitation extremes, particularly for high-intensity events. 
 Satellite-based precipitation products have significantly advanced applications in hydrology, climate science, and related fields. Despite the significant role of the Global Precipitation Measurement (GPM) mission in monitoring global precipitation dynamics over the past decade, its performance on sub-daily time scales remains insufficiently explored on a global scale. This study provides a continental assessment of the Integrated Multi-satellitE Retrievals for GPM (IMERG) V07B Final Run using extensive hourly ground observations across contiguous United States (CONUS), West Europe, and East Asia. The results demonstrate that IMERG captures precipitation amounts with reasonable accuracy, yielding a median Kling–Gupta efficiency of 0.31 and a median relative bias of 7 %. This bias is primarily attributed to overestimated precipitation frequency and underestimated intensity. However, its performance varies significantly with seasons, land surface attributes, and precipitation types, with better performance generally observed in spring and fall, as well as in temperate and humid climates, and low-altitude regions. While IMERG performs well in detecting moderate precipitation, it struggles with drizzle and moderate-to-extreme events, particularly those exceeding 5 mm/h. Additionally, diurnal performance variability is evident, with the highest accuracy observed in the morning (0600–0900) and the lowest in the afternoon (1400–1700). These findings underscore the variable performance of IMERG and highlight the need for further improvements, especially in capturing extreme precipitation in regions with complex geo-topographic conditions."
10.1016/j.rse.2025.114687,False,Remote Sensing of Environment,该研究论文主要关注的是利用遥感技术，特别是Landsat卫星影像，结合Google Earth Engine平台，来优化火灾严重程度的制图方法。研究重点在于图像合成参数（如时间窗口、季节选择、像素值确定标准）对火灾严重程度制图精度的影响，并针对不同生态系统提出了参数选择的建议。虽然使用了遥感数据，但其核心在于地表火灾的监测和评估，与大气环境遥感技术（如空气质量监测、大气成分分析等）关联不大。,"['fire severity', 'Landsat', 'Google Earth Engine', 'ecosystem monitoring', 'remote sensing', 'image compositing']",N. Quintero;O. Viedma;S. Veraverbeke;J.M. Moreno,Optimising fire severity mapping using pixel-based image compositing,"•Image compositing parameters affect fire severity mapping accuracy. •The optimal lag timing (initial vs. extended) varies by ecosystem. •Seasonal timing differences reduce the accuracy of fire severity maps. •The optimal compositing criteria depends on lag timing. •Fire severity maps and GEE code for the Iberian Peninsula are shared. 
 Fire severity is closely linked to ecosystem responses. As climate change increases the frequency of severe fires, large-scale fire severity monitoring has become increasingly important. The traditional bitemporal approach, which compares single pre- and post-fire images to map fire severity, is effective at local scales but less efficient for larger-scale assessments. Recent advances in compositing multiple images have improved large-scale mapping; however, the effects of compositing parameters on mapping accuracy remain poorly understood. This study evaluates the impact of compositing parameters on composite-based fire severity maps derived from Landsat images across summer fires at multiple scales. At the large scale, we analysed fires in the Iberian Peninsula (2000−2023); at the medium scale, fires in a Mediterranean region of Spain (1985–2015), validated with national statistics; and at the local scale, two fires with field-based severity data. Various compositing parameters were tested, including the period for selecting pre- and post-fire images: lag timing (initial vs. extended assessment), seasonal timing (summer-summer, spring-summer, and summer-autumn), and the criteria for determining pre- and post-fire pixel values (mean-mean, max-min, and mean-min). Accuracy was assessed using the optimality index, correlation with the bitemporal approach, and alignment with field-based severity data, depending on the scale. Both the compositing period and criteria significantly influenced the accuracy of severity maps. In Mediterranean landscapes, the highest accuracy was achieved using post-fire imagery from the same year as the fire, whereas in alpine areas, it was achieved using post-fire imagery from the year after the fire. Seasonally consistent pre- and post-fire images acquired during summer also improved accuracy. The optimal compositing criteria varied depending on the lag timing: mean-min and max-min were most effective for assessing fire severity shortly after the fire, whereas mean-mean performed better for assessments conducted one year later. This study highlights the importance of carefully selecting compositing parameters based on the ecological characteristics of the study area. Additionally, it presents a scalable, automated methodology for large-scale fire severity mapping using Google Earth Engine, which can be applied to larger regions with appropriate adjustments to the compositing parameters."
