doi,is_relevant,journal,explanation,topic_words,authors,title,abstract
10.1038/s41586-024-08562-y,False,Nature,这篇研究论文主要关注的是病毒感染过程中CD8+ T细胞的起源、分化和适应性。研究使用了慢性LCMV感染的小鼠模型，发现了一种具有干细胞样特征的PD-1+ TCF-1+ TOX+ CD8+ T细胞，这种细胞可以在急性或慢性感染中早期产生，并根据感染的持续时间调整其分化轨迹。研究结果揭示了机体应对潜在慢性感染的先验准备，以及这种干细胞样CD8+ T细胞在PD-1靶向免疫治疗中的作用。该研究与大气环境遥感技术，例如空气质量监测、卫星观测和大气成分分析，没有任何关系。,[],Daniel T. McManus;Rajesh M. Valanparambil;Christopher B. Medina;Christopher D. Scharer;Donald J. McGuire;Ewelina Sobierajska;Yinghong Hu;Daniel Y. Chang;Andreas Wieland;Judong Lee;Tahseen H. Nasti;Masao Hashimoto;James L. Ross;Nataliya Prokhnevska;Maria A. Cardenas;Amanda L. Gill;Elisa C. Clark;Kathleen Abadie;Arjun Kumar;Jonathan Kaye;Byron B. Au-Yeung;Hao Yuan Kueh;Haydn T. Kissick;Rafi Ahmed,An early precursor CD8 T cell that adapts to acute or chronic viral infection,"An early precursor CD8 T cell that adapts to acute or chronic viral infection 
 This study examines the origin and differentiation of stem-like CD8+ T cells that are essential for sustained T cell immunity in chronic viral infections and cancer and also play a key role in PD-1 directed immunotherapy1-10. These PD-1+ TCF-1+ TOX+ stem-like CD8+ T cells, also referred to as precursors of exhausted T cells8,9, have a distinct program that allows them to adapt to chronic antigen stimulation. Using the mouse model of chronic LCMV infection we found that virus specific stem-like CD8+ T cells are generated early (day 5) during chronic infection suggesting that this crucial fate commitment occurs irrespective of infection outcome. Indeed, we found that nearly identical populations of stem-like CD8+ T cells were generated early during acute or chronic LCMV infection, and that antigen was essential for maintaining the stem-like phenotype. We next performed reciprocal adoptive transfer experiments to determine the fate of these early stem-like CD8+ T cells after viral clearance versus persistence. Following transfer of day 5 stem-like CD8+ T cells from chronically infected into acutely infected mice, these cells downregulated canonical markers of the chronic stem-like CD8+ T cells and expressed markers (CD127 and CD62L) associated with central memory CD8+ T cells. Reciprocally, when day 5 stem-like cells from acutely infected mice were transferred into chronically infected mice these CD8+ T cells functioned like chronic resource cells and responded effectively to PD-1 therapy. These findings highlight the ability of these early PD-1+ TCF-1+ TOX+ stem-like CD8+ T cells to adapt their differentiation trajectory to either an acute or chronic viral infection. Most importantly, our study shows that the host is prepared a priori to deal with a potential chronic infection."
10.1038/s41586-024-07975-z,False,Nature,这篇论文的标题和摘要表明，其研究方向是细胞信号通路，特别是mTORC1的激活机制。它关注的是氨基酸、KLHL22和DEPDC5这几种蛋白质之间的相互作用，与大气环境遥感技术（例如空气质量监测、卫星观测和大气成分分析）没有任何关系。因此，这篇论文与大气环境遥感技术不相关。,[],Jie Chen;Yuhui Ou;Ying Liu,Reply to: Amino acids and KLHL22 do not activate mTORC1 via DEPDC5 degradation,"Reply to: Amino acids and KLHL22 do not activate mTORC1 via DEPDC5 degradation 
 "
10.1038/d41586-025-00006-5,False,Nature,这篇研究论文的标题和摘要表明，其研究内容是关于行星状星云周围的尘埃云，这属于天文学领域。文章指出，观测到的尘埃云可能是首次在行星状星云周围发现的碎片盘。研究与大气环境遥感技术，例如空气质量监测、卫星观测和大气成分分析等，并没有直接关系。,[],,Cosmic carnage: planetary rubble spotted at a dying star,"Dust cloud is thought to be the first debris disk to be seen around a planetary nebula. 
 Dust cloud is thought to be the first debris disk to be seen around a planetary nebula.  Dust cloud is thought to be the first debris disk to be seen around a planetary nebula."
10.1038/s41586-024-08571-x,False,Nature,"这篇论文的标题和摘要表明，这是一项关于人类蛋白质编码变异的基因组学研究。研究分析了983,578个人的蛋白质编码变异，构建了一个深度目录。 这与大气环境遥感技术，例如空气质量监测、卫星观测和大气成分分析，没有任何关系。  研究对象是人类基因组，研究方法是基因组学分析，而非大气遥感技术。",[],Kathie Y. Sun;Xiaodong Bai;Siying Chen;Suying Bao;Chuanyi Zhang;Manav Kapoor;Joshua Backman;Tyler Joseph;Evan Maxwell;George Mitra;Alexander Gorovits;Adam Mansfield;Boris Boutkov;Sujit Gokhale;Lukas Habegger;Anthony Marcketta;Adam E. Locke;Liron Ganel;Alicia Hawes;Michael D. Kessler;Deepika Sharma;Jeffrey Staples;Jonas Bovijn;Sahar Gelfman;Alessandro Di Gioia;Veera M. Rajagopal;Alexander Lopez;Jennifer Rico Varela;Jesús Alegre-Díaz;Jaime Berumen;Roberto Tapia-Conyer;Pablo Kuri-Morales;Jason Torres;Jonathan Emberson;Rory Collins;Gonçalo Abecasis;Giovanni Coppola;Andrew Deubler;Aris Economides;Adolfo Ferrando;Luca A. Lotta;Alan Shuldiner;Katherine Siminovitch;Christina Beechert;Erin D. Brian;Laura M. Cremona;Hang Du;Caitlin Forsythe;Zhenhua Gu;Kristy Guevara;Michael Lattari;Kia Manoochehri;Prathyusha Challa;Manasi Pradhan;Raymond Reynoso;Ricardo Schiavo;Maria Sotiropoulos Padilla;Chenggu Wang;Sarah E. Wolf;Amelia Averitt;Nilanjana Banerjee;Dadong Li;Sameer Malhotra;Justin Mower;Mudasar Sarwar;Jeffrey C. Staples;Sean Yu;Aaron Zhang;Andrew Bunyea;Krishna Pawan Punuru;Sanjay Sreeram;Gisu Eom;Benjamin Sultan;Rouel Lanche;Vrushali Mahajan;Eliot Austin;Sean O’Keeffe;Razvan Panea;Tommy Polanco;Ayesha Rasool;Lance Zhang;Evan Edelstein;Ju Guan;Olga Krasheninina;Samantha Zarate;Adam J. Mansfield;Evan K. Maxwell;Kathie Sun;Manuel Allen Revez Ferreira;Kathy Burch;Adrian Campos;Lei Chen;Sam Choi;Amy Damask;Sheila Gaynor;Benjamin Geraghty;Arkopravo Ghosh;Salvador Romero Martinez;Christopher Gillies;Lauren Gurski;Joseph Herman;Eric Jorgenson;Michael Kessler;Jack Kosmicki;Nan Lin;Adam Locke;Priyanka Nakka;Karl Landheer;Olivier Delaneau;Maya Ghoussaini;Joelle Mbatchou;Arden Moscati;Aditeya Pandey;Anita Pandit;Charles Paulding;Jonathan Ross;Carlo Sidore;Eli Stahl;Maria Suciu;Peter VandeHaar;Sailaja Vedantam;Scott Vrieze;Jingning Zhang;Rujin Wang;Kuan-Han Wu;Bin Ye;Blair Zhang;Andrey Ziyatdinov;Yuxin Zou;Kyoko Watanabe;Mira Tang;Brian Hobbs;Jon Silver;William Palmer;Rita Guerreiro;Amit Joshi;Antoine Baldassari;Cristen Willer;Sarah Graham;Ernst Mayerhofer;Mary Haas;Niek Verweij;George Hindy;Tanima De;Parsa Akbari;Luanluan Sun;Olukayode Sosina;Arthur Gilly;Peter Dornbos;Juan Rodriguez-Flores;Moeen Riaz;Gannie Tzoneva;Momodou W. Jallow;Anna Alkelai;Ariane Ayer;Veera Rajagopal;Vijay Kumar;Jacqueline Otto;Neelroop Parikshak;Aysegul Guvenek;Jose Bras;Silvia Alvarez;Jessie Brown;Jing He;Hossein Khiabanian;Joana Revez;Kimberly Skead;Valentina Zavala;Lyndon J. Mitnaul;Marcus B. Jones;Esteban Chen;Michelle G. LeBlanc;Jason Mighty;Nirupama Nishtala;Nadia Rana;Jennifer Rico-Varela;Jaimee Hernandez;Alison Fenney;Randi Schwartz;Jody Hankins;Samuel Hart;Ann Perez-Beals;Gina Solari;Johannie Rivera-Picart;Michelle Pagan;Sunilbe Siceron;David Gwynne;Jerome I. Rotter;Robert Weinreb;Jonathan L. Haines;Margaret A. Pericak-Vance;Dwight Stambolian;Nir Barzilai;Yousin Suh;Zhengdong Zhang;Elliot Hong;Braxton Mitchell;Nicholas B. Blackburn;Simon Broadley;Marzena J. Fabis-Pedrini;Vilija G. Jokubaitis;Allan G. Kermode;Trevor J. Kilpatrick;Jeanette Lechner-Scott;Stephen Leslie;Bennet J. McComish;Allan Motyer;Grant P. Parnell;Rodney J. Scott;Bruce V. Taylor;Justin P. Rubio;Danish Saleheen;Ken Kaufman;Leah Kottyan;Lisa Martin;Marc E. Rothenberg;Abdullah Ali;Azra Raza;Jonathan Cohen;Adam Glassman;William E. Kraus;Christopher B. Newgard;Svati H. Shah;Jamie Craig;Alex Hewitt;Naga Chalasani;Tatiana Foroud;Suthat Liangpunsakul;Nancy J. Cox;Eileen Dolan;Omar El-Charif;Lois B. Travis;Heather Wheeler;Eric Gamazon;Lori Sakoda;John Witte;Kostantinos Lazaridis;Adam Buchanan;David J. Carey;Christa L. Martin;Michelle N. Meyer;Kyle Retterer;David Rolston;Nirmala Akula;Emily Besançon;Sevilla D. Detera-Wadleigh;Layla Kassem;Francis J. McMahon;Thomas G. Schulze;Adam Gordon;Maureen Smith;John Varga;Yuki Bradford;Scott Damrauer;Stephanie DerOhannessian;Theodore Drivas;Scott Dudek;Joseph Dunn;Ned Haubein;Renae Judy;Yi-An Ko;Colleen Morse Kripke;Meghan Livingstone;Nawar Naseer;Kyle P. Nerz;Afiya Poindexter;Marjorie Risman;Salma Santos;Giorgio Sirugo;Julia Stephanowski;Teo Tran;Fred Vadivieso;Anurag Verma;Shefali S. Verma;JoEllen Weaver;Colin Wollack;Daniel J. Rader;Marylyn Ritchie;Joan O’Brien;Erwin Bottinger;Judy Cho;S. Louis Bridges;Robert Kimberly;Marlena Fejzo;Richard A. Spritz;James T. Elder;Rajan P. Nair;Philip Stuart;Lam C. Tsoi;Robert Dent;Ruth McPherson;Brendan Keating;Erin E. Kershaw;Georgios Papachristou;David C. Whitcomb;Shervin Assassi;Maureen D. Mayes;Eric D. Austin;Michael Cantor;Timothy Thornton;Hyun Min Kang;John D. Overton;Alan R. Shuldiner;M. Laura Cremona;Mona Nafde;Aris Baras;Gonçalo Abecasis;Jonathan Marchini;Jeffrey G. Reid;William Salerno;Suganthi Balasubramanian,"Author Correction: A deep catalogue of protein-coding variation in 983,578 individuals","Author Correction: A deep catalogue of protein-coding variation in 983,578 individuals 
 "
10.1038/s41586-024-07974-0,False,Nature,这篇论文的标题和摘要表明，其研究方向是细胞信号通路，特别是mTORC1的激活机制。研究发现氨基酸和KLHL22并不通过DEPDC5降解来激活mTORC1。这与大气环境遥感技术，例如空气质量监测、卫星观测和大气成分分析毫无关系。  研究内容属于分子生物学或细胞生物学领域。,[],Max L. Valenstein;Pranav V. Lalgudi;Jibril F. Kedir;Kendall J. Condon;Anna Platzek;Daniel G. Freund;Martin S. Taylor;Yunhan Xu;Raghu R. Chivukula;David M. Sabatini,Amino acids and KLHL22 do not activate mTORC1 via DEPDC5 degradation,"Amino acids and KLHL22 do not activate mTORC1 via DEPDC5 degradation 
 "
10.1038/s41586-024-08281-4,False,Nature,这篇论文主要关注的是有机化学领域中的催化反应，特别是利用阳离子钯配合物实现酮和酯的β-C-H键官能化反应。研究通过设计一种新型的MPANA配体，成功地实现了酮和酯的多种甲基β-C-H官能化反应，包括分子间芳基化、羟基化和分子内C(sp3)-H/C(sp2)-H偶联反应，并可以用于合成螺环和稠环体系。文章的重点在于催化剂的设计、反应的开发以及反应机理的研究，与大气环境遥感技术，例如空气质量监测、卫星观测和大气成分分析等，没有任何直接关系。,[],Yi-Hao Li;Nikita Chekshin;Yilin Lu;Jin-Quan Yu,β-C−H bond functionalization of ketones and esters by cationic Pd complexes,"Diverse methyl β-C−H functionalizations of ketones and esters are enabled by cationic Pd(II) complexes with MPANA ligands, offering access to spirocyclic and fused ring systems through enhanced catalyst–substrate affinity. 
 C–H activation is the most direct way of functionalizing organic molecules. Many advances in this field still require specific directing groups to achieve the necessary activity and selectivity. Developing C–H activation reactions directed by native functional groups is essential for their broad application in synthesis1. Over the past decade, several generations of bifunctional ligands developed have enabled C(sp3)–H activation reactions of free carboxylic acids2, free aliphatic amines3, native amides4,5 and alcohols6. However, an effective catalyst for ketones and carboxylic esters remains to be realized. Here we report diverse methyl β-C−H functionalizations, including intermolecular arylation, hydroxylation and intramolecular C(sp3)–H/C(sp2)–H coupling of ketones and carboxylic esters with a monoprotected amino neutral amide (MPANA) ligand. The in situ generation of cationic Pd(II) complexes by the combination MPANA ligand and HBF4 is crucial for achieving the reactivity. The compatibility of these reactions with cyclic ketones and lactams provides a method to access spirocyclic and fused ring systems. Mechanistic experiments and density functional theory studies support the role of cationic Pd complexes with MPANA ligands in enhancing catalyst–substrate affinity and facilitating the C−H cleavage step. Diverse methyl β-C−H functionalizations of ketones and esters are enabled by cationic Pd(II) complexes with MPANA ligands, offering access to spirocyclic and fused ring systems through enhanced catalyst–substrate affinity."
10.1038/s41586-024-08300-4,False,Nature,这篇论文的标题和摘要讨论的是人类胚胎的多基因组编辑及其伦理问题，重点关注降低疾病易感性与加剧健康不平等之间的可能性。它主要涉及基因组学、医学伦理学和社会公平等领域，与大气环境遥感技术（例如空气质量监测、卫星观测和大气成分分析）没有任何关系。论文中没有提及任何与大气成分、卫星传感器或应用相关的术语或概念。,[],Peter M. Visscher;Christopher Gyngell;Loic Yengo;Julian Savulescu,Heritable polygenic editing: the next frontier in genomic medicine?,"We discuss the potential consequences and ethical concerns of polygenic genome editing of human embryos to alter specific variants associated with polygenic diseases, highlighting the possibility of reducing disease susceptibility while exacerbating health inequalities. 
 Polygenic genome editing in human embryos and germ cells is predicted to become feasible in the next three decades. Several recent books and academic papers have outlined the ethical concerns raised by germline genome editing and the opportunities that it may present1–3. To date, no attempts have been made to predict the consequences of altering specific variants associated with polygenic diseases. In this Analysis, we show that polygenic genome editing could theoretically yield extreme reductions in disease susceptibility. For example, editing a relatively small number of genomic variants could make a substantial difference to an individual’s risk of developing coronary artery disease, Alzheimer’s disease, major depressive disorder, diabetes and schizophrenia. Similarly, large changes in risk factors, such as low-density lipoprotein cholesterol and blood pressure, could, in theory, be achieved by polygenic editing. Although heritable polygenic editing (HPE) is still speculative, we completed calculations to discuss the underlying ethical issues. Our modelling demonstrates how the putatively positive consequences of gene editing at an individual level may deepen health inequalities. Further, as single or multiple gene variants can increase the risk of some diseases while decreasing that of others, HPE raises ethical challenges related to pleiotropy and genetic diversity. We conclude by arguing for a collectivist perspective on the ethical issues raised by HPE, which accounts for its effects on individuals, their families, communities and society4. We discuss the potential consequences and ethical concerns of polygenic genome editing of human embryos to alter specific variants associated with polygenic diseases, highlighting the possibility of reducing disease susceptibility while exacerbating health inequalities."
10.1038/s41586-024-08397-7,False,Nature,这篇论文研究的是海马神经元的活动与行动计划之间的关系。研究者利用高密度电生理记录技术，在小鼠实验中探究了海马神经元如何根据行动计划更新内部产生的细胞集群，以达到外部目标。实验中，空间、听觉提示、奖励和环境因素都被考虑在内，并被设计成具有变化的相关性。结果表明，海马神经元的活动主要受行动计划的影响，而不是外部变量的直接影响。神经元的放电模式会根据目标的不确定性进行调节。研究认为，海马神经元对不同感觉模式的表观调节可能是由于与任务中允许的行动进程一致，而不是对外部线索的表征。总而言之，这项研究关注的是神经科学领域，特别是关于大脑如何规划和执行行动的机制，与大气环境遥感技术没有直接关系。,[],Ipshita Zutshi;Athina Apostolelli;Wannan Yang;Zheyang Sam Zheng;Tora Dohi;Edoardo Balzani;Alex H. Williams;Cristina Savin;György Buzsáki,Hippocampal neuronal activity is aligned with action plans,"Using high-density electrophysiological recordings, how internally generated cell assemblies are updated by action plans to meet external goals is explored. 
 Neurons in the hippocampus are correlated with different variables, including space, time, sensory cues, rewards and actions, in which the extent of tuning depends on ongoing task demands1–8. However, it remains uncertain whether such diverse tuning corresponds to distinct functions within the hippocampal network or whether a more generic computation can account for these observations9. Here, to disentangle the contribution of externally driven cues versus internal computation, we developed a task in mice in which space, auditory tones, rewards and context were juxtaposed with changing relevance. High-density electrophysiological recordings revealed that neurons were tuned to each of these modalities. By comparing movement paths and action sequences, we observed that external variables had limited direct influence on hippocampal firing. Instead, spiking was influenced by online action plans and modulated by goal uncertainty. Our results suggest that internally generated cell assembly sequences are selected and updated by action plans towards deliberate goals. The apparent tuning of hippocampal neuronal spiking to different sensory modalities might emerge due to alignment to the afforded action progression within a task rather than representation of external cues. Using high-density electrophysiological recordings, how internally generated cell assemblies are updated by action plans to meet external goals is explored."
10.1038/s41586-024-08371-3,False,Nature,这篇研究论文主要关注组蛋白单胺化修饰及其对神经节律性的调控作用。研究发现，转谷氨酰胺酶2 (TG2) 能够擦除和交换H3组蛋白的单胺化修饰，包括组蛋白H3 Gln5位点的组胺化修饰。H3Q5组胺化修饰在脑中呈现昼夜节律性表达，并参与调控昼夜节律基因的表达和行为。与H3Q5丝氨酸化修饰不同，H3Q5组胺化修饰抑制WDR5蛋白的结合，从而拮抗H3K4甲基转移酶的活性。总的来说，这项研究阐明了一种机制，即单个染色质调节酶能够感知化学微环境，从而影响细胞的表观遗传状态，而这些动态变化在神经节律性的调控中起着关键作用。该研究与大气环境遥感技术，例如空气质量监测、卫星观测和大气成分分析等，没有任何关系。,[],Qingfei Zheng;Benjamin H. Weekley;David A. Vinson;Shuai Zhao;Ryan M. Bastle;Robert E. Thompson;Stephanie Stransky;Aarthi Ramakrishnan;Ashley M. Cunningham;Sohini Dutta;Jennifer C. Chan;Giuseppina Di Salvo;Min Chen;Nan Zhang;Jinghua Wu;Sasha L. Fulton;Lingchun Kong;Haifeng Wang;Baichao Zhang;Lauren Vostal;Akhil Upad;Lauren Dierdorff;Li Shen;Henrik Molina;Simone Sidoli;Tom W. Muir;Haitao Li;Yael David;Ian Maze,Bidirectional histone monoaminylation dynamics regulate neural rhythmicity,"TG2 functions as an eraser and exchanger of H3 monoaminylations, including histaminylation of Gln5 of histone H3. 
 Histone H3 monoaminylations at Gln5 represent an important family of epigenetic marks in brain that have critical roles in permissive gene expression1–3. We previously demonstrated that serotonylation4–10 and dopaminylation9,11–13 of Gln5 of histone H3 (H3Q5ser and H3Q5dop, respectively) are catalysed by transglutaminase 2 (TG2), and alter both local and global chromatin states. Here we found that TG2 additionally functions as an eraser and exchanger of H3 monoaminylations, including H3Q5 histaminylation (H3Q5his), which displays diurnally rhythmic expression in brain and contributes to circadian gene expression and behaviour. We found that H3Q5his, in contrast to H3Q5ser, inhibits the binding of WDR5, a core member of histone H3 Lys4 (H3K4) methyltransferase complexes, thereby antagonizing methyltransferase activities on H3K4. Taken together, these data elucidate a mechanism through which a single chromatin regulatory enzyme has the ability to sense chemical microenvironments to affect the epigenetic states of cells, the dynamics of which have critical roles in the regulation of neural rhythmicity. TG2 functions as an eraser and exchanger of H3 monoaminylations, including histaminylation of Gln5 of histone H3."
10.1038/s41586-024-08296-x,False,Nature,这篇论文研究的是Janus石墨烯纳米带的制备和性质。它关注的是通过在锯齿形边缘引入苯环的拓扑缺陷阵列来打破结构对称性，从而实现单一锯齿形边缘上的局域态。研究利用了Lieb定理和拓扑分类理论，设计并制备了两种Janus石墨烯纳米带，并通过扫描探针显微镜和光谱以及第一性原理密度泛函理论对其进行了表征。其核心是探索材料的磁性量子现象和奇异量子相，旨在实现基于碳的铁磁输运通道，这与大气环境遥感技术（例如空气质量监测、卫星观测和大气成分分析）并没有直接关系。,[],Shaotang Song;Yu Teng;Weichen Tang;Zhen Xu;Yuanyuan He;Jiawei Ruan;Takahiro Kojima;Wenping Hu;Franz J. Giessibl;Hiroshi Sakaguchi;Steven G. Louie;Jiong Lu,Janus graphene nanoribbons with localized states on a single zigzag edge,"Janus graphene nanoribbons with localized states on a single zigzag edge are fabricated by introducing a topological defect array of benzene motifs on the opposite zigzag edge, to break the structural symmetry. 
 Topological design of π electrons in zigzag-edged graphene nanoribbons (ZGNRs) leads to a wealth of magnetic quantum phenomena and exotic quantum phases1–10. Symmetric ZGNRs typically show antiferromagnetically coupled spin-ordered edge states1,2. Eliminating cross-edge magnetic coupling in ZGNRs not only enables the realization of a class of ferromagnetic quantum spin chains11, enabling the exploration of quantum spin physics and entanglement of multiple qubits in the one-dimensional limit3,12, but also establishes a long-sought-after carbon-based ferromagnetic transport channel, pivotal for ultimate scaling of GNR-based quantum electronics1–3,9,13. Here we report a general approach for designing and fabricating such ferromagnetic GNRs in the form of Janus GNRs (JGNRs) with two distinct edge configurations. Guided by Lieb’s theorem and topological classification theory14–16, we devised two JGNRs by asymmetrically introducing a topological defect array of benzene motifs to one zigzag edge, while keeping the opposing zigzag edge unchanged. This breaks the structural symmetry and creates a sublattice imbalance within each unit cell, initiating a spin-symmetry breaking. Three Z-shaped precursors are designed to fabricate one parent ZGNR and two JGNRs with an optimal lattice spacing of the defect array for a complete quench of the magnetic edge states at the ‘defective’ edge. Characterization by scanning probe microscopy and spectroscopy and first-principles density functional theory confirms the successful fabrication of JGNRs with a ferromagnetic ground-state localized along the pristine zigzag edge. Janus graphene nanoribbons with localized states on a single zigzag edge are fabricated by introducing a topological defect array of benzene motifs on the opposite zigzag edge, to break the structural symmetry."
