doi,is_relevant,journal,explanation,topic_words,authors,title,abstract
10.5194/gmd-18-5937-2025,False,Geoscientific Model Development,该论文主要关注大气潜在氧气（APO）的传输模型比对项目，旨在评估大气传输模型和海-气O2通量产品的误差。虽然涉及大气成分（APO）的模拟和观测，但其重点在于大气传输过程和海洋生物地球化学的影响，而非直接利用大气环境遥感技术（如空气质量监测、卫星观测等）进行大气成分分析。因此，该论文与大气环境遥感技术的关联性不强。,"['Atmospheric Potential Oxygen (APO)', 'Air-sea gas exchange', 'Atmospheric transport models (ATMs)', 'Ocean biogeochemistry', 'Fossil fuel burning']",Yuming Jin;Britton B. Stephens;Matthew C. Long;Naveen Chandra;Frédéric Chevallier;Joram J. D. Hooghiem;Ingrid T. Luijkx;Shamil Maksyutov;Eric J. Morgan;Yosuke Niwa;Prabir K. Patra;Christian Rödenbeck;Jesse Vance,The Atmospheric Potential Oxygen forward Model Intercomparison Project (APO-MIP1): evaluating simulated atmospheric transport of air-sea gas exchange tracers and APO flux products,"We carry out a comprehensive atmospheric transport model (ATM) intercomparison project. This project aims to evaluate errors in ATMs and three air-sea O2 flux products by comparing model simulations with observations collected from surface stations, ships, and aircraft. We also present a model evaluation framework to independently quantify transport-related and flux-related biases that contribute to model-observation discrepancies in atmospheric tracer distributions. 
 Atmospheric Potential Oxygen (APO, defined as O2 + 1.1 × CO2) is primarily a tracer of ocean biogeochemistry and fossil fuel burning. APO exhibits strong seasonal variability at mid-to-high latitudes, driven mainly by seasonal air-sea O2 exchange. We present results from the first version of the Atmospheric Potential Oxygen forward Model Intercomparison Project (APO-MIP1), which forward transports three air-sea APO flux products in eight atmospheric transport models or model variants, aiming to evaluate atmospheric transport and flux representations by comparing simulations against surface station, airborne, and shipboard observations of APO. We find significant spread and bias in APO simulations at eastern Pacific surface stations, indicating inconsistencies in representing vertical and coastal atmospheric mixing. A framework using airborne APO observations demonstrates that most atmospheric transport models (ATMs) participating in APO-MIP1 overestimate tracer diffusive mixing across moist isentropes (i.e., diabatic mixing) in mid-latitudes. This framework also enables us to isolate ATM-related biases in simulated APO distributions using independent mixing constraints derived from moist static energy budgets from reanalysis, thereby allowing us to assess large-scale features in air-sea APO flux products. Furthermore, shipboard observations show that ATMs are unable to reproduce seasonal APO gradients over Drake Passage and near Palmer Station, Antarctica, which could arise from uncertainties in APO fluxes or model transport. The transport simulations and flux products from APO-MIP1 provide valuable resources for developing new APO flux inversions and evaluating ocean biogeochemical processes."
10.1021/acs.est.5c04952,False,Environmental Science & Technology,该研究论文主要关注从磷石膏废料中回收稀土元素（REE）的经济和环境可持续性。它提出了一种生物启发吸附分离的REE回收处理方案，并使用概率可持续性框架评估其环境和经济效益。虽然该研究与环境可持续性相关，但它并不直接涉及大气环境遥感技术，如空气质量监测、卫星观测或大气成分分析。因此，该论文与大气环境遥感技术没有强相关性。,[],Adam Smerigan and Rui Shi,Advancing the Economic and Environmental Sustainability of Rare Earth Element Recovery from Phosphogypsum,"Transitioning to green energy requires more sustainable rare earth element (REE) production. The current REE supply relies on energy- and chemical-intensive mining, prompting interest in alternative sources like phosphogypsum (PG) waste. However, using conventional solvent extraction to recover REEs in PG is inefficient and environmentally burdensome. This study proposes a treatment train for REE recovery from PG, featuring a bioinspired adsorptive separation, and evaluates its environmental and economic performance using a probabilistic sustainability framework that integrates life cycle assessment (LCA) and techno-economic analysis (TEA). Results show the system achieves an internal rate of return (IRR) above 15% in 87% of simulations, suggesting strong profitability potential. Environmentally, it outperforms conventional REE mining and PG treatment in ecosystem quality and resource depletion but shows higher human health impacts. Scenario analysis reveals profitability at processing capacities over 100 000 kg·h–1 for PG with REE content above 0.5 wt %. However, more dilute sources (0.02–0.1 wt %) are not viable under current conditions due to acid and neutralization costs. This study offers the first in-depth sustainability assessment of REE recovery from PG waste and highlights key areas for future process development to improve access to low-grade sources and enhance environmental outcomes."
10.1021/acs.est.5c05708,False,Environmental Science & Technology,该研究主要关注纳米塑料对植物生理的影响，特别是利用RNA干扰技术研究纳米塑料核酸载体在植物细胞内的调控作用。实验结果表明，带正电荷的聚苯乙烯纳米塑料可以有效地吸附小干扰RNA，形成稳定的复合物，并能进入植物细胞，调控特定基因的表达，从而影响植物的性状，例如花朵的颜色。虽然该研究涉及纳米颗粒，但其重点在于植物生物学和纳米毒理学，与大气环境遥感技术（如空气质量监测、卫星观测和大气成分分析）没有直接关联。,[],Haimei Wu;Ziqian Li;Yunmu Xiao;Hong Liu;Yong Li;Yuliang Pan;Huan Zhang;Qian Liu;Guibin Jiang,Plant Trait Regulation Enabled by Nanoplastic Nucleic Acid Carriers,"Nanoplastic pollutants have raised concerns about their potential impacts on plant physiology. In this study, RNA interference technology (RNAi) was leveraged to verify the intracellular regulation of nanoplastic nucleic acid carriers (NNAC) on plant traits. The results revealed that positively charged polystyrene nanoplastics (PS, 20 nm) can efficiently adsorb small interfering RNA (siRNA) at a mass ratio of 1:5 (siRNA-PS) through electrostatic interactions, forming stable siRNA-PS complexes resistant to enzymatic degradation. The red fluorescence was  observed in tobacco leaf cells, providing evidence that Cy3-siRNA-PS has successfully traversed the cell wall barrier and been internalized. Meanwhile, the targeted siRNA-PS effectively induces pronounced fluorescence quenching of green fluorescent protein (GFP) in tobacco leaves, decreasing by 97.6% after 24 h. Similarly, the vibrant red flowers of glory were tuned to a faded state through the manipulation of color-controlled genes, particularly the mRNA expression of chalcone isomerase (CHI) reduced by 69.4%. Nevertheless, the expression of the GFP gene in tobacco leaves has largely reverted to the baseline levels observed in the control group after 4 days, highlighting the transient and reversible nature of this nongenetic regulation. Overall, this study uncovers the role of nanoplastic carriers, enhancing our understanding of nanoplastic biosafety and providing a foundation for the phytotoxicity of new nanopollutants."
10.1021/acs.est.5c07191,False,Environmental Science & Technology,该研究论文主要关注通过海底地下水排放（SGD）进入沿海泻湖的汞和甲基汞的来源，以及它们对人类和生态系统健康的影响。研究重点是量化SGD驱动的汞/甲基汞通量，特别是在地中海西部最大的沿海泻湖中。研究测量了地表水和孔隙水中溶解的汞和甲基汞总量，发现孔隙水中的汞和甲基汞含量高于泻湖。通过SGD进入泻湖的汞输入量与大气沉降相似，远大于河流输入量。该研究强调了考虑不同SGD组成部分对于准确估计基于SGD的汞输入沿海海洋的重要性。该论文与大气环境遥感技术（如空气质量监测、卫星观测和大气成分分析）没有直接关系。,[],Céline Lavergne;Júlia Rodriguez-Puig;Clara Ruiz-González;María Montero-Curiel;Gemma Casas;Daniel Romano-Gude;Irene Alorda-Montiel;Júlia Dordal-Soriano;Aaron Alorda-Kleinglass;Marc Diego-Feliu;Javier Gilabert;Alex Campillo-de La Maza;Cristina Romera-Castillo;Natalia Torres-Rodriguez;Lars-Eric Heimbürger-Boavida;Jordi García-Orellana;Valentí Rodellas;Andrea G. Bravo,Unveiling Hidden Mercury and Methylmercury Sources: The Role of Submarine Groundwater Discharge in Coastal Lagoons,"Mercury loads from Submarine Groundwater Discharge (SGD) may represent an overlooked source of methylmercury (MeHg) to the ocean, affecting human and ecosystem health. The SGD process involves the flow of fresh, saline, or mixed groundwater from coastal aquifers into the oceans classified in different components. Existing studies rarely report the fluxes supplied by the different SGD components; therefore, the relevance of SGD as a source of mercury remains unclear. We aimed to quantify SGD-driven mercury/methylmercury fluxes to the coast, focusing on the largest coastal lagoon in the western Mediterranean. We measured total dissolved mercury and MeHg in surficial and porewaters during the summer and autumn. Porewaters were enriched in total dissolved Hg and MeHg compared to the lagoon. Lagoon shore waters and porewaters with a high concentration of labile dissolved organic matter were prone to MeHg formation and thus had higher MeHg concentrations. The mercury input through SGD to the Mar Menor lagoon (4300 mmol year–1) was similar to atmospheric deposition and 1 order of magnitude greater than the stream input. Among different components of the SGD,  long-scale lagoon water recirculation dominated. These findings have substantial implications for the regional Hg budget and raise awareness of the importance of considering the different SGD components for an accurate estimation of SGD-based Hg input to the coastal ocean."
10.1021/acs.est.5c07255,False,Environmental Science & Technology,该研究论文主要关注PM2.5的生物活性，特别是内毒素对PM2.5诱导的细胞因子IL-8的影响，以及内毒素的来源分析。虽然与空气质量相关，但它侧重于生物毒性而非大气环境遥感技术，如卫星观测或大气成分分析。因此，它与大气环境遥感技术的关联性不强。,"['PM2.5', 'Endotoxin', 'Bioactivity', 'Air quality', 'Source apportionment']",Jinyan Yu;Tian Chen;Yong Han;Xintong Liu;Junrong Su;Polly Hang Mei Leung;Frank Kelly;Kin-fai Ho;Guangbo Qu;Ling N. Jin,"Disproportionately Higher Contribution of Endotoxin to PM2.5 Bioactivity than Its Mass Share Highlights the Need to Identify Low-Concentration, High-Potency Components","The contribution of microbial components and their sources to the bioactivity of airborne fine particulate matter (PM2.5) remains unclear. This study validated the concentration-additive mixture effects of ambient PM2.5 fractions on in vitro interleukin-8 (IL-8) induction, enabling quantification of the role of endotoxin from Gram-negative bacteria in IL-8 induction by PM2.5 from contrasting environments. Endotoxin consistently contributed to PM2.5-induced IL-8 at both the coastal site (0.1–10%) and the urban site (0.1–17%), far exceeding its mass fraction in PM2.5 (<0.0001%). Among reported components, endotoxin demonstrated the highest toxicity-to-mass contribution ratio (10,000:1–100,000:1) due to its high potency. This suggests that reducing PM2.5 toxicity may not necessarily require a proportional reduction in its mass. The sources of Gram-negative bacteria shifted from predominantly natural origins at the coastal site (natural-to-anthropogenic ratio of 1.6:1) to increasing anthropogenic contributions at the urban site (natural-to-anthropogenic ratio of 0.7:1). These anthropogenic sources, including the built environment, sewage treatment, and humans, fall outside conventional pollution-intensive categories. These findings highlight the importance of identifying high-potency, low-concentration components and their sources. Targeting such components is critical for cost-effective PM2.5 abatement strategies and achieving significant public health benefits, especially in regions with low-to-moderate PM2.5 levels."
10.1021/acs.est.5c06078,False,Environmental Science & Technology,这篇论文主要关注的是利用机器学习和流动成像显微技术来自动监测淡水系统中的藻类繁殖。它开发了一个图像处理流程，用于实时监测天然淡水系统中的藻类，重点在于解决水生样本自动成像中的挑战，例如失焦颗粒和背景物体，以及识别训练数据集中未表示的新物体。该研究与大气环境遥感技术（如空气质量监测、卫星观测和大气成分分析）关系不大，因为它主要关注水生环境中的生物监测。,"['algal blooms', 'freshwater systems', 'phytoplankton', 'flow-imaging microscopy', 'image classification', 'convolutional neural network']",Farhan Khan;Benjamin Gincley;Andrea Busch;Dienye L. Tolofari;John W. Norton;Jr.;Emily Varga;R. Michael McKay;Miguel Fuentes-Cabrera;Tad Slawecki;Ameet J. Pinto,Integrating Machine Learning with Flow-Imaging Microscopy for Automated Monitoring of Algal Blooms,"Real-time monitoring of phytoplankton in freshwater systems is critical for early detection of harmful algal blooms (HABs) to enable efficient response by water management agencies. This manuscript presents an image processing pipeline developed to adapt ARTiMiS, a low-cost automated flow-imaging device, for real-time algal monitoring in natural freshwater systems. This pipeline addresses several challenges associated with autonomous imaging of aquatic samples, such as flow-imaging artifacts (i.e., out-of-focus and background objects), as well as strategies to efficiently identify novel objects that are not represented in the training data set; the latter is a common challenge with the application of deep learning approaches for image classification in environmental systems. The pipeline leverages a random forest model to identify out-of-focus particles with an accuracy of 89% and a custom background particle detection algorithm to identify and remove particles that erroneously appear in consecutive images with >97 ± 2.8% accuracy. Furthermore, a convolutional neural network (CNN), trained to classify taxonomical classes, achieved 95% accuracy in a closed set classification. Nonetheless, the supervised closed-set classifiers struggled with the accurate classification of objects when challenged with novel particles, which are common in complex natural environments; this limits real-time monitoring applications by requiring extensive manual oversight. To mitigate this, three methods incorporating classification with rejection were tested to improve model precision by flagging irrelevant or unknown classes. Combined, these advances present a fully integrated, end-to-end solution for real-time HAB monitoring in natural freshwater systems, which enhances the scalability of automated detection in dynamic aquatic environments."
10.1021/acs.est.5c09252,True,Environmental Science & Technology,该研究论文探讨了森林过滤效应（FFE），即植物如何通过生物降解和光降解过程去除空气中的多环芳烃（PAHs）污染物，从而改善空气质量。虽然该研究主要关注植物叶片上的PAHs降解机制，但其结果与大气环境遥感技术密切相关。通过了解PAHs的降解速率和途径，可以更好地评估植物在改善空气质量方面的作用，并为大气成分分析和空气质量监测提供参考。例如，可以结合卫星观测数据，评估不同植被覆盖区域的PAHs浓度变化，从而更准确地评估森林过滤效应的实际效果。,"['air quality', 'polycyclic aromatic hydrocarbons (PAHs)', 'biodegradation', 'photodegradation', 'atmospheric composition', 'forest filter effect']",Elisa Terzaghi;Corinne Bertipaglia;Elisabetta Zanardini;Davide Siniscalchi;Renzo Bagnati;Alice Passoni;Laura Rampazzi;Cristina Corti;Josè-Julio Ortega-Calvo;Rosa Posada-Baquero;Antonio Di Guardo,Forest Filter Effect Revisited: First Evidence That Polycyclic Aromatic Hydrocarbon Metabolites Are Produced on Leaves by Biodegradation and Photodegradation,"Plants are considered “nature-based solutions” for the improvement of air quality. Through the so-called forest filter effect (FFE), they can remove both gas and particulate matter (PM) associated organic contaminants, such as polycyclic aromatic hydrocarbons (PAHs) from air, reducing their concentrations. In this work, new aspects of FFE were investigated through several laboratory experiments of increasing complexity. More specifically, the study was designed to evaluate for the first time the contribution of light and phyllosphere microbial communities of Quercus ilex leaves to the degradation of deuterated PAHs (naphthalene-d8, acenaphthene-d10, phenanthrene-d10, pyrene-d10, chrysene-d12, and perylene-d12). Such degradation was investigated by observing the production of deuterated PAH hydroxy metabolites (OH-PAHs). OH-PAHs were produced in both  light and dark conditions, while their appearance in sterile controls was negligible, highlighting the importance of leaf-associated microorganisms in the degradation of parent PAH. The number of PAH metabolites and their isomers increased when entire leaves were used rather than the inoculated phyllosphere microorganisms only, confirming the degradation ability of native phyllosphere microbial communities. Although preliminary, these results showed that FFE can be enhanced by photo- and biodegradation processes. The continuous removal of PAHs through degradation could result in an enhanced PAH concentration gradient and flux of deposition  to leaves."
10.1021/envhealth.5c00117,False,Environment & Health,该研究主要关注环境因素和遗传因素对孕妇和胎儿健康的影响，特别是探讨环境暴露（包括新兴污染物）与妊娠相关疾病之间的关系。研究侧重于生物样本分析和环境暴露评估，以了解环境因素如何影响胚胎发育和妊娠结果。虽然研究提到了环境暴露，但其重点在于生物医学和流行病学方面，而非大气环境遥感技术，如空气质量监测、卫星观测或大气成分分析。,[],Jiaqi Zhu;Juan Chen;Kai Zhao;Qi Wang;Lei Jin;Lijun Pei;Furong Deng;Liyun Wang;Huimeng Liu;Yu You;Yaxin Wang;Rongrong Li;Linlin Cui;Shigang Zhao;Hongsong Yu;Xiao-Wen Zeng;Yonghong Tian;Guang-Hui Dong;Hui-Ping Zhang;Shaowei Wu;Xuejun Shang,"The China Birth Cohort-Environmental and Genetic Factors (CBC-EG) Study: Design, Aims, Protocol, Findings, and Prospects","Early life, including the embryonic period, is particularly vulnerable to environmental exposures. Previous studies have largely focused on the relationship between individual environmental factors and population health. In reality, individuals are exposed to multiple environmental factors, which together form an “exposome” that reflects the environmental influences on human health. Exposome-based analyses utilizing biological samples have been conducted in various countries to assess the impacts of environmental endocrine disruptors and other pollutants on maternal and fetal health during pregnancy, particularly in developed countries. However, large-scale cohort studies that comprehensively cover major maternal and fetal diseases during pregnancy to explore the environmental and genetic interactions affecting maternal and fetal health are still lacking in China. Currently, environmental exposure assessment and biomarker measurement are particularly complex, given the challenges posed by handling mixed exposure effects and the hidden threats posed by emerging contaminants. The China Birth Cohort-Environmental Genetic Factors (CBC-EG) study was established as a large, multicenter cohort study spanning 14 cities across China. A total of 101,437 pregnant women were recruited between 2013 and 2022. The objectives of this cohort study include analyzing the effects of environmental exposure levels and behavioral factors, monitored through external exposure assessments, on embryonic development and pregnancy-related diseases. Additionally, the study aims to explore the impact of environmental pollutants, monitored through internal exposure assessments, on embryonic development and pregnancy outcomes. A key focus of this research is to investigate the potential threats posed by emerging contaminants to maternal and fetal health, as well as to uncover environmental and genetic interactions and identify susceptibility loci."
10.1021/envhealth.5c00196,False,Environment & Health,该论文主要关注的是利用机器学习模型进行高通量筛选，以识别潜在的致肥胖化学物质（obesogens）。它基于不良结局通路网络（AONs），整合了多个通路来描述化学物质诱导肥胖的机制。研究的重点在于构建一个预测模型，并验证其在识别与肥胖相关的化学结构和通路干扰方面的准确性。虽然论文涉及化学物质和生物通路，但与大气环境遥感技术，如空气质量监测、卫星观测和大气成分分析等，没有直接关联。,[],Xiaoqing Wang;Yang Huang;Fei Li;Jin Wang;Chenglong Ji;Huifeng Wu;Yitao Pan;Jiayin Dai,Machine Learning Models for High-Throughput Screening of Obesogens Based on Pathway Network,"Metabolism-disrupting chemicals increase the incidence of obesity through diverse signaling pathways. It is critical to prioritize potential obesogenic factors and systematically profile their modes of action. Here, based on adverse outcome pathway networks (AONs), we established a machine learning screening system that integrated three adverse outcome pathways (AOPs) to describe the mechanisms of chemical-induced obesity for thousands of chemicals. Notably, optimal AON-informed machine learning models achieved an accuracy above 0.95 and identified amide, aromatic/polycyclic, and nitrogen-containing structures as obesity-related. In addition, polycyclic aromatic hydrocarbons were identified as prime candidate obesogens, inducing metabolic syndrome by interfering with all three signaling pathways across the AONs. Representative obesogens predicted in this study, such as antibiotics, insecticide metabolites, and exogenous chemical glucagon, were found to predominantly target membrane, mitochondrial, and nuclear receptor signaling pathways, respectively. Furthermore, top-prioritized chemicals (such as phenanthrene, azithromycin, 1,8,9-trihydroxyanthracene, etc.) according to ranking scores were randomly selected for experimental verification, and all selected candidates exhibited pathway interference in activating specific molecular initiating events (MIEs), demonstrating the predictive model’s accuracy. The developed high-throughput screening strategy can efficiently evaluate the potential obesogenic effects of emerging chemicals and provide guidance for the safe design of new chemicals."
10.1029/2025GL116020,True,Geophysical Research Letters,该研究论文探讨了北大西洋锋面后云层中气溶胶浓度和吸湿性对新粒子形成的影响。通过飞机测量和大规模涡流模拟，研究揭示了气溶胶粒径分布的日变化模式，并分析了高浓度累积模式气溶胶如何抑制新粒子形成对云滴活化的影响，从而影响降水和云反照率。研究使用了卫星观测数据进行验证，与大气环境遥感技术，特别是空气质量监测和卫星观测密切相关。,"['aerosol particle size distribution', 'aerosol hygroscopicity', 'cloud albedo', 'satellite observations', 'air quality']",F. Tornow;E. C. Crosbie;A. M. Fridlind;A. S. Ackerman;L. D. Ziemba;G. Elsaesser;B. Cairns;D. Painemal;S. Chellappan;P. Zuidema;C. Voigt;S. Kirschler;A. Sorooshian,High Accumulation Mode Aerosol Concentration and Moderate Aerosol Hygroscopicity Limit Impacts of Recent Particle Formation on Northwest Atlantic Post‐Frontal Clouds,"Postfrontal cloud regime transitions often result from strong aerosol‐cloud‐precipitation interaction. Using ACTIVATE measurements from 40 flights, we show a diurnal pattern of evolving aerosol particle size distributions (PSD) in the marine boundary layer upwind of clouds. A nucleation mode grows in size between 12 and 17 LT, likely from new particle formation (NPF), and an accumulation mode increases in concentration during daytime. Selecting the day of strongest size growth, we use quasi‐Lagrangian large‐eddy simulations to examine cloud impacts. With a morning PSD, moderate aerosol hygroscopicity aligns best with satellite and field campaign observational targets. Using a PSD near 17 LT, greater cloud droplet number concentrations delay the precipitation onset and keep albedo elevated for longer, primarily driven by increased accumulation mode concentrations, which facilitate an updraft‐limited regime and inhibit activation of smaller modes despite their growth after NPF. These results constitute a caveat for NPF‐related activation under polluted conditions."
