doi,is_relevant,journal,explanation,topic_words,authors,title,abstract
10.1029/2025JD043359,True,Journal of Geophysical Research: Atmospheres,该研究论文关注海洋飞沫的产生函数，特别是大尺寸飞沫（大于20微米）的产生，并利用自研的液滴谱仪在海-气边界层进行了观测实验。研究结果表明，现有模型低估了大尺寸飞沫的海盐气溶胶（SSA）通量。该研究为海洋模型中计算SSA通量提供了一个新的大尺寸飞沫产生函数。虽然论文没有直接提及遥感技术，但海盐气溶胶是重要的气溶胶类型，影响地球辐射平衡和云的形成，因此与大气环境遥感，特别是气溶胶监测和气候变化研究密切相关。通过卫星观测气溶胶的分布和性质，可以验证和改进这类海盐气溶胶产生函数，从而提高气候模型的准确性。,"['sea salt aerosol', 'SSA flux', 'marine droplets', 'air-sea boundary layer', 'climate change', 'air pollution', 'droplet spectrometer']",Xueling Cheng;Jiangbo Jin;Peng Fan;Run Guo;Yubin Ma;Jian Huang;Shouyin Zheng;Jiatian Chen;Hengchi Lei;Qingcun Zeng,The Sea Spray Generation Function for Large Droplets Based on Sea Salt Aerosol Flux Observation,"Marine droplets, as the largest natural aerosol source after sand and dust, can have a significant impact on climate change, air pollution, typhoons, and other disaster weather. At present, due to the lack of observational data and insufficient understanding of turbulent transport processes in the air‐sea boundary layer, there is considerable uncertainty in the generation function of sea spray droplets, especially for droplets with a particle size greater than 20 μm, most of the generation functions underestimate them. The multiple experiments on observing droplets were conducted in the air‐sea boundary layer using a self‐developed droplet spectrometer. The concentration and upward velocity of large droplets with particle sizes ranging from 25μm to 1.6 mm were obtained. The sea spray generation function was analyzed using the observed data, and the results showed that the sea salt aerosol (SSA) flux of large droplets was much higher than that given by existing sea spray generation functions, providing a new generation function for large droplets in calculating SSA flux in ocean models."
10.1038/s41467-025-58398-x,False,Nature Communications,"该研究论文主要关注的是通过双镍催化实现的炔烃二聚-氢芳基化反应，生成五取代的1,3-二烯。这是一种有机合成方法，与大气环境遥感技术（如空气质量监测、卫星观测和大气成分分析）没有直接关系。该研究侧重于化学反应机理和新型催化剂的开发，而非大气环境科学。",[],Ke Chen;Hongdan Zhu;Shuxin Jiang;Kuiling Ding;Qian Peng;Xiaoming Wang,"Alkyne dimerization-hydroarylation to form pentasubstituted 1,3-dienes via binuclear nickel catalysis","Inspired from bimetallic active sites in both enzymes and heterogeneous catalysts, the development of binuclear catalysis can offer the potential to induce novel intermediates, reactivity, and selectivity. Here the authors report a dimerization-hydrocarbofunctionalization of internal alkynes via dinickel catalysis, leading to the formation of pentasubstituted 1,3-dienes. 
 Mono-metallic catalysts dominate in homogeneous catalysis, wherein all the element steps generally occur on one metal site. Inspired from bimetallic active sites in both enzymes and heterogeneous catalysts, the development of binuclear catalysis can offer the potential to induce novel intermediates, reactivity, and selectivity. Metal-catalyzed hydroarylation of alkynes generally leads to one alkyne incorporated products and alkyne dimerization-hydrocarbofunctionalization is rather challenging via conventional mono-metallic intermediates. Herein, a highly selective dimerization-hydrocarbofunctionalization of internal alkynes is achieved via dinickel catalysis, leading to the formation of synthetically challenging pentasubstituted 1,3-dienes. Mechanistic studies suggest that each Ni site can promote distinct elementary steps of two alkynes to generate a di-vinyl di-Ni intermediate. Such a mode of “binuclear convergent catalysis” is fundamentally different from the traditional mono-metallic catalysis and may provide new understanding on binuclear synergistic effects at atomic and molecular level. Inspired from bimetallic active sites in both enzymes and heterogeneous catalysts, the development of binuclear catalysis can offer the potential to induce novel intermediates, reactivity, and selectivity. Here the authors report a dimerization-hydrocarbofunctionalization of internal alkynes via dinickel catalysis, leading to the formation of pentasubstituted 1,3-dienes."
10.1038/s41467-025-58419-9,False,Nature Communications,该论文主要涉及镍(II)配合物的酞菁衍生物的合成，以及对这些化合物的电子性质（如反芳香性和自由基特性）的实验和计算表征。论文关注的是新型酞菁衍生物的合成方法和化学性质，而不是大气环境遥感技术。因此，与空气质量监测、卫星观测或大气成分分析等主题没有直接关联。,[],Yuta Takiya;Taiga Saito;Naoyuki Toriumi;Masanobu Uchiyama,Synthesis of nickel(II)-containing <i>meso</i>-edited phthalocyanine derivatives,"In contrast to the rich chemistry of porphyrin, the structural variety of phthalocyanine derivatives, which are widely utilized in material and life sciences, has been limited by the lack of versatile synthetic methods. Here, the authors report a synthetic strategy for the meso-position editing of nickel(II)-containing phthalocyanine derivatives. 
 In contrast to the rich chemistry of porphyrin and its analogs, the structural variety of phthalocyanine derivatives, which are widely utilized in material and life sciences, has been limited by the lack of versatile synthetic methods. Herein we present a synthetic strategy/methodology for the meso-position editing of phthalocyanine derivatives via deprotonative macrocyclization of open-form acyclic phthalonitrile Ni tetramer 1, prepared by thiolate-mediated reductive tetramerization of phthalonitrile and metalation. To illustrate the utility of this protocol, we synthesize several meso-N-edited phthalocyanine derivatives, including 16π-electron antiaromatic tetrabenzodiazanorcorrole 2, and 17π-electron paramagnetic tetrabenzotriazacorrole 3 and tetrabenzodiazacorrole 4. The products are obtained as the nickel(II) complexes. Their unique electronic properties, such as paratropicity and radical character, are characterized both experimentally and computationally. Moreover, antiaromatic compound 2 undergoes further meso-position and skeletal transformations upon reaction with nucleophiles to give nonaromatic and aromatic π-conjugates. In contrast to the rich chemistry of porphyrin, the structural variety of phthalocyanine derivatives, which are widely utilized in material and life sciences, has been limited by the lack of versatile synthetic methods. Here, the authors report a synthetic strategy for the meso-position editing of nickel(II)-containing phthalocyanine derivatives."
10.1038/s41612-025-01017-9,False,npj Climate and Atmospheric Science,该研究论文主要关注青藏高原最大湖泊色林错的入湖水量变化，以及温度和降水对入湖水量的不同影响。虽然气候变化（温度和降水）与大气环境有关，但该研究并未直接涉及大气环境遥感技术，如空气质量监测、卫星观测或大气成分分析。因此，该论文与大气环境遥感技术的关联性不强。,[],Yuanwei Wang;Lingxiao Wang;Lei Wang;Ting Li;Jing Zhou;Xiaoyu Guo;Zhaoyan Xie;Sichen Lin;Ying Hong;Lin Zhao,Divergent effects of temperature and precipitation on water flow into the largest lake on the Tibetan Plateau,"Divergent effects of temperature and precipitation on water flow into the largest lake on the Tibetan Plateau 
 The majority of lakes on the TP have expanded in an accelerated manner, changing the regulation of local water cycles and ecosystems. Here, spatiotemporal changes in inflow to Selin Co (the largest lake on the TP) from 1979 to 2022 were modeled, and the impacts of warming and wetting on water volume were explored. The modeled annual mean lake inflow was 2.27 km3, accompanied by a significant growth trend of 0.035 km3/yr (p < 0.01, the contributions of warming and wetting are −0.016 and 0.048 km3/yr respectively). Warming (+0.0386 K/yr) caused a decrease of 0.33 km3 in lake inflow per year, accounting for 14.5% of the annual mean water volume, while wetting (+4.46 mm/yr) caused an increase of 0.91 km3 in lake inflow per year, accounting for 40% of the annual mean value. These divergent effects of increasing temperature and precipitation on lake inflow makes it more difficult to predict the future water resources of basins such as Selin Co."
10.1038/s43247-025-02213-4,False,Communications Earth & Environment,该论文主要研究早期成岩过程中黄铁矿的形成路径，通过分析沉积物中黄铁矿的铁和硫同位素组成来推断沉积环境中的微生物和物理化学过程。研究重点在于地球化学过程和微生物活动对黄铁矿形成的影响，与大气环境遥感技术（如空气质量监测、卫星观测和大气成分分析）没有直接关联。,[],Virgil Pasquier;Johanna Marin-Carbonne;Thomas Giunta;Livio Ruffine;Itay Halevy,Microscale iron and sulphur isotopic compositions reveal pyritization pathways during early diagenesis,"Pyrite iron and sulfur isotopic compositions constrain the pyritization pathway and microbial and physicochemical aspects of sedimentary depositional environments, according to pyrite samples from a sedimentary core in the Danube River. 
 Sedimentary pyrite iron and sulphur isotope compositions (δ56FePYR, δ34SPYR, Δ33SPYR) are commonly used to reconstruct global ocean properties and the evolving oxidation state of Earth’s surface, motivating exploration of impacts of diagenesis on pyrite-based proxies. Along with auxiliary petrographic and porewater data, we present coupled microscale δ56FePYR-δ34SPYR-Δ33SPYR in accumulating sediments on the oxic margin of the Black Sea. The coevolution of microscale δ56FePYR-δ34SPYR-Δ33SPYR distributions provides insight into porewater S species production, consumption, and buildup on pyritization pathways. “Early” pyrite is characterized by low δ56FePYR and δ34SPYR values consistent with microbially-mediated iron and sulphate reduction and iron (oxyhydr)oxide sulphidization at low sulphide-to-iron ratios. In contrast, “sulphidic zone” pyrite displays distinct late-stage morphologies and higher δ56FePYR and δ34SPYR, which reflect sulphide accumulation at the sulphate-methane transition zone and direct sulphidization of residual iron phases. We propose that coupled δ56FePYR-δ34SPYR-Δ33SPYR distributions constrain pyritization pathways and microbial and physico-chemical aspects of the depositional environment. Pyrite iron and sulfur isotopic compositions constrain the pyritization pathway and microbial and physicochemical aspects of sedimentary depositional environments, according to pyrite samples from a sedimentary core in the Danube River."
None,False,Remote Sensing of Environment,该论文主要关注使用深度学习方法分析遥感时间序列数据。虽然遥感技术可以用于大气环境监测，但从标题和摘要来看，该论文更侧重于深度学习算法本身及其在遥感数据处理中的应用，而没有明确提及大气成分分析、空气质量监测或特定卫星/传感器的应用。因此，它与大气环境遥感技术的关联性较弱。,"['deep learning', 'remote sensing', 'time series data analysis']",Hankui K. Zhang;Gustau Camps-Valls;Shunlin Liang;Devis Tuia;Charlotte Pelletier;Zhe Zhu,Preface: Advancing deep learning for remote sensing time series data analysis,
None,False,Remote Sensing of Environment,该论文主要关注利用遥感技术监测快速盐碱化的沿海景观，核心方法是非线性光谱解混。虽然使用了遥感技术，但其应用领域是地表环境监测，而非大气环境遥感，因此与空气质量监测、卫星大气成分观测等大气环境遥感技术关联不大。,"['spectral unmixing', 'salinization', 'coastal landscapes', 'remote sensing']",Manan Sarupria;Rodrigo Vargas;Matthew Walter;Jarrod Miller;Pinki Mondal,"Corrigendum to “Non-linear spectral unmixing for monitoring rapidly salinizing coastal landscapes” [Remote Sensing of Environment Volume 319, 15 March 2025, 114642]",
None,False,Remote Sensing of Environment,由于只提供了标题“Editorial Board”和摘要“Abstract:”，没有关于研究内容的信息，因此无法判断该论文是否与大气环境遥感技术相关。无法提取任何主题词，也无法提供关于论文本身的解释。,[],,Editorial Board,
10.1016/j.jag.2025.104510,False,International Journal of Applied Earth Observation and Geoinformation,该论文主要关注利用遥感技术中的光谱指数方法进行水体监测，评估了15种常用的水体探测指数在全球14个代表性区域的Sentinel-2影像上的表现。研究旨在为不同场景下水体指数的选择提供指导，并推荐了指数阈值的范围。论文讨论了水体指数在建筑物、阴影和雪等复杂背景下的局限性，并提出了未来水体指数发展的方向。因此，该论文与大气环境遥感技术（如空气质量监测、卫星观测和大气成分分析）没有直接关系，而是专注于地表水体的遥感监测。,"['water resources', 'remote sensing', 'water body monitoring', 'spectral indices', 'Sentinel-2 imagery']",Chuanwu Zhao;Haishuo Wei;Gudina Legese Feyisa;Thiaggo de Castro Tayer;Gelilan Ma;Hanyi Wu;Yaozhong Pan,Evaluating spectral indices for water extraction: Limitations and contextual usage recommendations,"•A comprehensive evaluation of water indices under complex scenarios. •MBWI, AWEInsh, and TCW are the top three performers. •Provided recommended threshold ranges and suitable scenarios for each water index. •Indices need improvement to reduce interference from buildings, shadows and snow. •Future study should develop indices capable of describing various water body states. 
 With the intensification of climate change and human activities, water resource shortages, floods, and water quality anomalies are becoming increasingly serious. It is urgent to ensure the effective realization of water resource management, flood monitoring, and water quality assessment through fine-scale monitoring of water body spatial distribution and dynamics. Currently, various technologies have been applied to water information monitoring, with remote sensing-based spectral index methods being widely used due to their simplicity, low cost, and large-scale observation capabilities. However, the wide variety of existing water spectral indices, each suited to different scenarios and objectives, makes it challenging for ordinary users to select the most appropriate index and determine its optimal usage (i.e., threshold settings). This study addresses these challenges by evaluating the performance and applicability of 15 widely used water detection indices, using Sentinel-2 imagery across 14 representative global regions. The results revealed that the performance of water indices varied across different scenarios. Common issues include misidentification in high-reflectance backgrounds (e.g., buildings and snow), low-reflectance backgrounds (e.g., shadows), and omission errors for water bodies with high chlorophyll content. On this basis, this study provides a recommended table for water body index selection in different scenarios and a recommended range table for index thresholds, and point out key directions for future development of water body indices. This study offers valuable guidance for the selection and use of water body indices in practical application, helping to enhance the accuracy and efficiency of fine-scale monitoring of water bodies."
None,False,International Journal of Applied Earth Observation and Geoinformation,由于只提供了标题“编委会”和摘要“摘要：”，没有足够的信息来判断该研究论文是否与大气环境遥感技术相关。因此，无法确定其主题词，也无法提供关于论文本身的中文解释。,[],,Editorial Board,
10.1016/j.atmosenv.2025.121195,True,Atmospheric Environment,该研究论文探讨了甲苯、二氧化氮和氨在氧化铁/氧化铝颗粒上的非均相反应，重点关注污染物浓度和温度变化对含氮有机化合物（NOCs）形成的影响。虽然论文没有直接提及遥感技术或卫星观测，但其研究结果对于理解大气成分、空气质量以及多组分反应系统具有重要意义。通过了解这些反应过程，可以为大气环境监测和空气质量模型的改进提供科学依据，从而间接支持遥感技术的应用，例如通过地面观测数据验证卫星遥感结果。,"['N-containing organic compounds (NOCs)', 'Toluene', 'NO2', 'NH3', 'α-Fe2O3/α-Al2O3 particles', 'Heterogeneous reactions', 'Air quality', 'Atmospheric composition']",Sijie Wen;Xiang He;Aiyilaiti Kudesi;Shuangxi Wang;Xin Liu;Mingsong Dong;Xiaolong Yu,Heterogeneous reactions of toluene/NO<sub>2</sub>/NH<sub>3</sub> on α-Fe<sub>2</sub>O<sub>3</sub>/α-Al<sub>2</sub>O<sub>3</sub> particles: The effects of pollutant content and temperature changes on the formation of N-containing organic compounds (NOCs),"•Organic nitrates can be formed during the reaction of toluene/NO2/NH3on α-Fe2O3/α-Al2O3particles. •Pollutant content play a significant role in forming N-containing organic compounds (NOCs) during the heterogenous reactions. •Low temperature promotes adsorbed NO2reacting with benzyloxy radicals to form NOCs. 
 Heterogeneous reactions of toluene with mineral oxides play a crucial role in the formation processes of N-containing organic compounds (NOCs). However, less attention was paid to the effects of pollutant content and temperature changes on the formation of NOCs under combined pollution. In this study, the combined effects on the heterogeneous reaction of toluene/NO2/NH3 with α-Fe2O3/α-Al2O3 particles were investigated by using diffuse reflectance infrared Fourier transform spectroscopy (DRIFTS). The results show that the characteristic peak of the R-ONO2 group appears at 1295 cm−1, indicating benzyl nitrate formation in the presence of α-Fe2O3 with or without α-Al2O3. The addition of α-Al2O3 promotes the R-ONO2 formation on the particle surface compared to pure α-Fe2O3 as a result of the dispersion and oxidation of the additional particles. The optimal mass ratio of α-Fe2O3 and α-Al2O3 particles is 3:1. Furthermore, the optimal concentration ratio for toluene, NO2 and NH3 is determined as 2.5:2.5:1. It is obvious that NO2 and toluene are the primary sources of organic nitrates production. Higher concentration proportions of NO2 and toluene within a certain range lead to higher formation amounts of NOCs during the heterogeneous reaction. Spectral analysis demonstrates that reaction kinetics, such as reaction rate and uptake coefficient, are sensitive to temperature variations. When temperature decreases from 298 K to 253 K, the reaction rate increases from (1.59 ± 0.04) × 1018 ions g−1 s−1 to (2.38 ± 0.02) × 1018 ions g−1 s−1. Low temperature favors the production of R-ONO2, resulting from an exothermic process during the heterogeneous reaction. These findings are helpful for further exploring the combined effects on particulate NOCs formation and partly contribute to understanding of multicomponent reaction systems in real environment conditions."
10.1016/j.atmosenv.2025.121189,False,Atmospheric Environment,"该研究主要关注燃烧产生的颗粒物中醌类物质的光化学反应，以及这些反应如何产生活性氧（ROS），如羟基自由基和单线态氧。研究侧重于不同醌类物质（如9,10-蒽醌、1,4-蒽醌和1,4-萘醌）在光照下的不同反应路径和产物，以及它们对大气中ROS的影响。虽然该研究与大气环境相关，但它更侧重于化学反应机理和产物分析，而不是遥感技术、卫星观测或大气成分的宏观监测，因此与大气环境遥感技术的直接关联性较弱。","['ROS', 'hydroxyl radicals', 'singlet oxygen', 'quinones', 'combustion-derived particles', 'photochemistry', 'photocatalysis']",Desiree J. Sarmiento;Brian J. Majestic,The photochemistry of quinones and combustion-derived particles in forming hydroxyl radicals and singlet oxygen in the atmosphere,"•Combustion-derived particles contain various photosensitizers that form ROS. •9,10-anthraquinone and juglone act as photocatalysts in forming hydroxyl radicals. •Singlet oxygen formed from quinone photolysis is used to form other products. •1,4-naphthoquinone and juglone degrade into oxidized products that form ROS. 
 Polycyclic aromatic hydrocarbons (PAHs) are byproducts of combustion processes and can undergo photooxidation in cloud water upon being emitted into the atmosphere. Quinones are among the products formed from the photochemical aging of PAHs and can undergo subsequent reactions to form environmentally persistent free radicals (EPFRs) and reactive oxygen species (ROS). This study showed that 9,10-anthraquinone (9,10-ANTQ), 1,4-anthraquinone (1,4-ANTQ), and 1,4-naphthoquinone (1,4-NAPQ) undergo different pathways when forming ROS. Singlet oxygen (1O2), which was monitored during the photoaging of these quinones, formed logarithmically over time in low yields (0.5 ± 0.1 μM M−1 to 1.6 ± 0.1 μM M−1) with 9,10-ANTQ and 1,4-ANTQ. However, with 1,4-NAPQ, it formed rapidly within the first 5 min, reaching high yields of 21 ± 7 μM M−1, before undergoing decay. This work suggests that 9,10-ANTQ can behave as a photocatalyst to continuously generate hydroxyl radicals (•OH) in the atmosphere; however, it will more likely exist in its triplet state (39,10-ANTQ∗) as an EPFR. Contrarily, 1,4-ANTQ and 1,4-NAPQ will photodegrade into other products that generate ROS. Among these products is juglone, which was shown to generate •OH exponentially upon photoaging as well as degrade into other products. The varying photochemical behaviors between these different quinones help explain the overall photochemistry of combustion-derived particles, which catalytically generated 1O2 and •OH in this study. This work provides insight into the environmental fates of combustion-derived material and their oxidized derivatives and shows the potential of these compounds to generate excess atmospheric ROS."
