doi,is_relevant,journal,explanation,topic_words,authors,title,abstract
10.1038/s41467-025-55828-8,False,Nature Communications,这篇论文主要研究Rab3GAP的生化和结构特性，以及其对Rab18鸟苷酸交换活性的影响。它关注的是细胞内的分子机制，特别是膜运输和脂滴代谢。文中利用冷冻电镜技术解析了Rab3GAP的结构，并通过突变分析探讨了其与疾病的关系。研究与大气环境遥感技术，例如空气质量监测、卫星观测和大气成分分析等，没有任何关联。,[],Gage M. J. Fairlie;Kha M. Nguyen;Sung-Eun Nam;Alexandria L. Shaw;Matthew A. H. Parson;Hannah R. Shariati;Xinyin Wang;Meredith L. Jenkins;Michael Gong;John E. Burke;Calvin K. Yip,Biochemical and structural characterization of Rab3GAP reveals insights into Rab18 nucleotide exchange activity,"Rab3GAP, a guanine nucleotide exchange factor for Rab18, regulates membrane trafficking and lipid droplet metabolism. The authors elucidated its molecular structure, mapped its potential substrate binding interface, and uncovered that disease-associated mutations likely impair Rab18 binding. 
 The heterodimeric Rab3GAP complex is a guanine nucleotide exchange factor (GEF) for the Rab18 GTPase that regulates lipid droplet metabolism, ER-to-Golgi trafficking, secretion, and autophagy. Why both subunits of Rab3GAP are required for Rab18 GEF activity and the molecular basis of how Rab3GAP engages and activates its cognate substrate are unknown. Here we show that human Rab3GAP is conformationally flexible and potentially autoinhibited by the C-terminal domain of its Rab3GAP2 subunit. Our high-resolution structure of the catalytic core of Rab3GAP, determined by cryo-EM, shows that the Rab3GAP2 N-terminal domain binds Rab3GAP1 via an extensive interface. AlphaFold3 modelling analysis together with targeted mutagenesis and in vitro activity assay reveal that Rab3GAP likely engages its substrate Rab18 through an interface away from the switch and interswitch regions. Lastly, we find that three Warburg Micro Syndrome-associated missense mutations do not affect the overall architecture of Rab3GAP but instead likely interfere with substrate binding. Rab3GAP, a guanine nucleotide exchange factor for Rab18, regulates membrane trafficking and lipid droplet metabolism. The authors elucidated its molecular structure, mapped its potential substrate binding interface, and uncovered that disease-associated mutations likely impair Rab18 binding."
10.1038/s41612-025-00895-3,True,npj Climate and Atmospheric Science,这篇论文研究了2023年春季中国西南地区前所未有的热浪和干旱事件对植被生产力产生的重大影响。研究利用多种卫星数据，例如：增强型植被指数（EVI）和总初级生产力（GPP），发现高温和干旱导致植被生产力下降，这种影响持续到8月份。论文特别关注了大气环流异常导致的升高的温度和降低的降水量如何加剧土壤水分短缺和大气蒸汽压亏缺（VPD），从而限制植被的光合作用。研究结果表明，森林生产力的下降主要受土壤水分异常的影响，而草原和农田生产力的下降则主要由异常高的VPD引起。该研究强调了复合热浪-干旱事件引起的低土壤水分和高VPD异常对植被生长的综合影响，并为未来评估区域极端气候事件对植被生长的影响提供了宝贵的见解。总的来说，该研究与大气环境遥感技术密切相关，利用卫星观测数据分析大气成分（温度、水汽等）和地表参数（土壤水分）的变化，从而监测干旱和热浪等极端气候事件对植被的影响。,"['atmospheric water vapor', 'temperature', 'vapor pressure deficit (VPD)', 'soil moisture', 'satellite-based remote sensing', 'vegetation index (EVI)', 'gross primary productivity (GPP)', 'drought monitoring', 'heatwave monitoring']",Zhikai Wang;Wen Chen;Jinling Piao;Qingyu Cai;Shangfeng Chen;Xu Xue;Tianjiao Ma,Synergistic effects of high atmospheric and soil dryness on record-breaking decreases in vegetation productivity over Southwest China in 2023,"Synergistic effects of high atmospheric and soil dryness on record-breaking decreases in vegetation productivity over Southwest China in 2023 
 Extreme climate events have increasingly threatened global terrestrial ecosystems in recent decades. In spring 2023, Southwest China (SWC) experienced unprecedented heatwaves and droughts. Using multiple satellite-based datasets, we found that these events led to the most significant declines in gross primary productivity (GPP) and the enhanced vegetation index (EVI) for the past two decades, with lagged effects persisting until August in the drought-affected area. Unlike the widespread and persistent drought of 2010, the record-breaking heatwaves in April and May 2023 sustained and intensified the drought stress. Elevated temperatures and suppressed precipitation, driven by anomalous atmospheric circulations, exacerbated the soil moisture (SM) shortages and increased the atmospheric vapor pressure deficit (VPD), restricting water availability and carbon uptake for vegetation photosynthesis. Our findings reveal that, during the 2023 extreme event in SWC, the decreases in forest productivity were primarily driven by low SM anomalies, while the decreases in the grassland and cropland productivity mainly resulted from abnormally high VPDs. This study highlights the combined effects of low SM and high VPD anomalies caused by a compound heatwave–drought event on vegetation growth in SWC and provides valuable insights for future assessments of regional extreme climate events on vegetation growth."
10.1038/s41612-024-00889-7,True,npj Climate and Atmospheric Science,这篇论文研究了含有气溶胶的干燥空气掺入对云微物理过程的影响。研究使用Pi对流云室实验，结果表明气溶胶掺入导致云滴浓度增加，平均半径减小，从而导致云滴谱变窄，相对分散度变小。虽然液水含量(LWC)显著增加，但这被认为是由于小云滴抑制了沉降去除。气溶胶浓度的增加降低了有效半径，最终增加了云的光学厚度和反照率。该研究与层积云顶部的气溶胶掺入有关，对理解气溶胶-云相互作用，特别是气溶胶对云、降水和气候的影响具有重要意义。其结果可用于改进气候模型中气溶胶-云相互作用的模拟，并为利用卫星遥感技术观测云特性和气溶胶分布提供参考。,"['Aerosols', 'Cloud properties', 'Satellite remote sensing', 'Cloud albedo', 'Optical thickness', 'Air quality', 'Climate change']",Jae Min Yeom;Hamed Fahandezh Sadi;Jesse C. Anderson;Fan Yang;Will Cantrell;Raymond A. Shaw,Cloud microphysical response to entrainment of dry air containing aerosols,"Cloud microphysical response to entrainment of dry air containing aerosols 
 Impacts of aerosol particles on clouds, precipitation, and climate remain one of the significant uncertainties in climate change. Aerosol particles entrained at cloud top and edge can affect cloud microphysical and macrophysical properties, but the process is still poorly understood. Here we investigate the cloud microphysical responses to the entrainment of aerosol-laden air in the Pi convection-cloud chamber. Results show that cloud droplet number concentration increases and mean radius of droplets decreases, which leads to narrower droplet size distribution and smaller relative dispersion. These behaviors are generally consistent with the scenario expected from the first aerosol-cloud indirect effect for a constant liquid water content (L). However, L increases significantly in these experiments. Such enhancement of L can be understood as suppression of droplet sedimentation removal due to small droplets. Further, an increase in aerosol concentration from entrainment reduces the effective radius and ultimately increases cloud optical thickness and cloud albedo, making the clouds brighter. These findings are of relevance to the entrainment interface at stratocumulus cloud top, where modeling studies have suggested sedimentation plays a strong role in regulating L. Therefore, the results provide insights into the impacts of entrainment of aerosol-laden air on cloud, precipitation, and climate."
10.1038/s41612-025-00897-1,False,npj Climate and Atmospheric Science,这篇论文研究的是美国龙卷风风暴的发生机制及其地理空间分布趋势。研究者利用聚类分析方法，根据近地面气象条件与大尺度天气形势的关系，对导致龙卷风的不同天气形势进行了分类。结果表明，美国东南部的龙卷风频次增加与强烈的上层天气系统扰动（例如，高值的上层涡动能和密集的Z500高度场分布）有关，而美国中部的某些地区龙卷风频次减少则与上层天气系统较弱的扰动有关。该研究主要关注的是天气形势的动力学特征及其与龙卷风发生频率变化之间的关系，并没有直接涉及大气环境遥感技术，例如空气质量监测、卫星观测或大气成分分析等。,"['synoptic patterns', 'tornadic storms', 'severe convective storms', 'upper-level eddy kinetic energy', 'Z500 fields', 'tornado frequency', 'clustering analysis']",Qin Jiang;Daniel T. Dawson II;Funing Li;Daniel R. Chavas,Classifying synoptic patterns driving tornadic storms and associated spatial trends in the United States,"Classifying synoptic patterns driving tornadic storms and associated spatial trends in the United States 
 Severe convective storms and tornadoes rank among nature’s most hazardous phenomena, inflicting significant property damage and casualties. Near-surface weather conditions are closely governed by large-scale synoptic patterns. It is crucial to delve into the involved multiscale associations to understand tornado potential in response to climate change. Using clustering analysis, this study unveils that leading synoptic patterns driving tornadic storms and associated spatial trends are distinguishable across geographic regions in the U.S. Synoptic patterns with intense forcing featured by intense upper-level eddy kinetic energy and a dense distribution of Z500 fields dominate the increasing trend in tornado frequency in the southeast U.S., generating more tornadoes per event. Conversely, the decreasing trend noted in certain regions of the central Great Plains is associated with weak upper-level synoptic forcing. These findings offer an explanation of observational changes in tornado occurrences, suggesting that the physical mechanisms driving those changes differ across regions."
10.1038/s41612-024-00883-z,False,npj Climate and Atmospheric Science,这篇论文研究了土地利用变化和全球变暖对海洋大陆地区极端降水模式的影响。它使用了社区地球系统模型 (CESM) 模拟来分析土地利用变化 (55 年) 和全球变暖 (200 年) 的影响。研究发现，土地利用变化导致的森林砍伐增加了地表温度，增强了大气不稳定性，导致强降水事件增多。全球变暖增加了大气的持水能力，进一步加剧了湿极端事件。研究揭示了“湿者更湿，干者更干”的模式，其背后的机制在土地利用变化和全球变暖下有所不同。总的来说，这项研究关注的是气候变化对极端降水的影响，并没有直接涉及大气环境遥感技术，例如空气质量监测、卫星观测和大气成分分析等。,"['precipitation', 'land use change', 'global warming', 'climate model', 'extreme weather']",Jie Hsu;Chao-An Chen;Chia-Wei Lan;Chun-Lien Chiang;Chun-Hung Li;Min-Hui Lo,Impact of land use changes and global warming on extreme precipitation patterns in the Maritime Continent,"Impact of land use changes and global warming on extreme precipitation patterns in the Maritime Continent 
 Land use changes (LUC) and global warming (GW) significantly impact the Maritime Continent’s (MC) hydro-climate, but their effects on extreme precipitation events are underexplored. This study investigates the impacts of LUC and GW on wet and dry extremes in the MC using Community Earth System Model (CESM)simulations, analyzing 55 years for LUC and 200 years for GW. We find that LUC-induced deforestation increases surface warming, enhancing atmospheric instability and favoring local convection, leading to more frequent heavy precipitation. Meanwhile, GW amplifies the atmosphere’s water-holding capacity, further intensifying wet extremes. Our findings reveal a “wet-get-wetter, dry-get-drier” pattern driven by different mechanisms: dynamic processes primarily influence wet extremes under LUC, while changes in evapotranspiration control dry extremes. In contrast, under GW, wet extremes are driven by dynamic processes, while dry extremes are influenced by reduced moisture availability and weakened atmospheric circulation. This highlights the need for land management to address rising extreme risks."
10.1038/s43247-024-01989-1,False,Communications Earth & Environment,这篇研究论文主要关注亚马逊红树林系统对海洋中钕和铪元素释放的贡献。研究通过对河口、海水和沉积物样本的化学分析，发现红树林系统向亚马逊沿海海水释放了大量的溶解钕，约占总输入量的64%。研究还探讨了红树林系统中孔隙水排放、铁锰氧化氢的溶解及其与海水的相互作用等过程。虽然研究提到了红树林系统对全球碳循环和气候变化的影响，但这与大气环境遥感技术，如空气质量监测、卫星观测和大气成分分析等关系不大。该研究主要集中在海洋生物地球化学循环方面。,[],Antao Xu;Ed Hathorne;Michael Seidel;Te Liu;Nils E. Asp;Andrea Koschinsky;Thorsten Dittmar;Martin Frank,The Amazonian mangrove systems accumulate and release dissolved neodymium and hafnium to the oceans,"Mangrove systems supply the equivalent of 64% of the neodymium input to Amazonian coastal seawater, according to chemical analyses of estuarine water, seawater and sediment samples from the Amazonian mangrove belt. 
 Mangroves are essential tropical ecosystems nurturing a wide range of marine biodiversity and counteracting global warming by sequestering atmospheric carbon dioxide. Hence, the export mechanisms and fluxes of particulate and dissolved organic carbon and trace elements from mangroves directly influence coastal productivity, the global carbon cycle and thus global climate, which are, however, not well constrained. Here we find consistent radiogenic neodymium and hafnium isotopic compositions of porewater, sedimentary iron-manganese oxyhydroxides and coastal seawater, suggesting that the Amazonian mangrove belt supplies trace elements through porewater discharge, dissolution of iron-manganese oxyhydroxides and their interactions with seawater. Together, these processes supply 8.4 × 106 g yr-1 dissolved neodymium, equivalent to 64% of the total sources of neodymium to the Amazonian coastal seawater. Globally, mangrove systems along the continental margins contribute 6–9% of the net neodymium input to the ocean, which is similar to the contributions from atmospheric deposition. A contribution of this magnitude is potentially also the case for other trace elements, given the strong correlations between neodymium and iron (Pearson r = 0.92), and manganese (r = 0.75) concentrations across the entire river-ocean section, emphasizing the crucial role of mangrove system inputs in micro-nutrient cycling. Mangrove systems supply the equivalent of 64% of the neodymium input to Amazonian coastal seawater, according to chemical analyses of estuarine water, seawater and sediment samples from the Amazonian mangrove belt."
10.1038/s43247-025-01993-z,False,Communications Earth & Environment,这篇论文研究了中国天目山亚热带季风区泥炭地过去千年来的碳通量变化。研究发现，尽管千年尺度上碳积累减少，但该泥炭地仍保持碳汇状态，气候变化导致的碳释放风险并不大。湿度和冬季温度是影响碳积累的重要气候因素，干旱促进了泥炭地的初始发育。本研究主要关注的是泥炭地生态系统对气候变化的响应，与大气环境遥感技术，例如空气质量监测、卫星观测和大气成分分析等关系不大。,[],Bin Liu;Hanxiang Liu;Ying Wang;Zicheng Yu;Yuwen Fu;Zhengyu Xia;Chengyu Miao;Jia Jia,A millennium of cold and humid climate decreased carbon accumulation in the subtropical monsoon peatland,"The risk of carbon release from the peatland carbon pool under natural climate change conditions is not substantial in the subtropical monsoon area, based on a reconstruction of fluxes of a mountainous peatland in Tianmu Mountain, China, over the past thousand years. 
 In the subtropical monsoon region of China, the climate differs from that of most northern peatlands, where many peatlands have developed in mountainous areas. However, it remains unclear how the carbon dynamics of these subtropical peatlands respond to climate change. Here, we reconstructed the net carbon fluxes of a typical mountainous peatland in Tianmu Mountain, eastern China, over the past thousand years. Humidity and winter temperature are two important climatic factors influencing carbon accumulation (Deviance explained 77.2%) and drought promotes Qianmutian peatland initial development. Despite the decline in carbon accumulation over the last millennium, the peatland’s net carbon balance remains in a ‘carbon sink’ state. This suggests that the risk of carbon release from the peatland carbon pool under natural climate change conditions is not substantial in the subtropical monsoon area. The risk of carbon release from the peatland carbon pool under natural climate change conditions is not substantial in the subtropical monsoon area, based on a reconstruction of fluxes of a mountainous peatland in Tianmu Mountain, China, over the past thousand years."
10.1038/s43247-024-01990-8,True,Communications Earth & Environment,这篇论文研究了天然地质渗漏和人为泄漏产生的甲烷气体排放的化学差异。研究发现，通过分析渗漏和储层气体的分子和同位素数据，可以识别出渗漏气体中烷烃分子比率的改变以及丙烷和二氧化碳的13C富集等六种化学变化。这些变化是渗漏的典型特征，而不会出现在开采和运输过程中可能泄漏的深层储层气体中。该研究提出的模型有助于区分大气或地面调查中分析的化石气体的来源，为未来区域天然气排放研究奠定基础。 这与大气环境遥感技术密切相关，因为该研究结果可用于改进大气甲烷浓度监测和来源识别的卫星观测和航空调查数据分析方法。,"['Atmospheric methane', 'Greenhouse gas', 'Isotopic analysis', 'Molecular ratios', 'Satellite observations', 'Airborne surveys', 'Source attribution', 'Fossil fuel emissions']",Lisa J. Molofsky;Giuseppe Etiope;Daniel C. Segal;Mark A. Engle,Methane-rich gas emissions from natural geologic seeps can be chemically distinguished from anthropogenic leaks,"Methane-producing gas seeps exhibit chemical differences from fugitive gas leaks, including altered molecular ratios and 13C enrichment of propane and carbon dioxide, according to analysis of molecular and isotopic data from seeps and reservoirs. 
 Fossil methane, a key component of the atmospheric greenhouse gas budget, is emitted by fugitive leaks from petroleum industry activities and natural geologic seepage. Since the gas from these two sources can exhibit similar isotopic compositions, differentiating them using atmospheric observations is often challenging. Here, we provide a conceptual model that helps distinguish the two sources. Using molecular and isotopic data from global seep and reservoir gas inventories, and new seep analyses from major hydrocarbon-bearing basins in California, we identify six post-genetic changes in gas chemistry. These changes include alterations of molecular ratios among alkanes (ethane, propane, and butane) and 13C enrichment of propane and carbon dioxide due to oxidation and secondary methanogenesis. Such changes are typical of seepage, and do not occur in deep reservoir gas that may leak during extraction and transport. Our model can aid in source attribution of fossil gas analyzed in airborne or field surveys and serve as a foundation for future work on regional emissions of natural gas. 
                
                  
                
               Methane-producing gas seeps exhibit chemical differences from fugitive gas leaks, including altered molecular ratios and 13C enrichment of propane and carbon dioxide, according to analysis of molecular and isotopic data from seeps and reservoirs."
10.1038/s43247-024-01991-7,True,Communications Earth & Environment,这篇研究论文使用自上而下的方法，结合多种数据源和地理加权回归，构建了东亚地区2012年至2021年高分辨率（1公里）的二氧化碳排放清单。这是一种大气环境遥感技术相关的研究，因为它利用了卫星观测或其他遥感数据来估算区域二氧化碳排放量，并分析其空间分布。研究结果揭示了中国北方和东部地区持续存在的二氧化碳排放热点，以及中国西北部新出现的排放热点，并分析了这些热点地区排放增长的驱动因素，为制定有针对性的区域碳减排策略提供了数据支持。该研究与空气质量监测和大气成分分析密切相关，因为它直接关注二氧化碳这种重要的温室气体在大气中的浓度和分布。,"['carbon dioxide', 'atmospheric composition', 'emission inventory', 'satellite observation', 'top-down approach', 'spatial distribution', 'air quality monitoring', 'high-resolution']",Lei Xia;Rui Liu;Wenxuan Fan;Changxu Ren,Emerging carbon dioxide hotspots in East Asia identified by a top-down inventory,"Continued growth of carbon dioxide emissions occurred across Northern and Eastern China in the period 2012-2021, and a new growth hotspot emerged in Northwest China, according to a high-resolution top-down emissions inventory for East Asia. 
 A high-resolution carbon dioxide emission inventory is essential for accurate carbon emission assessment and management. This study used a top-down spatial proxy model to develop a high-resolution (1 km) carbon dioxide emission inventory for East Asia from 2012 to 2021. Combining multiple data sources with geographically weighted regressions can improve the accuracy of the spatial distribution of sectors within carbon dioxide inventories. To demonstrate accuracy, we compared our inventory with existing carbon dioxide inventories, such as the Multi-resolution Emission Inventory for China, which uses a ‘bottom-up’ approach. We outline and discuss the convergence and divergence in the estimation results of the different approaches, finding generally consistent results. Based on the high-resolution carbon dioxide grid, nationally, China accounted for over 80% of East Asia’s carbon dioxide emissions, followed by Japan and South Korea. The results of the hotspot and driver analyses reveal persistent hotspots in Northern and Eastern China, as well as new trends in Northwestern China. The main drivers of emissions growth in hotspots are economic growth and changes in the energy mix. The drivers of emission changes in cold hotspot regions vary depending on regional characteristics. Actionable insights are provided for targeted regional carbon reduction strategies. Continued growth of carbon dioxide emissions occurred across Northern and Eastern China in the period 2012-2021, and a new growth hotspot emerged in Northwest China, according to a high-resolution top-down emissions inventory for East Asia."
