doi,is_relevant,journal,explanation,topic_words,authors,title,abstract
10.1016/j.atmosenv.2025.121180,True,Atmospheric Environment,该研究利用CMIP6模型分析了1980-2014年印度地表臭氧的变化情况。研究将模型输出与AIRS卫星数据进行比较，评估了模型的可靠性。结果表明，印度地表臭氧呈现南北梯度差异，北部较高。大部分模型显示印度地表臭氧呈上升趋势，但印度恒河平原中部地区呈下降趋势。对前体气体的分析表明，印度前体气体呈显著上升趋势，恒河平原是热点区域。研究还揭示了印度主要受VOC限制，而恒河平原受NO/NO2限制，解释了尽管NO/NO2排放增加，地表臭氧却下降的现象。该研究强调了CMIP6模型在理解地表臭氧变化中的作用，并突出了卫星数据作为补充资源的作用。该研究与大气环境遥感技术密切相关，因为它使用了卫星观测数据（AIRS）来验证模型结果，并分析了大气成分（臭氧及其前体气体）的时空变化，从而服务于空气质量监测和大气成分分析。,"['surface ozone', 'CMIP6 models', 'AIRS', 'precursor gases', 'VOC-limited regimes', 'NO/NO2-limited chemistry', 'air quality monitoring', 'satellite observations', 'atmospheric composition analysis']",Arshitha Anand K A;Dilip Ganguly;Sushovan Ghosh;Vijay Kumar Soni;Sagnik Dey,Insights into surface ozone variability in India (1980–2014) through CMIP6 model analysis,"•The CESM2-WACCM-FV2 model is identified as the best for studying surface O3in India. •AIRS data is a reliable source for surface O3, followed by MME. •A positive trend in surface was O3observed across India, except in central parts of IGP. •VOC-limited regimes dominate India, with rising NO/NO2in IGP reducing surface O3. 
 This study investigates long-term (1980–2014) surface ozone (O3) variability over India using Coupled Model Intercomparison Project Phase 6 (CMIP6) models, offering a comprehensive spatial assessment crucial for addressing air quality and climate change challenges. Model outputs were compared with Atmospheric Infrared Sounder (AIRS) derived surface O3 to evaluate their reliability. Results reveal a persistent north-south gradient in surface O3, with higher values over northern India, consistent with satellite data. Most models indicate a positive trend in surface O3 across the country, while a negative trend is identified over parts of the central Indo-Gangetic Plain (IGP), a previously unreported phenomenon. Analysis of precursor gases shows significant positive trends over India, with the IGP emerging as a hotspot. Spatial correlations between surface O3 and its precursors highlight regional heterogeneity and complex formation dynamics. VOC-limited regimes dominate across India, whereas NO/NO2-limited chemistry prevails in the IGP, explaining the decreasing trend of surface O3 despite rising NO/NO2 emissions. Among the CMIP6 models, CESM2-WACCM-FV2 is identified as the most reliable for studying surface O3 in India. The spatial distribution provided by CMIP6 models is particularly valuable in regions lacking long-term monitoring, where ground-based observations are limited to point-based measurements. This study underscores the critical role of CMIP6 models in understanding surface O3 variability and highlights the utility of satellite-derived data as a complementary resource. The findings provide actionable insights for policy efforts to mitigate surface O3 and its precursors, improving air quality and addressing climate challenges in India."
None,False,Atmospheric Environment,由于只提供了标题“Editorial Board”和摘要“Abstract:”，没有提供任何关于研究内容的信息，因此无法判断该论文是否与大气环境遥感技术相关。无法提取任何主题词，也无法用中文解释论文内容。,[],,Editorial Board,
10.1016/j.atmosres.2025.108091,True,Atmospheric Research,该研究论文主要探讨了中国东部地区云水中类腐殖质（HULIS）和水溶性有机碳（WSOC）的光学特性，以及它们在云水环境中的演变过程。研究通过分析HULIS和WSOC的浓度、紫外-可见吸收光谱和荧光光谱，揭示了它们在光吸收和成分上的差异。特别地，研究强调了云水环境如何促进HULIS的漂白或降解，并提出了蛋白质类物质的光解可能是形成低氧化HULIS的重要途径。虽然该研究没有直接涉及卫星观测或特定的遥感技术，但它对理解大气成分（特别是云中的有机物）以及空气质量具有重要意义，因为这些有机物会影响云的形成和光学特性，进而影响气候和辐射平衡。,"['HULIS', 'WSOC', 'Cloud Water', 'Optical Properties', 'Absorption', 'Fluorescence', 'Atmospheric Composition', 'Air Quality']",Xinghui Liu;Huiting Mao;Xiaoling Nie;Jiebo Zhen;Ping Du;Tao Li;Xinfeng Wang;Likun Xue;Yan Wang;Jianmin Chen,Characterizing optical properties of HULIS versus WSOC in cloud water of Eastern China - Insights into secondary formation in cloud processes,"•Quantifying the concentration of HULIS in cloud water and analyzing its proportion within the WSOC were conducted. •There are significant differences in the optical properties between HULIS and WSOC. •Cloud water environment enhances the bleaching or degradation of HULIS chromophores. •The photolysis of protein-like substances is an important pathway for the formation of less‑oxygenated HULIS. 
 Effects of humic like substances (HULIS) on cloud condensation nuclei, initiation of ice, and global radiative forcing of clouds highlight their significant influence on climate dynamics. However, optical properties of HULIS in cloud water and their indications remain poorly understood. Cloud water samples were gathered from June through August 2021 at Mt. Tai, China, and HULIS and water-soluble organic carbon (WSOC) within these samples were quantitatively analyzed. The optical characteristics of these substances were examined using UV–Vis and fluorescence spectroscopy. The average concentration of HULIS was 3.14 ± 2.14 mgC L−1 contributing 38 ± 15 wt% to WSOC (9.42 ± 7.50 mgC L−1). A mass absorption efficiency value at 365 nm (MAE365) of 0.72 m2 g−1 and an absorption Ångström exponent (AAE300–400) value of 3.79 were measured for HULIS compared to 0.54 m2 g−1 and 3.58 for WSOC. Three fluorescent components, i.e., less oxygenated HULIS (LO-HULIS), highly oxygenated HULIS (HO-HULIS), and protein-like substances (PRLIS), were identified in both HULIS and WSOC employing EEM and parallel factor analysis. HULIS light absorption was dominated by HO-HULIS, followed by that of LO-HULIS and PRLIS. Compared to WSOC, HULIS exhibited enhanced light absorption and a higher degree of humification, attributed to its elevated levels of HO-HULIS and LO-HULIS alongside reduced PRLIS. Furthermore, the degradation of PRLIS was posited as a potential pathway for LO-HULIS formation based on the increasing trend in the ratio of LO-HULIS:PRLIS with decreasing PRLIS in WSOC. This study explores secondary HULIS formation in cloud water, advancing our understanding of HULIS evolution."
None,True,Atmospheric Research,该研究论文的标题和摘要表明，它关注的是使用WRF-CHEM模型模拟印度上空的黑碳污染，并结合了最新的排放清单。黑碳是大气中的一种重要污染物，因此该研究与大气环境遥感技术密切相关，尤其是在空气质量监测和大气成分分析方面。该研究旨在通过模型模拟来评估黑碳的分布和来源，从而为空气质量管理和政策制定提供科学依据。,"['Black carbon', 'Air quality monitoring', 'Atmospheric composition', 'WRF-CHEM model', 'Emission inventories']",Rahul Sheoran;Sanhita Ghosh;U.C. Dumka;D.G. Kaskaoutis;R.E.P. Sotiropoulou;S.D. Attri;V.K. Soni;Suresh Tiwari;Siddharth Singh;Rahesh K. Tiwari,"Corrigendum to “Black carbon pollution over India simulated with recent emission inventories and WRF-CHEM model” [Atmospheric Research, 315 (2025) 107931].",
None,True,Atmospheric Research,该论文主要关注北极地区大气中水汽的含量，通过对比无线电探空仪和太阳光度计的观测数据，来研究综合水汽的测量结果。虽然该研究没有直接涉及空气质量监测或卫星观测，但它涉及大气成分（水汽）的分析，并且使用了遥感技术（太阳光度计），因此与大气环境遥感技术有一定的相关性。该研究对于理解北极地区的气候变化和大气过程具有重要意义。,"['integrated water vapor', 'radiosondes', 'sun photometer', 'Arctic', 'atmospheric composition']",Juan Carlos Antuña-Marrero;Roberto Román;Victoria E. Cachorroa;David Mateos;Carlos Toledano;Abel Calle;Juan Carlos Antuña-Sánchez;Ramiro Gonzalez;Manuel Antón;Javier Vaquero-Martínez;Ángel M. de Frutos Baraja,Corrigendum to “Integrated water vapor over the Arctic: Comparison between radiosondes and sun photometer observations” [Atmospheric Research 270 (2022) 1–9 /106059],
None,False,Atmospheric Research,由于只提供了标题“编委会”和摘要“摘要：”，没有足够的信息来判断该研究论文是否与大气环境遥感技术相关。因此，无法确定其是否涉及空气质量监测、卫星观测或大气成分分析等主题。需要提供更多关于研究内容的信息才能进行准确的评估。,[],,Editorial Board,
