doi,is_relevant,journal,explanation,topic_words,authors,title,abstract
10.1038/s41467-025-62458-7,False,Nature Communications,该研究论文主要关注通过气味功能测试和脑脊液α-突触核蛋白种子扩增来检测路易体病理。它与大气环境遥感技术（如空气质量监测、卫星观测和大气成分分析）没有直接关系。该研究旨在开发一种非侵入性的方法来诊断神经退行性疾病，而不是研究大气环境。,[],Sophie E. Mastenbroek;Lyduine E. Collij;Jacob W. Vogel;Serena Caldera;Geidy E. Serrano;Charles H. Adler;Claudia Marina Vargiu;Sebastian Palmqvist;Frederik Barkhof;Piero Parchi;Thomas G. Beach;Rik Ossenkoppele;Oskar Hansson,Two-step detection of Lewy body pathology via smell-function testing and CSF α-synuclein seed amplification,"CSF α-synuclein seed amplification assays detect Lewy body pathology accurately but are invasive and costly. Here, the authors show that a two-step workflow using smell-function prescreening maintained 94% accuracy while reducing CSF testing by 43%. 
 Cerebrospinal fluid (CSF) α-synuclein (α-syn) seed amplification assays (SAAs) can detect Lewy body pathology (LBP) with high accuracy but are invasive and costly. To address these challenges, this study evaluated a two-step workflow combining prescreening via smell-function testing with confirmatory CSF α-syn SAA testing only in individuals with reduced smell, for predicting postmortem LBP status. Among 358 autopsied participants, the two-step workflow predicted brain LBP with high accuracy overall (94%), and within clinical subgroups (clinical parkinsonism=95%; clinical Alzheimer’s disease [AD]=94%; clinically unimpaired [CU]=93%). It reduced the need for confirmatory CSF testing by 43% overall (23% clinical parkinsonism; 35% clinical AD; 80% CU). In an independent in vivo cohort (N=1209), the workflow predicted CSF α-syn SAA status with 79% accuracy and reduced CSF testing by 26%. This approach may reduce invasive CSF testing, alleviating patient burden and lowering healthcare costs. CSF α-synuclein seed amplification assays detect Lewy body pathology accurately but are invasive and costly. Here, the authors show that a two-step workflow using smell-function prescreening maintained 94% accuracy while reducing CSF testing by 43%."
10.1038/s41467-025-62314-8,False,Nature Communications,该研究论文主要关注一种快速、简便、经济的核糖体分离方法，用于结构和功能研究。论文描述了一种使用多聚赖氨酸快速分离活跃翻译核糖体的方法，适用于各种细胞和组织类型，并可用于质谱分析、冷冻电镜和体外翻译实验。该方法旨在简化核糖体分离过程，降低成本，并减少所需的生物材料量。因此，该论文与大气环境遥感技术（如空气质量监测、卫星观测和大气成分分析）没有直接关系。,[],Jessey Erath;Danielle Kemper;Elisha Mugo;Alex Jacoby;Elizabeth Valenzuela;Courtney F. Jungers;Wandy L. Beatty;Yaser Hashem;Marko Jovanovic;Sergej Djuranovic;Slavica Pavlovic Djuranovic,"A rapid, simple, and economical method for the isolation of ribosomes and translational machinery for structural and functional studies","Here, the authors present a method to rapidly isolate actively translating ribosomes in a time- and cost-effective manner using poly-lysine. The method is compatible with a wide variety of cell and tissue types and can be used for mass spectrometry, cryoEM, and in vitro translation assays. 
 Ribosomes are RNA-protein complexes essential for protein synthesis and quality control. Traditional methods for ribosome isolation are labor-intensive, expensive, and require a substantial amount of biological material. In contrast, our method, RNA affinity purification using poly-lysine (RAPPL), provides a rapid, simple, and cost-effective alternative applicable to various species and types of starting material (cell lysates, whole cells, organs, or whole organisms). It is also compatible with traditional isolation techniques. Here, we describe the use of RAPPL for rapid isolation, functional screening, and structural analysis of ribosomes and associated factors. We also demonstrate the application of RAPPL in investigating ribosome-associated resistance mechanisms in uropathogenic Escherichia coli samples and generating a 2.7-Å cryoEM ribosome structure from Cryptococcus neoformans. By significantly reducing the amount of the starting biological material and the time required for isolation, RAPPL has the potential to facilitate the study of ribosomal function, interactions, and antibiotic resistance and provide a versatile platform for academic, clinical, and industrial research. Here, the authors present a method to rapidly isolate actively translating ribosomes in a time- and cost-effective manner using poly-lysine. The method is compatible with a wide variety of cell and tissue types and can be used for mass spectrometry, cryoEM, and in vitro translation assays."
10.1038/s41558-025-02403-0,False,Nature Climate Change,该论文的标题和摘要表明，其主要关注的是亲环境行为的神经特征。这属于心理学或神经科学领域，研究的是大脑活动与环保行为之间的关系。与大气环境遥感技术（如空气质量监测、卫星观测和大气成分分析）没有直接关联。,[],Danyang Cheng,Neural traits of pro-environmental behaviour,"Neural traits of pro-environmental behaviour 
 "
10.1038/s41558-025-02401-2,False,Nature Climate Change,该研究论文主要关注飓风对经济增长的影响。虽然飓风是大气现象，但研究的重点是其经济后果，而不是利用大气环境遥感技术（如空气质量监测、卫星观测或大气成分分析）来研究飓风本身。因此，该论文与大气环境遥感技术的关联性较弱。,"['cyclones', 'economic growth', 'natural disasters', 'economic impact']",Lingxiao Yan,Cyclones and economic growth,"Cyclones and economic growth 
 "
10.1038/s41558-025-02404-z,False,Nature Climate Change,该标题和摘要主要关注北极地区高密度水体的形成过程。虽然大气过程可能对海洋产生一定影响，但该研究的核心内容与大气环境遥感技术（如空气质量监测、卫星观测和大气成分分析）没有直接关联。因此，该论文与大气环境遥感技术的关联性较低。,[],Bronwyn Wake,Stable Arctic dense water formation,"Stable Arctic dense water formation 
 "
10.1038/s41558-025-02402-1,False,Nature Climate Change,"该论文的标题和摘要表明，其主要关注点是工作时间调整对劳动力损失的影响。这与大气环境遥感技术，如空气质量监测、卫星观测和大气成分分析等领域没有直接关联。因此，该论文与大气环境遥感技术领域不相关。(The title and abstract of the paper indicate that its primary focus is on the impact of shifting work hours on labor loss. This is not directly related to atmospheric environmental remote sensing technologies such as air quality monitoring, satellite observations, and atmospheric composition analysis. Therefore, the paper is not relevant to the field of atmospheric environmental remote sensing technology.)",[],Tegan Armarego-Marriott,Shifting work hours reduces labour loss,"Shifting work hours reduces labour loss 
 "
10.1038/s41558-025-02406-x,False,Nature Climate Change,该论文主要关注科研方法的清晰报告，以提高科学研究的可靠性和可重复性，并缩短评审过程。论文强调了方法部分的要求，以实现更高效的出版流程。因此，该论文与大气环境遥感技术（如空气质量监测、卫星观测和大气成分分析）没有直接关系。,[],,Making the most of the Methods,"Clear methods reporting is key for reliable and reproducible science and can also prevent an extended review process. We highlight Methods section requirements for a more efficient publication process. 
 Clear methods reporting is key for reliable and reproducible science and can also prevent an extended review process. We highlight Methods section requirements for a more efficient publication process."
10.1038/s41612-025-01146-1,False,npj Climate and Atmospheric Science,该研究论文主要关注南亚地区极端高温事件的时空变化模式，以及驱动这些变化的陆地-大气相互作用。虽然研究涉及大气过程（如大气加热和环球遥相关），但其重点在于气候变化背景下热浪的演变和预测，而非直接利用大气环境遥感技术（如空气质量监测、卫星观测或大气成分分析）。因此，该论文与大气环境遥感技术的关联性较弱。,[],Abhirup Banerjee;Shraddha Gupta;Pranava Priyanshu;Ankan Kar;Ruby Saha;Tanujit Chakraborty;Dibakar Ghosh;Jürgen Kurths;Chittaranjan Hens,Recent changes in spatiotemporal patterns of heat extremes in South Asia,"Recent changes in spatiotemporal patterns of heat extremes in South Asia 
 The likelihood of intense heatwaves in South Asia is increasing due to climate change, highlighting the need to understand their evolving spatiotemporal patterns. Using a complex network-based approach, we analyze synchronous extreme heat events across South and West Asia over three 30-year periods: two historical phases (1960–1989, 1990–2019) and a near-future projection (2020–2049) under the SSP2-4.5 scenario. Our findings reveal a shift in heatwave synchronization from western and central Asia before 1990 towards Pakistan, northwest India, and the southwestern Tibetan Plateau by the mid-21st century. This shift is primarily driven by increased surface sensible heat flux, which enhances atmospheric diabatic heating and strengthens the early-summer circumglobal teleconnection. Additionally, atmospheric conditions over the North Atlantic-Greenland sector modulate South Asian heatwave synchronization. Our study provides novel insights into the evolving land-atmosphere interactions driving extreme heat events, with implications for heatwave predictability and risk assessment in a warming world."
10.1038/s41612-025-01179-6,False,npj Climate and Atmospheric Science,该研究论文主要关注年代际海洋变率对北半球热浪的影响，重点分析了大西洋多年代际涛动（AMO）和太平洋年代际涛动（IPO）等海洋现象如何调节热浪的强度和频率。虽然热浪与大气环境有关，但该研究的重点在于海洋对气候的影响，而非直接涉及大气环境遥感技术，例如空气质量监测、卫星观测或大气成分分析。因此，该论文与大气环境遥感技术的关联性较弱。,"['Heatwaves', 'Oceanic Variability', 'Climate Change', 'AMO', 'IPO']",Nan Lei;Xiaodan Guan;Yongkun Xie;Xiaohan Shen;Yuhang Ding;Jianping Huang,Decadal oceanic variability amplified recent heatwave in the Northern Hemisphere,"Decadal oceanic variability amplified recent heatwave in the Northern Hemisphere 
 The persistent increase in heatwaves has caused substantial economic and ecological damage. However, the contribution of decadal oceanic variability to the recent surge in heatwaves remains unclear. Here, using observations and simulations, we demonstrate that oceanic modulation drives decadal heatwave swings and trends. We quantify that the decadal component of heatwave cumulative intensity (HWCI) accounts for 57% of the observed increase in HWCI across the Northern Hemisphere from 2013 to 2021, with 44% attributed to increases in the smoothed component (HWCIS) and 13% to enhancements in the anomaly component (HWCIA). Notably, decadal oceanic variability contributed to 63% of the HWCI increase in the Northern Hemisphere during 2013–2021 and to 26% over 1985–2021. Regionally, oceanic modulation amplified HWCI by 58% in Europe, and contributed more than 20% in North Africa, southern North America, eastern China, and northern Central Asia during 2013–2021. The positive-to-negative phase transitions of the Atlantic Multidecadal Oscillation (AMO) and Interdecadal Pacific Oscillation (IPO) were identified as key drivers of this recent intensification. Model simulations incorporating AMO and IPO forcings closely align with observed HWCI decadal oscillations since 1940, further supporting these findings. Our results highlight that oceanic modulation can significantly amplify or dampen human-induced long-term heatwave trends, suggesting a potential slowdown in heatwave intensification in the coming decades as oceanic variability transitions to a new phase."
10.1038/s43247-025-02623-4,False,Communications Earth & Environment,该论文主要关注使用雷达卫星图像进行地震灾害评估，特别是建筑物损毁情况的测绘。它比较了雷达图像和光学图像在灾害评估中的表现，发现雷达图像在覆盖范围、时效性和准确性方面都优于光学图像。论文强调了雷达技术在灾害响应中的重要性，但与大气环境遥感技术（如空气质量监测、卫星观测和大气成分分析）没有直接关系。,[],Eleanor A. Ainscoe;Rohini Swaminathan;Lin Way;Sirio Modugno;Shi Tong Chin;Niroj Panta;Thierry Crevoisier;Sang-Ho Yun,Earthquake damage mapped more comprehensively and accurately by radar satellites than optical imagery,"Radar imagery can be used to map building damage from disasters more comprehensively and accurately than optical imagery, according to a systematic assessment of destruction following the 2023 Kahramanmaraş, Türkiye earthquakes. 
 Following a disaster, responders need to rapidly assess the extent of the damage. The prevailing view is that very-high-resolution optical satellite images can provide more accurate estimates of building damage than lower-resolution synthetic aperture radar (SAR). However, we demonstrate that SAR-based damage proxy maps we produced after the 2023 Kahramanmaraş Türkiye earthquakes outperformed comparable maps derived from optical imagery. This finding held true for both a state-of-the art machine learning method and for visual interpretation. The SAR-based maps achieved an F1 performance score approximately twice as high as the optical-based maps (0.47 vs 0.24, 0.23 and 0.15). Additionally, SAR offers established advantages in both coverage and timeliness: SAR was able to image the entire affected area within ten days, whereas the very-high-resolution optical dataset covered only 5.4% of the SAR-covered area during the same timeframe. Using the largest ground dataset that we know of for any event, we show that the damage distribution captured by our SAR-based maps strongly correlates with the ground observations over a wide range of spatial scales from neighbourhoods (~1 km2) to provinces (~10,000 km2). Based on this experience, we argue that any reliable remote sensing-based damage assessment system should incorporate radar to complement other techniques. Radar imagery can be used to map building damage from disasters more comprehensively and accurately than optical imagery, according to a systematic assessment of destruction following the 2023 Kahramanmaraş, Türkiye earthquakes."
10.1038/s43247-025-02614-5,False,Communications Earth & Environment,该研究论文主要关注的是地球上大型陆地滑坡的规模估算，并分析了地形环境对滑坡体积的影响。研究重点在于滑坡的体积、分布以及与火山、断层等地形环境的关系。虽然滑坡可能间接影响大气环境（例如，通过释放粉尘），但论文本身并未直接涉及大气环境遥感技术，如空气质量监测、卫星观测或大气成分分析。因此，该论文与大气环境遥感技术没有直接的关联。,[],Oliver Korup;Tomáš Pánek;Michal Břežný,Size estimates of Earth’s largest terrestrial landslides informed by topographic setting,"The size distribution and hazard of Earth’s largest terrestrial landslides vary distinctively with dominant topographic settings, with volcanoes and fault-bounded range fronts releasing the largest landslide volumes, according to analysis of Bayesian regression models of 411 large landslides. 
 Landslides regulate the height of mountains by releasing potential energy and reducing topographic relief. Yet, relief also limits the dimensions of small, frequent landslides in turn. But how local topography, lithology, and climate influence the size distribution and hazard of Earth’s largest terrestrial landslides remains unclear. Here we use Bayesian regression to estimate these effects on landslide volume, drawing on a worldwide sample of 411 cases, each involving > 1 km3. Nearly two third of their total volume is volcanic and sedimentary rocks within 50 km of active fault zones, clustered in actively uplifting mountain belts and on volcanic plateaus. Volumetric estimates vary most distinctly with dominant topographic setting, regardless of local relief, general rock type, or contemporary climate. These largely negligible effects indicate that volume scaling statistics fail to capture differing bulk lithological properties, let alone a detection bias due to climatic controls on land cover, weathering, or erosion. The size distribution and hazard of Earth’s largest terrestrial landslides vary distinctively with dominant topographic settings, with volcanoes and fault-bounded range fronts releasing the largest landslide volumes, according to analysis of Bayesian regression models of 411 large landslides."
10.1038/s43247-025-02621-6,False,Communications Earth & Environment,该论文主要关注水分解器和燃料电池中关键材料的可持续供应问题，包括镍、锆、铂、铱、钛、镧、钇和锶等材料。论文从供应中断风险、环境影响、社会影响、资源枯竭压力、循环性和可替代性六个维度评估了这些材料的可持续性。虽然能源生产和使用与大气环境有间接关系，但该论文并未直接涉及大气环境遥感技术，如空气质量监测、卫星观测或大气成分分析。,[],Dengye Xun;Ming Liu;Han Hao;Xin Sun;Yong Geng;Fengqi You;Hao Dou;Haoyang Li;Zhenyu Dong,Sustainable supply of critical materials for water electrolysers and fuel cells,"Supply disruption, environmental and social impacts, resource depletion, circularity, and substitutability influence the sustainable supply of critical raw materials for water electrolysers and fuel cells, according to a perspective assessing different fuel cells and critical raw materials. 
 Water electrolysers and fuel cells are key technologies for global energy transition. Many materials used in them are critical, facing supply challenges. We compile challenges and opportunities for the sustainable supply of these critical materials. Three types of electrolysers (alkaline, polymer electrolyte membrane, and solid oxide) and two types of fuel cells (polymer electrolyte membrane and solid oxide), along with eight associated critical materials (nickel, zirconium, platinum, iridium, titanium, lanthanum, yttrium, and strontium) are considered. Material supply sustainability is reviewed from six dimensions: supply disruption risk, environmental impact, social impact, resource depletion pressure, circularity, and substitutability. We show that the devices perform differently in the six dimensions. Major challenges for the alkaline electrolyser are resource depletion pressure and substitutability, while the challenge for polymer electrolyte membrane electrolysers is the supply disruption risk. Regarding solid oxide electrolysers, challenges are identified in supply disruption risk, resource depletion pressure, and circularity dimensions. Supply disruption, environmental and social impacts, resource depletion, circularity, and substitutability influence the sustainable supply of critical raw materials for water electrolysers and fuel cells, according to a perspective assessing different fuel cells and critical raw materials."
10.1038/s43247-025-02599-1,False,Communications Earth & Environment,该研究论文主要关注格陵兰冰川融化对沿海生产力和碳循环的影响，重点是冰川融水如何通过驱动上升流来影响浮游植物的生长和二氧化碳的吸收。虽然涉及了碳循环，但其核心内容与大气环境遥感技术（如空气质量监测、卫星观测和大气成分分析）没有直接关联。因此，该论文与大气环境遥感技术的关联性较弱。,[],Michael Wood;Dustin Carroll;Ian Fenty;Clément Bertin;Basil Darby;Stephanie Dutkiewicz;Mark Hopwood;Ala Khazendar;Lorenz Meire;Hilde Oliver;Tara Parker;Josh Willis,Increased melt from Greenland’s most active glacier fuels enhanced coastal productivity,"Melting from Greenland’s glaciers increases primary productivity in Qeqertarsuup Tunua by up to 40%, according to analysis of biogeochemical modelling. 
 Seasonal phytoplankton blooms in Greenland’s coastal waters form the base of marine food webs and contribute to oceanic carbon uptake. In Qeqertarsuup Tunua, West Greenland, a secondary summertime bloom follows the Arctic spring bloom, enhancing annual primary productivity. Emerging evidence links this summer bloom to subglacial discharge from Sermeq Kujalleq, the most active glacier on the Greenland Ice Sheet. This discharge drives localized upwelling that may alleviate nutrient limitation in surface waters, yet this mechanism remains poorly quantified. Here, we employ a high-resolution biogeochemical model nested within a global state estimate to assess how discharge-driven upwelling influences primary productivity and carbon fluxes. We find that upwelling increases summer productivity by 15–40% in Qeqertarsuup Tunua, yet annual carbon dioxide uptake rises by only  ~3% due to reduced solubility in plume-upwelled waters. These findings suggest that intensifying ice sheet melt may alter Greenland’s coastal productivity and carbon cycling under future climate scenarios. Melting from Greenland’s glaciers increases primary productivity in Qeqertarsuup Tunua by up to 40%, according to analysis of biogeochemical modelling."
10.1038/s43247-025-02603-8,False,Communications Earth & Environment,该研究论文主要关注气候变化对世界文化遗产的影响，侧重于温度和湿度变化对文化遗产地材料（如石头和木材）的威胁。虽然论文使用了气候数据和模型预测，但其核心在于评估和预测气候变化对文化遗产的损害，而非大气环境遥感技术本身。因此，它与空气质量监测、卫星观测或大气成分分析等大气环境遥感技术的关联性不强。,[],Zihua Chen;Qian Gao;Yajing Wu;Jiaxin Li;Xiaowei Li;Xiao Li;Zhenbo Wang;Haiyang Cui,World Cultural Heritage sites are under climate stress and no emissions mitigation pathways can uniformly protect them,"Approximately eighty percent of World Cultural Heritage sites already experience heat and moisture disturbances, and nearly nineteen percent of sites have stone or wood materials affected by the changing climate, according to an analysis that utilizes climate data and material inventories 
 Climate change increasingly threatens cultural heritage, yet global studies remain limited. Here we use an analytical hazard–vulnerability–exposure framework, combining global climate reanalysis and multi-model projections with site-level material inventories, to track climate stress on United Nations Educational, Scientific and Cultural Organization World Heritage sites in the past (1961–1990), present (2010–2040) and future (2070–2100). We find that 80% of sites already experience harmful heat and moisture disturbance, and nearly 19% are threatened on more than one key material such as stone and wood. A low-emission future (SSP1-2.6) could spare about 40% of at-risk sites, whereas a medium-emission (SSP2-4.5) future offers far less relief. Regional and material disparities persist, highlighting that no single mitigation pathway can uniformly protect all sites. The results guide resource prioritization and locally tailored protection strategies. Approximately eighty percent of World Cultural Heritage sites already experience heat and moisture disturbances, and nearly nineteen percent of sites have stone or wood materials affected by the changing climate, according to an analysis that utilizes climate data and material inventories"
