doi,is_relevant,journal,explanation,topic_words,authors,title,abstract
10.1029/2024GL111873,False,Geophysical Research Letters,这篇论文研究的是南极洲Thwaites冰架底部的融化速率，重点关注冰架底部热量的传输机制。研究发现，湍流驱动的垂直热通量不足以维持冰架底部融化速率，大部分热量是由大尺度平流环流驱动的横向通量提供的。该研究与大气环境遥感技术，例如空气质量监测、卫星观测和大气成分分析等，没有直接关系。研究主要集中在海洋和冰川相互作用，以及冰川融化对海平面上升的影响。,[],Peter E. D. Davis;Keith W. Nicholls;David M. Holland;Britney E. Schmidt;Peter Washam;Bieito Fernández Castro;Kiya L. Riverman;James A. Smith;Paul G. D. Anker;Andrew D. Mullen;Daniel Dichek;Elisabeth Clyne;Keith Makinson,"Lateral Fluxes Drive Basal Melting Beneath Thwaites Eastern Ice Shelf, West Antarctica","Thwaites Glacier is one of the fastest‐changing ice‐ocean systems in Antarctica. Basal melting beneath Thwaites' floating ice shelf, especially around pinning points and at the grounding line, sets the rate of ice loss and Thwaites' contribution to global sea‐level rise. The rate of basal melting is controlled by the transport of heat into and through the ice–ocean boundary layer toward the ice base. Here we present the first turbulence observations from the grounding line of Thwaites Eastern Ice Shelf. We demonstrate that contrary to expectations, the turbulence‐driven vertical flux of heat into the ice–ocean boundary layer is insufficient to sustain the basal melt rate. Instead, most of the heat required must be delivered by lateral fluxes driven by the large‐scale advective circulation. Lateral processes likely dominate beneath the most unstable warm‐cavity ice shelves, and thus must be fully incorporated into parameterizations of ice shelf basal melting."
10.1029/2024GL111203,False,Geophysical Research Letters,这篇论文研究的是海洋生物碳泵的效率及其地理变异性。它关注的是通过整合不同地区的颗粒有机碳通量数据，来分析生物碳泵将大气碳转移到海洋深处的效率。研究发现，目前观测数据中存在较大的局部不确定性，这掩盖了生物碳泵效率的纬度变化。因此，该研究与大气环境遥感技术，例如空气质量监测、卫星观测和大气成分分析等，关系不大。,[],A. Rufas;S. Khatiwala;K. M. Bisson;A. P. Martin;H. A. Bouman,Can We Constrain Geographical Variability in the Biological Carbon Pump's Transfer Efficiency From Observations?,"The biological carbon pump (BCP) transfers large amounts of carbon from the atmosphere into the ocean's interior, contributing to carbon sequestration. Studies on latitudinal variability in organic carbon transfer to depth have yielded inconsistent results, likely due to methodological differences. To address this, we compiled particulate organic carbon (POC) flux data and BCP metrics from time‐series locations across biogeographically distinct ocean regions. We integrated multiple BCP observational techniques, including diverse collection and processing protocols, capturing diverse facets of POC flux at varying spatio‐temporal resolutions. To ensure comparability, we harmonized errors and used Monte Carlo error propagation to calculate uncertainties consistently. Our analysis reveals large local uncertainties that obscure expected latitudinal variations in BCP metrics. While such variations may exist, they remain difficult to identify with current observational data. Our findings underscore the need for sustained POC flux observations, standardization of protocols, and intercalibration of technologies to identify geographic BCP patterns."
10.1029/2024GL111264,False,Geophysical Research Letters,这篇论文主要研究的是罗斯海夏季浮游植物的异常大规模繁殖现象。研究使用了高分辨率滑翔机采样技术，在2022-2023年 austral 夏季，观测到罗斯海西南部的浮游植物大量繁殖，持续时间超过一个月，垂直延伸至水柱上层100米。叶绿素浓度远高于以往夏季平均水平。研究推测，这种现象可能与海冰融化、铁供应增加以及光照条件有关。 这是一项海洋生态学研究，与大气环境遥感技术关系不大。研究中没有涉及到大气成分分析、卫星观测或空气质量监测等方面的内容。,[],Esther Portela;Meredith G. Meyer;Karen J. Heywood;Walker O. Smith,Unprecedented Summer Phytoplankton Bloom in the Ross Sea,"High‐resolution glider sampling in the southwestern Ross Sea revealed an extensive phytoplankton bloom in austral summer 2022–2023 that persisted for over one month and extended through the upper 100 m of the water column. The temporal mean euphotic‐zone chlorophyll concentration was 20.3± $\hspace*{.5em}\pm \hspace*{.5em}$8.5 μgL−1 ${\upmu }\mathrm{g}\hspace*{.5em}{\mathrm{L}}^{-1}$, six to nine times higher than average summer Ross Sea concentrations. The bloom was likely initially dominated by Phaeocystis, favored over diatoms due to low light and high iron availability. Our observations are consistent with an ice‐edge bloom likely fueled by iron supply and enhanced stratification from late sea‐ice melt during an anomalously high ice‐covered summer. Photoacclimation to particularly low light conditions might have enhanced Chl‐a fluorescence. In the Ross Sea, the most productive region in the Southern Ocean, understanding the drivers of this extreme bloom is crucial for predicting potential impacts of the changing climate on primary production rates and carbon sequestration."
10.1029/2024GL112769,False,Geophysical Research Letters,这篇论文研究的是利用神经网络算法(FORCINN)反演磁铁矿颗粒大小和长宽比分布的方法。它基于岩石磁学中的FORC曲线，通过分析岩石样品的磁滞行为来推断磁性矿物学和磁畴状态。研究使用合成数据和实际样品（玄武岩和海洋沉积物）对算法进行了测试，并取得了较好的效果。该研究与大气环境遥感技术，例如空气质量监测、卫星观测和大气成分分析等，没有直接关系。,[],Zhaowen Pei;Wyn Williams;Lesleis Nagy;Greig A. Paterson;Roberto Moreno;Adrian R. Muxworthy;Liao Chang,FORCINN: First‐Order Reversal Curve Inversion of Magnetite Using Neural Networks,"First‐order reversal curve (FORC) diagrams are a standard rock magnetic tool for analyzing bulk magnetic hysteresis behaviors, which are used to estimate the magnetic mineralogies and magnetic domain states of grains within natural materials. However, the interpretation of FORC distributions is challenging due to complex domain‐state responses, which introduce well‐documented uncertainties and subjectivity. Here, we propose a neural network algorithm (FORCINN) to invert the size and aspect ratio distribution from measured FORC data. We trained and tested the FORCINN model using a data set of synthetic numerical FORCs for single magnetite grains with various grain‐sizes (45–400 nm) and aspect ratios (oblate and prolate grains). In addition to successfully testing against synthetic data sets, FORCINN was found to provide good estimates of the grain‐size distributions for basalt samples and identify sample size differences in marine sediments."
10.1029/2024JD042161,True,Journal of Geophysical Research: Atmospheres,"这篇论文研究了2004年至2021年期间平流层O3、HCl和N2O的趋势，重点关注其在南北半球的差异。研究利用ACE-FTS卫星观测数据和TOMCAT三维化学传输模型，发现南半球下平流层O3和N2O呈正趋势，HCl呈负趋势，北半球则相反。模型模拟结果表明，卤素含量的长期变化通过化学反馈作用，加剧了南半球臭氧恢复信号，延缓了北半球的臭氧恢复。这表明，在寻找中纬度下平流层臭氧恢复信号时，存在复杂的动态变化。研究使用了卫星遥感技术(ACE-FTS)和化学传输模型，对大气成分(O3, HCl, N2O)进行了分析，与大气环境遥感技术密切相关。","['Stratospheric ozone', 'HCl', 'N2O', 'Satellite remote sensing', 'ACE-FTS', 'Atmospheric composition analysis', 'Ozone recovery', 'Interhemispheric asymmetry', 'Chemical transport model']",Andreas Chrysanthou;Kimberlee Dubé;Susann Tegtmeier;Martyn P. Chipperfield,Hemispheric Asymmetry in Stratospheric Trends of HCl and Ozone: Impact of Chemical Feedback on Ozone Recovery,"We use trace gas profiles from Atmospheric Chemistry Experiment ‐ Fourier Transform Spectrometer (ACE‐FTS) satellite measurements and the TOMCAT three‐dimensional chemical transport model to diagnose stratospheric trends in O3, HCl and N2O. We find that the 2004–2021 ACE‐FTS trends exhibit a clear lower stratosphere (LS) interhemispheric asymmetry with positive (negative) O3 and N2O (HCl) trends in the Southern Hemisphere (SH), and trends of opposite sign in the Northern Hemisphere (NH). The trends are larger for the shorter time period of 2004–2018. TOMCAT qualitatively agrees with the ACE‐FTS LS N2O and HCl trends, confirming that transport variability drives such patterns, despite some discrepancies for O3. An additional model simulation is used to quantify the sensitivity of O3 to long‐term changes in chlorine and bromine and thus determine the chemical contribution of the spatially varying halogen trends to both observed and modeled O3 trends. Overall, the recent dynamically induced variation in mid‐latitude LS halogen abundance has, through chemical feedback, accentuated the O3 recovery signal in the SH and delayed it in the NH, reflecting the enhanced dynamical variability of the NH. These results further indicate the complexities that exist in the search for the signal of ozone recovery in the mid‐latitude LS."
10.1029/2024EF004988,False,Earth's Future,这篇研究论文主要关注的是气候变暖对森林土壤碳储存、稳定性和饱和度的影响。研究人员通过在中国5000公里长的森林样带进行采样，并整合全球数据集，发现气候变暖不仅减少了易分解的颗粒有机物，也降低了通常稳定的矿物结合有机物，从而导致土壤碳储存总量显著下降。此外，变暖的气候还会促进铁铝氧化物的结晶，降低铁铝氧化物结合有机复合物的形成效率，导致矿物碳饱和度下降。该研究强调了土壤地球化学性质在塑造森林土壤有机碳组成和饱和度方面的重要作用，以及气候变暖可能导致土壤碳储存减少，削弱其减缓气候变化的能力。总的来说，该研究属于土壤科学和生态学领域，与大气环境遥感技术关系不大。,[],Yuntao Wu;Ziyang Peng;Xin Wang;Junsheng Huang;Lu Yang;Lingli Liu,"Warmer Climate Reduces the Carbon Storage, Stability and Saturation Levels in Forest Soils","Forest soils store about one‐fifth of the global terrestrial biosphere carbon stock. However, our understanding of how soil geochemical, plant and microbial factors regulate forest soil organic carbon (SOC) storage, stability, and saturation levels remains limited. Here, we conducted a sampling campaign across a 5000‐km natural forest transect in China, measuring climate, geochemical factors and SOC fractions with varying stability. Additionally, we compiled a global data set of SOC fractions in major forest biomes. Our field survey and global synthesis consistently demonstrate that warmer climates not only reduce the content of labile particle organic matter (POM), but also decrease the typically stable mineral‐associated organic matter (MAOM), leading to a significant decline in total soil carbon storage. Additionally, warmer climates promote the crystallization of Fe/Al oxides, which decreases the formation efficiency of Fe/Al oxide associated organic complexes. Consequently, the mineralogical carbon saturation level declines from boreal forests (37%) to tropical forests (25%). Our findings underscore that, beyond the well‐established climate impacts, soil geochemical properties play a pivotal role in shaping forest SOC composition and saturation levels across latitudes. This highlights that colder regions harbor larger and more stable carbon pools, and that ongoing climate warming and associated soil geochemical properties shift could potentially lead to a decline in soil carbon storage and its capacity to mitigate climate change."
10.1002/eft2.1873,False,Earth's Future,由于标题和摘要均未提供任何信息，无法判断其与大气环境遥感技术（例如空气质量监测、卫星观测和大气成分分析）的相关性。要进行分析，需要提供标题和摘要的具体内容。,[],,Issue Information,No abstract is available for this article.
10.1029/2023GH000975,False,GeoHealth,这篇论文研究了COVID-19封锁期间人为排放减少对加拿大四个主要都市区PM2.5浓度和冠层城市热岛的影响。它使用地面空气污染监测数据，分析了封锁期间和之后PM2.5浓度和冠层城市热岛强度的变化。研究发现，PM2.5浓度显著下降，冠层城市热岛强度也大幅降低。虽然研究与大气环境相关，但其数据来源是地面观测，并未涉及到大气环境遥感技术，例如卫星观测或大气成分分析等。因此，它与大气环境遥感技术的关联性不强。,"['PM2.5', 'air quality', 'urban heat island', 'ground-level observations']",Samaneh Ashraf;Francesco S. R. Pausata;Sylvie Leroyer;Robin Stevens;Rodrigo Munoz‐Alpizar,Impact of Reduced Anthropogenic Emissions Associated With COVID‐19 Lockdown on PM2.5 Concentration and Canopy Urban Heat Island in Canada,"Extensive lockdowns during the COVID‐19 pandemic caused a remarkable decline in human activities that have influenced urban climate, especially air quality and urban heat islands. However, the impact of such changes on local climate based on long term ground‐level observations has hitherto not been investigated. Using air pollution measurements for the four major Canadian metropolitan areas (Toronto, Montreal, Vancouver, and Calgary), we find that PM2.5 markedly decreased during and after lockdowns with peak reduction ranging between 42% and 53% relative to the 2000–2019 reference period. Moreover, we show a substantial decline in canopy urban heat island intensity during lockdown and in the post lockdowns periods with peak reduction ranging between 0.7°C and 1.6°C in comparison with the 20‐year preceding period. The results of this study may provide insights for local policymakers to define the regulation strategies to facilitate air quality improvement in urban areas."
10.1002/gh2.599,False,GeoHealth,由于标题和摘要均未提供任何信息，无法判断其与大气环境遥感技术（例如空气质量监测、卫星观测和大气成分分析）的相关性。要进行分析，需要提供标题和摘要的内容。,[],,Issue Information,No abstract is available for this article.
10.1038/s41586-025-08712-w,False,Nature,这篇论文的标题和摘要表明，其研究主题是GZMK表达的CD8+ T细胞在反复发作的呼吸道炎症疾病中的作用。 这是一项免疫学研究，关注的是细胞水平的免疫反应机制，与大气环境遥感技术（例如空气质量监测、卫星观测和大气成分分析）并没有直接关系。  研究中并没有涉及到大气成分、卫星传感器或任何大气环境遥感技术相关的应用。,[],Feng Lan;Jizhou Li;Wenxuan Miao;Fei Sun;Su Duan;Yabing Song;Jiacheng Yao;Xiangdong Wang;Chengshuo Wang;Xin Liu;Jianbin Wang;Luo Zhang;Hai Qi,Author Correction: GZMK-expressing CD8<sup>+</sup> T cells promote recurrent airway inflammatory diseases,"Author Correction: GZMK-expressing CD8<sup>+</sup> T cells promote recurrent airway inflammatory diseases 
 "
10.1038/s41586-025-08718-4,False,Nature,这篇论文的标题和摘要表明，其研究主题是病毒诱导的衰老在COVID-19中的作用及其作为治疗靶点的潜力。这属于医学和病毒学领域，与大气环境遥感技术（例如空气质量监测、卫星观测和大气成分分析）没有任何直接关系。论文并未涉及大气成分、卫星传感器或任何大气环境遥感应用。,[],Soyoung Lee;Yong Yu;Jakob Trimpert;Fahad Benthani;Mario Mairhofer;Paulina Richter-Pechanska;Emanuel Wyler;Dimitri Belenki;Sabine Kaltenbrunner;Maria Pammer;Lea Kausche;Theresa C. Firsching;Kristina Dietert;Michael Schotsaert;Carles Martínez-Romero;Gagandeep Singh;Séverine Kunz;Daniela Niemeyer;Riad Ghanem;Helmut J. F. Salzer;Christian Paar;Michael Mülleder;Melissa Uccellini;Edward G. Michaelis;Amjad Khan;Andrea Lau;Martin Schönlein;Anna Habringer;Josef Tomasits;Julia M. Adler;Susanne Kimeswenger;Achim D. Gruber;Wolfram Hoetzenecker;Herta Steinkellner;Bettina Purfürst;Reinhard Motz;Francesco Di Pierro;Bernd Lamprecht;Nikolaus Osterrieder;Markus Landthaler;Christian Drosten;Adolfo García-Sastre;Rupert Langer;Markus Ralser;Roland Eils;Maurice Reimann;Dorothy N. Y. Fan;Clemens A. Schmitt,Author Correction: Virus-induced senescence is a driver and therapeutic target in COVID-19,"Author Correction: Virus-induced senescence is a driver and therapeutic target in COVID-19 
 "
10.1038/d41586-025-00263-4,False,Nature,这篇论文的标题和摘要表明，其研究方向是月球地质学，特别是关于月球上大型峡谷的形成机制。文章提出，这些峡谷可能在几分钟内形成，这暗示了一种快速的地质过程。然而，这与大气环境遥感技术，例如空气质量监测、卫星观测和大气成分分析等，没有任何直接关系。研究中可能涉及到对月球表面的观测数据分析，但这些数据并非大气数据，而是月球表面的地质信息。因此，该研究与大气环境遥感技术不相关。,[],Dan Fox,Grand Canyons on the Moon,"How Grand Canyon-sized lunar-valleys could have been carved in mere minutes. 
 How Grand Canyon-sized lunar-valleys could have been carved in mere minutes.  How Grand Canyon-sized lunar-valleys could have been carved in mere minutes."
10.1038/d41586-025-00065-8,False,Nature,这篇论文的标题和摘要表明，文章内容与达尔文的科学创造力以及一个相关的轶事有关，而不是大气环境遥感技术。标题中提到的“Charles Darwin’s brilliance”和摘要中出现的“cumulative process of scientific creativity”以及“noisy lizard’s midnight snack”都暗示文章的主题是科学史或科学家的生平故事，而非大气环境遥感技术相关的研究。因此，这篇文章与大气环境遥感技术，例如空气质量监测、卫星观测和大气成分分析等，没有直接关系。,[],,Charles Darwin’s brilliance was continuously evolving,"The cumulative process of scientific creativity and a noisy lizard’s midnight snack feature in our weekly dive into Nature’s archive. 
 The cumulative process of scientific creativity and a noisy lizard’s midnight snack feature in our weekly dive into Nature’s archive.  Snippets from Nature’s past."
10.1038/d41586-025-00343-5,False,Nature,这篇论文的标题和摘要关注的是人工智能在科研中的应用，以及研究人员在使用人工智能过程中遇到的挑战和对支持的需求。它并没有直接涉及大气环境遥感技术，例如空气质量监测、卫星观测和大气成分分析等具体技术或应用。因此，这篇论文与大气环境遥感技术的相关性较弱。,[],Miryam Naddaf,How are researchers using AI? Survey reveals pros and cons for science,"Despite strong interest in using artificial intelligence to make research faster, easier and more accessible, researchers say they need more support to navigate its possibilities. 
 Despite strong interest in using artificial intelligence to make research faster, easier and more accessible, researchers say they need more support to navigate its possibilities.  Despite strong interest in using artificial intelligence to make research faster, easier and more accessible, researchers say they need more support to navigate its possibilities."
10.1038/d41586-025-00367-x,False,Nature,这篇论文的标题和摘要表明，其研究主题是美国疾病控制与预防中心（CDC）寻求从科学论文中删除与性别相关的术语。这与大气环境遥感技术（例如空气质量监测、卫星观测和大气成分分析）没有任何关系。CDC 的这一举动是遵循唐纳德·特朗普总统的一项行政命令，并且只适用于尚未发表的研究。因此，该研究与大气科学或遥感技术无关。,[],Amanda Heidt,US health agency seeks to cut gender-related terms from scientific papers,"The mandate from the Centers for Disease Control and Prevention follows an executive order from president Donald Trump, and applies to research not yet published. 
 The mandate from the Centers for Disease Control and Prevention follows an executive order from president Donald Trump, and applies to research not yet published.  The mandate from the Centers for Disease Control and Prevention follows an executive order from president Donald Trump, and applies to research not yet published."
10.1038/d41586-025-00318-6,False,Nature,这篇论文的标题和摘要表明，其研究主题是科学家在学术界和私营部门对浪漫和恋爱关系的研究。Nature 杂志采访了这些科学家，并请他们分享他们的见解。这与大气环境遥感技术，例如空气质量监测、卫星观测和大气成分分析，没有任何关系。论文关注的是人类情感和关系，而不是大气科学。,[],Emily Sohn,How scientists labour on love and loss,"Romance and relationships are research topics for some scientists in academia and the private sector. Nature asked them for their insights. 
 Romance and relationships are research topics for some scientists in academia and the private sector. Nature asked them for their insights.  Romance and relationships are research topics for some scientists in academia and the private sector. Nature asked them for their insights."
10.1038/d41586-025-00283-0,False,Nature,这篇论文的标题和摘要关注的是世界卫生组织（WHO）的资金问题，以及美国退出后其他成员国如何确保其持续运作。它与大气环境遥感技术，例如空气质量监测、卫星观测和大气成分分析没有任何关系。文章的核心是国际组织的财务可持续性，而不是任何形式的科学或技术研究。,[],,How the World Health Organization can thrive without the United States,"If the 193 remaining member nations want the WHO to succeed, they must find a way to pay for it. 
 If the 193 remaining member nations want the WHO to succeed, they must find a way to pay for it.  If the 193 remaining member nations want the WHO to succeed, they must find a way to pay for it."
10.1038/d41586-025-00297-8,False,Nature,这篇论文的标题和摘要关注的是一次在巴黎举办的沉浸式展览，主题是“寂静的力量”。它与大气环境遥感技术（例如空气质量监测、卫星观测和大气成分分析）没有任何关系。文章探讨的是人类体验和感受，而不是科学测量和数据分析。,[],Laura Spinney,Can you ever experience true silence? Intimate exhibition offers insight,"An immersive show in Paris leaves you humbled by the awesome power of quiet. 
 An immersive show in Paris leaves you humbled by the awesome power of quiet.  An immersive show in Paris leaves you humbled by the awesome power of quiet."
10.1038/d41586-025-00368-w,False,Nature,这篇论文的标题和摘要表明，这是一项关于人体器官移植的医学研究，研究使用基因改造猪的肾脏进行人体移植的可行性和安全性。 这与大气环境遥感技术，例如空气质量监测、卫星观测和大气成分分析等，没有任何关系。,[],Smriti Mallapaty;Max Kozlov,The science behind the first pig-organ transplant trial in humans,"The small trial will help to establish whether kidneys from genetically modified pigs can be transplanted into people safely and effectively. 
 The small trial will help to establish whether kidneys from genetically modified pigs can be transplanted into people safely and effectively.  The small trial will help to establish whether kidneys from genetically modified pigs can be transplanted into people safely and effectively."
10.1038/d41586-025-00290-1,False,Nature,这篇论文的标题和摘要关注的是美国政府科学家在当前环境下的角色和责任，强调他们应该保持清晰的头脑，继续为公众服务。  它并没有直接涉及大气环境遥感技术，例如空气质量监测、卫星观测或大气成分分析等具体技术或应用。 因此，它与大气环境遥感技术的关系不大。,[],Gretchen T. Goldman,‘Despair is not an option’ — how scientists can help protect federal research,"Government scientists in the US must be clear-eyed and continue to serve the public. 
 Government scientists in the US must be clear-eyed and continue to serve the public.  Government scientists in the US must be clear-eyed and continue to serve the public."
