doi,is_relevant,journal,explanation,topic_words,authors,title,abstract
10.5194/acp-25-199-2025,True,Atmospheric Chemistry and Physics,这篇论文描述了使用SAPRC机制生成系统MechGen推导挥发性有机化合物（VOCs）大气反应机制的科学依据。MechGen可以推导包含C、H、O或N原子的绝大多数有机化合物的机制，包括有机物与OH、O3、NO3和O3P的初始反应，以及光解反应，以及所形成的各种中间体的反应。该论文详细介绍了MechGen中使用的估算速率常数和推导气相反应机制的方法，这些方法在过去20多年来一直用于开发用于空气质量模型的SAPRC机制。论文还指出了MechGen中需要改进的领域，以及需要进一步实验、理论或机制发展研究以改进对挥发性有机化合物大气反应机制预测的主要不确定性领域。总的来说，该研究与大气环境遥感技术密切相关，因为它为改进空气质量模型和更准确地模拟大气成分，特别是VOCs及其与其他大气成分的反应，提供了重要基础。这对于利用卫星观测和地面监测数据进行空气质量监测和预测至关重要。,"['Volatile Organic Compounds (VOCs)', 'Air quality modeling', 'Atmospheric chemistry', 'Mechanism generation', 'Gas-phase reactions', 'OH radical', 'NO3 radical', 'O3', 'Photolysis', 'Air quality monitoring']",William P. L. Carter;Jia Jiang;John J. Orlando;Kelley C. Barsanti,Derivation of atmospheric reaction mechanisms for volatile organic compounds by the SAPRC mechanism generation system (MechGen),"This paper describes the scientific basis for gas-phase atmospheric chemical mechanisms derived using the SAPRC mechanism generation system, MechGen. It can derive mechanisms for most organic compounds with C, H, O, or N atoms, including initial reactions of organics with OH, O3, NO3, and O3P or by photolysis, as well as the reactions of the various types of intermediates that are formed. The paper includes a description of areas of uncertainty where additional research and updates are needed. 
 This paper describes the methods that are used in the SAPRC mechanism generation system, MechGen, to estimate rate constants and derive mechanisms for gas-phase reactions of volatile organic compounds (VOCs) in the lower atmosphere. Versions of this system have been used for over 20 years in the development of the SAPRC mechanisms for air quality models, but this is the first complete documentation of the scientific basis for the chemical mechanisms it derives. MechGen can be used to derive explicit gas-phase mechanisms for most compounds with C, H, O, or N atoms. Included are reactions of organic compounds with hydroxy (OH) and nitrate (NO3) radicals, O3, and O3P; photolysis or unimolecular reactions; and the reactions of the radicals they form in the presence of O2 and oxides of nitrogen (NOx) at lower-atmospheric temperatures and pressures. Measured or theoretically calculated rate constants and branching ratios are used when data are available, but in most cases rate constants and branching ratios are estimated using various structure–reactivity or other estimation methods. Types of reactions include initial reactions of organics with atmospheric oxidants or by photolysis; unimolecular and bimolecular reactions of carbon-centered, alkoxy, and peroxy radicals; and those of Criegee and other intermediates that are formed. This paper documents the methods, assignments, and estimates currently used to derive these reactions and provides examples of MechGen predictions. Many of the estimation methods discussed here have not been published previously, and others have not been used previously in developing comprehensive mechanisms. Our knowledge of atmospheric reactions of organic compounds rapidly and continuously evolves, and therefore mechanism generation systems such as MechGen also need to evolve to continue to represent the current state of the science. This paper points out areas where MechGen may need to be modified when the system is next updated. This paper concludes with a summary of the major areas of uncertainty where further experimental, theoretical, or mechanism development research is most needed to improve predictions of atmospheric reaction mechanisms of volatile organic compounds."
10.5194/acp-25-157-2025,True,Atmospheric Chemistry and Physics,这篇论文研究了ERA5再分析数据中温度和相对湿度偏差对飞机尾迹（contrail）形成分析的影响。研究者利用IAGOS的机载观测数据对ERA5数据进行了对比分析，发现ERA5数据中存在相对湿度偏差。为了解决这个问题，研究者提出了一种多元分位数映射（QM）方法来校正ERA5数据的偏差，提高了对飞机尾迹形成的估计精度。研究结果表明，QM方法有效地降低了温度和相对湿度偏差，使得ERA5数据对飞机尾迹形成的预测结果与IAGOS观测结果更加一致。这项研究与大气环境遥感技术密切相关，因为它利用了卫星数据同化（ERA5再分析数据来源于多种卫星和地面观测数据）和机载观测数据来研究大气成分（水汽）的变化及其对气候的影响。飞机尾迹作为一种重要的气候影响因素，其形成与大气温度、湿度等气象条件密切相关，因此该研究对改进气候模型和预测气候变化具有重要意义。,"['Atmospheric water vapor', 'Contrail formation', 'Temperature', 'Relative humidity', 'Satellite data assimilation', 'Climate impact', 'ERA5 reanalysis', 'IAGOS observations', 'Quantile mapping', 'Bias correction']",Kevin Wolf;Nicolas Bellouin;Olivier Boucher;Susanne Rohs;Yun Li,Correction of ERA5 temperature and relative humidity biases by bivariate quantile mapping for contrail formation analysis,"ERA5 atmospheric reanalysis and airborne in situ observations from IAGOS are compared in terms of the representation of the contrail formation potential and the presence of supersaturation. Differences are traced back to biases in ERA5 relative humidity fields. Those biases are addressed by applying a quantile mapping technique that significantly improved contrail estimation based on post-processed ERA5 data. 
 Aviation contributes to global emissions of carbon dioxide, aerosol particles, water vapor (WV), and other compounds. WV promotes the formation of condensation trails (contrails), which are known for their net warming effect on the climate. Contrail formation is often estimated using the Schmidt–Appleman criterion (SAc) together with meteorological data from the European Centre for Medium-Range Weather Forecasts (ECMWF) ERA5 atmospheric reanalysis model. We compare ERA5 output of temperature and relative humidity in the upper troposphere and lower stratosphere with 5 years of In-service Aircraft for a Global Observing System (IAGOS) observations over the North Atlantic. Good agreement was found for the temperature fields, with a maximum bias of −0.4 K (200 hPa level), while larger biases were found for relative humidity of up to −5.5 % (250 hPa level). Using original ERA5 data, conditions prone to contrail formation occurred 50.3 % and 7.9 % of the time for non-persistent and persistent contrails, respectively, while 44.0 % and 12.1 % were flagged in the IAGOS data. We propose a multivariate quantile mapping (QM) correction to remove systematic biases by post-processing ERA5 temperature and relative humidity fields with respect to contrail formation. The QM correction was applied to post-process ERA5 data, reducing the temperature bias to less than 0.1 K and the relative humidity bias to less than −1.5 %, resulting in 44 % and 10.9 % of the data points now being flagged for non-persistent and persistent contrail formation, respectively. Our bias correction generalizes well compared to the IAGOS observations. How it generalizes outside the IAGOS regions remains to be investigated."
10.5194/acp-25-143-2025,True,Atmospheric Chemistry and Physics,这篇论文研究了阿拉斯加中部Poker Flat研究区2016年4月至2020年12月期间黑碳(BC)和一氧化碳(CO)的长期观测数据。研究发现，BC和CO浓度峰值同时出现，表明两者具有共同的来源，例如森林火灾。通过FLEXPART-WRF模式的溯源分析，证实了阿拉斯加和加拿大西部 boreal 森林火灾对高浓度BC的贡献。更重要的是，研究发现观测到的BC/ΔCO比值与阿拉斯加和加拿大观测到的火辐射功率(FRP)之间存在正相关关系(r=0.44)。这表明BC和CO的排放比值与森林火灾的强度和时间进程有关，并提示可以利用FRP改进BC的排放因子和/或清单。研究建议将FRP整合到未来的自下而上排放清单中，以更好地了解在快速变化的北极气候下，频繁发生的森林火灾对污染物动态的影响。该研究与大气环境遥感技术密切相关，因为它利用地面观测数据结合卫星观测数据（FRP）分析大气成分（BC和CO），评估森林火灾排放对空气质量的影响，并改进排放清单。,"['Black carbon', 'Carbon monoxide', 'Aerosol', 'Air quality', 'Forest fire', 'Satellite observation', 'Fire radiative power (FRP)', 'Emission inventory', 'Atmospheric composition']",Takeshi Kinase;Fumikazu Taketani;Masayuki Takigawa;Chunmao Zhu;Yongwon Kim;Petr Mordovskoi;Yugo Kanaya,"Long-term observations of black carbon and carbon monoxide in the Poker Flat Research Range, central Alaska, with a focus on forest wildfire emissions","Boreal forest wildfires in interior Alaska represent an important black carbon (BC) source for the Arctic and surrounding regions. We observed BC and carbon monoxide (CO) concentrations in the Poker Flat Research Range since 2016 and found a positive correlation between the observed BC / ∆CO ratio and fire radiative power (FRP) observed in Alaska and Canada. Our finding suggests the BC emission factor and/or inventory could be potentially improved by using FRP. 
 Forest wildfires in interior Alaska represent an important black carbon (BC) source for the Arctic and sub-Arctic. However, BC observations in interior Alaska have not been sufficient to constrain the range of existing emissions. Here, we show our observations of BC mass concentrations and carbon monoxide (CO) mixing ratios in the Poker Flat Research Range (65.12° N, 147.43° W), located in central Alaska, from April 2016 to December 2020. The medians, 10th percentile ranges, and 90th percentile ranges of the hourly BC mass concentration and CO mixing ratio throughout the observation period were 13, 2.9, and 56 ng m−3 and 124.7, 98.7, and 148.3 ppb, respectively. Sporadically large peaks in the BC mass concentration and CO mixing ratio were observed at the same time, indicating influences from common sources. These BC peaks coincided with peaks at other comparative sites in Alaska, indicating large BC emissions in interior Alaska. Source estimation by FLEXPART-WRF (Flexible Particle Dispersion–Weather Research and Forecast) confirmed a contribution of boreal forest wildfires in Alaska and western Canada when high BC mass concentrations were observed. For these cases, we found a positive correlation (r=0.44) between the observed BC/ΔCO ratio and fire radiative power (FRP) observed in Alaska and Canada. This finding implies that the variability of the BC and CO emission ratio is associated with the intensity and time progress of forest wildfires and suggests that the BC emission factor and/or inventory could be potentially improved by FRP. We recommend that FRP be integrated into future bottom-up emission inventories to achieve a better understanding of the dynamics of pollutants from frequently occurring forest wildfires under the rapidly changing climate in the Arctic."
10.5194/acp-25-183-2025,True,Atmospheric Chemistry and Physics,这篇论文研究了花粉对降水的影响。花粉作为大气中的重要生物气溶胶，其浓度在高浓度时能够影响云的形成和降水过程。研究使用了UCLALES-SALSA大型涡流模拟器，模拟桦树花粉对液相和混合相云的影响。结果表明，在高花粉浓度的情况下，花粉能够增强液相和混合相云的降水；而较低浓度下，花粉对降水的影响不显著。花粉破裂释放的细小冰核粒子在冰核化过程中起着重要作用。该研究与大气环境遥感技术密切相关，例如，可以通过卫星遥感监测花粉浓度及其时空分布，并结合大气成分分析，更好地理解花粉对气候和天气过程的影响。,"['Pollen', 'Aerosol', 'Cloud', 'Precipitation', 'Ice Nucleating Particles', 'Satellite remote sensing', 'Air quality monitoring', 'Atmospheric composition']",Marje Prank;Juha Tonttila;Xiaoxia Shang;Sami Romakkaniemi;Tomi Raatikainen,Can pollen affect precipitation?,"Large primary bioparticles such as pollen can be abundant in the atmosphere. In humid conditions pollen can rupture and release a large number of fine sub-pollen particles (SPPs). The paper investigates what kind of birch pollen concentrations are needed for the pollen and SPPs to start playing a noticeable role in cloud processes and alter precipitation formation. In the studied cases only the largest observed pollen concentrations were able to noticeably alter the precipitation formation. 
 Large primary bioparticles such as pollen can be abundant in the atmosphere; for example near-surface pollen concentrations above 10 000 particles per cubic metre can occur during intense pollination periods. On one hand, due to their large size (10–100 µm), pollen can act as giant cloud condensation nuclei and enhance the collision–coalescence process in clouds that leads to drizzle formation. On the other hand, in humid conditions pollen is known to rupture and release many fine particles that can increase the cloud stability by reducing the droplet size. Additionally, both whole pollen grains and the sub-pollen particles released by pollen rupture are known to act as ice-nucleating particles (INPs). Due to these complex interactions, the role of pollen in modulating the cloud cover and precipitation remains uncertain.We used the UCLALES-SALSA (UCLA Large-Eddy Simulation Code and Sectional Aerosol module for Large-Scale Applications) large eddy simulator for simulating birch pollen effects on liquid- and mixed-phase clouds. Our simulations show that the pollen concentrations observed during the most intense pollination seasons can locally enhance precipitation from both liquid- and mixed-phase clouds, while more commonly encountered pollen concentrations are unlikely to cause a noticeable change. The liquid precipitation enhancement depended linearly on the emitted pollen flux in both liquid- and mixed-phase clouds; however, the slope of this relationship was case-dependent. Ice nucleation happened at a relevant degree only if the process of rupturing pollen producing large number of fine ice-nucleating particles was included in the simulations. The resulting precipitation saturated for the highest INP concentrations. Secondary ice formation by rime splintering had only a minor effect in the considered 1 d timescale."
10.5194/acp-25-243-2025,True,Atmospheric Chemistry and Physics,这篇研究论文探讨了土地覆盖变化对大气有机气体、气溶胶和辐射效应的影响。研究使用了一个耦合化学-气候-植被模型，比较了当前的土地覆盖（森林被砍伐用于农作物和放牧）与自然植被和极端重新造林情景。结果发现，植被变化显著影响全球BVOC排放和有机气溶胶，但对总气溶胶、云和辐射效应的影响相对较小。研究中使用了土地利用方案来限制树木植物功能类型（PFT）覆盖，并评估了两种情景：（1）比较当前的土地覆盖与潜在的自然植被（PNV）覆盖；（2）极端重新造林情景。研究发现，与PNV情景相比，当前的森林砍伐导致BVOC排放减少26%，生物源SOA（bSOA）减少29%，总有机气溶胶（OA）减少9%。而极端重新造林情景则导致BVOC排放增加22%，bSOA增加26%，总OA增加6%。对于当前的森林砍伐情景，估计总辐射效应（气溶胶+云）为正（增暖），而对于极端重新造林情景，则为负（降温）。虽然文章没有直接提及具体的遥感技术或卫星观测，但其研究结果对利用卫星观测数据进行大气成分分析和空气质量监测具有重要参考价值，因为土地覆盖变化是影响大气成分的重要因素，而卫星遥感是监测土地覆盖变化的重要手段。,"['Biogenic volatile organic compounds (BVOCs)', 'Secondary organic aerosols (SOAs)', 'Organic aerosols', 'Radiative effects', 'Land cover change', 'Atmospheric chemistry', 'Climate modeling', 'Satellite observations (implied)']",Ryan Vella;Matthew Forrest;Andrea Pozzer;Alexandra P. Tsimpidi;Thomas Hickler;Jos Lelieveld;Holger Tost,"Influence of land cover change on atmospheric organic gases, aerosols, and radiative effects","This study examines how land cover changes influence biogenic volatile organic compound (BVOC) emissions and atmospheric states. Using a coupled chemistry–climate–vegetation model, we compare present-day land cover (deforested for crops and grazing) with natural vegetation and an extreme reforestation scenario. We find that vegetation changes significantly impact global BVOC emissions and organic aerosols but have a relatively small effect on total aerosols, clouds, and radiative effects. 
 Biogenic volatile organic compounds (BVOCs) are emitted in large quantities from the terrestrial biosphere and play a significant role in atmospheric gaseous and aerosol compositions. Secondary organic aerosols (SOAs) resulting from BVOC oxidation affect the radiation budget both directly, through the scattering and absorption of sunlight, and indirectly, by modifying cloud properties. Human activities have extensively altered natural vegetation cover, primarily by converting forests into agricultural land. In this work, a global atmospheric chemistry–climate model, coupled with a dynamic global vegetation model, was employed to study the impacts of perturbing the biosphere through human-induced land use change, thereby exploring changes in BVOC emissions and the atmospheric aerosol burden. A land use scheme was implemented to constrain tree plant functional type (PFT) cover based on land transformation fraction maps from the year 2015. Two scenarios were evaluated: (1) one comparing present-day land cover, which includes areas deforested for crops and grazing land, with potential natural vegetation (PNV) cover simulated by the model, and (2) an extreme reforestation scenario in which present-day grazing land is restored to natural vegetation levels. We find that, compared to the PNV scenario, present-day deforestation results in a 26 % reduction in BVOC emissions, which decreases the global biogenic SOA (bSOA) burden by 0.16 Tg (a decrease of 29 %), while the total organic aerosol (OA) burden decreases by 0.17 Tg (a reduction of 9 %). On the other hand, the extreme reforestation scenario, compared to present-day land cover, suggests an increase in BVOC emissions of 22 %, which increases the bSOA burden by 0.11 Tg and the total OA burden by 0.12 Tg – increases of 26 % and 6 %, respectively. For the present-day deforestation scenario, we estimate a positive total radiative effect (aerosol + cloud) of 60.4 mW m−2 (warming) relative to the natural vegetation scenario, while for the extreme reforestation scenario, we report a negative (cooling) effect of 38.2 mW m−2 relative to current vegetation cover."
10.5194/amt-18-115-2025,True,Atmospheric Measurement Techniques,这篇论文研究了利用地球静止环境监测光谱仪（GEMS）观测首尔都市地区二氧化氮（NO2）对流层垂直柱浓度（TropVCD）的日变化和季节变化特征。研究发现，NO2的TropVCD值及其日变化模式在不同季节存在显著差异，这与光化学过程和气象条件以及氮氧化物排放有关。例如，一月NO2浓度在15:00达到峰值，而七月在14:00达到最低值。此外，研究还比较了使用不同化学传输模型（TM5和WRF-Chem）的先验NO2数据反演结果，发现虽然不同模型模拟的NO2浓度差异很大，但反演得到的NO2 TropVCD日变化模式却基本一致，表明卫星观测数据在决定NO2 TropVCD日变化方面起主导作用。该研究充分利用了GEMS卫星提供的时空连续大气数据，对提高空气质量监测精度和理解城市地区NO2污染的时空分布具有重要意义。,"['Nitrogen Dioxide (NO2)', 'Tropospheric Vertical Column Density (TropVCD)', 'Air Quality Monitoring', 'Satellite Observation', 'Geostationary Environment Monitoring Spectrometer (GEMS)', 'Diurnal Variation', 'Seasonal Variation', 'Seoul Metropolitan Area', 'Chemical Transport Model']",Seunghwan Seo;Si-Wan Kim;Kyoung-Min Kim;Andreas Richter;Kezia Lange;John P. Burrows;Junsung Park;Hyunkee Hong;Hanlim Lee;Ukkyo Jeong;Jung-Hun Woo;Jhoon Kim,Diurnal variations of NO2 tropospheric vertical column density over the Seoul metropolitan area from the Geostationary Environment Monitoring Spectrometer (GEMS): seasonal differences and the influence of the a priori NO2 profile,"Over the Seoul metropolitan area, tropospheric NO2 vertical column densities from the Geostationary Environment Monitoring Spectrometer show distinct seasonal features. Also, varying a priori data have substantial impacts on the observed NO2 columns. The a priori data from different chemical transport models resulted in differences of up to −18.3 %. Notably, diurnal patterns of observed NO2 columns are similar for all datasets, although their a priori data exhibit contrasting diurnal patterns. 
 The Geostationary Environment Monitoring Spectrometer (GEMS), launched in 2020, provides both temporally and spatially continuous air quality data from geostationary Earth orbit (GEO). This study first investigates the seasonal variations and diurnal behavior of nitrogen dioxide (NO2) tropospheric vertical column densities (TropVCDs) over the Seoul metropolitan area (SMA) using GEMS data, retrieved by the IUP-UB algorithm. We find that the magnitude of the NO2 TropVCDs and their diurnal behavior have significant seasonal dependences. In January, the highest NO2 TropVCD values in the range 27.5–28.9×1015 molec.cm-2 during the four seasons were observed at 15:00 local time (LT) and NO2 TropVCD increases from the first retrieved values at 10:00 LT. On the other hand, we find the lowest values (7.4–8.8×1015 molec.cm-2) are at ∼14:00 LT in July. The VCD values in July increased up to 10:00 LT and then decreased until 14:00 LT but then began to increase again. These different diurnal behaviors of the TropVCDs in the different seasons reflect the differences in photochemical and meteorological conditions as well as the emissions of NOx. Photochemical transformations are typically more rapid in July and slower in January. The absolute values and diurnal behavior of NO2 TropVCDs are significantly influenced by the wind speed, except in July. Moderate (wind speed ≥3 m s−1) or strong wind (wind speed >5 m s−1) reduced the magnitude of the diurnal behavior in January, implying that the NO2 plumes were transported downwind. Finally, we compared the retrieved NO2 TropVCDs by using different a priori NO2 data simulated by TM5 and WRF-Chem, calculated using the most recent emission inventories. Although simulated VCDs from WRF-Chem and TM5 show differences of up to a factor 2.75, retrieved NO2 TropVCDs using each a priori data have almost identical values and diurnal behaviors, except in July. Notably, the diurnal behavior of the retrieved NO2 TropVCDs is independent of that from the two chemical transport models, indicating that observations of slant column densities are the dominant factor in determining the diurnal behavior of NO2 TropVCDs. Changes in the model horizontal resolution and volatile organic compound (VOC) emission inventory do not significantly affect the retrieved NO2 TropVCDs in this study. However, when the a priori NO2 vertical profile was fixed as the values at 13:45 LT, the diurnal patterns of NO2 TropVCDs showed significant changes, with differences of up to −18.3 %."
