doi,is_relevant,journal,explanation,topic_words,authors,title,abstract
10.1016/j.atmosres.2025.108164,False,Atmospheric Research,这篇论文主要研究的是利用闪电数据同化来改进数值天气预报模型对中国福建地区双雨带天气事件的模拟效果。研究重点在于提高对暖区暴雨的模拟精度，通过对比不同时间段和参数组合下的闪电数据同化实验，验证了该方法对降水模拟的改进作用。虽然该研究涉及大气过程，但其核心在于数值模拟和数据同化技术，而非直接利用大气环境遥感技术（如空气质量监测、卫星观测或大气成分分析）。,"['lightning data assimilation', 'numerical weather prediction', 'cloud-resolving model', 'rainfall simulation', 'VLF/LF lightning detection system']",Yehong Wang;Yuchun Zhao,"A numerical study on the impacts of lightning data assimilation upon the simulation of a double rainband in Fujian, China","•The lightning data assimilation significantly improved the simulation of a double rainband weather event at the cloud-resolving scale. •The simulation of warm-sector extremely heavy rainfall, which is a challenge for worldwide operational numerical models, was significantly improved. •Assimilating lightning data two times sequentially gave a better simulation for the warm-sector extremely heavy rainfall than one time. •Sensitivity experiments were carried out on the parameters in the lightning data assimilation scheme to identify the best combination of parameters. 
 Lightning data monitored by a very low frequency/low frequency (VLF/LF) three-dimensional lightning detection and position system were assimilated using a mesoscale numerical model and its three-dimensional variational assimilation system. A case study was conducted on a double rainband weather event in Fujian, China, on 7 May 2018, which included both shear-line precipitation and warm-sector rainfall. The impact of assimilating lightning data at cloud resolving scales was investigated through a series of comparative experiments, involving situations with and without lightning data assimilation, assimilation at different times, and assimilation under various parameter combinations. The results showed that assimilating lightning data significantly improved the simulation of the southeastward-moving shear-line rainband in inland Fujian and the northeastward-moving warm-sector rainband along the Fujian coast. The simulation of the warm-sector rainstorm was improved greatly. This improvement in simulating the coastal warm-sector rainstorm through lightning data assimilation was attributed not only to the increases in the relative humidity and cloud microphysical quantities, but also to the enhancement of wind convergence along the southwest jet in the ultra-low-level layer over the Fujian coastal region. The simulation of heavy rainfall in the double rainband was improved both in the individual assimilation of lightning data at 0200 and 0800 BT (Beijing Time), as well as in the simultaneous assimilation of lightning data at these two times. The modelling with assimilating lightning data at 0200 BT produced a greater improvement than that at 0800 BT. Moreover, the results from the simultaneous assimilation at both times were superior to those from individual assimilation at a single time. The simulation of the double rainband was also improved when assimilating lightning data under various parameter combinations, each yielding distinct improvements. The threat scores (TS) for 12-h rainfall were increased greatly, with the missing and empty report rates heavily reduced. The simulation accuracy for moderate rain, heavy rain, rainstorm and heavy rainstorm all improved obviously. Additionally, the TS for 1-h rainfall also increased, with a positive effect extending to 12–18 h."
10.1016/j.atmosres.2025.108167,True,Atmospheric Research,该研究论文利用卫星产品和地面测量数据，分析了西班牙马德里和瓦伦西亚两个城市在2013年至2022年期间PM2.5浓度的时空变化规律，并探讨了PM2.5浓度与气象参数之间的关系。研究重点关注了不同季节气象因素对PM2.5浓度的影响，并提出了相应的空气污染缓解策略，例如增加绿地和透水路面，以及减少排放。此外，论文还识别了冬季潜在的城市通风廊道。整体而言，该研究与大气环境遥感技术密切相关，特别是利用卫星观测进行空气质量监测和大气成分分析。,"['PM2.5', 'Air quality monitoring', 'Satellite products', 'Meteorological parameters', 'Spatiotemporal variations', 'Urban ventilation']",Letian Wei;José Sobrino,"The spatiotemporal variations of PM<sub>2.5</sub> concentration and its relationship with meteorological parameters: A multi-scale analysis in Madrid and Valencia, Spain","•Investigated the spatiotemporal variations of PM2.5in Madrid and Valencia from 2013 to 2022 using satellite products. •Conducted a multi-scale analysis of correlations between meteorological parameters and PM2.5concentration. •Quantitative analyzed the feature contribution of meteorological factors to PM2.5on seasonal scale. •For both cities, the southwest-northeast direction has the potential to form ventilation corridors in December. 
 Fine particulate matter (PM2.5), as a principal air pollutant, stands as one of the key indicators in atmospheric quality monitoring. The spatiotemporal patterns of PM2.5 concentration in Madrid and Valencia during 2013–2022 were obtained from satellite-derived PM2.5 products and ground-based measurements. The peak PM2.5 concentrations occurred in July, August and December in Madrid, showing a geographical trend of hotspots in the southeast and coldspots in the northwest. Similarly, the highest PM2.5 concentration in Valencia was observed in December and summer months (June–August), with hotspots appearing along the coastline. At diurnal and monthly scales, PM2.5 concentrations in Madrid positively correlated with air temperature (AT); the results of feature importance using XGBOOST-SHAP model reveal that high temperature-humidity enhances PM2.5 at seasonal scale, while high wind speed (WS) weakens it. Therefore, to mitigate elevated PM2.5 levels during summer and winter in Madrid, strategies should focus on increasing green spaces and pervious pavement. Additionally, since Valencia experiences the peak PM2.5 during spring and winter, requiring measures of reducing emission. Moreover, excessive humidity contributes the most to PM2.5 accumulation in Valencia. For both cities, potential urban ventilation corridors during winter align along southwest-northeast direction, which could serve as an effective strategy to facilitate the dispersion of PM2.5."
10.1016/j.atmosres.2025.108155,False,Atmospheric Research,该研究论文主要关注中国长江流域气象干旱的时空演变及其驱动因素。它探讨了干旱的强度、迁移特征，并量化了不同因素对干旱的影响，例如土壤湿度、水汽通量和温度。虽然研究提到了水汽通量，但其重点在于干旱的成因和演变，而非大气环境遥感技术，如空气质量监测、卫星观测或大气成分分析。因此，该论文与大气环境遥感技术的关联性不强。,"['drought', 'Yangtze River Basin', 'soil moisture', 'water vapor flux', 'temperature', 'human activities']",Xin-Min Zeng;Mingqiu Nie;Ning Wang;Irfan Ullah;Ganggang Bai;Manjing Wang;Zengxin Zhang;Jian Zhu,"Attributing spatiotemporal evolution and driving factors of meteorological drought across Yangtze River Basin, China","•Rate of expansion is proposed to quantify the development of drought outmost shape. •Migration characteristics of drought are explored from a 3D perspective. •Shapley additive explanation is used to quantify the importance of drivers. 
 Meteorological droughts have magnitude and migration characteristics due to their spatiotemporal construction. A comprehensive identification of these characteristics and quantification of their dominant factors are crucial for drought risk mitigation and forecasting efforts. However, migration characteristics have often been overlooked in previous studies, and the dominant factors affecting drought remain ambiguous. In this study, migration characteristics was described by a series of indicators, e.g., migration trajectory and drought speed (DV). We also proposed the rate of expansion (RE) for overall drought areas to quantify the evolution of the outmost shape boundary, based on 3-dimensional droughts. Furthermore, Shapley additive explanation (SHAP), a unified method to interpret the predictions of complex machine learning models, was used to quantify the importance of driving factors on characteristics. The results showed that: (1) severe meteorological droughts were predominantly concentrated in east region of the Yangtze River Basin, characterized by prolonged duration, high severity, rapid DV, and extensive affected areas along with high RE; (2) RE was large in March and April, ranging from 2.0 to 7.37, while negative RE frequently occurred in August, indicating contractions of affected area (DA); (3) soil moisture emerged as the primary driving factor influencing drought characteristics, with an average relative importance of 21.3 %, followed by vertically integrated water vapor flux (16.1 %) and temperature (15.6 %); and (4) while human activities exerted weaker impacts compared to climate factors, they demonstrated increasing trends in DA and RE. Overall, this study shed three-dimensional insights into meteorological drought evolution and driving mechanism exploration, which provided strategies for drought prediction and proactive prevention."
None,False,Atmospheric Research,由于只提供了标题“编委会”和摘要“摘要”，没有足够的信息来判断该研究论文是否与大气环境遥感技术相关。 编委会通常指期刊或会议的编辑委员会，而“摘要”一词仅表示存在摘要，但没有提供任何关于研究内容的信息。 因此，无法确定其主题、所用技术或应用领域。,[],,Editorial Board,
