doi,is_relevant,journal,explanation,topic_words,authors,title,abstract
10.1021/acsestair.4c00188,True,ACS ES&T Air,该研究论文利用臭氧监测仪（OMI）卫星传感器的数据，结合MERRA2 GMI化学传输模型，估算了印度地区的甲醛（HCHO）暴露量，并评估了长期暴露于甲醛可能带来的癌症风险。研究发现印度大部分地区的甲醛暴露量有所增加，尤其是在农村地区。这项研究表明，印度的甲醛污染是一个区域性问题，需要制定相应的减排政策。,"['formaldehyde', 'air quality monitoring', 'satellite observations', 'atmospheric composition analysis', 'Ozone Monitoring Instrument (OMI)', 'cancer risk assessment']",Deeksha Gautam;Sajeev Philip;Sagnik Dey;Matthew S. Johnson;Ekta Chaudhary;Zolal Ayazpour;Gonzalo González Abad,Assessing Ambient Formaldehyde Exposure and Estimating Cancer Risks over India using the Ozone Monitoring Instrument Satellite Sensor,"Estimating human exposure to formaldehyde (HCHO) is challenging due to sparse in situ measurements over India. We develop an ambient HCHO exposure data set to assess the long-term changes in exposure and to calculate the potential HCHO-related cancer risks in India. We estimate the long-term mean (2005–2019) annual 24-h average surface HCHO concentrations at a spatial resolution of 0.1° × 0.1° (latitude × longitude) over India by scaling the HCHO vertical column density retrievals from the Ozone Monitoring Instrument (OMI) satellite sensor with the atmospheric profile information from the MERRA2 GMI chemical transport model. We find an increase in long-term HCHO exposure of >0.05 ppb (parts per billion by volume) for most Indian states (2015–2019 annual mean compared to 2005–2009 mean). The OMI-based estimate shows that the Indian population of 40,000–76,000 will likely be under enhanced cancer risk due to exposure to long-term ambient HCHO. We find highest HCHO exposure values for rural regions compared to urban areas in most Indian states except Delhi national capital region. This study shows that HCHO pollution in India is a regional-centric issue. Therefore, emission mitigation policies should focus on reducing HCHO in both urban and rural regions."
10.1029/2024AV001628,False,AGU Advances,该研究论文主要关注温带地区火灾、燃料和气候之间的相互作用，通过比较北美西部、中西部欧洲和西南美洲三个地区的燃烧面积与气候和燃料条件，探讨了干旱指数、生物量和土地覆盖类型对火灾的影响。论文侧重于生态学和地理学，与大气环境遥感技术（如空气质量监测、卫星观测和大气成分分析）没有直接关联。虽然火灾会影响大气成分，但本文的重点在于火灾的驱动因素和区域差异，而不是大气环境遥感技术的应用。,[],Stephanie K. Kampf;Camille S. Stevens‐Rumann;Leónia Nunes;Ana Catarina Sequeira;Francisco Castro Rego;Cristina Fernández;Ana Hernández‐Duarte;Clara E. Mosso;Jean Pierre Francois;Alejandro Miranda,"Fire, Fuel, and Climate Interactions in Temperate Climates","Temperate regions around the world are experiencing longer fire weather seasons, yet trends in burned area have been inconsistent between regions. Reasons for differences in fire patterns can be difficult to determine due to variable vegetation types, land use patterns, fuel conditions, and human influences on fire ignition and suppression. This study compares burned areas to climate and fuel conditions in three temperate regions: the desert, shrub, and forest ecoregions of western North America, west‐central Europe, and southwestern South America. In each region the mean annual aridity index (AI, precipitation over potential evapotranspiration) spans arid to humid climates. We examined how the fraction of area burned from 2001 to 2021 varied with mean annual AI, mean aboveground biomass, and land cover type distributions. All three regions had low fractions of area burned for the driest climate zones (AI < 0.5), a sign of fuel limitation to burned area. Fraction of area burned increased with mean aboveground biomass for these dry zones. Fraction of area burned peaked at intermediate AI (0.7–1.5) for all regions and declined again in the wettest climate zones (AI > 1.5), a sign of climate limitation to burned area. Of the three regions, western North America had the highest burned area, fraction of area burned, and fire sizes. Fragmentation of vegetation patches by the high Andes Mountains in southwestern South America and by intensive land use changes in west‐central Europe likely limited fire sizes. All three regions are at risk for future wildfires, particularly in areas where fire is currently climate limited."
10.1029/2024GL112554,False,Geophysical Research Letters,该研究论文主要关注西北欧地区M2潮汐的季节性变化特征和驱动因素，重点在于潮汐动力学和大气对潮汐的影响，而非大气环境遥感技术。论文分析了潮汐观测数据，并通过数值模型研究了大气环流和分层对M2潮汐的影响，与空气质量监测、卫星观测和大气成分分析等大气环境遥感技术关系不大。,[],Lucia Pineau‐Guillou;Pascal Lazure,M2 ${M}_{2}$ Seasonal Variability in Northwestern Europe: Characteristics and Drivers,"The M2 ${M}_{2}$ tide displays large seasonal variability in Europe, particularly in the North Sea. The tide is there larger in summer than in winter. However, there is no consensus on the physical drivers leading to such large values, atmosphere circulation and stratification being two good candidates. We analyzed hourly sea level data from observations at 35 tide gauges in Europe. The amplitude of M2 ${M}_{2}$ seasonal cycle is the largest in the southern North Sea, reaching typically 4–6 cm. This cycle is well reproduced by a barotropic model, forced with the tidal potential and the atmosphere only. This suggests a minor role of the stratification. We show that large seasonal cycles in the southern North Sea are first due to gravitational nonlinear effects. The atmosphere also plays a role, but locally and in a smaller extent."
10.1029/2024GL113126,False,Geophysical Research Letters,该研究论文主要关注美国中西部地区极端降水事件的未来变化，并分析了不同类型风暴（如中尺度对流系统、热带气旋残余和冬季风暴）对降水的影响。研究使用了天气研究和预报模型（WRF）进行高分辨率模拟，探讨了在人为变暖情景下，不同类型风暴的降水变化趋势。虽然该研究与大气科学相关，但它主要侧重于降水模式和风暴动力学，而不是大气环境遥感技术，如空气质量监测、卫星观测或大气成分分析。因此，该论文与大气环境遥感技术的关联性不强。,[],Tyler J. Mercurio;Christina M. Patricola,Future Changes in Midwest Extreme Precipitation Depend on Storm Type,"Midwestern U.S. extreme precipitation is associated with multiple storm types including mesoscale convective systems (MCSs) and/or training thunderstorms, tropical cyclone (TC) remnants, and winter storms. Anthropogenic warming is expected to increase climatological precipitation globally, however, there may be little correspondence with regional storm‐based changes. Furthermore, uncertainty remains in precipitation‐temperature scaling due to use of convective parameterization in most global models. In this study, we investigated historically impactful extreme precipitation events from multiple types of Midwest storms using the Weather Research and Forecasting model at convection‐permitting resolution. We simulated five‐member ensembles of historical hindcasts and experiments representing the storms in the future using the pseudo‐global warming method. We found that future precipitation changes depend on storm type, with increases near Clausius‐Clapeyron (CC) for winter storms, no consensus for MCSs and/or training thunderstorms, and sub‐CC increases for TC remnants. This research highlights the importance of considering storm type in future extreme precipitation projections."
10.1029/2024GL113405,False,Geophysical Research Letters,这篇论文主要研究气候变化引起的地球自转极移现象，探讨了在不同气候情景下（RCP和SSP）极地冰盖融化、全球冰川融化以及陆地水储量变化对极移的影响。虽然气候变化与大气环境密切相关，但该研究的重点在于地球物理学和气候建模，而非直接涉及大气环境遥感技术，如空气质量监测、卫星观测或大气成分分析。因此，该论文与大气环境遥感技术的关联性较弱。,[],Mostafa Kiani Shahvandi;Benedikt Soja,Climate‐Induced Polar Motion: 1900–2100,"It has been demonstrated that the motion of the Earth's rotational pole with respect to the crust—termed polar motion—is increasingly influenced by barystatic processes, that is, continental‐ocean mass redistribution due to melting of polar ice sheets, global glaciers, and variations in terrestrial water storage. However, how these processes might impact polar motion in the 21st ${21}^{\text{st}}$ century is not known. Here we investigate this problem under various climatic scenarios, namely, Representative Concentration Pathways (RCP) and Shared Socioeconomic Pathways. We show that the climate‐induced polar motion is sensitive to the choice of climatic scenario; under the optimistic RCP2.6, the rotational pole might wander by ∼ ${\sim} $12 m with respect to 1900, whereas under the pessimistic RCP8.5 by more than twice as much (∼ ${\sim} $27 m). The most important contributor is the melting of polar ice sheets (Greenland and, to a lesser degree, Antarctica), followed by melting of global glaciers, and variations in terrestrial water storage."
10.1029/2024GL111769,False,Geophysical Research Letters,该研究主要关注北极-大西洋地区的温带气旋，特别是其热力学特征、大规模气流以及局部影响。虽然气旋活动与大气环境存在间接联系（例如，通过影响大气传输和混合），但该研究的重点并非直接针对大气环境遥感技术，如空气质量监测、卫星观测或大气成分分析。因此，该研究与大气环境遥感技术的直接相关性较低。,[],Dandan Tao;Camille Li;Richard Davy;Shengping He;Thomas Spengler;Clio Michel;Andrea Rosendahl,"Arctic‐Atlantic Cyclones: Variability in Thermodynamic Characteristics, Large‐Scale Flow, and Local Impacts","Cyclones at polar latitudes of the Atlantic‐Arctic corridor exhibit different thermodynamic characteristics. Midlatitude‐origin cyclones, which make up about 14% of wintertime cyclones in the region, are generally warm and moist. The more numerous Arctic‐origin cyclones display a wide range in the boundary‐layer equivalent potential temperature θe ${\theta }_{e}$ that depends on both temperature and moisture. This spread includes large positive and negative θe ${\theta }_{e}$ anomalies, leading to weak signals in composite means. Warm/moist (high‐θe ${\theta }_{e}$) cyclones at polar latitudes are associated with tilted and central jet regimes, steering cyclones of midlatitude‐origin into the Barents region or preconditioning the environment for Arctic genesis. Conversely, cold/dry (low‐θe ${\theta }_{e}$) Arctic‐origin cyclones form under a jet stream positioned far south, characterized by frequent southern jet regimes. These new insights into the large variability of Barents cyclones have implications for our understanding of genesis mechanisms, cyclone development, and their effect on the climate of the polar regions."
10.1029/2024GL113265,False,Geophysical Research Letters,该研究论文主要关注城市湿地中不同气态氮物种（如NO、NO2、NH3和N2O）的排放和交换情况。虽然涉及大气成分，但侧重于地面观测的氮循环过程，而非大气环境遥感技术，如空气质量监测、卫星观测或大气成分分析。因此，与大气遥感技术的关联性较弱。,"['Nitrogen species', 'Nitric oxide (NO)', 'Nitrogen dioxide (NO2)', 'Ammonia (NH3)', 'Nitrous oxide (N2O)', 'Fluxes', 'Emissions', 'Urban wetland']",Qian Yu;Zimeng Zhang;Piaopiao Ke;Jiale Chang;Han Li;Wenjia Wang;Lei Duan;Ronghua Kang;Lei Zhang;Yu Zhao,Land‐Air Exchanges of Various Gaseous Nitrogen Species in an Urban Wetland Based on In Situ Flux Observations,"Wetlands are universally recognized as hotspots for nitrogen cycling and gaseous nitrogen emissions. In this study, the fluxes of nitric oxide (NO), nitrogen dioxide (NO2), ammonia (NH3), and nitrous oxide (N2O) were observed seasonally in the mud and waterfront plots of an urban wetland in eastern China using a dynamic flux chamber. The results revealed that the fluxes of NO, NO2, and NH3 displayed a diurnal pattern of higher values during the day and lower values at night, which was opposite to that of N2O. The average annual emissions of NO, NH3, and N2O were 0.16 ± 0.04, 0.59 ± 0.03, and 8.81 ± 0.44 kg N ha−1 yr−1, respectively. Conversely, NO2 exhibited deposition, with an annual flux of 1.51 ± 0.03 kg N ha−1 yr−1. Given the evolving area of urban wetlands, the emissions of gaseous nitrogen, particularly N2O, deserve substantial attention."
10.1038/s41586-025-08792-8,False,Nature,该研究论文主要关注长链神经酰胺通过激活CYSLTR2和P2RY6受体加剧动脉粥样硬化的分子机制。研究重点在于生物化学、细胞信号传导和疾病病理学，特别是探讨神经酰胺如何通过特定的G蛋白偶联受体影响炎症反应和动脉粥样硬化的发展。该研究与大气环境遥感技术（如空气质量监测、卫星观测和大气成分分析）没有直接关联。,[],Siting Zhang;Hui Lin;Jiale Wang;Jingyu Rui;Tengwei Wang;Zeyu Cai;Shenming Huang;Yanxiang Gao;Tianfeng Ma;Rui Fan;Rongbo Dai;Zhiqing Li;Yiting Jia;Qiang Chen;HaoMing He;Jiaai Tan;Shirong Zhu;Rui Gu;Zhigang Dong;Meihong Li;Enmin Xie;Yi Fu;Jingang Zheng;Changtao Jiang;Jinpeng Sun;Wei Kong,Sensing ceramides by CYSLTR2 and P2RY6 to aggravate atherosclerosis,"Sensing ceramides by CYSLTR2 and P2RY6 to aggravate atherosclerosis 
 Recent evidence shows elevated circulating long-chain ceramide levels predict atherosclerotic cardiovascular disease (ASCVD) independently of cholesterol1,2. Although targeting ceramide signaling may provide therapeutic benefits beyond the treatment of hypercholesterolemia, the underlying mechanism by which circulating ceramides aggravate ASCVD remains elusive. We examined whether circulating long-chain ceramides activate membrane G protein-coupled receptors (GPCRs) to exacerbate atherosclerosis. We performed a systematic screen combining G protein signaling quantification, bioinformatic analysis of GPCRs expression, and functional examination of NLRP3 inflammasome activation, and the results suggested CYSLTR2 and P2RY6 are potential endogenous receptors of C16:0 ceramide-evoked inflammasome activation in both endothelial cells and macrophages. We found that inhibiting CYSLTR2/P2RY6 genetically or pharmacologically alleviated ceramide-induced atherosclerosis aggravation. Additionally, increased ceramide levels correlated with the severity of coronary artery disease in patients with varying degrees of renal impairment. Notably, CYSLTR2/P2RY6 deficiency mitigated chronic kidney disease (CKD)-aggravated atherosclerosis in mice, without affecting cholesterol or ceramide levels. Structural analysis of the ceramide-CYSLTR2-Gq complexes revealed that both C16:0 and C20:0 ceramides bind within an inclined channel-like ligand binding pocket on CYSLTR2. We further revealed an unconventional mechanism underlying ceramides-induced CYSLTR2 activation and CYSLTR2-Gq interface. Overall, our study provided structural and molecular mechanisms that long-chain ceramides initiate transmembrane Gq and inflammasome signaling through directly binding to CYSLTR2 and P2RY6 receptors, and blocking these signaling may provide new therapeutic potential to treat atherosclerosis-related diseases."
10.1038/d41586-025-00607-0,False,Nature,该研究论文的标题和摘要主要关注在萨尔瓦多发现的古代陶土雕像，这些雕像可能被用于公共仪式。它与大气环境遥感技术（如空气质量监测、卫星观测和大气成分分析）没有直接关系。因此，该论文与大气环境遥感技术领域无关。,[],,Ancient puppets that smile or scowl hint at shared rituals,"Clay figurines found on top of the remnants of a pyramid in what is now El Salvador might have been used in public ceremonies. 
 Clay figurines found on top of the remnants of a pyramid in what is now El Salvador might have been used in public ceremonies.  Clay figurines found on top of the remnants of a pyramid in what is now El Salvador might have been used in public ceremonies."
10.1038/d41586-025-00694-z,False,Nature,该文章标题和摘要主要讨论的是一位因对COVID-19的争议性观点而受到批评的健康经济学家Jay Bhattacharya被提名为NIH（美国国立卫生研究院）院长。文章提到了他承诺提供资金，但缺乏细节。因此，这篇文章与大气环境遥感技术（如空气质量监测、卫星观测和大气成分分析）没有直接关系。,[],Julian Nowogrodzki,Trump's nominee for NIH chief talks frozen grants and fostering ‘scientific dissent’,"Health economist Jay Bhattacharya, who drew censure for controversial views on COVID-19, vows to provide funding but is short on details. 
 Health economist Jay Bhattacharya, who drew censure for controversial views on COVID-19, vows to provide funding but is short on details.  Health economist Jay Bhattacharya, who drew censure for controversial views on COVID-19, vows to provide funding but is short on details."
10.1038/d41586-025-00481-w,False,Nature,该论文的标题和摘要主要关注美国黑人高等教育机构的财政困境以及增加科学领域多样性的必要性。它与大气环境遥感技术（如空气质量监测、卫星观测和大气成分分析）没有直接关系。论文的核心在于教育公平、种族平等以及科学领域的人才多样性，而非大气环境科学。,[],Joseph L. Graves Jr,The financial shackling of historically Black universities in the United States,"Evolutionary biologist Joseph L. Graves Jr argues that — now more than ever — the United States should honour its commitments to Black higher education to diversify the science workforce. 
 Evolutionary biologist Joseph L. Graves Jr argues that — now more than ever — the United States should honour its commitments to Black higher education to diversify the science workforce.  Evolutionary biologist Joseph L. Graves Jr argues that — now more than ever — the United States should honour its commitments to Black higher education to diversify the science workforce."
10.1038/d41586-025-00609-y,False,Nature,该研究论文的标题和摘要主要关注的是LGBTQ+生物学家在工作场所遭受的敌意环境，特别是针对跨性别和性别不符合规范的研究人员。它与大气环境遥感技术（如空气质量监测、卫星观测和大气成分分析）没有直接关系。该研究调查了LGBTQ+生物学家在工作场所遭受敌意、恐吓或冒犯行为的经历，旨在揭示生物学领域内LGBTQ+群体所面临的职场歧视问题。,[],Laurie Udesky,Trans researchers under attack: LGBTQ+ biologists face hostile work environment,"Largest survey of LGBTQ+ biologists finds 40% of trans and gender-nonconforming, and 20% of lesbian, gay, bisexual and queer researchers, experience hostility, intimidation or offensive behaviour at work. 
 Largest survey of LGBTQ+ biologists finds 40% of trans and gender-nonconforming, and 20% of lesbian, gay, bisexual and queer researchers, experience hostility, intimidation or offensive behaviour at work.  Largest survey of LGBTQ+ biologists finds 40% of trans and gender-nonconforming, and 20% of lesbian, gay, bisexual and queer researchers, experience hostility, intimidation or offensive behaviour at work."
10.1038/d41586-025-00630-1,False,Nature,根据标题和摘要，该文章主要讨论的是在中国工作的外国研究人员所面临的日益收紧的限制，特别是数据和安全法律对他们的影响。虽然文章提到了研究，但并没有具体涉及大气环境遥感技术，如空气质量监测、卫星观测或大气成分分析。因此，该文章与大气环境遥感技术的关联性不大。,[],David Matthews,Foreign researchers in China face tightening restrictions,"Data and security laws are affecting scientists who stayed in China after COVID — but for some it’s still a great place to do research. 
 Data and security laws are affecting scientists who stayed in China after COVID — but for some it’s still a great place to do research.  Data and security laws are affecting scientists who stayed in China after COVID — but for some it’s still a great place to do research."
10.1038/d41586-025-00711-1,False,Nature,该标题和摘要主要关注PubMed数据库的临时中断以及鸟巢中发现的塑料垃圾。它与大气环境遥感技术（如空气质量监测、卫星观测或大气成分分析）没有直接关系。,[],Flora Graham,Daily briefing: PubMed blackout stokes fears about database’s future,"A temporary blackout of PubMed has researchers concerned over the database’s future. Plus, a bird’s nest offers a time capsule of plastic rubbish. 
 A temporary blackout of PubMed has researchers concerned over the database’s future. Plus, a bird’s nest offers a time capsule of plastic rubbish.  A temporary blackout of PubMed has researchers concerned over the database’s future. Plus, a bird’s nest offers a time capsule of plastic rubbish."
10.1038/s41467-025-57657-1,False,Nature Communications,该研究论文主要关注胶体金纳米粒子中等离子体激元诱导的热载流子的产生和动力学。它利用超快X射线吸收光谱技术，以亚50飞秒的时间分辨率直接捕捉热载流子的动态，并观察到Landau阻尼和热载流子热化的过程。研究结果表明，俄歇加热机制在增强载流子能量方面起作用，使其超过单光子激发能量。该研究主要关注等离子体激元能量转换和光催化等应用，与大气环境遥感技术（如空气质量监测、卫星观测和大气成分分析）没有直接关联。,"['Plasmon', 'Hot carriers', 'Gold nanoparticles', 'Photocatalysis', 'Photovoltaics', 'Phototherapy', 'Ultrafast X-ray absorption spectroscopy']",Anna Wach;Robert Bericat-Vadell;Camila Bacellar;Claudio Cirelli;Philip J. M. Johnson;Rebeca G. Castillo;Vitor R. Silveira;Peter Broqvist;Jolla Kullgren;Alexey Maximenko;Tomasz Sobol;Ewa Partyka-Jankowska;Peter Nordlander;Naomi J. Halas;Jakub Szlachetko;Jacinto Sá,The dynamics of plasmon-induced hot carrier creation in colloidal gold,"This study presents real-time observation of plasmon-driven hot carrier creation. Auger heating is operative in enhancing carrier energy beyond single-photon excitation. These findings open new avenues in plasmonic energy conversion and photocatalysis. 
 The generation and dynamics of plasmon-induced hot carriers in gold nanoparticles offer crucial insights into nonequilibrium states for energy applications, yet the underlying mechanisms remain experimentally elusive. Here, we leverage ultrafast X-ray absorption spectroscopy (XAS) to directly capture hot carrier dynamics with sub-50 fs temporal resolution, providing clear evidence of plasmon decay mechanisms. We observe the sequential processes of Landau damping (~25 fs) and hot carrier thermalization (~1.5 ps), identifying hot carrier formation as a significant decay pathway. Energy distribution measurements reveal carriers in non-Fermi-Dirac states persisting beyond 500 fs and observe electron populations exceeding single-photon excitation energy, indicating the role of an Auger heating mechanism alongside traditional impact excitation. These findings deepen the understanding of hot carrier behavior under localized surface plasmon resonance, offering valuable implications for applications in photocatalysis, photovoltaics, and phototherapy. This work establishes a methodological framework for studying hot carrier dynamics, opening avenues for optimizing energy transfer processes in nanoscale plasmonic systems. This study presents real-time observation of plasmon-driven hot carrier creation. Auger heating is operative in enhancing carrier energy beyond single-photon excitation. These findings open new avenues in plasmonic energy conversion and photocatalysis."
10.1038/s41467-025-57597-w,False,Nature Communications,该论文的标题和摘要表明，它主要关注顶复门生物的线粒体核糖体的结构和组装，特别是 rRNA 分子的作用以及蛋白质和 RNA 元素的重新利用。 这项研究属于分子生物学和生物化学领域，与大气环境遥感技术（如空气质量监测、卫星观测和大气成分分析）没有直接关系。 该论文主要研究生物体内细胞层面的分子机制，而非大气环境的宏观观测和分析。,[],Shikha Shikha;Victor Tobiasson;Mariana Ferreira Silva;Jana Ovciarikova;Dario Beraldi;Alexander Mühleip;Lilach Sheiner,Publisher Correction: Numerous rRNA molecules form the apicomplexan mitoribosome via repurposed protein and RNA elements,"Publisher Correction: Numerous rRNA molecules form the apicomplexan mitoribosome via repurposed protein and RNA elements 
 "
