doi,is_relevant,journal,explanation,topic_words,authors,title,abstract
10.1038/s43247-025-02295-0,False,Communications Earth & Environment,该研究论文主要关注二氧化碳管道的选址与社会人口统计学特征之间的关系，特别是管道对不同收入、种族和教育程度的社区的影响。虽然二氧化碳是大气成分的一部分，并且与气候变化相关，但该研究的重点在于环境正义和社会公平问题，而非大气环境遥感技术本身。因此，它与空气质量监测、卫星观测或大气成分分析等遥感技术没有直接关联。,[],Julia A. Davis;Nafiseh Salehi;Liqing Li;Majid Shafiee-Jood,Carbon dioxide pipelines are disproportionally located in marginalized communities in the United States,"In the United States, communities with lower income live near carbon dioxide pipelines, while racial minorities and communities with lower education are more likely to live near pipelines in the future, according to an analysis that uses a statistical approach, population and pipeline routes data. 
 Carbon capture and storage and carbon dioxide removal technologies are pivotal for net-zero climate goals, requiring extensive carbon dioxide pipeline expansion across the U.S. However, as this network grows, concerns about safety and environmental justice intensify, due to insufficient regulations that may disproportionately expose marginalized communities to risks. Here, we empirically examine the environmental justice implications of existing and potential pipelines across communities. Using census-tract demographic data and pipeline spatial data, we applied LASSO regression to identify key demographic variables and incorporated them into binary logistic regression models to uncover if the locations of, and disadvantages associated with, carbon dioxide pipelines are equally distributed among different demographics. We find higher-income communities are less likely to host existing pipelines. Proposed pipelines are generally in areas with higher concentrations of Black residents, while areas with higher educational attainment show reduced likelihood. Using the Net Zero America study’s 2030 projection of carbon dioxide pipelines, we observe diminished impacts on higher-income and educated communities, although Black residents are less likely to have a pipeline in this scenario. All pipelines were more likely to be in rural areas. These findings reveal persistent demographic disparities in pipeline locations, underscoring concerns about resource accessibility and preparedness. In the United States, communities with lower income live near carbon dioxide pipelines, while racial minorities and communities with lower education are more likely to live near pipelines in the future, according to an analysis that uses a statistical approach, population and pipeline routes data."
10.1038/s43247-025-02314-0,True,Communications Earth & Environment,该研究论文探讨了人为气候变化对美国野火颗粒物污染造成的死亡人数和经济负担的影响。它通过整合气候预测、野火模型、烟雾模型以及排放和健康影响模型，量化了气候变化对美国各县和州（2006-2020年）因暴露于野火颗粒物而造成的死亡率和经济负担的贡献。虽然论文没有直接提及大气环境遥感技术，但其研究依赖于对颗粒物（一种大气成分）的监测和建模，并间接涉及空气质量监测和排放建模等遥感技术应用，因此与大气环境遥感技术具有相关性。,"['particulate matter', 'air quality monitoring', 'climate-wildfire models', 'emission modeling', 'health impact modeling']",Beverly E. Law;John T. Abatzoglou;Christopher R. Schwalm;David Byrne;Neal Fann;Nicholas J. Nassikas,Anthropogenic climate change contributes to wildfire particulate matter and related mortality in the United States,"Climate change contributed to 15,000 wildfire particulate matter deaths in the United States between 2006 and 2020, with a cumulative economic burden of $160 billion, according to observation-based modelling of climate, wildfire particulate matter, health, and economic impacts 
 Climate change has increased forest fire extent in temperate and boreal North America. Here, we quantified the contribution of anthropogenic climate change to human mortality and economic burden from exposure to wildfire particulate matter at the county and state level across the contiguous US (2006 to 2020) by integrating climate projections, climate-wildfire models, wildfire smoke models, and emission and health impact modeling. Climate change contributed to approximately 15,000 wildfire particulate matter deaths over 15 years with interannual variability ranging from 130 (95% confidence interval: 64, 190) to 5100 (95% confidence interval: 2500, 7500) deaths and a cumulative economic burden of $160 billion. Approximately 34% of the additional deaths attributable to climate change occurred in 2020, costing $58 billion. The economic burden was highest in California, Oregon, and Washington. We suggest that absent abrupt changes in climate trajectories, land management, and population, the indirect impacts of climate change on human-health through wildfire smoke will escalate. Climate change contributed to 15,000 wildfire particulate matter deaths in the United States between 2006 and 2020, with a cumulative economic burden of $160 billion, according to observation-based modelling of climate, wildfire particulate matter, health, and economic impacts"
10.1016/j.rse.2025.114758,False,Remote Sensing of Environment,该论文主要关注森林属性地图的不确定性量化问题，利用遥感数据（Sentinel-2卫星影像和机载激光扫描数据）和k-NN方法，结合共形预测技术，为森林资源的利用提供决策支持。研究内容集中于森林蓄积量、阔叶林蓄积量和洛雷高度等森林属性的制图，以及如何利用共形k-NN程序生成有效的预测区间。与大气环境遥感技术，如空气质量监测、卫星观测和大气成分分析等，没有直接关联。,[],M. Kuronen;J. Räty;P. Packalen;M. Myllymäki,"Uncertainty quantification for forest attribute maps with conformal prediction and <math xmlns:mml=""http://www.w3.org/1998/Math/MathML"" altimg=""si16.svg"" display=""inline"" id=""d1e418"" class=""math""><mi>k</mi></math>-nearest neighbor method","•Conformalk-NN prediction intervals were proposed for forest attribute maps. •Efficiency of conformalk-NN procedures was quantified using multiple measures. •Conformalizing SD and quantiles ofknearest neighbors led to efficient prediction intervals. •A theoretical coverage guarantee was proven for the conformal jackknifek-NN method. 
 Forest attribute maps relying on remotely sensed data are increasingly required for local decision-making related to the use of forest resources. Such maps always have uncertainty, which can be challenging to quantify. The objective of this work is to introduce the conformal prediction methodology to uncertainty quantification in forest attribute mapping, particularly for the k-NN method. We compare several conformal k-NN procedures for the mapping of total volume, broadleaved volume and Lorey’s height using Sentinel-2 satellite images and airborne laser scanning data. We show that all procedures produce valid prediction intervals in the sense that they contain the true value with the desired probability, for example 90%. We use multiple measures to quantify how well the prediction intervals adapt to the difficulty of prediction in different forest strata. We found that there are multiple methods for k-NN to produce prediction intervals competitive with those produced by conformal quantile regression. These methods include conformal prediction based on the standard deviation or quantiles of the k nearest neighbors with commonly used values of k. We present how to produce a forest attribute map with the proposed conformal prediction intervals. We also show a theoretical coverage guarantee for the jackknife conformal k-NN procedure. We recommend conformal prediction for unit-level uncertainty quantification of forest attribute maps."
None,False,Remote Sensing of Environment,由于标题和摘要均为空，无法判断该研究论文是否与大气环境遥感技术相关。无法确定其是否涉及空气质量监测、卫星观测或大气成分分析等主题。需要提供更多信息才能进行分析。,[],,Editorial Board,
10.1016/j.jag.2025.104549,False,International Journal of Applied Earth Observation and Geoinformation,该论文主要关注的是利用无人机遥感技术和深度学习方法进行大规模烟草识别。论文提出了一个大型无人机烟草数据集（LUSET），并设计了一种名为ConvFlow Transformer的模型来解决烟草识别中的挑战，例如烟草与其他作物的相似性以及烟草在不同生长阶段的差异性。该研究旨在提高烟草识别的准确性，属于精准农业和智慧农业的范畴，与大气环境遥感技术（如空气质量监测、卫星观测和大气成分分析）没有直接关联。,[],Wei Han;Shaohao Chen;Shuanglin Xiao;Yunliang Chen;Huihui Zhao;Jining Yan;Xiaohan Zhang;Sheng Wang,Large-scale tobacco identification via a very-high-resolution unmanned aerial vehicle benchmark and a ConvFlow Transformer,"•A large-scale UAV tobacco dataset has been proposed for the first time globally. •A ConvFlow Transformer is developed to address multiple tobacco mapping challenges. •A novel location-free self-attention is developed with a small amount of computation. •Extensive experiments proved that the superiority of the proposed structure. 
 Remote sensing and artificial intelligence technology have propelled the development of precision agriculture and smart agriculture. Among them, as a crucial economic crop, tobacco has been rarely studied and its large-scale identification task has consistently encountered several challenges. Firstly, tobacco is often inter-cropped with other crops, such as corn. These crops have similar colors and textures, with only minor differences in planting spacing and arrangement. These slight differences become even less observable in remote sensing imagery. Secondly, tobacco growth is a continuous and evolving process, resulting in drastically different characteristics during various growth stages and seasons, which further complicates the task of identification. Moreover, to the best of our knowledge, no tobacco dataset is accessible to the public, impeding the development of a deep learning (DL) model with optimal performance. Therefore, a Large-scale UAV remote SEnsing Tobacco dataset (LUSET) which is the world’s first tobacco dataset with a total volume of 67GB has been conducted in this paper. 10 large-scale images in the LUSET are accurately annotated with an average resolution of about 20,000 × 20,000 pixels, which can be divided into 7,252 512 × 512 samples1. Then, a dual-branch ConvFlow Transformer is proposed to address tobacco’s rich diversity and high inter-class similarity among different crops. A novel Convolutional Feature-enhanced Multi-Head Self-attention (CF-MHSA) with a location-free design in the ConvFlow Transformer is developed to replace the value matrix in the standard attention with the convolutional multi-scale features, which effectively achieves feature interaction and fusion from the convolutional and transformer branches. The fusion of refined features allows us to better distinguish the texture characteristics of different crops and represent their morphological features during different growth cycles. This addresses the two major challenges in tobacco recognition. Extensive experiments on the UAV tobacco data proved that the strategy of ConvFlow Transformer can be easily achieved in the mainstream Transformers and significantly improve their performance in tobacco identification with a small amount of computation."
None,False,Atmospheric Environment,由于只提供了标题“Editorial Board”和摘要“Abstract:”，没有提供任何关于研究内容的信息，因此无法判断该论文是否与大气环境遥感技术相关。无法提取任何主题词，也无法用中文解释论文内容。,[],,Editorial Board,
None,False,Atmospheric Research,由于只提供了标题“Editorial Board”和摘要“Abstract:”，没有提供任何关于研究内容的信息，因此无法判断该文章是否与大气环境遥感技术相关。无法提取任何主题词，也无法对文章内容进行解释。,[],,Editorial Board,
10.1126/science.adx4908,False,Science,该研究的标题和摘要表明其主要关注点是林业的回流（onshoring）所带来的好处，强调了科学依据。这可能涉及经济效益、供应链优化以及环境影响等方面。虽然林业与环境相关，但该研究似乎并未直接涉及大气环境遥感技术，如空气质量监测、卫星观测或大气成分分析。因此，它与大气环境遥感技术的关联性较低。,"['forestry', 'onshoring', 'supply chain', 'economic benefits', 'environmental impact']",Matthew G. Betts;Jerry F. Franklin;Jacob J. Bukoski;Z. Burivalova;Emily E. Conklin;Thomas H. DeLuca;Amelia Fitch;Austin Himes;Rajat Panwar;Hannah Sachs;R. Alex Wiebe;Gianluca Cerullo,Benefits of onshoring forestry rely on science,
10.1126/science.ady6483,False,Science,该研究的标题和摘要表明，它主要关注放射性碳定年法如何修正对土著社会历史的理解。 这与大气环境遥感技术（如空气质量监测、卫星观测或大气成分分析）没有直接关系。 该研究似乎属于考古学、人类学或历史学领域，而非环境科学或遥感领域。因此，它与大气环境遥感技术不相关。,[],Lizzie Wade,Radiocarbon dates revise histories of Indigenous societies,
10.1126/science.ady6484,False,Science,该研究的标题和摘要表明其主要关注点是树木年轮分析，旨在构建非洲首个干旱图集。虽然干旱与大气环境有关，但该研究的核心方法是树木年轮分析，而非大气环境遥感技术，如空气质量监测、卫星观测或大气成分分析。因此，该研究与大气环境遥感技术的关联性不强。,[],Paul Voosen,Hunt for tree rings could yield Africa’s first drought atlas,
10.1126/science.ady6485,False,Science,该研究标题和摘要表明，它主要关注水稻的耐热性，特别是通过单个基因来提高水稻在高温环境下的适应能力。这与大气环境遥感技术，如空气质量监测、卫星观测和大气成分分析，没有直接关联。因此，该研究与大气环境遥感技术关系不大。,[],Erik Stokstad,A single gene helps rice handle the heat,
10.1126/science.ady6486,False,Science,根据提供的标题《关税战对中国实验室造成损失》和摘要（内容为空），可以判断这篇论文主要关注关税战对中国实验室的影响。主题词包括关税战、中国、实验室、经济和贸易。因此，这篇论文与大气环境遥感技术（如空气质量监测、卫星观测和大气成分分析）没有直接关系。论文更侧重于经济和贸易政策对科研机构的影响。,"['Tariff War', 'China', 'Laboratories', 'Economics', 'Trade']",Richard Stone,Tariff war takes toll on labs in China,
10.1126/science.ady6487,False,Science,根据提供的标题和摘要，这份报告主要关注的是生态学家在职业道德方面的行为，而非大气环境遥感技术。因此，它与空气质量监测、卫星观测或大气成分分析等主题无关。这份报告似乎在调查生态学家的职业操守问题。,[],Cathleen O’Grady,"Ecologist blurred professional boundaries, report finds",
10.1126/science.ady6488,False,Science,根据提供的标题“中国公布将分享其珍稀月球样本的外国科学家”，以及摘要为空，该论文主要关注的是中国月球样本的国际合作分配，与大气环境遥感技术，如空气质量监测、卫星观测或大气成分分析等，没有直接关联。因此，该论文与大气环境遥感技术的相关性较低。,[],Dennis Normile,China reveals the foreign scientists who will share its rare lunar samples,
10.1126/science.ady6489,False,Science,根据标题提供的信息，这篇论文主要讨论的是美国国家科学基金会（NSF）主任辞职以及随之而来的拨款削减和人员缩减问题。这与大气环境遥感技术，如空气质量监测、卫星观测或大气成分分析等领域没有直接关系。因此，该论文与大气环境遥感技术的相关性较低。,"['NSF', 'grants', 'staff reductions']",Jeffrey Mervis,NSF director resigns amid cuts to grants and staff reductions,
10.1126/science.ady6158,False,Science,根据提供的标题《地穴传说》和摘要为空，无法判断其与大气环境遥感技术的关联性。标题暗示该作品可能属于恐怖或奇幻类型的故事集，与空气质量监测、卫星观测或大气成分分析等主题无关。,[],Andrew Curry,Tales from the crypt,
10.1126/science.adx5458,False,Science,该论文的标题和摘要主要关注后真相时代以及科学教育如何忽视这一现象。它与大气环境遥感技术，如空气质量监测、卫星观测和大气成分分析，没有直接关系。因此，该论文探讨的是教育和社会认知领域的问题，而不是大气科学或遥感技术。,[],Sibel Erduran,The post-truth era and how science education keeps ignoring it,
10.1126/science.ady5490,False,Science,由于只提供了标题“细则——科学的新面貌”和摘要为空，无法判断该研究论文是否与大气环境遥感技术相关。根据标题推测，该论文可能探讨的是科学研究的新趋势、新规范或者新的呈现方式，但没有明确指向大气环境遥感，如空气质量监测、卫星观测或大气成分分析等具体应用。,[],Beth Rakouskas;H. Holden Thorp,Fine print—Science’s new look,
10.1126/science.ady5524,False,Science,"由于标题和摘要为空，无法判断该研究是否与大气环境遥感技术相关。因此，我们假设该研究与大气环境遥感技术无关。

",[],Authors not available,New Products,
10.1126/sciadv.ado6644,False,Science Advances,该研究论文主要关注软骨细胞周围基质（PCM）的生物力学特性和发展过程，特别是胶原蛋白VI的组装和透明质酸的作用。它探讨了细胞外基质的组成和超微结构如何影响软骨的物理性质，以及动态压缩如何影响PCM的成熟。该研究与大气环境遥感技术（如空气质量监测、卫星观测和大气成分分析）没有直接关系。因此，该论文与大气环境遥感技术不相关。,[],Donghee Lee;Sydney E. Greer;Andrew T. Dudley,Development of the mechanoresponsive pericellular matrix of chondrons,"Physical properties of cartilage are conferred by the composition and ultrastructure of the extracellular matrix. This study focuses on the development of the pericellular matrix (PCM), a domain that directly contacts the chondrocyte and is a key regulator of biomechanical and biochemical signaling. Using three-dimensional cell culture, microfluidic cell compression platforms, and genetic mouse models, we demonstrated that collagen VI is initially assembled at the cell surface and then displaced to form a shell at the PCM-territorial matrix boundary. Cell surface–bound hyaluronan is crucial for the assembly process, and hyaluronan-aggrecan complexes drive displacement. Integrin adhesion is not required early but is crucial to determine the final placement of the collagen VI shell. Dynamic compression accelerated PCM maturation except in aggrecan mutants. Together, these findings provide key insights into the development of the mechanosensitive PCM and establish an in vitro platform to support studies of matrix biology in normal and disease models."
10.1126/sciadv.adq8425,False,Science Advances,该论文研究有孔虫的钙化过程，重点是有孔虫如何通过pH调节和离子运输来形成外壳。虽然海洋环境与大气环境存在相互作用，但该研究主要集中在生物钙化机制上，与大气环境遥感技术（如空气质量监测、卫星观测和大气成分分析）没有直接关系。因此，该论文与大气环境遥感技术的相关性较低。,[],Daniel François;Gert-Jan Reichart;Lennart J. de Nooijer,Open or closed: pH modulation and calcification by foraminifera,"Marine calcifying organisms precipitate their shells either in equilibrium with seawater or under strict biological control. Here, we show that these two options represent two ends of a spectrum. In species with a more “closed” system, rates of H+removal and Ca2+uptake are high and exceed the amount of ions required for calcification. This explains the relatively low Mg/Ca of the calcite of this species by dilution of the [Mg2+] in the calcifying fluid. Conversely, in species with a more open system, the H+and Ca2+fluxes are lower, with more seawater exchanged between the environment and calcifying fluid, explaining the relatively high Mg/Ca in these foraminifera. In either of these species, mitochondria were found to be located at the site where the Ca2+/H+exchange takes place and the mitochondrial density aligned with the rate of pumping. These findings highlight the crucial role of transmembrane transporters and mitochondria in foraminifera calcification and explain the species-specific elemental signatures."
10.1126/sciadv.adr4026,False,Science Advances,这篇论文主要关注的是空间转录组学方法，特别是如何通过一种集合交换方法来提高多重分析能力和误差鲁棒性。它探讨了如何优化扩展的汉明码书，用于像MERFISH这样的成像空间转录组学方法。该研究与大气环境遥感技术（如空气质量监测、卫星观测和大气成分分析）没有直接关系，因为它主要集中在基因表达的空间分析和相关技术优化上。,[],Johan Boström;Michaɫ Zapaɫa;Igor Adameyko,Boosting multiplexing capabilities for error-robust spatial transcriptomic methods using a set exchange approach,"In the last decades, image-based transcriptomic and proteomic experiments have moved from single-target probes to multiplexed experiments, allowing researchers to study hundreds or even thousands of mRNA and protein targets simultaneously. This large increase in scope necessitates methods in either increased specificity or in error correction, such as the Hamming codes used in the imaging-based spatial transcriptomic method MERFISH. For some experimental conditions, Hamming codes are efficient in encoding the highest possible number of genes for spatial analysis. However, for most experimental parameters, the optimal generation of error-robust codebooks is an unsolved mathematical problem. Here, we present a method to generate highly optimized extended Hamming codebooks compatible with established error-correctable methodologies such as MERFISH. Our method uses an iterative set-exchange approach and generally reaches over 90% of the theoretical maximum limit of gene set complexity. We also provide ready-to-use codebooks and discuss the advantages and disadvantages of changing probe density."
10.1126/sciadv.ads3919,False,Science Advances,该研究论文主要关注锌基液流电池的电极材料和性能提升，特别是通过使用液态金属电极来实现超高的面积容量和超长的循环寿命。虽然能量存储技术与可再生能源的整合有关，间接影响大气环境，但该论文本身与大气环境遥感技术（如空气质量监测、卫星观测、大气成分分析等）没有直接关系。因此，该论文与大气环境遥感技术的相关性较低。,[],Shengnan Wang;Deshuai Yang;Pu Zhang;Yihui Guo;Xingjun Liu;Ming Zhao;Jiaxiong Zhu;Pei Li;Xianfeng Li;Jun Fan;Chunyi Zhi,Liquid metal anode enables zinc-based flow batteries with ultrahigh areal capacity and ultralong duration,"Zinc-based flow batteries (Zn-FBs) are promising candidates for large-scale energy storage because of their intrinsic safety and high energy density. Unlike that conventional flow batteries operate on the basis of liquid-liquid conversions, the Zn anode in Zn-FBs adopts a solid-liquid conversion reaction, presenting challenges such as dendrite formation, poor reversibility, and low areal capacity, limiting its long-duration energy storage (LDES) applications. Here, we developed a liquid metal (LM) electrode that evolves the deposition/dissolution reaction of Zn into an alloying/dealloying process within the LM, thereby achieving extraordinary areal capacity and dendrite-free Zn-FBs with outstanding cycling stability. Both Zn-I2and Zn-Br2flow batteries using LM electrodes exhibited an ultrahigh areal capacity of 640 milliampere-hours per square centimeter, corresponding to an ultralong discharge duration of ~16 hours, thus exceeding the LDES standard defined by the US Department of Energy. This study breaks the solid-liquid working mode of the Zn anode, offering an effective solution for LDES applications with Zn-FBs."
