doi,is_relevant,journal,explanation,topic_words,authors,title,abstract
10.1016/j.rse.2025.114607,False,Remote Sensing of Environment,这篇论文主要关注的是利用ICESat-2卫星数据结合Sentinel-2卫星影像，通过机器学习方法改进海冰分类的研究。它并非直接研究大气环境遥感技术，例如空气质量监测、卫星观测大气成分等。文中使用的ICESat-2卫星主要用于测量海冰高度和类型，Sentinel-2卫星则提供光学影像用于辅助分类。因此，虽然使用了遥感技术，但研究对象是海冰，与大气环境遥感关系不大。,"['sea ice', 'ICESat-2', 'Sentinel-2', 'satellite imagery', 'sea ice classification', 'machine learning', 'remote sensing']",Wenxuan Liu;Michel Tsamados;Alek Petty;Taoyong Jin;Weibin Chen;Julienne Stroeve,Enhanced sea ice classification for ICESat-2 using combined unsupervised and supervised machine learning,"•Enhanced ICESat-2 sea ice classification guided by coincident Sentinel-2 imagery. •A combined unsupervised - supervised (CUS) method is used for classification. •Lead detection in ATL07 data with a precision of 98.6 % and a recall of 91.8 %. •Introducing a new gray ice category to improve sea ice classification. 
 ICESat-2 provides the potential for high-resolution and accurate measurements of the sea ice state. However, the current ATL07 sea ice height and type product relies on a threshold method for surface type classification, which introduces uncertainties in lead detection, especially in summer. In addition, it only categorizes into sea ice and lead types, excluding gray ice and the dark lead category has been shown to misclassify leads in cloudy conditions. To address these issues, we seek to improve the surface type classification by combining unsupervised and supervised machine learning methods and leveraging coincident imagery obtained from Sentinel-2. First, we use an unsupervised Gaussian Mixture Model (GMM) with four statistical parameters—photon rate, background rate, width of distribution, and height—to group ATL07 segments into 80 clusters. These clusters are then assigned specific surface types—sea ice, gray ice, or lead—based on coincident Sentinel-2 imagery. In the second step, we train a supervised K-nearest neighbor (KNN) classification model using the labeled segments from the GMM as training data. We conduct Leave One Group Out cross-validation of our model using coincident Sentinel-2 images as the ground truth, analyzing 717,009 strong beam and 702,843 weak beam ATL07 segments. The results demonstrate an improvement in lead detection, with precision values reaching approximately 98.6 % for strong beams and 97.5 % for weak beams and recall values of 91.8 % for strong beams and 90.3 % for weak beams. Our approach is applied to both Antarctic and Arctic sea ice, and is extended to include a new gray ice category, which agrees reasonably well with the coincident Sentinel-2 images. Our new sea ice and lead classification approach shows great promise for improving sea surface height and sea ice freeboard retrievals from ICESat-2 and highlights the significant value of coincident satellite imagery for classification training and validation."
10.1016/j.rse.2025.114614,False,Remote Sensing of Environment,这篇论文提出了一种基于滑动窗口的海岸测深方法，用于处理ICESat-2卫星的单光子激光雷达数据。该方法旨在解决现有方法在处理光子密度变化较大的数据时存在的噪声问题，提高海岸水深测量的精度和稳定性。研究使用了ICESat-2卫星数据，对六个岛屿海岸进行了实验，结果表明该方法有效，RMSE值较低。该研究主要关注的是利用空间激光雷达数据进行水深测量，与大气环境遥感技术（如空气质量监测、卫星观测和大气成分分析）关系不大。,[],Jinchen He;Shuhang Zhang;Wei Feng;Xiaodong Cui;Min Zhong,A sliding window-based coastal bathymetric method for ICESat-2 photon-counting LiDAR data with variable photon density,"•A novel coastal bathymetric method for single-photon data based on sliding windows. •Density-adaptive photon extraction of water surface and underwater terrain. •Elliptic domain for underwater terrain photon extraction constrained by seed points. •ICESat-2 derived calibration water depths with controllable number and spacing. 
 Coastal bathymetry is of great significance to the development and protection of islands and reefs. Traditional ship-based sonar bathymetry and airborne LiDAR (Light Detection and Ranging) bathymetry make it difficult to efficiently map the water depth of remote islands and reefs. Notably, the photon-counting LiDAR on board ICESat-2 (Ice, Cloud, and Land Elevation Satellite-2) has the capability of shallow water bathymetry. However, the photon data acquired by this instrument is contaminated with substantial noise of varying density. In this study, a sliding window-based coastal bathymetric method (SWCBM-Ph) is proposed for photon data with variable density. Experiments are carried out on six island coasts as an example, and the results show that the method is effective in extracting underwater terrain photons for bathymetry, with RMSE (Root Mean Square Error) of 0.60 m and 0.53 m on low- and high-density photon datasets separately within water depth of 30 m. Compared with existing bathymetry methods, the SWCBM-Ph is less affected by noise signals, and adapts to variations in photon density, including diversities between different datasets and within the same dataset. Therefore, the proposed method helps to improve the stability of spaceborne photon bathymetry for complex situations in coastal waters."
None,False,Remote Sensing of Environment,由于没有提供标题和摘要，无法判断其与大气环境遥感技术的关系。请提供标题和摘要以便进行分析。,[],,Editorial Board,
None,False,International Journal of Applied Earth Observation and Geoinformation,这篇论文的标题和摘要表明，其研究重点是南方大平原地区木本物种入侵的机制及其分类。研究将环境数据整合到物种入侵的研究中，但并没有直接提及大气环境遥感技术，例如空气质量监测、卫星观测或大气成分分析。因此，该研究与大气环境遥感技术的相关性较弱。,[],Justin Dawsey;Nancy E. McIntyre,Incorporating environmental data to refine the classification and understanding of the mechanisms behind encroachment of a woody species in the Southern Great Plains (USA),
None,False,International Journal of Applied Earth Observation and Geoinformation,该论文标题和摘要表明，这是一篇关于南京市院前急救设施布局优化的研究。研究利用多源大数据，特别是时空分析方法，对院前急救设施的布局进行优化。文章并未涉及大气环境遥感技术，例如空气质量监测、卫星观测和大气成分分析等。因此，该研究与大气环境遥感技术关系不大。,[],Bing Han;Wanqi Hu;Xilu Tang;Jiemin Zheng;Mingxing Hu;Zhe Li,Corrigendum to “Optimization of pre-hospital emergency facility layout in Nanjing: A spatiotemporal analysis using multi-Source big data” [Int. J. of Appl. Earth Obs. Geoinf. 133 (2024) 104112],
None,False,International Journal of Applied Earth Observation and Geoinformation,这篇论文的标题和摘要表明，它提出了一种基于AWC-LSTM模型的新型地表形变预测方法。这是一种利用人工智能技术进行地表形变预测的方法，与大气环境遥感技术，例如空气质量监测、卫星观测和大气成分分析等，并没有直接关系。论文的核心内容是地表形变预测，而不是大气环境的监测或分析。因此，它与大气环境遥感技术的相关性较弱。,[],Yu Chen;Xinlong Chen;Shanchuan Guo;Huaizhan Li;Peijun Du,A novel surface deformation prediction method based on AWC-LSTM model,
10.1016/j.atmosenv.2025.121052,True,Atmospheric Environment,这篇论文研究了蒙古国乌兰巴托市大气气溶胶粒子的实时粒径分布。研究使用了地面实测数据，而非遥感技术。通过一年的实时测量，研究揭示了乌兰巴托市不同季节大气气溶胶粒子的粒径分布特征及其日变化规律。结果表明，冬季的粒子数浓度是其他季节的4-11倍，主要由燃烧排放的原生粒子贡献。研究还分析了不同粒径范围的粒子在数量和体积上的分布，以及硝酸盐与硫酸盐的比例，以确定污染源。虽然没有直接使用卫星遥感或其他大气环境遥感技术，但该研究提供了重要的地面实测数据，有助于改进大气环境遥感技术的应用和模型的验证，对理解乌兰巴托市冬季严重空气污染的成因具有重要意义。,"['Particulate Matter (PM)', 'Aerosol particles', 'Size distribution', 'Air quality monitoring', 'Ground-based measurements', 'Number concentration', 'Winter pollution', 'Combustion emissions']",Mingyeong Kim;Yoonkyeong Ha;Jeongbeen Kim;Ji Yi Lee;Yong Pyo Kim;Amgalan Natsagdorj;Changhyuk Kim,"First real-time size distribution measurements of aerosol particles in Ulaanbaatar, Mongolia","•First measurements of particle size distributions in Ulaanbaatar were conducted. •Winter pollution in Ulaanbaatar was severe, 4–11 times higher than other seasons. •Combustion caused primary emissions contributed most to the winter air pollution. 
 Mongolia in northeastern Asia encounters severe atmospheric particulate matter (PM) pollution during winter. Although many researchers have investigated PM haze in Mongolia using filter sample analyses to understand its formation mechanisms and sources, the formation and growth of atmospheric PM in Mongolia are currently unknown because of the deficiency of real-time measurements of particle size distributions. In this study, the number size distributions of atmospheric particles (PNSDs) in Ulaanbaatar, Mongolia, were measured over a year using real-time aerosol instruments to better understand the formation and growth of atmospheric PM at different timescales using meteorological data. The diurnal variations in PNSDs in different seasons had similar patterns, but different particle number concentrations (PNCs). A weak new particle formation (NPF) in the daytime was observed only in summer under the cleanest air quality of the year. In winter, the PNSD exhibited 4–11 times higher PNC than that in the other seasons. The highest PNCs in winter were strongly correlated with the primary particles produced by combustion such as that in heating and power generation. In addition, the PNCs at nighttime were generally higher than those during the daytime, with larger modal sizes throughout the year. In terms of particle size ranges, Aitken- and accumulation-mode particles (which are detrimental to human health) were dominant in the number and volume size distributions of particles, respectively. The diurnal variations in PNC displayed dual peaks in the morning and late evening. This matched the primary particle emissions from traffic and coal/biomass burning. The nitrate-to-sulfate ratios revealed that stationary sources mainly contributed to high PM concentrations throughout the year except in summer. The significant Pearson correlation coefficients between particles and gaseous pollutants also supported primary particle emissions through combustion in winter."
10.1016/j.atmosenv.2025.121053,True,Atmospheric Environment,这项研究关注韩国中等规模住宅城市PM2.5浓度升高事件的特征，特别是与有机物浓度增加的关系。研究测量了四个有机化合物类别（糖类、二羧酸、脂肪酸和松属酸）的浓度，分析了它们在不同季节（暖季、过渡季和冷季）以及PM2.5高浓度事件中的变化。结果表明，有机物是PM2.5的主要成分，生物质燃烧是冷季有机气溶胶的重要来源。冷季不饱和脂肪酸的氧化老化效率较高，而二羧酸在大多数PM2.5高浓度事件中浓度显著增加。二次生成和气溶胶老化在提高PM2.5浓度中发挥了重要作用。该研究与大气环境遥感技术密切相关，因为它通过地面观测数据分析了大气成分（特别是PM2.5及其组成成分）的变化，这有助于改进空气质量监测和模型，从而为环境管理提供数据支持。,"['PM2.5', 'organic matter', 'atmospheric composition', 'air quality monitoring', 'dicarboxylic acids', 'fatty acids', 'sugars', 'biomass burning', 'secondary organic aerosol', 'aerosol aging']",Hye-Ji Lee;Hyo-Won Lee;Sung-Won Park;Ji-Won Jeon;Pyung-Rae Kim;Kyung-Hwan Kwak;Young-Ji Han;Thomas M. Holsen;Seung-Ha Lee;Hyun-Gu Jung;Seung-Hwan Cha;Jung-Min Park;Myung-Soo Yoo,Characteristics of elevated PM<sub>2.5</sub> events driven by enhanced organic compound concentrations in a South Korean residential city,"•Organic matter was the largest contributor to PM2.5. •Biomass burning was an important source of organic aerosol during the cold season. •Unsaturated fatty acids were efficiently aged during the cold season. •Dicarboxylic acid concentrations increased considerably during most high PM2.5concentration episodes. •Secondary formation and aerosol aging played a significant role in enhancing PM2.5concentrations. 
 Organic matter is often the largest contributor to PM2.5, but its emission sources and formation pathways are very diverse, making it challenging to identify the causes of high concentration episodes. In this study, four groups of organic compounds that contribute to PM2.5, including sugars, dicarboxylic acids (DA), fatty acids (FA), and pinonic acid (PNA) were measured in a medium-sized residential city in South Korea during three seasons, where high PM2.5 concentration episodes often occur. The average concentrations of PM2.5 and total quantified organic matter (∑17 qOM) was 21 ± 12 μg m−3 and 391 ± 183 ng m−3, respectively. The concentration of ∑sugars was higher during the colder seasons compared to the warm season (32 ± 18 ng m−3, 240 ± 109 ng m−3, and 231 ± 105 ng m−3 in the warm, transition, and cold seasons, respectively). In contrast, ∑DAs exhibited the opposite seasonal trend (234 ± 164 ng m−3, 114 ± 103 ng m−3, and 140 ± 103 ng m−3 in the warm, transition, and cold seasons, respectively). The contribution of ∑FA to qOM was relatively consistent (13.1% in warm season to 15.6% in colder seasons). PNA, a biogenic secondary organic aerosol tracer, had a significantly higher concentration during the warm season (16 ± 13 ng m−3 in warm season vs. 3 ± 3 ng m−3 in colder seasons). A strong correlation between ∑sugars and ∑FAs (r = 0.72) was observed only in the transition season, when crop residue burning was determined to be important. Unsaturated FAs were likely to be efficiently aged during the cold season since the ratio of C18:0 to C18:1, a tracer for the age of aerosol, increased. DAs were generally dominant in the warm season, but also significantly increased during most high PM2.5 concentration episodes (HCEs; 306 ± 199 ng m−3), which primarily occurred in the colder season. During HCEs appearing in colder season, the ratio of malonic acid (C3) to succinic acid (C4), a tracer for photochemical aging of air masses, also increased, suggesting that the secondary aerosol formation and aerosol aging significantly enhanced PM2.5 concentration."
10.1016/j.atmosenv.2025.121056,True,Atmospheric Environment,这篇论文研究了风沙尘对美国上空不同粒径气溶胶酸度的影响。研究使用PMCAMx化学传输模型，结合风沙尘排放模型，量化了2017年2月和7月风沙尘对美国不同高度气溶胶pH值的影响。结果表明，风沙尘会显著增加PM1和PM1-2.5的pH值，尤其是在夏季和西部地区，对粗颗粒物的影响较小。这种影响与海拔高度和硝酸盐粒径分布有关。该研究与大气环境遥感技术密切相关，因为它关注大气成分（气溶胶酸度、粒径分布、风沙尘浓度）的变化，这些变化可以通过地基或卫星遥感技术进行监测和分析。虽然论文本身没有直接提及具体的遥感技术或卫星传感器，但其研究结果可以为改进大气成分分析模型和提高空气质量监测的准确性提供数据支持。,"['Aerosol acidity', 'PM1', 'PM2.5', 'Particle size distribution', 'Wind-blown dust', 'Air quality monitoring', 'Satellite observations (indirectly)', 'Atmospheric composition analysis']",Stylianos Kakavas;Evangelia Siouti;Athanasios Nenes;Spyros N. Pandis,Effects of wind-blown dust emissions on size-resolved aerosol acidity over the US,"•Wind-blown dust increases the summer pH of PM1up to 3.5 units. •Smaller effect (up to 1 unit) in the winter. •Smaller effects on coarse particles which already have high pH. •The dust effect on PM1pH decreases with altitude. •The effects are partially due to the changes in nitrate size distribution. 
 Wind-blown dust can affect the acidity of all particles, impacting a series of related chemical processes. In this work, we use a wind-blown dust emissions model along with the hybrid version of aerosol dynamics in the PMCAMx chemical transport model to quantify the effects of dust on size-resolved aerosol pH over the U.S during February and July 2017 as a function of altitude. The version of the model used can capture the most important range of pH values (less than 5), while particles that are more alkaline than this threshold are assumed to have pH equal to 5. Our simulations indicate that wind-blown dust can increase ground level PM1 pH up to 1 unit during wintertime and up to 3.5 units during summertime in the western U.S. For PM1−2.5, the corresponding increases are higher during wintertime (up to 1.5 units) and a little lower during summertime (up to 3 units) compared to PM1. For coarse particles (PM2.5−5 and PM5−10), the impact of wind-blown dust is predicted to be lower since in most areas the corresponding pH is already quite high due to the presence of dust from anthropogenic activities (e.g., agriculture, resuspension due to traffic). The impact of wind-blown dust on aerosol acidity decreases with altitude for PM1 mainly because of the reduction of aerosol water. On the other hand, for PM1−2.5, the predicted effect increases with altitude due to the lower pH at higher altitudes. PM1 and PM1−2.5 acidity can be affected significantly by wind-blown dust for both simulated periods impacting at the same time secondary aerosol formation, emissions control strategies, solubility of metals, and nitrogen deposition."
10.1016/j.atmosenv.2025.121057,False,Atmospheric Environment,这篇论文研究的是室内环境中挥发性有机化合物（VOCs）的浓度，以及人员活动和通风系统对其的影响。研究使用了质子转移反应飞行时间质谱法 (PTR-ToF-MS) 实时监测办公室环境中 VOCs 的浓度变化，分析了不同通风控制场景下的 VOCs 浓度。结果表明，人员活动是室内 VOCs 的主要来源 (77.8%)，其次是建筑物本身 (12.9%) 和新风 (9.30%)。降低通风系统循环比例可以有效降低室内 VOCs 浓度。该研究关注的是室内空气质量，与大气环境遥感技术，例如空气质量监测、卫星观测和大气成分分析等，关系不大。,"['volatile organic compounds', 'indoor air quality', 'human occupancy', 'ventilation', 'building emissions']",Siyeon Joo;Berkay Yesildagli;Jung-Hwan Kwon;Jiwon Lee,Comparative analysis of indoor volatile organic compound levels in an office: Impact of occupancy and centrally controlled ventilation,"•113 indoor VOCs quantified using PTR-ToF-MS under varied occupancy and ventilation. •Occupant, building, and supply air contribute to 77.8, 12.9, and 9.30% indoor VOCs. •Emission rates were quantified by considering natural ventilation (117.36 m3h−1). •Decreased ventilation recirculation ratio reduced indoor VOC concentration by 55.1%. 
 Understanding the effects of human occupancy and ventilation on indoor air quality, especially in the presence of volatile organic compounds (VOCs), is crucial for human health. We investigated VOC concentrations in an office environment with varying occupancy and ventilation in real-time via proton transfer reaction time-of-flight mass spectrometry by evaluating conditions across different ventilation control scenarios. Among the 276 analyzed species, 113 VOCs were quantified, where 77.8% of the total emission rate is attributed to human occupancy, 12.9% to building sources, and 9.30% to supply air. The emissions rates of occupants and building were quantified by considering natural ventilation (Q = 117.36 m3 h−1) in the emission source, which increased their emission rate by 31.5%. A decrease in the ventilation recirculation ratio (RR = 0.5) reduced the total concentration of indoor VOCs by 55.1% owing to the introduction of fresh ambient air. Notably, daytime measurements with the half-open damper of the ventilation system highlighted the importance of controlled ventilation in mitigating VOC presence. Our findings suggest that considering natural ventilation is important in assessing indoor air quality, that HVAC system management is crucial in enhancing indoor air quality, and that building design and operational strategies must be optimized for the health of indoor environments."
None,False,Atmospheric Environment,由于没有提供标题和摘要，无法判断其与大气环境遥感技术的关系。请提供标题和摘要以便进行分析。,[],,Editorial Board,
10.1016/j.atmosres.2025.107943,True,Atmospheric Research,这篇论文研究了气溶胶对四川盆地闪电活动日变化的影响。研究利用2010-2018年夏季的云地闪数据、气溶胶光学厚度（AOD）数据以及其他气象数据，将研究期间划分为污染年份（2010-2013）和清洁年份（2015-2018），对比分析了不同年份闪电活动日变化的差异。结果表明，污染年份的闪电活动在下午和傍晚时段减少，但在其他时段没有显著差异；污染年份的雷暴强度更高，云地闪密度更大。研究认为，气溶胶的辐射效应主要通过改变雷暴的频率来影响闪电活动，而微物理效应主要通过调节雷暴强度来影响闪电活动。该研究与大气环境遥感技术密切相关，因为它利用了气溶胶光学厚度（AOD）等遥感数据来研究大气成分变化对闪电活动的影响，体现了卫星观测和大气成分分析在研究大气环境中的应用。,"['Aerosol optical depth', 'Cloud-to-ground lightning', 'Satellite observations', 'Air quality monitoring', 'Atmospheric composition analysis', 'Radiative effect of aerosols', 'Microphysical effect of aerosols', 'Thunderstorm', 'Diurnal variation']",Haichao Wang;Yongbo Tan;Zheng Shi;Tianxue Zheng,"Effects of aerosols on diurnal variation of lightning activity in the Sichuan Basin, China","•Polluted years exhibit less thunderstorms during late afternoon and early evening. •Thunderstorms in polluted years have a higher cloud-to-ground lightning density. •More extreme samples dominated by nocturnal lightning are found in polluted years. •The radiative impact of aerosols primarily alters the number of thunderstorms. •The microphysical effects of aerosols mainly influence the thunderstorm intensity. 
 Aerosols can affect the lightning activity through radiative and microphysical effects. This study attempts to reveal the distinct impact pathways of these two effects on lightning activity. Using data of cloud-to-ground (CG) lightning, aerosol optical depth (AOD), thermodynamic, and cloud-related variables during the summer (June, July, and August) of 2010–2018 in the Sichuan Basin, we investigate the changes in the diurnal variation of lightning activity characteristics between polluted (2010−2013) and clean (2015–2018) years. Polluted years exhibit more thunderstorms during the late afternoon and early evening hours than clean years, but show no significant differences in other time periods. During all time periods, thunderstorms in polluted years are more intense, with a higher CG lightning density. Aerosols exhibit more intense radiative effect during afternoon and early evening hours in polluted years, which reduces the surface temperature, thereby enhancing atmospheric stability and inhibiting the formation of convection. The cloud liquid water and cloud ice water content in polluted years are higher, suggesting stronger aerosol microphysical effects. These results indicate that the radiative effect of aerosols primarily influences lightning activity by altering the frequency of thunderstorms, whereas the microphysical effect of aerosols predominantly affects lightning activity by modulating the intensity of thunderstorms."
