doi,is_relevant,journal,explanation,topic_words,authors,title,abstract
10.1029/2025GL114595,False,Geophysical Research Letters,该论文主要研究南极半岛地表质量平衡变化引起的粘弹性固体地球形变。虽然涉及到利用GPS数据进行观测，但其核心在于冰川和地质物理过程，而非大气环境遥感技术。论文关注的是冰盖变化对地球形变的影响，以及由此推断出的地幔粘度，与大气质量、大气成分或空气质量监测等大气遥感主题无关。,[],Grace A. Nield;Michael J. Bentley;Achraf Koulali;Peter J. Clarke;Matt A. King;Terry Wilson;Pippa L. Whitehouse,Surface Mass Balance Variability Causes Viscoelastic Solid Earth Deformation in the Antarctic Peninsula,"Present‐day ice‐mass changes in Antarctica typically deform the solid Earth elastically, and this signal needs removing from Global Positioning System (GPS) observations of displacement before they can be used to constrain models of glacial isostatic adjustment. However, much of West Antarctica is underlain by weak upper mantle, meaning these short‐term fluctuations may also cause viscous (transient or steady‐state) deformation of the Earth. We model the viscoelastic response of the Earth to surface mass balance (SMB) variability in the Antarctic Peninsula and find an improved fit to GPS data at most sites compared to elastic only. Viscoelastic modeling constrains upper mantle steady‐state viscosity in the northern Peninsula to 5 × 1017 to 2 × 1018 Pa s, and >1 × 1018 Pa s for the mid to southern Peninsula. In the northern Peninsula, removing viscoelastic displacement caused by SMB variability from GPS time series increases estimated uplift rates by up to 3 mm/yr compared with using an elastic‐only correction."
10.1029/2025GL115972,False,Geophysical Research Letters,该研究论文主要关注的是季节性预测系统中美国西南部降水的预测技巧的季节性变化。它分析了8个季节性预测系统在10月至4月期间预测美国西南部降水的能力，发现这些模型在预测技巧上表现出显著的季节性特征。研究重点在于降水预测的准确性，以及影响预测技巧的因素，例如热带东太平洋海面温度的年周期和厄尔尼诺南方涛动。该研究与大气环境遥感技术（如空气质量监测、卫星观测和大气成分分析）没有直接关联。,"['precipitation', 'seasonal forecast', 'Southwest United States', 'El Niño Southern Oscillation']",Yannick Peings;Cameron Dong;Gudrun Magnusdottir,Seasonality in the Predictive Skill of Southwest United States Precipitation in the Seasonal Forecast Systems,"We examine seasonality in the skill of 8 seasonal forecast systems to predict the Southwest United States (SWUS) precipitation between October and April. The models share similarities in the large seasonality they exhibit in their prediction skill over the 1993–2016 period: from October to December, the skill is low if not non‐existent, before it gets higher in all the models, with a peak in February‐March in the model with an extended hindcast period (European Centre for Medium‐Range Weather Forecasts, ECMWF, 1981–2024 period). Using ECMWF, further analyses of daily precipitation illustrate how the model is able to better predict the SWUS precipitation over the February‐March forecast target window, versus November‐December. Higher precipitation in early February compared to early November is a contributing factor, as is the annual cycle in tropical eastern Pacific sea surface temperature, and the associated El Niño Southern Oscillation teleconnection with the extratropics."
10.1029/2025GL116241,False,Geophysical Research Letters,这篇论文主要研究热带气旋（TC）引起的次中尺度过程及其在冷尾流温度恢复中的作用。它侧重于海洋物理过程，特别是次中尺度涡旋的形成机制、垂直热通量以及它们对海洋温度的影响。虽然论文使用了卫星数据，但其重点在于海洋动力学和热带气旋与海洋的相互作用，而不是大气环境遥感技术，如空气质量监测或大气成分分析。因此，该论文与大气环境遥感技术的关联性不强。,[],Huaxin Wang;Zhiwei Zhang,Submesoscale Processes Triggered by Tropical Cyclones and Their Role in Temperature Recovery of Cold Wakes,"Submesoscale processes (submesoscales) play a crucial role in vertical tracer transport, which are typically stronger in winter than summer. However, recent studies revealed enhanced submesoscale activities following tropical cyclones (TCs) during summer months, though their characteristics, mechanisms, and dynamical impacts remain obscure. Through combining high‐resolution satellite and simulation data, we demonstrate that energetic submesoscales are present within TC‐induced cold wakes across the northwestern Pacific, which can produce strong upward vertical heat flux (VHF) in the upper ocean. Further analysis reveals that submesoscales are more active in stronger cold wakes induced by slower‐moving and stronger TCs and they may be generated through a combination of baroclinic instability and strain‐induced frontogenesis. Crucially, submesoscale VHF can accelerate the post‐TC temperature recovery of cold wakes which may influence the sequential TC intensification. Our results improve the understanding of TC‐ocean feedback and underscore the necessity of resolving or parameterizing submesoscales in TC prediction models."
10.1029/2025GL115420,False,Geophysical Research Letters,该研究论文主要关注岩石风化对全球养分循环的影响，以及如何利用铀和锂同位素比率来研究不同岩性的流域的剥蚀模式。论文探讨了岩石的内在属性（如粒度和动力学速率常数）和外在因素（如流体渗透和岩石抬升速率）如何影响河流中铀和锂的同位素比率。研究结果旨在帮助构建基于过程的景观剥蚀模型。该研究与大气环境遥感技术（如空气质量监测、卫星观测和大气成分分析）没有直接关系。,[],Evan J. Ramos;Daniel E. Ibarra;Gavin Piccione,Uranium and Lithium Isotope Ratios of River Solutes Clarify the Role of Bedrock Properties in Landscape Denudation,"Rock weathering impacts global nutrient cycles but factoring intrinsic properties of bedrock into weathering models remains a challenge. Here we show that two common tracers of silicate weathering—uranium (U) activity ratios and lithium (Li) isotope ratios of river solutes—inform lithology‐specific modes of landscape denudation. A compilation of paired, published (234U/238U)river and δ7Liriver values demonstrates that watersheds dominated by metamorphic, volcanic, and sedimentary rocks have respectively broader (234U/238U)river ranges but overlapping δ7Liriver values, indicating varying associations of sediment comminution and mineral dissolution with clay formation. Reactive transport models illustrate that intrinsic rock properties like grain size and kinetic rates constants mutually modify (234U/238U)river and δ7Liriver values whereas extrinsic forces like fluid infiltration and rock uplift rates mostly impact δ7Liriver values. These results delineate how given rock types denude and highlight the utility of these proxies in building process‐based models of landscape denudation over the Quaternary Period."
10.1038/d41586-025-01968-2,False,Nature,该论文的标题和摘要主要关注灾害预测和地方政府的应对措施，强调提前了解受灾人群的重要性，以便更有效地应对自然灾害。虽然自然灾害可能与大气环境因素有关（例如，极端天气事件），但该摘要并未明确提及大气环境遥感技术，如空气质量监测、卫星观测或大气成分分析。因此，该论文与大气环境遥感技术的直接关联性较低。,[],Jonathan Colmer,"We need to predict the people disasters will hit, not just the places","Local authorities can deal with natural hazards more effectively if they know ahead of time who will be affected. 
 Local authorities can deal with natural hazards more effectively if they know ahead of time who will be affected.  Local authorities can deal with natural hazards more effectively if they know ahead of time who will be affected."
10.1038/d41586-025-01966-4,False,Nature,该论文的标题和摘要主要关注的是科学界面临的反科学政治议程和学术自由受到的威胁，强调科学领导者需要公开反对这些趋势。虽然科学研究可能受到这些政治因素的影响，但论文本身并没有直接涉及大气环境遥感技术，如空气质量监测、卫星观测或大气成分分析。因此，该论文与大气环境遥感技术的直接相关性较低。,"['anti-science agendas', 'academic freedom', 'scientific leaders', 'political influence on science']",,"In the face of anti-science politics, silence is not without cost","More scientific leaders need to speak out about anti-science agendas and threats to academic freedom across the world. 
 More scientific leaders need to speak out about anti-science agendas and threats to academic freedom across the world.  More scientific leaders need to speak out about anti-science agendas and threats to academic freedom across the world."
10.1038/d41586-025-01969-1,False,Nature,该研究论文的标题和摘要主要关注美国健康状况，特别是与慢性疾病、枪支、毒品和汽车相关的寿命预期问题。它与大气环境遥感技术（如空气质量监测、卫星观测和大气成分分析）没有直接关系。因此，该论文不属于大气环境遥感技术领域。,[],Helen Pearson,How to make America healthy: the real problems — and best fixes,"The United States has lower life expectancy than most similarly wealthy nations. Chronic disease is part of the cause, but so are guns, drugs and cars. 
 The United States has lower life expectancy than most similarly wealthy nations. Chronic disease is part of the cause, but so are guns, drugs and cars.  The United States has lower life expectancy than most similarly wealthy nations. Chronic disease is part of the cause, but so are guns, drugs and cars."
10.1038/d41586-025-01717-5,False,Nature,该研究论文的标题和摘要主要关注的是儿童在数学能力上的性别差异，特别是在小学一年级入学后不久出现的这种差异。研究表明，这种性别差异与学校类型和社会经济背景无关。因此，该研究与大气环境遥感技术（如空气质量监测、卫星观测和大气成分分析）没有直接关系。,[],John A. List;Andrew Simon,Boys surpass girls in maths in the first year of school,"A gender gap in mathematical ability arises shortly after children begin school — irrespective of the type of school they attend and their socio-economic background. 
 A gender gap in mathematical ability arises shortly after children begin school — irrespective of the type of school they attend and their socio-economic background.  A gender gap in mathematical ability arises shortly after children begin school — irrespective of the type of school they attend and their socio-economic background."
10.1038/s41586-025-09284-5,False,Nature,该研究论文主要关注的是一种新的化学方法，即通过镍催化的邻位二硼化反应来实现芳香环（芳烃）的模块化官能化。该方法能够选择性地在芳烃上引入两个化学性质不同的硼基，并进一步转化为各种官能团，从而高效地合成具有不同取代基的芳烃衍生物。论文重点在于化学合成方法的创新、反应机理的探究以及其在药物研发中的潜在应用。与大气环境遥感技术，如空气质量监测、卫星观测和大气成分分析等，没有直接关联。,[],Jingfeng Huo;Yue Fu;Melody J. Tang;Ya Su;Shengkun Hu;Peng Liu;Guangbin Dong,"Modular arene functionalization by differential 1,2-diborylation","Modular arene functionalization by differential 1,2-diborylation 
 Aromatic rings, also known as arenes, containing two or more adjacent different substituents are ubiquitously found in small molecule drugs1. Strategies that can rapidly introduce diverse vicinal substituents to readily available precursors would greatly benefit generation of analogues of bioactive compounds2, which, however, remain challenging to realize to date. The existing approaches for preparing vicinal difunctionalized arenes lack modularity, or regioselectivity, or generality. Here we report a nickel-catalyzed vicinal diborylation method that can directly install two chemically differentiated boryl groups in a regio- and site-selective manner using readily available aryl triflates or chlorides as substrates. This reaction operates under simple and mild conditions and is scalable. It also shows a broad substrate scope and excellent functional group tolerance. Given that each boryl group can be independently transformed into various functional groups, this method offers a modular, regioselective, and divergent approach to access diverse vicinal difunctionalized arenes, showing promise for constructing analogue libraries. The combined experimental and computational mechanistic studies reveal a highly unusual reaction pathway, involving the formation of a dearomatized gem-diboryl species and 1,2-boron migration. The site- and regioselectivity of this reaction are proposed to be controlled by steric interactions of the boryl groups with the nickel catalyst. The mechanistic insights gained in this investigation could have broad implications on developing other boron-mediated functionalization reactions."
10.1038/d41586-025-01997-x,False,Nature,该标题和摘要主要涉及天文学领域的大型数字相机及其应用，以及学术研究中的“马太效应”和博士就业问题。虽然提到了观测，但重点在于天文观测而非大气环境遥感。因此，与空气质量监测、卫星观测或大气成分分析等大气环境遥感技术没有直接关联。,"['astronomy', 'large-scale imaging', 'research trends', 'academic job market']",Flora Graham,Daily briefing: Space shots from the largest digital camera in the world,"The Vera C. Rubin Observatory has released the first images taken using its 3,200 megapixel camera. Plus, why the ‘Matthew effect’ is rampant in research and what to do when PhDs vastly outnumber jobs in academia. 
 The Vera C. Rubin Observatory has released the first images taken using its 3,200 megapixel camera. Plus, why the ‘Matthew effect’ is rampant in research and what to do when PhDs vastly outnumber jobs in academia.  The Vera C. Rubin Observatory has released the first images taken using its 3,200 megapixel camera. Plus, why the ‘Matthew effect’ is rampant in research and what to do when PhDs vastly outnumber jobs in academia."
10.1038/d41586-025-01988-y,False,Nature,该文章标题和摘要主要关注的是科学会议的举办地选择标准（签证便利性和人权状况），以及其他科学话题，如电影《大白鲨》对鲨鱼认知的影响和利用人工智能加速医学审查的实验。文章内容与大气环境遥感技术，如空气质量监测、卫星观测和大气成分分析等，没有直接关联。,[],Flora Graham,Daily briefing: Which is the perfect conference country?,"Which countries offer the ideal combination of easy visas and human rights to host a scientific conference? Plus, how Jaws transformed our view of sharks and experiments to accelerate gold-standard medical reviews using AI. 
 "
10.1038/s41561-025-01718-z,True,Nature Geoscience,该研究论文探讨了自工业化以来，农田扩张对大气生物源二次有机气溶胶（biogenic secondary organic aerosol）的影响，以及由此导致的辐射冷却效应的降低。研究使用地球系统模型模拟了农田扩张对二次有机气溶胶的影响，发现农田扩张导致生物源二次有机气溶胶减少，降低了其辐射散射和云滴形成能力，从而减弱了辐射冷却效应。虽然论文没有直接涉及遥感技术，但它研究了大气成分的变化及其对气候的影响，这与大气环境遥感技术（如空气质量监测、卫星观测和大气成分分析）密切相关，因为遥感技术可以用于监测和评估这些大气成分的变化。,"['biogenic secondary organic aerosol', 'radiative cooling', 'land-use change', 'Earth system model', 'radiative forcing', 'cloud droplet formation', 'atmospheric composition']",Jialei Zhu;Joyce E. Penner;Chaopeng Hong;Hao Liu;Xi Zhao;Junjun Deng;Cong-Qiang Liu;Qiang Zhang;Pingqing Fu,Cropland expansion reduces biogenic secondary organic aerosol and associated radiative cooling,"Model simulations suggest that cropland expansion since industrialization has reduced atmospheric biogenic secondary organic aerosol by 10% and its associated radiative cooling effect by 11%. 
 Cropland expansion has been the most notable change in global land use since industrialization. However, assessments of radiative forcing from land-use change have generally neglected the effects of cropland expansion on secondary organic aerosol. Here we perform a series of cropland expansion sensitivity experiments with an Earth system model that incorporates advanced secondary organic aerosol processes, including organic new particle formation. Our model results show an ~ 10% decrease in biogenic secondary organic aerosol burden due to cropland expansion since industrialization. This has reduced radiation scattering and cloud droplet formation associated with secondary organic aerosol, leading to a 146 ± 112 mW m−2 decline in its radiative cooling forcing, equivalent to 8% of CO2-induced radiative warming forcing since industrialization. The radiative impact is mainly attributed to the transition from evergreen and deciduous broadleaf forests to croplands. The radiative impacts are projected to increase by approximately 50% under future climate warming and reduced anthropogenic aerosol and precursor gas emissions, due to changes in biogenic emission intensity and background cloud condensation nuclei concentration. Policies addressing food security and climate change should account for the radiative impact of biogenic secondary organic aerosol from cropland expansion. Model simulations suggest that cropland expansion since industrialization has reduced atmospheric biogenic secondary organic aerosol by 10% and its associated radiative cooling effect by 11%."
10.1038/s41467-025-59716-z,False,Nature Communications,这篇论文主要关注量子计算领域，特别是使用超导量子处理器通过Krylov量子对角化算法来计算多体系统的低能级。它与大气环境遥感技术（如空气质量监测、卫星观测和大气成分分析）没有直接关系。该研究旨在探索量子算法在解决量子系统计算问题方面的潜力，而不是大气环境科学。,[],Nobuyuki Yoshioka;Mirko Amico;William Kirby;Petar Jurcevic;Arkopal Dutt;Bryce Fuller;Shelly Garion;Holger Haas;Ikko Hamamura;Alexander Ivrii;Ritajit Majumdar;Zlatko Minev;Mario Motta;Bibek Pokharel;Pedro Rivero;Kunal Sharma;Christopher J. Wood;Ali Javadi-Abhari;Antonio Mezzacapo,Krylov diagonalization of large many-body Hamiltonians on a quantum processor,"The estimation of low energies of many-body systems is a cornerstone of the computational quantum sciences. This paper demonstrates on a superconducting quantum processor that the Krylov quantum diagonalization algorithm is poised to complement its classical counterparts at the foundation of computational methods for quantum systems. 
 The estimation of low energies of many-body systems is a cornerstone of the computational quantum sciences. Variational quantum algorithms can be used to prepare ground states on pre-fault-tolerant quantum processors, but their lack of convergence guarantees and impractical number of cost function estimations prevent systematic scaling of experiments to large systems. Alternatives to variational approaches are needed for large-scale experiments on pre-fault-tolerant devices. Here, we use a superconducting quantum processor to compute eigenenergies of quantum many-body systems on two-dimensional lattices of up to 56 sites, using the Krylov quantum diagonalization algorithm, an analog of the well-known classical diagonalization technique. We construct subspaces of the many-body Hilbert space using Trotterized unitary evolutions executed on the quantum processor, and classically diagonalize many-body interacting Hamiltonians within those subspaces. These experiments demonstrate exponential convergence towards an estimate of the ground state energy, and show that quantum diagonalization algorithms are poised to complement their classical counterparts at the foundation of computational methods for quantum systems. The estimation of low energies of many-body systems is a cornerstone of the computational quantum sciences. This paper demonstrates on a superconducting quantum processor that the Krylov quantum diagonalization algorithm is poised to complement its classical counterparts at the foundation of computational methods for quantum systems."
10.1038/s41467-025-60377-1,False,Nature Communications,该论文主要研究磁性石墨烯中的量子自旋霍尔效应，与大气环境遥感技术（如空气质量监测、卫星观测和大气成分分析）没有直接关系。论文重点在于材料科学和凝聚态物理领域，探讨石墨烯的拓扑性质和自旋电子学应用。,[],Talieh S. Ghiasi;Davit Petrosyan;Josep Ingla-Aynés;Tristan Bras;Kenji Watanabe;Takashi Taniguchi;Samuel Mañas-Valero;Eugenio Coronado;Klaus Zollner;Jaroslav Fabian;Philip Kim;Herre S. J. van der Zant,Quantum spin Hall effect in magnetic graphene,"Graphene was one of the first materials proposed to host the quantum spin Hall effect. However, its weak intrinsic spin-orbit interaction means that observing such an effect requires modifying the graphene band structure. Here, Ghiasi et al. combine graphene with CrPS4 and detect quantum spin Hall states at zero magnetic field. 
 A promising approach to attain long-distance coherent spin propagation is accessing topological spin-polarized edge states in graphene. Achieving this without external magnetic fields necessitates engineering graphene band structure, obtainable through proximity effects in van der Waals heterostructures. In particular, proximity-induced staggered potentials and spin-orbit coupling are expected to form a topological bulk gap in graphene with gapless helical edge states that are robust against disorder. In this work, we detect the spin-polarized helical edge transport in graphene at zero external magnetic field, allowed by the proximity of an interlayer antiferromagnet, CrPS4. We show the coexistence of the quantum spin Hall (QSH) states and magnetism in graphene, where the induced spin-orbit and exchange couplings also give rise to a large anomalous Hall (AH) effect. The detection of the QSH states at zero external magnetic field, together with the AH signal that persists up to room temperature, opens the route for practical applications of magnetic graphene in quantum spintronic circuitries. Graphene was one of the first materials proposed to host the quantum spin Hall effect. However, its weak intrinsic spin-orbit interaction means that observing such an effect requires modifying the graphene band structure. Here, Ghiasi et al. combine graphene with CrPS4 and detect quantum spin Hall states at zero magnetic field."
