doi,is_relevant,journal,explanation,topic_words,authors,title,abstract
10.1029/2025GL117294,True,Geophysical Research Letters,该研究论文探讨了南亚秋季黑碳气溶胶对北极和欧亚大陆地表气温的即时和延迟影响。研究表明，南亚较高的黑碳载荷会导致降雨减少和对流层非绝热冷却，进而激发欧洲上空的异常反气旋，将暖湿空气输送到北极，预先融化巴伦支-喀拉海的冰盖。海冰覆盖的减少导致巴伦支-喀拉海变暖，乌拉尔山附近的异常反气旋导致欧亚大陆地表降温。这种温度异常模式会因跨季节的海冰持续减少而持续到冬季。因此，该研究与大气环境遥感技术密切相关，特别是关于气溶胶、大气成分和气候影响的监测。,"['Black Carbon Aerosols', 'Surface Air Temperature', 'Arctic', 'Eurasia', 'South Asia', 'Sea Ice Cover', 'Climate Modeling', 'Atmospheric Composition']",Jiechun Deng,Instant and Delayed Effects of Autumn Black Carbon Aerosols Over South Asia on Arctic and Eurasian Surface Air Temperature,"Black carbon (BC) aerosols can affect both local and remote long‐term climate, but whether they can induce remote changes at short‐term timescales is unclear. Through analyses of observations and time‐slice model simulations, this study shows that South Asian autumn BC aerosols can cause instant and delayed responses of surface air temperature over the Arctic and Eurasia. In autumn, higher BC loading over South Asia leads to decreased rainfall and tropospheric diabatic cooling there. This cooling can remotely excite an anomalous anticyclone over Europe that transports warm and moist air into the Arctic to precondition sea ice melting over the Barents‐Kara Seas (BKS). The consequent decrease of sea ice cover (SIC) causes BKS warming through increased surface exchange fluxes, and the concurring anomalous anticyclone near the Ural Mountains induces surface cooling over Eurasia. This temperature anomaly pattern can persist into the ensuing winter due to the continued SIC decrease across seasons."
10.1029/2025GL117021,False,Geophysical Research Letters,该研究论文主要关注巨花魔芋（Corpse Flower）的授粉机制。虽然提到了花朵排放物对大气环境的影响，包括在污染大气中快速氧化可能影响化合物比例和气味羽流大小，从而抑制授粉，但其核心在于植物的生物学特性和授粉策略。与大气环境遥感技术，如空气质量监测、卫星观测和大气成分分析的关联性较弱。论文更侧重于生物学、植物学和生态学领域，而非大气科学或遥感技术。,"['floral emissions', 'atmospheric oxidation', 'polluted atmospheres', 'atmospheric composition']",Rose K. Rossell;Mj Riches;Abigail R. Koss;Tammy Brenner;Delphine K. Farmer,Efficient Pollination Stinks: Corpse Flowers Use Floral Trapping and Persistent Emissions,"Flowering corpse plants attract pollinating carrion insects through pungent, nocturnal odors. Female flowers primarily emit organosulfur, including ∼12gS/hour as methanethiol with mixing ratios comparable to landfills; male emissions are smaller and more diverse. Floral emissions during blooming represent ∼0.4% of plant biomass and change throughout the blooming sequence, consistent with floral trapping: insects remain with florets after initial attraction for subsequent release with pollen shedding the following night, preventing inbreeding and enhancing fertilization efficiency. Female flower plumes are resilient under pristine conditions, with relative floral composition changing minimally with nighttime oxidation and attracting insects for later release during the male bloom stage, which is less resilient. In polluted atmospheres, rapid oxidation may impact compound ratios and plume size, inhibiting pollination of these endangered plants."
10.1029/2025GL116470,True,Geophysical Research Letters,该研究论文关注南大洋上空大气中甲硫醇（MeSH）的浓度分布，以及其对气候冷却气溶胶形成的影响。虽然没有直接提及遥感技术或卫星观测，但该研究通过测量大气成分（MeSH、DMS、VMS），间接支持了大气环境遥感应用，例如空气质量监测和大气成分分析。研究结果可以用于改进气候模型，从而更好地理解和预测气溶胶对气候的影响。因此，该论文与大气环境遥感技术具有较强的相关性。,"['atmospheric composition', 'methanethiol (MeSH)', 'dimethyl sulfide (DMS)', 'volatile methylated sulfur (VMS)', 'aerosol formation', 'air quality monitoring (indirectly)', 'climate modeling']",Caleb Mynard;Emily B. Franklin;Joel Alroe;Nigel Somerville;Antonio Patti;Steven T. Siems;Alastair Williams;Marc D. Mallet;Ruhi Humphries;Erin Dunne,Constraining Atmospheric Methanethiol Estimates Over the Southern Ocean,"Dimethyl sulfide (DMS) and methanethiol (MeSH) are biologically co‐produced marine volatile sulfur compounds, which play a critical role in climate‐cooling aerosol formation. The spatio‐temporal distributions of MeSH are poorly constrained, especially over the Southern Ocean. DMS and MeSH atmospheric concentrations and relative contributions to volatile methylated sulfur (VMS) were measured across the Southern Ocean, spanning all seasons and latitudes from 37°S to 67°S. Highest absolute mixing ratios of MeSH occurred in summer (up to 250 ppt), over biologically productive waters at 45°S to 52°S and close to the Antarctic coast (> ${ >} $62°S). Highest MeSH/VMS occurred in spring and winter (up to 35%), and at the Subtropical Front and Antarctic coast. These results constrain MeSH contributions to VMS over the Southern Ocean, explore mechanisms driving these dynamics, and support recently modeled MeSH importance to the atmospheric sulfur burden, with significant implications for modeling climate‐cooling aerosols."
10.1029/2024GH001203,False,GeoHealth,该研究论文主要关注土地利用变化对中国恙虫病风险的影响。它构建了一个综合景观破碎化指数（LFI），并利用广义加性模型（GAM）来评估LFI对恙虫病发病率的影响，并根据不同的共享社会经济路径（SSPs）预测了未来风险变化。研究结果表明，人类对自然生态系统的干扰是恙虫病发病的重要因素。因此，该论文与大气环境遥感技术（如空气质量监测、卫星观测和大气成分分析）没有直接关系。,[],Ling Han;Zhaobin Sun;Guwei Zhang;Yunfei Zhang;Hongyu Ren;Zhongqiu Teng;Jianguo Xu;Tian Qin,Current and Future Projection of Scrub Typhus Risk Related to Land Use Change in China,"The widespread concern surrounding the enhanced spillover risk of infectious diseases due to dramatic global land use changes has sparked significant discussion. However, the specific implications of these changes on scrub typhus, a vector‐borne infectious disease facing increasing incidence and substantial expansion, remain unclear. Here, we constructed a comprehensive landscape fragmentation index (LFI), which reflects the interaction between human activities and natural habitats. Then we utilized a generalized additive model (GAM) to estimate the comprehensive and segmented impacts of LFI on scrub typhus incidence in China, grouping the results by year, land use type and fragmentation level. Additionally, we projected changes in such impacts under four shared socioeconomic pathways (SSPs), including SSP1‐2.6, SSP2‐4.5, SSP3‐7.0, and SSP5‐8.5. Key results were: (a) The LFI exhibited a nonlinear positive correlation with scrub typhus incidence. Each 0.1 increase in the LFI was associated with a relative risk of 1.20 (95% CI:1.19–1.21) for scrub typhus. Notably, at higher fragmentation levels, scrub typhus incidence tended to decrease. (b) Forest fragmentation had the most significant impact on scrub typhus, followed by cropland fragmentation, whereas construction land fragmentation was negatively associated. (c) The future areas of elevated scrub typhus risk varied among the SSPs, but they were mainly concentrated at the interface between urban expansion and natural habitats. Our results indicate that human interference with the natural ecosystem is a critical factor for the incidence of scrub typhus. These findings are conducive to promoting ecological protection and the prevention and control of scrub typhus."
10.1038/s41586-025-09608-5,False,Nature,该论文的标题和摘要表明，它是一个出版商的更正声明，涉及使用电子衍射实验确定部分电荷。 这项研究主要关注化学和物理学领域中分子性质的实验测定，与大气环境遥感技术（如空气质量监测、卫星观测或大气成分分析）没有直接关系。 因此，它与大气环境遥感技术关联不大。,[],Soheil Mahmoudi;Tim Gruene;Christian Schröder;Khalil D. Ferjaoui;Erik Fröjdh;Aldo Mozzanica;Kiyofumi Takaba;Anatoliy Volkov;Julian Maisriml;Vladimir Paunović;Jeroen A. van Bokhoven;Bernhard K. Keppler,Publisher Correction: Experimental determination of partial charges with electron diffraction,"Publisher Correction: Experimental determination of partial charges with electron diffraction 
 "
10.1038/s41586-025-09596-6,False,Nature,这篇论文主要关注的是量子计算和量子信息处理领域，特别是利用中性原子构建大规模量子比特系统。论文的核心在于展示一个可以连续运行的3000量子比特系统的实验架构，通过光学晶格传送带技术实现原子的高速重载和连续操作，同时保持量子信息的相干性。这项研究与大气环境遥感技术，如空气质量监测、卫星观测和大气成分分析，没有直接的关联。,[],Neng-Chun Chiu;Elias C. Trapp;Jinen Guo;Mohamed H. Abobeih;Luke M. Stewart;Simon Hollerith;Pavel L. Stroganov;Marcin Kalinowski;Alexandra A. Geim;Simon J. Evered;Sophie H. Li;Xingjian Lyu;Lisa M. Peters;Dolev Bluvstein;Tout T. Wang;Markus Greiner;Vladan Vuletić;Mikhail D. Lukin,"Continuous operation of a coherent 3,000-qubit system","Continuous operation of a coherent 3,000-qubit system 
 Neutral atoms are a promising platform for quantum science, enabling advances in areas ranging from quantum simulations1−3 and computation4−10 to metrology, atomic clocks11−13 and quantum networking14−16. While atom losses typically limit these systems to a pulsed mode, continuous operation17−22 could significantly enhance cycle rates, remove bottlenecks in metrology23, and enable deep-circuit quantum evolution through quantum error correction24,25. Here we demonstrate an experimental architecture for high-rate reloading and continuous operation of a large-scale atom array system while realizing coherent storage and manipulation of quantum information. Our approach utilizes a series of two optical lattice conveyor belts to transport atom reservoirs into the science region, where atoms are repeatedly extracted into optical tweezers without affecting the coherence of qubits stored nearby. Using a reloading rate of 300,000 atoms in tweezers per second, we create over 30,000 initialized qubits per second, which we leverage to assemble and maintain an array of over 3,000 atoms for more than two hours. Furthermore, we demonstrate persistent refilling of the array with atomic qubits in either a spin-polarized or a coherent superposition state while preserving the quantum state of stored qubits. Our results pave the way for realization of large-scale continuously operated atomic clocks, sensors, and fault-tolerant quantum computers."
10.1038/d41586-025-02923-x,False,Nature,该研究的标题和摘要主要关注可可豆的 ферментация 过程的改进，旨在支持西印度群岛的可可种植者。研究内容与大气环境遥感技术（如空气质量监测、卫星观测和大气成分分析）没有直接关系。因此，该研究与大气环境遥感技术不相关。,[],Rachel Brazil,Sweet like chocolate: researching in the shade of a cacao tree,"Naailah Ali aims to support cacao farmers in the West Indies by improving the bean-fermentation process. 
 Naailah Ali aims to support cacao farmers in the West Indies by improving the bean-fermentation process.  Naailah Ali aims to support cacao farmers in the West Indies by improving the bean-fermentation process."
10.1038/d41586-025-02988-8,False,Nature,该研究论文的标题和摘要主要关注的是亚洲发现的烟熏木乃伊，以及它们与埃及防腐处理木乃伊的年代比较。 这项研究与大气环境遥感技术（如空气质量监测、卫星观测和大气成分分析）没有直接关系。 该论文主要属于考古学和人类学领域。,[],,Ssmoke-dried mummies pre-date Egypt’s embalmed bodies,"Remains buried in Asia in a crouching position are thought to be oldest known examples of intentionally mummified burials. 
 Remains buried in Asia in a crouching position are thought to be oldest known examples of intentionally mummified burials.  Remains buried in Asia in a crouching position are thought to be oldest known examples of intentionally mummified burials."
10.1038/d41586-025-02939-3,False,Nature,这篇论文的标题和摘要讨论的是“时间晶体”这种物质状态，这是一种曾经被认为在物理上不可能存在的物质状态。该研究与大气环境遥感技术（如空气质量监测、卫星观测和大气成分分析）没有直接关系。因此，该论文与大气环境遥感技术领域无关。,[],Elizabeth Gibney,Weird ‘time crystals’ are made visible at last,"Time crystals, a state of matter once thought physically impossible, could soon be on a banknote. 
 Time crystals, a state of matter once thought physically impossible, could soon be on a banknote.  Time crystals, a state of matter once thought physically impossible, could soon be on a banknote."
10.1038/d41586-025-02922-y,False,Nature,该论文的标题和摘要主要关注的是学术同行评审过程中的不良行为，例如“恶意”评审。它探讨了学术团体、期刊、编辑和研究人员如何抵制这种行为。论文的核心在于学术规范和评审流程，而不是大气环境遥感技术。因此，它与空气质量监测、卫星观测或大气成分分析等主题没有直接关系。,[],Katarina Zimmer,‘Lipstick on a pig’: how to fight back against a peer-review bully,"Scientific societies, journals, editors and researchers are pushing back against mean-spirited peer reviews. 
 Scientific societies, journals, editors and researchers are pushing back against mean-spirited peer reviews.  Scientific societies, journals, editors and researchers are pushing back against mean-spirited peer reviews."
10.1038/d41586-025-02902-2,False,Nature,根据标题和摘要，这篇研究论文讨论的是关于“镜像生命”研究的伦理限制问题，涉及对基础科学研究的过早限制的辩论。它与大气环境遥感技术，如空气质量监测、卫星观测和大气成分分析等，没有直接关系。因此，该论文与大气环境遥感技术领域不相关。,[],Mark Peplow,How should ‘mirror life’ research be restricted? Debate heats up,"Some researchers are calling for strict limits, while others speak out against prematurely halting basic science. 
 Some researchers are calling for strict limits, while others speak out against prematurely halting basic science.  Some researchers are calling for strict limits, while others speak out against prematurely halting basic science."
10.1038/d41586-025-02987-9,False,Nature,该论文的标题和摘要主要讨论了人工智能聊天机器人（特别是那些声称是耶稣的聊天机器人）在宗教实践中的应用以及由此引发的争议。它与大气环境遥感技术，如空气质量监测、卫星观测和大气成分分析，没有直接或明显的联系。论文关注的是AI技术在宗教领域的影响，而非大气环境科学。,[],Brian Owens,The chatbots claiming to be Jesus: spreading gospel or heresy?,"Jesus chatbots aren't the only AI technologies seeping into religious practice. Some worshippers don't agree with the use of them. 
 Jesus chatbots aren't the only AI technologies seeping into religious practice. Some worshippers don't agree with the use of them.   Jesus chatbots aren't the only AI technologies seeping into religious practice. Some worshippers don't agree with the use of them. "
10.1038/d41586-025-02919-7,False,Nature,该论文的标题和摘要主要讨论了个人收集科学文物（scientific artefacts）的行为，以及他们的动机和对公共博物馆及私人收藏的影响。重点在于收藏者的心理和行为，而非大气环境遥感技术。因此，它与空气质量监测、卫星观测或大气成分分析等大气环境遥感技术没有直接关系。,[],Andrew Robinson,Heroes or hoarders? The strange brains of people who collect,"Public museums and private collections are stuffed with scientific artefacts gathered by individuals — often with highly questionable obsessions and motivations. 
 Public museums and private collections are stuffed with scientific artefacts gathered by individuals — often with highly questionable obsessions and motivations.  Public museums and private collections are stuffed with scientific artefacts gathered by individuals — often with highly questionable obsessions and motivations."
10.1038/d41586-025-02921-z,False,Nature,该论文主要讨论了全球定位系统（GPS）授时的脆弱性问题，并强调了寻找其他时间信息分发方式的必要性。论文关注的是时间同步和基础设施的可靠性，而不是大气环境遥感技术。因此，它与空气质量监测、卫星观测或大气成分分析等领域没有直接关联。,[],Leon Lobo;Douglas Paul;Chander Velu,GPS timekeeping is increasingly vulnerable: here’s how to deliver future-proofed time,"With crucial infrastructure increasingly dependent on accurate, resilient clocks, outages in the dominant system for global positioning highlight the need for other ways of distributing time information. 
 With crucial infrastructure increasingly dependent on accurate, resilient clocks, outages in the dominant system for global positioning highlight the need for other ways of distributing time information.  With crucial infrastructure increasingly dependent on accurate, resilient clocks, outages in the dominant system for global positioning highlight the need for other ways of distributing time information."
10.1038/d41586-025-02912-0,False,Nature,该论文的标题和摘要讨论了镜像分子生物学研究的益处和风险，以及弥合不同观点的必要性。它与大气环境遥感技术，如空气质量监测、卫星观测和大气成分分析，没有直接关系。论文关注的是生命构建块的镜像版本的研究，而非大气环境科学。,[],Ting Zhu,Mirror of the unknown: should research on mirror-image molecular biology be stopped?,"Amid growing debates about the benefits and risks of studying looking-glass versions of life’s building blocks, there is an urgent need to bridge divergent views. 
 Amid growing debates about the benefits and risks of studying looking-glass versions of life’s building blocks, there is an urgent need to bridge divergent views.  Amid growing debates about the benefits and risks of studying looking-glass versions of life’s building blocks, there is an urgent need to bridge divergent views."
10.1038/d41586-025-02940-w,False,Nature,该论文的标题和摘要讨论的是“数字来生”的概念，特别是关于“悲伤机器人”（griefbots）的开发和使用。这些机器人旨在通过重建死者的形象来帮助人们，但也存在潜在的危险。这个主题与大气环境遥感技术（如空气质量监测、卫星观测和大气成分分析）没有直接关系。因此，该论文与大气环境遥感技术领域无关。,[],Tammy Worth,"Ready or not, the digital afterlife is here","Developers of griefbots say that they help people by allowing them to commune with recreations of the dead, but others say that the technology is fraught with danger. 
 Developers of griefbots say that they help people by allowing them to commune with recreations of the dead, but others say that the technology is fraught with danger.  Developers of griefbots say that they help people by allowing them to commune with recreations of the dead, but others say that the technology is fraught with danger."
10.1038/d41586-025-02996-8,False,Nature,该文章的标题和摘要主要关注高收入国家中非传染性疾病的改善情况（以丹麦为例），一项旨在了解HIV的临床研究，以及热浪与特定化石燃料生产商之间的联系。这些主题与大气环境遥感技术（如空气质量监测、卫星观测和大气成分分析）没有直接或显著的关联。,[],Flora Graham,Daily briefing: The most- and least-improved countries for chronic disease,"Of high-income countries, when it comes to non-communicable diseases, Denmark is doing it right. Plus, a unique clinical study aims to understand HIV, and heatwaves have been linked to specific fossil-fuel producers. 
 Of high-income countries, when it comes to non-communicable diseases, Denmark is doing it right. Plus, a unique clinical study aims to understand HIV, and heatwaves have been linked to specific fossil-fuel producers.  Of high-income countries, when it comes to non-communicable diseases, Denmark is doing it right. Plus, a unique clinical study aims to understand HIV, and heatwaves have been linked to specific fossil-fuel producers."
10.1038/s41467-025-63884-3,False,Nature Communications,该论文的标题和摘要主要关注全球南方气候变化研究以及气候极端事件对弱势群体的影响。虽然气候变化与大气环境密切相关，但摘要并未明确提及大气环境遥感技术，如空气质量监测、卫星观测或大气成分分析。因此，该论文与大气环境遥感技术的直接相关性较低。该研究主要侧重于气候变化带来的社会经济影响和数据缺口问题。,[],,Climate research in the Global South,"The consequences of weather and climate extremes are felt disproportionately by some of the most disadvantaged populations of the world. Gaps in data and research perpetuate these deeply rooted inequalities and must be overcome. 
 The consequences of weather and climate extremes are felt disproportionately by some of the most disadvantaged populations of the world. Gaps in data and research perpetuate these deeply rooted inequalities and must be overcome."
10.1038/s41467-025-63485-0,False,Nature Communications,该论文主要关注的是超级电容器的体积能量密度问题，以及如何通过使用弯曲的石墨烯晶体来提高超级电容器的性能。它与大气环境遥感技术，如空气质量监测、卫星观测和大气成分分析，没有直接关系。论文的核心在于材料科学和电化学储能领域，而非大气环境科学。,[],Petar Jovanović;Meysam Sharifzadeh Mirshekarloo;Phillip Aitchison;Mahdokht Shaibani;Mainak Majumder,Operando interlayer expansion of multiscale curved graphene for volumetrically-efficient supercapacitors,"Supercapacitors are high-power energy storage devices that suffer from poor volumetric performance. Here, the authors demonstrate that unusually curved graphene crystallites exhibit rapid ion transport dynamics and enable the fabrication of thin electrodes for compact energy and power delivery. 
 Supercapacitors deliver high power but are limited in compact applications by low volumetric energy and power densities. Two-dimensional materials like graphene, despite their high packing density, are hindered by poor ion transport kinetics. A rapid thermal annealing step generates unusually curved turbostratic graphene crystallites, integrated and interwoven within disordered domains in micron-size particles to yield multiscale graphene. Ion insertion into the interlayers enables precise pore-ion matching and partial charge transfer, enabling a high Brunauer-Emmett-Teller surface area-normalized capacitance of 85 µF/cm2. Here, we show that multiscale graphene exhibits rapid ion transport dynamics within the curved crystallites and disordered domains. When the thin electrodes are assembled into symmetric pouch cell devices, they deliver a stack-level volumetric energy density of 99.5 Wh/L in ionic liquid electrolytes and 49.2 Wh/L in organic electrolyte with a high power density of 69.2 kW/L at 9.6 Wh/L. Supercapacitors are high-power energy storage devices that suffer from poor volumetric performance. Here, the authors demonstrate that unusually curved graphene crystallites exhibit rapid ion transport dynamics and enable the fabrication of thin electrodes for compact energy and power delivery."
