doi,is_relevant,journal,explanation,topic_words,authors,title,abstract
10.1038/s41467-025-58570-3,False,Nature Communications,该研究论文主要关注的是用于质子交换膜水电解的RuO2催化剂的应变异质性工程，以提高其在酸性氧析出反应中的效率和稳定性。论文重点在于材料科学和电化学领域，与大气环境遥感技术（如空气质量监测、卫星观测和大气成分分析）没有直接关系。该研究旨在开发更高效、更稳定的电催化剂，用于氢气生产，而非大气环境监测或分析。,[],Xuejie Cao;Licheng Miao;Wenqi Jia;Hongye Qin;Guangliang Lin;Rongpeng Ma;Ting Jin;Lifang Jiao,Strain heterogeneity in RuO<sub>2</sub> for efficient acidic oxygen evolution reaction in proton exchange membrane water electrolysis,"Efficient and stable catalysts are essential for advancing proton exchange membrane water electrolysis. In this study, a strain heterogeneity engineering strategy with single Pt atoms is used to enhance the activity and stability of RuO2 for the oxygen evolution reaction. 
 Developing acid-stable and active ruthenium dioxide (RuO2) catalysts for the oxygen evolution reaction (OER) is crucial for facilitating the large-scale applications of proton exchange membrane water electrolysis (PEMWE) for hydrogen production. Here, we propose a strain heterogeneity engineering strategy to simultaneously enhance the OER stability and activity of RuO2 electrocatalysts by introducing single-atom platinum (Pt). In a PEM water electrolyzer, the resultant Pt-RuO2 catalyst archives 3 A cm−2 at a low voltage of 1.791 V and maintains a stable performance for over 500 h at 500 mA cm−2. These performance metrics highlight its potential for practical applications. Experiments and calculations analyses confirm that the bulk tensile strain effectively stabilizes the entire structure of electrocatalysts, while the regions of compressive strain are identified as highly active catalytic sites, where the weakened binding energy of oxo-intermediates improves the catalytic activity. Efficient and stable catalysts are essential for advancing proton exchange membrane water electrolysis. In this study, a strain heterogeneity engineering strategy with single Pt atoms is used to enhance the activity and stability of RuO2 for the oxygen evolution reaction."
10.1038/s41467-025-61503-9,False,Nature Communications,该论文主要研究一种用于快速中子射线照相的透明混合金属卤化物闪烁屏。该闪烁屏利用锰基混合金属卤化物形成透明玻璃态，以减少光散射，从而提高中子射线照相的空间分辨率。该研究与大气环境遥感技术（如空气质量监测、卫星观测和大气成分分析）没有直接关系，主要集中在材料科学和射线成像领域。,[],Zi’an Zhou;Jinxiao Zheng;Shihao Ruan;Guichu Yue;Tiao Feng;Yini An;Meimei Wu;Nü Wang;Shuyun Zhou;Linfeng He;Chenghua Sun,A transparent hybrid metal halide glassy scintillation screen for high-resolution fast neutron radiography,"Zhou et al. report a 0D Mn-based hybrid metal halide incorporating a long branch alkyl chain with high steric hindrance to enable the formation of transparent glassy state, reducing the light scattering for fast neutron radiography and enabling a spatial resolution of 5 lp mm−1. 
 Fast neutron radiography offers exceptional penetration for high-density and bulky objects, yet its resolution is hindered by light scattering in conventional scintillators and screen fabrication techniques. To address this, here, we develop a transparent glassy Mn-based hybrid metal halide scintillation screen, (BTPP)1.8(HTPP)0.2MnBr4 (BTPP+ = butyltriphenylphosphonium, HTPP+ = heptyltriphenylphosphonium), leveraging temperature-dependent ordered-disordered transitions. The large-area screen boasts >70% visible light transmittance (500–800 nm), a high photoluminescence quantum yield (~85.54%), and threefold higher light output than commercial ZnS (Ag): PP screens. With a spatial resolution of 5 lp mm−1, it surpasses existing scintillators. This hybrid material enables imaging of heavy objects with clear hierarchical details, providing accurate data for non-destructive detection while offering an alternative approach to scintillator design, advancing the potential of fast neutron radiography. Zhou et al. report a 0D Mn-based hybrid metal halide incorporating a long branch alkyl chain with high steric hindrance to enable the formation of transparent glassy state, reducing the light scattering for fast neutron radiography and enabling a spatial resolution of 5 lp mm−1."
10.1038/s41612-025-01097-7,False,npj Climate and Atmospheric Science,该研究论文主要关注欧洲城市地区PM10的来源解析，通过对24个站点的化学成分数据进行分析，识别出道路交通、生物质燃烧、地壳来源、二次气溶胶、工业排放、海盐和重油燃烧等主要来源。虽然涉及空气质量监测，但其重点在于地面观测数据的统计分析和来源解析，而非大气环境遥感技术，如卫星观测或大气成分分析。,"['PM10', 'source apportionment', 'urban air quality', 'chemical speciation']",Xiansheng Liu;Xun Zhang;Bowen Jin;Tao Wang;Siyuan Qian;Jin Zou;Vy Ngoc Thuy Dinh;Jean-Luc Jaffrezo;Gaëlle Uzu;Pamela Dominutti;Sophie Darfeuil;Olivier Favez;Sébastien Conil;Nicolas Marchand;Sonia Castillo;Jesús D. de la Rosa;Stuart Grange;Christoph Hueglin;Konstantinos Eleftheriadis;Evangelia Diapouli;Manousos-Ioannis Manousakas;Maria Gini;Silvia Nava;Giulia Calzolai;Célia Alves;Marta Monge;Cristina Reche;Roy M. Harrison;Philip K. Hopke;Andrés Alastuey;Xavier Querol,Source apportionment of PM<sub>10</sub> based on offline chemical speciation data at 24 European sites,"Source apportionment of PM<sub>10</sub> based on offline chemical speciation data at 24 European sites 
 This study applied Positive Matrix Factorization (PMF) to PM10 speciation datasets from 24 urban sites across six European countries (France, Greece, Italy, Portugal, Spain, and Switzerland) to perform a detailed source apportionment (SA) analysis. By using a consistent source apportionment tool for all datasets, the study enhances the comparability of PM10 SA results across urban Europe. The results identified seven major PM10 sources including road traffic, biomass burning, crustal/mineral sources, secondary aerosols, industrial emissions, sea salt, and heavy oil combustion (HOC). Road traffic emerged as the predominant source of PM10 in urban areas, with contributions varying by location, but representing as much as 41% in high-traffic zones. Biomass burning was detected at 23 sites, contributing 8% to 41% on yearly averages, with substantial increase in winter. Crustal sources were present at all sites (3–33%). Industrial sources contributed relatively less PM10 mass, which was identified at 10 sites with contributions ranging from 2% to 14%. Secondary inorganic and organic aerosol, consisting primarily of ammonium nitrates and sulfates, and organic matter, formed a portion of the PM10 mass (5–41%). These secondary factors are primarily influenced by anthropogenic emissions, including the various combustion processes. Sea salt, predominantly found in coastal areas, contributed between 4% and 21%, reflecting the impact of the marine environments on air quality. This source was very often ‘aged’ (mixed with anthropogenic pollutants from different origins). Additionally, HOC, especially emits from shipping activities, and traced by V and Ni, was also a frequent contributing source (2–15% for 9 sites), indicating a need for more stringent emission controls. The chemical comparison is performed which indicates road traffic and secondary aerosols, showed consistent chemical profiles across sites, while industrial, HOC, and crustal sources displayed significant site-specific variability. These findings underscore the need for tailored air quality strategies according to local sources of emissions and the importance of long-term PM speciation monitoring for effective pollution control."
10.1038/s41612-025-01151-4,True,npj Climate and Atmospheric Science,该研究论文探讨了城市地区高NO浓度下异戊二烯环氧化二醇（IEPOX）的生成路径，指出异戊二烯羟基硝酸盐（IHN）的氧化是IEPOX的重要来源，尤其是在北京等大城市。这项研究与大气环境遥感技术密切相关，因为它涉及空气质量监测、大气成分分析，特别是对挥发性有机化合物（VOCs）、二次有机气溶胶（SOA）以及氮氧化物（NOx）的关注。虽然该论文没有直接提及卫星观测或特定传感器，但其研究结果对于理解城市空气污染的形成机制，以及验证和改进基于遥感数据的空气质量模型具有重要意义。 通过了解IEPOX的生成路径，可以更好地利用遥感数据来监测和预测城市地区的空气质量，并评估人为排放对生物源SOA形成的影响。,"['air quality monitoring', 'atmospheric composition analysis', 'volatile organic compound (VOC)', 'isoprene epoxydiols (IEPOX)', 'secondary organic aerosols (SOA)', 'isoprene hydroxynitrates (IHN)', 'NOx dependence', 'urban areas', 'Beijing']",Sainan Wang;Mike J. Newland;Andrew R. Rickard;Jacqueline F. Hamilton;Thomas J. Bannan;Archit Mehra;Carl J. Percival;Freya A. Squires;Weiwei Hu;Wei Song;Yang Chen;Xiaoling Zhang;Liming Wang;Xinming Wang,Largely underestimated production of isoprene epoxydiols (IEPOX) through high-NO oxidation pathways in urban areas,"Largely underestimated production of isoprene epoxydiols (IEPOX) through high-NO oxidation pathways in urban areas 
 Isoprene is the dominant nonmethane volatile organic compound (VOC) emitted into the atmosphere globally, with important atmospheric chemistry impacts on air quality and climate. One crucial intermediate in its gas-phase oxidation is isoprene epoxydiol (IEPOX), which contributes significantly to the formation of secondary organic aerosols (SOA). It is generally accepted that IEPOX is efficiently formed in remote forested regions with a sufficiently low NO/HO2 ratio. Here, we show that the oxidation of isoprene hydroxynitrates (IHN) can be an alternative, efficient, NO-driven pathway leading to the formation of IEPOX in urban areas where moderate to high NO concentrations exist. Field measurements from the megacity of Beijing show that this pathway contributes to more than 50% of IEPOX production during the morning and early afternoon. The results improve our understanding of the NOx dependence of SOA formation in polluted areas, where anthropogenic emissions can significantly enhance biogenic SOA formation."
10.1038/s41612-025-01145-2,True,npj Climate and Atmospheric Science,该论文研究了一种基于信任共识机制的低成本PM2.5传感器动态校准方法。该方法旨在解决低成本传感器在城市空气质量监测中存在的偏移、比例失配和漂移等问题。通过整合传感器精度、稳定性、响应性和共识一致性等指标，为每个传感器分配信任评分，并根据信任度动态调整校准模型的复杂性。实验结果表明，该方法能够显著提高低成本传感器网络的准确性，减少对大型训练数据集和频繁重新校准的依赖，从而增强其在复杂现实环境中的可扩展性。该研究直接关系到空气质量监测，属于大气环境遥感技术领域。,"['PM2.5', 'Air Quality Monitoring', 'Low-cost sensors', 'Calibration', 'Urban air quality']",Sachit Mahajan;Dirk Helbing,Dynamic calibration of low-cost PM<sub>2.5</sub> sensors using trust-based consensus mechanisms,"Dynamic calibration of low-cost PM<sub>2.5</sub> sensors using trust-based consensus mechanisms 
 Low-cost particulate matter (PM) sensors enable high-resolution urban air quality monitoring but face challenges from offsets, scaling mismatches, and drift. We propose an adaptive trust-based calibration framework that first corrects systematic errors and then dynamically adjusts model complexity based on sensor reliability. Extensive simulations and real-world deployment in Zurich, Switzerland validate the approach. Each sensor’s trust score integrates four indicators: accuracy, stability, responsiveness, and consensus alignment. High-trust sensors receive minimal correction, preserving baseline accuracy, while low-trust sensors leverage expanded wavelet-based features and deeper models. Results show mean absolute error (MAE) reductions of up to 68% for poorly performing sensors and 35–38% for reliable ones, outperforming conventional calibration methods. By using trust-weighted consensus, the framework reduces dependence on large training datasets and frequent re-calibrations, ensuring scalability. These findings demonstrate that dynamic, trust-driven calibration can substantially enhance low-cost sensor network accuracy across both controlled scenarios and complex real-world environments."
10.1038/s43247-025-02521-9,False,Communications Earth & Environment,该论文主要研究青藏高原上冰川湖和非冰川湖的甲烷排放差异，发现冰川湖的甲烷排放量低于非冰川湖。虽然甲烷是一种温室气体，与大气成分有关，但该研究的重点在于湖泊生态系统中的甲烷产生和排放机制，而非大气环境遥感技术（如空气质量监测、卫星观测或大气成分分析）。因此，该论文与大气环境遥感技术的关联性较弱。,"['Methane fluxes', 'Glacier-fed lakes', 'Tibetan Plateau', 'Greenhouse gas emissions']",Shuang Liu;Fuyuan Mai;Xiaodong Li;Meiqi Huang;Qing Yang;Guangli Mu;Linyuan Lu;Qianggong Zhang;Yiwen Liu;Yindong Tong,Author Correction: Glacier-fed lakes produce lower methane fluxes than non-glacier-fed lakes on the Tibetan Plateau,"Author Correction: Glacier-fed lakes produce lower methane fluxes than non-glacier-fed lakes on the Tibetan Plateau 
 "
10.1038/s43247-025-02510-y,False,Communications Earth & Environment,该研究论文主要关注的是发生在约1.83亿年前的托尔西阶海洋缺氧事件期间的海洋酸化现象。论文通过分析来自西南欧海洋剖面的石灰泥、腕足动物和双壳类生物的硼同位素数据，来研究当时的海洋pH值变化。研究发现，只有石灰泥的硼同位素数据记录了托尔西阶海洋缺氧事件期间的海洋酸化事件。因此，这项研究主要集中在古海洋学和地球化学方面，与大气环境遥感技术，如空气质量监测、卫星观测和大气成分分析，没有直接关系。,[],Simone A. Kasemann;Tina Klein;Richard A. Boyle;Clemens V. Ullmann;Martin Aberhan;Anette Meixner;Luís V. Duarte;Timothy M. Lenton;Veronica Piazza;Rachel A. Wood,Ocean acidification at the Toarcian Anoxic Event captured by boron isotopes in the lime mud record,"Boron isotope records of lime mud reliably constrain past ocean acidification during the Toarcian Anoxic Event, whereas records from bivalves and brachiopods do not, according to analysis of marine sections from Southwestern Europe. 
 The Toarcian Oceanic Anoxic Event (ca. 183 million years ago) marks a global mass extinction coincident with dramatic changes in climate and ocean circulation, likely driven by large igneous province emplacement. Rapid carbon dioxide release may have induced global warming, widespread ocean deoxygenation, and ocean acidification. To constrain the magnitude of ocean acidification, we present boron isotope data from three different carbonate components, lime mud (micrite), brachiopods, and bivalves, from two marine sections in SW Europe. Only data from micrite shows a temporary decrease in boron isotope composition during the Toarcian Oceanic Anoxic Event, recording an ocean acidification event, which we reproduce using a coupled biogeochemical model. The contrasting stability of boron isotope values shown by bivalves and brachiopods suggests that the investigated taxa may have been able to physiologically buffer changes in ocean pH, and are therefore poor targets for the interrogation of pH changes in Earth history. Boron isotope records of lime mud reliably constrain past ocean acidification during the Toarcian Anoxic Event, whereas records from bivalves and brachiopods do not, according to analysis of marine sections from Southwestern Europe."
10.1038/s43247-025-02500-0,True,Communications Earth & Environment,该研究论文主要关注大气环境中氯氟烃（CFC-11和CFC-12）和四氯化碳（CCl4）的寿命估算问题。它利用卫星观测数据来推断平流层的环流强度，并基于此计算这些物质的损失率、排放量和寿命。研究结果有助于提高对这些物质排放情况的监测能力，并评估它们对臭氧层和气候的影响。该研究与大气环境遥感技术密切相关，因为它使用了卫星测量数据来分析大气成分，并应用于空气质量监测和大气成分分析等领域。,"['chlorofluorocarbons', 'carbon tetrachloride', 'atmospheric lifetime', 'stratospheric circulation', 'satellite measurements', 'ozone-depleting substances', 'emission monitoring', 'nitrous oxide', 'stratospheric transport', 'emission inversions', 'ozone impacts', 'climate impacts']",Stephen Bourguet;Kane Stone;Megan Lickley,Semi-empirical estimates of stratospheric circulation and the lifetimes of chlorofluorocarbons and carbon tetrachloride,"Atmospheric lifetimes of chlorofluorocarbons 11 and 12 and carbon tetrachloride are estimated to be 50, 86, and 41 years respectively, according to satellite measurements of stratospheric chemistry. 
 Chlorofluorocarbons (CFCs) and carbon tetrachloride (CCl4) are ozone-depleting substances with high radiative efficiencies; however, uncertainties in their atmospheric lifetimes hinder top-down emission monitoring efforts. Here, we compute the loss, emission, and lifetime of CFC-11, CFC-12, and CCl4 using their mass balance in the stratosphere. We first infer the strength of the stratospheric overturning circulation using satellite measurements of nitrous oxide; the mass flux at about 18 km is then used to compute the loss of CFC-11, CFC-12, and CCl4. We confirm that anomalous surface measurements of CFC-11 from 2013 to 2018 cannot be attributed to variability in stratospheric transport alone, and we infer near-steady CCl4 emissions since 2013. Atmospheric lifetimes (50, 86, and 41 yr) independent of previous work are also computed using loss rates. These estimates add confidence to emission inversions and projections of the compounds’ ozone and climate impacts, and may help detect breaches of the Montreal Protocol. Atmospheric lifetimes of chlorofluorocarbons 11 and 12 and carbon tetrachloride are estimated to be 50, 86, and 41 years respectively, according to satellite measurements of stratospheric chemistry."
None,False,Remote Sensing of Environment,该论文主要关注的是大城市居民区夜间光污染的识别和评估，使用了SDGSAT-1卫星的微光影像数据。研究重点在于光污染的地理空间分布和强度，而非大气成分或空气质量等大气环境要素。因此，与大气环境遥感技术（如空气质量监测、卫星观测大气成分分析）的相关性较低。,"['nighttime light pollution', 'SDGSAT-1', 'glimmer imagery', 'residential area', 'megacities']",Yixuan Wu;Chenhao Huang;Yang Ye;Linlu Mei;Yalan Liu;Dacheng Wang;Weirong Chen;Jinsong Deng,Identification and evaluation of nighttime light pollution in residential gathering area of megacities based on SDGSAT-1 glimmer imagery,
10.1016/j.rse.2025.114896,False,Remote Sensing of Environment,该研究论文主要关注格陵兰冰盖上的冰上湖泊（SGLs）的动态变化，利用被动光学卫星影像（Sentinel-2和Landsat 8/9）进行监测和分析。研究重点在于冰上湖泊的面积变化与融水径流之间的关系，以及冰上湖泊对冰盖消融的影响。虽然使用了卫星观测数据，但其应用领域是冰川学和水文学，而非大气环境遥感，如空气质量监测或大气成分分析。因此，该论文与大气环境遥感技术的关联性不强。,[],Jiahui Qiu;Jiangjun Ran;Natthachet Tangdamrongsub;Xavier Fettweis;Shoaib Ali;Wei Feng;Xiaoyun Wan,Recent significant subseasonal fluctuations of supraglacial lakes on Greenland monitored by passive optical satellites,"•Supraglacial lakes in Greenland are mapped from ∼150,000 images during 2017–2022. •Monthly SGL area peaked at 5084.90 km2in August 2021. •Anomalous SGL area spike in SW basin in September 2022 caused by heavy rainfall. •Lake area changes show the highest correlation with simulated runoff. 
 Temporarily impounded liquid water on the surface of the Greenland Ice Sheet (GrIS), prominently represented as supraglacial lakes (SGLs), may enhance ice flow and modulate surface meltwater runoff, serving as a dynamic indicator of the cryohydrologic cycle. Despite their importance in understanding glacier mass balance and regional climate change, a detailed description of SGLs and their intra-annual fluctuations across the entire GrIS remains understudied. Here, we present a deep learning-based approach to automatically map SGLs from passive optical satellite imagery across the entire GrIS during the melt seasons of 2017–2022. Approximately 150,000 Sentinel-2 and Landsat 8/9 images were utilized, each representing a 5-day average composite at a 10 km × 10 km grid resolution, with the Landsat images used as possible supplements. SGL predictions by the proposed method demonstrate high performance, achieving an F1-score of up to 0.959 compared to the independent test dataset. This high accuracy enables a detailed analysis of the key role SGLs play in enhancing surface ablation by absorbing solar radiation and delivering meltwater. The SGL-driven ablation effect was most pronounced in the South-West basin of the GrIS, where the peak lake area in July accounted for 44.9 % of the total GrIS-wide lake area. In contrast, the lowest magnitude (4.2 %) was observed in the South-East basin, despite similarly strong ablation in this region. Among all the generated SGL occurrence grids, peak SGL areas in certain grids (∼14 % of the total) were observed in May or September, rather than exclusively during the typical high-ablation months of June to August, reflecting regional and elevation-dependent variations. Grids further from the ice sheet margin generally showed peak SGL areas later in the melt season, which is evident in the western part of the GrIS. Monthly SGL peak areas shift dramatically from 253.18 ± 123.94 km2 to 5084.90 ± 1043.26 km2, with the lowest in May 2018 and the highest in August 2021. An extraordinary area spike occurred in September 2022 and was particularly monitored in the South-West basin, where abnormally intense rainfall and runoff simulated by the Modèle Atmosphérique Régional (MAR) model were recorded. Our study highlights the significance of examining SGL area changes at short temporal intervals to understand the dynamics of cryospheric hydrology under future climate scenarios."
