doi,is_relevant,journal,explanation,topic_words,authors,title,abstract
10.1038/s41467-025-56298-8,False,Nature Communications,这篇论文主要关注的是量子计算领域，提出了一种结合超导猫态量子比特和二维局部LDPC码的低开销量子计算架构。其核心目标是降低量子计算中纠错所需的额外量子比特数量，以实现大规模量子计算。论文中提到的'低密度奇偶校验码'、'猫态量子比特'、'容错'等概念都属于量子计算的范畴，与大气环境遥感技术，例如空气质量监测、卫星观测和大气成分分析等，没有任何关系。,[],Diego Ruiz;Jérémie Guillaud;Anthony Leverrier;Mazyar Mirrahimi;Christophe Vuillot,LDPC-cat codes for low-overhead quantum computing in 2D,"Implementing full quantum error correction incurs a significant hardware overhead. Here, the authors propose a quantum computing architecture combining superconducting cat qubits with 2D local LDPC codes, featuring low overhead and ease of implementation. 
 The main obstacle to large scale quantum computing are the errors present in every physical qubit realization. Correcting these errors requires a large number of additional qubits. Two main avenues to reduce this overhead are (i) low-density parity check (LDPC) codes requiring very few additional qubits to correct errors (ii) cat qubits where bit-flip errors are exponentially suppressed by design. In this work, we combine both approaches to obtain an extremely low overhead architecture. Assuming a physical phase-flip error probability ϵ ≈ 0.1% per qubit and operation, one hundred logical qubits can be implemented on a 758 cat qubit chip, with a total logical error probability per cycle and per logical qubit ϵL ≤ 10−8. Our architecture also features two major advantages. First, the hardware implementation of the code can be realised with short-range qubit interactions in 2D and low-weight stabilizers, under constraints similar to those of the popular surface code architecture. Second, we demonstrate how to implement a fault-tolerant universal set of logical gates with an additional layer of routing cat qubits stacked on top of the LDPC layer, while maintaining the local connectivity. Furthermore, our architecture benefits from a high capacity of parallelization for these logical gates. Implementing full quantum error correction incurs a significant hardware overhead. Here, the authors propose a quantum computing architecture combining superconducting cat qubits with 2D local LDPC codes, featuring low overhead and ease of implementation."
10.1038/s41467-025-56409-5,False,Nature Communications,这篇论文主要研究的是钙钛矿太阳能电池的性能提升。研究人员通过引入间氨基吡啶配体和溶剂后滴技术，制备出高度有序的二维/三维钙钛矿异质结构，有效降低了界面复合和离子迁移，从而提高了太阳能电池的效率和稳定性。文中提到的26.05%效率和长期稳定性测试数据，都与太阳能电池本身的材料和器件性能有关，而与大气环境遥感技术，例如空气质量监测、卫星观测和大气成分分析等，并没有直接关系。,[],Xiaoming Chang;Randi Azmi;Tinghuan Yang;Nan Wu;Sang Young Jeong;Herui Xi;Drajad Satrio Utomo;Badri Vishal;Furkan H. Isikgor;Hendrik Faber;Zhaoheng Ling;Mingjie He;Marco Marengo;Pia Dally;Adi Prasetio;Yu-Ying Yang;Chuanxiao Xiao;Han Young Woo;Kui Zhao;Martin Heeney;Stefaan De Wolf;Leonidas Tsetseris;Thomas D. Anthopoulos,Solvent-dripping modulated 3D/2D heterostructures for high-performance perovskite solar cells,"The random orientation of spontaneously formed 2D phase atop 3D perovskites limits the performance of solar cells. Here, authors introduce a meta-amidinopyridine ligand with solvent post dripping to generate highly ordered 2D perovskites, achieving maximum efficiency of 26.05% for stable devices. 
 The controlled growth of two-dimensional (2D) perovskite atop three-dimensional (3D) perovskite films reduces interfacial recombination and impedes ion migration, thus improving the performance and stability of perovskite solar cells (PSCs). Unfortunately, the random orientation of the spontaneously formed 2D phase atop the pre-deposited 3D perovskite film can deteriorate charge extraction owing to energetic disorder, limiting the maximum attainable efficiency and long-term stability of the PSCs. Here, we introduce a meta-amidinopyridine ligand and the solvent post-dripping step to generate a highly ordered 2D perovskite phase on the surface of a 3D perovskite film. The reconstructed 2D/3D perovskite interface exhibits reduced energetic disorder and yields cells with improved performance compared with control 2D/3D samples. PSCs fabricated with the meta-amidinopyridine-induced phase-pure 2D perovskite passivation show a maximum power conversion efficiency of 26.05% (a certified value of 25.44%). Under damp heat and outdoor tests, the encapsulated PSCs maintain 82% and 75% of their initial PCE after 1000 h and 840 h, respectively, demonstrating improved practical durability. The random orientation of spontaneously formed 2D phase atop 3D perovskites limits the performance of solar cells. Here, authors introduce a meta-amidinopyridine ligand with solvent post dripping to generate highly ordered 2D perovskites, achieving maximum efficiency of 26.05% for stable devices."
10.1038/s41467-025-56312-z,False,Nature Communications,这篇论文研究的是地幔过渡带中含水铝硅酸盐的结构和热稳定性，重点关注高温条件下晶体结构的无序化对其稳定性和储水能力的影响。研究使用单晶X射线衍射、电子探针显微分析和纳米级二次离子质谱等技术，合成并在高压高温条件下表征含水铝硅酸盐单晶，发现结构无序化提高了其热稳定性并促进了更多氢的掺入。这与大气环境遥感技术，例如空气质量监测、卫星观测和大气成分分析等，并没有直接关系。研究对象是地幔深处的矿物，尺度和研究方法都与大气遥感技术存在很大差异。,[],Baoyun Wang;Jin Liu;Yanyao Zhang;Baisheng Nie;Wei Yang;Jialong Hao;Xing Ding;Yongjun Tian,High-temperature structural disorders stabilize hydrous aluminosilicates in the mantle transition zone,"Activated disorder in the structure of hydrous aluminosilicates improves their thermal stability and allows more hydrogen to be incorporated into the crystal structure, impacting the deep water cycle into the lower mantle. 
 Hydrous aluminosilicates are important deep water-carriers in sediments subducting into the deep mantle. To date, it remains enigmatic how hydrous aluminosilicates withstand extremely high temperatures in the mantle transition zone. Here we systematically investigate the crystal structures and chemical compositions of typical hydrous aluminosilicates using single-crystal X-ray diffraction, electron probe microanalyzer, and nanoscale secondary ion mass spectrometry. These single crystals are synthesized at 15.5–22.0 GPa and 1400–1700 °C, featuring pervasive structural disorders. In particular, Al and Si atoms extensively occupy new tetrahedral and octahedral sites that are nominally vacant in their ordered counterparts. High temperature activates disorders leading to variable local crystal structures and more hydrogen incorporation into the crystal structure. This result suggests that the order-to-disorder transition holds the key to the high thermal stability of hydrous aluminosilicates, significantly affecting the water cycle in the deep mantle. Activated disorder in the structure of hydrous aluminosilicates improves their thermal stability and allows more hydrogen to be incorporated into the crystal structure, impacting the deep water cycle into the lower mantle."
10.1038/s41467-025-56318-7,False,Nature Communications,这篇论文研究的是慢性淋巴细胞白血病（CLL）耐药性的分子机制。研究人员利用小鼠模型，结合多组学分析（包括基因组、转录组和蛋白质组），发现了蛋白酶体活性改变可能是导致伊布替尼耐药的原因。他们还发现，在伊布替尼耐药后使用蛋白酶体抑制剂卡非佐米可以延长小鼠的生存期。总的来说，这项研究是在细胞和分子水平上探索癌症治疗耐药性的机制，与大气环境遥感技术没有直接关系。,[],Lavinia Arseni;Gianluca Sigismondo;Haniyeh Yazdanparast;Johanne U. Hermansen;Norman Mack;Sibylle Ohl;Verena Kalter;Murat Iskar;Mathias Kalxdorf;Dennis Friedel;Mandy Rettel;Yashna Paul;Ingo Ringshausen;Eric Eldering;Julie Dubois;Arnon P. Kater;Marc Zapatka;Philipp M. Roessner;Eugen Tausch;Stephan Stilgenbauer;Sascha Dietrich;Mikhail M. Savitski;Sigrid S. Skånland;Jeroen Krijgsveld;Peter Lichter;Martina Seiffert,Longitudinal omics data and preclinical treatment suggest the proteasome inhibitor carfilzomib as therapy for ibrutinib-resistant CLL,"The molecular mechanisms underlying resistance to therapy in Chronic lymphocytic leukemia (CLL) remain to be explored. Here, the authors perform multi-omics analysis in a mouse model of ibrutinib resistance and suggest proteasome inhibition for overcoming it. 
 Chronic lymphocytic leukemia is a malignant lymphoproliferative disorder for which primary or acquired drug resistance represents a major challenge. To investigate the underlying molecular mechanisms, we generate a mouse model of ibrutinib resistance, in which, after initial treatment response, relapse under therapy occurrs with an aggressive outgrowth of malignant cells, resembling observations in patients. A comparative analysis of exome, transcriptome and proteome of sorted leukemic murine cells during treatment and after relapse suggests alterations in the proteasome activity as a driver of ibrutinib resistance. Preclinical treatment with the irreversible proteasome inhibitor carfilzomib administered upon ibrutinib resistance prolongs survival of mice. Longitudinal proteomic analysis of ibrutinib-resistant patients identifies deregulation in protein post-translational modifications. Additionally, cells from ibrutinib-resistant patients effectively respond to several proteasome inhibitors in co-culture assays. Altogether, our results from orthogonal omics approaches identify proteasome inhibition as potentially attractive treatment for chronic lymphocytic leukemia patients resistant or refractory to ibrutinib. The molecular mechanisms underlying resistance to therapy in Chronic lymphocytic leukemia (CLL) remain to be explored. Here, the authors perform multi-omics analysis in a mouse model of ibrutinib resistance and suggest proteasome inhibition for overcoming it."
10.1038/s41467-025-56423-7,False,Nature Communications,这篇论文的标题和摘要关注的是非侵入式生物医学技术的局限性，特别是这些技术对患者日常生活质量的影响，例如使用不便、不适和社会污名。它并没有涉及大气环境遥感技术，例如空气质量监测、卫星观测或大气成分分析。因此，这篇论文与大气环境遥感技术不相关。,[],Hyeokjun Yoon;Canan Dagdeviren,Towards device technologies non-invasive to our daily lives,"Recent advances in non-invasive technologies have shown disruptive potential for biomedical applications. However, while surgically non-invasive, they may introduce other types of limitations which interfere with the patient’s quality of life, from impracticalities and discomfort in daily life to social stigma. 
 Recent advances in non-invasive technologies have shown disruptive potential for biomedical applications. However, while surgically non-invasive, they may introduce other types of limitations which interfere with the patient’s quality of life, from impracticalities and discomfort in daily life to social stigma."
10.1038/s41467-024-55410-8,False,Nature Communications,这篇论文的标题和摘要关注的是公众参与和抗生素耐药性（AMR）的解决方案。它强调提高公众意识，并直接让患者和公众参与到AMR问题的解决中，例如制定方案、测试和推广解决方案。 这与大气环境遥感技术，例如空气质量监测、卫星观测和大气成分分析，没有任何关系。,[],Emily Scott-Dearing;Vanessa Carter;Michael Corley;Philip Mathew;Ara Darzi,Patient and public involvement and engagement to improve impact on antimicrobial resistance,"A step change is required in citizen awareness of antimicrobial resistance (AMR). The authors propose we go further still, directly engaging and involving patients and public in scoping, testing and scaling solutions to this global health crisis. 
 A step change is required in citizen awareness of the global antimicrobial resistance (AMR) health crisis. But we must move beyond awareness-raising to action, directly engaging and involving patients and public in scoping, testing and scaling solutions to ensure their adoption and impact. A step change is required in citizen awareness of antimicrobial resistance (AMR). The authors propose we go further still, directly engaging and involving patients and public in scoping, testing and scaling solutions to this global health crisis."
10.1038/s41467-025-56358-z,False,Nature Communications,这篇论文主要关注的是氧化石墨烯膜的制备及其在水净化方面的应用。研究者通过构建具有不对称孔的基底模板，成功制备出具有垂直通道的氧化石墨烯膜，该膜表现出高水通量和超高的重金属离子截留率。这与大气环境遥感技术，例如空气质量监测、卫星观测和大气成分分析等，并没有直接关系。论文中提到的技术主要集中在材料科学和膜分离技术领域。,[],Changdao Han;Jie Jiang;Liuhua Mu;Wenhui Zhao;Junfan Liu;Jian Lan;Shouyuan Hu;Huan Yang;Shan Gao;Feng Zhou;Junlang Chen;Yan Fan;Xiangmei Duan;Pei Li;Liang Chen,Quasi-vertically asymmetric channels of graphene oxide membrane for ultrafast ion sieving,"The high performance of two-dimensional (2D) channel membranes is generally achieved by preparing ultrathin or forming short channels with less tortuous transport through self-assembly of small flakes. Here, the authors report the construction of vertical channels in graphene oxide membranes based on a substrate template with asymmetric pores demonstrating high flux and metal ion rejection. 
 The high performance of two-dimensional (2D) channel membranes is generally achieved by preparing ultrathin or forming short channels with less tortuous transport through self-assembly of small flakes, demonstrating potential for highly efficient water desalination and purification, gas and ion separation, and organic solvent waste treatment. Here, we report the construction of vertical channels in graphene oxide (GO) membrane based on a substrate template with asymmetric pores. The membranes achieved water permeance of 2647 L m−2 h−1 bar−1 while still maintaining an ultrahigh rejection rate of 99.9% for heavy metal ions, which is superior to the state-of-the-art 2D membranes reported. Furthermore, the membranes exhibited excellent stability during long-term filtration experiments for at least 48 h, as well as resistance to ultrasonic treatment for over 100 minutes. The vertical channels possess very short pathway for almost direct water transport and a highly effective channel area, meanwhile the asymmetric porous template enhances the packing of the inserted GO nanosheets to avoid the swelling effect of membrane. Our work provides a simple way to fabricate vertical channels of 2D nanofiltration membranes with high water purification performance. The high performance of two-dimensional (2D) channel membranes is generally achieved by preparing ultrathin or forming short channels with less tortuous transport through self-assembly of small flakes. Here, the authors report the construction of vertical channels in graphene oxide membranes based on a substrate template with asymmetric pores demonstrating high flux and metal ion rejection."
10.1038/s41612-025-00918-z,False,npj Climate and Atmospheric Science,这篇论文研究了天山地区库玛拉克河流域的洪水驱动因素变化。研究使用了SWAT-Glacier水文模型和度日因子模型计算冰川融水、融雪和降雨量，并利用长短期记忆网络（LSTM）模型分析了不同因素对洪水的贡献。结果表明，冰川融水是年度最大洪水（AMF）的主要驱动因素，而融雪是春季最大洪水（AMFSp）的主要驱动因素。该研究主要关注水文过程和洪水预报，与大气环境遥感技术关系不大，例如空气质量监测、卫星观测和大气成分分析等方面没有涉及。,[],Wenting Liang;Weili Duan;Yaning Chen;Gonghuan Fang;Shan Zou;Zhi Li;Zewei Qiu;Haodong Lyu,Shifted dominant flood drivers of an alpine glacierized catchment in the Tianshan region revealed through interpretable deep learning,"Shifted dominant flood drivers of an alpine glacierized catchment in the Tianshan region revealed through interpretable deep learning 
 The Kumalak River, a typical alpine glacierized catchment in the Tianshan region, experiences complex flooding driven by glacier meltwater, snowmelt, and rainfall. However, the mechanisms driving these processes under climate change remain unclear. To address this, a SWAT-Glacier hydrological model and a degree–day factor model were used for snowmelt, glacier meltwater, and rainfall calculations. Two Long Short-Term Memory (LSTM) models (LSTM-SG and LSTM-DDF) were developed using these inputs, and additive decomposition and integrated gradient methods were applied to interpret flood mechanisms. Glacier meltwater was found to dominate annual maximum flood (AMF) events, while snowmelt drove annual spring maximum flood (AMFSp) events. For AMF events (1960–2018), contributions were 10.01–12.21% from snowmelt, 60.49–60.92% from glacier meltwater, and 26.86–29.50% from rainfall. For AMFSp events (1961–2018), contributions were 48.49–56.08% from snowmelt, 16.12–22.08% from glacier meltwater, and 27.79–29.42% from rainfall. These findings provide critical insights for enhancing flood prediction and optimizing water resource management."
10.1038/s41612-025-00919-y,False,npj Climate and Atmospheric Science,这篇论文主要关注的是英国气象局DePreSys4模式对热带气旋（台风）十年尺度变化预测能力的研究。研究发现该模式能够较好地预测北大西洋和东太平洋热带气旋数量和路径密度，预测技巧与海表温度和垂直风切变的模拟能力密切相关。论文中提到了模式预测未来十年（2023-2030年）这两个海域热带气旋数量将会增加，这可能导致巨大的经济损失。  然而，文章并没有涉及大气环境遥感技术，例如空气质量监测、卫星观测和大气成分分析等。因此，它与大气环境遥感技术关系不大。,"['tropical cyclone', 'wind shear', 'sea surface temperature', 'decadal prediction', 'climate variability']",Paul-Arthur Monerie;Xiangbo Feng;Kevin Hodges;Ralf Toumi,High prediction skill of decadal tropical cyclone variability in the North Atlantic and East Pacific in the met office decadal prediction system DePreSys4,"High prediction skill of decadal tropical cyclone variability in the North Atlantic and East Pacific in the met office decadal prediction system DePreSys4 
 The UK Met Office decadal prediction system DePreSys4 shows skill in predicting the number of tropical cyclones (TCs) and TC track density over the eastern Pacific and tropical Atlantic Ocean on the decadal timescale (up to ACC = 0.93 and ACC = 0.83, respectively, as measured by the anomaly correlation coefficient—ACC). The high skill in predicting the number of TCs is related to the simulation of the externally forced response, with internal climate variability also allowing the improvement in prediction skill. The Skill is due to the model’s ability to predict the temporal evolution of surface temperature and vertical wind shear over the eastern Pacific and tropical Atlantic Ocean. We apply a signal-to-noise calibration framework and show that DePreSys4 predicts an increase in the number of TCs over the eastern Pacific and the tropical Atlantic Ocean in the next decade (2023–2030), potentially leading to high economic losses."
10.1038/s43247-025-02019-4,False,Communications Earth & Environment,这篇研究论文主要关注珊瑚礁修复对佛罗里达州海岸线污染风险降低的经济效益评估。研究通过分析洪水风险和关键基础设施，发现珊瑚礁修复可以减少污水和石油化工污染物因洪水造成的污染，并估算了潜在的经济效益。该研究与大气环境遥感技术，例如空气质量监测、卫星观测和大气成分分析等，并没有直接关系。研究中涉及的污染物主要是陆地来源的，例如污水和石油化工产品，而不是大气中的污染物。因此，该研究与大气环境遥感技术的关联性较弱。,[],Marina E. Rottmueller;Curt D. Storlazzi;Fabian Frick,Coral reef restoration can reduce coastal contamination and pollution hazards,"Risk of sewage and petrochemical contamination from flooding along 460 km long coastline of Florida can be reduced by coral reef restoration, with a potential economic benefit of about $3.5 million US dollars, according to an analysis of flood risks and critical infrastructure. 
 Coral reef restoration can reduce the wave-driven flooding for coastal communities. However, this protection has yet to be assessed in terms of the reduced risk of flood-driven environmental contamination. Here we provide the first high-resolution valuation of the reduction of flood-related land-based environmental pollution provided by potential coral reef restoration. Along Florida’s 460 km-long coral reef-fringed coastline, coral reef restoration could reduce the risk of sewage and petrochemical contamination by preventing the flooding of petroleum storage tank systems (-9%), onsite sewage treatment and disposal systems (-4%), and wastewater treatment plants (-10%). The present value of critical infrastructure protection and contamination prevention benefits provided by coral reef restoration is $3,413,503, with some areas exceeding $1,500,000/km. Annually, 48,403 U.S. gal of petrochemicals, 10,404 GPD of wastewater treatment capacity, equivalent to $281,435, could be protected from flooding, demonstrating that coral reef restoration can provide environmental risk reduction and previously undocumented additional socioeconomic benefits. 
                
                  
                
               Risk of sewage and petrochemical contamination from flooding along 460 km long coastline of Florida can be reduced by coral reef restoration, with a potential economic benefit of about $3.5 million US dollars, according to an analysis of flood risks and critical infrastructure."
10.1038/s43247-025-02029-2,False,Communications Earth & Environment,这篇论文研究的是早白垩世时期南大西洋古海洋入侵对巴西Campos盆地古生态系统的影响。研究人员通过分析脂类生物标志物和碳酸盐同位素，揭示了大约1.16亿年前，南大西洋古海洋入侵导致该盆地从湖相碳酸盐沉积环境转变为海相蒸发岩沉积环境的过程。文中提到了海相藻类生物标志物的出现、87Sr/86Sr比率的显著负偏移以及硬石膏的出现等关键证据，表明当时存在着氧化还原分层和缺氧条件，以及化学跃层加深等现象。总而言之，这项研究属于古环境和古海洋学范畴，与大气环境遥感技术，例如空气质量监测、卫星观测和大气成分分析等，并没有直接关系。,[],Jian Ma;Leonardo F. Cury;Anelize M. B. Rumbelsperger;Heidi L. Albrecht;Erwin W. Adams;Joachim E. Amthor;Xingqian Cui;Antoine Crémière;Kei Sato;Kristin D. Bergmann;Roger E. Summons,Ecosystem changes after Early Cretaceous seawater intrusion into the proto-South Atlantic Ocean,"During the break-up of Gondwana, a marine invasion from the proto-South Atlantic Ocean about 116 million years ago transformed the paleoecosystem of the Campos Basin, as revealed by the analysis of lipid biomarkers and carbonate isotopes from the east coast of Brazil 
 The early evolution of the South Atlantic Ocean following the Cretaceous break-up of Gondwana is extensively recorded in rift basins along the conjugate margins of Africa and Brazil. For the Brazil side, divergent views of the source and pathway of the initial seawater incursion persist due to a paucity of recognized transitional sequences that document marine transgressive deposits over the continental interior. To address this, we conducted a high-resolution sedimentological and geochemical study through a core in the Campos Basin that encompasses the key lithologic switch from lacustrine carbonate to marine evaporite settings. Steroid lipid biomarkers, derived from pelagophyte marine algae, make a striking appearance in concert with a pronounced negative shift of 87Sr/86Sr ratios and coincident with the appearance of anhydrite. Importantly, the sulfur-sequestered biomarkers reveal a dynamic system where redox-stratified and anoxic conditions were amplified along with a deepening chemocline through the marine transition. During the break-up of Gondwana, a marine invasion from the proto-South Atlantic Ocean about 116 million years ago transformed the paleoecosystem of the Campos Basin, as revealed by the analysis of lipid biomarkers and carbonate isotopes from the east coast of Brazil"
