doi,is_relevant,journal,explanation,topic_words,authors,title,abstract
10.1021/acs.est.5c04582,False,Environmental Science & Technology,该论文的标题和摘要主要关注的是通过场外电催化将硫化氢分解成氢气和硫。 这项研究属于化学和材料科学领域，侧重于开发新的能源生产技术（氢气生产）。它与大气环境遥感技术（如空气质量监测、卫星观测和大气成分分析）没有直接关系。该研究不涉及大气污染物的检测、大气成分的遥感测量或利用卫星数据进行环境监测。,[],Zijin Wang;Qing-Nan Wang;Weiguang Ma;Tiefeng Liu;Wei Zhang;Panwang Zhou;Mingrun Li;Xinyi Liu;Qingbo Chang;Haibing Zheng;Ben Chang;Can Li,Correction to “Hydrogen Sulfide Splitting into Hydrogen and Sulfur through Off-Field Electrocatalysis”,
10.1021/acs.est.4c12973,False,Environmental Science & Technology,该研究论文主要关注的是一种新型固相微萃取技术，用于从水环境中富集和检测抗生素。论文描述了一种基于共价有机框架（COF）膜的材料的合成和应用，用于高效提取水样中的抗生素，并结合液相色谱-串联质谱法进行定量分析。虽然该技术与环境监测相关，但它主要集中在水环境污染物的分析，而不是大气环境遥感技术，如空气质量监测、卫星观测或大气成分分析。,[],Xiaoying Feng;Yixin Kuang;Jinglin Chen;Chunying Wei;Suxin Zhou;Juan Zheng;Gangfeng Ouyang,Lamellar Homogeneous COF Film Loaded on Ultrathin PDMS for Simultaneous and Exceptional Solid Phase Microextraction of Antibiotics,"Green solid phase microextraction (SPME) is a promising technique for effectively enriching high-profile and trace antibiotics, while its limited extraction phase volume and adsorbent load restrict the extraction efficiency. It remains a challenge to develop a rationally designed device with a high proportion of adsorbents for increased performance. Herein, using 3,8-diamino-6-phenylphenanthridine (DPP) and 1,3,5-triformylphloroglucinol (TP) as monomers, a β-ketoenamine-linked covalent organic framework membrane (TPDPP) was fabricated via interface assembly. TPDPP was further loaded on ultrathin polydimethylsiloxane (PDMS) using solvent evaporation, resulting in a high proportion of TPDPP functional components in the hybrid membrane (TPDPP@PDMS). This approach was highly feasible for the batch preparation of TPDPP@PDMS with a lamellar homogeneous structure and controllable layers. These TPDPP@PDMS membranes demonstrated outstanding enrichment performance for common antibiotics, particularly sulfonamide antibiotics, with extraction efficiencies 7.73–12.7 times higher than those of TPDPP fibers and 3.91–93.9 times higher than those of commercial fibers. The TPDPP@PDMS membranes reproducibly performed simultaneous SPME in a variety of environmental water samples, simplifying the pretreatment process and saving time. By integration of the membranes with liquid chromatography–tandem mass spectrometry, an ultrasensitive method was established to achieve parallel extraction and highly efficient antibiotic quantification, demonstrating great potential for environmental pollutant monitoring."
10.1021/acs.est.5c01190,False,Environmental Science & Technology,这篇研究论文主要关注的是水生生物（水蚤）对水下噪声污染的反应，特别是慢性宽带噪声对水蚤的生存、繁殖和移动能力的影响。它与大气环境遥感技术，如空气质量监测、卫星观测和大气成分分析等，没有直接关系。该研究的重点是水生生态系统中的噪声污染问题，而不是大气环境。,[],Loïc Prosnier;Emilie Rojas;Olivier Valéro;Vincent Médoc,Chronic Broadband Noise Increases the Fitness of a Laboratory-Raised Freshwater Zooplankton,"Although there is an increasing interest in the effects of anthropogenic noise on underwater wildlife, most studies focus on marine mammals and fish, while many other taxa of substantial ecological importance are still overlooked. This is the case for zooplankton species, which ensure the coupling between primary producers and fishes in pelagic food webs. Here, we measured lifespan, reproduction, and mobility of laboratory-raised water fleas Daphnia magna, a widespread freshwater zooplankton species, in response to continuous broadband noise. Surprisingly, we found a significant increase in survival and fecundity, leading to a higher individual fitness when considering total offspring production and a slight increase in the population growth rate according to the Euler–Lotka equation. Exposed water fleas were found to be slower than control individuals, and we discussed potential links between mobility and fitness. Our results can have implications in aquaculture and for in-lab studies (e.g., in ecotoxicology) where the acoustic environment receives little attention. Chronic broadband noise can be associated with certain human activities, but the consequences for natural Daphnia populations might differ as reduced velocity could have negative outcomes when considering competition and predation. Our work is one of the few showing an effect of noise on individual fitness and suggests that noise should be better accounted for in laboratory studies."
10.1021/acs.est.5c01254,False,Environmental Science & Technology,该研究主要关注纳米塑料对镉毒性的放大作用及其机制，包括纳米塑料作为“特洛伊木马”效应促进镉吸收、诱导炎症反应和钙离子失衡。研究对象是肝细胞，关注的是复合污染中纳米塑料对其他污染物毒性的影响。与大气环境遥感技术，如空气质量监测、卫星观测和大气成分分析，没有直接关联。,[],Xiangxiang Li;Shaoyang Hu;Zelian Yu;Falin He;Xingchen Zhao;Rutao Liu,"New Evidence for the Mechanisms of Nanoplastics Amplifying Cadmium Cytotoxicity: Trojan Horse Effect, Inflammatory Response, and Calcium Imbalance","Nanoplastics (NPs) are emerging pollutants worldwide. Particularly worrisome is that although studies have reported that NPs can amplify the biotoxicity of environmental pollutants, the specific mechanism remains unclear. Here, we found that NPs, even without significant toxicity (cell survival: 99.11%), amplified the hepatocyte toxicity of Cd2+. Mechanistically, higher Cd2+ uptake (Δ = 23.80%) combined with crucial intracellular desorption behavior of Cd2+ loaded in NPs (desorption rate: 82.70%) were identified as prerequisites for NPs amplifying Cd2+ cytotoxicity. As for toxigenic pathways, the inflammatory response and calcium (Ca) signaling pathway were identified as the primary molecular events leading to the amplification of Cd2+ cytotoxicity. Further phenotypic monitoring revealed that NPs synergized with Cd2+ to induce more severe pyroptosis and apoptosis by activating the inflammatory caspase-1-dependent and Ca2+-mitochondrial-caspase-3 pathways to a greater extent, respectively. This study reveals and proves for the first time the “Trojan horse” effects of NPs, thus elucidating the actual mechanisms by which NPs act as toxicity amplifiers of pollutants, providing significant insights into accurate risk assessment of NPs in composite pollution."
10.1021/acs.est.5c03896,False,Environmental Science & Technology,该研究主要关注纳米塑料与细胞膜的相互作用，以及由此引起的细胞膜形变。研究方法是单细胞形变等离子体成像（SCDPI），用于实时、无标记地量化纳米塑料与细胞的相互作用。研究重点在于不同尺寸、表面化学性质和材料的纳米塑料对细胞膜的影响，以及由此产生的细胞毒理学效应。与大气环境遥感技术（如空气质量监测、卫星观测和大气成分分析）没有直接关联。,[],Peng Lin†;Jiaying Li;Yushi Gao;Yachong Zhao;Yuhang Li;Huachun Zhang;Guangzhong Ma,Label-Free Quantification of Nanoplastic–Cell Membrane Interaction by Single Cell Deformation Plasmonic Imaging,"Nanoplastics are a growing environmental concern due to their potential to disrupt cellular functions. Understanding how these particles interact with cell membranes is crucial for assessing their biological effects. In this study, we present a label-free, quantitative method─Single Cell Deformation Plasmonic Imaging (SCDPI)─to measure real-time membrane interaction dynamics at the single-cell level. By examining both fixed and live cells, we characterized the binding behaviors of nanoplastics with varying sizes, surface chemistries, and materials. Our findings show that nanoplastic binding induces cell membrane deformation ranging from a few to tens of nanometers, depending on nanoplastic type and concentration (0–250 μg/mL), influencing membrane–surface interactions. This work provides new mechanistic insights into nanoplastic–cell interactions, demonstrating the potential of SCDPI as a powerful tool for evaluating the cellular impacts of environmental pollutants."
10.1029/2025GL115114,False,Geophysical Research Letters,这篇论文主要研究水合矿物脱水引起的孔隙压力如何触发深部和中等深度地震。它通过对模拟的低硅酸盐岩屑进行摩擦实验，研究了不同围压和温度下的粘滑行为。研究结果表明，脱水驱动的孔隙流体演化控制了低硅酸盐岩屑的粘滑行为。该研究与大气环境遥感技术，如空气质量监测、卫星观测和大气成分分析，没有直接关系。,[],M. Kawabata;R. Shiraishi;J. Muto;H. Nagahama;Y. Sasaki;M. Iwasaki,Time Evolution of Dehydration‐Induced Stick‐Slip Behaviors of Simulated Bassanite Gouges,"Pore pressure by dehydrating hydrous minerals can trigger deep and intermediate‐depth earthquakes. We performed friction experiments on simulated bassanite gouges under various confining pressures and temperatures. At room temperature (RT), stress drops and recurrence intervals of stick‐slip events varied with confining pressures. Under a confining pressure of 200 MPa and 110°C, stress drops and recurrence intervals decreased over time. Microstructures indicate that gouges deformed under RT contain numerous Riedel shears. On the other hand, a sample deformed under the confining pressure of 200 MPa and 110°C had few Riedel shear planes. Above observations indicate that the elevated pore pressure by the dehydration of bassanite gouges reduces the effective pressures controlling slip behaviors and suppresses the development of shear planes. We derived time function of dehydration‐driven pore pressure evolution using Avrami kinetics, which can be expressed by the Weibull distribution function representing the failure probability. Our result shows that the kinetics‐driven pore fluid evolution controlled the stick‐slip behaviors of the bassanite gouges."
10.1029/2024GL114447,False,Geophysical Research Letters,该论文主要研究木星的千米波段极光射电辐射，利用朱诺号探测器在极光区域的实地测量数据，分析了宽带千米波辐射源的特征和产生机制。研究重点在于等离子体物理和空间物理现象，与地球大气环境遥感技术（如空气质量监测、卫星观测和大气成分分析）没有直接关系。虽然涉及卫星观测数据，但其应用领域是木星的极光研究，而非地球大气环境。,[],B. Collet;L. Lamy;C. K. Louis;V. Hue;T. K. Kim,In Situ Analysis of Jupiter's Broadband Kilometric Auroral Radio Emissions With Juno,"Among the zoo of Jovian auroral radio emissions, the broadband kilometric (bKOM) component has been the least studied. Taking advantage of Juno in situ measurements within the auroral regions, we surveyed the Juno/Waves radio observations over the 60 first orbits to identify 7 bKOM source candidates. These were mostly detected during dawn storm auroral episodes (4/7) and three were found to be colocated with auroral cavities. By applying a growth rate analysis based on JADE‐E electron measurements, we show that the observed waves are driven by the Cyclotron Maser Instability from two free energy sources. The main emission, produced slightly above the electron gyrofrequency fce $\left({f}_{ce}\right)$, is amplified by conics‐type electron distribution functions (EDF) with 2–30 keV electron characteristic energies. Sporadic bursts, produced slightly below fce ${f}_{ce}$, are driven by shell‐type EDF of 0.1–10 keV. These results are analyzed comparatively to those obtained previously for Jovian hectometric and decametric emissions."
10.1029/2024GL114393,False,Geophysical Research Letters,该论文主要研究火星上尘卷风的轨迹分布，通过分析高分辨率图像，发现尘卷风轨迹集中在特定纬度并在夏季达到高峰。研究表明，尘卷风的形成与地表反照率和热惯量有关，并探讨了其对火星太阳能探测的影响。虽然使用了遥感图像，但其重点是火星地质和气候现象，而非地球大气环境的遥感监测，如空气质量或大气成分分析。,"['Mars', 'Dust devils', 'Surface disturbance', 'Atmospheric vortices', 'Remote sensing', 'Albedo', 'Thermal inertia']",Ingrid J. Daubar;Rachel Hausmann;Matthew Chojnacki;Matthew Golombek;Ralph D. Lorenz;James Wray;Susan Conway;Valentin T. Bickel,Global Distribution of Dust Devil Tracks on Mars,"Dust devils are dust‐raising atmospheric vortices that leave tracks of surface disturbance. In the first high‐resolution global survey of martian dust devil tracks (DDTs), we find them in 4% of High Resolution Imaging Science Experiment images 2014–2018. They are concentrated near ±60° latitude and peak in local summer, more frequently in the southern hemisphere summer (LS ∼ 250°–320°), coinciding with peak heating. DDT formation does not correlate with elevation, indicating it does not depend on ambient atmospheric pressure. Locations and timing of DDTs are similar to active dust devils, with several regional exceptions. DDTs are most common in areas characterized by low albedo and moderate thermal inertia, where thin layers of dust overlie larger‐grained material that provides an albedo contrast when uncovered by the passage of an atmospheric vortex. In addition to revealing the nature and formation of DDTs, this study has implications for solar‐powered exploration of Mars, identifying potential dust‐clearing event regions."
10.1029/2024GL114440,False,Geophysical Research Letters,该研究探讨了西太平洋反气旋（WNPAC）的加强与西太平洋热带气旋（WNPTC）活动减少之间的关系，尤其是在厄尔尼诺现象的背景下。研究发现，WNPTC活动的减少可以解释WNPAC大约33%的变异性。主要影响因素是600hPa高度上的相对湿度降低，而低层涡度的变化影响较小。这项研究主要关注大气环流和气象现象之间的动力学关系，与大气环境遥感技术（如空气质量监测、卫星观测和大气成分分析）没有直接关联。,"['Tropical Cyclone', 'Anticyclone', 'El Niño', 'Relative Humidity', 'Vorticity']",Haoyu Chen;Dake Chen;Tao Lian,Inactive Tropical Cyclone Strengthens Western North Pacific Anticyclone,"Previous studies have examined the strengthening of the western North Pacific anticyclone (WNPAC) after the mature phase of El Niño from a large‐scale perspective. This study demonstrates that the intensification of WNPAC is preceded by a reduction in western North Pacific tropical cyclones (WNPTCs) approximately 2 months earlier. By estimating the relative vorticity associated with WNPTCs, we find that reduced WNPTC activity accounts for about 33% of WNPAC variability from November of the El Niño year to September of the following year. This reduction is primarily driven by decreased relative humidity at 600 hPa, with low‐level vorticity changes playing a minor role. Our finding of the significant impact of WNPTCs on the WNPAC aligns with the circulation theorem and enhances the dynamical understanding of WNPAC changes induced by El Niño."
10.1029/2025GL114919,True,Geophysical Research Letters,该研究论文分析了2003年11月地磁暴恢复阶段东亚地区电离层中一种特殊的、不连续的负风暴演变过程。它使用了全球紫外成像仪（GUVI）的数据，包括[O]和[N2]柱密度比（Σ[O]/[N2]），总电子含量（TEC），以及电离层参数（如电离层峰值高度（hmF2）和峰值电子密度（NmF2））。此外，还结合了热层-电离层-电动力学通用环流模型（TIEGCM）的模拟结果。研究表明，这种现象可能与南半球热成风在压力梯度力和科里奥利力的影响下形成的热层成分的涡旋状结构有关。因此，该研究与大气环境遥感技术密切相关，因为它利用卫星观测数据（GUVI）和模型来研究大气成分和电离层的变化，尤其是在地磁暴期间。,"['Ionosphere', 'Thermosphere', 'Atmospheric Composition', 'Satellite Observations', 'GUVI', 'Total Electron Content (TEC)', '[O]/[N2] column density ratio', 'Geomagnetic Storms']",Xu Guo;Biqiang Zhao;Tingting Yu;Yongliang Zhang;Yuichi Otsuka;Atsuki Shinbori;Michi Nishioka;Septi Perwitasari;Wenjie Sun;Lianhuan Hu;Guozhu Li;Zhipeng Ren,A Peculiar Discontinuous Ionospheric Latitudinal Variation Over the East Asia Region During the Recovery Phase of the November 2003 Super Magnetic Storm: A Hint From May 2024 Superstorm,"In this study, we analyze a discontinuous negative storm evolution process in the ionosphere over the East Asian region during the recovery phase of the geomagnetic storms on 20 and 21 November 2003, using data from the Global Ultraviolet Imager (GUVI) for [O] and [N2] column density ratio (Σ[O]/[N2]), Total Electron Content (TEC), as well as ionospheric parameters, namely, the ionospheric peak height (hmF2) and peak electron density (NmF2), supplemented by Thermosphere Ionosphere Electrodynamics General Circulation Model (TIEGCM) simulations. The event lasted 3–4 hr and may represent the first simultaneous observation of vortex‐like structures in both the thermosphere and ionosphere since Solar Cycle 23. Our research findings suggest that this structure is most probably related to the vortex‐like structure of thermospheric composition caused by thermospheric winds blowing from the Southern Hemisphere under the influence of pressure gradient force and Coriolis force."
10.1029/2024GL113165,False,Geophysical Research Letters,该研究论文主要关注南极洲的古气候重建，通过分析蓝冰区域的冰样本中的同位素来估算过去的地表温度，从而研究南极洲在不同海拔高度上的温度变化。虽然该研究与气候变化有关，但它侧重于古气候学，而不是直接涉及大气环境遥感技术，如空气质量监测、卫星观测或大气成分分析。因此，它与大气环境遥感技术的关联性不强。,"['paleoclimate', 'Antarctica', 'temperature', 'blue ice', 'isotope']",Etienne Legrain;Veronica Tollenaar;Steven Goderis;Lisa Ardoin;Pierre‐Henri Blard;Philippe Claeys;Raúl R. Cordero;Vinciane Debaille;François Fripiat;Philippe Huybrechts;Naoya Imae;Maaike Izeboud;Frank Pattyn;Hamed Pourkhorsandi;Julien Seguinot;Naoki Shirai;Marijke Vancappellen;Matthias Van Ginneken;Sarah Wauthy;Akira Yamaguchi;Mehmet Yesiltas;Harry Zekollari,Absence of Elevation‐Dependent Warming in Antarctica Inferred From Blue Ice Paleoclimate Records,"Reconstructing the past Antarctic climate commonly involves deep drilling of ice cores. However, the ∼1% of the Antarctic ice sheet surface covered with blue ice also provides unique, yet largely unexploited paleoclimatic opportunities. Here, we analyze 444 ice samples collected in blue ice surfaces located around the Sør Rondane Mountains. Isotope measurements (δ18O) on these samples enable us to estimate surface paleotemperatures for both the current interglacial period and the Last Glacial Maximum. Combining these paleotemperatures with the spatially varying source elevation of the sampled blue ice provides new insights on the (lack of) lapse rate evolution (i.e., changes in the elevation‐temperature relationship) outside the 40°N–40°S latitudinal band. This result contrasts with low‐latitude areas that have experienced elevation‐dependent warming (EDW) during this period. Our results hint at a future (lack of) EDW in Antarctica, thereby highlighting the potential of blue ice area paleoclimatic archives to better predict future climatic changes."
10.1029/2024GL114071,False,Geophysical Research Letters,该研究论文主要关注南极洲维纳布尔冰架（Venable Ice Shelf）的稳定性，通过分析重力数据和卫星图像来研究冰架的底部地形和接地情况。研究揭示了冰架下方的海床深度，并推断了冰架在过去几十年中的接地历史。虽然使用了Landsat卫星图像，但其目的是分析冰架的物理特性，而非大气环境或大气成分，因此与大气环境遥感技术关系不大。,[],C. D. Locke;K. J. Tinto;D. F. Porter;R. R. Constantino,Novel Record of Intermittent Grounding of the Venable Ice Shelf Since 1935 From Operation IceBridge Airborne‐Gravity‐Derived Bathymetry and Landsat Imagery,"Future projections and past reconstructions of Antarctic Ice Sheet stability and sea‐level rise depend on knowledge of continental shelf bathymetry, which controls water circulation under floating ice and interactions between the ice shelf and seafloor. We present a bathymetry model of the Venable Ice Shelf (VIS) in the Bellingshausen Sea sector from an inversion of airborne gravity data. The new model reveals troughs up to ∼1.6 km deeper than previously mapped, providing pathways for warm Circumpolar Deep Water to access the grounding line. A bathymetric high beneath the western VIS is identified as a former pinning point. From crevasse patterns in Landsat satellite imagery, we infer intermittent grounding of the ice shelf on this high since ∼1935, and we interpret these patterns as evidence of mid‐20th century ice‐shelf thinning, in addition to a regrounding between 1970 and 1988, extending the ice‐shelf thickness record beyond the satellite era."
10.1029/2024GL113415,True,Geophysical Research Letters,该研究论文主要关注土卫六（泰坦）南极地区云层的演变。通过分析卡西尼探测器成像科学子系统的数据，研究人员发现南极云早在土卫六南半球秋季初期就开始形成，并持续存在一段时间。研究揭示了云层高度的下降和横向扩展，表明该云层位于极地平流层中的冷空气区域。这些观测数据为理解土卫六南半球秋季期间极地平流层的温度结构和大气环流提供了新的约束条件。虽然研究对象是土卫六，但其研究方法和关注点（如大气成分分析、卫星观测数据的使用）与大气环境遥感技术密切相关。,"[""Titan's atmosphere"", 'South polar cloud', 'Cassini Imaging Science Subsystem', 'HCN ice', 'Stratospheric temperature', 'Atmospheric circulation', 'Satellite observations', 'Atmospheric composition analysis']",Lavender Elle Hanson;Robert S. French;Darryn W. Waugh;Erika L. Barth;Carrie M. Anderson,The Evolution of Titan's Cold South Polar Cloud,"Early during Titan's southern fall, images captured by Cassini's Imaging Science Subsystem revealed the formation of a large cloud above Titan's south pole. Subsequent analysis of Cassini data revealed the cloud contained HCN ice, but the cloud's evolution has not been examined. We reviewed imagery of Titan's south pole between 2012 and the end of mission at Ls ${\mathrm{L}}_{s}$ = 93°. We find evidence of cloud formation as early as Ls ${\mathrm{L}}_{s}$ = 32° (April 2012), one terrestrial month earlier than previously reported, after which the cloud persists until Ls ${\mathrm{L}}_{s}$ = 79° (mid 2016). The cloud top altitude descended from about 320 km at Ls ${\mathrm{L}}_{s}$ = 32° to below 230 km by Ls ${\mathrm{L}}_{s}$ = 79°, at which point it became obscured by atmospheric methane absorption. The cloud also grew laterally, remaining just beyond the terminator, suggesting the cloud marks a region of cold air in the polar stratosphere. These measurements place new constraints on Titan's polar stratospheric temperature structure and circulation during southern fall."
10.1038/d41586-025-01513-1,False,Nature,该播客概述了美国国家科学基金会（NSF）的最新发展，以及拟议的预算削减可能对美国科学产生的影响。它主要关注科研经费和政策层面，而不是大气环境遥感技术。,"['research funding', 'budget cuts', 'US science', 'NSF']",Benjamin Thompson;Dan Garisto,NSF terminates huge number of grants and stops awarding new ones,"In this podcast we get an overview of recent developments at the US research funder, and what proposed budget cuts could mean for US science. 
 In this podcast we get an overview of recent developments at the US research funder, and what proposed budget cuts could mean for US science.  Hear the biggest stories from the world of science | 12 May 2025"
