doi,is_relevant,journal,explanation,topic_words,authors,title,abstract
10.1038/d41586-025-01501-5,False,Nature,该研究的标题和摘要描述了一项将铅转化为金的实验，尽管这种金只存在了极短的时间。这项研究主要关注原子如何发生变化，与大气环境遥感技术（如空气质量监测、卫星观测和大气成分分析）没有直接关系。因此，该研究与大气环境遥感技术领域无关。,[],Nick Petrić Howe,Scientists turn lead into gold,"The transmuted metal only lasted a fraction of a second before it was obliterated but can tell researchers more about how atoms change. 
 The transmuted metal only lasted a fraction of a second before it was obliterated but can tell researchers more about how atoms change.  The transmuted metal only lasted a fraction of a second before it was obliterated but can tell researchers more about how atoms change."
10.1038/d41586-025-01469-2,False,Nature,该研究的标题和摘要主要关注蝙蝠的叫声以及这些声音如何进化。它与大气环境遥感技术（如空气质量监测、卫星观测和大气成分分析）没有直接关系。因此，该研究与大气环境遥感技术不相关。,[],Tavares Cebola,What language do bats speak? I’m trying to find out,"Cesária Huó is collecting bat vocalizations to understand how the sounds they make evolve. 
 Cesária Huó is collecting bat vocalizations to understand how the sounds they make evolve.  Cesária Huó is collecting bat vocalizations to understand how the sounds they make evolve."
10.1038/d41586-025-01443-y,False,Nature,该研究论文的标题和摘要主要关注北美鸟类数量下降的趋势，特别是在鸟类种群数量最多的地区。虽然环境因素可能对鸟类种群产生影响，但摘要中并未明确提及大气环境遥感技术，如空气质量监测、卫星观测或大气成分分析。因此，该论文与大气环境遥感技术的直接关联性较低。,[],Holly Smith,North America’s birds are declining where they should be thriving,"The steepest drops in number are seen in areas that host the largest populations — a trend observed for more than 80% of bird species across the continent. 
 The steepest drops in number are seen in areas that host the largest populations — a trend observed for more than 80% of bird species across the continent.  The steepest drops in number are seen in areas that host the largest populations — a trend observed for more than 80% of bird species across the continent."
10.1038/d41586-025-01503-3,False,Nature,该研究论文的标题和摘要主要关注偏头痛药物Ubrogepant在预防偏头痛早期症状（如疲劳和光敏感）方面的效果。它与大气环境遥感技术，如空气质量监测、卫星观测和大气成分分析，没有直接或明显的关联。,[],Fred Schwaller,Migraine drug is first to tackle debilitating early symptoms,"Results from a phase III clinical trial suggest that taking ubrogepant at the first sign of an oncoming migraine can prevent pre-headache fatigue and light sensitivity. 
 Results from a phase III clinical trial suggest that taking ubrogepant at the first sign of an oncoming migraine can prevent pre-headache fatigue and light sensitivity.  Results from a phase III clinical trial suggest that taking ubrogepant at the first sign of an oncoming migraine can prevent pre-headache fatigue and light sensitivity."
10.1038/d41586-025-01485-2,False,Nature,这篇论文的标题和摘要主要关注人工智能模型在进行创新研究方面的能力，以及OpenAI发布开放版本模型供研究人员使用的计划。它与大气环境遥感技术，如空气质量监测、卫星观测和大气成分分析，没有直接关联。主要讨论的是AI模型本身及其在研究领域的应用，而不是特定的环境科学或遥感技术。,"['AI models', 'OpenAI', 'Novel research', 'Advanced models']",Elizabeth Gibney,‘AI models are capable of novel research’: OpenAI’s chief scientist on what to expect,"Jakub Pachocki, who leads the firm’s development of advanced models, is excited to release an open version to researchers. 
 Jakub Pachocki, who leads the firm’s development of advanced models, is excited to release an open version to researchers.  Jakub Pachocki, who leads the firm’s development of advanced models, is excited to release an open version to researchers."
10.1038/d41586-025-01464-7,False,Nature,该论文的标题和摘要主要关注的是在极端环境下生存的微生物，以及对这些微生物的研究提出的挑战性问题。它与大气环境遥感技术，如空气质量监测、卫星观测和大气成分分析，没有直接的关联。因此，该论文与大气环境遥感技术的相关性较低。,[],Andreas Teske,Hunting extreme microbes that redefine the limits of life,"An adventurous survey of inhospitable habitats unearths extraordinary organisms that pose challenging research questions. 
 An adventurous survey of inhospitable habitats unearths extraordinary organisms that pose challenging research questions.  An adventurous survey of inhospitable habitats unearths extraordinary organisms that pose challenging research questions."
10.1038/d41586-025-01467-4,False,Nature,该论文的标题和摘要主要关注大规模创伤对社会的影响，强调在研究和寻求治愈方法时，不应忽视受影响社区的历史。 这与大气环境遥感技术（如空气质量监测、卫星观测和大气成分分析）没有直接关系。论文讨论的是社会心理学和历史背景下的集体创伤，而不是大气科学或遥感技术。,[],Cindy C. Sangalang,The scars of war last for centuries: how we understand collective trauma needs to change,"Researchers looking to study the social ramifications of mass traumas must not overlook the histories of affected communities in the search for healing. 
 Researchers looking to study the social ramifications of mass traumas must not overlook the histories of affected communities in the search for healing.  Researchers looking to study the social ramifications of mass traumas must not overlook the histories of affected communities in the search for healing."
10.1038/d41586-025-01465-6,False,Nature,该论文的标题和摘要主要讨论了理论物理学领域中存在的问题，即一种认为只有推翻现有理论才能提出新想法的错误观念。这与大气环境遥感技术，如空气质量监测、卫星观测和大气成分分析等领域没有直接关联。因此，该论文与大气环境遥感技术不相关。,[],Carlo Rovelli,Why bad philosophy is stopping progress in physics,"Theoretical physicists are in thrall to a misguided mindset that allows viable ideas to be advanced only by overturning what already exists. 
 Theoretical physicists are in thrall to a misguided mindset that allows viable ideas to be advanced only by overturning what already exists.  Theoretical physicists are in thrall to a misguided mindset that allows viable ideas to be advanced only by overturning what already exists."
10.1038/d41586-025-01506-0,False,Nature,该文章的标题和摘要主要涉及植物气味产生的生物化学机制（臭菘），核物理实验（铅转化为金），以及由于传统知识丧失导致的鱼类迁徙模式变化。这些主题与大气环境遥感技术，如空气质量监测、卫星观测或大气成分分析，没有直接或明显的联系。,[],Flora Graham,Daily briefing: How skunk cabbages get their stink,"A small tweak to a common enzyme lets stinky plants make their distinctive scents. Plus, physicists turned lead into gold for a fraction of a second and the migrations of herrings are being altered by the loss of elders’ knowledge. 
 A small tweak to a common enzyme lets stinky plants make their distinctive scents. Plus, physicists turned lead into gold for a fraction of a second and the migrations of herrings are being altered by the loss of elders’ knowledge.  A small tweak to a common enzyme lets stinky plants make their distinctive scents. Plus, physicists turned lead into gold for a fraction of a second and the migrations of herrings are being altered by the loss of elders’ knowledge."
10.1038/s41561-025-01696-2,False,Nature Geoscience,该研究论文主要关注的是土壤微生物在长期生态系统发展过程中如何适应磷限制。研究通过分析澳大利亚一个约70万年的沙丘系统的土壤样本，发现微生物通过减少膜脂中的磷含量和增加细胞内碳储存来有效地利用磷。这项研究揭示了土壤微生物的生理生态与生态系统长期发展轨迹之间的重要关系，但与大气环境遥感技术，如空气质量监测、卫星观测和大气成分分析没有直接关联。,[],O. M. Butler;S. Manzoni;G. Liang;S. Matsumura;C. R. Warren,Microbial physiology conserves phosphorus across long-term ecosystem development,"Microbial physiology conserves phosphorus by reducing phosphorus contributions in membrane lipids and increasing intracellular carbon storage during long-term ecosystem development, according to measurements of a ~700,000–year chronosequence across an Australian dune system. 
 Long-term terrestrial ecosystem development is characterized by declining soil phosphorus (P) and a corresponding increase in biological P limitation. The function of P-limited ecosystems relies on efficient use of P by soil microorganisms, but the physiological strategies used by microorganisms to manage P scarcity during ecosystem development are unknown. Here, by applying recent advances in soil metabolomic techniques to samples collected from a ~700,000-year chronosequence of ecosystem development in eastern Australia, we show that soil microbial physiological strategies for P efficiency include a high proportion of non-phosphorous membrane lipids along with substantial intracellular carbon storage. These strategies—which proliferate during primary succession and are maximized in retrogressive, P-depleted ecosystems—uphold microbial carbon limitation, triple modelled P-mineralization potential and can conserve close to double the P contained in the aboveground biomass of vegetation. These findings transform our understanding of terrestrial ecosystems by revealing a strong yet overlooked interplay between the ecophysiology of soil microorganisms and the long-term trajectory of ecosystem development. Microbial physiology conserves phosphorus by reducing phosphorus contributions in membrane lipids and increasing intracellular carbon storage during long-term ecosystem development, according to measurements of a ~700,000–year chronosequence across an Australian dune system."
10.1038/s41561-025-01687-3,False,Nature Geoscience,这篇论文主要研究南极冰盖下的水文系统，特别是冰流的融化和沉积物运输过程。它关注的是冰下水的流动如何影响冰架的融化和海底通道的形成，以及这些过程与上游流域的联系。研究方法包括钻孔观测、沉积物分析和水文数据量化。该研究与大气环境遥感技术（如空气质量监测、卫星观测和大气成分分析）没有直接关系，因为它主要关注冰川和水文过程。,[],Huw J. Horgan;Craig Stewart;Craig Stevens;Gavin Dunbar;Linda Balfoort;Britney E. Schmidt;Peter Washam;Mauro A. Werder;Darcy Mandeno;James Marschalek;Christina Hulbe;Nicholas Holschuh;Richard Levy;Benjamin Hurwitz;Stefan Jendersie;Katelyn Johnson;Justin Lawrence;Regine Morgenstern;Andrew D. Mullen;Enrica Quartini;Wilson Sauthoff;Matthew Siegfried;Holly Still;Sam Thorpe-Loversuch;Tina van de Flierdt;Ryan Venturelli;Arran Whiteford,A West Antarctic grounding-zone environment shaped by episodic water flow,"Observations from a borehole in the Kamb Ice Stream suggest that discrete subglacial discharge events dominate channel melt and sediment transport. 
 Beneath Antarctica’s ice sheets, a little-observed network of liquid water connects vast landscapes and contributes to the motion of the overriding ice. When this subglacial water reaches the ocean cavity beneath ice shelves, it mixes with seawater, amplifying melt and in places forming deep channels in the base of the ice. Here we present observations from a hot-water-drilled borehole documenting subglacial water entering the ocean cavity at the grounding zone of Kamb Ice Stream and the Ross Ice Shelf. Our observations show that melt has removed approximately a third of the ice thickness, yet measurements reveal low rates of subglacial discharge in a turbid plume. Sediment cored from the channel floor shows larger discharge events occur and episodically deposit material from distinct geological domains. We quantify subglacial discharge and link our observations to the catchment upstream. We conclude that discrete discharge events are likely to dominate channel melt and sediment transport and result in the extensive ice-shelf features downstream of Kamb Ice Stream. Observations from a borehole in the Kamb Ice Stream suggest that discrete subglacial discharge events dominate channel melt and sediment transport."
10.1038/s41467-025-59669-3,False,Nature Communications,该论文主要研究了一种用于制造可打印缠结聚合物多重网络的共引发剂系统双重机制策略。重点在于材料科学，特别是高分子材料的合成和机械性能增强，以及其在增材制造和传感领域的应用。与大气环境遥感技术，如空气质量监测、卫星观测和大气成分分析等领域没有直接关联。,[],An Wei;Qian Wang;Jupen Liu;Yuchan Huang;Haoxiang Li;Zhenhao Zhu;Tao Wang;You Yu,Co-initiating-system dual-mechanism drives the design of printable entangled polymer multinetworks,"While entangled networks can offer improved mechanical performance in synthetic materials, these can be challenging to achieve in polymer materials. Here, the authors report a co-initiating system for fabrication of printable entangled networks. 
 Entanglement significantly enhances the mechanical performance and functionality of both natural and synthetic materials. However, developing straightforward, versatile strategies for creating high-performance entangled polymer materials remains a challenge. Here, a co-initiating-system dual-mechanism strategy is designed for fabricating printable entangled polymer multinetworks. This thermal-light dual-initiation process benefits the synthesis of high-molecular-weight polymers and promotes the rapid formation of multinetworks within hydrogels. The resulting long polymer chains enable hydrogels with higher mechanical performance, lower stress relaxation, and activation energy compared to short polymer chain-contained samples. Such a method proves more effective than traditional self-thickening and strengthening techniques for enhancing hydrogel entanglements and is also compatible with additive manufacturing, enabling the design of complex 2D webs with adaptive mechanical performance and capable of detecting and sensing applications. This work provides an effective strategy for designing high-performance entangled polymer materials, which are set to impact numerous fields, from advanced sensing to material science and beyond. While entangled networks can offer improved mechanical performance in synthetic materials, these can be challenging to achieve in polymer materials. Here, the authors report a co-initiating system for fabrication of printable entangled networks."
10.1038/s41467-025-59711-4,False,Nature Communications,该论文主要研究植物中组蛋白H3.3上赖氨酸4 (K4) 的作用，以及它对基因表达调控的影响。研究发现H3.3上的K4对于H3K4甲基化至关重要，并且参与了基因的激活和RNA聚合酶II的延伸。该研究与大气环境遥感技术（如空气质量监测、卫星观测和大气成分分析）没有直接关系。,[],Mande Xue;Lijun Ma;Xiaoyi Li;Huairen Zhang;Fengyue Zhao;Qian Liu;Danhua Jiang,Single amino acid mutations in histone H3.3 illuminate the functional significance of H3K4 methylation in plants,"Sequence variation between histones expands chromatin diversity. Here, the authors investigate the role of lysine 4 in Arabidopsis histones H3.1 and H3.3 and show that it is essential for H3.3 methylation and regulating gene expression. 
 Although histone modifications are linked with chromatin activities such as transcription, proofs of their causal importance remain limited. Sequence variants within each histone family expand chromatin diversity and may carry specific modifications, further raising questions about their coordination. Here, we investigate the role of lysine 4 (K4) in two Arabidopsis H3 variants, H3.1 and H3.3. K4 is essential for H3.3 function but not H3.1 in plant development. Mutating K4 in H3.3 drastically reduced H3K4 methylation levels and mimicked the transcriptomic effects of losing SDG2, the major H3K4 trimethylation (H3K4me3) methyltransferase. Moreover, H3.3K4 and SDG2 are required for de novo gene activation and RNA Pol II elongation. H3K4 methylation is preferentially enriched on H3.3, likely due to the coordinated activity of H3.3 deposition and H3K4 methylation. Furthermore, we reveal the diverse impacts of K4 nearby residue mutations on H3K4 methylation and H3.3 function. These findings highlight H3.3 as a critical substrate for H3K4 methylation, which is important for gene expression regulation. Sequence variation between histones expands chromatin diversity. Here, the authors investigate the role of lysine 4 in Arabidopsis histones H3.1 and H3.3 and show that it is essential for H3.3 methylation and regulating gene expression."
10.1038/s41467-025-59666-6,False,Nature Communications,这篇论文主要研究钠离子电池正极材料的结构稳定性和电化学性能，特别是通过熵调节和多阳离子相互作用来抑制晶格应变，从而提高电池的循环稳定性和钠离子扩散动力学。该研究与大气环境遥感技术，如空气质量监测、卫星观测和大气成分分析，没有直接关系。,[],Haoji Wang;Tongchao Liu;Hongyi Chen;Yu Mei;Jinqiang Gao;Lianshan Ni;Ningyun Hong;Jiangnan Huang;Xinyu Hu;Wentao Deng;Guoqiang Zou;Hongshuai Hou;Debbie S. Silvester;Craig E. Banks;Xiaobo Ji;Khalil Amine,Multicationic interactions mitigating lattice strain in sodium layered cathodes,"Sodium layered oxide-based cathodes of sodium-ion batteries commonly suffer from structural degradation. Here, authors propose entropy regulation with zero Li/Co usage to suppress lattice strain, enhancing structural stability and improving the electrochemical performance. 
 Transition-metal (TM) layered oxides have emerged as the primary cathode choice for sodium-ion batteries (SIBs) due to their high energy density and sustainable chemistry using non-critical elements. However, their anisotropic lattice strain and stress accumulation during (de)sodiation lead to severe structural degradation, yet an intrinsic strain-depressant approach remains elusive. Herein, we propose entropy regulation with zero Li/Co usage to mitigate harmful lattice displacements and enhance the electrochemical performance of sodium layered cathodes. Our findings demonstrate that high entropy design effectively inhibits TMO6 octahedra distortions upon cycling, as evidenced by hard X-ray absorption spectroscopy, greatly reducing near-surface structural deconstruction and interface side reactions. Furthermore, multicationic interactions driven by configurational entropy thermodynamically mitigate the formation of oxygen defects and strengthen ligand-to-metal coordination. The complementarity inherent in charge compensation within complex systems is unveiled and the restrained lattice parameters deviations without interior volume residuals are successfully achieved. As a result, the multicationic cathode exhibits improved cycling stability and Na+ diffusion kinetics in both half and full cells. The cathode chemistries outlined here broaden the prospects for lattice engineering to alleviate bulk fatigue and open up the possibility to develop an economically viable layered oxides with long durability. Sodium layered oxide-based cathodes of sodium-ion batteries commonly suffer from structural degradation. Here, authors propose entropy regulation with zero Li/Co usage to suppress lattice strain, enhancing structural stability and improving the electrochemical performance."
10.1038/s41467-025-59792-1,False,Nature Communications,该论文主要关注的是眼科疾病，特别是脉络膜肿瘤的诊断。它提出了一种基于概念的可解释模型，利用多模态数据进行诊断。这与大气环境遥感技术，如空气质量监测、卫星观测和大气成分分析，没有直接关系。,[],Yifan Wu;Yang Liu;Yue Yang;Michael S. Yao;Wenli Yang;Xuehui Shi;Lihong Yang;Dongjun Li;Yueming Liu;Shiyi Yin;Chunyan Lei;Meixia Zhang;James C. Gee;Xuan Yang;Wenbin Wei;Shi Gu,Author Correction: A concept-based interpretable model for the diagnosis of choroid neoplasias using multimodal data,"Author Correction: A concept-based interpretable model for the diagnosis of choroid neoplasias using multimodal data 
 "
10.1038/s41467-025-59742-x,False,Nature Communications,该论文主要研究通过激光打印技术制备具有增强机械性能的聚乙二醇（PEG）微柱和蜂窝微晶格材料。研究重点在于材料的压缩强度、能量吸收能力和循环加载后的恢复能力。虽然该研究具有潜在的应用价值，例如在低密度晶格结构中提高机械性能，但它与大气环境遥感技术（如空气质量监测、卫星观测和大气成分分析）没有直接关联。,[],Letian Zheng;Heyi Liang;Jin Tang;Qiang Zheng;Fang Chen;Lian Wang;Qi Li,Micrometer-scale poly(ethylene glycol) with enhanced mechanical performance,"Optimizing mechanical performance for polymer materials is frequently challenging, often require complex methods. Here the authors design an poly(ethylene glycol) material with enhanced mechanical properties by laser printing a micropillar and honeycomb micro-lattice. 
 Strong and lightweight materials are highly desired. Here we report the emergence of a compressive strength exceeding 2 GPa in a directly printed poly(ethylene glycol) micropillar. This strong and highly crosslinked micropillar is not brittle, instead, it behaves like rubber under compression. Experimental results show that the micropillar sustains a strain approaching 70%, absorbs energy up to 310 MJ/m3, and displays an almost 100% recovery after cyclic loading. Simple micro-lattices (e.g., honeycombs) of poly(ethylene glycol) also display high strength at low structural densities. By combining a series of control experiments, computational simulations and in situ characterization, we find that the key to achieving such mechanical performance lies in the fabrication of a highly homogeneous structure with suppressed defect formation. Our discovery unveils a generalizable approach for achieving a performance leap in polymeric materials and provides a complementary approach to enhance the mechanical performance of low-density latticed structures. Optimizing mechanical performance for polymer materials is frequently challenging, often require complex methods. Here the authors design an poly(ethylene glycol) material with enhanced mechanical properties by laser printing a micropillar and honeycomb micro-lattice."
