doi,is_relevant,journal,explanation,topic_words,authors,title,abstract
10.5194/essd-2025-352,False,Earth System Science Data Discussions,该研究论文主要关注冰核粒子（INP）在大气中的作用，特别是它们如何影响云的微物理过程和降水形成。论文介绍了美国能源部大气辐射测量（ARM）用户设施收集的全球不同环境下的INP数据集，包括北极、农业区、城市、海洋和山区。研究重点是INP的浓度、类型（生物、有机、无机）以及它们在不同季节和地区的差异。虽然该研究与大气环境有关，但它更侧重于云和降水过程中的微观物理机制，而不是大气环境遥感技术，如空气质量监测或卫星观测。,"['ice nucleating particles', 'cloud microphysics', 'precipitation formation', 'aerosol-cloud interactions', 'INP concentration', 'biological INP', 'organic INP', 'inorganic INP']",Jessie M. Creamean;Carson C. Hume;Maria Vazquez;Adam Theisen,Long-term measurements of ice nucleating particles at Atmospheric Radiation Measurement (ARM) sites worldwide,"This study presents a comprehensive, publicly available ice nucleating particles (INP) dataset from the U.S. Department of Energy Atmospheric Radiation Measurement (ARM) user facility across diverse environments, including Arctic, agricultural, urban, marine, and mountainous sites. Samples are collected via fixed and mobile platforms and processed using a standardized pipeline. The dataset supports observational and modelling analyses of seasonal, spatial, and compositional variability in INPs. 
 Ice nucleating particles (INPs) play a critical role in cloud microphysics and precipitation formation, yet long-term, spatially extensive observational datasets remain limited. Here, we present one of the most comprehensive publicly available datasets of immersion-mode INP concentrations using a single analytical method, generated through the U.S. Department of Energy’s (DOE) Atmospheric Radiation Measurement (ARM) user facility. INP filter samples have been collected across a broad range of environments—including agricultural plains, Arctic coastlines, high-elevation mountain sites, marine regions, and urban areas—via fixed observatories, mobile facility deployments, and vertically-resolved tethered balloon system operations. We describe the standardized processing and quality assurance pipeline, from filter collection and processing using the Ice Nucleation Spectrometer to final data products archived on the ARM Data Discovery portal. The dataset includes both total INP concentrations and selectively treated samples, allowing for classification of biological, organic, and inorganic INP types. It features a continuous 5-year record of INP measurements from a central U.S. site, with data collection still ongoing. Seasonal and site-specific differences in INP concentrations are illustrated through intercomparisons at −10 °C and −20 °C, revealing distinct regional sources and atmospheric drivers. We also outline mechanisms for researchers to access existing data, request additional sample analyses, and propose future field campaigns involving ARM INP measurements. This dataset supports a wide range of scientific applications, from observational and mechanistic studies to model development, and provides critical constraints on aerosol-cloud interactions across diverse atmospheric regimes."
10.5194/essd-2025-353,False,Earth System Science Data Discussions,该研究论文主要关注利用遥感技术（卫星和无人机影像）对黄花苜蓿这种入侵植物在南达科他州西部地区的时空分布进行制图，时间范围从2016年到2023年。研究重点在于开发黄花苜蓿的覆盖率地图，以便帮助土地管理者识别和控制这种入侵物种，从而保护北部大平原的草原生态系统。论文中使用的遥感数据包括Sentinel-2卫星影像和高分辨率无人机影像，并结合地面实测数据和机器学习模型进行分析。因此，该论文与大气环境遥感技术（如空气质量监测、卫星观测和大气成分分析）没有直接关系，主要侧重于植被生态和入侵物种管理。,[],Sakshi Saraf;Ranjeet John;Venkatesh Kolluru;Khushboo Jain;Geoffrey Henebry;Jiquan Chen;Raffaele Lafortezza,Spatiotemporal mapping of invasive yellow sweetclover blooms using Sentinel-2 and high-resolution drone imagery,"We developed the maps to identify the spread of an invasive plant, yellow sweetclover, in the western South Dakota from 2016 to 2023 using satellite and drone imagery. Our study shows that the plant blooms widely during wet years and is often found near roads and moist areas. The developed percent cover maps using field data, drone images, and machine learning models would help land managers find and control this invasive species, protecting Northern Great Plains grasslands. 
 Yellow sweetclover (Melilotus officinalis (L.) Lam.; MEOF) is an invasive forb pervasive across the Northern Great Plains, often linked to traits such as wide adaptability, strong stress tolerance, and high productivity. Despite MEOF's prevalent ecological-economic impacts and importance, knowledge of its spatial distribution and temporal evolution is extremely limited. Here, we aim to develop a spatial database of annual MEOF abundance (2016–2023) across western South Dakota (SD) at 10 m spatial resolution by applying a generalized prediction model on Sentinel-2 imagery. We collected in situ quadrat-based total vegetation cover with MEOF percent cover estimates across western SD from 2021 through 2023 and synthesized with other available percent cover estimates (2016–2022) of several federal, state, and non-governmental sources. We conducted drone overflights at 14 sites across Butte County, SD in 2023 to develop very high spatial resolution (4–6 cm) and accurate MEOF cover maps by applying a random forest (RF) classification model. The field-measured and uncrewed aerial system (UAS) derived MEOF percent cover estimates were used to train, test, and validate a RF regression model. The predicted MEOF percent cover dataset was validated with UAS-derived percent cover in 2023 across four sites (out of 14 sites). We found that the variation in the Tasseled Cap Greenness and Normalized Difference Yellowness Index were among the top predicting variables in predicting MEOF abundance. Our predictive model yielded greater accuracies with an R2 of 0.76, RMSE of 15.11 %, MAE of 10.95 %, and MAPE of 1.06 %. We validated our 2023 predicted maps using the 3-m resolution PlanetScope imagery for regions where field samples could not be collected in 2023. The database of MEOF abundance showed consecutive years of average or above-average precipitation yielded a higher MEOF abundance across the study region. The database could assist local land managers and government officials pinpoint locations requiring timely land management to control the rapid spread of MEOF in the Northern Great Plains. The developed invasive MEOF percent cover datasets are freely available at the figshare repository (https://doi.org/10.6084/m9.figshare.29270759.v1)."
10.5194/gmd-18-4805-2025,False,Geoscientific Model Development,该论文主要描述了一个名为SuCCESs的综合评估模型，该模型用于计算能源、材料、土地利用和气候变化之间的长期相互作用情景，直至2100年。该模型通过跨期优化，最小化系统成本，以满足预测的需求和其他约束（如气候目标），从而得出建模系统之间的长期均衡解决方案。虽然该模型考虑了温室气体排放及其对气候变化的影响，但其重点在于能源、材料和土地利用系统的综合建模，而不是大气环境遥感技术，如空气质量监测、卫星观测或大气成分分析。因此，该论文与大气环境遥感技术的直接相关性较低。,[],Tommi Ekholm;Nadine-Cyra Freistetter;Tuukka Mattlar;Theresa Schaber;Aapo Rautiainen,"SuCCESs – a global IAM for exploring the interactions  between energy, materials, land use, and climate systems  in long-term scenarios (model version 2024-10-23)","SuCCESs (Sustainable Climate Change mitigation strategies in Energy–land–material Systems) is a model that represents energy, materials, land use, and climate change globally and can be used to calculate long-term scenarios of these systems up to year 2100. It provides a new way to model how these systems interact and how they could work together towards reaching global sustainability targets, for example, to mitigate climate change. This paper describes how the model works and the results it can produce and how these compare to results from other models. 
 SuCCESs (Sustainable Climate Change mitigation strategies in Energy–land–material Systems) is a bottom-up integrated assessment model (IAM) that represents energy production and use, materials production, land use, and climate globally. The primary use case for SuCCESs is to calculate long-term scenarios until 2100 that consider the interactions between these systems, for example, the greenhouse gas emissions from energy, materials, and land use and their impact on climate change. The four systems are hard-linked in SuCCESs, and scenarios are solved through intertemporal optimization by minimizing discounted system costs to satisfy projected demand and other constraints, e.g. climate targets. This yields a long-term equilibrium solution between the modelled systems. This article introduces the model logic and structure, describes the overall representation of each system, and provides an evaluation by comparing the scenarios produced by SuCCESs with different end-of-century radiative forcing targets to those from other IAMs. Towards this end and to demonstrate the capability of SuCCESs for large-scale scenario exploration, we also conduct a sensitivity analysis employing Monte Carlo sampling with a 1000-member scenario ensemble for each radiative forcing target. Lastly, we discuss some practical aspects and different ways of using the model in long-term scenario analyses."
10.5194/gmd-18-4789-2025,False,Geoscientific Model Development,该论文主要关注海洋环流模型（NEMO）中海气热通量的偏差校正，使用神经网络来提高海洋温度预测的准确性。虽然涉及大气强迫数据，但其重点在于海洋模拟和预测，而非大气环境遥感技术本身，如空气质量监测、卫星观测或大气成分分析。因此，与大气环境遥感技术的关联性不强。,[],Andrea Storto;Sergey Frolov;Laura Slivinski;Chunxue Yang,Correction of sea surface biases in the NEMO ocean general circulation model using neural networks,"Inaccuracies in air–sea heat fluxes severely degrade the accuracy of ocean numerical simulations. Here, we use artificial neural networks to correct air–sea heat fluxes as a function of oceanic and atmospheric state predictors. The correction successfully improves surface and subsurface ocean temperatures beyond the training period and in prediction experiments. 
 The atmospheric forcing and the heat exchanges between the ocean and the atmosphere represent one of the major sources of uncertainty for numerical ocean reconstructions and predictions, together with inaccuracies in vertical mixing and solar radiation penetration. Air–sea heat fluxes may suffer from inaccuracies in meteorological fields, sea surface variables, and bulk formulations, which have a strongly nonlinear dependence on the ocean state. Here, state-dependent errors in heat fluxes are learned by artificial neural networks (ANNs) from a dataset of heat flux correction terms, derived in turn from previous sea surface temperature nudging experiments. The pre-trained model predictors include stationary fields, atmospheric forcing data, ocean state, and stratification indices. Variable importance scores emphasize the dependence of air–sea heat flux errors on wind forcing. The pre-trained heat flux correction model is then used to adaptively correct fluxes online, in a series of global ocean experiments performed with the NEMO version 4 (Nucleus for European Modelling of the Ocean) ocean general circulation model, augmented with ANN inference capabilities in Fortran90. Results indicate the positive impact of the correction procedure, beyond the training period, e.g. in independent observation–poor and –rich periods, leading to the same dynamic and subsurface signature as in nudging experiments. Prediction experiments also indicate the method's potential for use in operational forecast applications. The method may also be adopted in coupled long-term reanalyses, long-range predictions, and projections."
10.1021/acs.est.4c08174,False,Environmental Science & Technology,该研究论文的标题和摘要主要关注灾害准备和经历过用水困难的人的看法。它探讨了人们对灾害的准备程度以及对水资源安全的看法，数据来源是劳埃德船级社基金会的世界风险调查。因此，该论文与大气环境遥感技术（如空气质量监测、卫星观测和大气成分分析）没有直接关系。该研究属于社会科学领域，侧重于人类行为、风险认知和社会应对策略，而非大气科学或遥感技术。,[],Joshua F. Inwald;Wändi Bruine de Bruin;Marc Yaggi,Disaster Preparedness and Perceptions of People who Experienced Water Insecurity: Insights from the Lloyd’s Register Foundation’s World Risk Poll,
10.1021/acs.est.5c02148,False,Environmental Science & Technology,该研究主要关注野外-城市交界区域（WUI）的材料燃烧产生的副产物，以及这些副产物的化学和毒理学特征。虽然燃烧产物会影响大气环境，但该研究的重点在于具体材料燃烧的化学成分和毒性，而非使用遥感技术进行大气成分监测或分析。因此，它与大气环境遥感技术的关联性较弱，更偏向于化学和毒理学分析。,"['combustion byproducts', 'toxicology', 'WUI', 'chemical profiles']",Mackenzie Bowden;Fernando Rosario-Ortiz;Cresten Mansfeldt,Combustion Byproducts of Individual Materials Characteristic of the Wildland–Urban Interface (WUI) Display Unique Chemical and Toxicological Profiles That Are Masked in Aggregate Samples,
10.1021/acs.est.5c03293,False,Environmental Science & Technology,该研究论文主要关注的是中国东部自来水中全氟和多氟烷基物质（PFAS）的残留问题，以及这些物质对水资源的影响和家用净水器降低风险的效果。 这项研究侧重于水质分析和污染控制，与大气环境遥感技术，如空气质量监测、卫星观测和大气成分分析没有直接关系。,[],Xinxin Zhang;Danfan Wang;Kemeng Wang;Zilin Yang;Mengjie Ai;Yanyan Zhang,Legacy and Novel Per- and Polyfluoroalkyl Substances in Tap Water from East China: Impact from Water Sources and Risk Mitigation by Household Purifiers,
10.1021/acs.est.5c03460,False,Environmental Science & Technology,该研究论文主要关注沿海城市河流中的新兴污染物，并提出了一种结合可疑物和非目标物筛查以及空间自相关分析的优先级排序策略。该研究旨在评估这些污染物对海洋生态系统的威胁，并根据污染源和水文动态等环境条件来确定污染物的传输行为。研究重点在于识别和追踪河流中的污染物来源，并利用空间自相关性来量化污染物在环境中的传输行为。虽然该研究涉及环境监测，但其重点是水环境而非大气环境，因此与大气环境遥感技术（如空气质量监测、卫星观测和大气成分分析）没有直接关联。,[],Mengwen Liu;Guiyao Xiong;Yunhao Ke;Xuebing Wang;Xiaobin Zhu;Nanyang Yu;Peixiu Zhai;Jianfeng Wu;Jichun Wu;Si Wei,Integrating Suspect and Nontarget Screening with Spatial Autocorrelation to Prioritize Emerging Contaminants in a Coastal Urban River,"Emerging contaminants (ECs) in coastal urban rivers threaten marine ecosystems, yet existing prioritization strategies focus on the physicochemical properties of ECs, neglecting the contribution of environmental conditions (e.g., pollution sources and hydrological dynamics) to the transport behavior of ECs. This study integrates suspect and nontarget screening with spatial autocorrelation analysis to establish a monitoring-driven prioritization strategy. In this study, 276 ECs were identified in an urban river discharging into Laizhou Bay, Bohai Sea, including five newly detected per- and polyfluoroalkyl substances (PFAS). The source-tracing analysis, incorporating multidimensional indicators, revealed three representative pollution patterns of ECs in rivers: single-point, composite-point, and mixed sources. Spatial autocorrelation derived from monitoring data was evaluated for 161 ECs with source assignment and intrinsic properties, such as mobility, demonstrating the potential of spatial autocorrelation/connectivity to capture the combined effects of chemical characteristics and actual environmental conditions on ECs’ transport behavior. A quantitative measure of spatial connectivity, correlation length, was applied to prioritize ECs. PFAS from mixed sources exhibited high priority. Persistence, mobility, and toxicity (PMT) evaluation highlighted the need for further investigation into the ecological risks posed by prioritized PFAS. This approach guides targeted monitoring and in-depth risk assessments of ECs, supporting efficient coastal ecosystem management."
10.1021/acs.est.5c03513,False,Environmental Science & Technology,该研究论文主要关注西班牙加的斯湾沿海地区塑料在海洋环境中的垂直分布和组成，包括表层水、次表层水、水体和沉积物中的塑料浓度和类型。研究重点在于塑料颗粒在不同环境介质中的分布模式、垂直输运过程以及沉积和破碎等因素的影响。与大气环境遥感技术（如空气质量监测、卫星观测和大气成分分析）没有直接关系。,[],Rocío Quintana;Sandra Manzano-Medina;Lucía Pérez-López;Amets Oyón-Sanz;Daniel González-Fernández;Juan Ignacio González-Gordillo;Elisa Marti;Fidel Echevarría;Carmen Morales-Caselles,Vertical Distribution and Composition of Plastics in Coastal Areas of the Gulf of Cádiz: Insights into Transport Dynamics,"Plastic distribution in the surface water of the marine environment has been well-documented over the years. However, vertical distribution of plastic within the water column remains poorly understood due to a lack of in situ data. This study investigates the vertical distribution of plastic particles in coastal areas of the Gulf of Cádiz, examining the surface (0–0.2 m), subsurface (0.2–1.2 m), water column (1.2–100 m), and sediment layers. Using a high vertical resolution sampling, we analyzed plastic concentration patterns across different environmental compartments, as well as plastic particle characteristics. Our results show the highest plastic concentrations in the sediments (97.9%). Concentrations along the water column decrease exponentially with depth, retaining the particles in the mixed layer just before reaching the pycnocline. Fragment-type microplastics dominate in all compartments, while film-type and line are most prevalent below the sea surface (>0.2 m). The sediment contains the densest polymers and the smallest particle sizes, likely due to density-driven sedimentation and fragmentation processes. These findings highlight the role of vertical transport in the distribution and potential accumulation of plastics across compartments, which is crucial for understanding their fate and long-term environmental impacts."
10.1021/acs.est.5c09658,False,Environmental Science & Technology,该研究主要关注亚马逊黑土中富含的稠环芳烃碳（ConAC）和氮（ConAN）的化学性质，特别是腐殖酸中的这些物质。研究旨在了解ConAC的形成过程及其转化为含氧衍生物的过程。虽然研究涉及土壤中的碳和氮循环，但它与大气环境遥感技术，如空气质量监测、卫星观测或大气成分分析没有直接关系。因此，该研究与大气环境遥感技术的相关性较低。,[],João Vitor dos Santos;Aleksandar I. Goranov;Laís G. Fregolente;Marcia C. Bisinoti;Zhenhuan Sun;Klaus Schmidt-Rohr;Patrick G. Hatcher,Deciphering the Chemistry of Condensed Aromatic “Black” Carbon and Nitrogen in Amazonian Anthrosols,"Amazonian anthrosols are renowned for their high fertility and dark color, properties primarily attributed to the abundance of condensed aromatic carbon (ConAC) in the soil organic matter. ConAC, commonly referred to as black carbon, play a key role in the stability and nutrient retention of these soils. However, the processes governing the formation of ConAC and its transformation into oxygenated derivatives remain poorly understood. In this study, we used multiple analytical platforms to investigate the chemistry of ConAC-rich humic acids (HA) extracted from Terra Mulata de Indio, a type of Amazonian anthrosol. The results reveal that ConAC are predominantly nonprotonated and consist of approximately 4–10 condensed rings. These structures exhibit varying degrees of oxygenation (1–24 oxygen atoms), suggesting that they are produced through oxidative processes. Approximately 20% of ConAC contain nitrogen atoms, referred to as ConAN (condensed aromatic nitrogen), which are part of either  heterocyclic ring systems (commonly termed black nitrogen) or present as amine functional groups. As a result, we conclude that HA in Amazonian anthrosols contain polycyclic N-containing aromatic acids (PolyNARA), likely formed through combined charring of plant and animal biomass, abiotic  nitrogen incorporation, and/or other soil processes. The mechanisms governing the formation, persistence, and transformation of PolyNARA in Amazonian anthrosols warrant further investigation, particularly given their potential implications for global carbon and nitrogen biogeochemical cycling."
10.1021/acs.est.4c14384,False,Environmental Science & Technology,该研究论文主要关注的是在室内环境下，使用加热美发工具时，由于美发产品挥发而产生的纳米颗粒物，以及由此可能导致的人体呼吸道暴露风险。虽然涉及空气中的颗粒物，但研究重点在于室内空气质量和个人护理产品的使用，与大气环境遥感技术（如空气质量监测、卫星观测和大气成分分析）关联不大，属于室内空气污染和暴露评估的范畴。,"['indoor air pollution', 'nanoparticles', 'personal care products', 'human exposure']",Jianghui Liu;Jinglin Jiang;Satya S. Patra;Xiaosu Ding;Chunxu Huang;Jordan N. Cross;Brian H. Magnuson;Nusrat Jung,Indoor Nanoparticle Emissions and Exposures during Heat-Based Hair Styling Activities,"Heat-based hair styling activities, such as straightening, curling, and waving, emit volatile and semivolatile chemicals when used with hair care products like creams, lotions, and serums. This study investigates the formation of airborne nanoparticles (6–500 nm) during such activities as a previously unrecognized source of indoor air pollution. Experiments conducted in the Purdue zEDGE Test House revealed that hair styling at temperatures above 300 °F produced indoor nanoparticle concentrations ranging from 10,000 to over 100,000 particles cm–3, with sub-100 nm particles typically accounting for more than 95% of total number concentrations at temperatures exceeding 360 °F. The primary mechanism for nanoparticle formation was heat-driven volatilization of cyclic siloxanes and various low-volatility constituents in hair care products, followed by nanoparticle nucleation and subsequent growth via condensation and coagulation. Ozonolysis of fragrance additives served as a secondary formation pathway. Respiratory tract deposition modeling indicated that more than 10 billion nanoparticles could deposit in the respiratory system during a single hair styling session, with the highest dose occurring in the pulmonary region. These findings identify heat-based hair styling as a significant indoor source of airborne nanoparticles and highlight previously underestimated exposure risks. This work advances our understanding of the physical and chemical processes underlying emissions from personal care product use and underscores the need for mitigation strategies to reduce exposure in residential environments."
