doi,is_relevant,journal,explanation,topic_words,authors,title,abstract
10.1021/acs.est.4c12586,False,Environmental Science & Technology,这篇论文主要关注饮用水中的机会性病原体（OPs）和消毒副产物（DBPs），探讨了影响它们在饮用水系统中同时出现的各种因素，包括物理化学参数、水源特性、处理工艺和分配系统特性。论文强调了微生物和化学研究之间需要加强合作，以实现对微生物和化学风险的整体评估。该研究与大气环境遥感技术（如空气质量监测、卫星观测和大气成分分析）没有直接关系。,[],Soojung Lee;Yue Sun;Shi Fan;Nowrina Rahim;Yuhao Xian;Mohammad Kiron Shakhawat;Karina A. Chavarria;Matthew Vedrin;Seth Guikema;Lina Sela;Emily Kumpel;Mariana Lanzarini-Lopes;Yun Shen;Mary Jo Kirisits;Lutgarde Raskin;Sarah Potgieter;Katherine S. Dowdell;Aleksandra Szczuka,Moving Beyond the Silos of Opportunistic Pathogen and Disinfection Byproduct Research to Improve Drinking Water System Management,"Drinking water opportunistic pathogens (OPs) and disinfection byproducts (DBPs) both pose risks to public health, and their variable occurrence from source to tap complicates efforts to control them simultaneously. Management of OPs and DBPs is further hindered by the historical division between microbial and chemical research. This review brings together the current knowledge regarding OPs and DBPs, identifies factors that influence the occurrence of both, and highlights areas where research is needed to better understand their health risks. First, we examine the current understanding of how OPs and DBPs are jointly influenced by physicochemical parameters, source water characteristics, treatment processes including disinfection, and distribution system properties. Temperature, for example, can affect OP and DBP occurrence, where higher temperatures can promote the growth of some OPs, such as Legionella pneumophila, but temperature’s effect on DBPs is species-dependent. Methods for quantifying the risks associated with OPs (quantitative microbial risk assessment) and DBPs (chemical risk assessment) are compared, finding that the numerous assumptions and data gaps associated with each method limit comparability across contaminant types. We highlight the urgent need to fill existing data gaps and develop a more unified risk framework so as to move toward holistic assessment of microbial and chemical risks. This review provides suggestions for future research, highlighting ways that researchers might utilize established practices in OP or DBP studies to further our understanding of the other. For example, analysis of source water organic matter composition, which has advanced our understanding of DBP formation, could be utilized to elucidate how source water characteristics influence OPs. This review bridges the gap between the OP and DBP disciplines, arguing that collaboration between the two is needed to address the pressing challenges facing water systems today."
10.1021/acs.est.5c02367,False,Environmental Science & Technology,该研究论文的标题和摘要主要关注的是有机磷酸酯阻燃剂代谢物在澳大利亚不同年龄和性别的尿液样本中的趋势分析（2012-2023）。 这项研究属于环境健康和生物监测领域，与大气环境遥感技术（如空气质量监测、卫星观测和大气成分分析）没有直接关系。研究重点在于评估人体暴露于特定化学物质的程度，而不是大气环境本身的成分或变化。,[],Danielle E. Que;Fatima den Ouden;Stijn Bosschaerts;Ian Zammit;Sandra Nilsson;Xianyu Wang;Christos Symeonides;Yarui Liu;Leisa-Maree L. Toms;Peter Hobson;Daman Langguth;Adrian Covaci;Jochen F. Mueller,Trends of Organophosphate Ester Flame Retardant Metabolites in Age- and Sex-Stratified Pooled Australian Urine Samples from the Past Decade (2012–2023),
10.1021/acs.est.5c04349,False,Environmental Science & Technology,该研究论文主要关注的是铁载体去铁胺-B对由腐败希瓦氏菌介导的铀生物矿化的螯合作用的修正。它探讨了生物地球化学过程中重金属铀的去除和转化，与大气环境遥感技术（如空气质量监测、卫星观测和大气成分分析）没有直接关系。该研究属于环境生物地球化学和微生物修复领域，而非大气科学。,[],Xiaojing Lu;Yang-Yang Zhang;Wencai Cheng;Yingzhangyang Liu;Qingrong Li;Xiaoan Li;Faqin Dong;Jun Li;Xiaoqin Nie,Correction to “Chelating Effect of Siderophore Desferrioxamine-B on Uranyl Biomineralization Mediated by Shewanella putrefaciens”,
10.1021/acs.est.4c08571,False,Environmental Science & Technology,该论文主要关注水体中全氟烷基物质 (PFAS) 降解技术的实验设计、测试和报告的最佳实践。它侧重于化学方法，并为开发可靠的 PFAS 实验室协议提供建议，涵盖实验计划、样品储存和分析以及废物管理等关键方面。此外，它还提出了五个标准，用于标准化 PFAS 降解技术的性能和进展报告。因此，该论文与大气环境遥感技术（如空气质量监测、卫星观测和大气成分分析）没有直接关系。,[],Allyson Leigh Junker;Jan-Max Arana Juve;Lu Bai;Charlotte Skjold Qvist Christensen;Lutz Ahrens;Ian T. Cousins;Mohamed Ateia;Zongsu Wei,"Best Practices for Experimental Design, Testing, and Reporting of Aqueous PFAS-Degrading Technologies","Increased awareness of pervasive per- and polyfluoroalkyl substances (PFAS) contamination and the need for zero-pollution treatment solutions necessitate the scientific and engineering community to respond urgently and systematically. Existing approaches lack reproducible and standardized methods to report the technological treatment capabilities. Consequently, it is difficult to compare innovations and accurately assess their potential. In this Perspective, we shed light on hurdles encountered in the lab-scale research and development of aqueous PFAS destruction technologies with a focus on chemical methods and offer recommendations for overcoming them. Best practices are provided for developing robust PFAS laboratory protocols covering crucial aspects such as experimental planning, sample storage and analysis, and waste management. Further, we present five criteria to standardize reporting on performance and advances in PFAS degrading technologies: 1) scope, 2) defluorination efficiency, 3) relative energy consumption, 4) material stability, and 5) unit process considerations. Through the dissemination of these insights, we aim to foster progress in the development of highly effective treatment solutions."
10.1021/acs.est.4c10935,False,Environmental Science & Technology,该研究论文主要关注氮管理对温室气体减排的贡献，以中国为例进行了案例研究。它构建了一个氮-碳耦合模型，将氮代谢与温室气体排放清单联系起来，旨在揭示氮管理在协同减少温室气体排放方面的作用。论文重点在于农业氮肥的使用、畜禽粪便管理以及食物浪费等环节对温室气体排放的影响，并提出了相应的减排策略。虽然涉及大气中的气体成分，但研究方法和重点并非大气环境遥感技术，如空气质量监测、卫星观测或大气成分分析，而是侧重于农业管理措施对温室气体排放的宏观影响评估。,"['greenhouse gas emissions', 'nitrogen management', 'carbon dioxide', 'methane', 'nitrous oxide', 'carbon sequestration']",Hang Fu;Kai Zhao;Xin Xie;Yuanhang Li;Yuheng Sun;Lei Shi;Dingjiang Chen;Shanying Hu,Contribution of Nitrogen Management to Greenhouse Gas Emission Reduction: A Case Study of China,"Developing collaborative and effective strategies for reducing reactive nitrogen (Nr) and greenhouse gas (GHG) emissions is key to maintaining human activities within planetary boundaries. Nitrogen (N) management not only promotes Nr emission and pollution control but also influences GHG emission sources. Therefore, we constructed a nitrogen–carbon (N–C) coupled model to link N metabolism with GHG emission inventory at the national scale, revealing the contributions of N management for synergistic GHG emission reduction. China was selected as the case study. The results showed that from 2015 to 2020, the N-metabolism system was associated with 1510 Mt carbon dioxide (CO2)eq yr–1 of GHG emissions, including CO2, methane, nitrous oxide, and C sequestration, accounting for 13.5% of the national level. Adopting N–C coupled strategies could synergistically reduce N-associated GHG emissions by 42.1% (607.8 Mt CO2 eq), suggesting that the Nr–GHG comitigation effects have been considerably underestimated. Specifically, the most effective synergistic strategies were balanced N fertilizer use, manure management, food loss, and waste reduction, and garbage sorting, which may become a priority for future N–C synergistic emission reduction."
10.1021/acs.est.4c13472,True,Environmental Science & Technology,该研究论文探讨了亚油酸气溶胶在非均相氧化过程中的氧化降解机制，重点关注羟基自由基（•OH）引发的传统过氧化反应和Criegee中间体（CI）介导的自氧化反应。研究通过实验和动力学模型，量化了这两种机制对气溶胶氧化速率的影响，并识别了关键产物作为反应路径的指示剂。虽然论文没有直接提及遥感技术或卫星观测，但其研究结果对于理解大气中有机物的降解过程、气溶胶的形成和演变以及空气质量具有重要意义。通过深入了解这些化学过程，可以为开发更精确的大气模型和改进空气质量监测技术提供科学依据，最终可能影响到遥感数据的解释和应用。,"['atmospheric degradation', 'aerosol oxidation', 'air quality', 'organic aerosols', 'atmospheric composition']",Meirong Zeng and Kevin R. Wilson,Coupling of Lipid Peroxidation and Criegee Intermediate Mediated Autoxidation in the Heterogeneous Oxidation of Linoleic Acid Aerosols,"Autoxidation is an established mechanism for the degradation of organic molecules, which is relevant in the atmosphere, combustion processes, the environment, and the rancidification of lipids (commonly known as lipid peroxidation). Autoxidation proceeds via radical chain reactions involving hydroxyl (•OH), peroxy (RO2•), and alkoxy radicals, which are also prominent oxidants in the atmosphere. Recent reports have provided evidence for an alternative autoxidation mechanism driven instead by Criegee intermediates (CIs), which are produced from the reaction of β-hydroxy peroxy radicals (β–OH-RO2•). This work evaluates the contributions of these two mechanisms in the •OH initiated heterogeneous oxidation of linoleic acid (LA) aerosols. Reaction kinetics and product distributions are monitored using a vacuum ultraviolet photoionization aerosol time-of-flight mass spectrometer. To explain the observed kinetics, a kinetic model is developed that incorporates both the conventional peroxidation and alternative CI-mediated autoxidation mechanisms. We observe that the CI-mediated autoxidation pathways enhance the heterogeneous autoxidation rate, while the peroxidation reactions, although present, contributes less to the overall oxidation rate. α-Acyloxyalkyl hydroperoxides (AAHPs) are identified as key indicators for bimolecular reactions of CI with LA, highlighting the role of LA as a CI scavenger. Moreover, the measured functionalized LA products with hydroxyl or carbonyl group(s), serve as markers for the peroxidation reactions. In summary, this work presents a quantitative framework to understand the coupled reaction network of •OH, RO2•, β–OH-RO2• radicals, and CI in driving heterogeneous autoxidation, which is crucial for understanding degradation mechanisms of organic molecules in the environment and atmosphere."
10.1021/acs.est.4c14193,False,Environmental Science & Technology,该论文主要关注利用机器学习辅助的分子结构嵌入方法，以提高对新兴污染物通过臭氧氧化去除的预测准确性。研究重点在于饮用水处理过程中新兴污染物的降解，构建了基于图神经网络（GNN）的KANO-EC模型，用于预测臭氧氧化过程中新兴污染物的残留率。该模型能够捕捉复杂的结构特征，并阐明氧化机制中涉及的关键官能团。虽然该研究与环境科学相关，但其核心在于水处理技术和化学物质的反应预测，与大气环境遥感技术（如空气质量监测、卫星观测和大气成分分析）没有直接联系。,[],Jiapeng Yue;Hongjiao Pang;Renke Wei;Chengzhi Hu;Jiuhui Qu,Machine Learning-Assisted Molecular Structure Embedding for Accurate Prediction of Emerging Contaminant Removal by Ozonation Oxidation,"Ozone has demonstrated high efficacy in depredating emerging contaminants (ECs) during drinking water treatment. However, traditional quantitative structure–activation relationship (QSAR) models often fall short in effectively normalizing and characterizing diverse molecular structures, thereby limiting their predictive accuracy for the removal of various ECs. This study uses embedded molecular structure vectors generated by a graph neural network (GNN), combined with functional group prompts, as inputs to a feedforward neural network. A data set of 28 ECs and 542 data points, representing diverse molecular structures and physiochemical properties, was built to predict the residual rate of ECs (REC) in ozonation oxidation. Compared to traditional QSAR models, the GNN-based molecular structure embedded methods significantly improve prediction accuracy. The resulting KANO–EC model achieved an R2 of 0.97 for REC, demonstrating its ability to capture complex structural features. Moreover, KANO–EC maintains exceptional interpretability, elucidating key functional groups (e.g., carbonyls, hydroxyls, aromatic rings, and amines) involved in the oxidation mechanism. This study presents the KANO–EC model as a novel approach for predicting the ozonation removal efficiency of current and potential ECs. The model also provides valuable insights for developing efficient control strategies for ensuring the long-term safety and sustainability of drinking water supplies."
10.1021/acs.est.5c00903,False,Environmental Science & Technology,该研究主要关注过氧乙酸在含色度溶解性有机物水溶液中的光化学转化，以及其在去除新兴污染物方面的应用。虽然涉及太阳辐射，但重点在于水处理而非大气环境。因此，与大气环境遥感技术（如空气质量监测、卫星观测和大气成分分析）没有直接关联。,[],Yixin Huang;Yihui Zhang;Mengzhe Zhao;Shuwen Yan;Daqiang Yin;Weihua Song,Solar-Induced Phototransformation of Peracetic Acid in Chromophoric Dissolved Organic Matter Solutions,"Peracetic acid (PAA) has been extensively investigated as an alternative disinfectant for water and wastewater treatments. However, the photochemical transformation of PAA in sunlit surface waters has not been previously investigated. For the first time, the photosensitized transformation of PAA was here observed in chromophoric dissolved organic matter (CDOM)-enriched solutions under simulated solar irradiation. Triplet CDOM (3CDOM*) is here proposed to play a key role in the phototransformation processes. Using triplet model compounds, the reaction rate constant of 3CDOM* with PAA can be estimated to around 1.1 × 108 M–1 s–1. The reaction mechanism of triplet with PAA involves both energy- and electron-transfer. CH3COO• was generated from the reaction between PAA and excited triplets. Furthermore, HO• and organic reactive species (i.e., CH3COOO• and CH3COO•) are involved in the photochemical transformation of PAA in sunlit CDOM-enriched solutions. These reactive species (including HO•, CH3COOO•, and CH3COO•) also play a role in the removal of contaminants of emerging concerns (CECs). Overall, the current study provided new insights into the photochemical transformation of PAA in CDOM-enriched solutions. The solar irradiation of wastewater with PAA enhancement could be a useful and economically beneficial advanced oxidation process for CEC abatement."
10.1021/acs.est.5c02960,False,Environmental Science & Technology,该论文主要关注的是全氟烷基物质（PFAS）的去除技术，特别是通过设计具有选择性吸附位点的氟化水凝胶来高效去除水体中的PFAS。论文重点在于材料的吸附性能、选择性以及再生能力，旨在解决水体污染问题。虽然PFAS可能通过大气沉降进入水体，但该研究的核心内容与大气环境遥感技术（如空气质量监测、卫星观测和大气成分分析）没有直接关联。因此，该论文不属于大气环境遥感技术领域。,[],Jinjing Huang;Kaixing Fu;Hengzhi Liu;Jing Zhang;Jinming Luo,Unveiling the Differential Intensity of Fluorous Active Sites Toward Selective Polyfluoroalkyl Substance Removal: Insights into Adsorption and Desorption Trade-Offs,"The design of selective sorption sites for per- and polyfluoroalkyl substance (PFAS) removal, integrated with efficient regenerative strategies, remains a critical yet underexplored challenge. While existing technologies prioritize adsorption capacity over regenerative sustainability, we engineered a fluorinated hydrogel with tailored fluorous binding sites to target PFAS via their hydrophobic C–F termini. This design achieved over 90% PFAS removal efficiency in real water matrices (e.g., tap and lake water), at environmentally relevant concentrations (1 μg L–1), with robust resistance to competing background ions and natural organic matter. Selectivity correlated strongly with PFAS chain length (F9 > F12 > F6), driven by stable adsorption configurations (C–F···F–C vs C–H···F–C) and a favorable adsorption energy of −29.06 kcal mol–1. Leveraging controlled noncovalent F···F interactions, the hydrogel enabled efficient desorption (60–80% efficiency using 1% NaCl, 1% NH4Cl, or 0.5% NH4OH–NH4Cl) without structural degradation. Full regeneration (>92% recovery) was achieved with 50% methanol, supporting five reuse cycles with minimal performance decline. In continuous operation, using 1% NaCl achieved a 10-fold PFAS enrichment, while 50% methanol enabled a significantly higher 51-fold enrichment. Both approaches reduced eluent consumption by 20–50% compared to conventional activated carbon and resins. Overall, balancing PFAS adsorption and desorption trade-offs significantly reduces environmental footprint and operational costs, providing a sustainable strategy for PFAS remediation."
10.1021/acs.estlett.5c00346,False,Environmental Science & Technology Letters,该研究论文主要关注使用硅胶腕带作为个人被动采样工具，评估多氯联苯（PCBs）通过皮肤吸收的暴露量。它探讨了如何将腕带中SVOCs的浓度转化为估计的剂量，并将其与通过空气和手部擦拭计算的皮肤吸收估计值进行比较。虽然该研究涉及环境暴露评估，但它侧重于皮肤吸收途径，而不是大气环境遥感技术，如空气质量监测、卫星观测或大气成分分析。,[],Stephanie C. Hammel;Helle Vibeke Andersen;Lisbeth E. Knudsen;Marie Frederiksen,Translating Silicone Wristbands to a Personal Exposure Estimate for Dermal Absorption: A Case Study with PCBs,"Dermal absorption is an exposure pathway frequently underestimated due to challenges in quantifying how exogenous chemicals pass through skin. Silicone wristbands have been used as effective personal passive sampling tools for semivolatile organic compounds (SVOCs) and serve as integrated measures of inhalation and dermal exposures. However, to-date, translating SVOC concentrations in wristbands to estimated doses has been a gap for their application in exposure assessment. Here, we utilized wristbands as proxy measures for skin-surface lipids to calculate estimated daily intakes (EDIs) from the dermal absorption pathway. EDIs were compared to dermal uptake estimates previously calculated from indoor air measurements and hand wipes, which were collected from residents of both polychlorinated biphenyl (PCB)-contaminated and noncontaminated buildings. Wristband-based estimates showed strong agreement with those from air and hand wipes (rs > 0.8, p < 0.0001), particularly for lower chlorinated PCBs, with dermal uptake accounting for a third of exposed residents’ PCB exposure (∑7PCB = 29.2 ng/kg bodyweight/day). All three dermal estimates were significantly associated with serum measurements among the lower chlorinated congeners. Our results demonstrate wristbands’ potential for quantifying personal external exposure, building on their utility for ranking internal dose. This study further presents a method for using wristbands to calculate dermal absorption for personalized exposure assessment."
10.1021/acsestair.5c00043,True,ACS ES&T Air,该研究论文直接观察了从东北亚三个城市（首尔、北京、能登）收集的PM2.5颗粒的液-液相分离和核-壳形态，并探讨了其对N2O5水解的影响。研究发现，实际PM2.5样品在不同相对湿度下会发生相变，主要以两相或三相状态存在，并且经常观察到有机壳和无机核组成的核-壳结构。研究还计算了有机壳的粘度，并发现粘度越高，N2O5的扩散率越低，从而显著降低N2O5的吸收系数。这些结果表明气溶胶形态在非均相化学中起着关键作用，有机外相可以显著改变反应吸收系数和气-固相互作用。虽然论文没有直接提及遥感技术，但其研究的气溶胶成分、形态和化学反应对于理解大气成分和空气质量至关重要，这些参数可以通过遥感技术进行监测和分析。因此，该研究与大气环境遥感技术具有很强的相关性。,"['PM2.5', 'aerosol morphology', 'liquid-liquid phase separation', 'heterogeneous chemistry', 'N2O5 hydrolysis', 'air quality', 'atmospheric composition']",Mijung Song;Ying Li;Changjoon Seong;Hang Yang;Kyoung-Soon Jang;Zhijun Wu;Ji Yi Lee;Atsushi Matsuki;Joonyoung Ahn,Direct Observation of Liquid–Liquid Phase Separation and Core–Shell Morphology of PM2.5 Collected from Three Northeast Asian Cities and Implications for N2O5 Hydrolysis,"The morphologies of aerosol particles significantly influence atmospheric processes, including heterogeneous chemistry. This study presents direct observations of liquid–liquid phase separation and the morphologies of PM2.5 filter extracts collected from Seoul, Beijing, and Noto during autumn 2023. The PM2.5 samples covered both polluted and clean environments and were predominantly organic-rich. Optical microscopy revealed that real-world samples from these cities underwent phase transitions with changing relative humidity and primarily existed in either two-liquid or three-phase states, while fully homogeneous or nonliquid states were rare. Moreover, a core–shell morphology, consisting of an organic shell and inorganic core, was frequently observed in the PM2.5 samples. Calculations confirmed that the viscosity of the organic shell ranges from ∼101 Pa s in Seoul (liquid-like) to ∼106 Pa s in Beijing (semisolid). As the shell becomes more viscous, the diffusivity of N2O5 decreases, thereby lowering the N2O5 uptake coefficient by 1–3 orders of magnitude and significantly restricting N2O5 uptake. These results highlight the crucial role of aerosol morphology in heterogeneous chemistry, as the organic-rich outer phase can significantly modify the reactive uptake coefficients and gas–particle interactions."
