doi,is_relevant,journal,explanation,topic_words,authors,title,abstract
10.1038/s41467-025-59645-x,False,Nature Communications,该研究论文主要关注碳酸酐酶II（CAII）的催化机制，通过紫外光解技术和温度控制的X射线晶体学，在原子水平上追踪酶的催化过程，包括底物结合、产物转化和产物释放。研究重点在于酶活性位点水的结构和动力学如何影响催化效率。虽然酶在生物地球化学循环中可能发挥作用，但该研究与大气环境遥感技术（如空气质量监测、卫星观测和大气成分分析）没有直接关联。,[],Jin Kyun Kim;Seon Woo Lim;Hannah Jeong;Cheol Lee;Seoyoon Kim;Dong Woo Son;Rajeev Kumar;Jacob T. Andring;Carrie Lomelino;Jennifer L. Wierman;Aina E. Cohen;Tae Joo Shin;Cheol-Min Ghim;Robert McKenna;Byung Hoon Jo;Duyoung Min;Jeong-Mo Choi;Chae Un Kim,Fast product release requires active-site water dynamics in carbonic anhydrase,"Water plays an essential role in enzyme catalysis, but direct observations linking enzyme catalysis and active-site water pose a significant challenge due to experimental difficulties. Here, the authors employ an ultraviolet photolysis technique with temperature-controlled X-ray crystallography to track the catalytic pathway of carbonic anhydrase II at 1.2 Å resolution. 
 Water plays an essential role in enzyme structure, stability, and the substantial rate enhancement of enzyme catalysis. However, direct observations linking enzyme catalysis and active-site water dynamics pose a significant challenge due to experimental difficulties. By integrating an ultraviolet (UV) photolysis technique with temperature-controlled X-ray crystallography, we track the catalytic pathway of carbonic anhydrase II (CAII) at 1.2 Å resolution. This approach enables us to construct molecular movies of CAII catalysis, encompassing substrate (CO2) binding, conversion from substrate to product (bicarbonate), and product release. In the catalytic pathway, we identify an unexpected configuration in product binding and correlate it with sub-nanosecond rearrangement of active-site water. Based on these experimental observations, we propose a comprehensive mechanism of CAII and describe the detailed structure and dynamics of active-site water in CAII. Our findings suggest that CAII has evolved to utilize the structure and fast dynamics of the active-site waters for its diffusion-limited catalytic efficiency. Water plays an essential role in enzyme catalysis, but direct observations linking enzyme catalysis and active-site water pose a significant challenge due to experimental difficulties. Here, the authors employ an ultraviolet photolysis technique with temperature-controlled X-ray crystallography to track the catalytic pathway of carbonic anhydrase II at 1.2 Å resolution."
10.1038/s41467-025-58973-2,False,Nature Communications,该研究论文主要关注南极洲 Larsen C 冰架的内部结构，特别是冰架在接地带的形成过程。研究使用了钻孔光学电视记录来识别一种中间冰单元，该单元在大陆冰和原位冰之间形成，并分析了其形成机制与雷达分层一致性丧失的关系。该研究与大气环境遥感技术（如空气质量监测、卫星观测和大气成分分析）没有直接关系，主要集中在冰川学和冰架结构方面。,[],K. E. Miles;B. Hubbard;A. Luckman;B. Kulessa;S. Bevan;S. Thompson;G. Jones,Influence of the grounding zone on the internal structure of ice shelves,"Borehole optical televiewer logs from across Larsen C Ice Shelf, Antarctic Peninsula, reveal an ice unit formed during transport over the grounding zone, the upper depth of which coincides with a loss in lateral consistency of radar layering. 
 Antarctic ice shelves typically comprise continental meteoric ice, in situ-accumulated meteoric ice, and marine ice accumulated at the shelf base. Using borehole optical televiewer logs from across Larsen C Ice Shelf, Antarctic Peninsula, we identify and report an intermediate ice unit, located between continental and in situ meteoric ice, that is tens of metres thick and formed of layers that progressively increase in dip (by ~60°) with depth. The unit’s stratigraphic position and depth, supported by flowline modelling, indicate formation at the grounding zone. We hypothesise that the unit forms due to changes in the surface slope of feeder glaciers at the grounding zone, resulting in both variable surface accumulation and intense deformation. The top of the unit also marks the depth at which lateral consistency in radar layering is lost from radargrams, which may, to some degree, mark the depth of grounding zone ice across all ice shelves. Borehole optical televiewer logs from across Larsen C Ice Shelf, Antarctic Peninsula, reveal an ice unit formed during transport over the grounding zone, the upper depth of which coincides with a loss in lateral consistency of radar layering."
10.1038/s41467-025-59247-7,False,Nature Communications,该论文主要探讨了贝尔不等式的物理意义，特别是当违反贝尔不等式时，对局域隐变量理论的假设会产生什么影响。论文讨论了如果局域隐变量理论的某个假设失效，那么它必须完全失效，从而排除了一些部分成立的理论模型，如部分瞬时超距作用、部分约束选择自由或部分逆因果影响。这与大气环境遥感技术（如空气质量监测、卫星观测和大气成分分析）没有直接关系。,[],Carlos Vieira;Ravishankar Ramanathan;Adán Cabello,Test of the physical significance of Bell non-locality,"Loophole-free violations of Bell inequalities imply that at least one of the assumptions formalising local hidden-variable theories must fail. Here, the authors show that, if only one is false, then it has to fail completely, therefore excluding models that allow partial instantaneous actions at a distance, partially constrain freedom of choice or allow for partial retrocausal influences. 
 Loophole-free violations of Bell inequalities imply that at least one of the assumptions behind local hidden-variable theories must fail. Here, we show that, if only one fails, then it has to fail completely, therefore excluding models that partially constrain freedom of choice or allow for partial retrocausal influences, or allow partial instantaneous actions at a distance. Specifically, we show that (i) any hidden-variable theory with outcome independence (OI) and arbitrary joint relaxation of measurement independence (MI) and parameter independence (PI) can be experimentally excluded in a Bell-like experiment with many settings on high-dimensional entangled states, and (ii) any hidden-variable theory with MI, PI and arbitrary relaxation of OI can be excluded in a Bell-like experiment with many settings on qubit-qubit entangled states. Loophole-free violations of Bell inequalities imply that at least one of the assumptions formalising local hidden-variable theories must fail. Here, the authors show that, if only one is false, then it has to fail completely, therefore excluding models that allow partial instantaneous actions at a distance, partially constrain freedom of choice or allow for partial retrocausal influences."
10.1038/s41558-025-02334-w,False,Nature Climate Change,该研究论文主要关注气候变化适应政策的规划和实施之间的差距，以及如何通过提高适应计划的内部一致性来缩小这一差距。它侧重于政策层面，而非大气环境遥感技术，如空气质量监测、卫星观测或大气成分分析。因此，该论文与大气环境遥感技术没有直接关联。,[],Diana Reckien;Attila Buzasi;Marta Olazabal;Paris Fokaides;Filomena Pietrapertosa;Peter Eckersley;Monica Salvia,Explaining the adaptation gap through consistency in adaptation planning,"The gap between adaptation policy planning and actual implementation could delay effective actions. Researchers demonstrate why internal consistency checks should be the starting point to reduce the gap by applying them for city-level adaptation plans across Europe. 
 An adaptation gap exists when adaptation efforts fail to meet adaptation needs. While conceptualizing and operationalizing this gap is challenging, we argue that it should begin with aligning climate risks with policy goals, measures and monitoring and evaluation—what we refer to as ‘consistency’ within adaptation policy. Through a comprehensive European study, we demonstrate how assessing consistency in adaptation plans can enhance understanding and help reduce the adaptation gap. The gap between adaptation policy planning and actual implementation could delay effective actions. Researchers demonstrate why internal consistency checks should be the starting point to reduce the gap by applying them for city-level adaptation plans across Europe."
10.1038/s41558-025-02327-9,False,Nature Climate Change,该研究论文主要关注全球变暖对森林生态系统的影响，特别是亚马逊森林的损失和高纬度地区的木本植物入侵。论文探讨了三种不同的升温情景（最小超调、短暂超调和持续超调）下森林生态系统面临的不可逆转的风险，并强调了将全球温度控制在1.5°C以下以减轻这些风险的重要性。虽然该研究与气候变化有关，但它主要侧重于陆地生态系统，而非大气环境遥感技术，如空气质量监测、卫星观测或大气成分分析。,[],Gregory Munday;Chris D. Jones;Norman J. Steinert;Camilla Mathison;Eleanor J. Burke;Chris Smith;Chris Huntingford;Rebecca M. Varney;Andy J. Wiltshire,Risks of unavoidable impacts on forests at 1.5 °C with and without overshoot,"The authors assess the risk of overshoot beyond 1.5 °C warming, using three scenarios with minimal overshoot, brief overshoot and sustained overshoot. They show a risk of long-term Amazon dieback, which begins as early as 1.3 °C warming but is largely mitigated by reducing temperature below 1.5 °C. 
 With global warming heading for 1.5 °C, understanding the risks of exceeding this threshold is increasingly urgent. Impacts on human and natural systems are expected to increase with further warming and some may be irreversible. Yet impacts under policy-relevant stabilization or overshoot pathways have not been well quantified. Here we report the risks of irreversible impacts on forest ecosystems, such as Amazon forest loss and high-latitude woody encroachment, under three scenarios that explore low levels of exceedance and overshoot beyond 1.5 °C. Long-term forest loss is mitigated by reducing global temperatures below 1.5 °C. The proximity of dieback risk thresholds to the bounds of the Paris Agreement global warming levels underscores the need for urgent action to mitigate climate change—and the risks of irreversible loss of an important ecosystem. The authors assess the risk of overshoot beyond 1.5 °C warming, using three scenarios with minimal overshoot, brief overshoot and sustained overshoot. They show a risk of long-term Amazon dieback, which begins as early as 1.3 °C warming but is largely mitigated by reducing temperature below 1.5 °C."
10.1038/s41893-025-01567-z,False,Nature Sustainability,这篇研究论文主要关注从海水中提取铀的电化学方法，旨在提高提取效率并降低能耗。虽然该技术与能源供应和可持续资源利用相关，但它与大气环境遥感技术，如空气质量监测、卫星观测或大气成分分析，没有直接联系。该研究的重点是材料科学、电化学和资源提取，而不是大气科学或遥感领域。,[],Yanjing Wang;Guobin Wen;Zhijuan Liu;Ta Thi Thuy Nga;Chung-Li Dong;Jie You;Chao Xie;Shiqian Du;Fei Zhang;Qie Liu;Jianrong Wei;Yu Cao;Xinda Peng;Yahong Yuan;Yanyong Wang;Shuangyin Wang,Bipolar electrochemical uranium extraction from seawater with ultra-low cell voltage,"Seawater is the most abundant source of uranium. This work shows a bipolar electrochemical mining process from seawater at ultra-low voltages, ensuring maximized extraction efficiency and minimized energy consumption. 
 Efficient uranium extraction from seawater has the potential to secure an abundant and reliable supply of nuclear fuel, providing affordable energy with minimized carbon emissions. Among the many extraction methods, the electrochemical route has emerged as a promising choice owing to its fast kinetics and materials regeneration. The major challenges facing this technology, however, lie in its high energy consumption, low extraction efficiency and poor selectivity. Here we show a bipolar electrochemical uranium extraction (EUE) system that combines cathodic direct electroreduction of uranium species and electrochemistry-assisted indirect uranium reduction at the anode. The EUE device operates at an ultra-low voltage of merely 0.6 V, exhibiting an efficiency of ~100% for sources with a wide range of uranium concentrations (1–100 ppm). This bipolar EUE system in natural seawater displays excellent uranium selectivity (above 85.3%), long-term stability (45 cycles), low energy consumption (1,944 kWh kg−1 U) and cost advantage (US$83.2 kg−1 U). This work opens an avenue to the electrochemical system design for sustainable recycling of different waste resources. Seawater is the most abundant source of uranium. This work shows a bipolar electrochemical mining process from seawater at ultra-low voltages, ensuring maximized extraction efficiency and minimized energy consumption."
10.1038/s41893-025-01563-3,False,Nature Sustainability,该研究论文主要关注从原油中选择性且可持续地分离碳氢化合物，重点在于使用分子筛技术（特别是cucurbit[7]uril）直接从原油中提取环己烷。虽然碳氢化合物与大气成分有关，但该研究的重点是分离技术和能源效率，而不是大气环境遥感技术。因此，它与空气质量监测、卫星观测或大气成分分析等领域没有直接关联。,[],Gengwu Zhang;Ikjin Kim;Lukman O. Alimi;Deepak Ramdas Boraste;Rahul Dev Mukhopadhyay;Weibin Lin;Aiping Chen;Vasilios G. Samaras;Abdul-Hamid Emwas;Basem A. Moosa;Kimoon Kim;Niveen M. Khashab,Selective and sustainable separation of hydrocarbons from crude oil via molecular sieve,"Crude oil is a mixture of different hydrocarbons, and their separation remains challenging. Here this work shows a molecular sieve that allows for direct, selective and sustainable isolation of valuable components. 
 The sustainable separation of hydrocarbons from crude oil is critical for reducing energy consumption and carbon emissions in the chemical industry. Current methods are energy intensive and do not allow for isolation of specific hydrocarbons due to overlapping physicochemical properties and molecular complexities in crude oil. Here we introduce an energy-efficient molecular sieving strategy using cucurbit[7]uril (CB[7]) aqueous solution to directly extract cyclohexane (CH) from crude oil. CB[7] enables efficient CH separation under ambient and harsh conditions through shape- and size-selective binding with an ultrahigh affinity (2.5 × 109 M−1). Industrial validation shows >99% CH purity from azeotropic benzene mixtures and crude distillates and achieves 57.4–82.4% energy savings compared with current industrial methods. By demonstrating the scalability and robustness of CB[7]-based separations, this work highlights the potential of molecular sieves for sustainable, cost-effective hydrocarbon recovery from crude oil, paving the way for large-scale, sustainable hydrocarbon purification. Crude oil is a mixture of different hydrocarbons, and their separation remains challenging. Here this work shows a molecular sieve that allows for direct, selective and sustainable isolation of valuable components."
10.1038/s41612-025-01069-x,False,npj Climate and Atmospheric Science,该论文主要研究南极洲布兰斯菲尔德海流锋面附近的海洋次中尺度过程，重点在于利用地震成像技术探测由垂直温度变化引起的高反射区域，并推断湍流过程。研究结果表明，这些区域可能指示分层湍流，包括内波破碎、界面交错和翻转等现象。虽然该研究涉及环境科学，但其重点是海洋湍流和混合，与大气环境遥感技术（如空气质量监测、卫星观测和大气成分分析）没有直接关系。,[],Qunshu Tang;Jianmin Lin;Wen Xu;Zhiyou Jing;Vincent C. H. Tong,Intensifying stratified turbulence and mixing towards the oceanic submesoscale front,"Intensifying stratified turbulence and mixing towards the oceanic submesoscale front 
 The role of submesoscale processes as the primary energy source for ocean turbulence remains controversial due to observational limitations. Seismic imaging captures multi-scale processes from mesoscale to finescale, allowing us to infer turbulence processes. This study identified hundreds of ~200-m-long high seismic reflection patches, primarily caused by vertical temperature changes, moving at 0.24 ± 0.13 m/s across the deep-reaching front of Bransfield Current, Antarctica. Patch distribution within the main current is uneven, increasing exponentially towards the frontal leading edge. Over 95% of the detected patches are concentrated within 10 km from the frontal leading edge, where elevated Thorpe-scale diffusivity exceeding 10−2 m2/s has been observed hydrographically. These patches may indicate stratified turbulence, including broken internal wave segments, interleaving interfaces, and overturns, which may correspond to wave breaking, frontal instability, and shear instability, respectively. Our findings challenge the recently questioned classical hypothesis that energy cascades directly from internal waves to isotropic turbulence, instead supporting the paradigm of a stratified turbulence stage."
10.1038/s43247-025-02342-w,False,Communications Earth & Environment,该论文主要关注饮食习惯和社会人口因素对英国家庭饮食温室气体排放的影响，与大气环境遥感技术（如空气质量监测、卫星观测和大气成分分析）没有直接关系。论文分析了不同饮食模式（如素食、肉食）以及社会人口变量（如收入、教育程度）如何影响家庭的温室气体排放量，旨在探讨如何通过改变饮食习惯来减少碳足迹。虽然温室气体排放与大气环境有关，但该研究的重点在于饮食行为的社会经济驱动因素，而非大气环境的遥感监测或分析技术。,[],Tony W. Carr;Arli Guadalupe Zárate-Ortiz;Anouk Reuzé;Grace O’Donovan;Hassan Mahfouz;Sarah Nájera Espinosa;Rosemary Green;Pauline F. D. Scheelbeek,Author Correction: Eating habits and sociodemographic factors impact household dietary greenhouse gas emissions reduction in Great Britain,"Author Correction: Eating habits and sociodemographic factors impact household dietary greenhouse gas emissions reduction in Great Britain 
 "
10.1038/s43247-025-02194-4,False,Communications Earth & Environment,这篇论文主要研究了在热液条件下碳酸盐矿物中的铀的氧化还原状态，以及它对铀铅年代学的影响。研究结合了X射线吸收光谱技术和原位铀铅碳酸盐年代学，旨在追踪斑岩-浅成热液系统中铀的分布和氧化还原状态随时间的变化。该研究与大气环境遥感技术（如空气质量监测、卫星观测和大气成分分析）没有直接关系，主要关注地质过程和矿床成矿作用。,[],Sarah Bowie;Catherine Mottram;E. Troy Rasbury;Paul Northrup;Ryan Tappero;Dawn Kellett,U redox state tracked in mineralized hydrothermal carbonate with implications for U-Pb geochronology,"In situ U-Pb carbonate geochronology is robust under hydrothermal conditions and, combined with X-ray absorption spectroscopy techniques, can track the temporal evolution of redox changes and boiling processes critical to metal deposition in multistage hydrothermal-magmatic ore deposits. 
 U-Pb carbonate geochronology can directly constrain the timing and rates of important geological processes. However, the mechanisms and controls on U incorporation, distribution, and retention in carbonate minerals remain unclear, limiting geological interpretations. Here X-ray absorption spectroscopy (µXAS) and in-situ U-Pb carbonate geochronology are combined to temporally track U distribution and redox state in a porphyry-epithermal system. In this setting, multiple generations of carbonate minerals record fluid conditions and processes which control the solubility and deposition of metals, including U. This novel approach provides the first evidence of both oxidized UO22+ and reduced U4+ species in temporally distinct generations of carbonate within a single sample. Preservation of two different U oxidation states during discrete precipitation events requires U retentivity within older domains, demonstrating that the U-Pb carbonate geochronometer is robust under hydrothermal conditions. Furthermore, crystal zones with abundant fluid/vapour inclusions linked to boiling processes coincide with relatively high levels of U and favourable U/Pb. Targeting carbonate domains with these textures may therefore increase success in U-Pb geochronology. U-Pb carbonate dating combined with µXAS can track the temporal evolution of processes critical for metal deposition in long-lived and multistage hydrothermal-magmatic ore deposit settings. 
                
                  
                
               In situ U-Pb carbonate geochronology is robust under hydrothermal conditions and, combined with X-ray absorption spectroscopy techniques, can track the temporal evolution of redox changes and boiling processes critical to metal deposition in multistage hydrothermal-magmatic ore deposits."
None,False,Remote Sensing of Environment,由于只提供了标题“Editorial Board”和摘要“Abstract:”，没有关于研究内容的信息，无法判断其与大气环境遥感技术（如空气质量监测、卫星观测和大气成分分析）的相关性。因此，无法提取主题词，也无法提供关于论文本身的中文解释。,[],,Editorial Board,
