doi,is_relevant,journal,explanation,topic_words,authors,title,abstract
10.1038/s41467-026-73769-8,False,Nature Communications,该论文研究的是野生稻物种 *Oryza australiensis* 的基因组组装和进化关系，涉及的是遗传学和植物学领域，与大气环境遥感技术（如空气质量监测、卫星观测、大气成分分析、气溶胶反演等）没有直接关系。,"['genome assembly', 'transposon', 'telomere']",Yu Bao;Hanli You;Shuo Liu;Guanqing Liu;Yuechao Wu;Qingqing Yang;Qi You;Peng Liu;Chuandeng Yi;Wenli Zhang;Zhukuan Cheng;Tao Zhang,Telomere-to-telomere genome assembly of <i>Oryza australiensis</i> reveals transposon-driven centromere repositioning and shared EE–DD ancestry,"Oryza australiensis (EE genome) is a wild rice species with extreme environmental adaptability and grain properties. Here, the authors report its telomere-to-telomere genome assembly and clarify that the ancestral lineage that contributed the DD subgenome shared common ancestry with an EE-like progenitor. 
 Oryza australiensis (EE genome), the sole representative of the EE genome in the genus, holds significant value for deciphering polyploid evolution and mining stress-resistance genes owing to its extreme environmental adaptability. Here, we report a telomere-to-telomere (T2T) genome assembly of O. australiensis, yielding a 901 Mb genome with 12 complete chromosomes. This enables comprehensive annotation of centromeres, telomeres, and 36,742 genes, revealing non-canonical telomeric repeats and three distinct centromere repositioning mechanisms: inversion-driven shifts, duplication-mediated neocentromerization, and transposon burst-induced neocentromere formation. Crucially, transposon dynamics analysis reveals synchronized amplification of Angela LTR retrotransposons in the EE genome and the DD subgenome of allotetraploid O. alta (CCDD) prior to CCDD formation. Phylogenetic and synteny analyses of Angela LTR integrase domains, alongside a 275-bp repeat marker exclusive to EE and DD, indicate that the ancestral lineage that contributed the DD subgenome share common ancestry with an EE-like progenitor. These findings refine Oryza evolutionary history and highlight transposon dynamics in reconstructing deep evolutionary relationships. Oryza australiensis (EE genome) is a wild rice species with extreme environmental adaptability and grain properties. Here, the authors report its telomere-to-telomere genome assembly and clarify that the ancestral lineage that contributed the DD subgenome shared common ancestry with an EE-like progenitor."
10.1038/s41467-026-73795-6,False,Nature Communications,该论文主要研究糖酵解途径中酶的动态组装，涉及分子通道和蛋白质相互作用，与大气环境遥感技术（如空气质量监测、卫星观测、大气成分分析、气溶胶反演）没有直接关联。,"['glycolytic enzymes', 'protein flocks', 'quinary interactions']",Blanca Poquet;Galal Yahya;Laia Ferrer;Enrique Marcos;Carme Gallego;Martí Aldea,Highly dynamic assemblies of glycolytic enzymes by quinary determinants,"Molecular channelling in glycolysis is debated. Here, authors show short-lived enzyme assemblies, named protein flocks, in yeast and human cells. Shared surface properties suggest quinary interactions boost efficiency and limit toxic intermediates. 
 Molecular channelling has long since been proposed as an amenable solution to efficiently drive sequential enzymatic reactions in the cell. Nonetheless, metabolic channelling in central pathways such as glycolysis is still a matter of debate and plausible underlying mechanisms are not known. Here we use correlation spectroscopy and proximity labelling methods to uncover extremely dynamic interactions among enzymes of the glycolysis pathway in yeast and human cells. The resulting transient protein assemblies, tentatively named as protein flocks, form in the cytoplasm with a lifetime shorter than 10 ms. Compared to other metabolic pathways, glycolytic enzymes display a greater similarity in the electrochemical properties of surface atoms, pointing to quinary structural features as molecular determinants of protein flocks. We observe a remarkable negative correlation between the spatiotemporal coincidence by correlation spectroscopy and the Euclidean distance in surface atom configuration within multiple protein pairs, including a collection of surface variants generated from a de novo designed protein framework. By underlying protein flock formation from yeast to human, quinary determinants would provide enzymes with higher efficiency and specificity in glycolysis but, perhaps more important to human cells, would limit intermediate concentrations and prevent their inherent toxic effects. Molecular channelling in glycolysis is debated. Here, authors show short-lived enzyme assemblies, named protein flocks, in yeast and human cells. Shared surface properties suggest quinary interactions boost efficiency and limit toxic intermediates."
10.1038/s41467-026-73670-4,False,Nature Communications,该论文主要研究的是水系红ox流电池中的催化问题，虽然涉及到电池性能和效率的提升，但与大气环境遥感技术（如空气质量监测、卫星观测、大气成分分析、气溶胶反演等）没有直接关联。,"['aqueous redox flow batteries', 'relay catalysis', 'sulfur-based flow cells']",Jiafeng Lei;Yaqin Zhang;Weixing Wu;Ying Wang;Jun Fan;Yi-Chun Lu,Bio-inspired relay catalysis for aqueous redox flow batteries,"Aqueous redox flow batteries are promising for large-scale energy storage, but many suffer from sluggish kinetics. Here, authors report a relay catalysis strategy to break the trade-off between overpotential and catalytic rate in sulfur- and organic-based flow cells. 
 Aqueous redox flow batteries are promising for long-duration energy storage. However, many of them (e.g. sulfur-based and organic-based flow batteries) suffer from sluggish kinetics with low energy efficiency and insufficient capacity utilization. Here, we propose relay catalysis as a universal strategy to achieve high reaction rates while minimizing overpotential, enabling high capacity and energy efficiency. Inspired by sequential electron transfer in cellular respiration, relay catalysis employs a low-overpotential catalyst (e.g., isoalloxazine) to initiate the reaction, seamlessly transferring control to a high-activity catalyst (e.g., quinone) to sustain charge propagation, breaking the trade-off between overpotential and catalytic rate. Using this strategy, we demonstrate polysulfide-ferrocyanide flow batteries with near full polysulfide utilization (S42–/S22–, 64 Ah L–1negolyte) and high stability over 3 months (> 500 cycles at 20 mA cm–2, decay rate 0.00071% per cycle, 0.003% per day). We further extend this strategy to organosulfide- and azo-based batteries with various relay-catalyst couples. By mimicking biological electron relays, this approach not only redefines homogeneous catalysis for energy storage but also establishes a transformative platform for designing flow batteries with enhanced performance and scalability. Aqueous redox flow batteries are promising for large-scale energy storage, but many suffer from sluggish kinetics. Here, authors report a relay catalysis strategy to break the trade-off between overpotential and catalytic rate in sulfur- and organic-based flow cells."
10.1038/s41467-026-72852-4,False,Nature Communications,该论文研究的是肺炎球菌如何通过COMMD2蛋白改变宿主细胞免疫，与大气环境遥感技术（如空气质量监测、卫星观测、大气成分分析、气溶胶反演）无关。,"['air quality monitoring', 'satellite observations', 'atmospheric composition analysis', 'aerosol retrieval']",Michael G. Connor;Lisa Sanchez;Christine Chevalier;Tiphaine M. N. Camarasa;Filipe Carvalho;Matthew J. G. Eldridge;Thibault Chaze;Mariette Matondo;Esma Karkeni;Sara Dufour;Francis Impens;Sebastian Baumgarten;Jost Enninga;Melanie A. Hamon,Pneumococcus uses COMMD2 to alter host cellular immunity,"In this comparative analysis of pneumococcal isolates, authors reveal divergent NF-κB signaling and COMMD2-mediated suppression of cellular immunity programs in airway epithelial cells. 
 NF-κB driven cellular immunity is essential for both pro- and anti-inflammatory responses to microbes, which makes it one of the most frequently targeted pathways by bacteria during pathogenesis. How NF-κB tunes the epithelial response to Streptococcus pneumoniae across the spectrum of commensal to pathogenic outcomes is not fully understood. In this study, we compare a commensal-like 6B ST90 strain to an invasive TIGR4 strain and demonstrate, through comparative mass spectrometry of the p65 interactome, that TIGR4 challenge triggers interaction of COMMD2 with p65 and p62. Mechanistically, we show this complex mediates export of p65 for degradation and COMMD2 is necessary for altering host cellular immunity. With these results, we reveal a bacterial pathogenesis mechanism to repress host inflammatory response though COMMD2 and p65 degradation while presenting a paradigm for diverging NF-κB responses to pneumococcus. In this comparative analysis of pneumococcal isolates, authors reveal divergent NF-κB signaling and COMMD2-mediated suppression of cellular immunity programs in airway epithelial cells."
10.1038/s41467-026-73284-w,True,Nature Communications,该论文研究了小行星（469219）Kamoʻoalewa的起源和表面特性，涉及光谱分析（反射光谱）、空间风化实验和动力学起源追踪，这些方法与大气环境遥感技术（如光谱监测、成分分析）密切相关，因此与该主题高度相关。,"['asteroid', 'space weathering', 'reflectance spectrum', 'atmospheric composition', 'remote sensing']",Pengfei Zhang;Guozheng Zhang;Zichen Wei;Mikael Granvik;Xiaoran Yan;Pengyue Wang;Qinwei Zhang;Ronghua Pang;Wen-Han Zhou;Te Jiang;Pierre Vernazza;Takahiro Hiroi;Edward Cloutis;Francesca DeMeo;Pierre Beck;Wing-Huen Ip;Marco Fenucci;Yongxiong Zhang;Michael Marsset;Yunbo Niu;Xuejin Lu;Xing Wu;Honglei Lin;Shoucun Hu;Bin Cheng;Haibin Zhao;Xiaobin Wang;Xiaoping Lu;Yonglong Zhang;Zongcheng Ling;Jiang Zhang;Sizhe Zhao;Cateline Lantz;Jooyeon Geem;Zhiping He;Juntao Wang;Liyong Zhou;Xiliang Zhang;Shijei Li;Sen Hu;Wei Yang;Xiongyao Li;Xiaoping Zhang;Jiahui Liu;Peng Zhang;Guang Zhang;Yangting Lin;Yang Li,Tianwen-2 mission target asteroid (469219) Kamoʻoalewa probably develops an Itokawa-compositional but more space-weathered surface,"The origin of asteroid (469219) Kamo‘oalewa, target of China’s Tianwen-2 mission, is debated. Here, the authors show that it probably originated from the Flora family and it resembles asteroid (25143) Itokawa-like composition but with a more space-weathered surface. 
 China’s ongoing Tianwen-2 mission will return samples from a small, rapidly spinning Earth quasi-satellite (469219) Kamoʻoalewa. Previous studies linked Kamoʻoalewa to lunar composition and origin. Here, we propose another scenario. We reanalyze the reflectance spectrum of Kamoʻoalewa and obtain an absorption band center at 1.001 ± 0.028 μm (error is 1σ), consistent with LL chondrites. We then conduct space weathering experiments on meteorites and find that highly space-weathered LL chondrite powder (but not slab) successfully reproduces the reflectance spectrum of Kamoʻoalewa. We further trace the dynamical origin of Kamoʻoalewa and find that it probably originated from the ν6 secular resonance, and more specifically, the Flora family. Kamoʻoalewa exhibits a similar composition to Itokawa and 7 objects in the Flora family, but with a higher degree of space weathering. We, therefore, propose that Kamoʻoalewa probably originated from the Flora family and developed an Itokawa-compositional, more space-weathered, fine-regolith-dominated surface. The origin of asteroid (469219) Kamo‘oalewa, target of China’s Tianwen-2 mission, is debated. Here, the authors show that it probably originated from the Flora family and it resembles asteroid (25143) Itokawa-like composition but with a more space-weathered surface."
10.1038/s41467-026-73718-5,False,Nature Communications,该论文主要研究昆虫的嗅觉和味觉受体的进化起源，虽然涉及化学感受器，但与大气环境遥感技术（如空气质量监测、卫星观测、大气成分分析、气溶胶反演）没有直接关系。,"['chemoreceptors', 'insect', 'evolution']",Robert F. Mitchell;Kevin M. Moran;Duane D. McKenna,Early hexapod genomes reveal the deep origin of insect gustatory and odorant receptors,"Insect smell and taste are governed by vast arrays of chemoreceptors, but the evolutionary origins of these genes have remained murky. This study resolves their origin through a phylogeny that incorporates numerous previously undescribed chemoreceptor lineages in insects and their near relatives. 
 Insect smell and taste is primarily mediated through a chemoreceptor superfamily that includes three lineages of gustatory receptors—sugar, carbon dioxide, and bitter—and a distinct lineage of odorant receptors. Although sugar gustatory receptors can be traced back to ancestral crustaceans, the evolutionary origins of the remaining lineages have been unclear. Here, we resolve this history through homology-driven searches and phylogenetic analyses across insect and non-insect hexapod genomes. We uncover several previously unrecognized gustatory receptor clades, including a fifth insect chemoreceptor lineage that we term relict gustatory receptors, which expanded in the non-insect hexapod order Diplura but dwindled in extant insects. We also identify a gustatory receptor lineage in non-insect hexapods that is sister to insect odorant receptors, and which provides strong evidence that odorant receptors arose from within the sugar gustatory receptors. These findings clarify relationships among the insect gustatory and odorant receptor lineages and illuminate the origins and subsequent diversification of chemoreception across Hexapoda. Insect smell and taste are governed by vast arrays of chemoreceptors, but the evolutionary origins of these genes have remained murky. This study resolves their origin through a phylogeny that incorporates numerous previously undescribed chemoreceptor lineages in insects and their near relatives."
10.1038/s41893-026-01857-0,False,Nature Sustainability,该论文的标题和摘要主要讨论战争对燃料和水基础设施的环境影响，以及军事冲突对民用健康和安全的威胁。虽然这些基础设施的破坏可能间接影响空气质量或环境监测，但论文并未明确提及大气环境遥感技术、空气质量监测、卫星观测或大气成分分析等具体技术或方法。因此，该论文与大气环境遥感技术的关系不强。,[],,The long environmental shadow of war,"Fuel and water infrastructure are increasingly becoming the targets of military conflicts. These attacks pose not only a direct threat to civilian health and safety, but an ongoing threat to the environment that may persist for decades. Military strikes on civilian-critical infrastructure must be condemned if we are to build a just and sustainable future. 
 Fuel and water infrastructure are increasingly becoming the targets of military conflicts. These attacks pose not only a direct threat to civilian health and safety, but an ongoing threat to the environment that may persist for decades. Military strikes on civilian-critical infrastructure must be condemned if we are to build a just and sustainable future."
10.1038/s43247-026-03621-w,False,Communications Earth & Environment,该论文主要关注水文和气候模型对作物水分利用和可持续性的影响，虽然涉及大气环境中的水分循环，但并未直接涉及大气环境遥感技术，如空气质量监测、卫星观测、大气成分分析或气溶胶反演等。,"['hydrological', 'climate models', 'crop water use']",Qiming Sun;Francesca Bassani;Marta Tuninetti;Sara Bonetti,Uncertainties in global hydrological and climate models challenge future estimates of crop water use and sustainability,"Model uncertainty causes wide divergence in future estimates of crop green and blue water footprints (~ 18–51%) and water debts (~ 250–451%), challenging reliable assessment of crop water use and sustainability, according to a global, multi model climate-hydrology analysis of end century scenarios. 
 Assessing crop water requirements and sustainability under future climates is crucial to concurrently address water scarcity, food security, and ecosystem preservation. Yet, global climate and hydrological models differ substantially in estimating precipitation, potential evapotranspiration, and renewable freshwater, challenging future crop water use and sustainability assessments. Here, we perform a multi-model analysis to quantify how model uncertainty propagates into crop water needs and sustainability estimates. Results show end-of-century global uncertainty spreads of ~ 18% and ~ 51% for green and blue water footprints, respectively, relative to ensemble means. Blue water sustainability exhibits even larger variability, from 250% to 451%, depending on scenario and model choices. These uncertainties further intensify at finer spatial scales. Hydrological model discrepancies dominate blue water assessments, whereas climate model variability primarily affects green water estimates, particularly under high-emission scenarios. Accounting for model uncertainty is essential for reliable crop water estimates and to inform agricultural water management under climate change. Model uncertainty causes wide divergence in future estimates of crop green and blue water footprints (~ 18–51%) and water debts (~ 250–451%), challenging reliable assessment of crop water use and sustainability, according to a global, multi model climate-hydrology analysis of end century scenarios."
10.1038/s43247-026-03678-7,True,Communications Earth & Environment,该论文研究的是早寒武纪扬子地块边缘的硫酸钡和黄铁矿沉积，涉及海洋和环境因素对沉积物的影响，特别是氧化还原条件和金属成矿作用。虽然不直接涉及大气环境遥感技术，但研究内容与地球科学和环境科学中的大气成分分析、沉积物环境监测等领域有一定关联，因此可以认为与大气环境遥感技术有强关联性。,"['barite', 'witherite', 'euxinia', 'redox conditions', 'sulfur isotopes']",Peng Yuan;Lingang Xu;Jingwen Mao;Hao Yan;Wei Wei;Fang Huang;Andrey Bekker,Regional early Cambrian euxinia coupled with massive barite and witherite deposition on the Yangtze Block,"Marine and environmental factors influenced the early Cambrian barite and witherite deposition on the continental margins of the Yangtze Block, based on an integrated whole-rock barium and in-situ sulfur isotopic data-based genetic model. 
 Fluctuations in marine redox conditions on the Yangtze Block, recorded by widespread black shales, critically influenced local biological habitability during the early Cambrian. However, the relation between redox conditions and precipitation of massive barite and witherite hosted within these black shales remains poorly constrained. Here, we integrate barium and sulfur isotope data to elucidate metallogenesis of these deposits within its paleoceanographic environment. Systematic δ138Ba variations reveal water-column barium enrichment under sulfate-depleted conditions, modulated by primary productivity. Offshore decreasing δ34S values of barite indicate that open-ocean incursions were the primary source of sulfate. Mixing of this sulfate with dissolved barium induced barite precipitation. Within the marginal basins, organic carbon export and sulfate replenishment fueled sulfate reduction, generating hydrogen sulfide that promoted euxinia expansion from deep- to shallow-waters. Our findings bear on the early Cambrian marine redox evolution on the Yangtze Block and demonstrate that massive barite and witherite precipitation was directly coupled with euxinia expansion. Marine and environmental factors influenced the early Cambrian barite and witherite deposition on the continental margins of the Yangtze Block, based on an integrated whole-rock barium and in-situ sulfur isotopic data-based genetic model."
10.1038/s43247-026-03600-1,False,Communications Earth & Environment,该论文主要研究海藻和海草在沿海日本不同气候带中产生的难降解溶解有机碳的变量，与大气环境遥感技术（如空气质量监测、卫星观测、大气成分分析、气溶胶检索等）没有直接关系。虽然涉及碳封存和有机碳降解，但核心内容是海洋生态系统中的碳循环，而非大气环境遥感技术。,"['dissolved organic carbon', 'macroalgal', 'seagrass', 'carbon sequestration', 'degradation experiments']",Kenta Watanabe;Masakazu Hori;Atsushi Kubo;Hirotada Moki;Tomohiro Kuwae,Macroalgal and seagrass species generate variable amounts of recalcitrant dissolved organic carbon in coastal Japan,"Recalcitrant dissolved organic carbon stores carbon at variable rates in marine macrophytes, according to the results from degradation experiments of macroalgal and seagrass species across cold-temperate to subtropical coastal habitats in Japan 
 Dissolved organic carbon released from marine macrophytes is an important carbon sequestration pathway, but its recalcitrant fraction remains poorly quantified. Here, we quantified dissolved organic carbon release rates and recalcitrance using empirical data from macroalgal and seagrass species across cold-temperate to subtropical coastal Japan. Dissolved organic carbon release rates ranged from 5 to 462 µmol g-DW−1 d−1, with similar averages between macroalgae and seagrasses. Using degradation dynamics simulated with a reactivity continuum model, we estimated the mean recalcitrant fractions over 100-year timescale as 25% (17–34%, 95% credible interval) for seagrasses and 14% (11–16%) for macroalgae, corresponding to 8% (4–12%) and 4% (3–6%) of annual net primary production, respectively. These regionally constrained estimates indicate that macrophyte-derived recalcitrant dissolved organic carbon generation represents a major carbon storage process comparable to particulate organic carbon storage beyond the source ecosystems. 
                
                  
                
               Recalcitrant dissolved organic carbon stores carbon at variable rates in marine macrophytes, according to the results from degradation experiments of macroalgal and seagrass species across cold-temperate to subtropical coastal habitats in Japan"
10.1038/s43247-026-03680-z,False,Communications Earth & Environment,该论文主要研究浮游植物叶绿素对拉尼娜现象的影响，涉及海洋生物地球化学和气候系统，与大气环境遥感技术（如空气质量监测、卫星观测、大气成分分析、气溶胶反演）没有直接关联。,"['chlorophyll', 'sea surface temperature', 'ocean physics–biogeochemical model']",Feng Tian;Rong-Hua Zhang;Xiujun Wang;Chuanyu Liu,Phytoplankton-induced radiation effects reshape the evolution of multi-year La Niña,"Chlorophyll patterns modulate sea surface temperature gradients, helping to sustain multi-year La Niña conditions, according to coupled ocean physics– biogeochemical simulations. 
 Chlorophyll in phytoplankton modulates upper-ocean heating by absorbing shortwave radiation, thereby affecting climate systems. However, how chlorophyll influences multi-year La Niña evolution—a key aspect of El Niño–Southern Oscillation diversity—remains largely unexplored. Using a coupled ocean physics–biogeochemical model, we reveal that chlorophyll patterns markedly modulate the anomalous zonal sea surface temperature gradient across the equatorial Pacific. In the western-central equatorial Pacific, increased surface chlorophyll enhances meridional advection and vertical mixing, sustaining cooling into the second year by ~8%. Conversely, reduced chlorophyll in the eastern equatorial Pacific allows deeper shortwave penetration, warming the subsurface; this subsequently promotes surface warming by ~45% via background upwelling. Additionally, the subsurface chlorophyll maximum further enhances eastern equatorial Pacific cooling, helping sustain second-year La Niña conditions. These findings identify phytoplankton-driven bio-feedback as a previously unrecognized mechanism reshaping multi-year La Niña processes. Chlorophyll patterns modulate sea surface temperature gradients, helping to sustain multi-year La Niña conditions, according to coupled ocean physics– biogeochemical simulations."
