doi,is_relevant,journal,explanation,topic_words,authors,title,abstract
10.1038/s41586-026-10609-1,False,Nature,该论文主要研究量子材料中空腔介导的吸引相互作用，涉及太赫兹光和二维量子材料，但不直接与大气环境遥感技术（如空气质量监测、卫星观测、大气成分分析或气溶胶检索）相关。,"['terahertz', 'van der Waals', '2D quantum materials']",F. Helmrich;H. S. Adlong;M. Kroner;I. Khanonkin;G. Scalari;J. Faist;A. İmamoğlu;T. F. Nova,Cavity-driven attractive interactions in quantum materials,"A broadband, sub-wavelength time-domain microscope is described, enabling the observation that terahertz light trapped within a cavity can mediate attractive interactions in a tunable van der Waals material. 
 Many-body phenomena in quantum materials emerge from the interplay among a broad continuum of electronic states and controlling these interactions is critical for engineering new phases. One promising approach exploits light confined within optical cavities to tailor electronic properties1. Here we demonstrate that terahertz cavity photons can mediate attractive interactions in a tunable van der Waals (vdW) material and reorganize a continuum of electron–hole transitions into an exciton-like state. We introduce a broadband, sub-wavelength time-domain microscope that integrates exfoliated, dual-gated 2D quantum materials into a terahertz cavity. This approach enables the spectroscopic measurement of the field-tunable bandgap of bilayer graphene2 (BLG) in the terahertz range and, at resonance, reveals ultrastrong coupling3 (USC) with an effective interaction strength exceeding g/ωc ≈ 40% of the bare photon energy. Crucially, we identify a cavity-induced resonance emerging from the interband continuum that resembles Coulomb-bound excitons and remains stable across a broad temperature range. Our findings propose an experimental platform for designing and investigating hybrid light–matter phases in 2D quantum matter.  A broadband, sub-wavelength time-domain microscope is described, enabling the observation that terahertz light trapped within a cavity can mediate attractive interactions in a tunable van der Waals material."
10.1038/s41586-026-10521-8,False,Nature,该论文研究的是使用超导量子比特进行实验性随机性放大，与大气环境遥感技术（如空气质量监测、卫星观测、大气成分分析、气溶胶检索）没有直接关系。论文内容主要涉及量子信息处理和随机性增强，而非大气科学或遥感技术。,"['superconducting qubits', 'randomness amplification', 'Bell test']",Anatoly Kulikov;Simon Storz;Josua D. Schär;Martin Sandfuchs;Ramona Wolf;Florence Berterottière;Christoph Hellings;Andreas Wallraff;Renato Renner,Experimental randomness amplification,"An experimental realization of device-independent randomness amplification is demonstrated using superconducting qubits, in which a source of weak, correlated randomness is converted into virtually perfect random bits, certified by a Bell test. 
 Realistic quantum information processing devices are inherently imperfect, leading to computational errors that require quantum error correction. Likewise, random bits generated by such devices are flawed and must be enhanced to be usable for applications such as generating cryptographic keys. This enhancement of randomness quality is achieved through a protocol known as randomness amplification1. Here we report on an experiment that implements such a protocol. Randomness amplification is device-independent, making no assumptions about the internal workings of the quantum devices. It requires executing a loophole-free Bell test2–4 within a specific parameter regime that involves both a high Bell violation and a high repetition rate. The experimental demonstration is made possible by a combination of theoretical advances, which allow for protocols with an experimentally realistic parameter regime, and experimental progress that achieves this regime with superconducting circuits. Crucially, randomness amplification has been proven to be impossible by purely classical means5. This experiment therefore demonstrates a definitive quantum advantage—leveraging quantum technology to accomplish a task unattainable by classical information processing. An experimental realization of device-independent randomness amplification is demonstrated using superconducting qubits, in which a source of weak, correlated randomness is converted into virtually perfect random bits, certified by a Bell test."
10.1038/s41586-026-10536-1,False,Nature,该论文主要研究社交平台算法对社会规范认知的影响，与大气环境遥感技术（如空气质量监测、卫星观测、大气成分分析、气溶胶反演等）无关。,[],William J. Brady;Meriel Doyle;Abdo Elnakouri;Eli J. Finkel;Joshua Conrad Jackson;Nour Kteily;Victoria Parker;Curtis Puryear;Trevor Spelman;Jacob Teeny;Mark Torres,Redesigning algorithms to intervene on social norm misperceptions during a national election,"Engagement-based feeds amplify intergroup, moralized, emotional (IME) and toxic content relative to reverse-chronological feeds, and a diversified extremity algorithm reduces exposure to IME and toxic content while maintaining comparable platform enjoyment. 
 For the first time in history, civic discourse commonly occurs in digital environments in which algorithms influence exposure to social information1,2. It is increasingly important to understand whether and how these algorithms affect political discourse3–5. Here we built custom feed-ranking algorithms with full control over their features, and randomly assigned 2,000 participants to use them for 8 weeks (before and after the 2024 US presidential election). We tested whether an engagement-based algorithm (used on major social media platforms6,7) amplifies intergroup, moralized and emotional (IME) information in ways that skew perceptions of social norms around political dialogue5,8, and whether it increased engagement with IME content and perceptions of partisan animosity (compared with a reverse-chronological feed9,10). We also developed and tested a ‘diversified extremity’ algorithm to reduce the influence of extreme users11–13 to improve the accuracy of social norm perception14–16 and reduce perceptions of partisan animosity. We found that engagement-based feeds amplified IME and toxic content relative to reverse-chronological feeds, with the largest increases in moral outrage and political content. Engagement-based feeds also reduced prescriptive norm perception accuracy (albeit in an unexpected direction) and increased perceived partisan animosity. However, they did not significantly alter users’ own engagement behaviours. The diversified extremity algorithm reduced IME and toxic content exposure, improved prescriptive norm accuracy, yet maintained comparable platform enjoyment—suggesting that reducing the influence of extreme users can curb algorithmic distortions without diminishing user experience. protocol registration The Stage 1 protocol for this Registered Report was accepted in principle on 17 September 2024. The protocol, as accepted by the journal, can be found at 
              https://osf.io/c9a3m
              
            . Engagement-based feeds amplify intergroup, moralized, emotional (IME) and toxic content relative to reverse-chronological feeds, and a diversified extremity algorithm reduces exposure to IME and toxic content while maintaining comparable platform enjoyment."
10.1038/s41586-026-10569-6,False,Nature,该论文研究的是人类血液中mtDNA突变的积累机制，与大气环境遥感技术（如空气质量监测、卫星观测、大气成分分析、气溶胶反演）无关。,"['air quality', 'satellite observations', 'atmospheric composition', 'aerosol retrieval']",Rahul Gupta;Timothy J. Durham;Grant Chau;Masahiro Kanai;Md Mesbah Uddin;Wenhan Lu;M. Austin Argentieri;Konrad J. Karczewski;Daniel Howrigan;Pradeep Natarajan;Wei Zhou;Benjamin M. Neale;Vamsi K. Mootha,Mechanism of age-related accumulation of mtDNA mutations in human blood,"Genome-wide analyses indicate that accumulation of mitochondrial DNA mutations, a hallmark of ageing, may be caused by cryptic replication errors, which act as passenger mutations that eventually become detectable with age owing to age-related somatic mosaicism, rather than oxidative damage. 
 Accumulation of mutant mitochondrial DNA (mtDNA) heteroplasmy is among the strongest signatures of ageing1. Here we investigated the underlying mechanism by calling mtDNA sequence, mtDNA abundance and mtDNA heteroplasmic variants in human blood using whole-genome sequences from approximately 750,000 individuals. We observed that mtDNA single-nucleotide variants (mtSNVs) accumulate sharply at age 60 years, occur at low levels of heteroplasmy, exhibit little evidence of positive selection and are likely to be predominantly neutral. The mutational spectrum of mtSNVs does not reflect oxidative lesions, as is commonly invoked, but is more consistent with mtDNA replication errors. To understand why mtSNVs become detectable with age, we performed a genome-wide association study for heteroplasmic mtSNV burden, identifying germline variants near TERT, TCL1A and SMC4, all of which have been linked to clonal haematopoiesis (CH)2. Rare-variant analysis also showed that high mtSNV burden is associated with mutations in numerous CH driver genes. These genetic associations persisted even after exclusion of individuals with known CH driver mutations. Our results support a model in which ‘cryptic’ mtDNA mutations initially arise randomly as replication errors but are undetectable in bulk. They then become apparent only through age-related expansion of cellular clones in blood. We propose that the high copy number and mutation rate of mtDNA make it a sensitive blood-based marker of somatic mosaicism due to CH. Our work mechanistically unifies three prominent signatures of ageing: common germline variants in TERT, CH and observed accrual of mtDNA mutations. Genome-wide analyses indicate that accumulation of mitochondrial DNA mutations, a hallmark of ageing, may be caused by cryptic replication errors, which act as passenger mutations that eventually become detectable with age owing to age-related somatic mosaicism, rather than oxidative damage."
10.1038/s41586-026-10543-2,True,Nature,该论文研究了全球范围内冰雹灾害的潜在增加趋势，涉及气候变化对大气现象的影响，这与大气环境遥感技术（如卫星观测、大气成分分析）密切相关。,"['hailstorm', 'atmospheric composition', 'convective storms', 'remote sensing', 'air quality monitoring']",Shiyi Zhang;Qinghong Zhang;John T. Allen;Xiangyu Lin,Rising global hail damage potential in a warming world,"Hailstone trajectory simulations conducted under historical and future scenarios show a shift towards larger hailstones, resulting in global hailstorm-induced damage potential increasing by around 40% by the late twenty-first century. 
 Anthropogenic climate change (ACC) is expected to modify severe convective storms and their associated hazards, including hailstorms, a primary driver of weather-related economic losses1–4. Despite some research on the response of hailstorms to ACC, most studies have focused on regional-scale changes2–9, whereas global-scale assessments of hailstone size remain scarce. Here we show a 36.5–42.1% increase in global hailstorm-induced damage potential by the late twenty-first century, with the magnitude determined by the emission scenario. Our results arise from hailstone trajectory simulations conducted under historical and future scenarios, driven by EC-Earth3 ensemble outputs10 that are cross-validated through multimodel comparisons. Globally, increased low-level temperature and specific humidity drive a shift towards larger hailstones, with the frequency of ≥30-mm-diameter hailstones rising by 37.9–51.8% and <30-mm-diameter hailstones declining by 4.2–12.3%. Regionally, the mid-high latitudes predominantly exhibit increased hail damage potential owing to strong warming and weak moistening, amplifying instability sufficiently to counteract enhanced drag and melting effects. Conversely, tropical and monsoonal regions experience reduced hail damage potential owing to weak warming, strong moistening and limited hail growth depth. Our findings highlight the non-uniform impacts of ACC on global hailstorm damage, providing critical insights for future disaster prevention and mitigation strategies. Hailstone trajectory simulations conducted under historical and future scenarios show a shift towards larger hailstones, resulting in global hailstorm-induced damage potential increasing by around 40% by the late twenty-first century."
10.1038/s41586-026-10576-7,False,Nature,该论文主要研究甘蔗的基因组和遗传结构，涉及多倍体基因组、基因重组和染色体重排等生物学话题，与大气环境遥感技术（如空气质量监测、卫星观测、大气成分分析、气溶胶检索）没有直接关联。,"['polyploid genome', 'sugarcane', 'genetic architecture']",Jungang Wang;Xiaofeng Li;Yibin Wang;Jishan Lin;Shuai Chen;Hongbo Liu;Xiao Chen;Kun Chai;Aoqian Dong;Tingting Zhao;Cuilian Feng;Ruijie Wu;Ping Zhao;Yaodong Zheng;Zhongqiang Xia;Shengcheng Zhang;Yi Liu;Shenyang Qu;Ziqi Ye;Yuhan Song;Qingyuan Deng;Xiaofei Zeng;Guangrun Yu;Ran Kong;Baoqing Zhang;Wei Zhang;Peifang Zhao;Jun Mao;Xin Lu;Haifeng Jia;Xueting Zhao;Qianqian Zhang;Shuzhen Zhang;Wenwei Cai;Dongao Huo;Ling Li;Yuqing Gong;Shiqiang Huang;Yongji Huang;Zehuai Yu;Zuhu Deng;Baoshan Chen;Yuebin Zhang;Muqing Zhang;Ray Ming;Xingtan Zhang,Genetic architecture of sugarcane traits in a polyploid genomics framework,"A fully phased genome assembly of the sugarcane foundational cultivar POJ2878 reveals extensive subgenome recombination and non-homologous chromosomal rearrangements. 
 Sugarcane (Saccharum spp.) is a vital sugar and bioenergy crop with an exceptionally complex polyploid genome (10–12 sets of chromosomes). This complexity resulted from nobilization—a historical breeding process involving interspecific hybridization and repeated backcrossing1. However, the extreme ploidy has long impeded efforts to elucidate the genetic basis of its considerable sucrose-storing capacity. Here we present a fully phased genome assembly of the foundational cultivar POJ2878, achieved using a Pore-C-based assembly algorithm. This assembly resolved 118 chromosomes, revealing extensive subgenome recombination and non-homologous chromosomal rearrangements. Using identity-by-descent and allele-specific expression profiling, we identified breeder-favoured haplotypes, including a SUS2 haplotype with enhanced sucrose content. Resequencing of 981 Saccharum accessions traced POJ2878’s pervasive contribution to modern cultivars and identified key domestication and improvement sweeps. Genes under selection include CBL1 for cold tolerance, TIP1 for cell size regulation and TB1 for tillering control. A genome-wide association study tailored for polyploid genomes resolved loci associated with parenchyma cell size and sucrose storage capacity, including the functionally validated sucrose transporter Saccharum hybrid SUT2. These findings clarify the genetic architecture underlying sugarcane’s biomass productivity and sugar yield, offering a genomic foundation for accelerating improvement in sugarcane and other polyploid crops critical for global food and bioenergy security. A fully phased genome assembly of the sugarcane foundational cultivar POJ2878 reveals extensive subgenome recombination and non-homologous chromosomal rearrangements."
10.1038/s41586-026-10595-4,True,Nature,该论文研究的是使用超材料增强近场热辐射传递，这涉及到红外传感应用，属于大气环境遥感技术中的红外遥感领域。,"['near-field radiative heat transfer', 'metamaterials', 'infrared sensing']",Zexiao Wang;Renwen Yu;Hakan Salihoglu;Xiao Luo;Zhuo Li;Hyeonggyun Kim;Xiu Liu;Tianyi Huang;Yibai Zhong;Shanhui Fan;Sheng Shen,Metamaterial-enhanced near-field radiative heat transfer,"Near-field radiative heat transfer between silicon nitride membranes is enhanced several-fold by using metamaterials, opening opportunities for thermal energy harvesting and infrared sensing applications. 
 When radiative thermal energy is exchanged at near field, evanescent surface waves such as surface phonon polaritons can tunnel through the gap, boosting heat transfer above the far-field blackbody limit by several orders of magnitude1,2. Such extreme radiative energy fluxes have been experimentally demonstrated in dielectric materials supporting surface phonon polaritons3–5. Although theories and simulations have suggested metamaterials as a promising route to further manipulate and enhance near-field radiative heat exchange beyond the limits of unstructured Drude- or Lorentz-type materials6–10, experimental validation remains elusive. Here we experimentally demonstrate metamaterial-mediated enhancement on near-field radiative heat transfer between gold split-ring resonators patterned on silicon nitride (SiN) membranes. Compared with unstructured gold plates on the SiN membrane or bare SiN membranes, the radiative heat transfer between the metamaterials is enhanced several-fold. This observed enhancement results from the split-ring-resonator resonant modes and their strong coupling with surface phonon polaritons in the SiN membrane, as supported by direct electromagnetic simulations and coupled-mode-theory modelling. Our work provides experimental verification of the strong capability of metamaterials in manipulating radiative energy exchange at near field, opening opportunities for thermal energy harvesting and infrared sensing applications. Near-field radiative heat transfer between silicon nitride membranes is enhanced several-fold by using metamaterials, opening opportunities for thermal energy harvesting and infrared sensing applications."
10.1038/s41586-026-10496-6,False,Nature,该论文主要关注的是硅晶体管的垂直堆叠和三维集成电路的制造技术，与大气环境遥感技术（如空气质量监测、卫星观测、大气成分分析、气溶胶反演）没有直接关系。,[],Bao Lam;Yung Man Yu;Hyunjun Nam;Hsu-Chih Ni;Shomik Chatterjee;Shaloo Rakheja;Jian-Min Zuo;Qing Cao,Monolithic three-dimensional integration of silicon transistors,"Uniformly doped, ultrathin single-crystalline silicon nanomembranes can be vertically stacked at low temperature using a roll-transfer-printing process that is scalable to wafer scale and tolerant to substrate topology and surface roughness for constructing high-performance monolithic three-dimensional integrated circuits. 
 Monolithic, three-dimensional (3D) integrated circuits promise advantages in packing density, energy consumption and interconnectivity bandwidth but require forming high-performance semiconductors and transistors on top tiers under the constraint of a limited thermal budget compatible with back-end-of-line integration1,2. Back-end-of-line-compatible transistors have been built on laser-annealed polycrystalline silicon, metal-oxide semiconductors, carbon nanotubes and two-dimensional chalcogenides3–5. However, their performance and reliability are much inferior to bottom-tier silicon metal–oxide–semiconductor field-effect transistors, which mask most of the improvements offered by monolithic 3D integration. Here we show that uniformly doped, ultrathin (≤10 nm) single-crystalline silicon nanomembranes can be vertically stacked using a roll-transfer-printing process that is scalable to wafer-scale and tolerant to substrate topology and surface roughness, enabling multi-tiers of complementary junctionless transistors to be sequentially fabricated on the same starting substrate under a processing temperature ≤400 °C. These devices achieve performance approaching that of front-end-of-line silicon metal–oxide–semiconductor field-effect transistors with current density above 650 µA µm−1 and sub-10-nm inter-tier registration for high-density vertical integration. We vertically constructed logic gates, including inverters, NAND, NOR gates and static random-access memory cells, based on up to three-tier integration at transistor-level granularity. Our demonstrations provide a promising route towards silicon-based monolithic 3D circuits, especially for research and low-volume prototyping. Uniformly doped, ultrathin single-crystalline silicon nanomembranes can be vertically stacked at low temperature using a roll-transfer-printing process that is scalable to wafer scale and tolerant to substrate topology and surface roughness for constructing high-performance monolithic three-dimensional integrated circuits."
10.1038/s41586-026-10607-3,True,Nature,该论文探讨了临时碳 dioxide 去除技术，特别是其对短寿命非 CO2 气候强迫物质的补偿作用。这与大气环境遥感技术中的空气质量监测和大气成分分析密切相关，因为其研究内容涉及温室气体的排放与补偿机制，以及特定污染物（如甲烷）的量化分析。,"['carbon dioxide removal', 'short-lived climate forcers', 'methane']",Yue He;Keywan Riahi;Matthew J. Gidden;Shilong Piao;Tao Wang;Thomas Gasser,Temporary carbon dioxide removal to offset short-lived climate forcers,"Temporary carbon dioxide removal can offset short-lived non-CO2 climate forcers, providing a viable physical approach for crediting temporary carbon dioxide removal activities in industries in which non-CO2 emissions dominate and direct emission reductions are difficult. 
 Carbon dioxide removal (CDR) is considered for achieving the long-term temperature objectives of the Paris Agreement and national net-zero emission targets1–5. The durability of these CDR methods varies widely, ranging from decades to theoretically permanent6. Temporary CDR dominates present deployment, whereas permanent solutions face further feasibility and cost challenges at scale1. However, efforts to integrate temporary CDR into climate policies have relied on equivalency assumptions between temporary and permanent CDR that contradict physical climate science: temporary CDR cannot fully offset CO2 emissions as permanent CDR can6,7. Here we show that temporary CDR can serve as compensation for non-CO2 climate forcers, particularly for short-lived species whose compensation ratios are fairly insensitive to the choice of time horizon. For instance, offsetting 1 kg CH4 requires 498 kg CO2 with 20-year temporary storage (such as bioplastics) or 101 kg CO2 with 100-year storage (such as durable wood products). We suggest a critical lifetime threshold separating short-lived and long-lived species for temporary CDR applications, with implementation requiring differentiated reporting of these categories. This framework can provide a physical basis for crediting temporary CDR activities in sectors such as agriculture, in which non-CO2 emissions dominate and direct emission reductions remain challenging. Temporary carbon dioxide removal can offset short-lived non-CO2 climate forcers, providing a viable physical approach for crediting temporary carbon dioxide removal activities in industries in which non-CO2 emissions dominate and direct emission reductions are difficult."
