doi,is_relevant,journal,explanation,topic_words,authors,title,abstract
10.1038/s41467-026-74016-w,False,Nature Communications,该论文主要研究宿主细胞中脂滴在抗病毒反应中的双重作用，涉及蛋白质组学和脂质组学技术，但与大气环境遥感技术（如空气质量监测、卫星观测、大气成分分析、气溶胶反演）无关，因此不相关。,"['proteomics', 'lipidomics', 'antiviral response', 'lipid droplets', 'cellular signalling']",Ebony A. Monson;Zahra Telikani;Jay L. Laws;Abbey J. Milligan;Irumi Amarasinghe;Sarah E. Bamford;Ashley M. Rozario;Monique L. Smith;Vivian Tran;Quynh N. Dinh;Nicholas Williamson;Adam Mechler;Boyin Liu;Chad J. Johnson;Paul J. Pigram;Michael Leeming;Shuai Nie;Jessica K. Holien;Markus J. Hofer;Donna R. Whelan;Karla J. Helbig,Integrative proteomics and lipidomics reveals dual roles for lipid droplets in the host cell antiviral response,"Dual proteomics–lipidomics demonstrates that virus-induced lipid droplets rapidly recruit antiviral proteins and remodel lipids. These lipid–protein networks form signalling hubs, while specific long chain fatty acids enhance interferon responses and restrict viral replication. 
 Lipid droplets (LDs), once viewed as inert lipid storage sites, are now recognised as dynamic organelles central to cellular signalling and immunity. This study presents a dual-omics approach, integrating proteomics and lipidomics, to investigate LDs in the host antiviral response. In vivo and in vitro RNA viral infection models demonstrate that LDs rapidly remodel both their proteome and lipidome. The antiviral proteins RIG-I, MDA5, STAT1, STAT2, and viperin are specifically recruited to virus-induced LDs. Simultaneously, the LD lipidome shifts toward enrichment in long-chain polyunsaturated fatty acids and bioactive phospholipids, likely enhancing membrane dynamics and protein recruitment. Correlation analysis of matched proteomic and lipidomic datasets revealed extensive lipid–protein co-regulation on LDs and identified distinct correlation networks in which immune and antiviral proteins preferentially aligned with neutral lipid species. Enzymes involved in lipid metabolism and post-translational modifications are also upregulated, suggesting a mechanistic link between lipid remodeling and protein localisation. Functional assays utilizing artificial LDs revealed that arachidonic-acid and eicosapentaenoic-acid suppress viral replication and enhance type I and III interferon responses. These findings position LDs as key immunometabolic platforms in early antiviral defence. Dual proteomics–lipidomics demonstrates that virus-induced lipid droplets rapidly recruit antiviral proteins and remodel lipids. These lipid–protein networks form signalling hubs, while specific long chain fatty acids enhance interferon responses and restrict viral replication."
10.1038/s41467-026-74003-1,False,Nature Communications,该论文的主题是利用大型语言模型（LLMs）发现近似纳什均衡算法，涉及算法设计和证明保证，与大气环境遥感技术（如空气质量监测、卫星观测、大气成分分析、气溶胶反演）没有直接关联。,"['Nash equilibrium', 'LLMs', 'algorithm discovery']",Hanyu Li;Dongchen Li;Xiaotie Deng,Discovering expert-level Nash equilibrium algorithms with large language models,"This study is on algorithm discovery for approximate Nash equilibria. Here, authors developed LegoNE, a framework combining symbolic proof encoding with LLMs to automatically certify worst-case guarantees, discovering new equilibrium algorithms surpassing previous multi-player design paradigms. 
 Designing polynomial-time algorithms for approximate Nash equilibria (ANE) with provable worst-case guarantees is a fundamental open problem in algorithmic game theory. While large language models (LLMs) can generate candidate algorithms at scale, certifying worst-case guarantees requires formal analysis over all game instances—a task for which no automated system previously existed. Here, we present LegoNE, a framework encoding expert proof strategies into a symbolic language that automatically compiles any candidate algorithm into a finite optimization problem certifying its worst-case guarantee. Integrating LegoNE with a reasoning LLM, we rediscovered an algorithm matching the best polynomial-time guarantee for two-player games, and discovered a three-player algorithm improving the best guarantee from 0.6 + δ to 0.5 + δ—provably beyond the reach of the extension technique, the only previously known multi-player ANE design paradigm. These results show that encoding domain-specific proof strategies into a machine-tractable language can support LLM-driven discovery of algorithms outside known human design paradigms. This study is on algorithm discovery for approximate Nash equilibria. Here, authors developed LegoNE, a framework combining symbolic proof encoding with LLMs to automatically certify worst-case guarantees, discovering new equilibrium algorithms surpassing previous multi-player design paradigms."
10.1038/s43247-026-03706-6,True,Communications Earth & Environment,该论文研究的是跨半球气候响应，特别是南半球和北半球在热带太平洋耦合作用下的不对称性。虽然不直接涉及空气质量监测或卫星观测等技术，但其探讨了大气环流和气候模式的相互作用，这与大气环境遥感技术中的大气成分分析和气候变化研究有一定关联，因此可以认为与大气环境遥感技术有较强的相关性。,"['climate model', 'tropical Pacific', 'Rossby wave train']",Jun-Young Moon;Soon-Il An;Matthew T. Luongo;Young-Min Yang;So-Eun Park;Shang-Ping Xie;Mark R. England,Asymmetric cross-hemispheric climate response to extratropical forcing mediated by tropical Pacific coupling,"Southern Hemisphere extratropical cooling induces strong temperature responses in the Northern Hemisphere whereas equivalent Northern Hemisphere cooling remains more localized, primarily due to hemispheric asymmetries in tropical air-sea coupling, revealed by climate model experiments. 
 Regional climate perturbations can influence distant regions through coupled ocean-atmosphere processes. However, how forcing in one hemisphere affects the other remains underexplored. Here, using Earth system model simulations, we show that Southern Hemisphere extratropical cooling induces a robust cross-hemispheric temperature response, particularly over the Arctic, whereas equivalent Northern Hemisphere cooling yields a localized response. This asymmetry initiated from differences in how extratropical cooling interacts with the tropical Pacific. Southern Hemisphere forcing more effectively cools the equatorial central Pacific through enhanced surface wind-evaporative feedback, leading to stronger suppression of deep convection. It generates a planetary-scale Rossby wave train that establishes low-pressure anomalies over the Arctic, which reduce subsidence and adiabatic warming, thus promoting sea ice growth and amplifying surface cooling. In contrast, weaker tropical response under Northern Hemisphere forcing limits cross-hemispheric influence. Our findings highlight the central role of tropical Pacific processes in shaping asymmetry in hemispheric climate interaction. Southern Hemisphere extratropical cooling induces strong temperature responses in the Northern Hemisphere whereas equivalent Northern Hemisphere cooling remains more localized, primarily due to hemispheric asymmetries in tropical air-sea coupling, revealed by climate model experiments."
10.1038/s43247-026-03589-7,False,Communications Earth & Environment,该论文主要关注热浪对帕金森病死亡率的影響，涉及气候变化和人口老龄化对健康风险的评估，但并未涉及大气环境遥感技术，如空气质量监测、卫星观测或大气成分分析等。,"['heatwave', 'Parkinson’s mortality', 'climate warming']",Rui Zhang;Yonghong Li;Songwang Wang;Yujie Meng;Jia Zhao;Huan Zheng;Miao Yu;Yiming Hu;Ainan Jia;Liusen Wang;Ran Niu;Zhen Guo;Shuo Zhan;Qiang Chen;Qing Guo;Xiaofeng Wang;Qinmei Han;Bo Lu;Peng Bi;Jing Wu,Heatwave-attributable Parkinson’s mortality is projected to increase by the 2080s in China under a high-emissions scenario,"In China, heatwaves could raise Parkinson’s-related deaths nearly elevenfold by the 2080 s, and aging of populations is one of the main drivers, according to a time-stratified case-crossover analysis of 59,384 deaths data and climate–demographic projections. 
 The convergence of rapid population aging and heatwaves poses a growing threat to neurological health, particularly for people with Parkinson’s disease. Here we analysed national death records of 59,384 older adults with Parkinson’s disease in China (2013–2020) using a time-stratified case-crossover design to quantify heatwave-associated mortality risks. We then combined these estimates with climate and demographic projections and applied a counterfactual decomposition framework to disentangle the contributions of climate warming, population aging, and adaptation. We found that, without adaptation, heatwave-related deaths could increase by nearly elevenfold by the 2080 s. Population aging drives most of the absolute increase, whereas climate warming amplifies the growth over time. Effective adaptation could prevent up to three-quarters of these excess deaths. These findings highlight a critical policy window before the 2030 s and provide a generalizable framework for assessing climate-related health risks in aging populations. In China, heatwaves could raise Parkinson’s-related deaths nearly elevenfold by the 2080 s, and aging of populations is one of the main drivers, according to a time-stratified case-crossover analysis of 59,384 deaths data and climate–demographic projections."
10.1038/s43247-026-03711-9,False,Communications Earth & Environment,该论文主要关注中国温室农业对土地利用效率和粮食安全的影响，虽然涉及环境采样和情景建模，但未明确涉及大气环境遥感技术，如空气质量监测、卫星观测或大气成分分析等。,"['greenhouse farming', 'land-use efficiency', 'food security']",Jinlong Dong;Xiaoye Tong;Jialu Xu;Nazim Gruda;Xiaozhong Wang;Xiao Ma;Yun Zhao;Rodney B. Thompson;Jing Che;Ren Fang Shen,Diverse greenhouse farming systems underpin high land‑use efficiency and food security in China,"Greenhouse farming in China produces over one-third of national vegetable output on just 1.4% of arable land and could further improve land-use efficiency and employment by 2050 through optimized regional deployment, based on nationwide farm surveys, environmental sampling, and scenario modeling. 
 Greenhouse cultivation substantially enhances land-use efficiency and food security worldwide. However, regional variations in farming systems and their socioeconomic impacts remain poorly quantified. Through large-scale surveys of smallholder farms (n = 246) and environmental sampling (n = 1,230) across China, we determined that this sector can deliver 37.2% of the national vegetable output on only 1.4% of China’s arable land, and achieve yields up to six times higher than those in open-field systems. We identify seventeen distinct greenhouse farming systems varying in five adaptation strategies: agroclimatic optimization, regional specialization, precise land use, use of marginal soils, and soil sustainability practices. Scenario modeling shows that by 2050, strategic production relocation to climatically suitable regions and optimization of these farming systems could further enhance land use efficiency compared to those in 2022, indicated by a decrease in land area of 7–51% while increasing farmer employment by 20% or 156% without or with considering elderly care policy. Thus, diversified, small-scale farming systems represent a transformative pathway for sustainable intensification, offering scalable solutions to global food security with regional policy support. Greenhouse farming in China produces over one-third of national vegetable output on just 1.4% of arable land and could further improve land-use efficiency and employment by 2050 through optimized regional deployment, based on nationwide farm surveys, environmental sampling, and scenario modeling."
10.1038/s43247-026-03712-8,False,Communications Earth & Environment,该论文主要关注海平面上升对地中海沿岸地区复合洪水的影响，虽然涉及海洋和大气过程，但并未明确涉及大气环境遥感技术，如空气质量监测、卫星观测、大气成分分析或气溶胶检索等。,"['sea-level rise', 'compound flooding', 'rainfall', 'coastal water level']",José A. Jiménez;Juan Del-Rosal-Salido;Filippo Giaroli;Andrea Lira-Loarca;Miguel Ortega-Sánchez;Marc Sanuy;Marcus Silva-Santana;María Bermúdez,Sea-level rise is projected to reshape compound flooding potential in microtidal environments along the Spanish Mediterranean coastline,"Sea-level rise could drive increasing coastal compound flooding in the Western Mediterranean, despite stable storm-driven contributions, suggests a multivariate analysis of rainfall and coastal water level interactions and EURO CORDEX simulations under a high-emissions scenario. 
 Compound flooding, arising from the concurrence of extreme rainfall and elevated coastal water levels, poses a growing challenge for climate risk assessment in coastal regions. In microtidal environments, where meteorological forcing dominates coastal water levels, interactions between terrestrial runoff and marine processes can strongly amplify flood impacts. Yet future changes in compound flooding remain poorly constrained, and the relative roles of storm characteristics and sea-level rise are unclear. Here, we develop a multivariate analytical framework that explicitly resolves non-linear interactions between heavy rainfall and coastal water levels by decomposing compound flooding into event intensity, joint occurrence probability, and statistical dependence. Applying this framework along the 1600 km Spanish Mediterranean coastline using a 17-member EURO-CORDEX ensemble under a high-emissions scenario, we show that projected changes in storm characteristics alone lead to generally stable or declining compound flooding potential. In contrast, sea-level rise fundamentally reshapes rainfall-coastal water-level interactions, driving widespread increases in compound flooding potential by 2100. These results identify sea-level rise as the dominant control on future compound flooding in microtidal coastal environments. Sea-level rise could drive increasing coastal compound flooding in the Western Mediterranean, despite stable storm-driven contributions, suggests a multivariate analysis of rainfall and coastal water level interactions and EURO CORDEX simulations under a high-emissions scenario."
10.1038/s43247-026-03696-5,False,Communications Earth & Environment,该论文主要研究的是海冰覆盖变化对海洋生物多样性的影响，虽然涉及气候变化和海洋环境，但并未直接涉及大气环境遥感技术，如空气质量监测、卫星观测、大气成分分析或气溶胶反演等。,"['sea ice cover', 'marine biodiversity', 'ancient DNA']",Stijn De Schepper;Tristan Cordier;Katrine Sandnes Skaar;Jessica Louise Ray;Henrik Sadatzki;Bjørg Risebrobakken,Changing sea ice cover led to marine biodiversity shifts in the Late Quaternary,"Changes to the sea ice cover in the Labrador Sea led to shifts in marine eukaryote communities, according to an analysis of ancient DNA in marine sediments from the past 50,000 years. 
 Today, the sea ice cover is rapidly declining in the Arctic Ocean. While major changes in the Arctic marine ecosystems are starting to appear, the full implication of a changing Arctic ecosystem is not well understood. Here we show, using sedimentary ancient DNA metabarcoding to document marine eukaryotic communities, that higher diversity is recorded in a warmer, sea ice free Labrador Sea compared to when this region is sea ice covered. Changes in diversity and communities happen slower than the rapid climate warming of Greenland Interstadial 8 (ca. 38,000 years ago) and the Bølling period (ca. 14,700 years ago). Surface ocean conditions, rather than atmospheric warming, exert control on the marine eukaryote community and diversity. Our observations from the paleoclimate record suggest that when sea ice further decreases under global warming, the (sub-)polar marine ecosystems will change drastically, and feedbacks to the carbon cycle and climate system become very likely. Changes to the sea ice cover in the Labrador Sea led to shifts in marine eukaryote communities, according to an analysis of ancient DNA in marine sediments from the past 50,000 years."
10.1038/s43247-026-03681-y,False,Communications Earth & Environment,该论文主要研究气候变化对河流水文的影响，特别是河流洪水频率和强度的变化，与大气环境遥感技术（如空气质量监测、卫星观测、大气成分分析、气溶胶反演）没有直接关系。,[],Siyu Zhu;Zhi Li;Songkun Yan;Hongjie Xie;Guo Yu;Jonathan J. Gourley;Mengye Chen;Yang Hong,Widespread intensification of global river hydrograph flashiness under climate change,"Future river floods are projected to increase more quickly, particularly in low-latitude basins, according to a numerical hydrological model driven by multiple climate model projections. 
 Flooding poses an increasing threat to lives and infrastructure worldwide, yet how river flow responds under climate change remains uncertain. Here we assess future changes in river hydrograph flashiness, defined as the rate of increase in streamflow normalized by time and drainage area, using a numerical hydrological model driven by multiple climate model projections. We analyze 520 major river basins globally. Results show that flashiness is projected to increase by about 14%, 30%, and 79% by the late twenty-first century under low-, intermediate-, and high-emission scenarios, respectively, relative to 2014. Increases are greater in low-latitude basins than in high-latitude regions. These changes are mainly associated with larger differences between peak and base flow and shorter times to reach peak discharge. Overall, our findings suggest that river floods are likely to become faster and more intense in a warming climate, posing growing challenges for flood risk management and infrastructure design. Future river floods are projected to increase more quickly, particularly in low-latitude basins, according to a numerical hydrological model driven by multiple climate model projections."
10.1038/s43247-026-03695-6,False,Communications Earth & Environment,该论文主要关注德国沿海水域中砷水平的上升，虽然与大气环境遥感技术有一定关联（如环境质量监测），但核心内容集中在水生生物和水质分析，而非大气成分分析或遥感技术本身。,"['arsenic', 'water', 'blue mussels']",Hans-Joerg Martin;Lillian Tabea Hannah Buenning;Jennifer Susanne Strehse;Edmund Maser,Rising arsenic levels in water and blue mussels in German coastal waters,"Over recent decades, German coastal waters show an increase in arsenic concentrations both in water and blue mussels, although not exceeding German environmental quality standards, according to analysis of data from Germany’s Marine Environmental Database. 
 Anthropogenic and natural processes contribute to the distribution of arsenic in the environment. Soluble trivalent arsenic compounds are highly toxic, and some arsenic species are known human carcinogens. Data were retrieved from Germany’s marine environmental database (Meeresumweltdatenbank) to illustrate the distribution of concentrations, identify potential hotspots, and show trends over time. We investigated total arsenic concentrations in water, sediment, and blue mussels in German coastal waters with a focus on anthropogenic pollution caused by submerged military munitions. Here, we show that a general upward trend in arsenic concentrations in water and blue mussels can be seen over the last 10–20 years. However, German environmental quality standards are not exceeded. Elevated arsenic concentrations were not observed in relation to proximity to known dump sites of conventional munitions or to the coast. Concentrations in the North Sea were higher in comparison to samples from the Baltic Sea, but similar to those globally. Over recent decades, German coastal waters show an increase in arsenic concentrations both in water and blue mussels, although not exceeding German environmental quality standards, according to analysis of data from Germany’s Marine Environmental Database."
10.1038/s43247-026-03664-z,True,Communications Earth & Environment,该论文研究了未来海平面上升对新西兰沿海含水层的影响，涉及地下水观测、海平面变化预测和垂直地表运动分析，这与大气环境遥感技术中的空气质量监测和地表水体分析有间接关联，但主要关注点是地下水安全和水资源管理。,"['groundwater observations', 'sea level rise', 'vertical land motion', 'aquifers', 'seawater intrusion']",Andrew R. Pearson;Allanah Kenny;Phil Abraham;Rachel Qiu;Richard Sutton;Murray E. Close;Theo S. Sarris,Projected expansion of potential seawater intrusion into coastal aquifers of Aotearoa New Zealand to 2150,"Areas of coastal aquifers with groundwater below sea level are projected to expand up to 8.3% under future sea level rise in Aotearoa New Zealand, according to a random forest analysis of 1.14 million groundwater observations and projections of sea level and vertical land motion. 
 Seawater intrusion into aquifers is an escalating global threat to coastal freshwater security, agriculture, and infrastructure. Seawater intrusion is generally more likely where the water table lies below sea level. In Aotearoa New Zealand (henceforth ‘Aotearoa’) this threat is increasing. Here, we analysed 1.14 million coastal groundwater level observations (2000–2023) from 46,677 wells and developed a random forest model to estimate water table elevations relative to sea level across Aotearoa’s usable coastal aquifer areas. We also incorporated projections of sea-level rise (under three Shared Socioeconomic Pathways (SSPs)), and vertical land motion to provide a national-scale screening assessment of the potential scope for seawater intrusion to the year 2150.Currently, 1.9% of Aotearoa’s useable coastal aquifer area exhibits negative groundwater levels relative to sea level. Under all SSPs, these areas expand nationwide, from 4.4% (SSP1-1.9) to 8.3% (SSP5-8.5) by 2150. Areas of coastal aquifers with groundwater below sea level are projected to expand up to 8.3% under future sea level rise in Aotearoa New Zealand, according to a random forest analysis of 1.14 million groundwater observations and projections of sea level and vertical land motion."
None,False,Remote Sensing of Environment,该论文研究的是青藏高原上的退化冻土滑坡识别问题，虽然可能使用遥感技术进行观测，但其主要关注点在于地质和生态领域，而非大气环境遥感技术（如空气质量监测、卫星观测、大气成分分析或气溶胶反演）。,"['retrogressive thaw slumps', 'Qinghai-Tibet plateau', 'heterogeneous feature fusion']",Taorui Zeng;Xiao Feng;Yuanming Lai;Thomas Glade,Multi-source heterogeneous feature fusion framework for identifying retrogressive thaw slumps on the Qinghai-Tibet plateau,
None,False,Remote Sensing of Environment,该论文研究的是一种基于功能-语义异构图聚合框架的方法，用于城市功能区映射，主要涉及空间关系和异构图技术，与大气环境遥感技术（如空气质量监测、卫星观测、大气成分分析、气溶胶反演）没有直接关联。,"['heterogeneous graph', 'spatial relationships', 'urban functional zone mapping']",Tianzhuo Guo;Shouhang Du;Shaoyu Wang;Zhanying Liu;Li Zhu;Jieyi Zhang;Xiuyuan Zhang;Shihong Du,A function-semantic oriented heterogeneous graph aggregation framework with weighted spatial relationships for urban functional zone mapping,
None,True,Remote Sensing of Environment,该论文利用多分辨率光学遥感技术改进了北极地区土地覆盖的制图和土地覆盖变化监测，这与大气环境遥感技术中的卫星观测和地表参数反演密切相关，属于大气环境遥感技术的范畴。,"['Arctic', 'land cover', 'remote sensing', 'optical remote sensing']",Xiaoran Zhu;Jonathan A. Wang;Oliver Sonnentag;Isla H. Myers-Smith;Daryl Yang;Kathleen M. Orndahl;Leon Nill;Antoine Caron-Guay;Etienne Laliberté;Mark A. Friedl,Improved mapping of Arctic fractional land cover and land cover change from multi-resolution optical remote sensing,
None,True,Remote Sensing of Environment,该论文研究了将非光化学猝灭（NPQ）纳入太阳能诱导的叶绿素荧光（SIF）估算光合碳同化，这与大气环境遥感技术中的气体成分分析和植被监测密切相关，因此具有相关性。,"['solar-induced chlorophyll fluorescence', 'photosynthetic carbon assimilation', 'non-photochemical quenching']",Jiale Chen;Zhunqiao Liu;Wenyan Xiao;Chenhui Guo;Gaoxiang Zhou;Yanan Wang;Longcai Zhao;Jincheng Liu;Yao Li;Peng Zhu;Zhigang Sun;Xiaoliang Lu,Incorporating non-photochemical quenching (NPQ) into estimating photosynthetic carbon assimilation from solar-induced chlorophyll fluorescence (SIF),
