doi,is_relevant,journal,explanation,topic_words,authors,title,abstract
10.1029/2025JD045746,True,Journal of Geophysical Research: Atmospheres,该论文研究了印度洋-太平洋暖池区域的水汽异常在不同时间尺度上的维持机制，使用了卫星获取的降水数据和对流层水汽静力能预算，涉及大气成分分析和遥感技术，因此与大气环境遥感技术密切相关。,"['moisture anomalies', 'satellite-derived precipitation data', 'CMSE budget', 'atmospheric composition analysis', 'intraseasonal timescales']",S. M. Navarro;K. Yasunaga;A. Hamada;K. Ueyoshi,Maintenance of Moisture Anomalies Across Synoptic and Intraseasonal Timescales Over the Indo‐Pacific Warm Pool,"Moisture variability plays a fundamental role in regulating tropical precipitation; however, the mechanisms that sustain moisture anomalies across different timescales remain unclear. This study examines how moisture anomalies are regulated over the Indo‐Pacific warm pool using the column‐integrated moist static energy (CMSE) budget. Spectral analysis is performed to reanalysis and satellite‐derived precipitation data for two frequency bands: synoptic (2–10‐day) and intraseasonal (20–60‐day). Results show that significant coherence between precipitation and CMSE occurs mainly at intraseasonal timescales along the equatorial warm pool (5°S–5°N, 80°E−150°E), whereas synoptic‐scale coupling is substantially weaker. Decomposition of the CMSE budget reveals that, at both timescales, horizontal and vertical advection act to damp moisture anomalies to a similar extent, while radiative heating and surface heat fluxes provide compensating sources that modulate regional variations. The net moisture tendency is nearly neutral because the opposing diabatic and advective processes effectively cancel each other, partly as a result of the spectral analysis methodology. Nonetheless, radiative heating and vertical advection exhibit spatial patterns that closely resemble the coherence between precipitation and CMSE and are associated with top‐heavy vertical velocity profiles. Further analysis indicates that strong upper‐tropospheric stability is a key factor in maintaining this top‐heaviness of the vertical velocity, while background wind fields modulate the meridional patterns of moisture mode emergence. These results suggest that the apparent moisture‐mode characteristics of intraseasonal disturbances arise primarily from environmental controls and their interactions with radiative and surface processes."
10.1029/2025JD045540,True,Journal of Geophysical Research: Atmospheres,该论文研究了大气过程对复杂地形下地表属性的敏感性，涉及地表参数（如森林和草地）对大气模拟的影响，这与大气环境遥感技术（如空气质量监测、卫星观测、大气成分分析、气溶胶反演）密切相关，因为它探讨了地表参数如何影响大气条件和模拟结果。,"['atmospheric process', 'land surface properties', 'sensitivity analysis', 'Weather Research and Forecasting model', 'Noah‐MP LSM']",Dario Di Santo;Cenlin He;Fei Chen;Andrea Zonato;Lorenzo Giovannini,Machine Learning‐Based Analysis of Atmospheric Process Sensitivity to Land Surface Properties Over Complex Terrain,"This study investigates the sensitivity of numerical simulations of atmospheric processes over complex terrain to land surface model (LSM) parameters, focusing on thermally driven circulations in an idealized valley. The sensitivity analysis is performed using the Weather Research and Forecasting model coupled with the Noah‐MP LSM, for forest and grassland land cover classes. An ensemble of 400 simulations for mixed forest and grassland is emulated with a suite of machine‐learning regressors, and variance‐based global sensitivity indices are computed from the surrogates. Sensitivity is evaluated for near‐surface wind, potential temperature, turbulent kinetic energy (TKE), and surface heat fluxes at representative valley locations. Results clearly discriminate influential and non‐influential parameters, providing guidance in identifying those that most affect model results and therefore should be treated with the most care. Over forests, stomatal minimum resistance (RS) is the most influential parameter overall, followed by canopy height (HVT), with importances intensifying during the night. Near‐infrared leaf reflectivity (RHOL_NIR), leaf area index, and optimal transpiration temperature (TOPT) also result as important parameters. Over grasslands, by contrast, both leaf and stem (SAI) area indices dominate, followed by RHOL_NIR. The roughness length (Z0MVT) is the most important parameter affecting turbulent kinetic energy during daytime, while RS and HVT are largely non‐influential. The results highlight that the proposed approach, integrating variance‐based global sensitivity analysis with machine learning, represents a reliable framework to perform sensitivity analyses for complex numerical models, providing valuable insights into the dynamic interactions between land surface parameters and atmospheric conditions over complex terrain."
10.1038/s41586-026-10594-5,False,Nature,该论文标题和摘要内容涉及的是神经科学领域，特别是痛觉神经元与胃肿瘤进展的关系，与大气环境遥感技术（如空气质量监测、卫星观测、大气成分分析、气溶胶反演等）无关。,[],Xiaofei Zhi;Feijing Wu;Jin Qian;Yosuke Ochiai;Guodong Lian;Ermanno Malagola;Biyun Zheng;Ruhong Tu;Yi Zeng;Hiroki Kobayashi;Zhangchuan Xia;Ruizhi Wang;Yueqing Peng;Qiongyu Shi;Duan Chen;Sandra W. Ryeom;Timothy C. Wang,Editorial Expression of Concern: Nociceptive neurons promote gastric tumour progression via a CGRP–RAMP1 axis,"Editorial Expression of Concern: Nociceptive neurons promote gastric tumour progression via a CGRP–RAMP1 axis 
 "
10.1038/d41586-026-01442-7,False,Nature,该论文标题和摘要讨论的是精准医疗与公平性，与大气环境遥感技术（如空气质量监测、卫星观测、大气成分分析、气溶胶反演）无关。,[],Afsaneh Shirani,Precision medicine without equity is just stratified inequality,"Precision medicine without equity is just stratified inequality 
 "
10.1038/d41586-026-01445-4,False,Nature,该论文标题和摘要描述的是一种能够在草原上滚动的小型机器人，其工作原理是基于光响应材料，与大气环境遥感技术（如空气质量监测、卫星观测、大气成分分析或气溶胶反演）无关。,"['air quality', 'satellite observation', 'atmospheric composition']",,Tumbleweed-style robot can roll across the prairie — no wind needed,"Woven from light-responsive strips, a tiny sphere trundles across a variety of surfaces when illuminated. 
 "
10.1038/d41586-026-01440-9,False,Nature,该论文标题和摘要主要讨论AI代理在研究中的生产力与学徒制之间的权衡，与大气环境遥感技术（如空气质量监测、卫星观测、大气成分分析、气溶胶反演）无关。,[],Jing Hu;Tony Huiquan Zhang,AI agents in research: when productivity comes at the cost of apprenticeship,"AI agents in research: when productivity comes at the cost of apprenticeship 
 Letter to the Editor"
10.1038/d41586-026-01443-6,False,Nature,该论文标题和摘要均与大气环境遥感技术无关，而是关于胸腺健康的医学研究。,[],Henry J. Kaminski;Linda L. Kusner;Gary Cutter;Rozen Le Panse,Thymic health under the microscope,"Thymic health under the microscope 
 Letter to the Editor"
10.1038/d41586-026-01441-8,False,Nature,该论文的标题和摘要主要关注昆虫的法律权利和 stingless-bee（无刺蜂）的保护，与大气环境遥感技术（如空气质量监测、卫星观测、大气成分分析、气溶胶反演）无关。,[],Shi-Jie Wang;A. J. Wubie,Legal rights for insects: a global imperative for stingless-bee conservation,"Legal rights for insects: a global imperative for stingless-bee conservation 
 Letter to the Editor"
10.1038/d41586-026-01333-x,False,Nature,该文章标题和摘要主要讨论的是一场科学聚会以及F.C.L. Wratten在摄影领域的贡献，与大气环境遥感技术（如空气质量监测、卫星观测、大气成分分析、气溶胶反演等）无关。,[],,Marvellous microscopes impress guests at a London party,"A sensational scientific soirée, and reflections on how F. C. L. Wratten advanced photography in this week’s pick from the Nature archive. 
 "
10.1038/d41586-026-01299-w,False,Nature,该论文标题和摘要主要关注可持续发展和环境经济学，讨论政府决策应考虑人类技能和自然资源，而非仅依赖GDP。内容与大气环境遥感技术（如空气质量监测、卫星观测、大气成分分析、气溶胶反演等）无关，因此不相关。,[],Pushpam Kumar,"To move beyond GDP, don’t ignore environmental economists","Sustainable development will only be achieved when governments base decisions on human skills and natural resources, not just gross domestic product. 
 Sustainable development will only be achieved when governments base decisions on human skills and natural resources, not just gross domestic product.   Sustainable development will only be achieved when governments base decisions on human skills and natural resources, not just gross domestic product. "
10.1038/d41586-026-01426-7,False,Nature,该论文的标题和摘要主要讨论的是NIH资助削减对少数族裔和女性科学家的影响，与大气环境遥感技术（如空气质量监测、卫星观测、大气成分分析、气溶胶反演）无关。,[],Max Kozlov,NIH grant cuts disproportionately hit minority and female scientists,"A survey reveals sharp divides in who bore the brunt of last year’s spree of grant cancellations by the Trump administration. 
 A survey reveals sharp divides in who bore the brunt of last year’s spree of grant cancellations by the Trump administration.  A survey reveals sharp divides in who bore the brunt of last year’s spree of grant cancellations by the Trump administration."
10.1038/d41586-026-01422-x,False,Nature,该论文标题和摘要主要讨论的是人工智能在研究资助中的应用和公平性问题，与大气环境遥感技术（如空气质量监测、卫星观测、大气成分分析、气溶胶反演）无关。,[],,Responses to the AI grant flood must prioritize fairness as part of excellence,"Research funding agencies are battling a wave of AI-assisted applications. Countermeasures should not entrench existing power structures. 
 Research funding agencies are battling a wave of AI-assisted applications. Countermeasures should not entrench existing power structures.  Research funding agencies are battling a wave of AI-assisted applications. Countermeasures should not entrench existing power structures."
10.1038/d41586-026-01408-9,False,Nature,该论文标题和摘要关于睾酮治疗的趋势、益处和风险，与大气环境遥感技术无关。,[],Mariana Lenharo,"Testosterone therapy is trending. Who really needs it, and why?","Some clinicians are pushing to broaden testosterone use, but there is debate about its benefits and risks. 
 Some clinicians are pushing to broaden testosterone use, but there is debate about its benefits and risks.  Some clinicians are pushing to broaden testosterone use, but there is debate about its benefits and risks."
10.1038/d41586-026-00508-w,False,Nature,该论文标题和摘要主要讨论的是学者拒绝使用生成式AI的原因，与大气环境遥感技术（如空气质量监测、卫星观测、大气成分分析、气溶胶反演等）无关。,[],Hannah Docter-Loeb,Meet the academics refusing to use generative AI,"Researchers say they have their reasons for avoiding AI tools — and they’re sick of arguing about it. 
 Researchers say they have their reasons for avoiding AI tools — and they’re sick of arguing about it.  Researchers say they have their reasons for avoiding AI tools — and they’re sick of arguing about it."
10.1038/d41586-026-01444-5,False,Nature,该论文主要研究的是纳米传感器在活体癌细胞内部的温度测量，与大气环境遥感技术（如空气质量监测、卫星观测、大气成分分析、气溶胶反演等）没有直接关系。,"['nanosensors', 'cancer cells', 'temperature']",Matthew Hutson,Quantum ‘thermometer’ takes temperatures inside living cancer cells,"Nanosensors showed that different parts of the cell varied by as much as 1 ºC. 
 Nanosensors showed that different parts of the cell varied by as much as 1 ºC.  Nanosensors showed that different parts of the cell varied by as much as 1 ºC."
10.1038/d41586-025-03504-8,False,Nature,该论文主题是关于人工智能在科学文献生成中的应用，与大气环境遥感技术（如空气质量监测、卫星观测、大气成分分析、气溶胶反演）无关。,[],Miryam Naddaf,How much of the scientific literature is generated by AI?,"Tools for reliably estimating what artificial intelligence is being used for are still lacking. 
 Tools for reliably estimating what artificial intelligence is being used for are still lacking.  Tools for reliably estimating what artificial intelligence is being used for are still lacking."
10.1038/d41586-026-01409-8,False,Nature,该论文标题和摘要主要讨论化肥短缺和能源危机对粮食安全的影响，与大气环境遥感技术（如空气质量监测、卫星观测、大气成分分析、气溶胶反演）没有直接关系。,[],Meihua Yang;Xing Wang;Solmaz Fathololoumi;Hiteshkumar B. Vasava;Yuhong Zhou;Henry W. Chau;Huijie Li;Bingcheng Si;Hongyi Li;Asim Biswas,How fertilizer shortages caused by the energy crisis threaten food security,"Unless governments treat fertilizer production as strategic infrastructure, the world will keep lurching from energy shock to harvest failure. 
 Unless governments treat fertilizer production as strategic infrastructure, the world will keep lurching from energy shock to harvest failure.  Unless governments treat fertilizer production as strategic infrastructure, the world will keep lurching from energy shock to harvest failure."
10.1038/d41586-026-01410-1,False,Nature,该论文的标题和摘要专注于基因组学和基因表达的调控，与大气环境遥感技术（如空气质量监测、卫星观测、大气成分分析、气溶胶反演）无关。,[],Michael Eisenstein,Powerful tools are revealing the ‘control knobs’ of the genome,"By accelerating the identification of DNA sequences that control gene expression, assays are revealing the hidden grammar of the regulatory genome — and giving scientists the means to rewrite it 
 By accelerating the identification of DNA sequences that control gene expression, assays are revealing the hidden grammar of the regulatory genome — and giving scientists the means to rewrite it  By accelerating the identification of DNA sequences that control gene expression, assays are revealing the hidden grammar of the regulatory genome — and giving scientists the means to rewrite it"
10.1038/d41586-026-01450-7,False,Nature,该论文标题和摘要内容与大气环境遥感技术无关，主要讨论的是Hantavirus（汉坦病毒）在邮轮上的传播情况，属于公共卫生和流行病学领域，不涉及空气质量监测、卫星观测、大气成分分析或气溶胶反演等技术。,[],Mohana Basu;Rachel Fieldhouse,Hantavirus crops up on a cruise ship — what scientists are watching,"The group of rodent viruses can cause disease in humans, but cases are rare. 
 The group of rodent viruses can cause disease in humans, but cases are rare.  The group of rodent viruses can cause disease in humans, but cases are rare."
10.1038/d41586-026-01394-y,False,Nature,该论文与大气环境遥感技术无关，主要讨论的是伊朗基础设施的轰炸和学术自由受到的威胁。,[],Michele Catanzaro,"'Heartbreaking': Iranian scientists on losing labs, libraries and liberty","Bombing of Iran's civilian infrastructure has damaged universities, destroyed thousands of books and manuscripts, amid a government-imposed Internet blackout, some of the country's researchers have told Nature. 
 Bombing of Iran's civilian infrastructure has damaged universities, destroyed thousands of books and manuscripts, amid a government-imposed Internet blackout, some of the country's researchers have told Nature.  Bombing of Iran's civilian infrastructure has damaged universities, destroyed thousands of books and manuscripts, amid a government-imposed Internet blackout, some of the country's researchers have told Nature."
10.1038/d41586-026-01452-5,False,Nature,该文章标题和摘要主要关注科学新闻的每日简报，包括一些正面的科学发展和一些关于 exotic particles 的讨论，但并未提及与大气环境遥感技术相关的具体内容，如空气质量监测、卫星观测、大气成分分析或气溶胶反演等。因此，该文章与大气环境遥感技术不相关。,[],Flora Graham,Daily briefing: Five inspiring science stories to lift your mood,"The positive scientific developments that you might have missed. Plus, these exotic particles could finally break the Standard Model. 
 The positive scientific developments that you might have missed. Plus, these exotic particles could finally break the Standard Model.  The positive scientific developments that you might have missed. Plus, these exotic particles could finally break the Standard Model."
10.1038/d41586-026-01436-5,False,Nature,该论文标题和摘要与大气环境遥感技术无关。标题提到的是 Craig Venter 逝世，他是人类基因组测序的领导者，而摘要内容是关于马拉松世界纪录的突破，这些内容均不涉及空气质量监测、卫星观测、大气成分分析或气溶胶检索等大气环境遥感技术领域。,[],Flora Graham,"Daily briefing: ‘A true pioneer and maverick’, Craig Venter dead at 79","Craig Venter — who led a race to decode the human genome – has died, aged 79. Plus, how so many runners just broke the marathon world record. 
 Craig Venter — who led a race to decode the human genome – has died, aged 79. Plus, how so many runners just broke the marathon world record.  Craig Venter — who led a race to decode the human genome – has died, aged 79. Plus, how so many runners just broke the marathon world record."
10.1038/s41467-026-72646-8,True,Nature Communications,该论文使用深度学习技术分析彗星活动，以推断彗星的大小，这与大气环境遥感技术中的成分分析和观测方法相关。研究涉及彗星云（如奥尔特云）的观测和建模，属于大气环境遥感技术的研究范畴。,"['comet', 'Oort Cloud', 'remote sensing', 'artificial intelligence', 'atmospheric composition']",Shunjing Zhao;Xian Shi;Hanlun Lei;Man-To Hui;Jianchun Shi,Deep learning-enabled size estimation of comets indicates a more dynamic early solar system,"Formation of the Solar System’s comet reservoirs remain uncertain. Here, the authors show that AI-based analysis of comet activity reveals a far more populated Oort Cloud than previously thought. 
 The formation and evolution of the Solar System’s two major comet reservoirs, the Oort Cloud and the Scattered Disk, remain poorly constrained. Observations of comet flux imply a population ratio between these reservoirs that exceeds predictions from models of giant planet instability by more than two orders of magnitude. A major source of uncertainty lies in determining comet sizes, as the nucleus is often obscured by the surrounding coma. Here we derive independent nucleus sizes for 28 comets by activity modeling with artificial intelligence to infer sizes directly from variations in water emission. We find that long-period comets possess significantly larger nuclei than short-period comets with comparable absolute brightness. Our results indicate that the Oort Cloud is nearly three orders of magnitude more populated than the Scattered Disk, implying that processes such as stellar flybys could have played an important role in shaping the outer Solar System. Formation of the Solar System’s comet reservoirs remain uncertain. Here, the authors show that AI-based analysis of comet activity reveals a far more populated Oort Cloud than previously thought."
10.1038/s41467-026-72849-z,False,Nature Communications,该论文主要研究的是钠离子电池的电解质问题，虽然涉及电极表面的稳定性和电池性能，但并未直接涉及大气环境遥感技术，如空气质量监测、卫星观测、大气成分分析或气溶胶检索等。因此，它与大气环境遥感技术没有直接相关性。,"['sodium batteries', 'solvent-locked electrolyte', 'battery electrolytes']",Jiyu Zhang;Guochuan Tang;Siyu Ma;Longfei Wen;Yongli Cheng;Jun Luo;Xiaoniu Guo;Chen Huang;Enhui Wang;Weihua Chen,Dual-domain solvent-locked electrolyte enabled durable 4.5 V-class sodium batteries,"Traditional electrolytes are electrochemically unstable on the positive electrode surface. Here, the author designed a solvent locked electrolyte to form a stable boride/fluoride interface. The assembled Na||Na2.26Fe1.87(SO4)3 battery maintained 88.2% capacity after 16500 cycles at 1 A g-1. 
 Sodium-ion batteries hold significant promise for sustainable energy storage by addressing resource scarcity and safety concerns. Elevating the upper-cut-off voltage is crucial for sodium-ion batteries to maximize electrode capacity and narrow their energy-density gap with commercial lithium-ion batteries. However, conventional electrolytes exhibit electrochemical instability on the highly desodiated positive electrode surface, undergoing strongly electrophilic attack and continuous decomposition that results in oligomer-rich interphases and rapid capacity fading. Here, we design a solvent-locked carbonate electrolyte creating electrochemically stable solvent-reinforced solvation structure and anion-rich interfacial shield-derived boride-/fluoride-rich interphase on positive electrode, thereby suppressing current leakage and parasitic reactions. The tailored electrolyte exhibits good compatibility with commercialized oxides and polyanionic positive electrodes. As-assembled Na||Na2.26Fe1.87(SO4)3 cells deliver extended lifespans operating to 4.5 V, retaining 88.2% capacity after 16,500 cycles at 1000 mA g–1 (coin cell) and 93.9% after 500 cycles at 100 mA g–1 (pouch cell). This work will inspire durable electrolyte and interphase design for high-energy batteries and beyond. Traditional electrolytes are electrochemically unstable on the positive electrode surface. Here, the author designed a solvent locked electrolyte to form a stable boride/fluoride interface. The assembled Na||Na2.26Fe1.87(SO4)3 battery maintained 88.2% capacity after 16500 cycles at 1 A g-1."
10.1038/s41467-026-72722-z,False,Nature Communications,该论文研究的是一种无电子模块结构的远程拆卸技术，虽然涉及振动和模块化结构，但与大气环境遥感技术（如空气质量监测、卫星观测、大气成分分析、气溶胶反演）没有直接关系。,"['modular structure', 'vibration', 'disassembly']",Xinyi Yang;Martin Nisser;Victor Riera Naranjo;Weijian Qian;Christos E. Athanasiou;Bolei Deng,Remote disassembly of electronics-free modular structures,"The authors present a low-cost modular structure built from self-locking cuboctahedral units, which can be selectively disassembled by a single vibration source. It enables electronics-free staged deployment, underwater release, load-bearing collapse, and 3D reconfiguration. 
 This paper presents a scalable modular structure composed of cuboctahedral units that can be selectively disassembled using a single, remote vibration source. Each module features self-locking intra-connectors for load-bearing assembly, together with inter-connectors designed for geometrically programmable, vibration-triggered disassembly. Rather than requiring embedded electronics, our system leverages the propagation of mechanical waves to enable targeted detachment anywhere in the structure from a single vibration source. Mechanical testing reveals that external vibration reduces the effective friction coefficient at inter-connectors, providing the physical basis for their remote disassembly. Leveraging this insight, we construct a surrogate model that systematically maps connector geometry to their disassembly properties, thereby enabling inverse design of inter-connectors with tailored triggering power and release energy. We further demonstrate this remote disassembly protocol across diverse applications-including staged deployment, underwater disassembly, load-bearing collapse, and three-dimensional deployment in large structures—highlighting its robustness, simplicity, and suitability for responsive, electronics-free modular systems. The authors present a low-cost modular structure built from self-locking cuboctahedral units, which can be selectively disassembled by a single vibration source. It enables electronics-free staged deployment, underwater release, load-bearing collapse, and 3D reconfiguration."
