doi,is_relevant,journal,explanation,topic_words,authors,title,abstract
10.1021/acsestair.5c00513,True,ACS ES&T Air,该论文研究的是中国典型商业烹饪中全挥发性有机化合物的排放特征，这些有机化合物是细颗粒物和臭氧的关键前体物。研究使用了二维气相色谱-飞行时间质谱联用技术来分析烹饪排放的有机化合物，这与大气环境遥感技术中的空气质量监测和大气成分分析密切相关。因此，该论文与大气环境遥感技术 strongly related。,"['organic compounds', 'particulate matter', 'emission inventory']",Guanghan Huang;Chengrui Liang;Zhijian Li;Yicong He;Shuai Hou;Jianguo Deng;Jingkun Jiang;Qing Li;Bin Zhao;Qingru Wu;Shuxiao Wang,Emission Characteristics of Full-Volatility Range Organic Compounds from Typical Commercial Cooking in China,"Organic compounds are key precursors of fine particulate matter and ozone, and cooking has become an increasingly important urban source, as emissions from other sectors decline. In this study, comprehensive two-dimensional gas chromatography coupled with time-of-flight mass spectrometry was applied to characterize the full-volatility range organic compounds from four popular commercial cooking styles in China, including high-temperature stir-frying (spicy and aromatic), simmering, and dry-heat roasting. Total organic concentrations ranged from 1.62 to 17.02 mg/m3, with 1893 individual organic compounds identified. When resolved by volatility across both gaseous and particulate fractions, intermediate- and semi-volatile organic compounds together accounted for 44.0% ± 19.7% of total organic mass, highlighting the importance of less-volatile species under real cooking conditions. The emitted organics were predominantly in the gas phase (71.9% ± 14.5%). Cooking intensity and temperature jointly enhanced gaseous organic emissions with chemical profiles dominated by lipid-oxidation products and spice-derived compounds. Unsaturated aldehydes were prominent, accompanied by furans and phenols, reflecting the complex precursor mixture in commercial kitchens. Particulate organic matter exhibited a highly diverse composition overwhelmingly dominated by oxygenated species (82.5%–94.9%). Fatty acids prevailed in oil-rich cuisines, whereas esters were enhanced in low-oil dry-heat roasting. Alcohols and esters from spices (e.g., linalool, linalyl acetate) represented additional contributors to particulate organic matter variability. These findings provide critical insights into the chemical complexity and cuisine-dependent variability of commercial cooking emissions and offer improved constraints for volatility-based emission inventories and secondary organic aerosol modeling."
10.1021/envhealth.5c00843,True,Environment & Health,该研究关注大气污染物（如多环芳烃和重金属）通过皮肤吸附的机制，这与大气环境遥感技术中的空气质量监测和污染物分析相关，因为皮肤吸附可以反映大气中污染物的分布和传输特征。,"['Polycyclic Aromatic Hydrocarbon Derivatives', 'Heavy Metals', 'skin types']",Siying Liu;Xinxin Li;Wanting Liang;Yinzuo Liu;Ting Wang;Hongjun Mao;Lei Wang,Effect of Skin Types and Microenvironment of Dermal Exposure to Polycyclic Aromatic Hydrocarbon Derivatives and Heavy Metals,"Dermal exposure is one of the main ways for the human body to adsorb atmospheric pollutants, and different skin types significantly affect the adsorption of pollutants. This study established a simulation device using polyethylene balloons coated with different doses of glycerol trioleate to simulate oily skin, neutral skin, and dry skin types and investigated the adsorption of polycyclic aromatic hydrocarbons (PAHs) and their derivatives (NPAHs and OPAHs) and metal elements on different skin types. The results show that (1) the adsorption of NPAHs and OPAHs with different ring numbers conforms to the first-order kinetic model. The adsorption concentration of NPAHs and OPAHs by balloon-simulated skin is the highest on the oily surface, followed by the neutral surface, and the lowest on the dry surface. (2) In the four scenarios analyzed in this study, the adsorption of NPAHs and OPAHs by the skin showed that the adsorption amount was the highest in dusty weather and the lowest in the indoor area of the campus. In the indoor and outdoor environments of the campus, the adsorption amount of NPAHs was greater than that of OPAHs. (3) Among the 11 heavy metals detected, Cu was detected only in sand–blowing weather, while As, Zn, V, and Ti were detected in four cases, and their adsorption capacity was accorded with the order of V > Zn > As > Ti. Therefore, the health risks associated with skin contact with pollutants on oily skin and during sandy weather should be given more attention, and appropriate protective measures should be implemented."
10.1021/envhealth.5c00825,True,Environment & Health,该论文研究了双酚M（BPM）对成年小鼠的肺部毒性以及潜在的跨代肺部影响，这与大气环境遥感技术中的空气质量监测和大气成分分析密切相关，因为肺部功能紊乱和炎症可能与空气污染物有关。,"['Bisphenol M', 'pulmonary dysfunction', 'air quality monitoring']",Jie Zhao;Zehong Wu;Kelei Pan;Chenming Yi;Liuyan Fu;Wenjuan Zhang;Jie Zhang;Yong Liang,BPM Exposure Induces Pulmonary Dysfunction in Adult Mice and Adverse Intergenerational Pulmonary Effects in Offspring,"Bisphenol M (BPM), a structural analogue of bisphenol A, has become increasingly prevalent in the environment, raising concerns about its potential health impacts. However, the pulmonary toxicity of BPM, particularly with regard to direct exposure in adults and potential intergenerational respiratory effects, is not well understood. This study systematically investigates the mechanisms of BPM-induced pulmonary dysfunction in adult mice using integrated transcriptomic and proteomic analyses while also evaluating intergenerational respiratory effects in the offspring of a pregnant mouse. In adult mice, BPM exposure impaired pulmonary function and induced histopathological alterations including inflammatory infiltration and early-stage fibrotic changes. At the molecular level, BPM disrupted pulmonary immune-inflammatory homeostasis by synergistically activating the NF-κB and MAPK pathways, while suppressing T-cell receptor─and Fc receptor─mediated immunoregulatory signals. Notably, maternal BPM exposure resulted in pulmonary impairment in female offspring, as evidenced by altered lung function parameters and the corresponding histopathological abnormalities. In summary, these findings demonstrate that BPM induces pulmonary dysfunction in adult mice by disrupting immune-inflammatory homeostasis while also conferring sex-specific intergenerational respiratory health risks."
10.1029/2025GL120961,True,Geophysical Research Letters,该论文探讨了AI气象预报模型GraphCast在全球夏季降水日变化再现能力，并将其与卫星观测（IMERG）、再分析（ERA5）和统一模型（UM）进行对比，涉及大气成分分析和降水监测，与大气环境遥感技术密切相关。,"['GraphCast', 'IMERG', 'ERA5', 'Unified Model', 'precipitation']",Emanuele Silvio Gentile;Kieran M. R. Hunt;Lorenzo Tomassini;Ben Harvey;Oscar Martinez‐Alvarado,Global Diurnal Precipitation Cycle in the AI Model GraphCast and a 5‐km Unified Model: Challenges and Opportunities,"This study evaluates the ability of the AI weather forecast model GraphCast to reproduce the global diurnal cycle of boreal summer precipitation, comparing it with Integrated Multi‐satellite Retrievals for GPM (IMERG) satellite observations, the ERA5 reanalysis, and an experimental global 5‐km Met Office Unified Model (UM) which is convection permitting but still retains an active scale‐aware parametrization. ERA5 captures large‐scale rainfall patterns but exhibits a premature afternoon peak and excessively weak nocturnal precipitation over land compared to IMERG. GraphCast, while reproducing realistic mean spatial rainfall distributions, inherits, and amplifies these timing and amplitude biases, concentrating precipitation near‐midday and producing very little nocturnal signal. The 5‐km UM improves nocturnal precipitation across many regions but overestimates rainfall over oceans and initiates convection too early over land, likely due to the still active convective parametrization. Our analysis shows that these contrasting behaviors highlight both challenges and opportunities for improving precipitation prediction through hybrid AI‐physics approaches."
10.1029/2025GL118106,False,Geophysical Research Letters,该论文主要研究火山喷发前后地下电阻结构的变化，涉及地球物理探测技术，但与大气环境遥感技术（如空气质量监测、卫星观测、大气成分分析、气溶胶反演等）无明显关联。,"['magnetotelluric', 'volcanic fluids', 'groundwater']",K. Aizawa;N. Matsushima;Y. Matsunaga,"Temporal Change in Resistivity Structure Before and After the 2018 Small Phreatic Eruption Iwo‐Yama Volcano, Kirishima Volcanic Complex, Japan","A small phreatic eruption occurred on April 2018 Iwo‐yama, Kirishima volcanic complex, Japan. We estimated the change in the subsurface resistivity structure before and after the phreatic eruption by repeated magnetotelluric (MT) measurements. A substantial decrease in resistivity was determined in the zone from the surface down to a depth of approximately 200 m whose area corresponded to the extent of surface geothermal activation after the eruption, and is interpreted as the result of mixing of high temperature volcanic fluids into cold shallow groundwater. The low‐resistivity layer, which is interpreted as clay‐rich cap, expanded in a ENE–WSW direction and changed into a more “bell‐shaped” structure that can store high‐temperature fluids more effectively. The uppermost part of the bell‐shaped low‐resistivity zone partly showed an increase in resistivity, which may indicate capping has weakened due to increased temperature or acidification. These results suggest an increased potential for a larger‐scale phreatic eruption."
10.1029/2026GL121737,False,Geophysical Research Letters,该研究使用Sentinel-1 InSAR和地震波形建模技术来分析阿富汗Asadabad地震的破裂过程和地表变形，虽然涉及遥感技术（InSAR），但主题是地震学而非大气环境遥感技术。,"['Sentinel-1', 'InSAR', 'teleseismic waveform modeling']",Ping He;Timothy J. Craig;Yangmao Wen;Huihui Weng;Kefeng He;Caijun Xu,Multi‐Stage Shallow Rupture and Pre‐Event Shallow Deformation During the 2025 Mw 5.9 Asadabad Earthquake (Afghanistan),"The 31 August 2025 Mw 5.9 Asadabad earthquake in eastern Afghanistan caused severe damage despite its moderate magnitude, raising questions about rupture processes and seismic hazard in the southern Hindu Kush. Using Sentinel‐1 InSAR and teleseismic waveform modeling, we reveal a complex, multi‐stage shallow (4–5 km) rupture involving the mainshock and three M > 5.0 aftershocks. Surface deformation ranges from ∼10 to 35 cm, and fault planes exhibit moderate to steep dip angles, with secondary rupture approaching the surface. Time‐series InSAR shows ∼2 mm/yr localized interseismic uplift near the epicenter, consistent with localized shallow deformation prior to the earthquake. Occurring within exposed crystalline basement rocks without mapped Quaternary faults, the earthquake ruptured a previously unknown immature, distributed fault system. These findings help explain the high damage relative to magnitude and highlight significant seismic hazard in orogenic interiors from moderate‐magnitude, shallow ruptures on unmapped faults."
10.1029/2025GL121483,True,Geophysical Research Letters,该论文研究了土壤湿度对机器学习预测光合作用和蒸散量的影响，涉及生态系统的关键过程和环境监测技术，与大气环境遥感技术（如空气质量和生态过程监测）密切相关。,"['soil moisture', 'machine learning', 'evapotranspiration', 'photosynthesis']",Daniel Power;Miguel Angel Rico‐Ramirez;Pierre Gentine;David McJannet;Martin Schrön;Corinna Rebmann;Humberto da Rocha;Rafael Rosolem,Understanding the Influence of Soil Moisture on Machine Learning Predictions of Photosynthesis and Evapotranspiration,"Evapotranspiration (ET) and photosynthesis are key processes in ecosystem functioning on which soil moisture (SM) has an important influence. Eddy covariance measurements and machine learning (ML) increasingly enable flux prediction in ungauged regions. With numerous SM estimation methods available, each representing different spatiotemporal scales, understanding how data choice influences ML predictions is important. Our study examines how different SM data affect ML predictions of ET and photosynthesis. At semi‐arid to arid sites, we found that in situ near‐surface SM enhances ML predictions of ET. For photosynthesis, SM memory, indicative of deeper SM control, shows the highest predictive power, improving predictions by up to 30% at the driest sites. These contrasting responses reveal that ET and Gross Primary Productivity (GPP) are likely governed by distinct SM mechanisms: spatial scale matching for ET and temporal depth for GPP. Our study demonstrates that process‐guided feature engineering can improve ML predictions where root‐zone SM observations are often unavailable."
10.1029/2026GL121743,False,Geophysical Research Letters,该论文主要研究地震学中的海洋转换断层地震活动，与大气环境遥感技术（如空气质量监测、卫星观测、大气成分分析、气溶胶反演）没有直接关系。,"['earthquake', 'transform fault', 'foreshock']",Hui Liu;Min Liu;Yen Joe Tan,Large Earthquakes Along the Mendocino Oceanic Transform Fault Hardly Have Any Foreshocks,"Compared to continental strike‐slip faults, oceanic transform faults (OTFs) are thought to mainly slip aseismically and host significantly more foreshocks triggered by precursory aseismic slip which enhance the mainshocks' short‐term predictability. However, long‐term high‐resolution observational constraints remain limited. In December 2024, one of the largest ever OTF earthquakes occurred offshore California on the Mendocino OTF. Here we show that foreshock activity is very limited within the rupture zone of this moment magnitude (Mw) 7.0 earthquake and does not indicate accelerating aseismic slip in the preceding month. The 2016 Mw 6.6 and 1994 Mw 7.0 Mendocino OTF earthquakes share similar characteristics. The 15 historical Mw ≥ 5.5 mainshocks also have significantly fewer foreshocks on average compared to continental strike‐slip earthquakes. Therefore, there is no clear evidence of aseismic‐nucleation‐related seismicity preceding large Mendocino OTF earthquakes. Our results further demonstrate that enhanced foreshock activity is not a general characteristic of OTFs despite prevalent aseismic slip."
10.1029/2026GL122817,False,Geophysical Research Letters,该论文研究的是希腊西部赫利克俯冲带中的应力场和巨大俯冲带强度，与大气环境遥感技术（如空气质量监测、卫星观测、大气成分分析、气溶胶反演）无关。,[],G. M. Bocchini;D. Essing;I. Nikolopoulou;A. Dielforder;M. P. Roth;A. Serpetsidaki;E. Sokos;C. P. Evangelidis;R. M. Harrington,"Stress Field and Megathrust Strength in the Western Hellenic Subduction System: Insights From the 2024 Mw 5.9 Strofades Earthquake Sequence, Greece","A M5.9 earthquake occurred on 29 March 2024, offshore near the Strofades Islands, in the western Hellenic Subduction System. Here we present high‐precision earthquake locations and focal mechanisms that suggest the rupture of a NNE‐SSW striking, left‐lateral strike‐slip fault. Both the aftershock depth distribution, and roughly orthogonal focal mechanism P‐axes relative to the upper‐plate shortening direction suggest that the sequence occurred within the slab. The stress pattern inferred from the M5.9 sequence is consistent with arc‐parallel shortening in the lower plate, similar to other intraslab, intermediate‐depth earthquakes in the Aegean. The lack of triggered upper‐plate seismicity, together with the contrasting stress orientations between overriding and subducting plates, suggests a decoupled upper‐lower plate stress field that can be explained by a weak megathrust interface."
10.1029/2026GL122363,False,Geophysical Research Letters,该论文主要研究多相流体动力学对单个孔隙中矿物溶解速率的影响，涉及地下的多相流和矿物反应，与大气环境遥感技术（如空气质量监测、卫星观测、大气成分分析、气溶胶反演）关系不大。,"['mineral dissolution', 'two-phase hydrodynamics', 'pore-scale reactive transport']",Xin Wang;Hang Deng,Dependence of Mineral Dissolution Rates on Two‐Phase Hydrodynamics in Single Pores,"Multiphase flow and mineral reactions co‐exist in many subsurface systems, and thus elucidating and quantifying the impacts of multiphase flow on mineral reaction rates are crucial. Our study established a benchmark experiment on calcite dissolution in cylindrical pores in slug flow, and performed a series of simulations using a validated pore‐scale multiphase reactive transport model. The results revealed contrasting impacts of the two‐phase flow on transport in the aqueous phase and the effective surface area, and that the relative contribution of these factors determines whether the bulk reaction rate in two‐phase flow is lower (regime I) or higher (regime II) than that in single‐phase flow. Scaling laws were attempted to relate reaction rate with velocity to account for the enhanced transport by internal circulations, and variability in the effective surface area was also discussed. This study provides useful insights for upscaling mineral reaction rate in two‐phase flow in porous media."
10.1029/2025GL121555,True,Geophysical Research Letters,该论文研究地表风驱动的沙运输现象，涉及边界层流动湍流和沙流带动力学，虽然主要关注沙运动，但其研究方法（图像处理算法和三维风测量）与大气环境遥感技术中的空气质量和地表观测技术有相似之处，因此与大气环境遥感技术有一定关联。,"['boundary layer flow', 'sand streamer dynamics', 'image-processing algorithm', '3D wind measurement', 'turbulent flow']",Mengdi Yan;Yuanwei Lin;Yang Zhang;Andreas C. W. Baas,Multiscale Coupling of Boundary Layer Flow Turbulence and Sand Streamer Dynamics,"Wind‐driven sand transport at the Earth's surface exhibits pronounced spatiotemporal variability, forming elongated sand streamers that critically control sand flux. Despite their importance, the detailed fundamental mechanisms governing streamer formation remain elusive. This study presents results from a novel image‐processing algorithm analyzing high‐resolution video imagery combined with 3D wind measurement in turbulent boundary layer flow over a sandy beach. Streamers are shown to align with high‐momentum pathways modulated by large‐scale turbulence structures, and sand flux inside streamers scales with flow forcing. Streamer width remains invariant and decoupled from flow forcing, whereas streamer spacing increases with wind speed. These results support a top‐down modulation mechanism where the invariant streamer width is likely governed by the height of the turbulent footprint, whereas the increased spacing may relate to spanwise dilation of vortex scales or a near‐surface momentum feedback mediated by the saltating sand."
10.1029/2025GL121443,True,Geophysical Research Letters,该论文研究了人类活动对云滴数浓度的影响，涉及大气成分分析和气溶胶对云的影响，与大气环境遥感技术中的空气质量监测和大气成分分析密切相关。,"['cloud droplet number concentration', 'anthropogenic biofuel emissions', 'effective radiative forcing']",Hunter Y. Brown;Daniel T. McCoy;Jacqueline M. Nugent;Hailong Wang;Mingxuan Wu;Kai Zhang;Susannah M. Burrows,Sensitivity of Anthropogenic Cloud Droplet Number Change to Preindustrial Emission Inventories and Physics Parameterizations,"Understanding the preindustrial (PI) to present‐day (PD) change in cloud droplet number concentration (ΔNd) is important to constrain the anthropogenic influence on clouds and aid future model projections. Perturbed parameter ensemble simulations of PI and PD conditions in the Energy Exascale Earth System Model (E3SMv3) reveal two locations with consistent negative ΔNd signal across parameter space–the Southeastern US and the United Kingdom–despite a trend of positive ΔNd globally from increased fossil fuel consumption. These negative ΔNd signals are driven by higher anthropogenic biofuel emissions in the PI. By varying the PI aerosol mass and/or number emissions across these data sets' uncertainty ranges, we can change the magnitude and sign of ΔNd and the effective radiative forcing from aerosol‐cloud interactions (ERFaci) regionally and globally, with near‐zero ΔNd leading to near‐zero ERFaci. These results highlight the need to constrain PI emission uncertainty to better understand Earth system responses to aerosol‐cloud interactions."
10.1029/2025GL120482,False,Geophysical Research Letters,该论文研究的是地壳对大陆岩石圈破坏的响应，涉及地震学方法如接收函数、Love波和Rayleigh波分散等，与大气环境遥感技术（如空气质量监测、卫星观测、大气成分分析、气溶胶反演）无关。,"['receiver functions', 'Love waves', 'Rayleigh waves', 'radial anisotropy', 'shear-wave model']",Yuqi Zhu;Zhouchuan Huang;Frederik Tilmann;Kuan‐Yu Ke;Xinglu Wang;Cong Ji,"Crustal Responses to the Destruction of Continental Lithosphere: Insights From Radial Anisotropy of the Tanlu Fault Zone, Eastern China","Since the Mesozoic, much of the eastern China lithosphere was removed through thermo‐mechanical erosion and delamination, yet the effects on the overlying crust remain unclear. The Tanlu Fault Zone (TLFZ), the region's largest lithosphere‐scale weakness, offers a natural laboratory to assess crustal responses to lithospheric destruction. We jointly invert receiver functions with Love‐ and Rayleigh‐wave dispersion using a transdimensional Bayesian approach to image a radially anisotropic shear‐wave model. The model reveals pronounced negative radial anisotropy and low velocities at the top of the upper mantle, consistent with mantle upwelling, whereas the lower crust shows strong positive radial anisotropy and high velocities, indicating lateral emplacement of mantle‐derived melts. These modifications correlate with present‐day seismicity, implying that mafic intrusions act as stress‐concentrating asperities that promote earthquake nucleation. Our results demonstrate that lithospheric destruction has substantially reshaped crustal architecture in eastern China and highlight the pivotal role of the TLFZ in this process."
10.1029/2025GL118879,False,Geophysical Research Letters,该研究主要关注海洋中pCO2对热带气旋生成频率的响应特征及其物理机制，涉及海洋碳循环和海表温度、盐度等参数，但并未直接涉及大气环境遥感技术，如空气质量监测、卫星观测或大气成分分析等。,"['oceanic pCO2', 'tropical cyclones', 'Sea Surface Temperature']",Qiong Wu;Keyu Hu;Zhenxin Ruan;Zhijin Li;Xiaochun Wang,Physical Mechanisms Governing the Response of Oceanic pCO2 in the Northern South China Sea to Tropical Cyclones,"This study investigates the response characteristics of oceanic pCO2 in different regions of the Northern South China Sea (NSCS) to tropical cyclone genesis frequency (TCF) on interannual timescale, and clarifies the response mechanisms. Results show that reduced Sea Surface Temperature (SST) induced by TCs suppresses pCO2 in the northwestern SCS by increasing CO2 solubility. Stepwise regression analysis reveals that SST is the dominant impact factor, contributing 35.83% to pCO2. In the northeastern SCS, in addition to TC‐induced SST reduction, TC‐induced freshwater fluxes further reduce pCO2 by not only diluting surface CO2 concentration, but also suppressing vertical mixing and inhibiting the upwelling of dissolved inorganic carbon (DIC). SST, Sea Surface Salinity (SSS), and DIC are the dominant impact factors, contributing 24.41%, 30.94%, and 16.14% to pCO2. This study offers insights into TCF's effect on the ocean carbon cycle in the NSCS on interannual timescale."
