doi,is_relevant,journal,explanation,topic_words,authors,title,abstract
10.1016/j.jag.2026.105220,False,International Journal of Applied Earth Observation and Geoinformation,API Request Failed,[],Shijuan Chen;Curtis E. Woodcock;Hanfeng Gu;Luofan Dong;Xiaojing Tang;Pontus Olofsson,Drivers of forest disturbance in Southeast Asia,"•We mapped and analyzed forest disturbance drivers in the entire Southeast Asia. •We applied a Landsat time series method, CCDC-SMA, combined with auxiliary data. •We estimated the area of different drivers over time. •The margins of error of our area estimates for all classes are all less than 26%. •New plantation and shifting cultivation have the largest areas among the drivers. 
 Although Southeast Asia is a hotspot of forest disturbance, there is a lack of fine-resolution and long-term analysis of drivers of forest disturbance in Southeast Asia. Here, we present a study of mapping and analyzing drivers of forest disturbance in Southeast Asia at 30-meter resolution from 2000 to 2021. We used a combination of Continuous Change Detection and Classification − Spectral Mixture Analysis (CCDC-SMA), object-based image analysis, and land cover classification to attribute the drivers of forest disturbances. The overall accuracy of the map of drivers of forest disturbance reached 76.3% (77% before area-adjusted estimates). The margins of error of our area estimates for all classes are all less than 26%. We found that shifting cultivation affected 231,927 ± 45,009 km2, which accounted for 4.7% ± 0.9% of Southeast Asia. The area of the new plantation is 186,457 ± 40,487 km2 (3.8% ± 0.8% of Southeast Asia). Deforestation accounted for 3.0% ± 0.8% of Southeast Asia, equivalent to 148,511 ± 37,547 km2. Shifting cultivation has the lowest uncertainty among the change classes. Shifting cultivation mainly occurs in Myanmar, Laos, and Indonesia. New plantations mainly occur in Indonesia, Malaysia, and Myanmar. Deforestation mainly occurs in Indonesia, Cambodia, and Laos. New plantations increased significantly in 2006–2010 compared to 2001–2005, and then decreased after 2010. The area of deforestation decreased slightly from 2001 to 2010 and increased slightly from 2010 to 2020. Shifting cultivation has a moderately increasing trend over time. Our study provides important information on drivers of forest disturbance in Southeast Asia, which helps to improve decision-making for forest conservation and land management."
10.1016/j.jag.2026.105224,False,International Journal of Applied Earth Observation and Geoinformation,API Request Failed,[],Junli Zhao;Wei Zhao;Yanqing Yang;Jiujiang Wu;Yuxin Li,"An integrated reconstruction–downscaling framework for generating daily, all-weather 30 m land surface temperature in cloudy mountainous regions","•An integrated reconstruction–downscaling framework was developed for LST data. •The decomposition of the ATC model offers a key solution for this unified solution. •An adaptive window was adopted to ensure robust training under cloudy conditions. •Terrain and soil-moisture features enhance the explanatory capability. •It advances continuous high-resolution thermal monitoring in mountainous areas. 
 As a key driver of land–atmosphere interactions, land surface temperature (LST) has been widely applied across various geoscientific disciplines. In mountainous regions, complex terrain and frequent cloud cover create a strong demand for LST products with higher spatiotemporal resolution. Previous studies have developed methods for cloud-covered LST reconstruction or for downscaling to alleviate the challenges of cloud obstruction and coarse resolution in thermal infrared observations. However, most of these approaches focus on a single task and seldom account for the unique characteristics of mountainous areas, which limits the applicability in cloudy mountainous regions. This study, therefore, proposes an integrated reconstruction–downscaling framework designed to simultaneously address the limitations of cloud obstruction and coarse resolution in cloudy mountainous regions. The framework was developed based on the annual temperature cycle (ATC) model, which partitions daily LST into a background temperature component estimated from the ATC coefficients and a residual term representing short-term thermal variability. ATC coefficients and daily, all-weather residual term at 30 m scale were separately estimated using Extreme Gradient Boosting (XGBoost) regression. These components were then combined to generate the final LST product. Applied to the Wanglang National Nature Reserve for generating LST data in 2022, the proposed framework demonstrated improved agreement with ground LST measurements relative to a two-step sequential approach of first reconstructing and then downscaling, achieving a reduction in RMSE of 0.16 – 0.73 K. This study holds the potential to provide valuable insights for improving fine-scale, all-weather LST retrieval in cloudy mountainous regions."
None,False,International Journal of Applied Earth Observation and Geoinformation,API Request Failed,[],Huizhi Duan;Jianpo Liu;Teng Wang;Pengyuan Ma,How coal mining sites respond to extreme rainfall: Deep-learning-enhanced InSAR observations across the 2021 Henan 7.20 extreme rainfall,
None,False,International Journal of Applied Earth Observation and Geoinformation,API Request Failed,[],,Editorial Board,
None,False,Atmospheric Environment,API Request Failed,[],S.N. Lukashenko;A.V. Mikhailov;D.N. Kurbakov;A.V. Thomson;D.A. Kondakov;E.V. Fedunova;M.A. Edomskaya,Investigation of tritium concentration levels and mechanisms of its release to the atmospheric air in an area with an underground source of tritium,
None,False,Atmospheric Environment,API Request Failed,[],,Editorial Board,
10.1016/j.atmosres.2026.108907,False,Atmospheric Research,API Request Failed,[],Yingxiao Sun;Qianrong Ma;Haoxuan Yu;Zhiqi Xu;Hao Wu;Qiong Wu;Zhiwei Zhu;Yueyue Yu,Quantifying the role of large-scale circulation in North China heatwaves under global warming,"•North China heatwaves were interrupted and reinforced by episodic precipitation. •High-amplitude quasi-stationary Rossby wave provide basic large-scale background. •Precipitation-induced heating forms positive feedback for heatwaves. •Global warming raised the anomaly by 0.53 °C, 1.6 times higher than the past. •Warming amplifies heatwaves via more effective circulation-thermodynamic mechanism. 
 In June–July 2023, North China (NC) experienced consecutive heatwaves. These events occurred as part of a repeated sequence in which heatwaves were interrupted and reinforced by episodic precipitation. High-amplitude quasi-stationary Rossby wave patterns created favorable large-scale conditions, supporting the development of a mid-tropospheric anticyclonic system west of the region. This pattern promoted cold-air advection and together with the local vertical structure, enabled precipitation before each heatwave. The associated diabatic heating then strengthened the serial heatwave in the sequence. However, this circulation pattern alone cannot fully explain the severity of the 2023 events. Global warming has made circulation–thermodynamic interactions substantially more effective. According to analog-based approach, the temperature anomaly during 2023 heatwaves under present climate conditions (1993–2023) was 0.53 °C and 1.6 times higher than past (1961–1992). This enhancement reflects stronger thermodynamic feedback in a warmer climate, which amplifies diabatic heating under similar circulation configurations. Our study underscores the pivotal role of global warming in amplifying the effects of large-scale circulation anomalies, which become more effective in triggering extreme heatwaves through enhanced thermodynamic interactions."
10.1016/j.atmosres.2026.108900,False,Atmospheric Research,API Request Failed,[],Shubham Dixit;Kamlesh K. Pandey,Evolving Indo-Pacific teleconnections and regional feedbacks in Indian rainfall extremes: A principal component-wavelet framework,"•Non-stationary models risk excess complexity when many correlated covariates are used. •Individual wavelet analysis fails to capture joint covariate influences. •PCA extracted the principal components which were tested against extreme rainfall using wavelets. •Regional drivers are strong and immediate; global drivers weaker and lagged. •Covariate selection for rainfall extremes should prioritize regional indicators. 
 Rainfall extremes in India are shaped by both remote teleconnection influences and regional thermodynamic processes. However, most previous studies have emphasized large-scale indices such as the El Niño–Southern Oscillation (ENSO) or the Indian Ocean Dipole (IOD), examining them individually through wavelet analysis. While useful for identifying time–frequency associations, such approaches overlook multicollinearity among covariates and cannot reveal their interacting effects. To address this, a unified diagnostic framework integrating Principal Component Analysis (PCA), wavelet coherence, and cross-correlation was applied to nine climate covariates for monthly rainfall extremes across peninsular India (1901–2021). PCA transformed the correlated covariates into nine orthogonal Principal Component (PC) time series. While PC1 and PC2 explained ∼45% of the variance in the nine-covariate set, their wavelet coherence with rainfall extremes was weak and inconsistent. By contrast, PCs dominated by regional indicators (Integrated Vapor Transport (IVT) and maximum and minimum temperature anomalies (MATA, MITA)) together accounting for ∼30% of variance, displayed the strongest and most persistent wavelet coherence, significant at >80% of stations. Cross-correlation revealed 2–3 month lags for ENSO, whereas IVT and regional temperature anomalies exerted contemporaneous influence. These findings indicate a shift toward stronger regional control in recent decades, with IVT and regional temperature anomalies providing stronger, more contemporaneous, and persistent controls than the lagged and weaker influence of remote teleconnections. The PCA-wavelet framework provides an evidence-based method to screen physically meaningful covariates for covariate-informed extreme value models, with implications for hydrological risk assessment under climate change."
10.1016/j.atmosres.2026.108906,False,Atmospheric Research,API Request Failed,[],Thi-Chinh Nguyen;Ching-Yuang Huang;Hung-Chi Kuo,How can severe rapid intensification of super-intense typhoons be revealed by the evolution of lower-stratospheric potential vorticity?,"•LSPV has a faster pronounced increase than TPV during the RI stage for Yutu. •LSPV is transported inward and downward into the upper eye to interact with TPV. •SE solutions quantify different vortex spinups by eddy forcing and diabatic heating. •LSPV growth in the inner vortex highly correlates with the vortex intensification. •TPV alone does not explore the severity of RI, without referring to the LSPV growth. 
 Rapid intensification (RI) of super-intense typhoons is investigated by ocean-coupled HWRF simulations. The simulation of Supertyphoon Yutu (2018) indicates a faster pronounced increase in lower-stratospheric potential vorticity (LSPV) than in tropospheric potential vorticity (TPV) within the inner typhoon. During the early RI stage, the intensifying LSPV in the ambient PV reservoir is transported inward to the eye and downward to the upper eye through mean and asymmetric eddy advection in the PV budget to provide feedbacks with the TPV at upper levels. The solution of the extended Sawyer-Eliassen (SE) equation, with a relief of balance dynamics, indicates that the RI becomes more severe, due to the enhanced spinup near the upper-level eye induced by diabatic heating and the eyewall in 12–18-km height by asymmetric eddy forcing, in association with a stronger spinup in the eyewall below 12-km height induced by diabatic heating. A significant spinup in the mid-lower eye region, however, can be produced by eddy forcing, in association with the primary eyewall spinup in response to the quickly increasing TPV as the LSPV also becomes stronger. Averaged LSPV and TPV amounts within the inner vortex exhibit high correlations with the actual vortex intensity. Stronger LSPV highly correlated with the vortex intensity also exists for other supertyphoons, Megi (2010), Haiyan (2013), and Goni (2020), all undergoing severe RI, but not for Mangkhut (2018) developing only marginal RI in short of the LSPV. TPV alone does not clearly explore the severity of RI, without referring to the growth rate of LSPV."
10.1016/j.atmosres.2026.108904,False,Atmospheric Research,API Request Failed,[],Pengcheng Lin;Chunsong Lu;Yiming Liu;Xin He;Junjun Li;Tongwen Wu;Yixiong Lu,Performance evaluation and mechanism analysis of different ice particle distribution shape parameter schemes in BCC-AGCM,"•Modifying ice spectral shape parameter (μ) reduces simulation biases in the BCC-AGCM. •Theμ= 3 andμ= 5 schemes perform comparably to the diagnostic scheme. •Increasingμnarrows ice spectra and enhances ice mass, promoting high cloud formation. 
 The representation of ice cloud microphysical processes remains a major source of uncertainty in general circulation models (GCMs). Many models assume a shape parameter (μ) of zero for the ice particle size distribution, which deviates from observations. Previous work implemented a diagnostic μ scheme in the Beijing Climate Center Atmospheric General Circulation Model (BCC-AGCM). This study investigates whether computationally cheaper fixed-μ schemes (μ = 3, 5, and 8) can achieve performance comparable to the diagnostic scheme. Results show that all modified schemes (μ > 0) reduce model biases compared with the default scheme (μ = 0), including the underestimation of cloud fraction and cloud radiative forcing, and the overestimation of total precipitation. Evaluations based on the Kling-Gupta Efficiency (KGE) and a mean rank (MR) score indicate that the μ = 3 and μ = 5 schemes are effective alternatives (MR = 0.486), performing most closely to the diagnostic scheme (MR = 0.600). Similar to the diagnostic scheme, increasing μ narrows the ice particle spectrum, weakens the autoconversion of ice to snow and ice sedimentation, and enhances depositional growth. These changes increase cloud ice mass concentration in the μ = 3 and μ = 5 schemes, correcting the underestimation of high cloud fraction. In contrast, the μ = 8 scheme causes overestimation due to excessive ice mass. Consequently, the μ = 3 scheme performs best in simulating total cloud fraction and longwave cloud radiative forcing, while the μ = 5 scheme provides improvements across all variables. The results confirm that optimizing the ice crystal spectral shape parameter effectively improves model performance."
None,False,Atmospheric Research,API Request Failed,[],,Editorial Board,
